Contenido,IR,Fecha,Dispositivo,Likes,Retweets,Entidad,Hora,Foto
"RT @campusvirtualsp: 💻 Nuevo curso virtual: si eres parte del equipo de profesionales a cargo de la atención de recién nacidos, te recomend…",https://twitter.com/i/web/status/1421127837684281350,30/07/2021 09:17:34,Twitter for iPhone,0,7,OPS/OMS,09:17:34,http://pbs.twimg.com/profile_images/1096094749902028801/ijbQWupW.png
RT @rpsp_pajph: “La importancia de la cooperación sanitaria entre las naciones” y “El diagnóstico diferencial y la extirpación de la viruel…,https://twitter.com/i/web/status/1421127903094485003,30/07/2021 09:17:50,Twitter for iPhone,0,3,OPS/OMS,09:17:50,http://pbs.twimg.com/profile_images/1096094749902028801/ijbQWupW.png
"RT @OPSOMS_Col: En Norte de Santander, el equipo de psicologas de la @opsoms 🇨🇴 realizó capacitación en Primero Auxilios Psicologicos a líd…",https://twitter.com/i/web/status/1421146352373968901,30/07/2021 10:31:08,Twitter for iPhone,0,4,OPS/OMS,10:31:08,http://pbs.twimg.com/profile_images/1096094749902028801/ijbQWupW.png
RT @OPSOMS_Col: La evidencia científica muestra que las medidas de salud que ya conocemos nos protegen de todas las variantes de la #COVID1…,https://twitter.com/i/web/status/1421146364407427072,30/07/2021 10:31:11,Twitter for iPhone,0,22,OPS/OMS,10:31:11,http://pbs.twimg.com/profile_images/1096094749902028801/ijbQWupW.png
"RT @opsomsnic: Nicaragua y Honduras firmaron Acuerdo Binacional en el marco del Derecho Comunitario Centroamericano, con el fin de realizar…",https://twitter.com/i/web/status/1421146442199142401,30/07/2021 10:31:30,Twitter for iPhone,0,4,OPS/OMS,10:31:30,http://pbs.twimg.com/profile_images/1096094749902028801/ijbQWupW.png
"RT @opsomsnic: Hemos apoyado la llegada hoy a #Nicaragua de 36,480 dosis de vacunas AstraZeneca de Oxford donadas por Noruega a través de #…",https://twitter.com/i/web/status/1421215432057532426,30/07/2021 15:05:38,Twitter for iPhone,0,7,OPS/OMS,15:05:38,http://pbs.twimg.com/profile_images/1096094749902028801/ijbQWupW.png
"""Dado que los países 🌎 han dedicado recursos, personal y atención a sus respuestas al COVID-19, muchos han tenido d… https://t.co/I9Rp6DA950",https://twitter.com/i/web/status/1421221879008751618,30/07/2021 15:31:15,Twitter Media Studio,11,7,OPS/OMS,15:31:15,http://pbs.twimg.com/profile_images/1096094749902028801/ijbQWupW.png
"Todos los virus 🦠, como el que causa la COVID-19, son propensos a generar mutaciones y cambiar genéticamente, crean… https://t.co/625GfwAMWr",https://twitter.com/i/web/status/1421483835909296143,31/07/2021 08:52:11,Twitter for iPhone,47,34,OPS/OMS,08:52:11,http://pbs.twimg.com/profile_images/1096094749902028801/ijbQWupW.png
"Nicaragua recibió un donativo de 36,480 dosis de 💉 de AstraZeneca de Oxford de parte de Noruega por medio del Mecan… https://t.co/Hpc3Yf5B8s",https://twitter.com/i/web/status/1421524457575780353,31/07/2021 11:33:35,Twitter for iPhone,12,3,OPS/OMS,11:33:35,http://pbs.twimg.com/profile_images/1096094749902028801/ijbQWupW.png
"Ya van más de 1,9 millones de vacunados y en esta jornada se espera superar los 2 millones, dice la ministra de Sal… https://t.co/VADQHNjurZ",https://twitter.com/i/web/status/1421560106441924619,31/07/2021 13:55:15,Twitter for iPhone,2,0,Secretaría de Salud,13:55:15,http://pbs.twimg.com/profile_images/1347259182777557002/Yge3kdJi.jpg
"""Si no revertimos estas tendencias, corremos el riesgo de una avalancha de empeoramiento de los problemas de salud… https://t.co/3HEZNzLJxN",https://twitter.com/i/web/status/1421561304654000133,31/07/2021 14:00:01,Twitter Media Studio,23,12,OPS/OMS,14:00:01,http://pbs.twimg.com/profile_images/1096094749902028801/ijbQWupW.png
"Brasileña radicada en el país se inmuniza en #Vacunatón del Distrito Central, para prevenir la #Covid19 https://t.co/sGPbWJpiue",https://twitter.com/i/web/status/1421570164462657536,31/07/2021 14:35:13,Twitter for iPhone,2,3,Secretaría de Salud,14:35:13,http://pbs.twimg.com/profile_images/1347259182777557002/Yge3kdJi.jpg
Carlos Salinas veedor del @Fonac_ verifica proceso de #Vacunatón en DistritoCentral https://t.co/GqBnlBTH7b,https://twitter.com/i/web/status/1421571829001596936,31/07/2021 14:41:50,Twitter for iPhone,7,5,Secretaría de Salud,14:41:50,http://pbs.twimg.com/profile_images/1347259182777557002/Yge3kdJi.jpg
El #Vacunatón se desarrolla con éxito en Francisco Morazán y el próximo fin de semana este novedoso esquema de vacu… https://t.co/0IzPf3HeAL,https://twitter.com/i/web/status/1421577044014604290,31/07/2021 15:02:33,Twitter for iPhone,5,5,Secretaría de Salud,15:02:33,http://pbs.twimg.com/profile_images/1347259182777557002/Yge3kdJi.jpg
RT @Presidencia_HN: Una eficaz respuesta dio la población  capitalina a la jornada de vacunación en el #Vacunatón que organizó el Gobierno…,https://twitter.com/i/web/status/1421587245954383872,31/07/2021 15:43:05,Twitter for iPhone,0,17,Secretaría de Salud,15:43:05,http://pbs.twimg.com/profile_images/1347259182777557002/Yge3kdJi.jpg
Gracias a estas empresas por apoyar en el #Vacunatón https://t.co/bMzSHF4PVa,https://twitter.com/i/web/status/1421604608997302272,31/07/2021 16:52:05,Twitter for iPhone,9,2,Secretaría de Salud,16:52:05,http://pbs.twimg.com/profile_images/1347259182777557002/Yge3kdJi.jpg
"La ministra de Salud, Alba Consuelo Flores, informó que hasta este momento se han vacunado contra la Covid-19 unas… https://t.co/mGFb9oYctU",https://twitter.com/i/web/status/1421612467122225157,31/07/2021 17:23:19,Twitter for iPhone,4,1,Secretaría de Salud,17:23:19,http://pbs.twimg.com/profile_images/1347259182777557002/Yge3kdJi.jpg
Un éxito el #Vacunaton en el Estadio Nacional este sábado. https://t.co/HWnNbsUgxU,https://twitter.com/i/web/status/1421617436353339394,31/07/2021 17:43:03,Twitter for iPhone,2,0,Secretaría de Salud,17:43:03,http://pbs.twimg.com/profile_images/1347259182777557002/Yge3kdJi.jpg
Miles de capitalinos se inocularon contra la #Covid19 en el #Vacunaton en el Estadio Nacional este sábado. https://t.co/ukcpsCJ5ZB,https://twitter.com/i/web/status/1421618718099058690,31/07/2021 17:48:09,Twitter for iPhone,1,1,Secretaría de Salud,17:48:09,http://pbs.twimg.com/profile_images/1347259182777557002/Yge3kdJi.jpg
Un éxito la vacunación contra la #Covid19 en el #Vacunaton en el Polideportivo de la UNAH. https://t.co/y7NxjSKxkM,https://twitter.com/i/web/status/1421618806816919554,31/07/2021 17:48:30,Twitter for iPhone,4,0,Secretaría de Salud,17:48:30,http://pbs.twimg.com/profile_images/1347259182777557002/Yge3kdJi.jpg
