Contenido,IR,Fecha,Dispositivo,Likes,Retweets,Entidad,Hora,Foto
"Hemos entregado cantidades considerables de equipo de protección personal, ayudamos a ampliar la atención a las per… https://t.co/yPbAkQEVhN",https://twitter.com/i/web/status/1415337978680029186,14/07/2021 09:50:44,Twitter Web App,4,2,OPS/OMS,09:50:44,http://pbs.twimg.com/profile_images/1096094749902028801/ijbQWupW.png
"Si bien la situación en Haití es única, muchos países de nuestra región, desde Colombia hasta Brasil y ahora Cuba,… https://t.co/JLvSfgJyjE",https://twitter.com/i/web/status/1415338225485426690,14/07/2021 09:51:43,Twitter Web App,6,6,OPS/OMS,09:51:43,http://pbs.twimg.com/profile_images/1096094749902028801/ijbQWupW.png
"COVID-19 no solo ha devastado nuestros sistemas de salud, ha fracturado los programas de protección social y desest… https://t.co/cg0q3Jzq5b",https://twitter.com/i/web/status/1415338667015647241,14/07/2021 09:53:28,Twitter Web App,44,27,OPS/OMS,09:53:28,http://pbs.twimg.com/profile_images/1096094749902028801/ijbQWupW.png
🌎Un nuevo informe publicado por la @cepal_onu la semana pasada presenta un panorama sombrío para nuestra región -… https://t.co/CBLNF7tzkW,https://twitter.com/i/web/status/1415339157241610250,14/07/2021 09:55:25,Twitter Web App,4,1,OPS/OMS,09:55:25,http://pbs.twimg.com/profile_images/1096094749902028801/ijbQWupW.png
"Más de 7️⃣ millones de empresas han cerrado en América Latina y el Caribe a raíz de la pandemia, más de un tercio d… https://t.co/N9dMsHZoVT",https://twitter.com/i/web/status/1415339855991746563,14/07/2021 09:58:12,Twitter Web App,4,6,OPS/OMS,09:58:12,http://pbs.twimg.com/profile_images/1096094749902028801/ijbQWupW.png
"El informe de la @cepal_onu  muestra cómo la pandemia sigue siendo alimentada por la desigualdad. Y, lamentablement… https://t.co/Gk68CugC6Z",https://twitter.com/i/web/status/1415340553663823879,14/07/2021 10:00:58,Twitter Web App,4,3,OPS/OMS,10:00:58,http://pbs.twimg.com/profile_images/1096094749902028801/ijbQWupW.png
🌎 Instamos a los países a que sigan dando prioridad a las redes de seguridad social y sanitaria como parte de su re… https://t.co/uC00ME2jgA,https://twitter.com/i/web/status/1415340962071695367,14/07/2021 10:02:35,Twitter Web App,9,4,OPS/OMS,10:02:35,http://pbs.twimg.com/profile_images/1096094749902028801/ijbQWupW.png
La protección social es clave tanto para ayudar a las personas a adherirse a las medidas de salud pública que sabem… https://t.co/uJQuJ3T9mB,https://twitter.com/i/web/status/1415343645730000898,14/07/2021 10:13:15,Twitter Web App,16,7,OPS/OMS,10:13:15,http://pbs.twimg.com/profile_images/1096094749902028801/ijbQWupW.png
"🌎 La salud es un derecho fundamental. Así era antes de COVID-19, y la carga desigual de esta pandemia ha pintado la… https://t.co/bBO79ta9XG",https://twitter.com/i/web/status/1415344626433658891,14/07/2021 10:17:09,Twitter Web App,12,6,OPS/OMS,10:17:09,http://pbs.twimg.com/profile_images/1096094749902028801/ijbQWupW.png
#HondurasSeVacuna https://t.co/7gxNpqkQjJ,https://twitter.com/i/web/status/1415403653083639813,14/07/2021 14:11:42,Twitter for Android,2,0,Secretaría de Salud,14:11:42,http://pbs.twimg.com/profile_images/1347259182777557002/Yge3kdJi.jpg
#HondurasSeVacuna https://t.co/S2Yzev6AuX,https://twitter.com/i/web/status/1415405330012459015,14/07/2021 14:18:22,Twitter Web App,2,0,Secretaría de Salud,14:18:22,http://pbs.twimg.com/profile_images/1347259182777557002/Yge3kdJi.jpg
"🔶 Los nuevos casos de 🦠 COVID-19 aumentaron en Centroamérica, el Caribe y algunos países de Sudamérica la semana pasada. 

#COVID19 ⬇️⬇️",https://twitter.com/i/web/status/1415405940979945473,14/07/2021 14:20:47,"<a href=""https://ads-api.twitter.com"" rel=""nofollow"">Twitter for Advertisers.",22,13,OPS/OMS,14:20:47,http://pbs.twimg.com/profile_images/1096094749902028801/ijbQWupW.png
"Salud entrega 22 ambulancias a los hospitales para el fortalecimiento del sistema sanitario del país

Con esta entr… https://t.co/VVkct7bQzB",https://twitter.com/i/web/status/1415419563227947013,14/07/2021 15:14:55,Twitter for iPhone,12,4,Secretaría de Salud,15:14:55,http://pbs.twimg.com/profile_images/1347259182777557002/Yge3kdJi.jpg
"A un costo de 51, 498,756.24 millones de lempiras la Secretaría de Salud entregó este día 22 ambulancias totalmente… https://t.co/5zbNS5yKoR",https://twitter.com/i/web/status/1415419578642046976,14/07/2021 15:14:59,Twitter for iPhone,5,2,Secretaría de Salud,15:14:59,http://pbs.twimg.com/profile_images/1347259182777557002/Yge3kdJi.jpg
"Seguimos fortaleciendo el sistema de salud de Honduras. 🏥🇭🇳

Este día con el apoyo del BCIE y de la OPS/OMS hicimos… https://t.co/JUva4LKQFE",https://twitter.com/i/web/status/1415427440856297473,14/07/2021 15:46:13,Twitter for iPhone,2,0,Secretaría de Salud,15:46:13,http://pbs.twimg.com/profile_images/1347259182777557002/Yge3kdJi.jpg
🏥✅ https://t.co/P6yMt05OiI,https://twitter.com/i/web/status/1415427514873352201,14/07/2021 15:46:31,Twitter for iPhone,0,0,Secretaría de Salud,15:46:31,http://pbs.twimg.com/profile_images/1347259182777557002/Yge3kdJi.jpg
"En el Distrito Central  
Se vacunarán a personas de 45 a 49 años con enfermedades de base este jueves 15 y viernes… https://t.co/XSiybgBQB6",https://twitter.com/i/web/status/1415453636243640326,14/07/2021 17:30:19,Twitter for iPhone,0,1,Secretaría de Salud,17:30:19,http://pbs.twimg.com/profile_images/1347259182777557002/Yge3kdJi.jpg
Este 15 y 16 de julio se continúa la vacunación contra la Covid-19 a la población mayor de 50 años sin ninguna rest… https://t.co/l2r92gObVH,https://twitter.com/i/web/status/1415453638298939398,14/07/2021 17:30:19,Twitter for iPhone,0,0,Secretaría de Salud,17:30:19,http://pbs.twimg.com/profile_images/1347259182777557002/Yge3kdJi.jpg
"Pacientes con enfermedad renal reciben  segunda dosis de la vacuna contra la Covid-19

Este miércoles y jueves se e… https://t.co/jrUM48oDwI",https://twitter.com/i/web/status/1415453802304622599,14/07/2021 17:30:58,Twitter for iPhone,0,0,Secretaría de Salud,17:30:58,http://pbs.twimg.com/profile_images/1347259182777557002/Yge3kdJi.jpg
Autoridades de la Región Metropolitana del Distrito Central iniciaron  este miércoles a aplicar la segunda dosis de… https://t.co/7rs5rftJ9h,https://twitter.com/i/web/status/1415453810139533313,14/07/2021 17:31:00,Twitter for iPhone,1,0,Secretaría de Salud,17:31:00,http://pbs.twimg.com/profile_images/1347259182777557002/Yge3kdJi.jpg
