Contenido,IR,Fecha,Dispositivo,Likes,Retweets,Entidad,Hora,Foto
Existen estudios preliminares que sugieren que las dosis únicas podrían inducir una respuesta inmune adecuada si ha… https://t.co/tdhZR8DDFG,https://twitter.com/i/web/status/1398638161778163717,29/05/2021 07:51:37,Twitter for iPhone,20,6,OPS/OMS,07:51:37,http://pbs.twimg.com/profile_images/1096094749902028801/ijbQWupW.png
"Sobre la base de estos hallazgos preliminares, aquellos que han tenido COVID-19 pueden posponer su cita para la vac… https://t.co/KzjwdTX9l3",https://twitter.com/i/web/status/1398638163048947715,29/05/2021 07:51:38,Twitter for iPhone,25,12,OPS/OMS,07:51:38,http://pbs.twimg.com/profile_images/1096094749902028801/ijbQWupW.png
"En el caso de haber padecido #COVID19 u otra enfermedad infecciosa, la vacuna puede ser administrada después del fi… https://t.co/Rp5EYB9uWe",https://twitter.com/i/web/status/1398663628946120708,29/05/2021 09:32:49,Twitter for iPhone,41,29,OPS/OMS,09:32:49,http://pbs.twimg.com/profile_images/1096094749902028801/ijbQWupW.png
"Los productos 🧃🍟🍩 con alto contenido de grasas, sal y azúcares, incluso en pequeñas cantidades, pueden comprometer… https://t.co/FTrneMXd66",https://twitter.com/i/web/status/1398738415558922240,29/05/2021 14:30:00,Twitter Media Studio,18,14,OPS/OMS,14:30:00,http://pbs.twimg.com/profile_images/1096094749902028801/ijbQWupW.png
"👉 ""Como todos nosotros, las mujeres embarazadas están expuestas a las infecciones por 🦠 COVID-19, pero debido a que… https://t.co/gm1rlIvySA",https://twitter.com/i/web/status/1398741183774420992,29/05/2021 14:41:00,Twitter Media Studio,21,27,OPS/OMS,14:41:00,http://pbs.twimg.com/profile_images/1096094749902028801/ijbQWupW.png
La recomendación de la OMS es esperar por lo menos 14 días entre vacunarse 💉 contra la COVID-19 y vacunarse contra… https://t.co/FI8dIElz9M,https://twitter.com/i/web/status/1398998585203642371,30/05/2021 07:43:49,Twitter for iPhone,40,20,OPS/OMS,07:43:49,http://pbs.twimg.com/profile_images/1096094749902028801/ijbQWupW.png
Le soutien du gouvernement du Canada 🇨🇦 aidera à vacciner les groupes de population vulnérables et transitoires afi… https://t.co/pSN5ZrymTn,https://twitter.com/i/web/status/1399067387438247941,30/05/2021 12:17:13,Twitter for iPhone,6,2,OPS/OMS,12:17:13,http://pbs.twimg.com/profile_images/1096094749902028801/ijbQWupW.png
"🚨 ""Debemos recordar que los desafíos y las desigualdades que enfrentamos antes de 🦠 COVID-19 no han desaparecido du… https://t.co/KpWmtaghFu",https://twitter.com/i/web/status/1399103823340265472,30/05/2021 14:42:00,Twitter Media Studio,23,20,OPS/OMS,14:42:00,http://pbs.twimg.com/profile_images/1096094749902028801/ijbQWupW.png
#DichoYHecho @JuanOrlandoH https://t.co/tdK9wn8snD,https://twitter.com/i/web/status/1399112223407194123,30/05/2021 15:15:22,Twitter for iPhone,1,1,Secretaría de Salud,15:15:22,http://pbs.twimg.com/profile_images/1347259182777557002/Yge3kdJi.jpg
#DichoYHecho @JuanOrlandoH https://t.co/BLtq6hbdN1,https://twitter.com/i/web/status/1399112233347653635,30/05/2021 15:15:25,Twitter for iPhone,4,1,Secretaría de Salud,15:15:25,http://pbs.twimg.com/profile_images/1347259182777557002/Yge3kdJi.jpg
#DichoYHecho @JuanOrlandoH https://t.co/s4VdNxggN0,https://twitter.com/i/web/status/1399112238393446400,30/05/2021 15:15:26,Twitter for iPhone,3,1,Secretaría de Salud,15:15:26,http://pbs.twimg.com/profile_images/1347259182777557002/Yge3kdJi.jpg
#DichoYHecho @JuanOrlandoH https://t.co/AOQSahhvoo,https://twitter.com/i/web/status/1399112243711709196,30/05/2021 15:15:27,Twitter for iPhone,1,1,Secretaría de Salud,15:15:27,http://pbs.twimg.com/profile_images/1347259182777557002/Yge3kdJi.jpg
Periodistas y comunicadores sociales en Siguatepeque fueron convocados al Centro de Salud Gustavo Boquín para ser v… https://t.co/2ehu2zWSfH,https://twitter.com/i/web/status/1399151050507046917,30/05/2021 17:49:40,Twitter for iPhone,3,1,Secretaría de Salud,17:49:40,http://pbs.twimg.com/profile_images/1347259182777557002/Yge3kdJi.jpg
"Estas gestiones se lograron concretar con el apoyo de la Asociación de Prensa y el gobierno.

No todo el gremio se… https://t.co/tFoBvZCB9Q",https://twitter.com/i/web/status/1399151055565426689,30/05/2021 17:49:41,Twitter for iPhone,2,1,Secretaría de Salud,17:49:41,http://pbs.twimg.com/profile_images/1347259182777557002/Yge3kdJi.jpg
"Vacunación de comunicadores prosigue a nivel nacional:
 Gremio periodístico de Santa Bárbara agradece a Gobierno y… https://t.co/BtJFS5uKBe",https://twitter.com/i/web/status/1399155751386595351,30/05/2021 18:08:20,Twitter for iPhone,3,1,Secretaría de Salud,18:08:20,http://pbs.twimg.com/profile_images/1347259182777557002/Yge3kdJi.jpg
Los profesionales de la comunicación de Santa Bárbara fueron vacunados contra la covid-19 y agradecieron al Gobiern… https://t.co/fokPiJUnvq,https://twitter.com/i/web/status/1399155757426352130,30/05/2021 18:08:22,Twitter for iPhone,2,1,Secretaría de Salud,18:08:22,http://pbs.twimg.com/profile_images/1347259182777557002/Yge3kdJi.jpg
"La Administración Hernández, mediante la Secretaría de Salud, desarrolló hoy el proceso de inmunización del gremio… https://t.co/rJhEw7744a",https://twitter.com/i/web/status/1399155763629674496,30/05/2021 18:08:23,Twitter for iPhone,1,1,Secretaría de Salud,18:08:23,http://pbs.twimg.com/profile_images/1347259182777557002/Yge3kdJi.jpg
"Estadísticas de #Covid19 del 30 de mayo 2021, de la Unidad de Vigilancia de la Salud. https://t.co/okQM7Wxwxv",https://twitter.com/i/web/status/1399176044213645314,30/05/2021 19:28:59,Twitter for iPhone,1,0,Secretaría de Salud,19:28:59,http://pbs.twimg.com/profile_images/1347259182777557002/Yge3kdJi.jpg
"¡Hoy es el #DíaMundialSinTabaco! 🚭

La pandemia de #COVID19 ha hecho que millones de consumidores de tabaco afirmen… https://t.co/PAZUYDPfmc",https://twitter.com/i/web/status/1399337543850774530,31/05/2021 06:10:43,Twitter for iPhone,6,4,OPS/OMS,06:10:43,http://pbs.twimg.com/profile_images/1096094749902028801/ijbQWupW.png
"Cada año, más de 8 millones de personas mueren 💀 por causa del tabaco. 

Ahora es el mejor momento para dejarlo 🚭… https://t.co/TmXvluV0A7",https://twitter.com/i/web/status/1399337549588578307,31/05/2021 06:10:44,Twitter for iPhone,4,3,OPS/OMS,06:10:44,http://pbs.twimg.com/profile_images/1096094749902028801/ijbQWupW.png
