name,url,description,datePublished,imagen,pais,Fuente
Julieta Castellanos: ampliar la circulación de gente en Honduras es un riesgo,https://www.latribuna.hn/2020/09/19/julieta-castellanos-ampliar-la-circulacion-de-gente-en-honduras-es-un-riesgo/,"Tegucigalpa, 19 sep (EFE).- La iniciativa de aumentar la próxima semana la cantidad de gente que pueda circular en Honduras representa un riesgo porque la pandemia de COVID-19 sigue en alza, advirtió",19-09-2020 20:36,https://www.bing.com/th?id=OVFT.vOh_KXAelZ5l9etOCtz-qS,Chile,La Tribuna
Oficial: Honduras habilita circulación de dos dígitos por día a partir de mañana,https://www.laprensa.hn/honduras/1409829-410/honduras-habilita-circulacion-d%C3%ADgitos-econom%C3%ADa,A nivel nacional mañana circulan los dígitos 0 y 1. Se continúa en fase 1 de la reapertura económica. Tegucigalpa. A partir de este lunes 21 de septiembre se habilita en Honduras la circulación de dos,20-09-2020 00:00,https://www.bing.com/th?id=OVFT.oq9dbM03Z9to7sTIh-D6Ti,Chile,La Prensa Chicos
Laboratorio de Virología ya no tendrá mora en procesamiento de pruebas PCR para detección de covid-19,https://www.radiohrn.hn/laboratorio-de-virologia-ya-no-tendra-mora-en-procesamiento-de-pruebas-pcr-para-deteccion-de-covid-19,"""La situación real es que no hay mora y que se están presentando en su tiempo y forma"", afirmó Marco Moncada, presidente del Colegio de Microbiólogos El presidente del Colegio de Microbiólogos y Quími",20-09-2020 00:00,https://www.bing.com/th?id=OVFT.PBeYi_QPLfnvk6iP_27pci,Chile,Radio HRN
Toque de queda en Honduras se extiende hasta el 4 de octubre,https://www.elheraldo.hn/pais/1409806-466/toque-de-queda-honduras-coronavirus-pandemia-octubre,"TEGUCIGALPA, HONDURAS.-Porque el covid-19 sigue causando estragos en el país, el toque de queda absoluto en Honduras fue extendido hasta el próximo domingo 4 de octubre a las 11:00 de la noche. Durant",20-09-2020 00:00,https://www.bing.com/th?id=OVFT.6AVbu3daQNb3PkzxCkSjDi,Chile,El Heraldo
Coronavirus: Honduras supera los 22 mil pacientes recuperados de covid-19,https://www.radiohrn.hn/coronavirus-honduras-supera-los-22-mil-pacientes-recuperados-de-covid,"Zonia Reyes, vocera del Sistema Nacional de Gestión de Riesgos (Sinager), detalló el domingo 20 de septiembre que Honduras reportó 473 nuevos pacientes de coronavirus (covid-19), que aumentan el total",20-09-2020 00:00,https://www.bing.com/th?id=OVFT.ugLekFwTGgsdAQ1n3JYNqy,Chile,Radio HRN
Honduras reporta 18 muertos por coronavirus y 473 nuevos contagios,https://www.laprensa.hn/especiales/coronavirus/1409821-410/honduras-muertos-coronavirus-contagios-covid,"La cifra de muertos en Honduras por Covid-19 se elevó este domingo a 2,184 y la de contagiados a 71,616, informó el Sistema Nacional de Gestión de Riesgos (Sinager). En su informe diario sobre la pand",20-09-2020 00:00,https://www.bing.com/th?id=OVFT._ociSpHoxfXfYwrVP4ZwoS,Chile,La Prensa Chicos
"Honduras suma 2,184 muertos y 71,616 infectados por coronavirus",https://www.elheraldo.hn/pais/1409812-466/honduras-coronavirus-finales-septiembre-pandemia,"TEGUCIGALPA, HONDURAS.-Honduras acumula hasta el domingo 20 de septiembre 2,184 muertos y 71,616 contagios por la pandemia del coronavirus, confirmaron las autoridades del Sistema Nacional de Gestión",20-09-2020 00:00,https://www.bing.com/th?id=OVFT.yLvqxFQrN3Kq1qqEbQASpS,Chile,El Heraldo
"Honduras alcanza 71,143 casos y 2,166 decesos por COVID-19",https://proceso.hn/honduras-alcanza-71143-casos-y-2166-decesos-por-covid-19/,"Tegucigalpa –Honduras acumula este sábado 71 mil 143 contagios y dos mil 166 fallecimientos, confirmó el Sistema Nacional de Gestión de Riesgos (Sinager), tras cumplirse 193 días de pandemia. -La tasa",20-09-2020 02:32,https://www.bing.com/th?id=OVFT.r1tvsD2ZvnGwjNid8YwNZC,Chile,Proceso
Hondureño de 105 años vence al COVID-19 en Choluteca,https://www.latribuna.hn/2020/09/20/hondureno-de-105-anos-vence-al-covid-19-en-choluteca/,"Uno de los hombres más longevos de Honduras que había resultado contagiado de COVID-19, salió victorioso de la batalla contra la letal enfermedad. Se trata del maestro jubilado Fernando Rodríguez Joya",20-09-2020 15:21,https://www.bing.com/th?id=OVFT.ayucL-ar06GQhYVCHV7JRC,Chile,La Tribuna
Honduras e Israel analizan apertura de embajadas antes de fin de año,https://hondudiario.com/2020/09/20/honduras-e-israel-analizan-apertura-de-embajadas-antes-de-fin-de-ano/,"El presidente de Honduras, Juan Orlando Hernández, dijo este domingo que conversó telefónicamente con el primer ministro de Israel, Benjamín Netanyahu, y que ambos países esperan abrir embajadas antes",21-09-2020 00:40,https://www.bing.com/th?id=OVFT.IxqMV0LhI4IDzlrHKwIizi,Chile,Hondudiario
Honduras debe prepararse para segunda oleada de la pandemia,https://proceso.hn/honduras-debe-prepararse-para-segunda-oleada-de-la-pandemia/,"Tegucigalpa – Honduras debe prepararse para una segunda oleada de casos de COVID-19, lo que podría ocurrir en los próximos 14 a 20 días, además de que el virus se cuela en todos los rincones del país",21-09-2020 02:01,https://www.bing.com/th?id=OVFT.0odzlmhrEWmE6EU5rDEeai,Chile,Proceso
Gobierno de Honduras extiende toque de queda y anuncia nuevo calendario de circulación con dos dígitos,https://www.diez.hn/coronavirus/1409863-441/nuevo-calendario-circulacion-dos-digitos-gobierno-honduras-extiende-toque-queda,Secretaría de Seguridad y Sinager confirmaron que el Toque de Queda se extiende hasa el domingo 4 de octubre y a partir de este lunes comenzarán a circular dos dígitos diarios. La Secretaría de Seguri,21-09-2020 02:45,https://www.bing.com/th?id=OVFT.shDjm7WEeT7Jc5YAc_X9Ii,Chile,diez.hn
"Honduras reporta 473 nuevos contagios de covid-19 y la cifra de muertos se eleva a 2,184",https://www.diez.hn/coronavirus/1409875-441/honduras-nuevos-contagios-covid-19-muertos-recuperados-cortes-francisco-morazan,"Sinager confirmó 255 nuevos recuperados de Covid-19. Honduras ya suma 71,616 casos, 22,065 pacientes que superaron el virus y 2,184 muertos. El Sistema Nacional de Gestión de Riesgos (Sinager) confirm",21-09-2020 03:36,https://www.bing.com/th?id=OVFT.eQf1vqHo7SDNG6hdxDvIKC,Chile,diez.hn
