name,url,description,datePublished,imagen,pais,Fuente
Honduras sobrepasa los 109 mil contagios de coronavirus,https://hondudiario.com/2020/12/02/honduras-sobrepasa-los-109-mil-contagios-de-coronavirus/,"*** En el plano internacional, la vacuna contra el nuevo coronavirus cada vez está más cerca. El Sistema Nacional de Gestión de Riesgos (Sinager), confirmó este miércoles 503 nuevos casos de Covid-19,",03-12-2020 02:55,https://www.bing.com/th?id=OVFT.0XMLNHZUQYGDfII-qyHY4i,Chile,Hondudiario
COVID-19 Honduras: SINAGER confirma 503 nuevos casos y 3 muertos,https://tiempo.hn/covid-19-en-honduras-sinager-503-casos-3-muertos/,"TEGUCIGALPA, HONDURAS. De 1,512 nuevas pruebas para diagnosticar COVID-19 que procesó el Laboratorio Nacional de Virología (LNV), de la Secretaría de Salud (SESAL), 503 resulta",03-12-2020 05:29,https://www.bing.com/th?id=OVFT.Yczh90CphL780xQOqPe8di,Chile,Tiempo
La COVID-19 ha causado 2.930 muertos en Honduras,https://www.latribuna.hn/2020/12/02/la-covid-19-ha-causado-2-930-muertos-en-honduras/,"La pandemia de COVID-19, que desde marzo se comenzó a expandir en Honduras, le ha causado la muerte a 2.930 personas, informó este miércoles el estatal Sistema Nacional de Gestión de Riesgos (Sinager)",03-12-2020 05:51,https://www.bing.com/th?id=OVFT.gODl8F94927luU_HEjF1yS,Chile,La Tribuna
"Troglio cuenta cómo motivó al plantel para vencer a Motagua ""Les dije que son partidos de gloria""",https://www.diez.hn/liganacionaldehonduras/1426780-498/pedro-troglio-cuenta-como-motivo-olimpia-para-vencer-a-motagua-boca-river,"El entrenador del Olimpia, además, confesó que ha recibido otro golpe en su familia: su madre sufre con el coronavirus en Argentina. Habla de que se siente feliz de estar en Olimpia",03-12-2020 06:43,https://www.bing.com/th?id=OVFT.Yg5iV085nOZhKheL08aJlS,Chile,diez.hn
Casos de covid aumentan 2 por ciento en las últimas dos semanas; la pandemia no se ha controlado: Karla Pavón,https://www.radiohrn.hn/casos-de-covid-aumentan-2-por-ciento-en-las-ultimas-dos-semanas-la-pandemia-no-se-ha-controlado-karla-pavon,"""En las últimas dos semanas hemos tenido un aumento en el número de casos covid. Se ha incrementado en 2 por ciento. Esto se debe a que ya está en circulación toda la poblacin",03-12-2020 15:56,https://www.bing.com/th?id=OVFT.o_cUaCMhwc0hLSuYg8oHmy,Chile,Radio HRN
Honduras hace un llamamiento ante la ONU para garantizar acceso a vacunas,https://www.latribuna.hn/2020/12/03/honduras-hace-un-llamamiento-ante-la-onu-para-garantizar-acceso-a-vacunas/,"El presidente de Honduras, Juan Orlando Hernández, hizo este jueves un llamamiento a la comunidad internacional para que continúe fortaleciendo el fondo financiero de la alianza que impulsa la ONU «pa",03-12-2020 18:16,https://www.bing.com/th?id=OVFT.b1jKfI0SiVp_8zopSyV-IS,Chile,La Tribuna
"Darixon Vuelto sobre el clásico ante Olimpia: ""Vamos con el cuchillo entre los dientes""",https://www.diez.hn/liganacionaldehonduras/1426887-498/darixon-vuelto-olimpia-real-espana-domingo-liguilla-liga-concacaf,"El delantero del Real España, Darixon Vuelto, dijo que han trabajado en la semana en definición y esperan llegar finos al choque contra Olimpia. Además, envió un mensaje de solidad a periodista.",03-12-2020 20:10,https://www.bing.com/th?id=OVFT.sN46ezCHDLABOt8-KmUavi,Chile,diez.hn
"Vacuna contra el covid será gratuita en Honduras, tras aprobación de nueva ley",https://www.radiohrn.hn/vacuna-contra-el-covid-sera-gratuita-en-honduras,Las personas que se encuentran en la primera línea serán algunas de las primeras personas que serán vacunadas contra el covid en Honduras,03-12-2020 20:24,https://www.bing.com/th?id=OVFT.ZQHPq4HKQH-_AOvAWXtYUi,Chile,Radio HRN
CN aprueba ley: Vacuna contra el COVID-19 será gratuita para los hondureños,https://tiempo.hn/cn-aprueba-vacuna-contra-el-covid-19-gratuita-honduras/,"El Congreso Nacional (CN), durante la sesión virtual de hoy, jueves, aprobó la la Ley de Vacuna Gratuita contra el COVID-19 que aplicaría",03-12-2020 21:04,https://www.bing.com/th?id=OVFT.k4aBumCYwe0wYIlaLUEM6C,Chile,Tiempo
Salud mantiene plan de fortalecimiento del sistema sanitario del país para contrarrestar la COVID-19,https://ultimahora.hn/salud-mantiene-plan-de-fortalecimiento-del-sistema-sanitario-del-pais-para-contrarrestar-la-covid-19/,La Secretaría de Salud ha logrado con éxito implementar el plan de respuesta para contrarrestar un posible brote de la COVID-19 consecuencia de los daños ocasionados por las tormentas tropicales,03-12-2020 22:03,https://www.bing.com/th?id=OVFT.29DRQiKZnoXY4lWx8Ivusi,Chile,Ultima Hora
BID ayudará a Honduras en la reasignación de fondos para reconstrucción y habilitación de infraestructura,https://proceso.hn/bid-ayudara-a-honduras-en-la-reasignacion-de-fondos-para-reconstruccion-y-habilitacion-de-infraestructura/,"Washington – El Banco Interamericano de Desarrollo (BID) ayudará a Honduras en la reasignación de fondos para la reconstrucción y habilitación de infraestructura del país, informó hoy el ministro de F",03-12-2020 22:37,https://www.bing.com/th?id=OVFT.d3NuI3V5qEsmwyZyXJMVNi,Chile,Proceso
HONDURAS / ¡ABSURDO! SÓLO 30 MIL LEMPIRAS PAGARÁN VIOLADORES DE LEY TRANSPARENCIA,http://www.web.ellibertador.hn/index.php/noticias/nacionales/2481-honduras-absurdo-solo-30-mil-lempiras-pagaran-violadores-de-ley-transparencia,"Si se considera que el salario mínimo vigente para 2020 en Honduras, oscila entre 9 mil 400 y 12 mil 100 lempiras, significa que los “sancionados” pagarán a lo sumo unos 36 mil lempiras, algo que raya",03-12-2020 23:45,https://www.bing.com/th?id=OVFT.Lb-I249TmNfLtWNryfr0JS,Chile,El Libertador
"Honduras suma 616 contagios y muertes por Covid-19 ya son 2,938",https://hondudiario.com/2020/12/03/honduras-suma-616-contagios-y-muertes-por-covid-19-ya-son-2938/,"El Sistema Nacional de Gestión de Riesgos (Sinager), confirmó este jueves 616 nuevos casos de Covid-19, sumando así un total de 109,760 contagios a nivel nacional. Además, se reportó la muerte de 8 pe",04-12-2020 01:34,https://www.bing.com/th?id=OVFT.Q-6-XmlAgbZ-fTPmrKyENS,Chile,Hondudiario
Diputados de Libre y Pinu votaron en contra de que hondureños reciban vacunas contra Covid-19,https://ultimahora.hn/diputados-de-libre-y-pinu-votaron-en-contra-de-que-hondurenos-reciban-vacunas-contra-covid-19/,"Diputados como Jorge Cálix, Doris Gutiérrez, Jary Dixon, Luis Redondo y Sergio Castellanos, entre otros de Libre y Pinu, votaron en contra de la ley que asegura la vacunación de todos los",04-12-2020 02:39,https://www.bing.com/th?id=OVFT.HFrc97r0ROVkzlFq8BiUyS,Chile,Ultima Hora
Honduras registra ocho fallecidos por coronavirus y 616 contagios,https://www.laprensa.hn/honduras/1427018-410/honduras-ocho-fallecidos-coronavirus-contagios-covid-pandemia-,"La cifra de muertos en Honduras por la covid-19 roza los 3.000, mientras que la de contagios del coronavirus SARS-CoV-2 los 110.000 en casi nueve meses de pandemia, informó este jueves el Sistema Naci",04-12-2020 03:00,https://www.bing.com/th?id=OVFT.ASujTeoWSd1nawimuOXtBC,Chile,La Prensa Chicos
Hernández expone a bancos multilaterales los daños que dejaron las tormentas tropicales Eta y Iota,http://www.eldiario.hn/hernandez-expone-a-bancos-multilaterales-los-danos-que-dejaron-las-tormentas-tropicales-eta-y-iota/,Washington. - El presidente Juan Orlando Hernández realizó este jueves en Washington una serie de reuniones con representantes de bancos multilaterales a fin de concretar la asistencia que le brindará,04-12-2020 03:11,https://www.bing.com/th?id=OVFT.DGS92dbjqqW-w1rlp27lky,Chile,El Diario
Hernández expone a bancos multilaterales los daños que dejaron las tormentas tropicales Eta e Iota,http://www.eldiario.hn/hernandez-expone-a-bancos-multilaterales-los-danos-que-dejaron-las-tormentas-tropicales-eta-e-iota/,Washington. - El presidente Juan Orlando Hernández realizó este jueves en Washington una serie de reuniones con representantes de bancos multilaterales a fin de concretar la asistencia que le brindará,04-12-2020 03:11,https://www.bing.com/th?id=OVFT.DGS92dbjqqW-w1rlp27lky,Chile,El Diario
Presidente Hernández expone a bancos multilaterales los daños que dejaron las tormentas tropicales Eta y Iota,http://www.elsoldehonduras.com/nacionales/presidente-hernandez-expone-a-bancos-multilaterales-los-danos-que-dejaron-las-tormentas-tropicales-eta-y-iota/,El presidente Juan Orlando Hernández realiza hoy en Washington una serie de reuniones con representantes de bancos multilaterales a fin de concretar la asistencia que le brindarn,04-12-2020 04:08,https://www.bing.com/th?id=OVFT.RVvX4L4i0hKdjT79nYzuYy,Chile,El Sol de Honduras
