name,url,description,datePublished,imagen,pais,Fuente
Inauguran centro de triaje para pacientes COVID-19 en Comayagua,https://www.laprensa.hn/especiales/coronavirus/1403718-410/centro-triaje-inaugurado-pacientes-coronavirus-comayagua-fuerza-honduras,"Ayer se inauguró el centro de triaje de Comayagua para pacientes con COVID-19, el cual funciona en el gimnasio del instituto León Alvarado, con capacidad para atender a 450 personas diarias, las 24 ho",25-08-2020 17:28,https://www.bing.com/th?id=ON.0151DE7ED9390EAFC941EFCCE06E7607,Chile,La Prensa Chicos
"El nuevo Vida que quiere Luis Cruz: Exportación de jugadores, 10 mensualidades, títulos y proyección con reservas",https://www.diez.hn/liganacionaldehonduras/1403742-498/el-nuevo-vida-que-quiere-luis-cruz-exportaci%C3%B3n-de-jugadores-10-mensualidades,"Vida visualiza un futuro prometedor con la llegada del nuevo inversionista, el hondureño Luis Cruz quien dirigirá el barco junto en cuerpo técnico experimentado como Enrique Maradiaga y Nerlyn Membreñ",25-08-2020 18:02,https://www.bing.com/th?id=ON.8E597B6AD39A44AF55B3DE5DCC62E7EE,Chile,diez.hn
"USAID equipa sala COVID-19 del Hospital de San Marcos, Ocotepeque",https://hondudiario.com/2020/08/25/usaid-equipa-sala-covid-19-del-hospital-de-san-marcos-ocotepeque/,"*** Las donaciones suman a más de 40 mil dólares, con los cuales se fortaleció un centro de salud que trata a 165 mil hondureños. Tegucigalpa, Honduras.   El Gobierno de los Estados Unidos, a través d",25-08-2020 20:52,https://www.bing.com/th?id=ON.0E6124D8D6F8CDC66C95BC3D1A9D962F,Chile,Hondudiario
Honduras: Hospitales reportan seis decesos por COVID-19,https://www.latribuna.hn/2020/08/25/honduras-hospitales-reportan-seis-decesos-por-covid-19/,"Cuatro hospitales de Honduras reportan el deceso de seis personas con sospecha de COVID-19 en las últimas 24 horas, de los cuales tres en el Instituto Nacional Cardiopulmonar Tórax, uno en el Institut",25-08-2020 21:27,https://www.bing.com/th?id=ON.BAF2A01FB3710EDEA1BF06682E32E12A,Chile,La Tribuna
Honduras registra 968 nuevos contagios y aumentan a 55.479 los casos de coronavirus,https://elpatriota.hn/2020/08/25/honduras-registra-968-nuevos-contagios-y-aumentan-a-55-479-los-casos-de-coronavirus/,"TEGUCIGALPA,HONDURAS. El Sistema Nacional de Gestión de Riesgo (Sinager) comunicó hoy que el Laboratorio Nacional de Virología confirmó otros 968 casos de covid-19 en Honduras, con los que se elevó a",25-08-2020 22:18,https://www.bing.com/th?id=ON.38C59A3E4F65BCAB272087987942EE5C,Chile,El Patriota
"Amnistía Internacional:Honduras, el número 13 en lista de países con más médicos fallecidos por COVID",https://elpatriota.hn/2020/08/25/amnistia-internacionalhonduras-el-numero-13-en-lista-de-paises-con-mas-medicos-fallecidos-por-covid/,"TEGUCIGALPA, HONDURAS. Con más de 40 médicos fallecidos por COVID-19, Honduras se ubica en una posición preocupante en el ránking de los países que más decesos de profesionales de la salud registran.",25-08-2020 22:49,https://www.bing.com/th?id=ON.FAD69F96E015BBC8D6E83320CE983E51,Chile,El Patriota
Países con menos contagios de covid-19 realizan más pruebas que Honduras,https://www.elheraldo.hn/mundo/1403826-466/pa%C3%ADses-con-menos-contagios-de-covid-19-realizan-m%C3%A1s-pruebas-que-honduras,"TEGUCIGALPA, HONDURAS.-El covid-19 sigue creciendo en la región centroamericana. En las últimas horas, Guatemala, el segundo con más contagios, reportó más de 1,000 casos del nuevo coronavirus, rozand",25-08-2020 22:56,https://www.bing.com/th?id=ON.9E07343861436235E90549D1E26909B3,Chile,El Heraldo
Chicha y Limón martes 25 de agosto de 2020,http://www.eldiario.hn/chicha-y-limon-martes-25-de-agosto-de-2020/,¡LUNA CRECIENTE!!… Y así crecen las emociones en muchos iracundos de la palestra en esta última semana de Agosto… Cuando llegan estas fechas el año ya va en picada jodido… ¡Hace poco que era Semana Sa,26-08-2020 00:18,https://www.bing.com/th?id=ON.CBFF3F72469A851A37A82F1ED5FCD0A8,Chile,El Diario
"Honduras sobrepasa las 1,700 muertes por COVID con récord diario de recuperados",https://hondudiario.com/2020/08/25/honduras-sobrepasa-las-1700-muertes-por-covid-con-record-diario-de-recuperados/,"El Sistema Nacional de Gestión de Riesgos (Sinager), informó este martes que de 922 pruebas para diagnosticar Covid-19 en el país, 368 dieron positivo, sumando así un total de 55,877 casos de coronavi",26-08-2020 15:01,https://www.bing.com/th?id=ON.0E8D4C1356E55EDA05AADB5A4E18DBAF,Chile,Hondudiario
"Honduras, el país de Centroamérica con menos recuperados de covid-19",https://www.elheraldo.hn/pais/1403911-466/honduras-recuperados-centroamerica,"TEGUCIGALPA, HONDURAS.-Con apenas 15% de recuperados, Honduras es el país de Centroamérica que menos personas reporta que han logrado vencer el coronavirus. Los resultados obedecen en gran manera al c",26-08-2020 16:03,https://www.bing.com/th?id=ON.4D6785630F8F8AA60C50078B3EC3D6FA,Chile,El Heraldo
"OMS/OPS dona 1,5 millones de mascarillas y otros insumos a Honduras para enfrentar pandemia",http://www.eldiario.hn/omsops-dona-15-millones-de-mascarillas-y-otros-insumos-a-honduras-para-enfrentar-pandemia/,Tegucigalpa.-El Gobierno del presidente Juan Orlando Hernández recibió una donación de insumos de parte de la Organización Mundial de la Salud y Organización Panamericana de la Salud (OMS/OPS) para fo,26-08-2020 17:20,https://www.bing.com/th?id=ON.F6419998BF55C7B38FA4FFD514DF9A21,Chile,El Diario
Presidente Hernández: Las medidas que tomamos contra el COVID-19 han dado resultados,https://www.latribuna.hn/2020/08/26/presidente-hernandez-las-medidas-que-tomamos-contra-el-covid-19-han-dado-resultados/,"El presidente Juan Orlando Hernández destacó los resultados positivos que se obtuvieron de las medidas de confinamiento contra el COVID-19. A inicios de la pandemia en Honduras, en marzo pasado, el Go",26-08-2020 20:52,https://www.bing.com/th?id=ON.24303064FECDC27C1D605DE7B01D663D,Chile,La Tribuna
