name,url,description,datePublished,imagen,pais,Fuente
España aprueba crédito por 35 millones de dólares para pobres de Honduras,https://www.laprensa.hn/honduras/1396380-410/espa%C3%B1a-ayuda-credito-35-millones-dolares-pobres-honduras,"Con el crédito aprobado por España los hondureños del empobrecido Corredor Seco tendrán acceso a tecnología y asistencia productiva. Tegucigalpa. Miles de hondureños del denominado ""Corredor seco"", en",24-07-2020 22:29,https://www.bing.com/th?id=ON.30331A5492DE1164A3272103197C3913,Chile,La Prensa Chicos
España aprueba crédito por $35 millones para pobres de Honduras,https://www.latribuna.hn/2020/07/24/espana-aprueba-credito-por-35-millones-para-pobres-de-honduras/,"Miles de hondureños del denominado «Corredor seco», en una región empobrecida, tendrán acceso a tecnología y asistencia productiva a través de un crédito aprobado por el Gobierno de España a Honduras",25-07-2020 00:17,https://www.bing.com/th?id=ON.5CD8414BE5A4A6723FCFC63551F4DB4D,Chile,La Tribuna
Nebulizadores usados y en mal estado en millonaria compra del gobierno de Honduras,https://notibomba.com/nebulizadores-usados-y-en-mal-estado-en-millonaria-compra-del-gobierno-de-honduras/,"El Ministerio Público en Honduras confirmó este viernes el decomiso de vaporizadores y nebulizadores en mal estado y usados como parte de los hospitales móviles, adquiridos por el gobierno por una sum",25-07-2020 01:59,https://www.bing.com/th?id=ON.3940EEDCA934DDCF0A668616F9D89704,Chile,Noti Bomba
Honduras: Millonaria compra de equipo médico en mal estado y usado,https://notibomba.com/honduras-millonaria-compra-de-equipo-medico-en-mal-estado-y-usado/,"Aunque fueron siete los hospitales adquiridos por el monto de mil millones de lempiras, a Honduras solo han llegado dos, de los cuales se reveló que no cuentan con las condiciones de calidad para atender a los pacientes de Covid-19. El Misterio Público ...",25-07-2020 02:33,https://www.bing.com/th?id=ON.3940EEDCA934DDCF0A668616F9D89704,Chile,Noti Bomba
"Covid-19 hunde a más de 300,000 hondureños en la miseria",https://www.laprensa.hn/premium/1396477-410/covid-19-hunde-a-mas-de-300000-en-la-miseria-economia-coronavirus-pandemia,"San Pedro Sula, Honduras. Desde que el Gobierno de Honduras anunció el ... Hoy, a causa de las restricciones impuestas por el Gobierno para contener el covid-19, ellos integran el grupo de casi 2 millones que no tienen ni un pedazo de tortilla.",25-07-2020 13:23,https://www.bing.com/th?id=ON.3D80FF3D2043E0D259E821CD1C3F7DA7,Chile,La Prensa Chicos
Invest-H no aceptará productos de mala calidad o que no sean para pacientes con Covid-19,https://hondudiario.com/2020/07/25/invest-h-no-aceptara-productos-de-mala-calidad-o-que-no-sean-para-pacientes-con-covid-19/,"Inversión Estratégica de Honduras (Invest-H), informó que pedirá explicaciones al proveedor sobre el mal estado de los equipos médicos que componen los hospitales móviles adquiridos de Turquía. Aduana",25-07-2020 17:05,https://www.bing.com/th?id=ON.998D4975F00F6A2BA06EAC9ADAC74D65,Chile,Hondudiario
"Mipymes han desaparecido debido a la pandemia; transportistas reportan pérdidas millonarias, según empresarios",https://www.radiohrn.hn/mipymes-han-desaparecido-debido-a-la-pandemia-transportistas-reportan-perdidas-millonarias-segun-empresarios,"El retorno a la fase 1 de la reapertura de la economía en Honduras parece ser una realidad inminente, en un país donde la pandemia ha detenido la actividad económica causando estragos. Las empresas ha",25-07-2020 18:44,https://www.bing.com/th?id=ON.FF3F48921BC87685709C94961B46C23C,Chile,Radio HRN
Muere por covid-19 el periodista hondureño Edilberto Zelaya,https://www.elheraldo.hn/pais/1396559-466/muere-por-covid-19-el-periodista-hondure%C3%B1o-edilberto-zelaya,"TEGUCIGALPA, HONDURAS.-Otro periodista hondureño perdió la batalla contra el covid-19. José Edilberto Zelaya falleció este sábado en el Hospital Cardiopulmonar El Tórax. Hace una semana se informó que",25-07-2020 20:15,https://www.bing.com/th?id=ON.9362D1F0BD995B0FC19E9B5819B90C05,Chile,El Heraldo
Honduras registra 37.559 contagios y 1.061 muertos por COVID-19,https://www.latribuna.hn/2020/07/25/honduras-registra-37-559-contagios-y-1-061-muertos-por-covid-19/,"Los contagios con la COVID-19 en Honduras ascendieron este viernes a 37.559, mientras que los muertos a 1.061 desde que inició la pandemia, en marzo, informó el Sistema Nacional de Gestión de Riesgos",25-07-2020 20:34,https://www.bing.com/th?id=ON.EB6572C66E782C1A4680C1A21FAE1286,Chile,La Tribuna
Ñel Vega vence al Coronavirus,https://www.diariomas.hn/2020/07/25/nel-vega-vence-al-coronavirus/,"Después de varias semanas de estar interno en el Hospital María y el Polideportivo de la Universidad Autónoma de Honduras, salió recuperado del Covid-19 el mítico kinesiólogo de Motagua, Gustavo Busti",25-07-2020 20:50,https://www.bing.com/th?id=ON.022D232F7BE71BD99A450304A1845013,Chile,Mas
