name,url,description,datePublished,imagen,pais,Fuente
"Alianzas estratégicas entre actores locales, municipales y educativos",http://www.elsoldehonduras.com/educacion/alianzas-estrategicas-entre-actores-locales-municipales-y-educativos/,Las alianzas con actores de los municipios de Comayagua han fortalecido los procesos de enseñanza durante la pandemia de la COVID-19 informaron este día las autoridades de la Secretaría de Educación.,01-09-2020 00:32,https://www.bing.com/th?id=ON.B7A92A294DF1B658F95F65B7C63C07A2,Chile,El Sol de Honduras
COVID-19 en Honduras: 15 nuevos fallecimientos y 840 casos positivos por todo el país,https://www.diez.hn/coronavirus/1405213-441/covid-19-honduras-muertes-casos-positivos-balance-coronavirus-pandemia,"La cifra de muertos aumenta cada día y se acerca a los 1,900; hoy se reportaron contagios en los 18 departamentos. El Sistema Nacional de Gestión de Riesgos (SINAGER) confirmó este lunes, 31 de agosto",01-09-2020 03:33,https://www.bing.com/th?id=ON.3806B2A3A618AF7A5238C51F6A31BD39,Chile,diez.hn
"Honduras cierra agosto con total de 18,160 casos y 521 muertes por COVID-19",https://hondudiario.com/2020/08/31/honduras-cierra-agosto-con-18160-casos-y-521-muertes-por-covid-19/,"*** El octavo mes del año fue el segundo más mortal desde el comienzo de la pandemia a mediados de marzo. Tegucigalpa, Honduras. El Sistema Nacional de Gestión de Riesgos (Sinager), informó este lunes",01-09-2020 03:51,https://www.bing.com/th?id=ON.B82B5C68A7BCE23EA9935E3E49F1EA5B,Chile,Hondudiario
Honduras trabaja en una nueva política migratoria integral,https://hondudiario.com/2020/08/31/honduras-trabaja-en-una-nueva-politica-migratoria-integral/,"La directora del Instituto Nacional de Migración (INM), Carolina Menjivar, declaró este lunes que Honduras trabaja en la elaboración de una nueva política migratoria integral. La formulación de esta n",01-09-2020 03:51,https://www.bing.com/th?id=ON.DF876D09ECA611B245FF7D3E43B72B31,Chile,Hondudiario
Vigilan la formación de disturbio tropical,https://www.laprensa.hn/honduras/1405236-410/vigilan-la-formaci%C3%B3n-de-disturbio-tropical,"TEGUCIGALPA. Honduras inicia hoy su mes patrio, y el covid-19 no detendrá las actividades cívicas para celebrar los 199 años de independencia patria, aunque sí serán atípicas. Antes del inicio de sept",01-09-2020 06:46,https://www.bing.com/th?id=ON.E4F2484E6BEB1E350B59298B3E77F156,Chile,La Prensa Chicos
Honduras vive tiempos extraordinarios y la unidad es precisa: Camilo Atala,https://www.proceso.hn/honduras-vive-tiempos-extraordinarios-y-la-unidad-es-precisa-camilo-atala/,"Tegucigalpa – Sin duda lo que vive Honduras son tiempos extraordinarios por la pandemia del COVID-19 y los retos del futuro son complejos, pero el compromiso de la banca con la sociedad es firme en cu",01-09-2020 13:50,https://www.bing.com/th?id=ON.C3E804C040E8E8FF0749D143D4561744,Chile,Proceso
Medidas anticipadas fueron vitales para evitar males mayores con la pandemia de covid-19:Presidente Hernández,https://ultimahora.hn/?q=content/medidas-anticipadas-fueron-vitales-para-evitar-males-mayores-con-la-pandemia-de-covid,"Enviado por Editor 1 el Mar, 09/01/2020 - 08:53",01-09-2020 15:12,https://www.bing.com/th?id=ON.95B4527A56BFD26DC784E1416DE9364E,Chile,Ultima Hora
Ministra de Salud: Ocupación hospitalaria en Honduras bajó a 48%,https://www.latribuna.hn/2020/09/01/ministra-de-salud-ocupacion-hospitalaria-en-honduras-bajo-a-48/,"La ministra de Salud, Alba Consuelo Flores, destacó en las últimas horas que durante la fase de atención a la pandemia la ocupación hospitalaria bajó en las últimas semanas de 150 a 48 por ciento. Asi",01-09-2020 16:01,https://www.bing.com/th?id=ON.04575D8C32078C827D6EC67FBB8EFDB4,Chile,La Tribuna
Presidente Hernández: celebremos el 199 aniversario patrio bajo nueva realidad (Video),https://www.latribuna.hn/2020/09/01/presidente-hernandez-vamos-a-celebrar-este-199-aniversario-en-una-nueva-realidad/,"El Presidente de Honduras, Juan Orlando Hernández, en el marco del 199 aniversario patrio, hizo este martes un reconocimiento a los médicos y ciudadanos caídos por la pandemia del COVID-19, a quienes",01-09-2020 18:22,https://www.bing.com/th?id=ON.7870B063B2EBF2C5A5DB2529AFABC63D,Chile,La Tribuna
"Expertos sobre reactivación económica: Honduras necesita plan integral, giro en política fiscal y atención a grupos vulnerables",https://www.radiohrn.hn/expertos-sobre-reactivacion-economica-honduras-necesita-plan-integral-giro-en-politica-fiscal-y-atencion-a-grupos-vulnerables,"Un balance fiscal es una condición sin la cual no es posible tener orden en la hacienda hondureña, muy presionada por el alto endeudamiento y el gasto improductivo, además de la distribución inequitat",01-09-2020 18:48,https://www.bing.com/th?id=ON.76892A68CA144EB88E00F9693DAD2CAD,Chile,Radio HRN
Conozca la interpretación de las pruebas rápidas para detectar covid,https://www.radiohrn.hn/honduras-conozca-la-interpretacion-de-las-pruebas-rapidas-para-detectar-covid,"Los test de anticuerpos ofrecen claridad sobre si alguien se está recuperando del virus o es potencialmente infeccioso, si necesita tratamiento o aislamiento. El test de anticuerpos IgM e IgG es una d",01-09-2020 19:24,https://www.bing.com/th?id=ON.40A9479AB3C578EA795EF933D36F2EA2,Chile,Radio HRN
"Próximo viernes salen de Turquía dos hospitales móviles con destino a Honduras, informa Invest-H",https://www.proceso.hn/proximo-viernes-salen-de-turquia-dos-hospitales-moviles-con-destino-a-honduras-informa-invest-h/,"Tegucigalpa – La Comisión Interventora de Inversión Estratégica de Honduras (Invest-H), informó este martes que el próximo viernes 4 de septiembre, saldrán de Turquía otros dos hospitales móviles, de",01-09-2020 19:31,https://www.bing.com/th?id=ON.2836AC424AB83C6066F381CD76606714,Chile,Proceso
