name,url,description,datePublished,imagen,pais,Fuente
Honduras ha perdido unos 70 médicos y 38 enfermeras por la covid-19,https://www.radiohrn.hn/honduras-ha-perdido-unos-70-medicos-y-38-enfermeras-por-la-covid-19,La mayor incidencia de médicos y personal de enfermería muertos y contagiados con el SARS-CoV-2 se ha registrado en lo que va de este año,11-02-2021 05:11,https://www.bing.com/th?id=OVFT.lBXIMQZUj0ZPbMkgvVFIjy,Chile,Radio HRN
Honduras registra 862 contagios y 17 nuevas muertes por covid-19,https://www.laprensa.hn/honduras/1442082-410/honduras-coronavirus-contagios-fallecidos-recuperados,"Tegucigalpa, Honduras. Los contagios acumulados de covid-19 en Honduras desde marzo de 2020 suman 157,468, en tanto que los muertos 3,806, informó este miércoles el Sistema Naci",11-02-2021 15:00,https://www.bing.com/th?id=OVFT.0Ce3C9KaylqjlXHRYAjX1C,Chile,La Prensa Chicos
Honduras: hospitales reportan diez personas fallecidas bajo sospecha de la COVID-19,https://www.latribuna.hn/2021/02/11/honduras-hospitales-reportan-diez-personas-fallecidas-bajo-sospecha-de-la-covid-19/,Diez personas fallecieron en las últimas 24 horas bajo sospecha de COVID-19 en los diferentes hospitales del territorio hondureño. Las,11-02-2021 17:33,https://www.bing.com/th?id=OVFT.JfoWbGtDzWXcr11uKzf7by,Chile,La Tribuna
Javier Portillo ha retornado a los entrenamientos del Olimpia tras superar el covid-19,https://www.diez.hn/liganacionaldehonduras/1442164-498/javier-portillo-regreso-entrenamiento-olimpia-superar-covid,El lateral izquierdo merengue de 39 años realizó un ejercicio físico especial durante la sesión de este jueves.,11-02-2021 19:27,https://www.bing.com/th?id=OVFT.ZRxCU8y8SYV-cQz42MjChS,Chile,diez.hn
Gobierno promete vacuna de AstraZeneca para mayores de 65 años,https://hondudiario.com/2021/02/11/gobierno-promete-vacuna-de-astrazeneca-para-mayores-de-65-anos/,"El Gobierno aseguró que la vacuna de AstraZeneca contra el Covid-19 que llegará en los próximos días al país también será aplicada a las personas mayores de 65 años. Al respecto, el comisionado presid",11-02-2021 21:53,https://www.bing.com/th?id=OVFT.4i41H6O2PlSGNBb2ndzdMS,Chile,Hondudiario
"A 11 meses de su llegada, el covid-19 acabó con casi 4,000 vidas en Honduras",https://www.laprensa.hn/honduras/1442204-410/honduras-se-acerca-a-los-4000-muertos-1600-contagios-por-covid-honduras-coronavirus,Los casos de los dos primeros dos contagios fueron de dos mujeres que ingresaron al país el 4 y 5 de marzo de 2020 procedentes de España y Suiza.,11-02-2021 22:25,https://www.bing.com/th?id=OVFT.aoBebgoU0g65tRAAIk71WC,Chile,La Prensa Chicos
HONDURAS / SINDICALISTAS PIDEN AL RÉGIMEN ACCIÓN PARA CAMPESINOS DESAMPARADOS,http://www.web.ellibertador.hn/index.php/noticias/nacionales/2668-honduras-sindicalistas-piden-al-regimen-accion-para-campesinos-desamparados,"Tegucigalpa. El Sindicato de Trabajadores del Institución Nacional Agrario (Sitraina), ha emitido un pronunciamiento público para exigir al Gobierno de Honduras que dé la cara por los trabajadores que",11-02-2021 22:38,https://www.bing.com/th?id=OVFT.Aabm9KDCSp84agezpPzjHS,Chile,El Libertador
Despliegue de brigadas médicas en barrios y colonias de San Pedro Sula,http://www.eldiario.hn/despliegue-de-brigadas-medicas-en-barrios-y-colonias-de-san-pedro-sula/,"San Pedro Sula. - Las brigadas médicas ""Todos Contra el Covid-19"" de la Secretaría de Salud iniciaron este jueves su segundo despliegue en barrios y colonias de San Pedro Sula para contrarrestar la pr",12-02-2021 01:47,https://www.bing.com/th?id=OVFT.byf6_IWZp34RFnKkXTRiaS,Chile,El Diario
Honduras suma 32 muertes confirmadas por coronavirus y 27 están bajo sospecha,https://hondudiario.com/2021/02/11/honduras-suma-32-muertes-confirmadas-por-coronavirus-y-27-estan-bajo-sospecha/,"El Sistema Nacional de Gestión de Riesgos (Sinager), confirmó este jueves 887 nuevos casos de Covid-19, sumando así un total de 158,355 contagios a nivel nacional. De 3,116 pruebas PCR procesadas por",12-02-2021 03:44,https://www.bing.com/th?id=OVFT.8wmmTs1Bwr-lOltCY4Ye-C,Chile,Hondudiario
Más de 27 mil citas dio Fundación Teletón en el 2020,https://www.elheraldo.hn/pais/1441740-466/m%C3%A1s-de-27-mil-citas-dio-telet%C3%B3n-en-el-2020,La pandemia del covid-19 no fue un obstáculo para que las personas con diferentes tipos de discapacidad fueran atendidas en los Centros de Rehabilitación Integral Teletón (CRIT),12-02-2021 04:37,https://www.bing.com/th?id=OVFT.ODgoeY41dp6MEapxP4t9nC,Chile,El Heraldo
En próximos días llegarán vacunas contra el COVID-19,https://www.latribuna.hn/2021/02/12/en-proximos-dias-llegaran-vacunas-contra-el-covid-19/,"El Gobierno de la República aseguró que la vacuna de AstraZeneca contra el COVID-19, que llegará en los próximos días",12-02-2021 11:51,https://www.bing.com/th?id=OVFT.e7r66UlfY0TNOlaZlx3WNS,Chile,La Tribuna
Las vacunas como signos de desigualdad,https://www.elheraldo.hn/opinion/columnas/1442290-469/las-vacunas-como-signos-de-desigualdad,"Ocurrió una extraña coincidencia cuando la vida quiso llevarnos por Madrid: en la avenida Alberto Alcocer, una viejecita nos preguntó repentina: 'vosotros sabéis dónde está la call",12-02-2021 12:22,https://www.bing.com/th?id=OVFT.JA-9GP1wmfr3lItKi2PciS,Chile,El Heraldo
"COVID-19: Por alto índice de contagios, intervendrán cinco municipios de FM",https://tiempo.hn/municipios-intervenidos-covid/,"Los municipios tienen un 70 % de positividad de COVID-19. TEGUCIGALPA, HONDURAS. Miriam Aguilera, portavoz de Colegio de Microbiólogos de Honduras (CMH), informó que al menos cinco municipios de Franc",12-02-2021 13:52,https://www.bing.com/th?id=OVFT.2I_79NQ6veKEZQUCE_i0jC,Chile,Tiempo
"Imparable COVID-19 en Honduras | ¿Se circula por dígito hoy, viernes?",https://tiempo.hn/que-digito-circula-hoy-viernes-12/,"TEGUCIGALPA, HONDURAS. Para tratar de controlar el aumento de casos de la COVID-19 en el país, del Gobierno decidió prolongar las nuevas medidas de circulación, que se mantienen vigente durante la sem",12-02-2021 14:00,https://www.bing.com/th?id=OVFT.1gPmxGc2_wm9voFeQqSacS,Chile,Tiempo
BRIGADAS MÉDICAS HAN SALIDO A CORTAR CADENA DE TRANSMISIÓN DE COVID-19 EN TODO EL PAÍS,https://ultimahora.hn/brigadas-medicas-han-salido-a-cortar-cadena-de-transmision-de-covid-19-en-todo-el-pais/,Las brigadas médicas y los equipos de respuesta rápida de la Secretaría de Salud salieron hoy en su segundo despliegue a nivel nacional a buscar casos de coronavirus por todos los barrios y,12-02-2021 14:10,https://www.bing.com/th?id=OVFT.6TQn44iFcY467h5AtiQsnS,Chile,Ultima Hora
Cinco decesos por COVID registran hospitales de Tegucigalpa,https://proceso.hn/cinco-decesos-por-covid-registran-hospitales-de-tegucigalpa/,Al menos cinco personas fallecieron bajo sospecha de COVID-19 en las últimas horas en los hospitales de la capital Tegucigalpa.,12-02-2021 15:09,https://www.bing.com/th?id=OVFT.788LtOlh-T0jfO5of8nI9y,Chile,Proceso
Muere la abuela de la doctora Karen Tábora por COVID-19 en el occidente de Honduras,https://proceso.hn/muere-la-abuela-de-la-doctora-karen-tabora-por-covid-19-en-el-occidente-de-honduras/,Una muerte más se registra en la familia Tábora tras reportarse el fallecimiento de la abuela de la doctora Karen quien también murió por causa del COVID-19.,12-02-2021 15:20,https://www.bing.com/th?id=OVFT.qWFodti1EO93Y4dzojCdQS,Chile,Proceso
