name,url,description,datePublished,imagen,pais,Fuente
Un menor fallece bajo sospecha de COVID-19 en hospital sampedrano,https://proceso.hn/actualidad/7-actualidad/un-menor-fallece-bajo-sospecha-de-covid-19-en-hospital-sampedrano.html,"San Pedro Sula -Un menor de edad falleció en las últimas horas en el Hospital Mario Catarino Rivas de San Pedro Sula, norte de Honduras, bajo sospecha de COVID-19, se informó. De acuerdo a versiones d",21-08-2020 18:45,https://www.bing.com/th?id=OVFT.oN0mOFA6FLUAzS_aLBdany,Chile,Proceso
Disminuyen las muertes bajo sospechas de COVID en la capital; dos este viernes,https://hondudiario.com/2020/08/21/disminuyen-las-muertes-bajo-sospechas-de-covid-en-la-capital-una-este-viernes/,"El Hospital Escuela (HE) solo reporta una muerte bajo sospecha de COVID-19 este viernes, así como el Instituto Nacional  Cardiopulmonar del Tórax;  mientras que el Instituto Hondureños de Seguridad So",21-08-2020 19:29,https://www.bing.com/th?id=OVFT.bKxH_nxw7PLTo6oZSVcz0i,Chile,Hondudiario
Hay 55 % de positividad de COVID-19 en Honduras: Salud,https://www.proceso.hn/portadas/10-portada/hay-un-55-de-positividad-de-covid-19-en-honduras-secretaria-de-salud.html,"Tegucigalpa - La jefa de vigilancia epidemiológica de la Secretaría de Salud, Karla Pavón, reveló este viernes que hay un 55 por ciento de casos positivos de COVID-19 en Honduras. - Pavón indicó que m",21-08-2020 20:10,https://www.bing.com/th?id=OVFT.N8YKdYMDQ9iJQt-BQULPlS,Chile,Proceso
Para septiembre se proyecta la ampliación de la reapertura económica,https://www.elheraldo.hn/pais/1402800-466/reapertura-economia-honduras-cambios-septiembre,"TEGUCIGALPA, HONDURAS.-El Sistema Nacional de Gestión de Riesgos (Sinager) dio luz verde a la propuesta de la Mesa Multisectorial para la Apertura Económica y Social de avanzar en el proceso de reaper",21-08-2020 21:02,https://www.bing.com/th?id=OVFT.Xyn8a9352M_CangL-v8n7i,Chile,El Heraldo
Costa Rica convoca para microciclo y Panamá realiza pruebas de Covid-19 para concentrarse 40 días,https://www.diez.hn/centroamerica/1402925-498/costa-rica-realiza-convocatoria-microciclo-panama-hace-pruebas-covid19,"Las eliminatorias de Concacaf para el Mundial de Qatar 2022 están a la vuelta de la esquina para las selecciones centroamericanas; algunas comienzan en octubre, otras en junio del 2021 como Honduras,",21-08-2020 22:07,https://www.bing.com/th?id=OVFT.--mg0U0JDRuN-966yX-vYy,Chile,diez.hn
"Trump: Si Biden es electo, cárteles de la droga vendrán de Honduras, Guatemala, El Salvador",https://www.latribuna.hn/2020/08/21/trump-si-biden-es-electo-carteles-de-la-droga-vendran-de-honduras-guatemala-el-salvador/,"El presidente estadounidense, Donald Trump, intentó robar el protagonismo mediático a su rival demócrata, Joe Biden, quien la noche del jueves aceptó la nominación de su partido a la Casa Blanca, con",21-08-2020 22:31,https://www.bing.com/th?id=OVFT.dH-kbOV7Dxs5WWdtDFIMDi,Chile,La Tribuna
Presidente Hernández viaja a Gracias y realiza recorrido en centro de triaje,https://hondudiario.com/2020/08/21/presidente-hernandez-viaja-a-gracias-para-realizar-recorrido-en-su-centro-de-triaje/,"El presidente Juan Orlando Hernández recorrió este viernes el triaje de Gracias, Lempira, ubicado en la Casa de la Cultura, y con el que se pretende evitar la propagación del coronavirus, y por ende l",22-08-2020 00:20,https://www.bing.com/th?id=OVFT.CEErXb5fiY2J1Jgsx_-IEy,Chile,Hondudiario
"Coronavirus Honduras: Se superan los 53 mil infectados y más de 1,600 muertos por Covid-19",https://www.diez.hn/coronavirus/1403011-441/coronavirus-honduras-superan-53-mil-infectados-coronavirus-muertos,"Este viernes se reportó el fallecimiento de 13 compatriotas; 10 son del departamento de Cortés, 2 de Copán y uno de Comayagua. También hubo 189 recuperados Luego de realizar 1,453 pruebas, las autorid",22-08-2020 03:00,https://www.bing.com/th?id=OVFT.IdzLJjCTALFckLs1Jl4oty,Chile,diez.hn
Denuncian derechohabientes: Tardanza del IHSS en dar y pago de incapacidades,https://www.latribuna.hn/2020/08/22/denuncian-derechohabientes-tardanza-del-ihss-en-dar-y-pago-de-incapacidades/,"Los derechohabientes ahora denuncian que el IHSS les retrasa los pagos de las incapacidades hasta 60 días, ya después de pasar la enfermedad, les aceptan el documento 30 días después y de allí tienen",22-08-2020 11:06,https://www.bing.com/th?id=OVFT.AFvji8GegiDvJcMQdAsdii,Chile,La Tribuna
"En Honduras sí realizarán desfiles patrios este 2020 pese a pandemia, ¿cómo funcionará?",https://www.radiohrn.hn/en-honduras-si-realizaran-desfiles-patrios-este-2020-pese-a-pandemia-como-funcionara,"El viceministro de Educación Javier Menocal, confirmó el sábado a HRN que, si se desarrollarán los desfiles patrios este próximo 15 de septiembre. El viceministro de Educación Javier Menocal, confirmó",22-08-2020 14:19,https://www.bing.com/th?id=OVFT.cwOBb_r_5l_dZQYx_x75KC,Chile,Radio HRN
Auditoría del TSC retrasa judicilización de casos de corrupción,https://www.elheraldo.hn/pais/1403028-466/auditor%C3%ADa-del-tsc-retrasa-judicilizaci%C3%B3n-de-casos-de-corrupci%C3%B3n,"TEGUCIGALPA, HONDURAS.-El retraso en la auditoría especial que realiza el Tribunal Superior de Cuentas (TSC), por las millonarias compras ejecutadas durante la pandemia, obstaculizan al Ministerio Púb",22-08-2020 15:41,https://www.bing.com/th?id=OVFT.Al78BLx_Ry5Rslim8h9PIS,Chile,El Heraldo
Muere por COVID-19 el médico hondureño Héctor Raúl Gómez,https://www.laprensa.hn/honduras/1403102-410/muere-el-medico-hector-raul-gomez-ihss-tegucigalpa-covid-coronavirus,"El galeno falleció en el IHSS de Tegucigalpa. Hasta el momento, ya suman 40 los médicos fallecidos a causa de la pandemia. Tegucigalpa, Honduras. Un médico más perdió la vida en Honduras a causa del C",22-08-2020 19:05,https://www.bing.com/th?id=OVFT.-CcfGNfsXYbd33Wq3qm1cC,Chile,La Prensa Chicos
"Hondureños y extranjeros deberán presentar prueba negativa de covid, antes de ingresar a Roatán",https://www.radiohrn.hn/hondurenos-y-extranjeros-deberan-presentar-prueba-negativa-de-covid-antes-de-ingresar-a-roatan,"La medida es con el objetivo de evitar la propagación del mortal virus que ya deja casi los 54 mil contagiados en Honduras. El regidor municipal, Raymund Cherington, comunicó que están solicitando al",22-08-2020 20:01,https://www.bing.com/th?id=OVFT.DL6rMmSKK4J0PYNyqyF1Iy,Chile,Radio HRN
Honduras reabre turismo en una primera fase tras más de cinco meses de cierre,https://www.laprensa.hn/honduras/1403148-410/honduras-turismo-reapertura-cierre-pandemia-,"Esas empresas volverán a recibir visitantes nacionales y extranjeros después de más de cinco meses de cierre del sector turismo. Tegucigalpa, Honduras Honduras inició este sábado una reapertura gradua",22-08-2020 22:29,https://www.bing.com/th?id=OVFT.lBR84DCgXvO-do79O8MgWi,Chile,La Prensa Chicos
