name,url,description,datePublished,imagen,pais,Fuente
"Más de 46,000 licencias han decomisado a nivel nacional desde que inició la pandemia",https://www.laprensa.hn/honduras/1399146-410/miles-licencias-decomisadas-nivel-nacional-inicios-pandemia-covid,"La Policía reportó hasta la fecha el decomiso de 46,247 licencias de conducir por diversas faltas de tránsito en todo el territorio hondureño desde inicios de la pandemia del COVID-19. A través de pat",05-08-2020 00:00,https://www.bing.com/th?id=ON.D8789E0D1012A07128363CDF0BD56D68,Chile,La Prensa Chicos
"Muere el reconocido doctor Obdulio García, víctima del Covid-19",https://www.laprensa.hn/honduras/1399123-410/muere-reconocido-doctor-obdulio-garc%C3%ADa-covid19-seguro-social,Otro doctor murió este miércoles tras perder la batalla contra el coronavirus Covid-19. En las salas del Instituto Hondureño de Seguridad Social (IHSS) de San Pedro Sula murió este día el médico Obdul,05-08-2020 00:00,https://www.bing.com/th?id=ON.443F3BE62218B7E21FF03F1FC4CF85F3,Chile,La Prensa Chicos
Taiwán dona 10 ambulancias y equipos médicos,https://www.elheraldo.hn/pais/1398903-466/taiw%C3%A1n-dona-10-ambulancias-y-equipos-m%C3%A9dicos,"Donación a la Sesal está valorada en 2.5 millones de lempiras y consta de ambulancias, vehículos y equipo de rayos X TEGUCIGALPA, HONDURAS.-El gobierno de China (Taiwán) donó ayer a la Secretaría de S",05-08-2020 14:41,https://www.bing.com/th?id=ON.83F4CDB0452162007A42FDCAFC6AF2DC,Chile,El Heraldo
Zidane los borra por completo: La convocatoria del Real Madrid para enfrentar al Manchester City,https://www.diez.hn/championsleague/1398975-498/real-madrid-convocatoria-manchester-city-champions-zidane-borra-james-bale,Zinedine Zidane ha dado a conocer hoy la lista de convocados para el partido del viernes ante el Manchester City por la vuelta de los octavos de final de la Champions Zidane ha dado a conocer la lista,05-08-2020 15:37,https://www.bing.com/th?id=ON.4167E31EE94F6B8B5BD1BE4CB55A74C7,Chile,diez.hn
"Mel Zelaya: La pandemia no ha sido manejada como el pueblo lo esperaba, hay mucha corrupción",https://www.radiohrn.hn/expresidente-honduras-manuel-zelaya-la-pandemia-no-ha-sido-manejada-como-el-pueblo-lo-esperaba-hay-mucha-corrupcion,"Además, el expresidente de Honduras dijo que la sabiduría del pueblo debería acompañar a los gobernantes de este país, “pero no ocurre así"". La emergencia del covid-19 en el país no ha sido manejada c",05-08-2020 17:03,https://www.bing.com/th?id=ON.44C98496FAB5D48B90D7B2BB91F98395,Chile,Radio HRN
Honduras: Hospitales reportan 20 decesos con sospecha de COVID-19,https://www.latribuna.hn/2020/08/05/honduras-hospitales-reportan-20-decesos-con-sospecha-de-covid-19/,"Los hospitales de Honduras reportan este miércoles el deceso de 20 personas con sospecha de COVID, en las últimas 24 horas. La portavoz del Hospital de Especialidades del Seguro Social, Ana Lourdes Ba",05-08-2020 19:43,https://www.bing.com/th?id=ON.0975773DDF99663FDEF40271F0BB0CBD,Chile,La Tribuna
"Mariano Acevedo: ""Jugando al fútbol compramos tierras, sembramos palma y está saliendo la sal para el huevo""",https://www.diez.hn/liganacionaldehonduras/1399098-498/mariano-acevedo-jugando-al-f%C3%BAtbol-compramos-tierras-sembramos-palma-y-est%C3%A1-saliendo,"Desde la comunidad de 36 Guaymas, El Progreso, el ex del Marathón, Olimpia y Honduras Progreso, sostuvo un mano a mano con DIEZ en Live en YouTube y Facebook para contar cómo es un día en su vida lejo",05-08-2020 22:17,https://www.bing.com/th?id=ON.14DF2EF89CACD074865C41FA11FE6ED6,Chile,diez.hn
En las últimas horas dos médicos fallecen por sospecha de COVID-19,https://elpatriota.hn/2020/08/05/en-las-ultimas-horas-dos-medicos-fallecen-por-sospecha-de-covid-19/,"TEGUCIGALPA,HONDURAS. El Colegio Médico sigue poniendo los muertos por el coronavirus, mientras trabajan en salvar vidas en los diferentes centros asistenciales de Honduras. Se trata del doctor Pablo",05-08-2020 22:45,https://www.bing.com/th?id=ON.9F2971E833481254253047FB3F87D467,Chile,El Patriota
Microbiólogo contesta a Ebal Díaz: “Entre 5 mil a 6 pruebas de covid sin procesar por falta de insumos,https://elpatriota.hn/2020/08/05/microbiologo-contesta-a-ebal-diaz-entre-5-mil-a-6-pruebas-de-covid-sin-procesar-por-falta-de-insumos/,"TEGUCIGALPA,HONDURAS. Indignado el presidente del Colegio de Microbiólogos de Honduras, Marco Moncada, ante la exigencia del secretario de la presidencia, Ebal Díaz, de aumentar la capacidad de proces",05-08-2020 23:01,https://www.bing.com/th?id=ON.D26D4BAAAC3B32FD28AFE4A34B18746E,Chile,El Patriota
El enfoque de la UE para la recuperación verde después del Covid-19,https://www.latribuna.hn/2020/08/05/el-enfoque-de-la-ue-para-la-recuperacion-verde-despues-del-covid-19/,"A medida que el mundo se enfrenta al brote de la pandemia de Covid-19 y comienza a prepararse gradualmente para hacer frente a sus impactos a largo plazo, los gobiernos y las sociedades deberían tomar",05-08-2020 23:46,https://www.bing.com/th?id=ON.455BC1DB2ADC302431A24FD0AC668C27,Chile,La Tribuna
La pandemia de coronavirus ya dejó más de 700.000 muertos en todo el mundo,https://hondudiario.com/2020/08/05/la-pandemia-de-coronavirus-ya-dejo-mas-de-700-000-muertos-en-todo-el-mundo/,"La pandemia del nuevo coronavirus ha dejado más de 700.000 muertos en el mundo, desde su aparición en China en diciembre, según un recuento de la AFP realizado este miércoles a las 06H55 GMT en base a",06-08-2020 01:03,https://www.bing.com/th?id=ON.7C797085CC41C5A9886B70BD00076A53,Chile,Hondudiario
En caravana trasladan cuerpo de diputado de Libre Francisco Paz a El Paraíso,https://proceso.hn/component/k2/38-politica-nacional/en-caravana-trasladan-cuerpo-de-diputado-de-libre-francisco-paz-a-el-paraiso.html,"Tegucigalpa- Tras perder la batalla contra el COVID-19, la mañana de este miércoles fue entregado el cuerpo del diputado del Congreso Nacional por el partido Libertad y Refundación (Libre), Francisco",06-08-2020 01:54,https://www.bing.com/th?id=ON.914ADCCE32379548692B5CE622796BD4,Chile,Proceso
Avanza desembalaje e instalación de hospitales móviles,https://hondudiario.com/2020/08/05/avanza-desembalaje-e-instalacion-de-hospitales-moviles/,"Inversión Estratégica de Honduras (Invest-H) informó en las últimas horas que este miércoles se ha iniciado el proceso de desembalaje e instalación de los diferentes sistemas, los muebles médicos y no",06-08-2020 03:34,https://www.bing.com/th?id=ON.2B1465169E3491C6DBA598ACE99B985B,Chile,Hondudiario
