name,url,description,datePublished,imagen,pais,Fuente
CESAL reporta incremento del 22% en la mortalidad por COVID-19 en Honduras,https://www.latribuna.hn/2021/01/15/cesal-reporta-incremento-del-22-en-la-mortalidad-por-covid-19-en-honduras/,"La mortalidad de casos por COVID-19 ha incrementado en un 22% en algunas regiones del país, en las primeras semanas del año, así lo informó, Henry Andino, consultor de la Unidad de Vigilancia de la Sa",15-01-2021 19:09,https://www.bing.com/th?id=OVFT.cTN_nOV1jjLvqgKMjtNKoy,Chile,La Tribuna
El mundo superó los dos millones de muertos por COVID-19,https://hondudiario.com/2021/01/15/el-mundo-supero-los-dos-millones-de-muertos-por-covid-19/,"La cifra mundial de muertos por COVID-19 superó los dos millones este viernes, cruzando el umbral en medio de un despliegue de vacunas tan inmenso, pero tan desigual, que mientras en algunos países ha",15-01-2021 20:42,https://www.bing.com/th?id=OVFT.LTamUMSOg1ZjupHtXK--CS,Chile,Hondudiario
CESAL: Letalidad por COVID-19 aumentó un 22 % en Honduras,https://tiempo.hn/cesal-letalidad-covid-19-aumento-22-honduras/,"TEGUCIGALPA, HONDURAS. Henry Andino, consultor de la Cooperación para el Desarrollo y Acción Social e Inmigración (CESAL), detalló que las muertes por COVID-19 en Honduras han aumentado en un 22 %. De",16-01-2021 05:09,https://www.bing.com/th?id=OVFT.Tdv_UaCd1NdkppTMsjyMkC,Chile,Tiempo
Presidente del CMH: 51 microbiólogos vencen al COVID-19,https://www.latribuna.hn/2021/01/16/presidente-del-cmh-51-microbiologos-vencen-al-covid-19/,"Unos 51 microbiólogos han vencido al COVID-19 y ya se reincorporaron de nuevo a sus labores a nivel nacional. Así lo informó el presidente del Colegio de Microbiólogos de Honduras (CMH), Marco Moncada",16-01-2021 07:40,https://www.bing.com/th?id=OVFT.k1uV803AOM9u_ownmIJYSi,Chile,La Tribuna
Honduras ya está lista para recibir y almacenar la vacuna contra el Covid-19,https://www.vtv.com.hn/noticia/honduras-ya-esta-lista-para-recibir-y-almacenar-la-vacuna-contra-el-covid-19/,"El gobierno a través de la representante de Honduras ante la alianza GAVI, en las próximas horas le hará la formal petición a COVAX, para que gestione él envió de las primeras dosis de la vacuna contr",16-01-2021 09:11,https://www.bing.com/th?id=OVFT.fvs2GudMYvQeOh02i6RMqi,Chile,VTV
HOSPITAL LEONARDO MARTÍNEZ AMPLIARÁ SALA COVID CON DONACIÓN DE INSUMOS Y 50 CAMAS DE LA FUNDACIÓN MANOS AYUDANDO A HONDURAS,https://ultimahora.hn/hospital-leonardo-martinez-ampliara-sala-covid-con-donacion-de-insumos-y-50-camas-de-la-fundacion-manos-ayudando-a-honduras/,"El Hospital Leonardo Martínez, de San Pedro Sula, recibió este viernes una donación de insumos hospitalarios de parte de la Fundación Manos Ayudando a Honduras, los que incluyen 50 camas para la",16-01-2021 14:02,https://www.bing.com/th?id=OVFT.yKhuDwhDH6VqBQD1yAyBVy,Chile,Ultima Hora
Multitudinaria caravana de migrantes hondureños ingresó a Guatemala y sigue su travesía,https://hondudiario.com/2021/01/16/multitudinaria-caravana-de-migrantes-hondurenos-ingreso-a-guatemala-y-sigue-su-travesia/,"Los miles de hondureños que forman parte de la caravana de migrantes, ingresaron la noche del viernes a Guatemala a través de la frontera de El Florido, en su intento por llegar hasta Estados Unidos.",16-01-2021 14:45,https://www.bing.com/th?id=OVFT.HzwdxNboAnLbsB_wY59sXS,Chile,Hondudiario
51 microbiólogos vencen el COVID-19 y no reportan nuevos casos en 2021,https://tiempo.hn/microbiologos-vencen-covid-19-no-nuevos-casos/,"51 profesionales de microbiología han logrado vencer el COVID-19, así lo detalló el presidente del Colegio de Microbiólogos, Marco Moncada.",16-01-2021 20:30,https://www.bing.com/th?id=OVFT.mPTFcVT7VuGjpTqbI1WcmC,Chile,Tiempo
Olimpia cerró filas en el Morazán entrenando a la hora del partido de este domingo y con equipo completo,https://www.diez.hn/liganacionaldehonduras/1436173-498/olimpia-cerro-filas-estadio-morazan-entrenando-final-marathon-yankel,"El equipo de Pedro Troglio está tranquilo en San Pedro Sula, solo esperando la hora del choque para definir el campeón frente a Marathón este domingo en el Yankel Rosenthal",16-01-2021 21:01,https://www.bing.com/th?id=OVFT.dGziVzHQeSRzJaz3AlLi4y,Chile,diez.hn
Así ve el mundo la caravana migrante que salió de Honduras,https://www.elheraldo.hn/minisitios/hondurenosenelmundo/1436180-471/caravana-migrante-honduras-2021-guatemala-mexico-biden-trump,"Los publicaciones de los medios internacionales destacan el largo camino, los innumerables retos que les esperan y sus dolorosos relatos",16-01-2021 22:53,https://www.bing.com/th?id=OVFT.AgztwH09JmH8glu0D_0y_y,Chile,El Heraldo
Teófimo López: “El que quiera ser el rey del boxeo tendrá que vencerme”,https://www.laprensa.hn/deportes/1436215-410/teofimo-lopez-entrevista-honduras-frustrado-covid-19-rey-boxeo-esposa-tyson-mayweather,El boxeador revela que se siente frustrado porque debido al COVID-19 no ha podido venir a celebrar sus títulos mundiales a Honduras.,17-01-2021 00:35,https://www.bing.com/th?id=OVFT.AUNla7bxoDYUDhZ5ynB0XC,Chile,La Prensa Chicos
Se triplican las atenciones por covid-19 en el triaje de Villanueva,https://www.laprensa.hn/honduras/1435790-410/honduras-triplican-atenciones-covid-19-triaje-villanueva,"A pesar de que los atenciones por covid-19 se han triplicado en el municipio ... de la Agencia de los Estados Unidos para el Desarrollo Internacional (Usaid) y Goal Honduras, entregaron un donativo valorado en aproximadamente 400,000 lempiras, que consiste ...",17-01-2021 01:34,https://www.bing.com/th?id=OVFT.Lsr0qECGvxiKL0ZWoK_sai,Chile,La Prensa Chicos
"Sin registrar recuperados, Honduras llega a 133,507 contagiados por COVID-19",https://proceso.hn/sin-registrar-recuperados-honduras-llega-a-133507-contagiados-por-covid-19/,"El reporte brindado por Sinager señala que este día no se registró pacientes recuperados, por lo tanto, la cifra total de personas que vencieron la COVID-19 permanece en 60 ml 056.",17-01-2021 03:29,https://www.bing.com/th?id=OVFT.nJQmowiLOGdlAHsmeVMAeS,Chile,Proceso
