name,url,description,datePublished,imagen,pais,Fuente
Se reporta el primer alcalde con coronavirus en Honduras,https://radiohrn.hn/se-reporta-el-primer-alcalde-con-coronavirus-en-honduras/,"Luis Guerra, es el primer alcalde con coronavirus en Honduras. En Honduras se contabilizan mil 771 (1,771) casos de coronavirus, de los cuales uno es el alcalde de Langue en el departamento de Valle,",09-05-2020 21:27,https://www.bing.com/th?id=ON.C81D6C7B1726547E93F5AEB9DB632E4A,Chile,Radio HRN
A revisión últimas estadísticas de COVID-19 en Honduras por repetición en casos de pacientes,https://www.proceso.hn/actualidad/7-actualidad/a-revision-ultimas-estadisticas-de-covid-19-en-honduras-por-similitud-en-casos-de-pacientes.html,"Tegucigalpa - Luego que se reportaran una serie de similitudes en los casos de pacientes positivos de COVID-19, las autoridades hondureñas informaron que las estadísticas sobre este tema están en revi",09-05-2020 22:50,https://www.bing.com/th?id=ON.3BD3C2592297C1506FEAEB9067D36E66,Chile,Proceso
Árbitro hondureño se dedica a la agricultura en tiempo de pandemia de coronavirus,https://www.diez.hn/liganacionaldehonduras/1378646-498/carlos-darinel-martinez-arbitro-hondureno-agricultura-pandemia-coronavirus,"Carlos Darinel Martínez ha dejado el pito y las tarjetas, ahora se está dedicando a la cosecha de piñas, frijoles, maíz y también a la pesca. Lo que bien se aprende nunca se olvida. Es lo que está pon",09-05-2020 23:19,https://www.bing.com/th?id=ON.BB8A1F74472FB32AD173C3447FF452EF,Chile,diez.hn
Honduras extiende la alerta roja hasta el 17 de mayo por la COVID-19,https://www.laprensa.hn/honduras/1378793-410/honduras-coronavirus-alerta-roja-covid-19-departamentos-pandemia-copeco,"Las autoridades de Honduras extendieron este domingo la alerta roja hasta el próximo 17 de mayo a causa de la pandemia del COVID-19, enfermedad de la que el país centroamericano registra más de 1,800",10-05-2020 00:00,https://www.bing.com/th?id=ON.B86D91DC12D2186C439C99AE44FB00D5,Chile,La Prensa Chicos
"Honduras: 142 nuevos contagios; suma se eleva a 1,972 casos",https://www.laprensa.hn/especiales/coronavirus/1378852-410/covid-honduras-142-nuevos-contagios-1972-casos,Sinager informó que no se reportan muertes por esta enfermedad. Tegucigalpa. Honduras registró este domingo 142 nuevos contagios de coronavirus tras 442 pruebas realizadas. Los contagios se elevan a 1,10-05-2020 00:00,https://www.bing.com/th?id=ON.84655B0B6475AFE9854C426A61FC800C,Chile,La Prensa Chicos
Extienden hasta el 17 mayo toque de queda en Honduras,https://www.latribuna.hn/2020/05/10/extienden-hasta-el-17-mayo-toque-de-queda-en-honduras/,"El Sistema Nacional de Gestión de Riesgos (Sinager) a solicitud de la Secretaría de Salud, determinó este domingo extender, hasta el 17 de mayo, la alerta roja para los 18 departamentos de Honduras a",10-05-2020 19:42,https://www.bing.com/th?id=ON.B571C4E77FA46CDE9A3C1E6BEE0A1DCA,Chile,La Tribuna
Las madres reciben el 38% de remesas en Honduras,https://www.elheraldo.hn/economia/1378675-466/las-madres-reciben-el-38-de-remesas-en-honduras,"Los hondureños que radican en el extranjero envían un 16% a los hermanos, 12.5% a hijos y 12.9% a cónyugues TEGUCIGALPA, HONDURAS.-Como una muestra de amor y apoyo, los hondureños que han migrado del",11-05-2020 00:11,https://www.bing.com/th?id=ON.EB663A7674545CFE47B85AA6C9E1B870,Chile,El Heraldo
"Aplicar más pruebas, clave en lucha contra coronavirus en Honduras",https://www.elheraldo.hn/pais/1378689-466/aplicar-m%C3%A1s-pruebas-clave-en-lucha-contra-coronavirus-en-honduras,La falta de control del Covid-19 también se ha debido por la poca conciencia ciudadana y el incumplimiento de las medidas de bioseguridad a 56 días de haberse decretado la cuarentena en el país TEGUCI,11-05-2020 00:11,https://www.bing.com/th?id=ON.8256C07F6FBAF332A0121B6A1599E9C5,Chile,El Heraldo
"Nuevas medidas de circulación para Cortés, El Progreso, Yoro, y Las Vegas, Santa Bárbara",https://www.diez.hn/coronavirus/1378858-441/nuevas-medidas-circulacion-cortes-el-progreso-yoro-las-vegas-santa-barbara,"El departamento de Cortés, El Progreso, Yoro, y Las Vegas, Santa Bárbara, podrán salir esta semana según el último número de circulación de identidad. La Secretaría de Estado en el Despacho de Segurid",11-05-2020 01:21,https://www.bing.com/th?id=ON.267D2BC911B93D94CDBF609BBEFA442B,Chile,diez.hn
Desigualdades sociales y COVID-19 en Honduras,https://www.latribuna.hn/2020/05/11/desigualdades-sociales-y-covid-19-en-honduras/,"A nuestra pobreza de origen estructural ahora se le suma la COVID-19, una pandemia del siglo XXI, que ataca el aparato respiratorio de los hondureños y hondureñas. Tales aparatos respiratorios no func",11-05-2020 06:41,https://www.bing.com/th?id=ON.F0B5481E22A1A5AA73BA1D7266103FC6,Chile,La Tribuna
Honduras se acerca a los 2.000 casos de Covid-19 y la alerta sigue,https://hondudiario.com/2020/05/10/sinager-confirmo-142-casos-mas-positivos-de-coronavirus-rosando-los-dos-mil-el-total/,"El Gobierno de la República de Honduras, a través del Sistema Nacional de Gestión de Riesgos (Sinager), informó que realizaron 432 nuevas pruebas para diagnosticar coronavirus, de las cuales 142 diero",11-05-2020 07:04,https://www.bing.com/th?id=ON.17D10B868B71E1AED886F6B83D66BCF5,Chile,Hondudiario
"Coronavirus: Honduras se aproxima a los 2,000 contagios de covid-19",https://radiohrn.hn/coronavirus-honduras-se-aproxima-a-los-2000-contagios-de-covid-19/,"Honduras registró el 10 de mayo, mil 972 (1,972) personas contagiadas de coronavirus y confirmó 108 víctimas mortales por la enfermedad. Honduras, a través del Sistema Nacional de Gestión de Riesgos (",11-05-2020 13:09,https://www.bing.com/th?id=ON.AAF6F89735170BE69AFFD8C59EAC2E38,Chile,Radio HRN
