name,url,description,datePublished,imagen,pais,Fuente
Honduras: Cerca de 54.000 contagios por COVID-19 y 1.643 muertos,https://www.latribuna.hn/2020/08/22/honduras-cerca-de-54-000-contagios-por-covid-19-y-1-643-muertos/,"La cifra de contagios en Honduras por la COVID-19 ascendió este sábado a 53.983, desde marzo, en tanto que los fallecidos ya suman 1.643, informó el estatal Sistema Nacional de Gestión de Riesgos (Sin",22-08-2020 09:37,https://www.bing.com/th?id=ON.53A719723445626A8D3F9F09BA18F89E,Chile,La Tribuna
UPNFM realiza las pruebas covid-19 a sus jugadores y se alista para arrancar el lunes sus trabajos,https://www.diez.hn/liganacionaldehonduras/1403062-498/upnfm-pruebas-covid-19-jugadores-trabajos-pretemporada-apertura-2020-salomon-nazar,La UPNFM se inscribió en Liga Nacional y ya realizó las pruebas PCR a sus jugadores y cuerpo técnico. La pretemporada inicia el lunes a las 7:00am. Luego de cumplir con la inscripción en Liga Nacional,22-08-2020 14:09,https://www.bing.com/th?id=ON.A275BDD042C4667C807B5D92092D337A,Chile,diez.hn
PMA instalará en Honduras corredor humanitario para CA,https://www.latribuna.hn/2020/08/22/pma-instalara-en-honduras-corredor-humanitario-para-ca/,"Honduras y el Programa Mundial de Alimentos (PMA) suscribieron un convenio para que en el país se instale un corredor humanitario de la agencia de Naciones Unidas, con el propósito de ampliar su asist",22-08-2020 21:33,https://www.bing.com/th?id=ON.CB038E3A545CC99BD19757756112BC70,Chile,La Tribuna
Honduras reabre turismo en una primera fase tras más de cinco meses de cierre,https://www.laprensa.hn/honduras/1403148-410/honduras-turismo-reapertura-cierre-pandemia-,"Esas empresas volverán a recibir visitantes nacionales y extranjeros después de más de cinco meses de cierre del sector turismo. Tegucigalpa, Honduras Honduras inició este sábado una reapertura gradua",22-08-2020 22:44,https://www.bing.com/th?id=ON.29EEBA43F6DBE2364697359063FD88FD,Chile,La Prensa Chicos
Factura petrolera de Honduras disminuye 40% en primer semestre por Covid-19,https://www.laprensa.hn/economia/1403324-410/factura-petrolera-honduras-disminuye-covid19,"La reducción obedece a la caída en el precio internacional del petróleo. Tegucigalpa. Honduras pagó en el primer semestre de este año 472,4 millones de dólares por las importaciones petroleras, 40 % m",23-08-2020 00:00,https://www.bing.com/th?id=ON.2252DF3FAFD27046A58F4B59FA9FC63B,Chile,La Prensa Chicos
"Covid-19 en Centroamérica: altas cifras, luchas de poder y economías laceradas",https://www.elheraldo.hn/mundo/1403267-466/covid-19-centroamerica-honduras-guatemala-salvador-economia,"TEGUCIGALPA, HONDURAS.-Centroamérica es una de las regiones más afectadas por el covid-19 en el mundo. El corazón de América reporta hasta este domingo 269,959 casos del virus desde que la crisis come",23-08-2020 19:40,https://www.bing.com/th?id=ON.1C8205F4C5504BE179EF757DA0930B06,Chile,El Heraldo
Honduras suma 602 nuevos contagios y 11 muertes más por COVID-19,https://hondudiario.com/2020/08/22/honduras-suma-602-nuevos-contagios-y-11-nuevas-muertes-de-covid-19/,"El Sistema Nacional de Gestión de Riesgos (Sinager), confirmó 602 casos nuevos de COVID-19 este sábado, de 1,378 pruebas procesadas, para un total de contagios en todo el país. De igual forma, reportó",23-08-2020 20:24,https://www.bing.com/th?id=ON.C54ECD153BB1FF85115CFBEA03B95B60,Chile,Hondudiario
Cardenal Rodríguez recuerda que Dios está con Honduras pese a la pandemia,https://hondudiario.com/2020/08/23/cardenal-rodriguez-recuerda-que-dios-esta-con-honduras-pese-a-la-pandemia/,"El cardenal Óscar Andrés Rodríguez, aseguró este domingo durante la homilía celebrada en la Basílica Menor de Suyapa, que Dios sigue con Honduras pese a la pandemia del COVID-19 que atraviesa. “El Señ",23-08-2020 20:24,https://www.bing.com/th?id=ON.E246545BBB966923CABBA524C3357617,Chile,Hondudiario
