name,url,description,datePublished,imagen,pais,Fuente
Informe de OACNUDH resalta avances de Honduras en respeto a garantía de los derechos humanos,http://www.elsoldehonduras.com/nacionales/informe-de-oacnudh-resalta-avances-de-honduras-en-respeto-a-garantia-de-los-derechos-humanos/,"La Oficina de la Alta Comisionada de las Naciones Unidas para los Derechos Humanos en Honduras (OACNUDH) presentó este miércoles su informe anual, en el cual resalta importantes avances de Honduras en",11-03-2021 18:38,https://www.bing.com/th?id=OVFT.S92SHus3eZQEREGXAMussi,Chile,El Sol de Honduras
"BCIE aprueba a Honduras, $35 millones para la adquisición de vacunas contra el COVID-19",https://www.latribuna.hn/2021/03/11/bcie-aprueba-a-honduras-35-millones-para-la-adquisicion-de-vacunas-contra-el-covid-19/,El Banco Centroamericano de Integración Económica (BCIE) aprobó hoy a la República de Honduras un financiamiento por US$35 millones para,11-03-2021 20:28,https://www.bing.com/th?id=OVFT.XBY-wKATeODIOt_Z9cAgyy,Chile,La Tribuna
Honduras cumple un año de la pandemia con repunte de casos y lenta vacunación,https://www.radiohrn.hn/honduras-cumple-un-ano-de-la-pandemia-con-repunte-de-casos-y-lenta-vacunacion,"A un año de la confirmación de los primeros dos contagiados detectados con covid-19, Honduras roza los 180 mil positivos y 4 mil 500 muertes acumuladas, mientras el proceso de vacunación marcha lento,",12-03-2021 00:35,https://www.bing.com/th?id=OVFT.e9Wkc7UgAneLbPrWZ0BSoC,Chile,Radio HRN
"Los casos de COVID-19 ascienden a 176,427 con 985 nuevos contagios",https://www.latribuna.hn/2021/03/11/los-casos-de-covid-19-ascienden-a-176427-con-985-nuevos-contagios/,"Los casos de COVID-19 en Honduras se elevaron a 176,427 desde el inicio de la pandemia con la confirmación de otros 985 contagios, mientras que los pacientes recuperados aumentaron a 68,500, informó el Sistema Nacional de Gestión de Riesgos (Sinager).",12-03-2021 04:00,https://www.bing.com/th?id=OVFT.Y1pcAmXLZK6cnZtR0_15iy,Chile,La Tribuna
Gobierno lanza Expo Turismo 2021 con motivo del feriado de Semana Santa,http://www.elsoldehonduras.com/turismo/gobierno-lanza-expo-turismo-2021-con-motivo-del-feriado-de-semana-santa/,"Con motivo del feriado de la Semana Santa y de la temporada de verano, el Gobierno de la República lanzó este martes la Expo Turismo 2021 a través de la Secretaría de Turismo con apoyo de la Cámara Na",12-03-2021 07:29,https://www.bing.com/th?id=OVFT.dVNnzClg0WGJiUKiICIKei,Chile,El Sol de Honduras
Embarazadas con Covid-19 en Honduras piden a gritos que médicos salven a sus bebés,https://www.laprensa.hn/premium/1448783-410/honduras-pandemia-covid-coronavirus-embarazo-muertes-casos,Expertos aseguran que el coronavirus en las embarazadas de 28 a 30 semanas de gestación pone en alto riesgo la vida de ambos.,12-03-2021 10:22,https://www.bing.com/th?id=OVFT.wfex16giZnGla4SRjd9DDi,Chile,La Prensa Chicos
"COVID-19: Restricciones continúan, ¿Qué dígitos circulan hoy viernes?",https://tiempo.hn/que-digitos-circulas-hoy-viernes/,"TEGUCIGALPA-HONDURAS. Obviando el aumento descomunal de casos de COVID-19 en Honduras, las autoridades de la Secretaría de Seguridad determinaron que hoy, viernes, 12 de marzo, todos los ciudadanos, s",12-03-2021 13:29,https://www.bing.com/th?id=OVFT.bGej0tj8nj8rOsOJo655Hy,Chile,Tiempo
Próximo martes continuará vacunación anticovid con dosis donadas por Covax,https://hondudiario.com/2021/03/12/proximo-martes-continuara-vacunacion-anticovid-con-dosis-donadas-por-covax/,"La ministra de la Secretaría de Salud (Sesal), Alba Consuelo Flores, informó que, el próximo martes se continuará con la vacunación contra el Covid-19 del personal médico, con 48 mil dosis donadas por",12-03-2021 16:41,https://www.bing.com/th?id=OVFT.cSPqtFPaWGa8hGvDZ_ZFIi,Chile,Hondudiario
LISTO EL CALENDARIO PARA SEGUNDA JORNADA DE VACUNACIÓN ANTICOVID CON VACUNA DE INICIATIVA COVAX QUE LLEGA MAÑANA,https://ultimahora.hn/listo-el-calendario-para-segunda-jornada-de-vacunacion-anticovid-con-vacuna-de-iniciativa-covax-que-llega-manana/,"Las primeras 48.000 dosis de la vacuna contra la covid-19 de la iniciativa Covax llegarán a Honduras mañana sábado, así lo anunció la representante de la Organización Panamericana de la",12-03-2021 20:58,https://www.bing.com/th?id=OVFT.fgu78xT-E_CozzOwhn0ZAC,Chile,Ultima Hora
Mañana llegan vacunas de COVAX: este es el plan de vacunación de Salud,https://tiempo.hn/llegan-vacunas-de-covax-honduras-plan-vacunacion/,Salud ya definió el plan de vacunación con las dosis de vacunas de COVAX que llegarán a Honduras el sábado 13 de marzo. La,12-03-2021 21:48,https://www.bing.com/th?id=OVFT.QWmxExHuJ4Ia9rV6MaLOzy,Chile,Tiempo
DICTAMEN CIENTÍFICO DE LA UNAH RECOMIENDA EL USO DE ASTRAZENECA PARA VACUNAR CONTRA EL COVID-19,https://ultimahora.hn/dictamen-cientifico-de-la-unah-recomienda-el-uso-de-astrazeneca-para-vacunar-contra-el-covid-19/,"La Universidad Nacional Autónoma de Honduras UNAH, emitió un dictamen en el que recomienda el uso de la vacuna de AstraZeneca para vacunar contra el Covid-19 Establece que ya la Organización",12-03-2021 22:40,https://www.bing.com/th?id=OVFT.ATUVneUgHZ8z1FI8rKnj0i,Chile,Ultima Hora
Comisión COVID-19 de la UNAH sugiere que Honduras utilice la vacuna de AstraZeneca,https://proceso.hn/comision-covid-19-de-la-unah-sugiere-que-honduras-utilice-la-vacuna-de-astrazeneca/,"Asimismo, sugirió establecer un programa fármaco vigilancia con las vacunas por los reportes de trombos y embolismo en personas que recibieron las vacunas de AstraZeneca en Europa varias naciones",13-03-2021 01:14,https://www.bing.com/th?id=OVFT.xpUiCyL0RfqA9n2iCxc0XS,Chile,Proceso
Cinco fiascos que han marcado el manejo de la pandemia en Honduras,https://www.laprensa.hn/premium/1443528-410/primer-a%C3%B1o-pandemia-contagios-covid-honduras-fiascos-secretaria-salud-muertes,En el primer año de la pandemia en el país han salido a la palestra pública múltiples escándalos de corrupción en el uso de dinero para atender la crisis de salud.,13-03-2021 01:26,https://www.bing.com/th?id=OVFT.s3bc4P3wgvSpswcdbIR8-i,Chile,La Prensa Chicos
"Comicios, la vía para darle giro a destino de Honduras, dice ente anticorrupción",https://www.radiohrn.hn/comicios-la-via-para-darle-giro-a-destino-de-honduras-dice-ente-anticorrupcion,"El CNA destacó que la última década ""ha significado el asalto indiscriminado de las instituciones públicas por parte de las mafias sedientas de poder, dinero e impunidad""",13-03-2021 02:03,https://www.bing.com/th?id=OVFT.SNQyd_lHToFpYaJYG6-JeS,Chile,Radio HRN
Las elecciones son la vía pacifica para cambiar el destino de Honduras,https://hondudiario.com/2021/03/12/las-elecciones-son-la-via-pacifica-para-cambiar-el-destino-de-honduras/,"El Consejo Nacional Anticorrupción (CNA), mediante un comunicado este viernes, sostuvo que la vía pacífica para cambiar el destino de Honduras, que ha sido golpeado por el narcotráfico y corrupción, s",13-03-2021 02:43,https://www.bing.com/th?id=OVFT.QBNH8z24kDPL2q2_WJD_sC,Chile,Hondudiario
Honduras recibirá 48.000 dosis de vacuna contra el coronavirus por la OMS,https://www.diez.hn/noticiasdelmundo/1449268-498/honduras-recibira-nueva-donaciones-vacuna-oms,"Los próximos envíos previstos incluyen vacunas de AstraZeneca para Honduras, que tiene programado recibir 48.000 dosis el sábado, así como para Jamaica y Paraguay, que deben obtener dosis la próxima s",13-03-2021 03:36,https://www.bing.com/th?id=OVFT.fj1PaHxKi0OiGVCJRl7Gny,Chile,diez.hn
"Redes sociales, plataformas electorales en tiempos de pandemia",https://proceso.hn/redes-sociales-plataformas-electorales-en-tiempos-de-pandemia/,"Son canales que se han convertido en los principales espacios de comunicación, incluso los políticos las consideran indispensables.",13-03-2021 04:22,https://www.bing.com/th?id=OVFT.JUzAOU3n81D514_DxLRsUy,Chile,Proceso
