name,url,description,datePublished,imagen,pais,Fuente
"Eta y covid-19 dejan muerte, destrucción y pérdidas millonarias en Honduras",https://ultimahora.hn/eta-y-covid-19-dejan-muerte-destruccion-y-perdidas-millonarias-en-honduras/,"El paso del ciclón tropical Eta dejó un panorama de destrucción y luto en Honduras, donde informes preliminares de la Comisión Permanente de Contingencias (Copeco) revelan que el meteoro ocasionó hast",09-11-2020 14:07,https://www.bing.com/th?id=OVFT.EXWo-y1smDPFsebAZH9rGi,Chile,Ultima Hora
A la mitad cae la demanda de garantías para créditos,https://www.elheraldo.hn/economia/1421120-466/a-la-mitad-cae-la-demanda-de-garant%C3%ADas-para-cr%C3%A9ditos,"Debido a la crisis económica derivada del covid-19, Confianza bajó su meta de 52,000 a 25,000 garantías para avalar los préstamos del presente año",09-11-2020 15:33,https://www.bing.com/th?id=OVFT.I12tDwzwQ1MGtQSX_KtvXi,Chile,El Heraldo
Hoy los canillitas son los protagonistas de la noticia,https://www.elheraldo.hn/tegucigalpa/1421214-466/hoy-los-canillitas-son-los-protagonistas-de-la-noticia,"Sin importar la fecha o las condiciones del clima, los canillitas están tempranito cada día para pregonar las noticias más importantes",09-11-2020 18:10,https://www.bing.com/th?id=OVFT.u473BmRFgSGadDjW8iXq-C,Chile,El Heraldo
Honduras añade 14 muertes por COVID y llega a las 2 mil 765 defunciones,https://proceso.hn/honduras-anade-14-muertes-por-covid-y-llega-a-las-2-mil-765-defunciones/,"Tegucigalpa – En las últimas horas se confirmó el deceso de 14 personas por la COVID-19 en Honduras, con lo que la cifra total de muertes por la enfermedad que causa el nuevo coronavirus se elevó 2 mi",10-11-2020 03:57,https://www.bing.com/th?id=OVFT.VBxTZHi-t0fXjsJdv5DNlS,Chile,Proceso
Honduras suma 100 573 casos Covid-19,https://ultimahora.hn/honduras-suma-100-573-casos-covid-19/,"Sinager confirma 65 casos de Covid-19 para este lunes, para sumar un total de 100,573 contagios a nivel nacional. Además, se reportan 14 nuevas muertes, elevando las víctimas a 2,265. Los",10-11-2020 04:14,https://www.bing.com/th?id=OVFT.Jil4sSDvJ55Uilq6va08jC,Chile,Ultima Hora
Honduras suma 14 muertes nuevas por Covid-19,https://hondudiario.com/2020/11/09/honduras-suma-14-muertes-nuevas-por-covid-19/,"*** Honduras alcanza 100,573 casos del nuevo coronavirus en 245 días de pandemia. El Sistema Nacional de Gestión de Riesgos (Sinager), confirmó para este lunes 65 nuevos casos de Covid-19, sumando un",10-11-2020 04:17,https://www.bing.com/th?id=OVFT.sXHcVGocjlznKshOlfa8HS,Chile,Hondudiario
COVID-19 Honduras: SINAGER confirma 65 nuevos casos y 14 muertos,https://tiempo.hn/covid-19-honduras-sinager-confirma-65-nuevos-casos-y-14-muertos/,"Los nuevos casos de COVID-19 pertenecen a los departamentos de Santa Bárbara, Lempira, Cortés, Olancho, Copán y Francisco Morazán. TEGUCIGALPA, HONDURAS. Actualmente Honduras enfrenta los estragos de",10-11-2020 04:38,https://www.bing.com/th?id=OVFT.Sb5tfFQe298vrNrtsuW48C,Chile,Tiempo
"Muertos por covid-19 en Honduras ascienden a 2,765 y contagios a 100,573",https://www.laprensa.hn/honduras/1421377-410/muertos-por-covid-en-honduras-ascienden-contagios-sinager-copeco,"El número de muertos en Honduras por covid-19 se elevó este lunes a 2.765, mientras que el de contagiados a 100.573, según el informe diario del estatal Sistema Nacional de Gestión de Riesgos (Sinager",10-11-2020 15:03,https://www.bing.com/th?id=OVFT.rs08wb3TTqiZ8mrCgIqUrS,Chile,La Prensa Chicos
Fuerza de Tarea Multidisciplinaria recorre los 28 municipios de Santa Bárbara,http://www.elsoldehonduras.com/nacionales/fuerza-de-tarea-multidisciplinaria-recorre-los-28-municipios-de-santa-barbara/,Santa Bárbara. Porsegundo día consecutivo la Fuerza de Tarea Multidisciplinaria en Santa Bárbara recorre las zonas afectadas por el fenómeno natural Eta. Los equipos de especialistas se han dadoa la t,10-11-2020 16:54,https://www.bing.com/th?id=OVFT.1dlEwb4RClH9dzuz4d68YS,Chile,El Sol de Honduras
"Ministra de Sedis, Zoila Cruz: Compra de kits para afectados por Eta es un proceso muy transparente de cotizaciones y recepción de ofertas",http://www.elsoldehonduras.com/nacionales/ministra-de-sedis-zoila-cruz-compra-de-kits-para-afectados-por-eta-es-un-proceso-muy-transparente-de-cotizaciones-y-recepcion-de-ofertas/,Las palabras del Cruz obedecen a que un medio de comunicación aseguró que los kits que serán entregados por la Operación No Están Solos para ayudar a las familias hondureñas afectadas por la tormenta,10-11-2020 17:00,https://www.bing.com/th?id=OVFT.g918OzVMZyZgeqL7aJPL2C,Chile,El Sol de Honduras
Honduras necesitaría unos $. 5 mil millones para recuperarse de la pandemia y Eta,https://hondudiario.com/2020/11/10/honduras-necesitaria-unos-5-mil-millones-para-recuperarse-de-la-pandemia-y-eta/,"El economista del Foro Social de la Deuda Externa y Desarrollo de Honduras (Fosdeh), Ismael Zepeda, estimó que el país necesitará más de 5 mil millones de dólares para recuperarse de los daños causado",10-11-2020 17:32,https://www.bing.com/th?id=OVFT.0xap_22TQ9n9KOoTa6eA5i,Chile,Hondudiario
34 % de casos de COVID-19 en Honduras corresponden a menores y jóvenes: Coiproden,https://proceso.hn/34-de-casos-de-covid-19-en-honduras-corresponden-a-menores-y-jovenes-coiproden/,A través de un cuadro informativo la ONG indicó que hasta el lunes se contabilizan 34 mil 478 casos positivos de COVID-19 de niños y jóvenes no mayores a los 30 años. Además se contabilizan 85 decesos,10-11-2020 18:00,https://www.bing.com/th?id=OVFT.fIiTADzdMBpF7Aeduud-0S,Chile,Proceso
Marco Tulio Medina: Eta vino a agudizar el problema de salud pública.,https://www.latribuna.hn/2020/11/10/marco-tulio-medina-eta-vino-a-agudizar-el-problema-de-salud-publica/,"El científico hondureño, Marco Tulio Medina, manifestó que la tormenta tropical Eta vino a agudizar los problemas de salud en la población. Antes del fenómeno Honduras ya trabajaba para contrarrestar",10-11-2020 19:10,https://www.bing.com/th?id=OVFT.7jayaAXGBvFX1D0oCX1dsy,Chile,La Tribuna
De 33% es tasa de positividad por coronavirus en albergues,https://www.laprensa.hn/honduras/1421508-410/-tasa-positividad-coronavirus-lbergues-eta-honduras-,"Tegucigalpa, Honduras Las autoridades sanitarias de Honduras informaron este martes que la relación de test que han dado positivo por el coronavirus SARS-CoV-2 sobre el total de pr",10-11-2020 21:49,https://www.bing.com/th?id=OVFT.5o00TaEPfUpYKkTxtcZFLS,Chile,La Prensa Chicos
"BCIE: Reconstruir Honduras, enorme tarea que requiere el apoyo de donantes.",https://www.latribuna.hn/2020/11/10/bcie-reconstruir-honduras-enorme-tarea-que-requiere-el-apoyo-de-donantes/,"Tegucigalpa, 10 nov (EFE).- La reconstrucción de Honduras tras el paso de la depresión tropical Eta, que suma 57 muertos, es una tarea «bastante grande» que requiere la coordinación del Gobierno y org",10-11-2020 21:58,https://www.bing.com/th?id=OVFT.wmQjz1liujzzABRW2EKlty,Chile,La Tribuna
"HONDURAS / 63 MUERTOS, 400 PERSONAS ESPERAN RESCATE Y PROTESTA",http://www.web.ellibertador.hn/index.php/noticias/nacionales/2402-honduras-63-muertos-400-personas-esperan-rescate-y-protesta,"La angustia de los hondureños parece infinita, Eta se suma a la catástrofe de los fraudes electorales, golpe de Estado, éxodo migrante y la pandemia. En viejos tejados de lámina todavía hay gente desa",10-11-2020 23:58,https://www.bing.com/th?id=OVFT.6DpdyFeoqqAHUAbxcY2V3y,Chile,El Libertador
Honduras completo se segundo día de trabajo,https://www.diariomas.hn/2020/11/10/honduras-completo-se-segundo-dia-de-trabajo/,"Con la presencia del delantero del Real Salt Lake de la MLS, Douglas Martínez, la selección de Honduras, efectuó su segundo día de preparación de",11-11-2020 00:02,https://www.bing.com/th?id=OVFT.ps74KoX8syBge4rZuadGdi,Chile,Mas
"UNICEF: Mas de 1,5 millones de niños hondureños en peligro por Eta y COVID-19",https://tiempo.hn/unicef-15-millones-ninos-hondurenos-eta-covid-19/,"UNICEF alertó que más de 1,5 millones de niños hondureños están expuestos a los daños que provocó la depresión tropical Eta y el COVID-19.",11-11-2020 00:54,https://www.bing.com/th?id=OVFT.swwMKLARBPXeiWqak7SbLC,Chile,Tiempo
HONDURAS / EL LIBERTADOR DA MANO SOLIDARIA A HÉROES DE BLANCO,http://www.web.ellibertador.hn/index.php/noticias/nacionales/2403-honduras-el-libertador-da-mano-solidaria-a-heroes-de-blanco,"Tegucigalpa. Como parte de su Responsabilidad Social Empresarial, EL LIBERTADOR ha extendido una mano solidaria a los héroes de blanco, que durante casi ocho meses de la crisis sanitaria por el Covid-",11-11-2020 02:50,https://www.bing.com/th?id=OVFT.cgHmUAgL1qGoPT8lz3dRfy,Chile,El Libertador
