name,url,description,datePublished,imagen,pais,Fuente
CMH: Viaje a Israel es un reflejo de mala administración de la pandemia en Honduras,https://www.vtv.com.hn/noticia/cmh-viaje-a-israel-es-un-reflejo-de-mala-administracion-de-la-pandemia-en-honduras/,El presidente noroccidental del CMH señaló de irresponsable el manejo que el gobierno le ha dado a la pandemia del Covid-19,23-02-2021 21:03,https://www.bing.com/th?id=OVFT.BK9uyLTMbp_iJLiCjqtDgC,Chile,VTV
"NO POLITIZAR DISTRIBUCIÓN DE VACUNA, PIDE MINISTRO MADERO",https://ultimahora.hn/no-politizar-distribucion-de-vacuna-pide-ministro-madero/,"El Coordinador General de Gobierno, Carlos Madero, llamó hoy a la comunidad internacional y nacional a no politizar el manejo de la vacuna y agradeció a Israel por la donación de un lote de",23-02-2021 21:54,https://www.bing.com/th?id=OVFT.yAzHHhe2JLFr0GfHtZ3KSi,Chile,Ultima Hora
ONU HACE LLAMADO URGENTE POR HAMBRUNA QUE AZOTA HONDURAS,http://www.web.ellibertador.hn/index.php/noticias/nacionales/2710-onu-hace-llamado-urgente-por-hambruna-que-azota-honduras,"Honduras y Nicaragua) azotados por graves hambrunas causadas por la crisis económica desata por el covid-19 y los desastres naturales. En un comunicado divulgado en Roma, la Organización de Naciones Unidas (ONU), premio Nobel de la Paz en 2020 ...",23-02-2021 21:55,https://www.bing.com/th?id=OVFT.WtMGyJ1uRQJW9riBDKZvIy,Chile,El Libertador
"El virus está más agresivo, son al menos 40 fallecidos diarios: Roberto Cosenza",https://hondudiario.com/2021/02/23/el-virus-esta-mas-agresivo-son-al-menos-40-fallecidos-diarios-roberto-cosenza/,"Es preocupante que aún Honduras no llega a la meseta por Covid-19, y se siguen contabilizando ciudadanos que fallecen por la enfermedad, señaló. Cosenza apuntó que, en el Hospital Leonardo Martínez de Cortés, donde se registran 80 pacientes ...",23-02-2021 22:17,https://www.bing.com/th?id=OVFT.xErtfq0Dla7z8yf5kDSwxi,Chile,Hondudiario
Salud acelerará envío de unidades de triaje móviles a barrios y colonias,http://www.elsoldehonduras.com/salud/salud-acelerara-envio-de-unidades-de-triaje-moviles-a-barrios-y-colonias/,"Ante el aumento de casos positivos de covid-19 en el país, la Secretaría de Salud (Sesal) ejecutará la estrategia nacional de llevar unidades de triaje móviles a barrios y colonias como forma de preve",23-02-2021 22:37,https://www.bing.com/th?id=OVFT._QGbWwAC35CJqLagLT7x1S,Chile,El Sol de Honduras
"Presidente Hernadez agradece a Israel por la respuesta de 5,000 dosis de vacunas contra el COVID-19",http://www.elsoldehonduras.com/nacionales/presidente-hernadez-agradece-a-israel-por-la-respuesta-de-5000-dosis-de-vacunas-contra-el-covid-19/,"Que el Gobierno de Israel, luego de una solicitud del Presidente Juan Orlando Hernández al Primer Ministro, Benjamin Netanyahu, anunció la donación de un lote de 5.000 dosis de vacunas contra el COVID",23-02-2021 22:50,https://www.bing.com/th?id=OVFT.cmz_8gQJFMSNKyoXz4ApZi,Chile,El Sol de Honduras
"La COVID-19, Eta e Iota dejan al descubierto violencia de género en Honduras",https://proceso.hn/la-covid-19-eta-e-iota-dejan-al-descubierto-violencia-de-genero-en-honduras/,El estudio titulado «Análisis Rápido de Género en Honduras: un panorama ante COVID-19 y Eta/Iota» destaca que la pandemia y las tormentas afectaron las condiciones estructurales relacionadas con,23-02-2021 22:50,https://www.bing.com/th?id=OVFT.pMN5frTZTThR6VgeCP0h0S,Chile,Proceso
HONDURAS QUEDARÁ A LA ZAGA DE AMÉRICA LATINA EN VACUNAS Y PAÍSES “TOP” DEL MUNDO,http://www.web.ellibertador.hn/index.php/noticias/nacionales/2711-honduras-quedara-a-la-zaga-de-america-latina-en-vacunas-y-paises-top-del-mundo,"En América Latina, Honduras está entre los cinco países que no han puesto una sola vacuna junto a Guatemala, Nicaragua, Uruguay y Cuba, que aunque esperan empezar en próximas semanas o meses, al final",23-02-2021 23:11,https://www.bing.com/th?id=OVFT.t4I2UDXg7solLFy2mbByli,Chile,El Libertador
"Honduras supera las 4,000 muertes por coronavirus en 11 meses",https://www.elheraldo.hn/pais/1445044-466/honduras-muertos-coronavirus,Los contagios y fallecimientos por el covid-19 en Honduras no presentan ningún descenso en el territorio hondureño,23-02-2021 23:41,https://www.bing.com/th?id=OVFT.JjxPsldpTCImtIRFJeiwNi,Chile,El Heraldo
Médico: Por esperar un 20 % de vacunas gratis Honduras no planificó compras,https://tiempo.hn/medico-vacunas-gratis-honduras-no-planificar-compras/,El médico Fidel Barahona lamentó que el gobierno se haya esperanzado a que la vacuna contra el COVID-19 se iba a obtener gratis con Covax.,23-02-2021 23:54,https://www.bing.com/th?id=OVFT.m3Kt6WbL9q6qgQqtWtlYvS,Chile,Tiempo
"La covid-19, Eta y Iota dejan al descubierto violencia de género en Honduras",https://www.laprensa.hn/honduras/1445052-410/-covid-19-eta-iota-violencia-genero-honduras-,"La representante de ONU Mujeres en Honduras, Margarita Bueso, dijo que la pandemia de coronavirus SARS-CoV-2 ha 'profundizado' los diferentes tipos de violencia contra la mujer en el país centroameric",24-02-2021 00:21,https://www.bing.com/th?id=OVFT.ln4TrIPS2AyE-tB1NvkBcC,Chile,La Prensa Chicos
Estos dos departamentos de Honduras presentan el mayor número de niños contagiados por covid-19,https://www.radiohrn.hn/estos-dos-departamentos-de-honduras-presentan-el-mayor-numero-de-ninos-contagiados-por-covid-19,¡Atención! Conoce los dos departamentos que registran el mayor número de niños contagiados por covid Francisco Morazán y Cortés son los departamentos que representan la mayor cantidad de niños diagnos,24-02-2021 00:24,https://www.bing.com/th?id=OVFT.H1dx4WKg1X3HY1z--GlMWy,Chile,Radio HRN
Vacunas donadas por Israel llegarán el jueves a Honduras,https://www.laprensa.hn/honduras/1445067-410/vacunas-donadas-israel-llegan-honduras-coronavirus-,"Unas 5.000 vacunas contra la covid-19 que Israel enviará a Honduras, llegarán a primeras horas del jueves informó este martes una fuente de las Fuerzas Armadas, aunque el presidente hondureño, Juan Or",24-02-2021 00:30,https://www.bing.com/th?id=OVFT.nCyRYYuojQtbBI4vZCUiNi,Chile,La Prensa Chicos
Este jueves llegan a Honduras primeras vacunas contra el Covid-19: ¿Quienes serán los primeros inoculados?,https://www.diez.hn/coronavirus/1445083-441/jueves-llegan-primeras-vacunas-covid-19-honduras-donadas-israel,El Gobierno de Israel hizo la primera donación de vacunas contra el Coronavirus a Honduras y llegan la noche de este miércoles,24-02-2021 01:19,https://www.bing.com/th?id=OVFT.qe3_kVo1S0dGzkk99HpOtS,Chile,diez.hn
Honduras acumula 166 mil 547 contagios de COVID-19,https://proceso.hn/honduras-acumula-166-mil-547-contagios-de-covid-19/,"Los casos de COVID-19 en Honduras se elevaron este martes a 166 mil 547 desde que se declaró la emergencia sanitaria por la pandemia en marzo del año pasado, informó el Sistema Nacional de Gestión",24-02-2021 03:31,https://www.bing.com/th?id=OVFT.I7OXBhvdt5M2r7a9Lz3kSC,Chile,Proceso
Un hombre de 78 años y una mujer de 70 entre los nuevos fallecidos de este martes en Honduras,https://www.radiohrn.hn/un-hombre-de-78-anos-y-una-mujer-de-70-entre-los-nuevos-fallecidos-de-este-martes-en-honduras,"Honduras a través del Sistema Nacional de Gestión de Riesgos(Sinager), informó el martes (23.02.2021)  sobre la realizaron de 2 mil 485 nuevas pruebas para diagnosticar el virus, de las cuales 810 die",24-02-2021 04:16,https://www.bing.com/th?id=OVFT.Q5WrFaNIuxLjb9Q3PlP6WS,Chile,Radio HRN
Las 5.000 vacunas anticovid donadas por Israel serán para personal de primera línea asegura el Gobierno,http://www.eldiario.hn/las-5-000-vacunas-anticovid-donadas-por-israel-seran-para-personal-de-primera-linea-asegura-el-gobierno/,"Tegucigalpa. - Las 5.000 vacunas contra la covid-19 donadas por Israel a Honduras, que llegarán próximamente al país, serán en su totalidad para inmunizar a los trabajadores de la salud que trabajan e",24-02-2021 04:40,https://www.bing.com/th?id=OVFT.vr416BXkVUN3OJRv8cYBqy,Chile,El Diario
Juan Orlando Hernández agradece a Israel la donación de 5 mil vacunas anticovid,https://www.elheraldo.hn/pais/1445000-466/vacuna-israel-honduras-coronavirus-covid-donacion,"El mandatario anunció que Israel y Chile, dos de los países más exitosos en vacunar rápidamente a sus poblaciones objetivo, asesorarán a Honduras para replicar sus buenas prácticas",24-02-2021 06:38,https://www.bing.com/th?id=OVFT.CabNbw9pWCs2GOtozuhTRi,Chile,El Heraldo
Honduras acumula 4.040 muertos por COVID-19 y 166.547 contagios,https://www.latribuna.hn/2021/02/24/honduras-acumula-4-040-muertos-por-covid-19-y-166-547-contagios/,"Tegucigalpa.- Honduras acumuló este martes 4.040 muertos por COVID-19 en 11 meses de pandemia y 166.547 contagios, informó el estatal",24-02-2021 06:52,https://www.bing.com/th?id=OVFT.JAOlHiI6jHd_vcoLOfFg8S,Chile,La Tribuna
JOH: 5 mil vacunas donadas serán para personal de primera línea,https://www.latribuna.hn/2021/02/24/joh-5-mil-vacunas-donadas-seran-para-personal-de-primera-linea/,"Las 5.000 vacunas contra la covid-19 donadas por Israel a Honduras, que llegarán próximamente al país, serán en su totalidad",24-02-2021 09:26,https://www.bing.com/th?id=OVFT.Dq6-ZxXvuuszPWtGa_EwQS,Chile,La Tribuna
"En primeros 54 días del año, Honduras ya reporta 1,250 casos de dengue",https://tiempo.hn/casos-dengue-honduras-2021/,"En lo que va del 2021, Honduras ha reportado más de 1,200 casos de dengue. TEGUCIGALPA, HONDURAS. El Coordinador de Vigilancia de Virus y otras enfermedades de la Secretaría de Salud (SESAL), el docto",24-02-2021 13:15,https://www.bing.com/th?id=OVFT.0yp41_RWaOUyimMNF0yXOy,Chile,Tiempo
Se conforma Consejo de Veeduría Social para transparencia en compra de vacunas,https://www.vtv.com.hn/noticia/se-conforma-consejo-de-veeduria-social-para-transparencia-en-compra-de-vacunas/,"Luego de la aprobación de la reforma a la Ley de Vacuna Gratuita contra la Covid-19 por el Congreso Nacional y publicada en el Diario Oficial La Gaceta, las secretarías de Finanzas y de Salud conforma",24-02-2021 13:16,https://www.bing.com/th?id=OVFT.iYz2CvJDYTZmTvYY7LyhUC,Chile,VTV
