name,url,description,datePublished,imagen,pais,Fuente
LAS VACUNAS CONTRA EL COVID-19 LAS ESTÁ COMPRANDO EL GOBIERNO: MADERO,https://ultimahora.hn/las-vacunas-contra-el-covid-19-las-esta-comprando-el-gobierno-madero/,"El Coordinador General de Gobierno, Carlos Madero, aclaró este jueves que las vacunas contra la covid-19 las está comprando el Gobierno de Honduras, por medio de la Secretaría de Salud y el",22-01-2021 14:24,https://www.bing.com/th?id=OVFT.y3oa99MLAMUz4M17T5AuUi,Chile,Ultima Hora
Doctora Karla Pavón se reinfecta de covid-19: se había contagiado en julio,https://www.elheraldo.hn/pais/1437489-466/doctora-karla-pavon-reinfecta-covid-19-contagiado-julio-honduras,La jefa de vigilancia epidemiológica de la Secretaría de Salud de Honduras permanece aislada y recibiendo suministro de oxígeno,22-01-2021 14:53,https://www.bing.com/th?id=OVFT.7XF1q-VRarxDqRlxS7sVLS,Chile,El Heraldo
Honduras sobrepasa los 138 mil contagios y suma 16 nuevas muertes por coronavirus,https://hondudiario.com/2021/01/22/honduras-sobrepasa-los-138-mil-contagios-y-suma-16-nuevas-muertes-por-coronavirus/,"CEl Sistema Nacional de Gestión de Riesgos (Sinager), confirmó en las últimas horas 1,146 nuevos casos de Covid-19, sumando así un total de 138,044 contagios a nivel nacional. De 3,259 pruebas PCR pro",22-01-2021 14:55,https://www.bing.com/th?id=OVFT.Gj5GKgqbhKBTK2HlN7holy,Chile,Hondudiario
"Directora de Virología, Karla Pavón, se reinfecta de Covid-19",https://www.laprensa.hn/honduras/1437501-410/karla-pavon-positivo-covid-honduras-jefa-vigilancia-epidemiologica-secretaria-salud,Este sería el primer caso oficial de reinfección por Covid-19 entre el personal de Salud que trabaja en la primera línea contra la pandemia en Honduras.,22-01-2021 15:51,https://www.bing.com/th?id=OVFT.tCA5SpZg-UEgFq_c8jn7YS,Chile,La Prensa Chicos
HONDURAS / EMPRESARIOS MÁS RESPONSABLES QUE GOBIERNO CON VACUNAS,http://www.web.ellibertador.hn/index.php/noticias/nacionales/2603-honduras-empresarios-mas-responsables-que-gobierno-con-vacunas,"Unos 600 mil hondureños trabajan por cuenta propia o no cotizan al IHSS, por eso razón, el gerente de Asesoría Legal del Cohep, Gustavo Solórzano, comentó a este rotativo que han propuesto a las autor",22-01-2021 16:17,https://www.bing.com/th?id=OVFT.aJC2EW-G2CRqnKffX90_Si,Chile,El Libertador
Entre globos y aplausos despiden a médico muerto por COVID-19 (Video),https://www.latribuna.hn/2021/01/22/entre-globos-y-aplausos-empleados-del-ihss-despiden-a-medico-muerto-por-covid-19-video/,"Amigos, familiares y empleados de la periférica 1 del Instituto Hondureño de Seguridad Social (IHSS), en Tegucigalpa, capital de Honduras realizaron este viernes un sentido homenaje de despedida para",22-01-2021 18:37,https://www.bing.com/th?id=OVFT.JKhnNWy-27sqvgT9EUbfRS,Chile,La Tribuna
La Sub-23 de Honduras se fogueará ante Costa Rica en febrero previo al Preolímpico en México,https://www.diez.hn/laseleccion/1437537-498/honduras-sub-23-seleccion-costa-rica-partidos-amistosos-preolimpico-juegos-olimpicos-tokio,"La Sub-23 de Honduras, que ya se encuentra trabajando bajo el mando de Fabián Coito, disputará dos partidos amistosos contra su similar de Costa Rica el próximo mes de febrero. Las fechas que están pr",22-01-2021 20:10,https://www.bing.com/th?id=OVFT.TMA6QYXg00hqPZk_ZM3uXi,Chile,diez.hn
Estas son las farmacéuticas que dotarán a Honduras de vacuna antiCOVID,https://tiempo.hn/farmaceuticas-dotaran-honduras-vacuna-anticovid/,AstraZeneca y Pfizer son las farmacéuticas que negociaron con las autoridades de Honduras para enviar la primera dosis de vacuna anticovid.,22-01-2021 21:01,https://www.bing.com/th?id=OVFT.OOLV4Cb0TbLqFWXM_JnVlS,Chile,Tiempo
Muere por covid-19 el doctor Arquímedes Rodríguez en la capital,https://www.elheraldo.hn/pais/1437571-466/muere-covid-19-doctor-arquimedes-rodriguez-tegucigalpa,"TEGCUCIGALPA, HONDURAS.-El reconocido doctor Arquímedes Rodríguez falleció este viernes a causa de covid-19, según lo confirmó su colega Carlos Umaña. A través de su cuenta de Twitter, el doctor Umaña",22-01-2021 21:43,https://www.bing.com/th?id=OVFT.7sgpjfXYhsOKmAXJtIbCvS,Chile,El Heraldo
HONDURAS RECIBIRÁ EL PRIMER LOTE DE VACUNAS CONTRA LA COVID-19 A INICIOS DE MARZO DE 2021,https://ultimahora.hn/honduras-recibira-el-primer-lote-de-vacunas-contra-la-covid-19-a-inicios-de-marzo-de-2021/,"La jefa del Programa Ampliado de Inmunizaciones (PAI), Ida Berenice Molina, manifestó este día que Honduras recibirá el primer lote de vacunas contra la COVID-19 a inicios de marzo de 2021. No",22-01-2021 22:13,https://www.bing.com/th?id=OVFT.O2LaYci7TLSqn4yUOtxsvy,Chile,Ultima Hora
"A 10 sube la cifra de embarazadas afectadas por el covid-19 en Honduras, según médico",https://www.radiohrn.hn/a-10-sube-la-cifra-de-embarazadas-afectadas-por-el-covid-19-en-honduras-segun-medico,El médico advirtió nuevamente el covid se está ensañando con las mujeres embarazadas Al menos 10 mujeres embarazadas en estado delicado de salud por covid-19 permanecen en el Instituto Hondureño del S,22-01-2021 22:26,https://www.bing.com/th?id=OVFT.tpczZ2QCjEKts-FtmmmPOC,Chile,Radio HRN
"Vacuna que rechazó Honduras es más barata que una PCR, dice galeno",https://tiempo.hn/vacuna-que-rechazo-honduras-mas-barata-que-pcr/,"El doctor Denis Chirinos, urólogo del Hospital Escuela, denunció que la vacuna que Honduras rechazó a AstraZeneca es más barata que una PCR.",22-01-2021 22:31,https://www.bing.com/th?id=OVFT.Q3XzDXcSAbRt3R8XaOf0hi,Chile,Tiempo
"Honduras tendrá los recursos necesarios para la adquisición de las vacunas de la COVID-19, garantiza viceministra de Finanzas",https://proceso.hn/honduras-tendra-los-recursos-necesarios-para-la-adquisicion-de-las-vacunas-de-la-covid-19-garantiza-viceministra-de-finanzas/,"“De parte de la Secretaría de Salud ha venido trabajando en conjunto con la Secretaría de Finanzas para asignar los recursos necesarios para la adquisición de la vacuna de la COVID-19”, declaró la",22-01-2021 22:38,https://www.bing.com/th?id=OVFT.zFl3qfhtqY-HLSErFmhmwi,Chile,Proceso
Infectólogo hondureño alerta que puede haber una tercera reinfección por covid,https://www.radiohrn.hn/infectologo-hondureno-alerta-que-puede-haber-una-tercera-reinfeccion-por-covid,"El reconocido infectólogo hondureño, Tito Alvarado advirtió a los hondureños que han estado o están infectados con el covid- 19 que puede haber hasta una tercera reinfección del virus, la cual sería m",23-01-2021 00:02,https://www.bing.com/th?id=OVFT.0pIDrFiC028fl-XAP9a7Ai,Chile,Radio HRN
Saprissa vs Alajuelense: clásico en la final de la Liga Concacaf para demostrar el dominio tico en la Copa,https://www.diez.hn/centroamerica/1437630-498/saprissa-vs-alajuelense-clasico-final-liga-concacaf-olimpia-centeno-alex-lopez,"Los ticos se servirán con la cuchara grande en el torneo Concacaf League, la competencia en la que el Deportivo Saprissa y la Liga Deportiva Alajuelense definirán el próximo campeón el 3 de febrero qu",23-01-2021 01:01,https://www.bing.com/th?id=OVFT.7b3tg5nsRABgogID4Fx54y,Chile,diez.hn
Asegura Hernández: Las vacunas contra la covid-19 del IHSS serán compradas con dineros del Estado,http://www.eldiario.hn/asegura-hernandez-las-vacunas-contra-la-covid-19-del-ihss-seran-compradas-con-dineros-del-estado/,Tegucigalpa. -  El presidente Juan Orlando Hernández afirmó que las vacunas contra la covid-19 que adquirirá el Instituto Hondureño de Seguridad Social (IHSS) serán compradas por el Estado y no por ni,23-01-2021 03:11,https://www.bing.com/th?id=OVFT.Vv4PmIuGhDY7Wb941IrxMC,Chile,El Diario
La OPS garantiza la vacuna contra el Covid-19 en Honduras,https://www.vtv.com.hn/noticia/la-ops-garantiza-la-vacuna-contra-el-covid-19-en-honduras/,"La representante de la OPS en el país, asegura que Honduras tiene garantizado el acceso a la vacuna contra la Covid-19 para toda la población que está acta para recibirla.",23-01-2021 03:16,https://www.bing.com/th?id=OVFT.tohTsmIeZt8oEyeSdEojXS,Chile,VTV
"Honduras acumula 139,182 casos y 3,439 decesos por COVID-19",https://proceso.hn/honduras-acumula-139182-casos-y-3439-decesos-por-covid-19/,"Se confirmó los fallecimientos de 17 personas: 13 en la ciudad de San Pedro Sula, tres en el Distrito Central y uno en el municipio de La Paz.",23-01-2021 03:22,https://www.bing.com/th?id=OVFT.0cy7rxPX4BoaBrj83u6Oii,Chile,Proceso
Se registro otro médico fallecido en Honduras por Covid-19,https://www.vtv.com.hn/noticia/se-registro-otro-medico-fallecido-en-honduras-por-covid-19/,Galenos mencionaron que es importante tener claro que la vacuna no garantiza la erradicación completa del Coronavirus. Temas: Covid-19; fallecido; médico; vacunas,23-01-2021 03:32,https://www.bing.com/th?id=OVFT.pANQ4RV4gWTlREhybnTyMi,Chile,VTV
"Honduras alcanza 139,182 contagios y 3,439 muertes por Covid-19",https://hondudiario.com/2021/01/22/honduras-alcanza-139182-contagios-y-3439-muertes-por-covid-19/,"El Sistema Nacional de Gestión de Riesgos (Sinager), confirmó este viernes 1,138 nuevos casos de Covid-19, sumando así un total de 139,182 contagios a nivel nacional. De 3,322 pruebas PCR procesadas p",23-01-2021 03:52,https://www.bing.com/th?id=OVFT.FQpZ_fDRUa-s_ifr4pQSMy,Chile,Hondudiario
Política para frenar éxodo de migrantes se mantendrá,https://www.laprensa.hn/honduras/1437645-410/estados-unidos-pol%C3%ADtica-frenar-exodo-migrantes-mantendra,"Revisión del Acuerdo Tercer País Seguro es posible. Analistas estiman que el muro seguirá, pero de forma silenciosa.",23-01-2021 05:05,https://www.bing.com/th?id=OVFT.nDUW4ao-tz2iem6ndtLTeC,Chile,La Prensa Chicos
"EEUU, México y Guatemala cierran puertas a caravanas migrantes",https://www.latribuna.hn/2021/01/23/eeuu-mexico-y-guatemala-cierran-puertas-a-caravanas-migrantes/,"CIUDAD DE GUATEMALA, Guatemala. Los gobiernos de Estados Unidos, México y Guatemala acordaron prohibir el paso por su territorio de caravanas migrantes debido a la pandemia, días después que una prove",23-01-2021 11:57,https://www.bing.com/th?id=OVFT.SFFOzoJOZ1S7Q35ZxHb95y,Chile,La Tribuna
