name,url,description,datePublished,imagen,pais,Fuente
"Con dos mil pruebas procesadas, Honduras suma 2,661 decesos por COVID-19",https://proceso.hn/con-dos-mil-pruebas-procesadas-honduras-suma-2661-decesos-por-covid-19/,"– La tasa de letalidad del COVID-19 en Honduras es del 2.7 por ciento. Se registró, además, 951 nuevos casos de COVID-19 tras 2 mil 068 pruebas PCR procesadas por el Laboratorio de Virología. Cortés r",30-10-2020 07:06,https://www.bing.com/th?id=OVFT.ZqjizNkHeMBQVOo-6k6Pui,Chile,Proceso
"Taiwán y la OMS, un contraste de voluntades",https://elpatriota.hn/2020/10/30/taiwan-y-la-oms-un-contraste-de-voluntades/,"Las más fuertes economías en los cinco continentes se han visto sometidas y sin reacción ante el alto nivel de contagio y letalidad del Coronavirus, agente causal del COVID-19. Pero llama poderosament",30-10-2020 13:49,https://www.bing.com/th?id=OVFT.hXvBs-E5d-K7ulagdx-YQi,Chile,El Patriota
OFICIAL: Cristiano Ronaldo da negativo en su última prueba de coronavirus y ya puede jugar,https://www.diez.hn/internacionales/1419099-498/cristiano-ronaldo-supera-el-coronavirus-prueba-negativa-comunicado-juventus,"Mediante un comunicado oficial, la Juventus hizo oficial que Cristiano Ronaldo ha superado el coronavirus tras 19 días.",30-10-2020 19:11,https://www.bing.com/th?id=OVFT.DwWoWfs9gZZ8g1mv7Svoiy,Chile,diez.hn
"Carlos Madero asegura que restricciones de bioseguridad continuarán durante la Semana Morazánica, pese a libre circulación",https://www.radiohrn.hn/honduras-carlos-madero-asegura-que-restricciones-de-bioseguridad-continuaran-durante-la-semana-morazanica-pese-a-libre-circulacion,"La única restricción de bioseguridad que se suspende es la de circulación de personas y vehículos. El coordinador general de gobierno y coordinador del Gabinete Económico y Social, Carlos Madero, acla",30-10-2020 20:59,https://www.bing.com/th?id=OVFT.W_Lp51gmYrhXhCUv0tFqKi,Chile,Radio HRN
Honduras se prepara para adquirir más de 1.8 millones de vacunas contra el Covid-19,https://hondudiario.com/2020/10/30/honduras-se-prepara-para-adquirir-mas-de-1-8-millones-de-vacunas-contra-el-covid-19/,"Además el funcionario informó que Honduras ya se está preparando para la adquisición de la vacuna contra el COVID-19. “Nos preparamos para que podamos introducir y tengamos acceso a la vacuna, la ministra de Salud (Alba Flores), ha diseñado un ...",30-10-2020 21:59,https://www.bing.com/th?id=OVFT.XFyZ_i5ogUEfUlXm6DQ80i,Chile,Hondudiario
Presidente Hernández entrega Bono Único y financiamiento de Crédito Solidario en Gracias,http://www.elsoldehonduras.com/nacionales/presidente-hernandez-entrega-bono-unico-y-financiamiento-de-credito-solidario-en-gracias/,"El presidente Juan Orlando Hernández entrega este jueves en Gracias, Lempira, 15 Bonos Únicos correspondientes al programa de asistencia a trabajadores independientes o de cuenta propia y otros cuyos",30-10-2020 23:25,https://www.bing.com/th?id=OVFT.HLemZVx_WoXbHP3glrCXqi,Chile,El Sol de Honduras
"Fuerza Honduras ha garantizado mejoramiento de la red primaria de salud, apoyo social y reactivación económica en Ocotepeque",http://www.elsoldehonduras.com/nacionales/fuerza-honduras-ha-garantizado-mejoramiento-de-la-red-primaria-de-salud-apoyo-social-y-reactivacion-economica-en-ocotepeque/,"Dando cumplimiento a las instrucciones del presidente Juan Orlando Hernández en la verificación del cumplimiento, ejecución e inversión de los fondos destinados al combate a pandemia por la COVID-19 y",30-10-2020 23:28,https://www.bing.com/th?id=OVFT.EHdZBIANaY_yBDmQCUWshi,Chile,El Sol de Honduras
BID busca soluciones innovadoras en agricultura frente al COVID-19,https://www.latribuna.hn/2020/10/30/bid-busca-soluciones-innovadoras-en-agricultura-frente-al-covid-19/,"El Banco Interamericano de Desarrollo (BID) lanzó la convocatoria Agrinnovah: Agricultura Innovadora en Honduras en Tiempos de COVID-19, que tiene como objetivo incentivar soluciones innovadoras orien",31-10-2020 00:42,https://www.bing.com/th?id=OVFT.K_uRkL9QnttP9b_-PMxozi,Chile,La Tribuna
COVID-19 Honduras: SINAGER reporta 738 nuevos casos y 8 muertos,https://tiempo.hn/covid-19-honduras-sinager-reporta-738-nuevos-casos-y-8-muertos/,"De los 738 nuevos casos de COVID-19, 284 pertenecen al departamento de Francisco Morazán. TEGUCIGALPA, HONDURAS. De 2,001 pruebas para diagnosticar COVID-19 que procesó el Laboratorio Nacional de Virología (LNV) de la Secretaria de Salud, 738 resultaron ...",31-10-2020 02:36,https://www.bing.com/th?id=OVFT.KpSW7t4Ckg0MHGApUqjZlC,Chile,Tiempo
Honduras se acerca a los 97 mil contagios de Covid-19 con 738 nuevos casos,https://hondudiario.com/2020/10/30/honduras-se-acerca-a-los-97-mil-contagios-de-covid-19-con-738-nuevos-casos/,"El Sistema Nacional de Gestión de Riesgos (Sinager), reportó este viernes 2,001 pruebas PCR procesadas, de las cuales 738 resultaron positivas al Covid-19, sumando así un total de 96,888 casos de coro",31-10-2020 03:02,https://www.bing.com/th?id=OVFT.5QIv2eXnSDE9kqlC3qF3jy,Chile,Hondudiario
Honduras roza los 97 mil casos de COVID-19,https://proceso.hn/honduras-roza-los-97-mil-casos-de-covid-19/,"Tegucigalpa – Honduras registró este viernes 738 nuevos casos, por lo tanto, alcanzó los 96 mil 888 contagiados por COVID-19, informó el Sistema Nacional de Gestión de Riesgos (Sinager). – La tasa de",31-10-2020 03:09,https://www.bing.com/th?id=OVFT.3TF5dYkbmf5wX8y830WYHS,Chile,Proceso
Sinager registra 738 nuevos casos de COVID-19,https://www.latribuna.hn/2020/10/30/sinager-registra-738-nuevos-casos-de-covid-19/,"con estos nuevos casos la cifra total es de 96,888 casos confirmados de COVID-19 en Honduras. Asimismo, el Laboratorio Nacional de Virología de la Secretaría de Salud, confirma el deceso de 8 personas a causa del mortal virus, sumando un total de 2,669 ...",31-10-2020 03:57,https://www.bing.com/th?id=OVFT.bBhySKIH63QSJUGQ8UdLwi,Chile,La Tribuna
"En Alauca, El Paraíso:El triaje de Fuerza Honduras salvo la vida de mi familia",https://ultimahora.hn/en-alauca-el-paraisoel-triaje-de-fuerza-honduras-salvo-la-vida-de-mi-familia/,"“Soy una paciente recuperada de COVID-19, mi familia fue también afectada y fuimos pacientes del triaje aquí en Alauca, estoy agradecida con los doctores porque nos atendieron, cuidaron y",31-10-2020 06:29,https://www.bing.com/th?id=OVFT.5cyysXV7wrstZ_wD69LBYy,Chile,Ultima Hora
Urge centro de estabilización en Dulce Nombre de Copán,https://www.laprensa.hn/honduras/1419229-410/urge-centro-de-estabilizacion-en-dulce-nombre-copan-honduras,"Las alarmas por el aumento de casos de covid-19 en el municipio más pequeño de Copán ... en casi un 8%. El programa Fuerza Honduras destinó 998,521.23 lempiras para Dulce Nombre, con los que se determinó consolidar un equipo de respuesta rápida ...",31-10-2020 08:10,https://www.bing.com/th?id=OVFT.USf64L3QjlBZL4aoY5VYxC,Chile,La Prensa Chicos
Honduras promociona productos en la Feria de Alimentos de Kaohsiung en Taiwán,https://elpatriota.hn/2020/10/31/honduras-promociona-productos-en-la-feria-de-alimentos-de-kaohsiung-en-taiwan/,"La participación de las empresas hondureñas en Taiwán fue todo un éxito pues pudieron promocionar sus productos de manera directa, con apoyo financiero de la Embajada de Taiwán, que envió muestras y c",31-10-2020 12:48,https://www.bing.com/th?id=OVFT.zm3sEf2s1tjceEGUT64gAi,Chile,El Patriota
"Texaco: Unidos más que nunca, ¡seguiremos brillando!",https://www.laprensa.hn/economia/marketingempresas/1419205-410/texaco-unidos_mas_que_nunca-seguiremos_brillando,"En Centroamérica, Texaco ha proporcionado alimentos básicos a cerca de 10,000 personas, y suministros médicos a 7,400 profesionales de la salud.",31-10-2020 13:00,https://www.bing.com/th?id=OVFT.COFzKqui3hr248hAFqfvly,Chile,La Prensa Chicos
COVID-19: ¿Puede salir hoy? Conozca los dígitos habilitados y evite multas,https://tiempo.hn/covid-19-que-digitos-circulan-honduras/,"Este sábado, de acuerdo a las medidas que mantiene vigentes SINAGER, solo dos dígitos pueden circular en Honduras. Conozca más detalles.",31-10-2020 13:49,https://www.bing.com/th?id=OVFT.hPX1XGFftngzvKbMSOUKtC,Chile,Tiempo
Honduras aprueba tercera revisión del Acuerdo Stand By vigente con el FMI,https://www.elheraldo.hn/economia/1419185-466/honduras-aprueba-tercera-revisi%C3%B3n-del-acuerdo-stand-by-vigente-con-el-fmi,"Junto a las implementadas en los últimos años, estas reformas continúan fortaleciendo los marcos de política económica en Honduras. Durante las reuniones se abordaron temas relacionados con la emergencia sanitaria por el covid-19, los resultados de ...",31-10-2020 14:05,https://www.bing.com/th?id=OVFT.v0Og53NAbBwU_jusYFHYrC,Chile,El Heraldo
Por segunda vez consecutiva Puerto Lempira gana premio campeón de la Malaria de las Américas,https://ultimahora.hn/por-segunda-vez-consecutiva-puerto-lempira-gana-premio-campeon-de-la-malaria-de-las-americas/,Los videos que ilustran cada uno de los proyectos fueron mostrados en el foro llamado “La malaria cero comienza conmigo: Combatir la COVID-19. Proteger a los trabajadores de la salud. Poner fin a la malaria”. Honduras ha ganado otros premios en la ...,31-10-2020 14:11,https://www.bing.com/th?id=OVFT.tpf8UaKtHX5QS3FLDwdOhy,Chile,Ultima Hora
"Ministerio Público investiga a Carlos Cordero, nuevo embajador de Honduras en el Vaticano",https://www.elheraldo.hn/pais/1419193-466/carlos-cordero-embajador-honduras-vaticano-corrupcion-copeco,El exministro de Copeco será citado por el MP antes de que viaje al Vaticano para que rinda su declaración en calidad de investigado en dos expedientes de presuntos actos de corrupción,31-10-2020 14:32,https://www.bing.com/th?id=OVFT.hRtB9iIo_yiUlaQBZDpw-S,Chile,El Heraldo
