name,url,description,datePublished,imagen,pais,Fuente
Autoridades del hospital psiquiátrico de Santa Rosita aseguran que la situación se ha ido de las manos tras reportarse brote de covid-19,https://www.radiohrn.hn/autoridades-del-hospital-psiquiatrico-de-santa-rosita-aseguran-que-la-situacion-se-ha-ido-de-las-manos-tras-reportarse-brote-de-covid-19,Los dirigentes de los hospitales psiquiátricos anunciaron protestas para la próxima semana ante la desatención de los pacientes,25-10-2020 14:35,https://www.bing.com/th?id=OVFT.ftMydVsN9_S491Hbj7mhBi,Chile,Radio HRN
"Más de 340,000 personas han atendido en centros de triaje en Honduras",https://www.laprensa.hn/especiales/coronavirus/1417952-410/personas-pacientes-atendidos-centros-triajes-honduras-pandemia-covid,"Tegucigalpa, Honduras. El coordinador de Operaciones contra el COVID-19, Julio Quiñónez, informó que en los centros de triaje a nivel nacional se han atendido a unas 342,000 pe",25-10-2020 17:19,https://www.bing.com/th?id=OVFT.u3bMTQ1CDdq9t3Xb1yYLSS,Chile,La Prensa Chicos
"Coronavirus ataca al Reginna del hondureño Rigoberto Rivas, donde reportan 21 miembros infectados",https://www.diez.hn/legionarios/1417970-498/coronavirus-reggina-italia-rigoberto-rivas-legionario-honduras-italia-calcio-seriea,"Después de los 16 casos ya encontrados, otros 11 positivos surgieron con Covid, entre ellos el entrenador y el entrenador asistente que dirigen al jugador catracho.",25-10-2020 19:25,https://www.bing.com/th?id=OVFT.z_J0qFybUoCSUNNjcmldoi,Chile,diez.hn
"La factura petrolera de Honduras baja un 40,7 % en ocho meses por la COVID-19",https://www.latribuna.hn/2020/10/25/la-factura-petrolera-de-honduras-baja-un-407-en-ocho-meses-por-la-covid-19/,"La factura petrolera de Honduras sumó 623,8 millones de dólares entre enero y agosto de este año, un 40,7 % menos que en el mismo período de 2019, y compró 1,9 millones de barriles menos de hidrocarbu",25-10-2020 21:23,https://www.bing.com/th?id=OVFT.j49NPnlmwq_qcvcaC5-umi,Chile,La Tribuna
Hondureña dio a luz en centro de triaje al momento que buscada atención médica en Yoro,https://www.radiohrn.hn/hondurena-dio-a-luz-en-centro-de-triaje-al-momento-que-buscada-atencion-medica-en-yoro,"Una hondureña dio a luz a un hermoso bebé al momento que buscaba el domingo (25.10.2020) asistencia médica en el Centro de Triaje La Fragua, donde se practican exámenes de covid-19, en El Progreso en",26-10-2020 03:27,https://www.bing.com/th?id=OVFT.vLUmSxbF602VTcpFbDcDEC,Chile,Radio HRN
"Honduras reporta 93,214 casos de covid-19 y suma 2,623 muertes",https://www.elheraldo.hn/pais/1418048-466/honduras-reporta-casos-covid-suma-mas-muertos,"TEGUCIGALPA; HONDURAS.-El coronavirus sigue sin dar tregua a los hondureños. El Sistema Nacional de Gestión de Riesgos (Sinager) reportó este domingo que de 1,197 pruebas que se procesaron, 490 result",26-10-2020 04:00,https://www.bing.com/th?id=OVFT.Gd4ErNDWWKlRnjKJQ5Jv9C,Chile,El Heraldo
Lamenta Carlos Umaña: La población le ha perdido el respeto al COVID-19,https://www.latribuna.hn/2020/10/26/lamenta-carlos-umana-la-poblacion-le-ha-perdido-el-respeto-al-covid-19/,"El presidente de la Asociación de Médicos del Instituto Hondureño de Seguridad Social (IHSS) en San Pedro Sula, Carlos Umaña, manifestó que la población ya le perdió el respeto al COVID-19. Honduras s",26-10-2020 07:00,https://www.bing.com/th?id=OVFT.HJTWwwpQlCrwE6q_6gwtZy,Chile,La Tribuna
Pacientes y personal del Santa Rosita se contagiaron de covid-19,https://www.elheraldo.hn/pais/1418086-466/pacientes-y-personal-del-santa-rosita-se-contagiaron-de-covid-19,El presidente del sindicato del hospital solicitó pruebas rápidas para testear a pacientes que ingresan al centro,26-10-2020 12:48,https://www.bing.com/th?id=OVFT.PRosJAZtwMumYH7eQWM-_S,Chile,El Heraldo
A partir de 2021 la COVID-19 se convertirá en endemia,https://proceso.hn/a-partir-de-2021-la-covid-19-se-convertira-en-endemia/,"“Son enfermedades que van a estar constantemente en nuestro país, así como la influenza que es una enfermedad que llegó a Honduras para quedarse, así viene también la COVID-19, así que nos va a tocar aprender a convivir con esa enfermedad ...",26-10-2020 14:33,https://www.bing.com/th?id=OVFT.rwgiRxmEBikwZl_sXGdDiC,Chile,Proceso
CN asegura “ha actuado a tiempo” aprobando medidas para contrarrestar efectos de la pandemia,https://hondudiario.com/2020/10/26/cn-asegura-ha-actuado-a-tiempo-aprobando-medidas-para-contrarrestar-efectos-de-la-pandemia/,"El presidente del Congreso Nacional (CN), Mauricio Oliva, participó en los últimos días, como expositor en el Encuentro de Parlamentarios de la Unión de Partidos Latinoamericanos (UPLA) tocando el tem",26-10-2020 15:11,https://www.bing.com/th?id=OVFT.0s06zF5PFJJZh7BsD_qH_y,Chile,Hondudiario
Honduras se proyecta como el país centroamericano que tendrá la mayor recuperación de exportaciones en 2021,https://ultimahora.hn/honduras-se-proyecta-como-el-pais-centroamericano-que-tendra-la-mayor-recuperacion-de-exportaciones-en-2021/,"A pesar del importante debilitamiento de las economías y el comercio mundial como consecuencia de la crisis provocada por la pandemia de COVID-19, se vislumbra un panorama ... de las exportaciones sería mayor en Honduras con un 19,2%, mientras que ...",26-10-2020 15:16,https://www.bing.com/th?id=OVFT.llJ3jGh58cj_VUtXLpsv8y,Chile,Ultima Hora
Al menos 138 mujeres han perdido la vida de forma violenta durante la cuarentena,https://hondudiario.com/2020/10/26/al-menos-138-mujeres-han-perdido-la-vida-de-forma-violenta-durante-la-cuarentena/,"La directora del Observatorio de la Violencia de la Universidad Nacional Autónoma de Honduras, (OV-UNAH), Migdonia Ayestas, informó que al menos 138 mujeres han perdido la vida en situaciones violenta",26-10-2020 15:49,https://www.bing.com/th?id=OVFT.c1lW4Cj-auJWcxNukn7V_C,Chile,Hondudiario
Ramón Maradiaga y Ricardo Canales vuelven a dar positivo de Covid-19,https://www.diariomas.hn/2020/10/24/ramon-maradiaga-y-ricardo-canales-vuelven-a-dar-positivos-de-covid-19/,"El plantel del equipo Vida de la ciudad de La Ceiba fue sometido este sábado a pruebas de Covid-19, luego que a inicios de la semana dieran positivos",26-10-2020 16:18,https://www.bing.com/th?id=OVFT.mehBAJkKSK77QDJv7Tt-bi,Chile,Mas
CPH realiza tamizaje para detectar el COVID-19 en periodistas y trabajadores de la comunicación,https://proceso.hn/cph-realiza-tamizaje-para-detectar-el-covid-19-en-periodistas-y-trabajadores-de-la-comunicacion/,"Tegucigalpa – En el Colegio de Periodistas de Honduras (CPH), se realiza hoy la segunda jornada de prueba rápidas para detectar el contagio o no del COVID-19 en los periodistas y el resto de trabajado",26-10-2020 16:55,https://www.bing.com/th?id=OVFT.0ZTRdB8KSF_4KDDOWXQLIC,Chile,Proceso
"Mascarilla Solidaria, el proyecto benéfico que reune artista de Honduras y Centroamérica",https://www.laprensa.hn/sociales/1418162-410/mascarilla-solidaria-el-proyecto-ben%C3%A9fico-que-reune-artista-de-honduras-y-centroam%C3%A9rica,"Mascarilla solidaria es una iniciativa que reúne a reconocidos artistas hondureños y del resto de Centroamérica en un proyecto inspirado en la crisis que se atraviesa a nivel mundial, el covid-19. 250 artistas ... Las Flores en Honduras en 1944.",26-10-2020 17:01,https://www.bing.com/th?id=OVFT.1vXAIZA94hXLT50lSzhFBy,Chile,La Prensa Chicos
