name,url,description,datePublished,imagen,pais,Fuente
El BCIEanuncio que emitió bono por $ 50.1 millones para vacuna contra COVID-19,https://ultimahora.hn/el-bcieanuncio-que-emitio-bono-por-50-1-millones-para-vacuna-contra-covid-19/,"El Banco Centroamericano de Integración Económica (BCIE) anunció  que ha emitido un segundo bono por 50,1 millones de dólares, con la participación de inversionistas regionales japoneses, dinero",09-12-2020 14:12,https://www.bing.com/th?id=OVFT.itRHlsSXhbvb4Wqwt8dkvS,Chile,Ultima Hora
La reina Letizia de España llegará a Honduras la próxima semana constatará daños de Eta e Iota y entregará ayuda humanitaria,https://ultimahora.hn/la-reina-letizia-de-espana-llegara-a-honduras-la-proxima-semana-constatara-danos-de-eta-e-iota-y-entregara-ayuda-humanitaria/,La reina Letizia viajará el próximo lunes 14 y 15 de diciembre a Honduras para transmitir el apoyo de España a las autoridades y ONG del país centroamericano tras los graves daños causados por los,09-12-2020 15:15,https://www.bing.com/th?id=OVFT.gB88dGPU_PwZT9zMxRqlgi,Chile,Ultima Hora
La reina Reina Letizia de España visitará Honduras para entregar ayuda humanitaria a afectadas por Eta e Iota,http://www.eldiario.hn/la-reina-reina-letizia-de-espana-visitara-honduras-para-entregar-ayuda-humanitaria-a-afectadas-por-eta-e-iota/,Tegucigalpa. - La Reina Letizia de España visitará Honduras los próximos 14 y 15 de diciembre para entregar ayuda humanitaria del pueblo español a las zonas afectadas por las tormentas Eta e Iota. Cab,09-12-2020 17:46,https://www.bing.com/th?id=OVFT.isOr18eEiVt-7px-RqOz5i,Chile,El Diario
Una aplicación para dispositivos móviles ayudará a identificar brotes de covid-19 y otras enfermedades en Cortés,http://www.eldiario.hn/una-aplicacion-para-dispositivos-moviles-ayudara-a-identificar-brotes-de-covid-19-y-otras-enfermedades-en-cortes/,San Pedro Sula. - La Secretaría de Salud y la delegación de expertos de Israel que se encuentra en Honduras trabajan para implementar una aplicación para dispositivos móviles que permitirá identificar,09-12-2020 18:12,https://www.bing.com/th?id=OVFT.xRtJYiYFBDKwnS9iALJeRi,Chile,El Diario
Reportan tres decesos por COVID-19 en Tegucigalpa,https://proceso.hn/reportan-un-fallecimiento-por-covid-19-en-tegucigalpa/,"Tegucigalpa – Tres personas fallecieron bajo sospecha de COVID-19 en el Hospital de Especialidades del Instituto Hondureño de Seguridad Social (IHSS), el Instituto Nacional Cardiopulmonar del Tórax y",09-12-2020 19:32,https://www.bing.com/th?id=OVFT.T1sS4mdeu38M8aAOB-mYSS,Chile,Proceso
OPS advierte del alza en los contagios de Covid-19 en Centroamérica y Brasil,https://hondudiario.com/2020/12/09/ops-advierte-del-alza-en-los-contagios-de-covid-19-en-centroamerica-y-brasil/,La Organización Panamericana de la Salud (OPS) advirtió este miércoles de que en las últimas semanas la región de las Américas registra los niveles más altos de nuevos casos de covid-19 desde el inici,09-12-2020 21:01,https://www.bing.com/th?id=OVFT.mhdn6iVNR9B89WMk5VR16i,Chile,Hondudiario
HONDURAS / ÉPOCA NAVIDEÑA DESENCADENARÁ MÁS CASOS COVID-19,http://www.web.ellibertador.hn/index.php/noticias/nacionales/2500-honduras-epoca-navidena-desencadenara-mas-casos-covid-19,"La problemática por la pandemia en Honduras se agudiza por indisciplinada de la población y negligencia con que las autoridades han manejado la crisis, la alerta crece porque en épocas festivas es cua",09-12-2020 22:25,https://www.bing.com/th?id=OVFT.2cXF_D4coGfz698kFczKjS,Chile,El Libertador
Motagua libre de covid-19; Real Estelí con un caso positivo,https://www.diariomas.hn/2020/12/09/motagua-libre-de-covid-19-real-esteli-con-un-caso-positivo/,"Luego de las pruebas de hisopado realizadas a los futbolistas del equipo Motagua y Real Estelí de Nicaragua, previo al juego de repechaje clasificatorio",09-12-2020 22:44,https://www.bing.com/th?id=OVFT.xYdc3o0pP4mUhhWOE9vdwy,Chile,Mas
Honduras registra 617 nuevos casos de coronavirus y nueve fallecidos,https://www.laprensa.hn/honduras/1428421-410/honduras-casos-coronavirus-fallecidos-pandemia-,"Se suman 544 nuevos casos de pacientes recuperados, con los que ya suman 50.888, desde marzo en el país, señaló el Sistema Nacional de Gestión de Riesgos (Sinager).",10-12-2020 04:00,https://www.bing.com/th?id=OVFT.tewfOVq8jcJy7Yz0GS-tVy,Chile,La Prensa Chicos
COVID-19 en Honduras: SINAGER confirma 617 nuevos casos y 9 muertos,https://tiempo.hn/covid-19-en-honduras-sinager-617-casos-9-muertos/,"TEGUCIGALPA, HONDURAS. De 1,811 nuevas pruebas para diagnosticar COVID-19 que procesó el Laboratorio Nacional de Virología (LNV), de la Secretaría de Salud (SESAL), 617 resultaron positivas, por lo qu",10-12-2020 04:43,https://www.bing.com/th?id=OVFT.N4iiSBt2tHx8mD0fmCfltS,Chile,Tiempo
Afirma ministra de Salud: Ocupación por COVID-19 es de 40% en hospitales,https://www.latribuna.hn/2020/12/10/afirma-ministra-de-salud-ocupacion-por-covid-19-es-de-40-en-hospitales/,"Afirma ministra de Salud: Ocupación por COVID-19 es de 40% en hospitales. La ocupación hospitalaria del país para la atención del COVID-19 se mantiene en un 40 por ciento, afirmó la ministra de la Sec",10-12-2020 10:22,https://www.bing.com/th?id=OVFT.GiB58mEMLXQJOXYvK2cT5C,Chile,La Tribuna
"""El milagro de Tegucigalpa"", la prensa de Nicaragua tras el bochorno del Motagua ante Real Estelí",https://www.diez.hn/liganacionaldehonduras/1428454-498/motagua-real-esteli-repechaje-champions-concacaf-prensa,"Inicio > Liga Nacional ""El milagro de Tegucigalpa"", la prensa de Nicaragua tras el bochorno del Motagua ante Real Estelí La prensa de Nicaragua celebró por todo lo alto la clasi",10-12-2020 12:57,https://www.bing.com/th?id=OVFT.x5LN-GmUPvahIkKaZzyv8y,Chile,diez.hn
IHSS de Tegucigalpa no reporta decesos por COVID-19 este jueves,https://proceso.hn/ihss-de-tegucigalpa-no-reporta-decesos-por-covid-19-este-jueves/,"Tegucigalpa – Este jueves no se reportan decesos bajo sospecha de COVID-19 en el Hospital de Especialidades del Instituto Hondureño de Seguridad Social (IHSS), de Tegucigalpa. Así lo confirmó la porta",10-12-2020 14:11,https://www.bing.com/th?id=OVFT.Yn_IZqlZqXFgnFdQZHC1HC,Chile,Proceso
Contagios de Covid-19 aumentan por no respetar medidas de bioseguridad: viceministro de Salud,https://hondudiario.com/2020/12/10/contagios-de-covid-19-aumentan-por-no-respetar-medidas-de-bioseguridad-viceministro-de-salud/,"Este miércoles el viceministro de Salud, Roberto Cosenza, señaló que el aumento en los contagios por la Covid-19 han aumentado debido a la actitud indiferente de los ciudadanos que no respetan las med",10-12-2020 15:06,https://www.bing.com/th?id=OVFT._fB4n03vTgWfdz-mGQ-kEi,Chile,Hondudiario
"Honduras suma 112,792 casos de coronavirus y 2,961 muertos en casi nueve meses",https://www.laprensa.hn/honduras/1428472-410/honduras-casos-coronavirus-muertos-recuperados-pruebas-covid-19,"De 1,811 nuevas pruebas PCR de laboratorio procesadas, 617 dieron positivo, con las que los casos se elevaron a 112,792, indicó el Sistema Nacional de Gestión de Riesgos (Sinager)",10-12-2020 15:08,https://www.bing.com/th?id=OVFT.HO8Vw2WOE7ZGAF4IoBiVSi,Chile,La Prensa Chicos
"Choco Lozano tras superar el covid-19: ""En este momento no se deberían hacer esos amistosos""",https://www.diez.hn/legionarios/1428584-498/choco-lozano-covid-amistosos-seleccion-honduras-cadiz-barcelona-cervera-negredo,"El delantero hondureño del Cádiz, Antony 'Choco' Lozano, contó la pesadilla que vivió tras dar positivo por covid-19 en la Selección de Honduras.",10-12-2020 21:12,https://www.bing.com/th?id=OVFT.58HSeDtbiyeIfWjAWv8sRi,Chile,diez.hn
COHEP dará dos garantías bancarias al IHSS para compra de vacuna contra COVID-19,https://tiempo.hn/garantias-bancarias-cohep-ihss-vacuna-covid-19/,"Las garantías bancarias para la compra de la vacuna contra el COVID-19 ascienden a más de $3.3 millones, según el COHEP. TEGUCIGALPA, HONDURAS. A través de una conferencia de prensa, el Consejo Hondur",10-12-2020 23:40,https://www.bing.com/th?id=OVFT.XBk3n8shHfvF4NYTI59kvy,Chile,Tiempo
Honduras cerró en puesto 64 del Ranking FIFA,https://www.diariomas.hn/2020/12/10/honduras-cerro-en-puesto-64-del-ranking-fifa/,"A pesar de que la Selección Nacional de Honduras no pudo ganar sus dos partidos internacionales de 2020, se mantuvo en el puesto 64 del ranking de",10-12-2020 23:45,https://www.bing.com/th?id=OVFT.GTOHBARLsySCg1fLZ6yS-i,Chile,Mas
Conadeh recomienda flexibilizar la recaudación tributaria a Mipymes,https://www.latribuna.hn/2020/12/10/conadeh-recomienda-flexibilizar-la-recaudacion-tributaria-a-mipymes/,"El Comisionado Nacional de los Derechos Humanos (CONADEH) recomendó, al Poder Ejecutivo y al Congreso Nacional, suspender el cobro de cargas impositivas, en el presente período, a las micro, pequeñas",11-12-2020 00:08,https://www.bing.com/th?id=OVFT.OcSTZ7hnFOq7ELiNtRrBZi,Chile,La Tribuna
