name,url,description,datePublished,imagen,pais,Fuente
Tenemos que aprender a convivir con el COVID-19: Roxana Araujo,http://www.elsoldehonduras.com/nacionales/tenemos-que-aprender-a-convivir-con-el-covid-19-roxana-araujo/,"La exministra de Salud, Roxana Araujo, manifestó que hay que aprender a vivir con el COVID-19, ya que esta enfermedad vino para ... “Ya cumplimos 6 meses del primer caso en Honduras, ya después de estos seis meses, con este autoaislamiento, con estas ...",14-09-2020 17:47,https://www.bing.com/th?id=OVFT.vxS3S35VOP-3f3ElJGy0CS,Chile,El Sol de Honduras
En día 188 de pandemia Honduras sobrepasa los 68 mil casos de COVID,https://proceso.hn/en-dia-188-de-pandemia-honduras-sobrepasa-los-68-mil-casos-de-covid/,"Tegucigalpa – En su día 188 desde que se registraron los primeros casos de COVID 19 en Honduras los positivos sobrepasan los 68 mil casos, informó la noche de este domingo el Sistema Nacional de Gesti",15-09-2020 03:27,https://www.bing.com/th?id=OVFT.We_z4pbqcpxTwXN4lu7W9y,Chile,Proceso
Honduras conmemora sus 199 años de Independencia en medio de la pandemia,https://hondudiario.com/2020/09/15/honduras-conmemora-sus-199-anos-de-independencia-en-medio-de-la-pandemia/,"Honduras conmemora este martes su 199 aniversario de Independencia Patria, de una forma atípica, en confinamiento y en medio de la crisis sanitaria que atraviesa por el COVID-19 y que agudiza problemá",15-09-2020 06:50,https://www.bing.com/th?id=OVFT.x2cHZnlOSzthkXrG8qmSvC,Chile,Hondudiario
Capo Wilter Blanco pide arresto domiciliario por el covid-19,https://www.elheraldo.hn/pais/1408495-466/capo-wilter-blanco-pide-arresto-domiciliario-por-el-covid-19,"El narco aseguró que tiene enfermedades de base que podrían en riesgo su salud si se contagia de covid-19 TEGUCIGALPA, HONDURAS.-El narcotraficante Wilter Blanco, condenado a 20 años de prisión, solic",15-09-2020 11:17,https://www.bing.com/th?id=OVFT.Na_oMFf9zZd_AlcvO8mJeC,Chile,El Heraldo
Consulado de Honduras en Charlotte abre en octubre,https://www.elheraldo.hn/minisitios/hondurenosenelmundo/1408491-471/consulado-de-honduras-en-charlotte-abre-en-octubre,"La nueva sede estaba planificada para ser abierta desde el pasado mes de marzo, pero se canceló por el covid-19 TEGUCIGALPA, HONDURAS.-A partir del próximo mes la comunidad de hondureños en Charlotte,",15-09-2020 11:21,https://www.bing.com/th?id=OVFT.w5hIOmUpAEVi8e3rx60M-i,Chile,El Heraldo
Colibríes de un parque hondureño atraen turismo afectado por la COVID-19,https://www.latribuna.hn/2020/09/15/colibries-de-un-parque-hondureno-atraen-turismo-afectado-por-la-covid-19/,"El turismo de Honduras, afectado por la pandemia de COVID-19, se recupera despacio con muchas personas que se movilizan a diversos sitios como el Parque Nacional Cerro Azul Meámbar (Panacam), donde lo",15-09-2020 15:22,https://www.bing.com/th?id=OVFT.eiXdp7BZKAOnm1x5rX2vWS,Chile,La Tribuna
Colibríes de Panacam atraen turismo afectado por la Covid-19,https://www.laprensa.hn/honduras/1408533-410/colibr%C3%ADes-panacam-atraen-turismo-afectado-covid19-honduras,"El Parque Nacional Cerro Azul Meámbar es refugio de unas 28 especies de colibríes. Cerro Azul Meámbar. El turismo de Honduras, afectado por la pandemia de COVID-19, se recupera despacio con muchas per",15-09-2020 15:26,https://www.bing.com/th?id=OVFT.EXt6OLw3lzNAkjG_EkYvUC,Chile,La Prensa Chicos
Honduras celebra 199 años de Independencia de una manera diferente debido al covid,https://www.radiohrn.hn/honduras-celebra-199-anos-de-independencia-de-una-manera-diferente-debido-al-covid,"Honduras conmemora este 15 de septiembre el 199 aniversario de Independencia Patria, que fue proclamada el 15 de septiembre de 1821. Este 2020, la celebración se torna de manera distinta y peculiar, s",15-09-2020 16:02,https://www.bing.com/th?id=OVFT.cmnnUXfalu4B0OY9DmNSQC,Chile,Radio HRN
Google rinde homenaje a Honduras en su 199 aniversario de independencia patria,https://www.radiohrn.hn/google-rinde-homenaje-a-honduras-en-su-199-aniversario-de-independencia-patria,"El gigante de las búsquedas Google en Internet rinde homenaje este 15 de septiembre a Honduras en el 199 aniversario de independencia patria. Al entrar al buscador, las personas pueden observar la ban",15-09-2020 16:02,https://www.bing.com/th?id=OVFT.jqEmH7xMqe-CwXp6YD7FZC,Chile,Radio HRN
Doctor Samuel Santos internado por sospechas de COVID-19,https://www.laprensa.hn/honduras/1408587-410/doctor-samuel-santos-internado-sospecha-covid-vicepresidente-colegio-medicos-honduras,"El vicepresidente del Colegio de Médicos de Honduras (CMH) y reconocido neonatólogo de la zona norte de Honduras tiene neumonía. San Pedro Sula, Honduras. El reconocido médico de la zona norte del paí",15-09-2020 18:50,https://www.bing.com/th?id=OVFT.cSvqheaSj2rB_S8opXdzgi,Chile,La Prensa Chicos
Centros de Desarrollo Empresarial se suman a la estrategia ¨Honduras Se Levanta¨,http://www.elsoldehonduras.com/economia/centros-de-desarrollo-empresarial-se-suman-a-la-estrategia-%C2%A8honduras-se-levanta%C2%A8/,Los Centros de Desarrollo Empresarial de Honduras han decidido integrarse a la estrategia ¨Honduras Se Levanta¨ para ayudar a los emprendedores y MIPYMES afectados por la crisis que generó la COVID 19,15-09-2020 20:02,https://www.bing.com/th?id=OVFT.B4elaw0acqKEzgMXGvCsOy,Chile,El Sol de Honduras
Pandemia vulnera los derechos de niños hondureños y aumenta trabajo infantil,https://proceso.hn/pandemia-vulnera-los-derechos-de-ninos-hondurenos-y-aumenta-trabajo-infantil/,"Tegucigalpa – La pandemia de la COVID-19 ha agudizado la compleja situación de la niñez en Honduras al vulnerar derechos como a una vida libre de violencia y la educación, y aumentar la pobreza, lo qu",15-09-2020 20:40,https://www.bing.com/th?id=OVFT.DhPu7oX7uUnMVV1KGvxoei,Chile,Proceso
Presidente Hernández: se debe seguir trabajando en la integración,https://www.latribuna.hn/2020/09/15/presidente-hernandez-se-debe-seguir-trabajando-en-la-integracion/,"El presidente de Honduras, Juan Orlando Hernández, dijo en este 199 aniversario de la independencia, que se debe seguir trabajando en la integración regional. Tegucigalpa, 15 sep (EFE).- El presidente",15-09-2020 21:07,https://www.bing.com/th?id=OVFT.8m7F60yTMGaNXt095SuPLC,Chile,La Tribuna
Pandemia vulnera derechos de niños en Honduras y aumenta el trabajo infantil,https://hondudiario.com/2020/09/15/pandemia-vulnera-derechos-de-ninos-en-honduras-y-aumenta-el-trabajo-infantil/,"La pandemia de la COVID-19 ha agudizado la compleja situación de la niñez en Honduras al vulnerar derechos como a una vida libre de violencia y la educación, y aumentar la pobreza, lo que podría dupli",15-09-2020 21:42,https://www.bing.com/th?id=OVFT.RNO9F8K1-SlYGXmWaCGOqS,Chile,Hondudiario
