name,url,description,datePublished,imagen,pais,Fuente
Dani Turcios está cerca de ser el nuevo técnico del Honduras Progreso,https://www.diez.hn/liganacionaldehonduras/1400096-498/dani-turcios-cerca-nuevo-tecnico-honduras-progreso-liga-nacional,"Elvis Danilo Turcios estaría muy cerca de convertirse en el nuevo técnico del Honduras Progreso, de acuerdo a lo conocido de manera exclusiva por DIEZ. El exmundialista con la Bicolor en Sudáfrica 201",09-08-2020 00:00,https://www.bing.com/th?id=ON.460C3348EF1A8E08D5FA858765D1A739,Chile,diez.hn
Fuerza Honduras envía transferencias a 255 municipios para combatir COVID-19 (Galería),https://www.latribuna.hn/2020/08/09/fuerza-honduras-envia-transferencias-a-255-municipios-para-combatir-covid-19-galeria/,"El programa Fuerza Honduras, que el Gobierno de la República realiza para el combate a la pandemia de coronavirus, ya ha entregado fondos a 255 municipios y entre lunes y martes totalizará 282, de los",09-08-2020 03:58,https://www.bing.com/th?id=ON.06CBE75970A84F6616B86AAD39204E08,Chile,La Tribuna
Al menos 10 decesos bajo sospecha de COVID se reportan en SPS,https://www.proceso.hn/actualidad/7-actualidad/al-menos-10-decesos-bajo-sospecha-de-covid-se-reportan-en-sps.html,"San Pedro Sula-Las autoridades sanitarias de la costa norte del país, informaron que durante este fin de semana se reportó una decena de decesos bajo sospecha de COVID-19 en el hospital Mario Catarino",09-08-2020 15:37,https://www.bing.com/th?id=ON.F0BE305B9885116B39F4470C87CC5179,Chile,Proceso
Celebran de forma virtual la Semana Mundial de la Lactancia Materna,http://www.eldiario.hn/celebran-de-forma-virtual-la-semana-mundial-de-la-lactancia-materna/,"Tegucigalpa.- Autoridades del Gobierno de Honduras, junto a representantes de la Organización Mundial de la Salud (OPS/OMS) y el Fondo de las Naciones Unidas para la Infancia (UNICEF), celebraron de f",09-08-2020 23:30,https://www.bing.com/th?id=ON.7D530252D33BE41812D2F05851494496,Chile,El Diario
Coronavirus en Honduras: Mapa y gráficos del crecimiento de casos,https://www.elheraldo.hn/interactivos/1377996-523/coronavirus-en-honduras-mapa-y-gr%C3%A1ficos-del-crecimiento-de-casos,"Desde el 11 de marzo, cuando se detectaron los dos primeros casos positivos, Honduras trata de contener la expansión de la enfermedad El coronavirus (Covid-19) entró oficialmente en Honduras en marzo",10-08-2020 00:41,https://www.bing.com/th?id=ON.A0AEAA5832C80481D879A67EDF1EABB9,Chile,El Heraldo
Se debe duplicar o triplicar la cantidad de pruebas en Honduras,https://www.elheraldo.hn/pais/1400081-466/duplicar-o-triplicar-la-cantidad-de-pruebas-honduras,"Marco Tulio Medina mencionó que la cantidad de personas asintomáticas es elevada y al no estar diagnosticadas representan un riesgo para el resto de la población TEGUCIGALPA, HONDURAS.-La poca aplicac",10-08-2020 06:23,https://www.bing.com/th?id=ON.1E32757AE479E8156FB1882365DFD105,Chile,El Heraldo
Comando Sur lleva ayuda a municipios de Honduras,https://www.laprensa.hn/honduras/1400111-410/comando-sur-honduras-municipios-coronavirus,"Centros médicos del municipio de La Lima, Cortés, y Gracias, Lempira, son beneficiados por donación de equipo biomédico del Comando Sur que es parte del Departamento de Defensa de los Estados Unidos.",10-08-2020 07:39,https://www.bing.com/th?id=ON.DD5F807F2AAD7804B6EAC75C0590AAE6,Chile,La Prensa Chicos
Ya suman 1.495 los fallecidos y aumenta a 47.454 los casos por coronavirus,https://elpatriota.hn/2020/08/10/ya-suman-1-495-los-fallecidos-y-aumenta-a-47-454-los-casos-por-coronavirus/,"TEGUCIGALPA,HONDURAS.  El Sistema Nacional de Gestión de Riesgo (Sinager) confirmó hoy 481 nuevos positivos de coronavirus, con los que Honduras llega a 47.454 casos desde el inicio de la pandemia. El",10-08-2020 14:42,https://www.bing.com/th?id=ON.52BEFD19ECEF51654E2FCFDB86E56986,Chile,El Patriota
"Coronavirus podría “no irse nunca”, nadie se puede relajar",https://www.latribuna.hn/2020/08/10/coronavirus-podria-no-irse-nunca-nadie-se-puede-relajar/,"La Organización Mundial de la Salud (OMS), alertó recientemente que la COVID-19 puede convertirse en un virus endémico y, por tanto, «no irse nunca», por lo que a nivel mundial la mayoría de los paíse",10-08-2020 15:02,https://www.bing.com/th?id=ON.72DF64EF125F17E9FF33236369ACA165,Chile,La Tribuna
"Por COVID-19 ingresan al Hospital del Tórax a Carlos Cordero, titular de COPECO",https://elpatriota.hn/2020/08/10/por-covid-19-ingresan-al-hospital-del-torax-a-carlos-cordero-titular-de-copeco/,"TEGUCIGALPA, HONDURAS. Esta mañana se confirmó que el titular de la Comisión Permanente de Contingencias (COPECO), Carlos Cordero, ayer, domingo, fue ingresado al Instituto Nacional Cardiopulmonar, má",10-08-2020 15:18,https://www.bing.com/th?id=ON.E113BC7F3A0B26266C29128F78D7CAF3,Chile,El Patriota
"A excepción de uno, aeropuertos de Honduras reinician operaciones con vuelos nacionales",https://www.radiohrn.hn/aeropuertos-de-honduras-reinician-operaciones-con-vuelos-nacionales,"El gobierno autorizó el reinicio de las actividades en aeropuertos a partir del 10 de agosto, para vuelos nacionales, y el 17 para internacionales. Los aeropuertos de Honduras comenzaron el lunes con",10-08-2020 15:33,https://www.bing.com/th?id=ON.1EE336D54D80F16611D020251E214305,Chile,Radio HRN
"Honduras supera los 47 mil contagios y roza las 1,500 muertes por coronavirus",https://hondudiario.com/2020/08/09/honduras-supera-los-47-mil-contagios-y-roza-las-1500-muertes-por-coronavirus/,"El Sistema Nacional de Gestión de Riesgos (Sinager), informó este domingo que de 1,245 pruebas para diagnosticar Covid-19 en el país, 481 dieron positivo, sumando así un total de 47,454 casos de coron",10-08-2020 15:33,https://www.bing.com/th?id=ON.D74C3352368601B559614A33DF1D598D,Chile,Hondudiario
Salud recibió “a su entera satisfacción” pruebas COVID dañadas de Invest-H,https://hondudiario.com/2020/08/10/salud-recibio-a-su-entera-satisfaccion-pruebas-covid-danadas-de-invest-h/,"*** El acta de recepción de las primeras 100 mil pruebas no indica problemas con las pruebas a pesar de aceraciones por Salud e Invest-H. Tegucigalpa, Honduras. Inversiones Estratégicas de Honduras (I",10-08-2020 15:33,https://www.bing.com/th?id=ON.21B234D9BF8B437AB92E5C0C2947D9C1,Chile,Hondudiario
Ingresan al Hospital del Tórax a ministro de Copeco tras dar positivo de COVID-19,https://www.laprensa.hn/honduras/1400151-410/ingresado-hospital-torax-ministro-copeco-carlos-cordero-coronavirus,"La institución informó que el comisionado Carlos Cordero se encuentra estable de salud. Tegucigalpa, Honduras. Carlos Cordero, ministro comisionado nacional de la Comisión Permanente de Contingencias",10-08-2020 15:53,https://www.bing.com/th?id=ON.032751482475DA411F586BF7E701C091,Chile,La Prensa Chicos
Antonio Banderas anuncia que tiene covid-19 en su 60 cumpleaños,https://www.diez.hn/noticiasdelmundo/1400162-498/antonio-banderas-anuncia-que-tiene-covid-19-en-su-cumplea%C3%B1os-60-actor,"Banderas no acudió la noche del domingo a una gala benéfica anual de la que debía ser anfitrión, en Marbella, una ciudad balneario a 60 km de Málaga. El actor español Antonio Banderas anunció este lun",10-08-2020 16:01,https://www.bing.com/th?id=ON.934842E0BC3736C1A3E4CDC13473FBF7,Chile,diez.hn
