name,url,description,datePublished,imagen,pais,Fuente
Panorama incierto en Honduras tras seis meses de pandemia de COVID-19,https://proceso.hn/panorama-incierto-en-honduras-tras-seis-meses-de-pandemia-de-covid-19/,"Tegucigalpa.– La pandemia de COVID-19 en Honduras ha dejado en seis meses 2.000 muertos y más de 63.000 contagiados, según fuentes oficiales, sin que se vislumbre un claro descenso de la enfermedad, m",06-09-2020 09:30,https://www.bing.com/th?id=ON.2BD66CE57E9C9339BF0A96CE4DE0832A,Chile,Proceso
"Honduras alcanza 64,764 casos positivos de la COVID-19",https://www.latribuna.hn/2020/09/06/honduras-alcanza-64764-casos-positivos-de-la-covid-19/,"La pandemia de la COVID-19 registra 64,764 casos positivos en Honduras, donde este domingo se modificó la apertura gradual de la economía, al permitir que los municipios turísticos de Tela y Omoa pasa",06-09-2020 09:42,https://www.bing.com/th?id=ON.5CBB60CA72BC1A4749E52D29AF5A4B85,Chile,La Tribuna
Pago de salarios y deuda consumen más del 40 por ciento del presupuesto en Honduras,https://www.radiohrn.hn/pago-de-salarios-y-deuda-consumen-mas-del-40-por-ciento-del-presupuesto-en-honduras,"La economía hondureña no podrá salir de la recesión en que se encuentra a causa de la pandemia covid-19, si no es por la vía de un ordenamiento fiscal Hay dos renglones que absorben la mayor parte del",06-09-2020 15:18,https://www.bing.com/th?id=ON.1183E7210BFC017623361438EF7D2ECB,Chile,Radio HRN
Se prevé caída en la carga marítima,https://www.elheraldo.hn/economia/1406405-466/se-prev%C3%A9-ca%C3%ADda-en-la-carga-mar%C3%ADtima,"El covid-19 ha tenido un impacto negativo en el comercio de bienes y a junio las importaciones bajaron 17.3% en el país TEGUCIGALPA, HONDURAS.-El movimiento de carga en contenedores en los puertos de",06-09-2020 16:19,https://www.bing.com/th?id=ON.2E17C64A88207D74F952F1E933F4FB91,Chile,El Heraldo
Primeros en retornar a las aulas de clases serán grados superiores,https://www.elheraldo.hn/pais/1406412-466/primeros-en-retornar-a-las-aulas-de-clases-ser%C3%A1n-grados-superiores,"En cada centro habrá un filtro que inspeccionará a diario si algún alumno o docente presenta síntomas de covid-19 TEGUCIGALPA, HONDURAS.-Los grados superiores de cada centro educativo serán los primer",06-09-2020 19:08,https://www.bing.com/th?id=ON.830D5658DC4AE986DAD7F7C066863527,Chile,El Heraldo
Honduras no sabe si hay un rebrote del coronavirus,https://www.laprensa.hn/honduras/1406534-410/honduras-rebrote-coronavirus-pruebas-pcr-pandemia-,"La pandemia de COVID-19 en Honduras ha dejado en seis meses 2,000 muertos y más de 63,000 contagiados, según fuentes oficiales, sin que se vislumbre un claro descenso de la enfermedad, mientras que la",06-09-2020 22:23,https://www.bing.com/th?id=ON.E69BE43FDD09A852BD7FE2AD4CDDFD96,Chile,La Prensa Chicos
Positividad en pruebas de COVID-19 en Honduras es de más de 50 por ciento,https://proceso.hn/positividad-en-pruebas-de-covid-19-en-honduras-es-de-mas-de-50-por-ciento/,"Tegucigalpa – La positividad en las pruebas para detectar el COVID-19, en Honduras es de más del 50 por ciento, señaló el médico internista Elvin Omar Videa. Detalló que hasta la semana epidemiológica",07-09-2020 05:37,https://www.bing.com/th?id=ON.CE4740A05D97F5632FFA89084E50A2CD,Chile,Proceso
"Editorial HRN: Burocracia, injusticia salarial y finanzas en bancarrota en Honduras",https://www.radiohrn.hn/editorial-hrn-burocracia-injusticia-salarial-y-finanzas-en-bancarrota-en-honduras,"Tenemos una burocracia con un enorme y preocupante exceso de peso, una estructura salarial muy injusta y un déficit insostenible entre los ingresos y los gastos. “A pobre viene, quien gasta más de lo",07-09-2020 13:47,https://www.bing.com/th?id=ON.243FB928B75455756BB75DD3E6868E8F,Chile,Radio HRN
Corea del Sur entrega equipo médico a Honduras,https://www.latribuna.hn/2020/09/07/corea-del-sur-entrega-equipo-medico-a-honduras/,"El Embajador Jae Hyun Shim, en representación de la Embajada de la República de Corea en Honduras, entregó este lunes una donación de 3 equipos médicos y 121 kits de extracción para realizar 46,464 pr",07-09-2020 17:56,https://www.bing.com/th?id=ON.E6A9524177FA4CAE9375C81D2AC0E415,Chile,La Tribuna
Comisión Médica sugiere pruebas COVID un día antes a cada partido de Liga Nacional,https://hondudiario.com/2020/09/07/comision-medica-sugiere-pruebas-covid-un-dia-antes-a-cada-partido-de-liga-nacional/,"La Comisión Médica de la Liga Nacional, integrada por doctores de los 10 clubes, sugieren que se haga pruebas COVID-19 a los jugadores, un día antes de cada partido del torneo Apertura que arranca el",07-09-2020 20:32,https://www.bing.com/th?id=ON.26EF031ECF5B96F1F8325DAF525A98E0,Chile,Hondudiario
Salud revela avances en el acceso y planificación de la vacuna contra el Covid-19,https://hondudiario.com/2020/09/07/salud-revela-avances-en-el-acceso-y-planificacion-de-la-vacuna-contra-el-covid-19/,"Autoridades de la Secretaría de Salud y la Organización Panamericana de la Salud (OPS/OMS) en Honduras, informaron este lunes sobre la importancia del cumplimiento de la Ley de Vacunas ante la introdu",07-09-2020 20:32,https://www.bing.com/th?id=ON.BD3CB77F0F697EB8E5566D5808681ACC,Chile,Hondudiario
"Muere Cipriano Dueñas, exgoleador del Vida, Marathón y Victoria en la década de los 80",https://www.diez.hn/liganacionaldehonduras/1406760-498/muere-cipriano-duenas-goleador-vida-marathon-victoria-liga-nacional-perez-zeledon-costa-rica,A cinco días del inicio de la Premier: Manchester City anuncia que tiene dos positivos por COVID-19 No te pierdas las mejores noticias deportivas del día,07-09-2020 22:38,https://www.bing.com/th?id=ON.671D42AA0AED6F0AD2CD103765C03D97,Chile,diez.hn
