name,url,description,datePublished,imagen,pais,Fuente
Aduanas Honduras inicia proceso de liberación de paquetería que permanecía retenida,http://www.elsoldehonduras.com/nacionales/aduanas-honduras-inicia-proceso-de-liberacion-de-paqueteria-que-permanecia-retenida/,"A partir del lunes 27 de julio del presente año, La Administración Aduanera de Honduras inicia el proceso de liberación de las mercancías provenientes de compras en línea que fueron decomisadas por el",25-07-2020 02:15,https://www.bing.com/th?id=OVFT.YpGMlSuK9RXK9WIJXPBh7y,Chile,El Sol de Honduras
43 alcaldes presentan rápido sus planes para combatir el coronavirus con fondos de Fuerza Honduras,http://www.elsoldehonduras.com/nacionales/43-alcaldes-presentan-rapido-sus-planes-para-combatir-el-coronavirus-con-fondos-de-fuerza-honduras/,Tegucigalpa. El presidente Juan Orlando Hernández felicitó por sus redes sociales a 43 alcaldes de 12 departamentos del país por haber presentado de manera rápida y eficiente sus planes de trabajo par,25-07-2020 03:00,https://www.bing.com/th?id=OVFT.H_XOakdRvdmnLm9-F8RB9i,Chile,El Sol de Honduras
Anuncian entrega de paquetes de compras en línea retenidas en 2018,https://www.elheraldo.hn/economia/1396438-466/anuncian-entrega-de-paquetes-de-compras-en-l%C3%ADnea-retenidas-en-2018,Los propietarios de la mercancía deben enviar por correo los documentos escaneados y luego llevar los originales a la aduana La Mesa para acreditar su propiedad y también pagar los impuestos TEGUCIGAL,25-07-2020 07:33,https://www.bing.com/th?id=OVFT.rLK0MJHe-od63wmRy_E6vi,Chile,El Heraldo
Así sobrevive Selvin Guevara a la pandemia: “Hay compañeros que no tienen ni para comer”,https://www.laprensa.hn/deportes/1396519-410/asi-sobrevive-selvin-guevara-marathon-pandemia-coronavirus-honduras-negocio-comida-compa%C3%B1eros,"San Pedro Sula, Honduras. La crisis provocada por el coronavirus en Honduras ... El juvenil catracho no tiene miedo del covid-19, pero siempre es cauteloso con tomar las medidas de bioseguridad. “Hay que tomar siempre todas las medidas de bioseguridad ...",25-07-2020 16:38,https://www.bing.com/th?id=OVFT.0YD_gvBfj842JZKQf_GPdS,Chile,La Prensa Chicos
Ñel Vega vence al Coronavirus,https://www.latribuna.hn/2020/07/25/nel-vega-vence-al-coronavirus/,"Después de varias semanas de estar interno en el Hospital María y el Polideportivo de la Universidad Autónoma de Honduras, salió recuperado del COVID-19 el mítico kinesiólogo de Motagua, Gustavo Busti",25-07-2020 18:47,https://www.bing.com/th?id=OVFT.DJal5H6LFhY5RpiD2qHaRC,Chile,La Tribuna
"Rafael Medina: Si avanzamos, se puede recuperar la mitad de los empleos perdidos",https://www.elheraldo.hn/pais/1396457-466/rafael-medina-si-avanzamos-se-puede-recuperar-la-mitad-de-los-empleos,"TEGUCIGALPA, HONDURAS.-La reapertura de la economía es la única salida para poder salvar miles de empresas y empleos que se han perdido por la crisis sanitaria del covid-19 en Honduras, afirmó Rafael",25-07-2020 21:05,https://www.bing.com/th?id=OVFT.NlxeSgqXUrKjJnKs948d4C,Chile,El Heraldo
El coronavirus deja otras 37 muertes en Honduras y 879 nuevos casos positivos,https://www.diez.hn/coronavirus/1396620-441/coronavirus-honduras-covid-19-pandemia-muertes-sinager,"El número de fallecidos por COVID-19 está a punto de alcanzar los 1,100. En Gracias a Dios se disparó del número de casos. El Sistema Nacional de Gestión de Riesgos (SINAGER) anunció este sábado, 25 d",26-07-2020 01:54,https://www.bing.com/th?id=OVFT.ihknfeHYKI2IRYUCGu4MkC,Chile,diez.hn
"Honduras reporta 38,430 contagiados por coronavirus y 1,098 fallecidos",https://hondudiario.com/2020/07/25/honduras-reporta-38430-contagiados-por-coronavirus-y-1098-fallecidos/,"El Sistema Nacional de Gestión de Riesgos (Sinager), confirmó 879 casos nuevos de Covid-19 este sábado de 2, 0048 pruebas realizadas, sumando un total de 38,438 contagios en todo el país. Los nuevos c",26-07-2020 04:27,https://www.bing.com/th?id=OVFT.vNYMN7jHZ5lsjH4-Za2SmS,Chile,Hondudiario
Exministra de Salud dice que es imposible continuar con la economía cerrada desde el punto de vista social en Honduras,https://www.radiohrn.hn/exministra-de-salud-dice-que-es-imposible-continuar-con-la-economia-cerrada-desde-el-punto-de-vista-social-en-honduras,"La exministra de Salud, Roxana Araujo, expuso el domingo que desde el punto de vista epidemiológico se debería continuar con el confinamiento por covid-19 para evitar más casos. Sin embargo, la exfunc",26-07-2020 13:41,https://www.bing.com/th?id=OVFT.BFiTM55_qcYk_lNCuTcedy,Chile,Radio HRN
Fallece otra enfermera por coronavirus en Honduras,https://www.laprensa.hn/sanpedro/1396681-410/enfermera-fallece-covid-honduras-hondurena-coronavirus,"La crisis sanitaria del COVID-19 ha cobrado la vida de otra enfermera en Honduras. Este domingo, trascendió la muerte de la trabajadora de salud identificada como Ana Rosa. En redes sociales sus coleg",26-07-2020 16:48,https://www.bing.com/th?id=OVFT.slbo08So-41vVX5hApnpoS,Chile,La Prensa Chicos
El precio que tendría en lempiras la vacuna contra el coronavirus para Honduras,https://www.diez.hn/coronavirus/1396761-441/precio-lempiras-vacuna-coronavirus-honduras-covid-19-pandemia,"Alba Consuelo Flores, Ministra de Salud, detalló que Honduras se encuentra en la lista de países que recibirán con prioridad la vacuna contra el coronavirus, una vez que las autoridades la aprueben a nivel mundial. La funcionaria explicó que desde hace ...",26-07-2020 21:50,https://www.bing.com/th?id=OVFT.64xWGVWu3p7GnsgXVIxerS,Chile,diez.hn
Trabajar con las alcaldías en el combate al Covid-19 es una buena decisión: Emín Abufele,https://hondudiario.com/2020/07/26/trabajar-con-las-alcaldias-en-el-combate-al-covid-19-es-una-buena-decision-emin-abufele/,"El empresario sampedrano, Emín Abufele, dijo que es aplaudible la decisión del Gobierno de trabajar con las alcaldías a nivel nacional en el combate al Covid-19, mediante la habilitación ... puso en marcha el programa Fuerza Honduras con el objetivo ...",27-07-2020 00:01,https://www.bing.com/th?id=OVFT.alv346qb9_hwpUdAMTGw5C,Chile,Hondudiario
"39,276 positivos por COVID-19 confirma Sinager",https://www.latribuna.hn/2020/07/26/39276-positivos-por-covid-19-confirma-sinager/,"De 1,999 pruebas realizadas, 838 son positivas y 1,161 negativas informó esta noche, el Sistema Nacional de Emergencias (Sinager) en el último informe sobre la pandemia. Los casos corresponden a Corté",27-07-2020 03:55,https://www.bing.com/th?id=OVFT.430axhGqGWfqxzKrZYDfMi,Chile,La Tribuna
