name,url,description,datePublished,imagen,pais,Fuente
Presidente Hernández: Honduras Solidaria es la operación más grande de la historia del país,http://www.elsoldehonduras.com/nacionales/presidente-hernandez-honduras-solidaria-es-la-operacion-mas-grande-de-la-historia-del-pais/,"Tegucigalpa. El presidente Juan Orlando Hernández presentó un informe sobre las primeras dos fases de la Operación Honduras Solidaria, que es la más grande ejecutada en el país, y los avances en la te",11-07-2020 18:46,https://www.bing.com/th?id=ON.8B7CA319537B1DF3DF28D0D08C6A8AEA,Chile,El Sol de Honduras
Gobierno de Honduras analizaría reactivar la economía este lunes 27 de julio,https://www.elheraldo.hn/economia/1396079-466/gobierno-de-honduras-analizar%C3%ADa-reactivar-la-econom%C3%ADa-este-lunes-27-de-julio,"TEGUCIGALPA, HONDURAS.-El gobierno de Honduras estaría analizando reabrir la economía a partir de este lunes, luego de que la mesa multisectorial para contener la pandemia del covid-19 en Honduras rec",23-07-2020 20:24,https://www.bing.com/th?id=ON.8F5CC8A22A0003F40C4248AEA8C820AF,Chile,El Heraldo
“Buscaremos adquirir vacuna contra la COVID-19 a través de la OMS”,https://www.latribuna.hn/2020/07/23/buscaremos-adquirir-vacuna-contra-la-covid-19-a-traves-de-la-oms/,"El científico hondureño Marco Tulio Medina consideró que la anunciada vacuna contra el COVID-19, que elabora la Universidad de Oxford ... “Esperamos que eso permita salir a Honduras de esta tragedia que nos agobia a fin de poder retomar el curso ...",23-07-2020 20:34,https://www.bing.com/th?id=ON.BEA35ED85C8D3F706111E9A7F995F653,Chile,La Tribuna
"La visita de Marcelo Bielsa a Honduras: Intentó pasar de incógnito en un centro comercial, pero lo descubrieron",https://www.diez.hn/laseleccion/1396125-498/la-visita-de-marcelo-bielsa-a-honduras-intent%C3%B3-pasar-de-inc%C3%B3gnito-en,Marcelo Bielsa con al selección de Argentina visitó Honduras en el 2003 para jugar un amistoso en el estadio Olímpico. Rolin Peña contó detalles del 'Loco'. Marcelo Bielsa es el técnico de moda en Eur,23-07-2020 21:03,https://www.bing.com/th?id=ON.565AC2FACDA0D8F0B69228DB2F6E059A,Chile,diez.hn
Gobierno de Honduras analiza reapertura de economía el lunes,https://www.laprensa.hn/honduras/1396035-410/gobierno-honduras-analiza-reapertura-econom%C3%ADa-lunes,"Autoridades hondureñas recibieron propuestas de empresarios para avanzar con la reapertura inteligente. Tegucigalpa. El Gobierno de Honduras revisa propuestas para avanzar, a partir del lunes 27 de julio, con la reapertura económica tras casi cinco meses ...",23-07-2020 21:40,https://www.bing.com/th?id=ON.CF9959795847ABABB303A8D4C4E893F8,Chile,La Prensa Chicos
"El Blog de Kike Lanza: ""Ya ni me acordaba que Fabián Coito era el técnico de la Selección de Honduras""",https://www.diez.hn/blogs/1396140-498/blog-de-kike-lanza-ya-ni-me-acordaba-fabian-coito-seleccion-honduras,"Trascendió hace unos días, lo preocupado que esta en Uruguay el DT de la Bicolor, porque en Honduras, los jugadores no están en actividad y porque no hay fecha de reactivación del fútbol. Leer esta no",23-07-2020 21:54,https://www.bing.com/th?id=ON.4BE7E105C2FA07F86FFBDA8BF35CF686,Chile,diez.hn
Llegan primeras 17 toneladas de equipo de protección e insumos para el combate del Covid-19,http://www.eldiario.hn/llegan-primeras-17-toneladas-de-equipo-de-proteccion-e-insumos-para-el-combate-del-covid-19/,Tegucigalpa.- Más de 24.000 trabajadores de la salud se beneficiarán con los equipos de protección personal (EPP) e insumos médicos adquiridos por el Gobierno para potenciar el combate de la pandemia,24-07-2020 05:22,https://www.bing.com/th?id=ON.5075FC4B747E60096FB16F7CBD9649E0,Chile,El Diario
Representante de OPS/OMS: Honduras en bloque de 36 países para comprar vacuna a precios bajos,https://www.latribuna.hn/2020/07/24/representante-de-ops-oms-honduras-en-bloque-de-36-paises-para-comprar-vacuna-a-precios-bajos/,"La representante en Honduras de la Organización Panamericana de la Salud/Organización Mundial de la Salud (OPS/OMS), Piedad Huerta, sostuvo que estamos esperanzados en la vacuna contra el COVID-19, pues ya se superaron las fases 1 y 2. Los resultados ...",24-07-2020 14:53,https://www.bing.com/th?id=ON.DC1353B152A90801C7C347E2F7D8476D,Chile,La Tribuna
"Proyectan 14,500 casos de covid-19 al cierre de julio en el Distrito Central",https://www.elheraldo.hn/tegucigalpa/1396246-466/proyectan-14500-casos-de-covid-19-al-cierre-de-julio-en-el-distrito,"TEGUCIGALPA, HONDURAS.-El departamento de Francisco Morazán (FM) superó ayer a Cortés en el número de casos positivos de covid-19 por cada cien mil habitantes (cpccmh). La base de datos de EL HERALDO,",24-07-2020 15:03,https://www.bing.com/th?id=ON.CA16AAC4288599ADB4EFECDE2F85E080,Chile,El Heraldo
Se registran 800 nuevos casos de Covid-19 y mas de 36 mil contagios,https://hondudiario.com/2020/07/23/se-registran-800-nuevos-casos-de-covid-19-y-mas-de-36-mil-contagios/,"El Sistema Nacional de Gestión de Riesgos (Sinager), confirmó 800 casos nuevos de Covid-19 para este jueves de 1,917 pruebas realizadas, sumando un total de 36,902, contagios a nivel nacional. Los nue",24-07-2020 15:08,https://www.bing.com/th?id=ON.AE97002101041170E6C631577248C23B,Chile,Hondudiario
Hay una oportunidad de recuperación del turismo ante crisis del Covid-19.,https://hondudiario.com/2020/07/24/hay-una-oportunidad-de-recuperacion-del-turismo-ante-crisis-del-covid-19/,"La Secretaría de Integración Económica Centroamericana (SIECA) organizó un seminario virtual analizando el “Impacto del COVID-19, medidas de reactivación y recomendaciones para una recuperación resili",24-07-2020 16:59,https://www.bing.com/th?id=ON.FE77AA818A4E5465D8DB889872F315DB,Chile,Hondudiario
