name,url,description,datePublished,imagen,pais,Fuente
"Crisis por Covid-19: Sin dinero para alquiler, hondureños viven en medianas o puentes",https://www.elheraldo.hn/pais/1382539-466/crisis-por-covid-19-sin-dinero-para-alquiler-hondure%C3%B1os-viven-en-medianas-o,"TEGUCIGALPA, HONDURAS.-Un pedazo de sofá amarrado con una cabuya a un árbol, un par de cobijas empapadas por la lluvia, dos bolsas negras con ropa vieja y un fogón improvisado con ladrillos a la par d",27-05-2020 19:12,https://www.bing.com/th?id=ON.77D293B214ABF60A65FCAB3E96484654,Chile,El Heraldo
Embajada de Estados Unidos en Honduras habilita nuevos vuelos comerciales,https://www.laprensa.hn/honduras/1382675-410/embajada-estados-unidos-honduras-coronavirus-pandemia-crisis,"Tome nota de las fechas y de quiénes pueden acceder a estos vuelos, que se realizarán a través de United Airlines y Spirit Airlines. Tegucigalpa, Honduras. La Embajada de Estados Unidos (EEUU) en Hond",27-05-2020 22:01,https://www.bing.com/th?id=ON.5979D16CCC51347FDAED2A446A551CD5,Chile,La Prensa Chicos
Suspenden uso de hidroxicloroquina en Honduras por advertencia de OMS,https://www.elheraldo.hn/pais/1382540-466/suspenden-uso-de-hidroxicloroquina-en-honduras-por-advertencia-de-oms,"TEGUCIGALPA, HONDURAS.-La Secretaría de Salud no aplicará la hidroxicloroquina en pacientes con Covid-19, tal y como lo contemplaba la implementación en el país del ensayo clínico internacional llamad",27-05-2020 22:40,https://www.bing.com/th?id=ON.2946D6931924FB23E31213F8DB4859FE,Chile,El Heraldo
Honduras: Salud asegura que la ocupación hospitalaria de pacientes con covid-19 está en un 40 por ciento,https://radiohrn.hn/honduras-salud-asegura-que-la-ocupacion-hospitalaria-de-pacientes-con-covid-19-esta-en-un-40-por-ciento/,"El viceministro de Salud, Roberto Cosenza, confirmó que hasta el momento los hospitales del país no han colapsado. En un 42.75 por ciento se encuentra la ocupación hospitalaria de pacientes con covid-",27-05-2020 23:55,https://www.bing.com/th?id=ON.7DBF452698348AFC0977CEAAA7836774,Chile,Radio HRN
Siguen aumentando el coronavirus en Honduras; se reportan 239 nuevos contagiados,https://www.diez.hn/coronavirus/1382744-441/siguen-aumentando-el-coronavirus-en-honduras-se-reportan-239-nuevos-contagiados,"Con este número se llegan a 4,640 casos; además de seis fallecidos y estamos a punto de llegar a los 200 decesos El coronavirus sigue cobrando la vida de muchos hondureños. Este miércoles se ha confir",28-05-2020 01:08,https://www.bing.com/th?id=ON.B66E13A39FAB901F4D5213BEB805424A,Chile,diez.hn
"Honduras cerca de los 200 fallecidos por Covid y ya suma 4,640 casos positivos",https://hondudiario.com/2020/05/27/honduras-cerca-de-los-200-fallecidos-por-covid-y-ya-suma-4640-casos-positivos/,"El Sistema Nacional de Gestión de Riesgos (Sinager), reportó 239 nuevos casos de Covid-19 en Honduras, sumando ya 4640 los contagiados en todo el país. Asimismo, dio a conocer de 6 muertes nuevas, par",28-05-2020 01:23,https://www.bing.com/th?id=ON.E96F69BC174C463B5D8F89395838811A,Chile,Hondudiario
"ONU recuerda a Honduras que ya le otorgó 85,000 pruebas para Covid-19",https://hondudiario.com/2020/05/27/onu-recuerda-a-honduras-que-ya-le-otorgo-85000-pruebas-para-covid-19/,"El secretario general de la Organización de las Naciones Unidas (ONU) António Guterres, le respondió a la embajadora hondureña Mary Elizabeth Flores, sobre sus peticiones de ayuda para atender el Covi",28-05-2020 01:34,https://www.bing.com/th?id=ON.FC9B06FD231F9C36A28CCA3B2714090C,Chile,Hondudiario
Siguen aumentando los contagiados de Covid-19 en Honduras; se reportan 239 nuevos casos,https://www.diez.hn/coronavirus/1382744-441/siguen-aumentando-los-contagiados-de-covid-19-en-honduras-se-reportan-239-nuevos,"Con este número se llegan a 4,640 casos. Hoy hubo seis fallecidos y estamos a punto de llegar a los 200 decesos El coronavirus sigue cobrando la vida de muchos hondureños. Este miércoles se ha confirm",28-05-2020 01:39,https://www.bing.com/th?id=ON.B66E13A39FAB901F4D5213BEB805424A,Chile,diez.hn
Muertes por COVID-19 en Honduras aumentan a 194,https://www.laprensa.hn/videos/?mId=8dUIB4r2&seccion=ultimosvideos&c,"Honduras registró este miércoles 27 de mayo 239 nuevos casos de coronavirus COVID-19, lo que aumenta a 4,640 la cifra de personas contagiadas con el virus.",28-05-2020 01:52,https://www.bing.com/th?id=ON.645FC079575131490502BEF0A6E70B13,Chile,La Prensa Chicos
"A 4,640 suben los casos de covid-19 y 194 los fallecidos en Honduras",https://radiohrn.hn/a-4640-suben-los-casos-de-covid-19-y-194-los-fallecidos-en-honduras/,"Honduras eleva la cifra de contagiados por covid-19 a 4, 640 y la suma de fallecidos aumenta a 194. Este 27 de mayo se realizaron 616 nuevas pruebas para diagnosticar el virus, de las cuales 239 dieron positivas, sumando así un total de 4,640. De los 239 casos, el departamento de Cortés registra 187, este sigue siendo el epicentro de la ...",28-05-2020 04:07,https://www.bing.com/th?id=ON.B9A0B95CD775233350259F6ED21B0EBA,Chile,Radio HRN
"Gobierno ha gestionado repatriación de más de 6,600 hondureños",https://www.latribuna.hn/2020/05/27/gobierno-gestionado-repatriacion-de-mas-de-6600-hondurenos/,"Ante la crisis mundial provocada por la pandemia del coronavirus (COVID – 19), el gobierno de Honduras gestionó, hasta la fecha, la repatriación de 6,630 hondureños desde 23 naciones o cruceros, según",28-05-2020 07:26,https://www.bing.com/th?id=ON.40CB9CCAA2B72D4056C195B968FD276F,Chile,La Tribuna
La red hospitalaria nacional está en 42% de ocupación,https://www.latribuna.hn/2020/05/28/la-red-hospitalaria-nacional-esta-en-42-de-ocupacion/,"El último informe sobre la red hospitalaria nacional ha confirmado que la ocupación total de los hospitales es de 42.75 por ciento en los 32 centros habilitados para atención de COVID-19, confirmó el",28-05-2020 13:38,https://www.bing.com/th?id=ON.5DE0D728285351E39E49EC99A814B3F2,Chile,La Tribuna
