name,url,description,datePublished,imagen,pais,Fuente
"Muere con síntomas de Covid-19 exalcalde de Talanga, Rudy Edgardo Banegas",https://www.laprensa.hn/honduras/1395818-410/muere-s%C3%ADntomas-covid19-exalcalde-talanga-rudy-edgardo-banegas,"A tempransa horas de este miércoles murió Rudy Egardo Banegas, exalcalde liberal del municipio Talanga, departamento Francisco Morazán. Rudy Edgardo Banegas, exalcalde y actual regidor de Talanga, mur",22-07-2020 18:41,https://www.bing.com/th?id=ON.1AD23B6B451B02881F8A2321BE62CF6C,Chile,La Prensa Chicos
"Honduras será prioridad en la lista de espera para obtener la vacuna contra el covid-19, reitera Salud",https://www.radiohrn.hn/honduras-sera-prioridad-en-la-lista-de-espera-para-obtener-la-vacuna-contra-el-covid-19-reitera-salud/,"Honduras ha sido incluida en la lista de países que recibirían prioritariamente la vacuna contra el covid-19, confirmó el miércoles la titular de la Secretaría de Salud, Alba Consuelo Flores. “Hondura",22-07-2020 18:55,https://www.bing.com/th?id=ON.9940367A80B0B1E9C45F2999B32A6D09,Chile,Radio HRN
Honduras garantiza con firma de carta de interés la vacuna contra covid-19,https://www.radiohrn.hn/honduras-garantiza-con-firma-de-carta-de-interes-la-vacuna-contra-covid-19,Honduras es uno de los países que se adelantó a firmar una carta de interés con alianza mundial con el fin de garantizar acceso a la vacuna contra covid-19 cuando ya esté disponible en el mercado. “Al,22-07-2020 19:11,https://www.bing.com/th?id=ON.2974E9D1452ACE878E4CF8BFCA894DE0,Chile,Radio HRN
Honduras reporta el día con más fallecidos y recuperados por covid-19 además el total de positivos se elevan a 35.345 casos,http://www.elsoldehonduras.com/internacionales/noticia/honduras-reporta-el-dia-con-mas-fallecidos-y-recuperados-por-covid-19-ademas-el-total-de-positivos-se-elevan-a-35-345-casos/,El Sistema Nacional de Gestión de Riesgo (Sinager) reportó este miércoles 734 nuevos casos positivos de covid-19 para hacer un total de 35.345 contagiados en el país. En cadena nacional de radio y tel,22-07-2020 19:17,https://www.bing.com/th?id=ON.BF57B97FA8A81FFDF6B9EA00286EC3C7,Chile,El Sol de Honduras
Tercera fase de Honduras Solidaria inicia entrega de alimentos casa por casa a familias capitalinas,http://www.elsoldehonduras.com/nacionales/tercera-fase-de-honduras-solidaria-inicia-entrega-de-alimentos-casa-por-casa-a-familias-capitalinas/,Tegucigalpa. Familias de distintas colonias capitalinas recibieron la Bolsa Solidaria al iniciarse la tercera fase de entregas casa por casa de la Operación Honduras Solidaria que llegará al Distrito,22-07-2020 19:52,https://www.bing.com/th?id=ON.4909332EF916BFF64EBFA9B025008044,Chile,El Sol de Honduras
Se perdió la cuenta del número de médicos contagiados de Covid-19: CMH,https://hondudiario.com/2020/07/22/se-perdio-la-cuenta-del-numero-de-medicos-contagiados-de-covid-19-cmh/,"El vicepresidente del Colegio Médico de Honduras (CMH), Samuel Santos, aseguró que hasta la fecha hay al menos 25 galenos que han perdido la vida a causa del Covid-19, pero que ya se perdió la cuenta",22-07-2020 20:53,https://www.bing.com/th?id=ON.11A14CB500593F4E0F500703389D4FC8,Chile,Hondudiario
La temporada de Grandes Ligas comienza bajo la sombra del coronavirus; Mauricio Dubón abre ante los Dodgers,https://www.diez.hn/notodoesfutbol/mauriciodubon/1395833-498/la-temporada-de-grandes-ligas-comienza-bajo-la-sombra-del-coronavirus-mauricio,"Sin jugadores masticando tabaco ni espectadores en las gradas, y con un calendario de solo 60 partidos en lugar del habitual maratón de 162, las Grandes Ligas de béisbol arrancarán el jueves su espera",22-07-2020 21:21,https://www.bing.com/th?id=ON.717D7C5FD6641634CAAC337C425E804C,Chile,diez.hn
Ministro salvadoreño compara manejo del COVID en Honduras; el presidente Bukele no pidió “carpas”,https://hondudiario.com/2020/07/22/ministro-salvadoreno-compara-manejo-del-covid-en-honduras-el-presidente-bukele-no-pidio-carpas/,"El ministro de Obras Públicas y de Transporte de El Salvador, Romeo Rodríguez, comparó el manejo de la pandemia por coronavirus de ese país con la Honduras, argumentando que, en el país vecino, el pre",22-07-2020 22:29,https://www.bing.com/th?id=ON.BFC6832E176F2C7A8DB523ED9154764D,Chile,Hondudiario
"Retos de la vuelta del fútbol en Honduras: Alto costo de pruebas PCR, jugar en tres ciudades y estrictas medidas de bioseguridad",https://www.diez.hn/liganacionaldehonduras/1395907-498/grandes-retos-para-que-vuelva-futbol-honduras-alto-costo-pruebas-pcr,Los días se han vuelto eternos en Honduras desde que en el mes de abril se declarara cancelado en el Torneo Clausura de la Liga Nacional y el balón dejó de rodar en los escenarios deportivos a consecu,22-07-2020 23:46,https://www.bing.com/th?id=ON.3B3984287B853C0D4F06FDF9E7518053,Chile,diez.hn
Canadá llevará a Honduras y Guatemala toneladas de mascarillas de la ONU,https://www.latribuna.hn/2020/07/22/canada-llevara-a-honduras-y-guatemala-toneladas-de-mascarillas-de-la-onu/,"La fuerzas armadas canadienses transportarán el jueves a Honduras varias toneladas de material de protección personal para la lucha contra la COVID-19, el primero de una serie de vuelos que durante la",23-07-2020 01:58,https://www.bing.com/th?id=ON.63A4912657C6F094E91239F84A2D5B5F,Chile,La Tribuna
Honduras espera recibir 1.8 millones de vacunas,https://www.laprensa.hn/premium/1395993-410/honduras-espera-recibir-18-millones-vacunas-pandemia-coronavirus,"Los avances en el desarrollo de una vacuna contra el covid-19 generan esperanza y optimismo ante una pandemia que registra más de 14 millones de contagios y más de 611,000 fallecidos en el mundo y en Honduras deja más de 1,000 muertos. La Organización ...",23-07-2020 08:11,https://www.bing.com/th?id=ON.A4CAE693CECBFA08FE7CF9FE9509117D,Chile,La Prensa Chicos
"Honduras busca asegurar acceso a la vacuna en Ginebra, Suiza",https://www.latribuna.hn/2020/07/23/honduras-busca-asegurar-acceso-a-la-vacuna-en-ginebra-suiza/,"La Secretaría de Relaciones Exteriores y Cooperación Internacional a través de la Misión Permanente de Honduras, en Ginebra, trabaja por un acceso equitativo y justo a la vacuna contra el COVID-19 a través del mecanismo de la Alianza Gavi Covax.",23-07-2020 11:33,https://www.bing.com/th?id=ON.55565F9B6B177B6DC65409BEAED48CC8,Chile,La Tribuna
En busca de la inmunidad: Tres vacunas representan la esperanza contra el covid-19,https://www.elheraldo.hn/pais/1395984-466/en-busca-de-la-inmunidad-tres-vacunas-representan-la-esperanza-contra-el,"TEGUCIGALPA, HONDURAS.-Científicos del mundo trabajan contrarreloj en una carrera donde la meta es salvar vidas del maligno covid-19. Son cuatro los países que han tomado la delantera en la pista de la investigación científica y han presentado los ...",23-07-2020 14:20,https://www.bing.com/th?id=ON.48D6386E6EE45B424109A5D859E99585,Chile,El Heraldo
"Ebal Díaz: ""Vía remota expertos extranjeros asistirán instalación de módulos""",https://www.elheraldo.hn/pais/1395994-466/ebal-d%C3%ADaz-v%C3%ADa-remota-expertos-extranjeros-asistir%C3%A1n-instalaci%C3%B3n-de-m%C3%B3dulos,"TEGUCIGALPA, HONDURAS.-El ministro de la Presidencia ... en los planteles donde se instalará el primer centro asistencial para pacientes con covid-19 en San Pedro Sula. ADEMÁS: Lo que traen en su interior los contenedores desembarcados en Puerto Cortés ...",23-07-2020 14:20,https://www.bing.com/th?id=ON.953E4775ED5F6BFE2C4101C4FD96D74C,Chile,El Heraldo
