name,url,description,datePublished,imagen,pais,Fuente
"Lobos – Motagua, reactivan la Liga Nacional",https://www.diariomas.hn/2020/09/26/lobos-motagua-reactivan-la-liga-nacional/,"El fútbol vuelve a casa, después de seis meses de incertidumbre y ansiedad por disfrutar de un partido de nuestra Liga Profesional que había tenido",26-09-2020 15:00,https://www.bing.com/th?id=OVFT.4MVqiExOYTDYRAWQdLk3bi,Chile,Mas
Primer clásico en plena pandemia,https://www.diariomas.hn/2020/09/27/primer-clasico-en-plena-pandemia/,La emoción del fútbol de la Liga Profesional de Honduras continúa esta noche con el primer clásico de la temporada en medio de la pandemia de la Covid,27-09-2020 15:01,https://www.bing.com/th?id=OVFT.owdRjxyRhmWBHmaOctHlxS,Chile,Mas
El covid-19 ha afectado a más de 300 hondureños en el extranjero,https://www.elheraldo.hn/pais/1411993-466/el-covid-19-ha-afectado-a-m%C3%A1s-de-300-hondure%C3%B1os-en-el-extranjero,Estados Unidos y España son los lugares donde se concentra la mayor cantidad de compatriotas que han sido afectados por el virus. Cancillería confirma muerte de 66 connacionales por la enfermedad,30-09-2020 21:01,https://www.bing.com/th?id=OVFT.pVy2cO4cSYvJoYLedDLr-S,Chile,El Heraldo
Honduras abrirá las fronteras terrestres entre el 9 y 12 de octubre,https://ultimahora.hn/honduras-abrira-las-fronteras-terrestres-entre-el-9-y-12-de-octubre/,"Las fronteras terrestres de Honduras serán habilitadas para el ingreso de viajeros por visita oficial, negocios, inversiones y turistas, entre el 9 y 12 de octubre. Así lo informó, en las últimas",30-09-2020 21:42,https://www.bing.com/th?id=OVFT.XMeukONX2_ymdNv0xCQGOC,Chile,Ultima Hora
"Honduras abrirá las fronteras terrestres y el transporte internacional de pasajeros, conoce la fecha",https://www.radiohrn.hn/honduras-abrira-las-fronteras-terrestres-y-el-transporte-internacional-de-pasajeros-conoce-la-fecha,"“Según el plan de activación serán abiertos los puntos fronterizos que tenemos con Guatemala, Nicaragua y El Salvador”, declaró Menjivar.",30-09-2020 22:11,https://www.bing.com/th?id=OVFT.KFxuDBRDQZP5wV-DvkVsJi,Chile,Radio HRN
"Honduras abrirá las fronteras terrestres en octubre, pedirán prueba de coronavirus",https://www.laprensa.hn/honduras/1412196-410/honduras-abre-fronteras-terrestres-octubre-prueba-coronavirus-,"Se exigirá un comprobante de la prueba rápida o PCR con resultado negativo de coronavirus. Las fronteras terrestres de Honduras serán habilitadas para el ingreso de viajeros por visita oficial, negoci",30-09-2020 22:12,https://www.bing.com/th?id=OVFT.6_smVg1LmtHn6Tw02s_ARC,Chile,La Prensa Chicos
Honduras abrirá sus fronteras terrestres entre el 9 y 12 de octubre,https://hondudiario.com/2020/09/30/honduras-abrira-sus-fronteras-terrestres-entre-el-9-y-12-de-octubre/,"La directora del Instituto Nacional de Migración (INM), Carolina Menjivar, anunció en las últimas la apertura de las fronteras terrestres de Honduras entre el 9 y ... o PCR con resultado negativo de Covid-19 para poder entrar al país.",30-09-2020 22:41,https://www.bing.com/th?id=OVFT.D14I5WgX1Wj_Ezw8usmrhi,Chile,Hondudiario
En Puerto Cortés inauguran nueva sala de recuperación de COVID-19,http://www.elsoldehonduras.com/salud/en-puerto-cortes-inauguran-nueva-sala-de-recuperacion-de-covid-19/,"El subsecretario de Redes Integradas y servicios de Salud, Roberto Cosenza, junto a las autoridades de la Operadora Portuaria Centroamericana (OPC) inauguraron este día la sala de recuperación del hos",01-10-2020 01:07,https://www.bing.com/th?id=OVFT.l054u4gEYezP1tQWdPmZLy,Chile,El Sol de Honduras
Honduras roza los 77 mil contagiados con 802 nuevos casos de COVID-19,https://proceso.hn/honduras-roza-los-77-mil-contagiados-con-802-nuevos-casos-de-covid-19/,"Tegucigalpa – Honduras alcanzó este miércoles los 76 mil 900 contagiados y los 2 mil 353 decesos en 205 días de pandemia, informó el Sistema Nacional de Gestión de Riesgos (Sinager). – La tasa de leta",01-10-2020 02:33,https://www.bing.com/th?id=OVFT.s2BEdsPP3aAlvtUCEtmtDS,Chile,Proceso
Puerto Cortés ya tiene sala para covid-19,https://www.laprensa.hn/honduras/1412310-410/puerto-cortes-sala-de-covid-honduras-coronavirus-triaje,"Puerto Cortés, Honduras. Más de dos millones de lempiras se invirtieron en una sala especial para mejorar las atenciones a pacientes con covid-19. Autoridades de Salud y fuerzas",01-10-2020 08:38,https://www.bing.com/th?id=OVFT.inTL4F2jHuCMy0W48q0k4y,Chile,La Prensa Chicos
Sale nueva caravana rumbo a Guatemala,https://www.latribuna.hn/2020/10/01/sale-nueva-caravana-rumbo-a-guatemala/,"A pesar del riesgo que implica la pandemia mundial de COVID-19, una caravana de migrantes salió el miércoles, a eso de las 7:00 de la noche, de Omoa, en Cortés, con rumbo a Guatemala, desde donde cont",01-10-2020 11:07,https://www.bing.com/th?id=OVFT.M4orPhVYFia1htS4oQNC6y,Chile,La Tribuna
"Honduras: 231,123 inconsistencias ya arroja el enrolamiento",https://www.elheraldo.hn/pais/1412281-466/honduras-231123-inconsistencias-ya-arroja-el-enrolamiento,"Un promedio de 65,000 personas acuden a diario a actualizar sus datos para que les doten de la nueva identidad. El RNP ya nombró una comisión de técnicos para resolver las inconsistencias más graves",01-10-2020 14:47,https://www.bing.com/th?id=OVFT.Z7F1tp5gYlErz_Vziqi7kC,Chile,El Heraldo
Guatemala no permitirá ingreso de hondureños que van en nueva caravana migrante,https://www.radiohrn.hn/guatemala-no-permitira-ingreso-de-hondurenos-que-van-en-nueva-caravana-migrante,"Además, Jerez reveló que Guatemala tiene un despliegue en la frontera para impedir el ingreso de los emigrantes indocumentados. ""El país vecino (Guatemala) tiene un despliegue",01-10-2020 14:49,https://www.bing.com/th?id=OVFT.5Jf_HrZRZXiEHK_16j2VDC,Chile,Radio HRN
Caravana de migrantes hondureños es retenida por autoridades guatemaltecas,https://ultimahora.hn/caravana-de-migrantes-hondurenos-es-retenida-por-autoridades-guatemaltecas/,"La Policía de Guatemala realiza el retorno del primer grupo de  50 hondureños al país, de la última caravana que partió del país. En ese sentido la caravana de migrantes fue  retenida por",01-10-2020 15:35,https://www.bing.com/th?id=OVFT.yfsart46TTXt-g7sVCkE8i,Chile,Ultima Hora
México advierte de hasta 10 años de cárcel a extranjeros por COVID-19,https://www.latribuna.hn/2020/10/01/mexico-advierte-de-hasta-10-anos-de-carcel-a-extranjeros-por-covid-19/,"México, 1 oct (EFE).- El Instituto Nacional de Migración (INM) del Gobierno mexicano advirtió este jueves de sanciones y hasta 10 años de cárcel para extranjeros que «ingresen al país sin medidas sani",01-10-2020 16:29,https://www.bing.com/th?id=OVFT.19oDQZjbSTD_wRllN084RC,Chile,La Tribuna
ICDF Taiwán: Realizan Webinar internacional sobre resilencia de los agricultores en Latinoamerica,http://www.elsoldehonduras.com/nacionales/icdf-taiwan-realizan-webinar-internacional-sobre-resilencia-de-los-agricultores-en-latinoamerica/,"Tegucigalpa. Un Webinar sobre la Resiliencia de los Agricultores en Latinoamérica ante el Cambio Climático y COVID-19 se realizó entre autoridades del agro de Taiwán, Italia, Paraguay, Ecuador, Hondur",01-10-2020 16:48,https://www.bing.com/th?id=OVFT.W8paVSj3ipdmUyMAuOh3wi,Chile,El Sol de Honduras
Honduras inicia cosecha de café con reto de evitar la propagación de COVID-19,https://proceso.hn/honduras-inicia-cosecha-de-cafe-con-reto-de-evitar-la-propagacion-de-covid-19/,"Tegucigalpa – Honduras inicia este jueves la cosecha de café 2020-2021, en la que prevé exportar 8.2 millones de quintales, que le generarán unos 1,000 millones de dólares, con el reto de evitar el co",01-10-2020 18:04,https://www.bing.com/th?id=OVFT.kAlGTtfgP4GjnakPaQKv6C,Chile,Proceso
