name,url,description,datePublished,imagen,pais,Fuente
"HONDURAS / NO MATE SUS VOTOS, SEA RESPONSABLE, CAMPAÑA SIN COVID-19",http://www.web.ellibertador.hn/index.php/noticias/nacionales/2685-honduras-no-mate-sus-votos-sea-responsable-campana-sin-covid-19,Red por la Equidad Democrática en Honduras (REDH) pide a las autoridades electorales y partidos políticos establecer reglas claras y mecanismos de control para evitar masivos contagios y muertes por C,16-02-2021 01:38,https://www.bing.com/th?id=OVFT.aeOwE-k_z8Zrui7iVqECXC,Chile,El Libertador
Aduanas Honduras garantizará el despacho oportuno y ágil del primer lote de vacunas contra la COVID-19,http://www.elsoldehonduras.com/nacionales/aduanas-honduras-garantizara-el-despacho-oportuno-y-agil-del-primer-lote-de-vacunas-contra-la-covid-19/,La Administración Aduanera de Honduras trabaja en la simplificación y tecnificación de su sistema para garantizar el despacho oportuno y ágil de las mercancías logrando una interoperatividad y paramet,16-02-2021 02:37,https://www.bing.com/th?id=OVFT.eRim96Vy0dhiU01fnGjRvC,Chile,El Sol de Honduras
Gobierno de Japón entregó a la Secretaría de Salud la donación de ocho ambulancias equipadas,http://www.eldiario.hn/gobierno-de-japon-entrego-a-la-secretaria-de-salud-la-donacion-de-ocho-ambulancias-equipadas/,"Tegucigalpa. - Como parte del fortalecimiento de los lazos de amistad entre Honduras y el Gobierno de Japón, este lunes el embajador de ese país, Norio Fukuta, entregó a la Secretaría de Salud la dona",16-02-2021 03:53,https://www.bing.com/th?id=OVFT.EKKVoINEQSXsX3BKepiuCC,Chile,El Diario
Honduras a punto de llegar a los 161 mil casos de covid-19,https://www.radiohrn.hn/honduras-a-punto-de-llegar-a-los-161-mil-casos-de-covid-19,"Los nuevos casos son de Francisco Morazán, Cortés, Atlántida, Yoro, Comayagua, Santa Bárbara, Ocotepeque, Copán, Choluteca, El Paraíso, Intibucá, La Paz y Olancho",16-02-2021 04:24,https://www.bing.com/th?id=OVFT.mHCNxH8IvDiGqCXBovtyXi,Chile,Radio HRN
Honduras registra 160.983 contagios de COVID-19 y 3.893 muertos,https://www.latribuna.hn/2021/02/16/honduras-registra-160-983-contagios-de-covid-19-y-3-893-muertos/,Tegucigalpa.- La cifra de contagios de COVID-19 en Honduras aumentó este lunes a 160.983 y la de muertos a 3.893,16-02-2021 07:18,https://www.bing.com/th?id=OVFT.ZBhFmG4336OTtiRL1zUx0y,Chile,La Tribuna
VACUNA CONTRA COVID-19 GARANTIZA QUE PERSONAS QUE SE LA APLIQUEN NO SERÁN HOSPITALIZADAS POR ESTA ENFERMEDAD,https://ultimahora.hn/vacuna-contra-covid-19-garantiza-que-personas-que-se-la-apliquen-no-seran-hospitalizadas-por-esta-enfermedad/,La vacuna contra la covid-19 garantiza que las personas que se la apliquen alcanzarán un nivel de inmunidad que les garantizará no serán hospitalizadas por complicaciones derivadas de esta,16-02-2021 14:03,https://www.bing.com/th?id=OVFT.DblPdfIyJ3b8G3tty34HPS,Chile,Ultima Hora
ORGANIZACIONES SINDICALES DE SALUD APOYAN PLAN NACIONAL DE VACUNACIÓN CONTRA LA COVID-19,https://ultimahora.hn/organizaciones-sindicales-de-salud-apoyan-plan-nacional-de-vacunacion-contra-la-covid-19/,Organizaciones sindicales del área de la salud expresaron este lunes su aprobación y apoyo al Plan Nacional de Vacunación contra la Covid-19 presentado por el Gobierno de la República. Dirigentes,16-02-2021 14:06,https://www.bing.com/th?id=OVFT.mnFjXmDkcMDVH340CAv-XS,Chile,Ultima Hora
Honduras registra 812 contagios y 27 nuevos fallecidos por covid-19 en las últimas 24 horas,https://www.laprensa.hn/honduras/1443187-410/honduras-coronavirus-covid-19-contagios-fallecidos-recuperados,"Desde el inicio de la pandemia el total de casos asciende a 160,983 y 3,893 muertes, según el registro de las autoridades sanitarias hondureñas.",16-02-2021 14:47,https://www.bing.com/th?id=OVFT.0Ce3C9KaylqjlXHRYAjX1C,Chile,La Prensa Chicos
HONDURAS / “¿DÓNDE ESTÁ EL DINERO?”: MADRE DE JOVEN MÉDICO MUERTO POR COVID,http://www.web.ellibertador.hn/index.php/noticias/nacionales/2687-honduras-donde-esta-el-dinero-madre-de-joven-medico-muerto-por-covid,"“Estoy indignada porque mi hijo se murió por falta de atención del Gobierno”, así lo ha dicho, entre lágrimas y cólera, doña Nidia Fuentes, madre del estudiante de medicina Yasser Cuellar, quien ha mu",16-02-2021 18:13,https://www.bing.com/th?id=OVFT.7w3h2B1CZ6rhAR-1LJQMiS,Chile,El Libertador
Aduanas garantizará el despacho oportuno y ágil del primer lote de vacunas contra Covid-19,https://hondudiario.com/2021/02/16/aduanas-garantizara-el-despacho-oportuno-y-agil-del-primer-lote-de-vacunas-contra-covid-19/,"El director Ejecutivo de la Administración Aduanera de Honduras, Juan José Vides, dijo que se trabaja en la simplificación y tecnificación de su sistema para garantizar el despacho oportuno y ágil de",16-02-2021 21:59,https://www.bing.com/th?id=OVFT.4CQwta-7RTbu1Fb_1AX3tS,Chile,Hondudiario
Migración realiza novena jornada de pruebas COVID-19 a empleados,https://www.latribuna.hn/2021/02/16/migracion-realiza-novena-jornada-de-pruebas-covid-19-a-empleados/,"A una nueva jornada de pruebas para detectar Covid-19 se sometió hoy el personal del Instituto Nacional de Migración (INM),",17-02-2021 02:27,https://www.bing.com/th?id=OVFT.ZQQh5qKx9uBrBYTWmW5nny,Chile,La Tribuna
Expertos de la OPS llegan a Honduras para detectar nueva cepa en Honduras,https://tiempo.hn/ops-llega-honduras-nueva-cepa/,"La OPS brindará capacitaciones al sector Salud de Honduras para que puedan detectar la nueva cepa del coronavirus. El médico intensivista hondureño Fernando Valerio afirmó en enero, que en el país ya",17-02-2021 02:32,https://www.bing.com/th?id=OVFT.i62Aamdt6EFooCIoSQNALC,Chile,Tiempo
Expertos de la OPS llegan a Honduras para detectar nueva cepa,https://tiempo.hn/ops-llega-a-honduras-nueva-cepa/,"La OPS brindará capacitaciones al sector Salud de Honduras para que puedan detectar la nueva cepa del coronavirus. El médico intensivista hondureño Fernando Valerio afirmó en enero, que en el país ya",17-02-2021 02:32,https://www.bing.com/th?id=OVFT.i62Aamdt6EFooCIoSQNALC,Chile,Tiempo
"Con 744 nuevos contagios, aumentan a 161 mil 727 los casos de COVID-19",https://proceso.hn/con-744-nuevos-contagios-aumentan-a-161-mil-727-los-casos-de-covid-19/,"Los casos de COVID-19 en Honduras se elevaron este martes a 161 mil 727 desde el inicio de la pandemia con la confirmación de otros 744 contagios, mientras que los pacientes recuperados aumentaron",17-02-2021 03:20,https://www.bing.com/th?id=OVFT.qUzeFtC5dh-oMR6-dIuziS,Chile,Proceso
Hospital Mario Catarino Rivas recibe moderno equipo de radiografía donado por el OIEA,http://www.eldiario.hn/hospital-mario-catarino-rivas-recibe-moderno-equipo-de-radiografia-donado-por-el-oiea/,"Tegucigalpa. - El primero de cuatro Sistemas de Radiografía Digital Móvil (Rayos X), donados por la Organización Internacional de Energía Atómica (OIEA) a Honduras, fue entregado hoy nartes por el Gob",17-02-2021 03:21,https://www.bing.com/th?id=OVFT.4X5haMns15OAXlY5KZx82y,Chile,El Diario
Honduras suma 161 mil 727 contagios y los tres mil 913 decesos por COVID-19,https://proceso.hn/honduras-suma-161-mil-727-contagios-y-los-tres-mil-913-decesos-por-covid-19/,Los casos de COVID-19 en Honduras se elevaron este martes a 161 mil 727 desde que se declaró la emergencia sanitaria por la pandemia en marzo del año pasado con la confirmación de otros 744,17-02-2021 03:23,https://www.bing.com/th?id=OVFT.YAQ9AJWXRhDxkLPOcNitLS,Chile,Proceso
"Por Covid-19, Real España pierde futbolista para el clásico ante Olimpia",https://www.diez.hn/liganacionaldehonduras/1443444-498/gerson-chavez-jugador-real-espana-positivo-covid-19-baja-clasico-olimpia-torneo-clausura,El equipo aurinegro y los merengues son dos de los primeros equipos de la Liga Nacional que han presentado dificultades con los contagios por Covid-19.,17-02-2021 03:37,https://www.bing.com/th?id=OVFT.52i3X2QqrmOy9ngbAlmkFi,Chile,diez.hn
