name,url,description,datePublished,imagen,pais,Fuente
"Honduras llega a 124,899 casos de Covid-19 , con 392 nuevos contagios",https://hondudiario.com/2021/01/06/covid/,"El Sistema Nacional de Gestión de Riesgos (Sinager), reportó 392 nuevos casos de Covid-19 para este miércoles de 1,245 pruebas procesadas, por lo que los contagios ascienden a 124,899 a nivel nacional",07-01-2021 04:41,https://www.bing.com/th?id=OVFT.oT04b6JLJ69JX8Rhpj9NuS,Chile,Hondudiario
Honduras puede regresar a restricciones si siguen aumentando casos de covid-19,https://www.laprensa.hn/honduras/1433959-410/coronavirus-informe-ministra-salud-alba-consuelo-flores-,"La ministra de Salud, Alba Consuelo Flores, confirmó que se están registrando entre 10 y 15 pacientes fallecidos por covid-19.",07-01-2021 06:26,https://www.bing.com/th?id=OVFT.TN7B5tgjvb-b4wcXviCqNC,Chile,La Prensa Chicos
Tras intervención 24 casos positivos de COVID19 en pruebas realizadas en asilo de ancianos,https://ultimahora.hn/tras-intervencion-24-casos-positivos-de-covid19-en-pruebas-realizadas-en-asilo-de-ancianos/,"Autoridades de la Región Metropolitana del Distrito Central, dieron a conocer que tras la intervención y la realización de pruebas PCR-TR para la detección de casos de COVID-19, 24 resultaron",07-01-2021 14:30,https://www.bing.com/th?id=OVFT.irr6tUiHjK1ldlmOzUPr2i,Chile,Ultima Hora
"Honduras se acerca a los 125,000 casos y alcanza los 3,192 muertos por covid",https://www.laprensa.hn/honduras/1434091-410/honduras-coronavirus-covid-19-sinager-salud-muerte-copeco,"Con seis nuevos fallecimientos, la cifra aumentó a 3,192. Tegucigalpa, Honduras. La cifra de contagios con covid-19 en Honduras ascendió este miércoles a 124,899 y los muertos a 3,192 desde que en mar",07-01-2021 16:08,https://www.bing.com/th?id=OVFT.OOoPHuiA7fSiAzZAVKjaky,Chile,La Prensa Chicos
En un 42% se elevaron los casos de COVID-19 durante diciembre.,https://www.latribuna.hn/2021/01/07/en-un-42-se-elevaron-los-casos-de-covid-19-durante-diciembre/,"El coordinador general del Gabinete de Gobierno, Carlos Madero, lamentó que durante diciembre pasado se elevaron en un 42 por ciento los casos de COVID-19. El funcionario manifestó que esto es debido",07-01-2021 18:04,https://www.bing.com/th?id=OVFT.vdpkKHRx-oa0ncH-uw2mFi,Chile,La Tribuna
"Gobierno espera seguir recibiendo apoyo de la comunidad internacional tras Eta, Iota y pandemia",https://hondudiario.com/2021/01/07/gobierno-espera-seguir-recibiendo-apoyo-de-la-comunidad-internacional-tras-eta-iota-y-pandemia/,"El canciller de la República Lisandro Rosales, agradeció a la comunidad internacional por el apoyo a Honduras, tras el paso de las tormentas tropicales Eta y Iota y de igual forma, por la ayuda al com",07-01-2021 19:18,https://www.bing.com/th?id=OVFT.nkhj7MtWDYJn6G0NQbKHVy,Chile,Hondudiario
"Por aumento de contagios, médico considera que nueva cepa de COVID-19 estaría en Honduras",https://tiempo.hn/nueva-cepa-covid-19-honduras-medico/,"SAN PEDRO SULA, HONDURAS. El doctor Carlos Umaña, presidente de la Asociación de Médicos del Instituto Hondureño de Seguridad Social (IHSS), considera que es probable que la nueva cepa del COVID-19 ya",07-01-2021 21:33,https://www.bing.com/th?id=OVFT.u9XvwAs5Y5WKZYGKefiyLi,Chile,Tiempo
Reportan 15 personas fallecidas este miércoles por sospecha de COVID-19 en Honduras,https://proceso.hn/reportan-12-personas-fallecidas-este-miercoles-por-sospecha-de-covid-19-en-honduras/,"Al menos 15 personas han fallecido en las últimas 24 horas por causa de la COVID-19 en diferentes hospitales del país, confirmaron fuentes sanitarias.",07-01-2021 22:08,https://www.bing.com/th?id=OVFT.7c-_hvOkY9ofbI8FNpeVUi,Chile,Proceso
Más de 52 mil familias recibirán el Bono Vida Mejor en Intibucá y La Paz,https://ultimahora.hn/mas-de-52-mil-familias-recibiran-el-bono-vida-mejor-en-intibuca-y-la-paz/,Más de 28 mil familias de Intibucá y 23 mil de La Paz iniciaron este jueves el cobro del bono único Vida Mejor entregado por el Gobierno. El beneficio fue instruido por el presidente de la,07-01-2021 23:13,https://www.bing.com/th?id=OVFT.py7vfGLVxVMy7nu1tHWKji,Chile,Ultima Hora
Vacuna anti Covid-19 en Honduras es parte del Plan de Reconstrucción del gobierno,https://www.vtv.com.hn/noticia/vacuna-anti-covid-19-en-honduras-es-parte-del-plan-de-reconstruccion-del-gobierno/,"Trabajadores en primera línea del sector salud: médicos, enfermeras, camilleros, conserjes, aseadoras, personal que brinda atención en clínica o administrativamente son los priorizados para recibir la",08-01-2021 00:24,https://www.bing.com/th?id=OVFT.7ZRHw9Xi1NIw22iNDpTbUy,Chile,VTV
Gobierno pide a Mesa Multisectorial evaluar nuevas medidas para frenar repunte de covid-19,http://www.elsoldehonduras.com/nacionales/gobierno-pide-a-mesa-multisectorial-evaluar-nuevas-medidas-para-frenar-repunte-de-covid-19/,"Tegucigalpa. El Gobierno, a través del Gabinete Económico y Social, pedirá a la Mesa Multisectorial adoptar nuevas medidas para frenar el repunte de casos de covid-19, informó el presidente Juan Orlan",08-01-2021 00:47,https://www.bing.com/th?id=OVFT.rcFhiIXHRp4GgKm9UFEfgC,Chile,El Sol de Honduras
Restablecen movilización nacional “Todos contra el Covid-19”,http://www.elsoldehonduras.com/nacionales/restablecen-movilizacion-nacional-todos-contra-el-covid-19/,"De manera simultánea, en los 18 departamentos del país y ciudades de Tegucigalpa y San Pedro Sula, junto a las 20 regiones de Salud se movilizarán más de 4.000 trabajadores de la salud (médicos, enfer",08-01-2021 00:58,https://www.bing.com/th?id=OVFT.XlIBcdRSYxBLqx3EFGmxOi,Chile,El Sol de Honduras
COVID-19 en Honduras: SINAGER confirma 219 casos y 8 muertos en 2021,https://tiempo.hn/covid-19-en-honduras-sinager-confirma-219-casos/,TEGUCIGALPA-HONDURAS. El incremento de casos de la COVID-19 en este 2021 no cesa en Honduras y esta es una emergencia sanitaria que mantiene en alerta roja a todo el país desde marzo del año pasado. P,08-01-2021 05:23,https://www.bing.com/th?id=OVFT.osV64uTPFwnQisu_8M3U1S,Chile,Tiempo
Honduras sobrepasa los 125 mil casos de COVID con 219 nuevos contagios,https://proceso.hn/honduras-sobrepasa-los-125-mil-casos-de-covid-con-219-nuevos-contagios/,"Tegucigalpa – El Sistema Nacional de Gestión de Riesgos (Sinager), informó este jueves que el Laboratorio Nacional de Virología, reportó otros 219 casos confirmados de COVID-19, con los que la cifra t",08-01-2021 06:11,https://www.bing.com/th?id=OVFT.eKHGOIgjfSqpbUMCW5n3uC,Chile,Proceso
Esfuerzo científico histórico ha permitido vacuna contra la covid-19,https://www.latribuna.hn/2021/01/08/esfuerzo-cientifico-historico-ha-permitido-vacuna-contra-la-covid-19/,"Por: José Rolando Sarmiento Rosales La rapidez con la que se comenzó a hablar de una serie de laboratorios y universidades participantes en la elaboración de vacunas para la COVID-19, tanto en Europa,",08-01-2021 07:37,https://www.bing.com/th?id=OVFT.7Y5cXDnpRH03SDfOGfqXSS,Chile,La Tribuna
