name,url,description,datePublished,imagen,pais,Fuente
Honduras reporta 523 nuevos contagiados por coronavirus y 8 nuevos fallecidos,https://www.laprensa.hn/honduras/1401735-410/coronavirus-honduras-covid-19-emergencia-sinager-contagios-salud,"La realización de pruebas PCR sigue baja en el país. Tegucigalpa, Honduras. El Sistema Nacional de Gestión de Riesgo (Sinager) a través de cadena nacional actualizó los datos de personas contagiadas p",16-08-2020 00:00,https://www.bing.com/th?id=ON.E5FB26BCB39B5512C44E7FB24B06576E,Chile,La Prensa Chicos
Rusia produce el primer lote de la vacuna contra el coronavirus,https://hondudiario.com/2020/08/15/rusia-produce-el-primer-lote-de-la-vacuna-contra-el-coronavirus/,"*** Los primeros frascos con el medicamento preventivo contra el COVID-19 serán entregados el 1 de enero del 2021. Tegucigalpa, Honduras. El ministerio de salud ruso comunicó este sábado que se ha pro",16-08-2020 01:46,https://www.bing.com/th?id=ON.BC56FD210393AB1D23AB904F0FFCDDB0,Chile,Hondudiario
Honduras: La curva del covid-19 en cada municipio,https://www.elheraldo.hn/interactivos/1401535-529/covid-honduras-curva-municipios,Explora en nuestra herramienta la cantidad de casos diarios y acumulados en cada municipio. Los resultados se ven limitados por la cantidad de pruebas realizadas El covid-19 ya demostró que siempre no,16-08-2020 04:08,https://www.bing.com/th?id=ON.B21A4CE18A577062D682C8D190489868,Chile,El Heraldo
Hay 35 municipios de Honduras con cero casos de covid-19,https://www.laprensa.hn/premium/1401573-410/honduras-35-municipios-cero-casos-covid-19-pandemia,"Con fuertes restricciones para la población, socialización de medidas de bioseguridad, y algunos ayudados por su posición geográfica aislada, 35 municipios aún permanecen libres de covid-19 al quinto",16-08-2020 08:01,https://www.bing.com/th?id=ON.C9E77A8CF56657C6952329D357E9A38E,Chile,La Prensa Chicos
"No hay bonanza, se pagará lo que se deba pagar: Juan Carlos Suazo",https://www.diariomas.hn/2020/08/16/no-hay-bonanza-se-pagara-lo-que-se-deba-pagar-juan-carlos-suazo/,"El presidente financiero del Fútbol Club Motagua, Juan Carlos Suazo, fue claro y categórico en afirmar que bajo la pandemia de la Covid 19, los recursos escasean y por lo tanto es obligatorio renegoci",16-08-2020 21:25,https://www.bing.com/th?id=ON.CC31FBFB9699A5392503654156BAA959,Chile,Mas
Canciller Rosales participa en toma de posesión del nuevo presidente de República Dominicana,http://www.elsoldehonduras.com/internacionales/noticia/canciller-rosales-participa-en-toma-de-posesion-del-nuevo-presidente-de-republica-dominicana/,"El canciller de la República, Lisandro Rosales, participó hoy, en representación del presidente Juan Orlando Hernández, en la toma de posesión del nuevo gobernante de República Dominicana, Luis Abinad",16-08-2020 21:43,https://www.bing.com/th?id=ON.EBF7EA0CBA1AD2645E4B47762F5B4960,Chile,El Sol de Honduras
Cuatro decesos por COVID-19 reportan hospitales de la capital,https://www.latribuna.hn/2020/08/16/cuatro-decesos-por-covid-19-reportan-hospitales-de-la-capital/,"Cuatro personas muertas por COVID-19 reportan los hospitales Escuela e Instituto Hondureño de Seguridad Social (IHSS), de Tegucigalpa en las últimas 24 horas. Las autoridades del IHSS confirman este d",16-08-2020 21:51,https://www.bing.com/th?id=ON.B79BCB281EA5A09C99607AA2CB65E834,Chile,La Tribuna
Que la educación superior no pague la crisis del covid-19,https://www.elheraldo.hn/opinion/columnas/1401544-469/que-la-educaci%C3%B3n-superior-no-pague-la-crisis-del-covid-19,"Sería injusto que el covid-19 sea la excusa perfecta para seguir debilitando económicamente a las seis universidades públicas de Honduras, que ya se encuentran en una situación difícil económicamente y con un control de la gestión académica ...",17-08-2020 00:07,https://www.bing.com/th?id=ON.7D05ACC3626093388D36064B004FCF19,Chile,El Heraldo
Asume Luis Abinader como nuevo presidente de la República Dominicana,https://notibomba.com/asume-luis-abinader-como-nuevo-presidente-de-republica-dominicana/,"El economista Luis Abinader, de 53 años, juró este domingo como presidente de la República Dominicana para el periodo 2020-2024. Luis Abinader al momento de tomar juramento como nuevo presidente de Re",17-08-2020 01:07,https://www.bing.com/th?id=ON.1EBF05535729B3D7837300834EDA5E52,Chile,Noti Bomba
Honduras supera los 50 mil casos de COVID-19,https://hondudiario.com/2020/08/16/honduras-supera-los-50-mil-casos-de-covid-19/,"*** La nación experimentó sus primeros dos casos hace 159 días, hoy sábado 15 de agosto la nación virtualmente alcanzó las 50 mil infecciones confirmadas. Tegucigalpa, Honduras. El Sistema de Gestión",17-08-2020 04:12,https://www.bing.com/th?id=ON.549784A751557045396166AD1C9CB295,Chile,Hondudiario
A “sol y agua” esperan noticias afuera de los hospitales,https://www.latribuna.hn/2020/08/17/a-sol-y-agua-esperan-noticias-afuera-de-los-hospitales/,"Escenas de tristeza, preocupación, impotencia y dolor viven los familiares de los pacientes COVID-19, en las afueras de diferentes hospitales capitalinos, tras cinco meses de la pandemia del coronavir",17-08-2020 11:31,https://www.bing.com/th?id=ON.79CE251D1735E1B9A8496B45B666747B,Chile,La Tribuna
