name,url,description,datePublished,imagen,pais,Fuente
A disparos ultiman a tres jóvenes en colonia capitalina La Rosa,https://www.proceso.hn/caliente/12-caliente/a-disparos-ultiman-a-dos-jovenes-en-colonia-capitalina-la-rosa.html,"Tegucigalpa - Tres jóvenes perdieron la vida en condiciones violentas la noche de este lunes en la colonia La Rosa de Comayagüela, ciudad gemela con Tegucigalpa, capital de Honduras. - La colonia La R",12-05-2020 16:15,https://www.bing.com/th?id=ON.CE2164E839F8647D3453AEA4B6D6D468,Chile,Proceso
"Cintia Zelaya, la hondureña que rompe el confinamiento para tener qué comer",https://www.diez.hn/coronavirus/1379208-441/historia-cinthia-zelaya-hondurena-rompe-confinamiento-cuarentena-buscando-comida,"La agencia de noticias AFP cuenta la historia de una hondureña sin empleo y sin comida en medio de la crisis por coronavirus. La hondureña Cintia Suyapa Zelaya, de 24 años, admite que incumple junto a",12-05-2020 17:06,https://www.bing.com/th?id=ON.E7441D429B850F8DCD9A51235C751F74,Chile,diez.hn
Llegan a Honduras los 85 hondureños varados en crucero en Panamá,https://www.elheraldo.hn/hondurenosenelmundo/1379124-299/llegan-a-honduras-los-85-hondure%C3%B1os-varados-en-crucero-en-panam%C3%A1,"El embajador de Honduras en Panamá, Germán Vicente García, detalló a EL HERALDO que la salida de los hondureños del barco se dio en el transcurso de la madrugada Momento en el que los hondureños salen",12-05-2020 21:25,https://www.bing.com/th?id=ON.00CC53CE6562430419CD0DE5F6BE76BD,Chile,El Heraldo
"Lucha contra COVID-19 en Honduras entre limitaciones, más casos y descontento",https://www.laprensa.hn/honduras/1379284-410/coronavirus-covid-19-honduras-pandemia-emerngencia-nacional-contagiados,"La pandemia de COVID-19 en Honduras ha dejado en dos meses 116 muertos y 2,100 contagiados, mientras que la lucha contra la enfermedad continúa con limitaciones en el sistema sanitario y el descontent",12-05-2020 22:15,https://www.bing.com/th?id=ON.09CFC760825293ADEA2A23EEDB2D00B4,Chile,La Prensa Chicos
Grupo de 63 hondureños retornados termina la cuarentena por coronavirus,https://www.laprensa.hn/honduras/1379299-410/honduras-migracion-coronavirus-covid-19-retornados-hondurenos-deportados,"Más de 60 hondureños deportados abandonaron este martes un centro especial de cuarentena en Tegucigalpa, capital de Honduras, donde se encontraban en una cuarentena de 14 días que concluyeron sin que",12-05-2020 22:54,https://www.bing.com/th?id=ON.EE441E1966861667950957DB004F7659,Chile,La Prensa Chicos
Con estrictas medidas de bioseguridad retoma atención la Aduana Integrada El Florido,https://www.latribuna.hn/2020/05/12/con-estrictas-medidas-de-bioseguridad-retoma-atencion-la-aduana-integrada-el-florido/,"Con estrictas medidas de bioseguridad el día de hoy se retoma la atención en la Aduana Integrada El Florido para el despacho de mercancías y operaciones aduaneras correspondientes a la importación, ex",12-05-2020 23:06,https://www.bing.com/th?id=ON.79237D3A04EC8F745BE9761D4F82A258,Chile,La Tribuna
Coronavirus: Hablan las enfermeras hondureñas en la primera línea de batalla,https://www.elheraldo.hn/interactivos/1379302-523/coronavirus-hablan-las-enfermeras-hondure%C3%B1as-en-la-primera-l%C3%ADnea-de-batalla,"Interactivos Coronavirus: Hablan las enfermeras hondureñas en la primera línea de batalla ﻿En el marco del Día Internacional de las Enfermeras, EL HERALDO da voz a las profesionales de la salud que combaten el Covid-19 en Honduras",13-05-2020 00:01,https://www.bing.com/th?id=ON.3768983B59FC8793C66E4AFE500AD89D,Chile,El Heraldo
"Honduras registra 2,080 casos positivos de covid-19",https://radiohrn.hn/honduras-registra-2080-casos-positivos-de-covid-19/,"El Sistema Nacional de Gestión de Riesgo (Sinager), anunció el martes que Honduras eleva la cifra de casos positivos por covid-19 a 2,080 a nivel nacional. De las 305 pruebas realizadas por coronaviru",13-05-2020 01:52,https://www.bing.com/th?id=ON.3A6EC56740CACD3FD59C071F81529159,Chile,Radio HRN
"Honduras se acerca a la etapa cinco del coronavirus, advierte el médico Carlos Umaña",https://radiohrn.hn/honduras-se-acerca-a-la-etapa-cinco-del-coronavirus-advierte-el-medico-carlos-umana/,"Suman y suman los casos por covid-19. Honduras se acerca a la etapa cinco del coronavirus, advirtió este martes, el presidente de la Asociación de médicos del Instituto Hondureño de Seguridad Social (",13-05-2020 01:52,https://www.bing.com/th?id=ON.06D2B19DBDAAE1933446BF2431717B93,Chile,Radio HRN
Muere subcomisionado de la Policía a causa de COVID,https://proceso.hn/portadas/10-portada/muere-por-covid-19-un-subcomisionado-de-la-policia-en-la-capital.html,"Tegucigalpa - Un subcomisionado de la Policía Nacional falleció este martes en el Hospital Militar de esta capital hondureña, a causa de COVID-19. El funcionario policial se contagio de la enfermedad",13-05-2020 02:00,https://www.bing.com/th?id=ON.89944387ED555C956FB5708CA7A89872,Chile,Proceso
"Honduras reporta 2,080 casos de Covid-19 tras “ajuste” en las cifras y 121 muertes en total",https://hondudiario.com/2020/05/12/honduras-reporta-2080-casos-de-covid-19-tras-ajuste-en-las-cifras-y-121-muertes-en-total/,"El Sistema Nacional de Gestión de Riesgos (Sinager), informó este martes que de 305 pruebas para diagnosticar Covid-19 en la población hondureña, 74 dieron positivo sumando así un total de 2,080 casos",13-05-2020 14:34,https://www.bing.com/th?id=ON.2D3AE8CF86218F5A3DF03F8459E07877,Chile,Hondudiario
"Gárgaras con agua, sal y cloro eliminan virus",https://www.latribuna.hn/2020/05/13/gargaras-con-agua-sal-y-cloro-eliminan-virus/,"Para contrarrestar o combatir el coronavirus o COVID-19, la población de escasos recursos económicos puede preparar su propio medicamento casero, manifestó ayer epidemiólogo del Instituto Hondureño de",13-05-2020 15:46,https://www.bing.com/th?id=ON.B24783770C572E5856516045478A33E0,Chile,La Tribuna
Pequeños hoteles esperan cerrar el 2020 con 15% de ocupación y una recuperación en dos años,https://hondudiario.com/2020/05/13/pequenos-hoteles-esperan-cerrar-el-2020-con-15-de-ocupacion-y-una-recuperacion-en-dos-anos/,"El presidente de la Asociación de Hoteles Pequeños de Honduras (Hopeh), Roberto Oseguera, expuso que la recuperación de estos negocios tras la emergencia por Covid-19 se dará luego de dos años y que e",13-05-2020 16:35,https://www.bing.com/th?id=ON.B4BFD4427C4832A88787273ECF22CFAC,Chile,Hondudiario
Honduras: Reconocen “errores” en divulgación de casos de Covid-19,https://notibomba.com/honduras-reconocen-errores-en-divulgacion-de-casos-de-covid-19/,"Autoridades sanitarias en Honduras reconocieron este miércoles que existen “errores” en la divulgación de casos de Covid-19, con un margen de 95 contagios lo que pone en duda el conteo oficial. “Se pu",13-05-2020 17:25,https://www.bing.com/th?id=ON.706C97CB491171BC5A5B82B0A281BF15,Chile,Noti Bomba
