name,url,description,datePublished,imagen,pais,Fuente
"Editorial HRN: Burocracia, injusticia salarial y finanzas en bancarrota en Honduras",https://www.radiohrn.hn/editorial-hrn-burocracia-injusticia-salarial-y-finanzas-en-bancarrota-en-honduras,"Tenemos una burocracia con un enorme y preocupante exceso de peso, una estructura salarial muy injusta y un déficit insostenible entre los ingresos y los gastos. “A pobre viene, quien gasta más de lo",07-09-2020 18:08,https://www.bing.com/th?id=OVFT.VlvgvNxQSNh8y20-T9y7Ki,Chile,Radio HRN
Se cancelaron eventos internacionales del voleibol: Félix Sabio,https://www.diariomas.hn/2020/09/07/se-cancelaron-eventos-internacionales-del-voleibol-felix-sabio/,"El presidente de la Federación de Voleibol de Honduras, Félix Ambrosio Sabio, confió a Diario Más que las tres competencias centroamericanas pendientes para 2020 fueron canceladas en forma oficial en",07-09-2020 19:59,https://www.bing.com/th?id=OVFT.GgoaqzxyNWvjJaOfEuT85S,Chile,Mas
Nueva ambulancia especial para Covid-19 en San Pedro Sula,https://www.laprensa.hn/honduras/1406725-410/-ambulancia-especial-covid-19-san-pedro-sula-,"A partir de la emergencia por la expansión del Covid-19 en el país, se han multiplicado las atenciones de la Cruz Roja Hondureña con el traslado de pacientes a centros hospitalarios. Las secuelas del",07-09-2020 20:27,https://www.bing.com/th?id=OVFT.9atcHayiP5Lu4QLkjlVUpy,Chile,La Prensa Chicos
"Muere Cipriano Dueñas, exgoleador del Vida, Marathón y Victoria en la década de los 80",https://www.diez.hn/liganacionaldehonduras/1406760-498/muere-cipriano-duenas-goleador-vida-marathon-victoria-liga-nacional-perez-zeledon-costa-rica,A cinco días del inicio de la Premier: Manchester City anuncia que tiene dos positivos por COVID-19 No te pierdas las mejores noticias deportivas del día,07-09-2020 21:55,https://www.bing.com/th?id=OVFT.IcUwM0IpzI2Ksu3Lr7m5bi,Chile,diez.hn
Gobierno de Corea dona 3 máquinas de extracción para pruebas PCR,https://hondudiario.com/2020/09/07/gobierno-de-corea-dona-3-maquinas-de-extraccion-para-pruebas-pcr/,"El Gobierno de Corea donó este lunes a la Secretaria de Salud  (Sesal), tres máquinas de extracción para la toma de pruebas PCR con el objetivo de contribuir en el fortalecimiento del Laboratorio Naci",07-09-2020 22:17,https://www.bing.com/th?id=OVFT.y1sCOrolikMqzeSRAUHbqi,Chile,Hondudiario
Ejecutivo reitera petición al CN para que apruebe Plan Financiero de Rescate Solidario,http://www.eldiario.hn/ejecutivo-reitera-peticion-al-cn-para-que-apruebe-plan-financiero-de-rescate-solidario/,Tegucigalpa.- El presidente Juan Orlando Hernández reiteró este lunes la petición al Congreso Nacional para que apruebe el Plan Financiero de Rescate Solidario enviado por el Ejecutivo para apoyar la,07-09-2020 22:58,https://www.bing.com/th?id=OVFT.MfNB1SgN6GmbBLMJZM-qOC,Chile,El Diario
Liga confirma patrocinio con Cervecería Nacional,https://www.diariomas.hn/2020/09/08/liga-confirma-patrocinio-con-cerveceria-nacional/,"La junta directiva de la Liga Nacional de Fútbol Profesional de Honduras, por medio de un comunicado confirmó que mantiene vigente su convenio de patrocinio con la empresa Cervecería Hondureña, S.A. C",07-09-2020 23:00,https://www.bing.com/th?id=OVFT.wTTRS30Ic8wQbFp93SFDRS,Chile,Mas
Ministerio Público llama a declarar al canciller Lisandro Rosales por compra de 129 ventiladores mecánicos,https://www.radiohrn.hn/honduras-ministerio-publico-llama-a-declarar-al-canciller-lisandro-rosales-por-compra-de-129-ventiladores-mecanicos-covid-19,"El Ministerio Público (MP), citó el lunes al canciller y comisionado presidente en el manejo de la pandemia del covid, Lisandro Rosales, con el fin de interrogarlo por la compra de ventiladores mecáni",08-09-2020 14:54,https://www.bing.com/th?id=OVFT.d3VCooTuYBxY0MW3HGzUby,Chile,Radio HRN
"“Falsificaron etiquetas para equipos médicos de hospital móvil”, denuncia el CNA",https://proceso.hn/falsificaron-etiquetas-para-equipos-medicos-de-hospital-movil-denuncia-el-cna/,"Tegucigalpa – El jefe de la unidad de investigación del Concejo Nacional Anticorrupción (CNA), Odir Fernández, manifestó que en el proceso de adquisición de los hospitales móviles se falsificaron etiq",08-09-2020 15:06,https://www.bing.com/th?id=OVFT.bdtD28wF9QSs9lZ18mrvlS,Chile,Proceso
Lote de pruebas de antígeno para covid-19 se comprará a Colombia,https://www.elheraldo.hn/pais/1406849-466/lote-de-pruebas-de-ant%C3%ADgeno-para-covid-19-se-comprar%C3%A1-a-colombia,"Las pruebas de antígenos ayudarán a detectar a los asintomáticos y se priorizará al personal asistencial, se aplicarán en centros de triaje y por los equipos de respuesta que visitan colonias TEGUCIGA",08-09-2020 15:10,https://www.bing.com/th?id=OVFT.GUXQUmXrXiSTh8feYzxXhC,Chile,El Heraldo
"La fortaleza en el movimiento de Yani son los jóvenes, dice ex diputado liberal",https://elpatriota.hn/2020/09/08/la-fortaleza-en-el-movimiento-de-yani-son-los-jovenes-dice-ex-diputado-liberal/,"CORTÉS, HONDURAS. La fortaleza del movimiento de simpatizantes del abogado y empresario Yani Rosenthal son los jóvenes, asegura el exdiputado del Partido Liberal Manuel Iván Fiallos. “Yani ha tenido e",08-09-2020 17:02,https://www.bing.com/th?id=OVFT.IVwOT0u2QA3SqRYOok0Xvi,Chile,El Patriota
Mientras hondureños aplauden interventor deINVEST-H de se indigna por informe del CNA sobre hospitales móviles,https://elpatriota.hn/2020/09/08/mientras-hondurenos-aplauden-interventor-deinvest-h-de-se-indigna-por-informe-del-cna-sobre-hospitales-moviles/,"TEGUCIGALPA-HONDURAS. Indignado reaccionó el integrante de la junta interventora de Inversión Estratégica de Honduras (INVEST-H), Gustavo Boquín, por el informe que emitió el Consejo Nacional Anticorr",08-09-2020 17:11,https://www.bing.com/th?id=OVFT.MbkFIODlSrnPk_mni2hwii,Chile,El Patriota
Se reduce en un 80% el contagio de COVID-19 en enfermeras,https://www.latribuna.hn/2020/09/08/se-reduce-en-un-80-el-contagio-de-covid-19-en-enfermeras/,"El presidente de la Asociación Nacional de Enfermeras y Enfermeros de Honduras (Aneeah), Josué Orellana, informó este martes que se ha registrado una reducción significativa en los contagios de COVID-",08-09-2020 17:48,https://www.bing.com/th?id=OVFT.NaBUnSME49YOs4BAs64zsy,Chile,La Tribuna
En Claves: ¿Cómo obtener un salvoconducto turístico?,https://www.laprensa.hn/honduras/1406958-410/turismo-interno-coronavirus-covid-pandemia-honduras-cuarentena,"Las autoridades han detallado varios requisitos que los turistas en Honduras deben cumplir en tiempos de COVID-19. Tome nota. San Pedro Sula, Honduras. Muchos hondureños desean hacer turismo interno,",08-09-2020 18:51,https://www.bing.com/th?id=OVFT.sigFnAYN9BAfhTioZD2hxC,Chile,La Prensa Chicos
Marca País lanza tercera edición del concurso Gran Embajador Marca Honduras,http://www.elsoldehonduras.com/nacionales/marca-pais-lanza-tercera-edicion-del-concurso-gran-embajador-marca-honduras/,"La estrategia público-privada Marca País lanzó hoy oficialmente el concurso Gran Embajador Marca Honduras, mediante el cual busca exaltar el amor patrio, el fomento de los valores y la identidad nacio",08-09-2020 20:57,https://www.bing.com/th?id=OVFT.yBX-8zc3Qui3hMSF_Dgl-S,Chile,El Sol de Honduras
Programa Honduras para Todos ahora realizará visitas Casa a Casa,http://www.elsoldehonduras.com/nacionales/programa-honduras-para-todos-ahora-realizara-visitas-casa-a-casa/,"En el marco de los esfuerzos realizados por el Gobierno de Honduras para el combate de la pandemia de covid-19, se realizó el lanzamiento de la estrategia Casa a Casa del Programa Honduras para Todos",08-09-2020 21:25,https://www.bing.com/th?id=OVFT.fnSFoAMaX1DxDDM1ziPzVC,Chile,El Sol de Honduras
Canciller Rosales confirma que próximo jueves comparecerá ante agentes del MP,https://hondudiario.com/2020/09/08/canciller-rosales-confirma-que-proximo-jueves-comparecera-ante-agentes-del-mp/,"El Canciller y comisionado especial para la pandemia de COVID-19, Lisandro Rosales, confirmó que el próximo jueves comparecerá ante agentes de la Fiscalía por la investigación en la compra de ventilad",08-09-2020 21:58,https://www.bing.com/th?id=OVFT.-ZzFO4haODDiHKckwWnwAC,Chile,Hondudiario
"Cantarranas ya tiene su centro de triaje, el número 24 en Francisco Morazán",https://www.latribuna.hn/2020/09/08/cantarranas-ya-tiene-su-centro-de-triaje-el-numero-24-en-francisco-morazan/,"El presidente Juan Orlando Hernández inauguró hoy de manera virtual el centro de triaje de Cantarranas (Francisco Morazán), instalado a través del programa Fuerza Honduras con el aporte del Gobierno c",08-09-2020 22:56,https://www.bing.com/th?id=OVFT.abtZZqP-Og-v8DxIv6nc9y,Chile,La Tribuna
