name,url,description,datePublished,imagen,pais,Fuente
"Lobos – Motagua, reactivan la Liga Nacional",https://www.diariomas.hn/2020/09/26/lobos-motagua-reactivan-la-liga-nacional/,"El fútbol vuelve a casa, después de seis meses de incertidumbre y ansiedad por disfrutar de un partido de nuestra Liga Profesional que había tenido",26-09-2020 15:00,https://www.bing.com/th?id=OVFT.4MVqiExOYTDYRAWQdLk3bi,Chile,Mas
Primer clásico en plena pandemia,https://www.diariomas.hn/2020/09/27/primer-clasico-en-plena-pandemia/,La emoción del fútbol de la Liga Profesional de Honduras continúa esta noche con el primer clásico de la temporada en medio de la pandemia de la Covid,27-09-2020 15:01,https://www.bing.com/th?id=OVFT.owdRjxyRhmWBHmaOctHlxS,Chile,Mas
Intervienen el departamento de Olancho por aumento de casos de COVID-19,https://www.latribuna.hn/2020/10/03/intervienen-el-departamento-de-olancho-por-aumento-de-casos-de-covid-19/,El presidente Juan Orlando Hernández anunció este sábado la intervención del departamento de Olancho tras participar en la ceremonia de las Fuerzas Armadas de Honduras durante la celebración del Día d,03-10-2020 21:16,https://www.bing.com/th?id=OVFT.2Ho8ERlZ-UwHYp6hCPoTHC,Chile,La Tribuna
Covid-19 no influyó de forma directa en las deportaciones y detenciones de migrantes,https://www.elheraldo.hn/minisitios/hondurenosenelmundo/1412811-471/covid-19-no-influy%C3%B3-de-forma-directa-en-las-deportaciones-y-detenciones-de,"Este 2020 es el año que menos deportaciones ha registrado, mientras que las detenciones de familias enteras cayeron significativamente en comparación con el año anterior",03-10-2020 21:19,https://www.bing.com/th?id=OVFT.kRl-BiHIXl7gMN64Pg01eC,Chile,El Heraldo
"Pese al covid-19, sigue migración, deportaciones y detenciones de hondureños",https://www.elheraldo.hn/minisitios/hondurenosenelmundo/1412811-471/pese-al-covid-19-sigue-migraci%C3%B3n-deportaciones-y-detenciones-de-hondure%C3%B1os,"Este 2020 es el año que menos deportaciones ha registrado, mientras que las detenciones de familias enteras cayeron significativamente en comparación con el año anterior",03-10-2020 21:44,https://www.bing.com/th?id=OVFT.kRl-BiHIXl7gMN64Pg01eC,Chile,El Heraldo
Presidente Hernández desea pronta recuperación a su homólogo de EEUU y su esposa tras dar positivos de coronavirus,http://www.elsoldehonduras.com/nacionales/presidente-hernandez-desea-pronta-recuperacion-a-su-homologo-de-eeuu-y-su-esposa-tras-dar-positivos-de-coronavirus/,"El presidente Juan Orlando Hernández expresó hoy sus deseos de pronta recuperación a su homólogo de Estados Unidos, Donald Trump, y su esposa, Melania Trump, luego de confirmarse que resultaron positi",03-10-2020 23:41,https://www.bing.com/th?id=OVFT.0HOdMnPOAdzf9SXT19xm2y,Chile,El Sol de Honduras
Cónsul mexicano en Honduras: Los hondureños que emigran no encontrarán empleo en México,http://www.elsoldehonduras.com/internacionales/consul-mexicano-en-honduras-los-hondurenos-que-emigran-no-encontraran-empleo-en-mexico/,"El cónsul de México en Honduras, Gilberto Limón Enríquez, aseguró hoy que los hondureños que migren a territorio mexicano no tienen opción de encontrar empleo, porque su país está enfrentando altos ni",03-10-2020 23:49,https://www.bing.com/th?id=OVFT.JBkJ79HACRyUCeqEXkK7tC,Chile,El Sol de Honduras
Extienden toque de queda en Honduras y continúan medidas de circulación en dos dígitos diarios,https://www.radiohrn.hn/extienden-toque-de-queda-en-honduras-y-continuan-medidas-de-circulacion-en-dos-digitos-diarios,El Sistema Nacional de Gestión de Riesgos (Sinager) y la Secretaría de Seguridad determinaron el domingo 4 de octubre continuar con la circulación de la población hondureña en dos dígitos diarios a pa,04-10-2020 00:00,https://www.bing.com/th?id=OVFT.KRFRf9pLtsM3wxmiQjRRyC,Chile,Radio HRN
Honduras extiende toque de queda hasta el 11 de octubre y mantiene circulación con dos dígitos,https://www.diez.hn/coronavirus/1413192-441/honduras-extiende-toque-queda-11-octubre-nuevo-calendario-circulacion-pandemia-coronavirus,El Gobierno de Honduras amplió el toque de queda por la pandemia del coronavirus hasta el domingo 11 de octubre a las 11 de la noche. Este es el calendario de circulación.,04-10-2020 00:00,https://www.bing.com/th?id=OVFT.EiULl3DugwfI4n-6zyW2wy,Chile,diez.hn
"Honduras se acerca a los 2,500 muertos por coronavirus",https://www.laprensa.hn/honduras/1413188-410/honduras-muertos-coronavirus-covid-contagiados-sinager-secretaria-salud,"San Pedro Sula, Honduras. El Sistema Nacional de Gestión de Riesgo (Sinager) actualizó la cantidad de personas contagiadas por covid-19 en Honduras y también las fallecidas. Se",04-10-2020 00:00,https://www.bing.com/th?id=OVFT.vwvgUN36Jh1gHHMlqO23wy,Chile,La Prensa Chicos
"Honduras alcanza 78,788 casos y 2,399 decesos por COVID-19",https://proceso.hn/honduras-alcanza-78778-casos-y-2399-decesos-por-covid-19/,"Tegucigalpa – El Sistema Nacional de Gestión de Riesgos (Sinager), reportó este sábado, otros 519 nuevos casos positivos de COVID-19, con lo que el número total de contagios subió a 78,788, mientras q",04-10-2020 04:14,https://www.bing.com/th?id=OVFT.YQQ2zHo1QT5ygbvXX3w28i,Chile,Proceso
Honduras niega que no quiera recibir a retornados como afirma Guatemala,https://www.laprensa.hn/honduras/1413037-410/honduras-niega-migrantes-retornados-guatemala-caravana,"Tegucigalpa. Honduras rechazó este domingo las afirmaciones del Gobierno de Guatemala, que señalan que se niega a recibir a los inmigrantes hondureños que han sido devueltos a su país en las últimas h",04-10-2020 17:06,https://www.bing.com/th?id=OVFT.NrzkhguNvu9AjlSRM8NsKC,Chile,La Prensa Chicos
Segun vicecanciller el 83% de migrantes de caravana ya retornaron a Honduras,http://www.eldiario.hn/segun-vicecanciller-el-83-de-migrantes-de-caravana-ya-retornaron-a-hondur/,Tegucigalpa. - El 83 por ciento de los aproximadamente 1.250 migrantes que viajaron en la caravana con destino a los Estados Unidos ya retornaron al país y están siendo trasladados a sus lugares de or,05-10-2020 03:35,https://www.bing.com/th?id=OVFT.FzjUfUR3zeHqMoVPaxpJPy,Chile,El Diario
Honduras “cautelosa” mantiene restricciones con 6 departamentos en alto nivel de riesgo por COVID,https://hondudiario.com/2020/10/04/honduras-cautelosa-mantiene-restricciones-con-6-departamentos-en-alto-nivel-de-riesgo-por-covid/,"*** El país tiene 6 departamentos con altas tasas de morbilidad, mortalidad y letalidad por el Covid-19. El Gobierno de Honduras determinó este domingo extender el toque de queda absoluto en todo el t",05-10-2020 04:11,https://www.bing.com/th?id=OVFT.CArZAUWeo99NP4vTA0wPKC,Chile,Hondudiario
Honduras supera los 79 mil contagios y los dos mil 400 decesos por COVID-19,https://proceso.hn/honduras-supera-los-79-mil-contagios-y-los-dos-mil-400-decesos-por-covid-19/,"Tegucigalpa – El Sistema Nacional de Gestión de Riesgos (Sinager), reportó este domingo, otros 841 nuevos casos positivos de COVID-19, con lo que el número total de contagios subió a 79,629 mientras q",05-10-2020 04:11,https://www.bing.com/th?id=OVFT.nygUXJ8lOQKCwCzDR6a1eS,Chile,Proceso
Honduras se ha posicionado como productor de café en Centroamérica,https://www.latribuna.hn/2020/10/05/honduras-se-ha-posicionado-como-productor-de-cafe-en-centroamerica/,"El Presidente de la República, Juan Orlando Hernández, felicitó al sector cafetalero con motivo del Día Internacional del Café, que coincide con el inicio de la cosecha 2020-2021, y le agradeció por p",05-10-2020 10:07,https://www.bing.com/th?id=OVFT.pT631oewWsyyTwmJnNKgtC,Chile,La Tribuna
El 83% de migrantes en caravana ya retornaron a Honduras,https://ultimahora.hn/el-83-de-migrantes-en-caravana-ya-retornaron-a-honduras/,El 83 por ciento de los aproximadamente 1.250 migrantes que viajaron en  la caravana con destino a los Estados Unidos ya retornaron al país y están siendo trasladados a sus lugares de origen por,05-10-2020 14:15,https://www.bing.com/th?id=OVFT.V1fQunnuV6oH0JpH_g4EAi,Chile,Ultima Hora
