name,url,description,datePublished,imagen,pais,Fuente
Coronavirus: Juan Orlando Hernández veta decreto que da permanencia laboral a personal de salud,https://radiohrn.hn/coronavirus-juan-orlando-hernandez-veta-decreto-que-da-permanencia-laboral-a-personal-de-salud/,"El presidente de Honduras, Juan Orlando Hernández, vetó el decreto que contiene el otorgamiento de acuerdos laborales al personal de la salud que trabaja por contrato, por considerar que existen incon",13-05-2020 03:30,https://www.bing.com/th?id=ON.B82500535CF43033B06912E7753D5F89,Chile,Radio HRN
"Declaran “Héroe Policial” al subcomisionado Jaime Barahona, tras fallecer por covid-19",https://radiohrn.hn/declaran-heroe-policial-al-subcomisionado-jaime-barahona-tras-fallecer-por-covid-19/,"La Policía Nacional reitera su compromiso de velar por la ciudadana. Foto El Heraldo. La Secretaría de Seguridad declaró este martes “Heroé Policial” al subcomisionado de la Policía Nacional, Jaime Ma",13-05-2020 13:18,https://www.bing.com/th?id=ON.EF8666548518311A18D4948A2D71DDC5,Chile,Radio HRN
Personas de la tercera edad en Honduras en la mira del coronavirus,https://www.elheraldo.hn/pais/1379434-466/las-personas-de-la-tercera-edad-en-la-mira-del-coronavirus,"El virus es más letal en las personas de 60 o más años, según análisis de la Unidad de Datos de EL HERALDO. Y, aunque los ancianos son los que menos se infectan en Honduras, son los que más mueren en",13-05-2020 18:23,https://www.bing.com/th?id=ON.1E706817B9238C2CE996EE1360CBBA3B,Chile,El Heraldo
Concacaf suspende el Premundial Sub-20 de San Pedro Sula por el coronavirus,https://www.diez.hn/laseleccion/1379543-498/concacaf-suspende-premundial-sub-20-san-pedro-sula-coronavirus,"Este día la Concacaf ha suspendido el Premundial Sub-20 masculino, certamen que estaba previsto para disputarse entre el mes de junio y julio en la ciudad de San Pedro Sula. Esto a raíz del coronaviru",13-05-2020 20:50,https://www.bing.com/th?id=ON.418F012483461903B919A73578841C0F,Chile,diez.hn
Honduras: Reconocen “errores” en divulgación de casos de Covid-19,https://notibomba.com/honduras-reconocen-errores-en-divulgacion-de-casos-de-covid-19/,"Autoridades sanitarias en Honduras reconocieron este miércoles que existen “errores” en la divulgación de casos de Covid-19, con un margen de 95 contagios lo que pone en duda el conteo oficial. “Se pu",13-05-2020 21:04,https://www.bing.com/th?id=ON.706C97CB491171BC5A5B82B0A281BF15,Chile,Noti Bomba
Concacaf anuncia suspensión del Premundial sub-20 a realizarse en Honduras,https://www.laprensa.hn/deportes/1379551-410/premundial-sub-20-concacaf-mundial-indonesia-honduras-san-pedro-sula-coronavirus,"La Confederación de Norteamérica, Centroamérica y el Caribe de Fútbol (Concacaf) decidió este miércoles suspender el Premundial Sub-20 previsto a realizarse entre el mes de junio y julio en San Pedro",13-05-2020 21:15,https://www.bing.com/th?id=ON.B350F02EAA118C1E0AB482AA21AA7317,Chile,La Prensa Chicos
Covid-19 Honduras: se confirma 74 contagios más de coronavirus sumando un total de 2080 casos,http://www.elsoldehonduras.com/salud/covid-19-honduras-se-confirma-74-contagios-mas-de-coronavirus-sumando-un-total-de-2080-casos/,"Tegucigalpa. El Sistema Nacional de Gestión de Riesgos (Sinager) anunció que tras realizarse 305 pruebas de covid-19 resultaron positivas 74 para sumar 2.080 casos de esa enfermedad, que causó la muer",13-05-2020 21:24,https://www.bing.com/th?id=ON.A44D426817F2555F13DEAFD491A23806,Chile,El Sol de Honduras
HONDURAS / MILITARES ADMINISTRARÁN COSTOSOS “HOSPITALES MÓVILES”,http://www.web.ellibertador.hn/index.php/noticias/nacionales/2009-honduras-militares-administraran-costosos-hospitales-moviles,"El portavoz de las Fuerzas Armadas, Yuri Chávez, informó que esa institución se encargará de administrar al menos dos de los hospitales móviles que Invest-H encargó a una empresa estadounidense cuya “",13-05-2020 21:56,https://www.bing.com/th?id=ON.A9A2B187DE0CB4A49E15365D67EF3DE4,Chile,El Libertador
Honduras registra 46 fallecidos por COVID-19 en el exterior,https://www.laprensa.hn/especiales/coronavirus/1379560-410/honduras-fallecidos-covid-19-exterior-coronavirus-hondure%C3%B1os-,"Honduras registra 46 de sus ciudadanos muertos por COVID-19 en el exterior, principalmente en Estados Unidos y España, mientras que el número de contagios se acerca a los 150, dijo a Efe la vicecancil",13-05-2020 22:04,https://www.bing.com/th?id=ON.5DA42EC09700117CA53F660C9BC85229,Chile,La Prensa Chicos
Ecuador golpeada por el Covid-19 y la corrupción,https://notibomba.com/ecuador-golpeada-por-el-covid-19-y-la-corrupcion/,"Ecuador, la nación más golpeada por el coronavirus en América Latina, sufre otros “revés” que mantiene en agonía a la población: La corrupción. A pesar de enfrentar una de las mayores crisis por el Co",13-05-2020 22:20,https://www.bing.com/th?id=ON.7D61386DA777DEC8C31B7870DCAD2D9F,Chile,Noti Bomba
Más de 100 mil empleos se han perdido en turismo según Emilio Silvestri,https://www.proceso.hn/mas-noticias/32-m%e1s-noticias/mas-de-100-mil-empleos-se-han-perdido-en-turismo-segun-emilio-silvestri.html,"Tegucigalpa - El empresario de turismo, Emilio Silvestri, reveló que las pérdidas de empleos en este sector, por el virus del COVID-19 a nivel nacional, ascienden a más de 100 mil de los 250 mil que g",13-05-2020 22:42,https://www.bing.com/th?id=ON.A71C997E31D7C366BC9EB2A181AA814E,Chile,Proceso
"Blog de Kike Lanza: ""El Covid-19 le quedó grande a la Liga Nacional, no pudieron con esa papa caliente""",https://www.diez.hn/blogs/1379595-500/blog-de-kike-lanza-covid19-le-quedo-grande-a-la-liga-nacional-honduras,"El director del programa radial 'El VAR de los compadres', asegura que Costa Rica es la Alemania de Centroamérica en fútbol No es desconocido por nadie que el tema COVID-19 le quedó grande a la Liga N",13-05-2020 23:28,https://www.bing.com/th?id=ON.6F23EF7FD47E90E744940423121FCA9C,Chile,diez.hn
Todo el personal sanitario y administrativo de apoyo en el área de salud obtendrá su acuerdo laboral,http://www.elsoldehonduras.com/salud/todo-el-personal-sanitario-y-administrativo-de-apoyo-en-el-area-de-salud-obtendra-su-acuerdo-laboral/,"• Presidente del CN, Mauricio Oliva, pidió dispensa de debates para que se aprobara cuanto antes ellos no pueden esperar”, dijo. • En esta iniciativa se incluye a personal por contrato del Sistema Nac",14-05-2020 02:01,https://www.bing.com/th?id=ON.9E3179BA8F46FB094891C21F46F3DD8D,Chile,El Sol de Honduras
Unos 600 niños han sido confirmados con Covid-19 en Honduras,https://hondudiario.com/2020/05/13/unos-600-ninos-han-sido-confirmados-con-covid-19-en-honduras/,"El pediatra Darío Zúniga lamentó que del 100 por ciento de los confirmados de Covid-19 en el país, el 32 por ciento corresponde a menores de 0 a 11 años de edad. Es decir que unos 600 niños están cont",14-05-2020 02:52,https://www.bing.com/th?id=ON.E87B300E46D334BB1A8D4C3985390AEF,Chile,Hondudiario
"BANASUPRO en primera linea, ante el Covid-19",https://hondudiario.com/2020/05/13/banasupro-en-primera-linea-ante-el-covid-19/,"Hace más de 2 meses, se confirmaron los primeros dos casos de COVID-19 en el país. Desde este momento se activó el Sistema Nacional de Gestión de Riesgos (SINAGER), involucrando a varias instituciones",14-05-2020 03:08,https://www.bing.com/th?id=ON.21BBA4A96C3D7E8CFA48178CB91A6383,Chile,Hondudiario
Médicos de Taiwán asesorarán a doctores de Honduras en el tema del coronavirus,https://www.latribuna.hn/2020/05/13/medicos-de-taiwan-asesoraran-a-doctores-de-honduras-en-el-tema-del-coronavirus/,"La embajadora de China-Taiwán en Honduras, Ingrid Hsing, manifestó que han realizado una importante alianza para que médicos de Taiwán asesoren a médicos de Honduras en el combate al Covid-19. Este pa",14-05-2020 05:37,https://www.bing.com/th?id=ON.85424FC69881665A98FACC5C17A67FDC,Chile,La Tribuna
Honduras registra 46 fallecidos por COVID-19 y 148 contagios en el exterior,https://www.latribuna.hn/2020/05/13/honduras-registra-46-fallecidos-por-covid-19-y-148-contagios-en-el-exterior/,"Honduras registra 46 de sus ciudadanos muertos por COVID-19 en el exterior, principalmente en Estados Unidos y España, mientras que el número de contagios se acerca a los 150, dijo a Efe la vicecancil",14-05-2020 05:37,https://www.bing.com/th?id=ON.0C1BE5D7F0559D273C6E6CCEB2C3C3A3,Chile,La Tribuna
