name,url,description,datePublished,imagen,pais,Fuente
Presidente Hernández: Honduras Solidaria es la operación más grande de la historia del país,http://www.elsoldehonduras.com/nacionales/presidente-hernandez-honduras-solidaria-es-la-operacion-mas-grande-de-la-historia-del-pais/,"Tegucigalpa. El presidente Juan Orlando Hernández presentó un informe sobre las primeras dos fases de la Operación Honduras Solidaria, que es la más grande ejecutada en el país, y los avances en la te",11-07-2020 18:46,https://www.bing.com/th?id=ON.8B7CA319537B1DF3DF28D0D08C6A8AEA,Chile,El Sol de Honduras
"Ante cementerio de empresas, trabajadores temen por su futuro",https://proceso.hn/economia/6-economia/ante-cementerio-de-empresas-trabajadores-temen-por-su-futuro.html,"Tegucigalpa – El temor y la desesperación comienzan a apoderarse de los trabajadores y los empresarios, especialmente de los medianos y pequeños, ya que su futuro se ve seriamente comprometido de cont",15-07-2020 19:22,https://www.bing.com/th?id=ON.A496D05DC3ACAFDA91B487C1E1146654,Chile,Proceso
Muere odontólogo por covid-19 antes de ser atendido en la carpa del Hospital Escuela de Tegucigalpa,https://radiohrn.hn/muere-odontologo-hondureno-por-covid-19-justo-antes-de-que-pudiese-ser-atendido-en-el-hospital-escuela-de-tegucigalpa/,Miembros de Medicina Forense trasladando el cuerpo de una persona hacia la morgue capitalina. Foto / La Tribuna HN. Un odontólogo hondureño perdió la vida justo antes de ser atendido en la carpa insta,15-07-2020 20:56,https://www.bing.com/th?id=ON.E732D12E7010E411725913BA1918C217,Chile,Radio HRN
"Latinoamérica se contraerá un 9,1 % en 2020 por la pandemia, según la Cepal",https://www.latribuna.hn/2020/07/15/latinoamerica-se-contraera-un-91-en-2020-por-la-pandemia-segun-la-cepal/,"Santiago de Chile, 15 jul (EFE).- La pandemia del nuevo coronavirus no termina de controlarse en América Latina y el Caribe, lo que llevará al PIB regional a contraerse un histórico 9,1 % en 2020 y el",15-07-2020 21:15,https://www.bing.com/th?id=ON.9F249ED734F4877F696DCC667CA8D3E7,Chile,La Tribuna
Coronavirus: 4 recomendaciones para superar la crisis económica expuestas por el sector empresarial,https://radiohrn.hn/coronavirus-4-recomendaciones-para-superar-la-crisis-economica-expuestas-por-el-sector-empresarial/,"Reactivación de la economía en medio de la pandemia. En el tema “El equilibro entre la salud, la economía y el empleo”, el presidente de la Federación de Cámaras de Comercio e Industrias de Honduras (",15-07-2020 23:54,https://www.bing.com/th?id=ON.78B120E6027792284DF5119C087342CE,Chile,Radio HRN
Habilitarán más centros de triaje en los 298 municipios,https://www.laprensa.hn/honduras/1394324-410/centros-triaje-298-municipios-honduras-covid-19,El Gobierno anunció transferencias a las alcaldías para que habiliten triajes y brigadas médicas. Las salas de filtro re.ducen mortalidad porque también se realizan evaluaciones Los centros de triaje,16-07-2020 06:31,https://www.bing.com/th?id=ON.6647B94B736440831ADC8ECD016C4AA6,Chile,La Prensa Chicos
"Honduras, uno de los países que mejor ha manejado la pandemia, según New York Times",https://www.latribuna.hn/2020/07/16/honduras-uno-de-los-paises-que-mejor-ha-manejado-la-pandemia-segun-new-york-times/,"El Presidente Juan Orlando Hernández, dijo que, de acuerdo al diario estadounidense New York Times, “Honduras clasifica como uno de los países que, a pesar de todo, ha manejado mejor la situación gene",16-07-2020 15:47,https://www.bing.com/th?id=ON.C6A37E2276D1E6614DC2C4406A89769C,Chile,La Tribuna
Honduras supera los 30 mil casos de Covid-19 en repunte de pruebas diarias,https://hondudiario.com/2020/07/15/honduras-supera-los-30-mil-casos-de-covid-19-en-repunte-de-pruebas-diarias/,"El Sistema Nacional de Gestión de Riesgos (Sinager), informó este miércoles que de 1,960 pruebas para diagnosticar Covid-19 en el país, 930 dieron positivo, sumando así un total de 30,036 casos de cor",16-07-2020 17:55,https://www.bing.com/th?id=ON.25764051C52A8FE147B97BD617912B16,Chile,Hondudiario
Facturas de hospitales móviles entregadas a Aduanas también tienen registros falsos,https://www.elheraldo.hn/especiales/coronavirus/1394401-528/facturas-de-hospitales-m%C3%B3viles-entregadas-a-aduanas-tambi%C3%A9n-tienen-registros-falsos,"Dos de las facturas, entregadas por la empresa de Axel López, fueron emitidas con el código comercial SDI-I0-20031606001, que en realidad pertenece a SDI Global En las facturas originales de los hospi",16-07-2020 18:51,https://www.bing.com/th?id=ON.9715C2DE23B0EE3F279A97F5A68AE61F,Chile,El Heraldo
930 nuevos contagios y los casos por covid-19 se elevan a 30.036 en Honduras,http://www.elsoldehonduras.com/nacionales/930-nuevos-contagios-y-los-casos-por-covid-19-se-elevan-a-30-036-en-honduras/,Tegucigalpa. El Sistema Nacional de Gestión de Riesgo (Sinager) reportó hoy 930 nuevos casos positivos de covid-19 para hacer un total de 30.036 contagiados en el país. En cadena nacional de radio y t,16-07-2020 19:57,https://www.bing.com/th?id=ON.20F2D657B89E329F837118710F1A7E3E,Chile,El Sol de Honduras
Ocho clubes de Liga Nacional gestionarán préstamo bancario para jugar el Torneo Apertura,https://www.diez.hn/liganacionaldehonduras/1394458-498/ocho-clubes-carta-liga-nacional-gestionaran-prestamo-bancario-torneo-apertura,"Los ocho clubes que mandaron una carta a Liga Nacional hace unos días, sostendrán una reunión con una entidad bancaria con el objetivo de gestionar un préstamo y estos fondos sirvan para que se juegue",16-07-2020 20:34,https://www.bing.com/th?id=ON.C8B447532ABC8992AC8050699CEC3AE8,Chile,diez.hn
“Palomo” Rodríguez no pudo salir del país,https://www.diariomas.hn/2020/07/16/palomo-rodriguez-no-pudo-salir-del-pais/,"El entrenador uruguayo del Honduras Progreso, Julio César “Palomo” Rodríguez, no pudo viajar a Houston, Estados Unidos, debido a que el vuelo humanitario aprobado fue cancelado a última hora por las a",16-07-2020 21:40,https://www.bing.com/th?id=ON.0CAEA2407BB2CE5BD97B8F527D7B9BE0,Chile,Mas
"Sin velorios, ni acompañamiento: el doloroso adiós a víctimas de covid-19 en Honduras",https://www.elheraldo.hn/inicio/1394493-465/honduras-coronavirus-cementerio-victima-adios-solitario-pandemia,"Llanto, dolor y consternación se vive a diario en el 'cementerio covid-19' en el Distrito Central, donde descansan los restos de los hondureños que no lograron vencer al mortal virus. Fotos: Alex Pére",16-07-2020 23:27,https://www.bing.com/th?id=ON.B083C056E7387DE28595B91F427E6E60,Chile,El Heraldo
Ministra de Salud rinde declaraciones ante la ATIC en caso hospitales móviles,https://hondudiario.com/2020/07/16/fiscales-llegan-a-tomar-declaracion-de-la-ministra-de-salud-en-caso-hospitales-moviles/,"La ministra de Salud, Alba Consuelo Flores, declara este jueves ante detectives y fiscales de la Agencia Técnica de Investigación Criminal (ATIC) por el sonado caso de los hospitales móviles comprados",17-07-2020 00:47,https://www.bing.com/th?id=ON.361F6D683A8F7A88C12B17C33AF6440D,Chile,Hondudiario
