name,url,description,datePublished,imagen,pais,Fuente
"Jesús Canahuati: ""Reabrir con bioseguridad para salvar empleos es impostergable""",https://www.elheraldo.hn/economia/1382699-466/reabrir-con-bioseguridad-para-salvar-empleos-es-impostergable-jesus-canahuati,"TEGUCIGALPA, HONDURAS.-Médicos y expertos aseguran que el tratamiento ""Maíz"" es vital para prevenir que los pacientes de Covid-19 se compliquen, razón que ha convertido a esta solución en la apuesta d",27-05-2020 00:00,https://www.bing.com/th?id=ON.512767C21700A92085F497A1C33D57EE,Chile,El Heraldo
160 nuevos casos de coronavirus en Honduras este 1 de junio y cinco fallecidos más,https://www.diez.hn/coronavirus/1383792-441/coronavirus-honduras-160-nuevos-casos-covid-19-cortes,"160 nuevos casos de coronavirus se registraron este 1 de junio luego de 575 pruebas realizadas, así se dio a conocer en la ya acostumbrada cadena nacional y es así como Honduras llega a 5,362 infectad",01-06-2020 00:00,https://www.bing.com/th?id=ON.3E06C3FFA169C359C384DAAA1C4A5769,Chile,diez.hn
"Honduras llega a 217 muertos por COVID-19 y 5,362 contagiados",https://www.laprensa.hn/especiales/coronavirus/1383809-410/honduras-covid-19-contagiados-muertes-,"Los nuevos contagios son de Cortés (86), Francisco Morazán (25), Atlántida (36), Ocotepeque (2, Intibucá (2), Valle (5) y Yoro (4). Tegucigalpa, Honduras Los muertos en Honduras a causa de la COVID-19",01-06-2020 00:00,https://www.bing.com/th?id=ON.7E6F4D0B115E1EC14EBDA4090B19CAE3,Chile,La Prensa Chicos
Desbloquean el comercio regional de la frontera entre Nicaragua y Costa Rica,http://www.eldiario.hn/desbloquean-el-comercio-regional-de-la-frontera-entre-nicaragua-y-costa-rica/,"Costa Rica aplicó las medidas restrictivas hace varias semanas como parte de sus acciones contra la pandemia de coronavirus, pero al final afectaron el transporte de carga regional. Honduras lideró ... ante la pandemia de covid-19, aplicables al sector ...",01-06-2020 04:48,https://www.bing.com/th?id=ON.29F36EFD8CF1BFE94D4C236DD0B2843D,Chile,El Diario
Honduras registra 212 muertes por COVID-19 y 5.202 contagios,http://www.eldiario.hn/honduras-registra-212-muertes-por-covid-19-y-5-202-contagios/,"San Pedro sula.- En Honduras hasta la fecha han fallecido un total de 212 personas a causa del COVID-19 y al menos 5.202 han dado positivo al virus a nivel nacional, así lo informó este domingo el Gobierno a través del Sistema Nacional de Gestión de ...",01-06-2020 05:39,https://www.bing.com/th?id=ON.B48AB252813C5EFEFAEAD20CDCFA7611,Chile,El Diario
Democracia: cerrada por covid-19,https://www.elheraldo.hn/opinion/columnas/1383589-469/democracia-cerrada-por-covid-19,"De sobra se sabe que la emergencia global de la pandemia ha obligado a todos los países a tomar medidas de contención y mitigación para proteger la salud y la integridad de las personas, restringiendo",01-06-2020 06:38,https://www.bing.com/th?id=ON.F995087CAA70FBF833A62F2EAD5AE949,Chile,El Heraldo
Honduras inicia temporada de huracanes con temor al COVID-19,https://www.laprensa.hn/honduras/1383661-410/honduras-temporada-huracanes-covid-19-,"Honduras, un país muy vulnerable, afrontará una temporada de huracanes ""muy activa"" y con el temor de que pueda sufrir una desgracia como la causada por el Mitch, que en 1998 dejó más de 5.000 muertos",01-06-2020 16:58,https://www.bing.com/th?id=ON.4A6B7AC161D92FF5298294185E72BD4A,Chile,La Prensa Chicos
En redes sociales lloran la muerte del periodista deportivo Jacobo Carías,https://www.diez.hn/liganacionaldehonduras/1383646-498/redes-sociales-lloran-muerte-de-periodista-deportivo-jacobo-car%C3%ADas,"La muerte visitó como intruso este domingo por la noche la humanidad del periodista deportivo Jacobo Carías López, destacado comunicador durante muchos años en San Pedro Sula. López era paciente de he",01-06-2020 17:03,https://www.bing.com/th?id=ON.1473F387DC0399A83FED338818AB9017,Chile,diez.hn
FMI aprueba aumento de fondos a Honduras por $531 millones,https://www.latribuna.hn/2020/06/01/fmi-aprueba-aumento-de-fondos-a-honduras-por-531-millones/,"WASHINGTON, DC – El Directorio Ejecutivo del Fondo Monetario Internacional (FMI) accedió a elevar el acceso de fondos a Honduras de 308 millones de dólares, a 531 millones para que el país enfrente lo",01-06-2020 23:13,https://www.bing.com/th?id=ON.1ECECB0815A0BFB4240D01D2EE0A9B88,Chile,La Tribuna
"Jesús Rivera, periodista de HRN con coronavirus: “no sé dónde me contagié, no presento ningún síntoma”",https://radiohrn.hn/jesus-rivera-periodista-de-hrn-con-coronavirus-no-se-donde-me-contagie-no-presento-ningun-sintoma/,"El periodista de HRN en San Pedro Sula, zona norte de Honduras, Jesús Rivera, dio positivo a la prueba del coronavirus. Rivera comentó en la revista La Tarde de HRN que se realizó la prueba para detec",02-06-2020 00:50,https://www.bing.com/th?id=ON.4B9862AAF0047DF043943B52E5BD542F,Chile,Radio HRN
"Coronavirus en Honduras: 5,362 personas contagiadas y 217 muertos",https://radiohrn.hn/coronavirus-en-honduras-5362-personas-contagiadas-y-217-muertos/,"Aumenta la cifra de muertos, contagiados y recuperados de coronavirus. A 5,362 aumentaron los casos de coronavirus en Honduras, de acuerdo con el último informe del Sistema Nacional de Gestión de Ries",02-06-2020 01:23,https://www.bing.com/th?id=ON.7531061A5DF829A2F6725B0296450C67,Chile,Radio HRN
La democracia en tiempos del coronavirus,https://www.latribuna.hn/2020/06/02/la-democracia-en-tiempos-del-coronavirus/,La pandemia del coronavirus o COVID-19 que ha impactado al planeta en estos últimos meses provoca ya secuelas reales en muchos campos. Ya muchos estados y organismos internacionales toman decisiones y,02-06-2020 06:25,https://www.bing.com/th?id=ON.7C38B91C0F029B25F98F2E957517E668,Chile,La Tribuna
Pequeños hoteles comienzan a tramitar préstamos para sostener operatividad,https://hondudiario.com/2020/06/01/pequenos-hoteles-comienzan-a-tramitar-prestamos-para-sostener-operatividad/,"El presidente de la Asociación de Hoteles Pequeños de Honduras (Hopeh), Roberto Oseguera, indicó que ya se comenzó el trámite de préstamos con la banca para sostener la operatividad de ese rubro, dañada por la pandemia de Covid-19. Por causa de la ...",02-06-2020 08:27,https://www.bing.com/th?id=ON.48DA4F797320E3E8A3940EC2FE086B28,Chile,Hondudiario
Tasa de Letalidad por Covid-19 en Honduras está entre las más bajas,https://hondudiario.com/2020/06/01/tasa-de-letalidad-por-covid-19-en-honduras-esta-entre-las-mas-bajas/,"en Honduras estamos en 3.95 por ciento. Los hondureños deben seguir previniendo el coronavirus para que los casos no aumenten como se proyecta para julio y agosto, advierte Pavón. Si el 75 por ciento de los hondureños toman las medidas de bioseguridad ...",02-06-2020 08:27,https://www.bing.com/th?id=ON.17D10B868B71E1AED886F6B83D66BCF5,Chile,Hondudiario
