name,url,description,datePublished,imagen,pais,Fuente
Todas las religiones se unen para orar por Honduras,https://www.latribuna.hn/2020/05/26/todas-las-religiones-se-unen-para-orar-por-honduras/,"Representantes de todas las religiones se unieron en la jornada de oración “Todos a Orar por Honduras”, en la que pidieron a Dios que el país salga adelante y supere la pandemia de COVID-19, y elevaro",26-05-2020 06:20,https://www.bing.com/th?id=ON.D2843D1106633CF3733C2E6D0328925F,Chile,La Tribuna
Maquiladores entregan ocho millones de mascarillas al gobierno,https://www.latribuna.hn/2020/05/26/maquiladores-entrengan-ocho-millones-de-mascarillas-al-gobierno/,"Considerando el uso de la mascarilla como una medida de prevención ante el COVID-19, el gobierno de la República en Honduras solicitó al sector textil maquilador la elaboración de nueve millones de ma",26-05-2020 09:29,https://www.bing.com/th?id=ON.7023A58CA77E1D9D1333492D7424072D,Chile,La Tribuna
Los medios deben acelerar los cambios y adaptarse a la realidad de “bajo contacto”: Jorge Canahuati,https://proceso.hn/portadas/10-portada/los-medios-deben-acelerar-los-cambios-y-adaptarse-a-la-realidad-de-bajo-contacto-jorge-canahuati.html,"San Pedro Sula/Tegucigalpa - El impacto del COVID-19 en el futuro de los medios de comunicación convencionales ya es notable, los medios de comunicación serán de los más afectados en esta crisis, dijo",26-05-2020 09:47,https://www.bing.com/th?id=ON.F3B72923018DA7F1C3653E4BE50F6CBA,Chile,Proceso
Covid-19 los arrastró a ser nuevos mendigos en Honduras,https://www.elheraldo.hn/pais/1382259-466/covid-19-los-arrastr%C3%B3-a-ser-nuevos-mendigos-en-honduras,"TEGUCIGALPA, HONDURAS.-“Solo huevo, huevo y huevo. Quiero arroz y frijoles”, clama la pequeña Abigaíl (8). La exigencia de la niña cala profundamente en su mamá, Sara Amador, una vendedora de tortilla",26-05-2020 14:49,https://www.bing.com/th?id=ON.88F6625B13555202B9363E5162F9622C,Chile,El Heraldo
Reabren delegación migratoria de El Amatillo tras cierre por COVID-19,https://www.laprensa.hn/honduras/1382315-410/reabierta-aduana-amatillo-dias-cerrada-pandemia-coronavirus-honduras,"La aduana El Amatillo paró los tránsitos desde el 9 de mayo debido a la pandemia del coronavirus. Tegucigalpa, Honduras. El Instituto Nacional de Migración informó que a partir de ayer funciona nuevam",26-05-2020 16:45,https://www.bing.com/th?id=ON.FDE13CC20667A2ADF711D3FE37B0E154,Chile,La Prensa Chicos
Dos policías muertos y 45 contagiados por COVID-19 en Honduras,https://www.laprensa.hn/especiales/coronavirus/1382333-410/policias-muertos-contagiados-sospechosos-coronavirus-honduras,"Jair Meza, vocero de la Secretaría de Seguridad, informó este martes que hay más de 50 agentes sospechosos de coronavirus. Tegucigalpa, Honduras. Dos policías murieron y 45 se contagiaron de COVID-19",26-05-2020 18:45,https://www.bing.com/th?id=ON.C0DFA34665965D712C7E731CDF589755,Chile,La Prensa Chicos
Honduras: Policía con Covid-19 denuncia que fue tratado como “perro”,https://notibomba.com/honduras-policia-con-covid-19-denuncia-que-fue-tratado-como-perro/,"Un elemento de la Policía Nacional de Honduras denunció este martes que personal médico del Instituto Hondureño de Seguridad Social (IHSS) en Tegucigalpa, capital de la nación, fue inhumano en su trat",26-05-2020 19:51,https://www.bing.com/th?id=ON.262D087E448020D751B3CD20FFE16421,Chile,Noti Bomba
"“Honduras se acerca al colapso del sistema sanitario por aumento en casos de covid-19, Sinager ya colapsó”: Umaña",https://radiohrn.hn/honduras-se-acerca-al-colapso-del-sistema-sanitario-por-aumento-en-casos-de-covid-19-sinager-ya-colapso-umana/,"Presidente del IHSS norte, Carlos Umaña. Foto Radio HRN. El presidente de la Asociación de Médicos del Instituto Hondureño de Seguridad Social (IHSS) de San Pedro Sula, Carlos Umaña, adelantó este mar",26-05-2020 21:35,https://www.bing.com/th?id=ON.1854AAE0F960096DA932E879FE6B82B4,Chile,Radio HRN
"Más de 3,300 hondureños han sido repatriados de Estados Unidos desde la emergencia por el coronavirus",https://radiohrn.hn/mas-de-3300-hondurenos-han-sido-repatriados-de-estados-unidos-desde-la-emergencia-por-el-coronavirus/,"Para los próximos días, está prevista la operación de un vuelo humanitario desde Florida, señaló Agüero entrevistada por HRN. Un total de 3,386 hondureños han sido repatriados desde Estados Unidos dur",26-05-2020 21:53,https://www.bing.com/th?id=ON.AF9D159FBEE7F469034D9C9A4EF8E1AA,Chile,Radio HRN
Comienza colapso de salas Covid-19 en hospitales de Honduras,https://hondudiario.com/2020/05/26/comienza-colapso-de-salas-covid-19-en-hospitales-de-honduras/,"La directora de la Región Metropolitana de Salud de San Pedro Sula, Lesbia Villatoro, advirtió este martes que, “los centros hospitalarios están prácticamente al límite de la capacidad de las salas CO",26-05-2020 22:18,https://www.bing.com/th?id=ON.55353CD0E5646075FC30215D65082A30,Chile,Hondudiario
"Michael Osorio, el futbolista de Marathón que trabaja en el cultivo de café por Covid-19",https://www.diez.hn/liganacionaldehonduras/1382322-498/michael-osorio-futbolista-de-marathon-que-trabaja-cultivo-de-cafe-por-covid-19,"En tiempos sin fútbol el defensor de Marathón, Michael Osorio trabaja día a día para generar ingresos extras a su bolsillo. Según él, después de retirase se dedicaría al cultivo de café. La crisis san",26-05-2020 22:26,https://www.bing.com/th?id=ON.EA55F7A1195B976CBA9F66E4B0777D41,Chile,diez.hn
Honduras y Taiwán reafirman compromisos de colaboración para hacer frente al Covid-19,https://hondudiario.com/2020/05/26/honduras-y-taiwan-reafirman-compromisos-de-colaboracion-para-hacer-frente-al-covid-19/,"El presidente Juan Orlando Hernández felicitó en conversación telefónica a su homóloga de la República de China (Taiwán), la doctora Tsai Ing-wen, por el inicio de su segundo mandato el pasado 20 de m",26-05-2020 22:41,https://www.bing.com/th?id=ON.143B0CFADDF2737B6433BA935873F7D3,Chile,Hondudiario
Taiwán dona mascarillas y equipo médico para combatir Covid-19 en Honduras,https://www.elheraldo.hn/pais/1382438-466/taiw%C3%A1n-dona-mascarillas-y-equipo-m%C3%A9dico-para-combatir-covid-19-en-honduras,"TEGUCIGALPA, HONDURAS.-El gobierno de la República de China (Taiwán) realizó una nueva donación de equipo de bioseguridad para el personas de primera línea en la batalla contra el coronavirus (Covid-1",26-05-2020 22:43,https://www.bing.com/th?id=ON.EC684E7D3EA4E9F2DA33FE350487B183,Chile,El Heraldo
OMS suspende ensayos clínicos de hidroxicloroquina,https://notibomba.com/oms-suspende-ensayos-clinicos-de-hidroxicloroquina/,"La Organización Mundial para la Salud (OMS) anunció la suspensión temporal de los ensayos clínicos con hidroxicloroquina, medicamento que era impulsado por el presidente de Estados Unidos (EEUU), Dona",26-05-2020 23:04,https://www.bing.com/th?id=ON.E26B36B83AD3979828A4B4A75880EDA7,Chile,Noti Bomba
