name,url,description,datePublished,imagen,pais,Fuente
Presidente Hernández: Honduras Solidaria es la operación más grande de la historia del país,http://www.elsoldehonduras.com/nacionales/presidente-hernandez-honduras-solidaria-es-la-operacion-mas-grande-de-la-historia-del-pais/,"Tegucigalpa. El presidente Juan Orlando Hernández presentó un informe sobre las primeras dos fases de la Operación Honduras Solidaria, que es la más grande ejecutada en el país, y los avances en la te",11-07-2020 18:46,https://www.bing.com/th?id=ON.8B7CA319537B1DF3DF28D0D08C6A8AEA,Chile,El Sol de Honduras
Las 15 imágenes del doloroso e inesperado adiós por el covid-19 en Honduras,https://www.elheraldo.hn/inicio/1393371-465/las-15-im%E1genes-del-doloroso-e-inesperado-adi%F3s-por-el-covid-19-en,"Los hondureños siguen siendo golpeados por el covid-19 al sumar, hasta el 11 de julio de 2020, 771 muertes y 27,583 personas infectadas. Viven una pesadilla sin saber qué pasará con sus familiares inf",12-07-2020 22:05,https://www.bing.com/th?id=ON.E809398CE58A405E5C7FCF47FCA889A1,Chile,El Heraldo
"Pacientes recuperados de covid-19 en Honduras, relatan sus conmovedoras historias luego de ser dados de alta",https://radiohrn.hn/pacientes-recuperados-de-covid-19-en-honduras-relatan-sus-conmovedoras-historias-luego-de-ser-dados-de-alta/,"Hondureños saliendo de los centros hospitalarios, luego de vencer el covid. Varios pacientes hondureños recuperados y dados de alta tras haber padecido coronavirus (covid-19), compartieron sus histori",13-07-2020 02:25,https://www.bing.com/th?id=ON.FCF71957A546BC53804EBAAB31B3CC6D,Chile,Radio HRN
Coronavirus: Honduras supera los 28 mil casos de covid-19 tras confirmarse 507 nuevos contagios,https://radiohrn.hn/coronavirus-honduras-supera-los-28-mil-casos-de-covid-19-tras-confirmarse-507-nuevos-contagios/,"Honduras registró el 12 de julio, 28,090 personas contagiadas de coronavirus y confirmó 774 víctimas mortales por la enfermedad. Las autoridades de Honduras, a través del Sistema Nacional de Gestión d",13-07-2020 02:54,https://www.bing.com/th?id=ON.A86A5490D8094D3267C37B216C4B7993,Chile,Radio HRN
Reportan muerte de 19 pacientes con coronavirus en el IHSS y el Tórax en Tegucigalpa,https://www.laprensa.hn/especiales/coronavirus/1393561-410/-muerte-pacientes-coronavirus-ihss-torax-tegucigalpa-,Al menos 19 pacientes fallecieron en las últimas horas por sospecha de coronavirus en el Instituto Hondureño de Seguridad Social (IHSS) y el Instituto Cardiopulmonar del Tórax de Tegucigalpa. De estos,13-07-2020 16:56,https://www.bing.com/th?id=ON.E16A650FB5E7B16E464FA331E305C0A5,Chile,La Prensa Chicos
Unos seis alcaldes se han contagiado de COVID-19 en Honduras,https://www.laprensa.hn/honduras/1393548-410/alcaldes-coronavirus-honduras-covid-coronavirus,Unos seis alcaldes de diferentes partes de Honduras también se han contagiado de COVID-19 durante la crisis sanitaria que enfrenta el país. Uno de ellos se encuentra interno en un hospital y el resto,13-07-2020 20:49,https://www.bing.com/th?id=ON.4DB8F79F6BC4EAC7A048F76F68D374A5,Chile,La Prensa Chicos
El Consejo de Ministros aprobó la compra de los hospitales móviles,https://hondudiario.com/2020/07/13/el-consejo-de-ministros-aprobo-la-compra-de-los-hospitales-moviles/,"La adquisición de los hospitales se realizó con el objetivo de dar una mejor atención a los hondureños, en el marco de la emergencia sanitaria por el COVID-19. En relación a los ... Inversión Estratégica de Honduras (Invest-H), quien ha tenido ...",13-07-2020 22:34,https://www.bing.com/th?id=ON.0566A897BAB9BB022949173AA82249F8,Chile,Hondudiario
EE. UU. deportó cientos de indocumentados con COVID-19,https://www.latribuna.hn/2020/07/13/ee-uu-deporto-cientos-de-indocumentados-con-covid-19/,"El Servicio de Inmigración y Control de Aduanas (ICE) de Estados Unidos fletó cientos de vuelos con inmigrantes deportados enfermos de COVID-19 desde que comenzó la ... El Salvador y Honduras. Estos dos últimos han aceptado más de 6,000 deportados ...",14-07-2020 00:15,https://www.bing.com/th?id=ON.FDBFA56F996B8D7F8601FE9E9B12FF29,Chile,La Tribuna
Honduras participa en Cumbre ministerial de la OCDE sobre COVID-19,https://www.latribuna.hn/2020/07/13/honduras-participa-en-cumbre-ministerial-de-la-ocde/,"La viceministra Doris Mendoza en representación del pueblo y Gobierno de Honduras, participa en la cumbre ministerial virtual social de la Organización para la Cooperación y el Desarrollo Económico OC",14-07-2020 01:33,https://www.bing.com/th?id=ON.93BF931BF993AE63DDC257672372BAD4,Chile,La Tribuna
