name,url,description,datePublished,imagen,pais,Fuente
Coronavirus en Honduras: Se confirman 231 nuevos casos positivos y dos fallecidos más,https://www.diez.hn/coronavirus/1410338-441/coronavirus-honduras-nuevos-casos-positivos-fallecidos-contagiados-covid-19,"La autoridades de Sinager han actualizado las cifras de coronavirus en Honduras y siguen aumentando los contagiados. Se han procesado un total de 650 pruebas PCR y 231 dieron positivo, una cifra baja",22-09-2020 00:00,https://www.bing.com/th?id=OVFT.FhVfF3tFRSbEzovy_iiSNy,Chile,diez.hn
Honduras solo reporta dos muertes por coronavirus y 231 contagios,https://www.laprensa.hn/honduras/1410310-410/coronavirus-honduras-pandemia-contagios-cifra-muertes-covi-,"Los pacientes hospitalizados hasta hoy son 809, de los que 666 presentan un cuadro estable, 123 están graves y 20 permanecen en unidades de cuidados intensivos. Tegucigalpa, Honduras La cifra de muert",22-09-2020 00:00,https://www.bing.com/th?id=OVFT.tewfOVq8jcJy7Yz0GS-tVy,Chile,La Prensa Chicos
"Covid-19 suma 231 nuevos casos en Honduras; total sube a 72,306 y muertes a 2,206",https://www.elheraldo.hn/pais/1410319-466/honduras-covid-nuevos-casos-muertes-sinager,"TEGUCIGALPA, HONDURAS.- Honduras cada día suma más casos de coronavirus, pese a la cuarentena que ya rebasa los seis meses. Este martes el Sistema Nacional de Gestión de Riesgos (Sinager) confirmó 231",22-09-2020 00:00,https://www.bing.com/th?id=OVFT.-5fa0hmSzJL_hFxlAl6p6y,Chile,El Heraldo
"Honduras supera los 72 mil contagiados y alcanza 22,204 decesos por COVID",https://proceso.hn/honduras-supera-los-72-mil-contagiados-y-alcanza-22204-decesos-por-covid/,Tegucigalpa – Honduras alcanzó este lunes los 72 mil 075 contagiados y 2 mil 204 decesos por COVID-19 tras 195 días de pandemia informó el Sistema Nacional de Gestión de Riesgos (Sinager). La tasa de letalidad es de 3.05 por ciento. Este día ...,22-09-2020 02:31,https://www.bing.com/th?id=OVFT.cG7bfYqzvTMJzlODrHCKzC,Chile,Proceso
CNA denuncia inconsistencias en las compras de mascarillas,https://www.latribuna.hn/2020/09/22/cna-denuncia-inconsistencias-en-las-compras-de-mascarillas/,"En su undécimo informe “Corrupción en tiempos de COVID-19”, Inversión Estratégica de Honduras (Invest-H), no logró concretar las adquisiciones de las mascarillas por un precio total de 50 millones 836 mil 500 lempiras. En ese sentido, CNA detectó ...",22-09-2020 09:38,https://www.bing.com/th?id=OVFT.pb7zgDOHgNbh15Mt7hDv2C,Chile,La Tribuna
El “Tasón” aplicará recorte de un 50 por ciento a entes de seguridad,https://www.elheraldo.hn/pais/1410101-466/el-tas%C3%B3n-aplicar%C3%A1-recorte-de-un-50-por-ciento-a-entes-de,"Debido a que la recaudación de fondos se ha visto afectada por la pandemia de convid-19 entre un 35 y 40 por ciento, la Tasa de Seguridad se ha quedado sin recursos para los entes Los ingresos a la Ta",22-09-2020 13:48,https://www.bing.com/th?id=OVFT.jPmlFREXx395439H1mcRIS,Chile,El Heraldo
Más de veinte muertos por covid en la capital y en San Pedro Sula en los últimos tres días,https://www.radiohrn.hn/honduras-mas-de-veinte-muertos-por-covid-en-la-capital-y-en-san-pedro-sula-en-los-ultimos-tres-dias,Hay indicios que las fatalidades por covid podrían ir en espiral y de manera inmoderada si no se realizan las enmiendas para salir al paso de las debilidades del sistema sanitario del sector público.,22-09-2020 15:53,https://www.bing.com/th?id=OVFT.NJVvwzB0SfQ8sCoACCHXYS,Chile,Radio HRN
Unas 4.200 vidas se han salvado en Honduras con los tratamientos Maíz y Catracho,https://ultimahora.hn/unas-4-200-vidas-se-han-salvado-en-honduras-con-los-tratamientos-maiz-y-catracho/,"Unas 4.200 vidas se han salvado en Honduras gracias a los tratamientos Maíz y Catracho, destacó el doctor y director del programa Medicina Familiar de la Universidad de Texas (Estados Unidos), Sidney",22-09-2020 16:27,https://www.bing.com/th?id=OVFT.mnWYG7Zz4Fbh7jmkj4r0tC,Chile,Ultima Hora
Escasez en aplicación de pruebas PCR impide ver la problemática real de la pandemia,https://hondudiario.com/2020/09/22/escasez-en-aplicacion-de-pruebas-pcr-impide-ver-la-problematica-real-de-la-pandemia/,"El científico hondureño, Marco Tulio Medina, aseguró que la creación de una estrategia de “vigilancia epidemiológica estricta” sería la única forma de mermar la pandemia ya que la escasa cantidad de pruebas PCR en Honduras, representa un ...",22-09-2020 17:19,https://www.bing.com/th?id=OVFT.HJy_603rRBgRHFmMUOetRi,Chile,Hondudiario
Mejores políticas bancarias y provisión de liquidez son necesarias para la recuperación,https://hondudiario.com/2020/09/22/mejores-politicas-bancarias-y-provision-de-liquidez-son-necesarias-para-la-recuperacion/,"El Banco Interamericano de Desarrollo (BID), reveló en un informe que se necesitan mejores políticas bancarias para prevenir las inestabilidades financieras causadas por las repercusiones económicas de la crisis sanitaria de la COVID-19 en América ...",22-09-2020 17:26,https://www.bing.com/th?id=OVFT.rwCvk_6kLouC73Z5gObVLC,Chile,Hondudiario
Joven enfermera muere por COVID-19 en Honduras,https://www.latribuna.hn/2020/09/22/joven-enfermera-muere-por-covid-19-en-honduras/,"Diario La Tribuna · Joven enfermera muere por COVID-19 en Honduras · Sinager registra 704 nuevos casos y llegamos a los 20,262 · El comercio mundial seguirá el mismo camino, con una contracción estimada de un 20 por ciento este año, según el estudio ...",22-09-2020 17:54,https://www.bing.com/th?id=OVFT.NaBUnSME49YOs4BAs64zsy,Chile,La Tribuna
Honduras necesita reabrir más su economía para mitigar efectos de la pandemia,https://www.laprensa.hn/honduras/1410251-410/honduras-reabrir-economia-efectos-pandemia-contagios-alden-rivera-covid,"Honduras se enfrenta a la urgencia de avanzar a la segunda fase de la reactivación económica para evitar más efectos sobre su débil economía, pero con la curva de contagios del coronavirus aún en asce",22-09-2020 21:06,https://www.bing.com/th?id=OVFT.cPHUFQcXMGrVIf9q7fjTwS,Chile,La Prensa Chicos
El claroscuro de Tegucigalpa en plena pandemia,https://proceso.hn/el-claroscuro-de-tegucigalpa-en-plena-pandemia/,"Tegucigalpa – Tegucigalpa, la capital hondureña, muestra un rostro sombrío en sus calles, bulevares, oficinas y comercios tras la puesta en vigencia de la ampliación a dos dígitos que permite a la gen",23-09-2020 03:42,https://www.bing.com/th?id=OVFT.heOBpFFMxqTsmoRzQgrhly,Chile,Proceso
