name,url,description,datePublished,imagen,pais,Fuente
"Honduras: De 4,000 es la mora de las pruebas PCR, dicen microbiólogos",https://www.elheraldo.hn/pais/1399730-466/honduras-de-4000-es-la-mora-de-las-pruebas-pcr-dicen-microbi%C3%B3logos,"El gremio de microbiólogos exige que se abastezca de insumos para aumentar el procesamiento de pruebas PCR diarias para los sospechosos de covid-19, ya que actualmente la capacidad es baja. Redacción",08-08-2020 16:17,https://www.bing.com/th?id=ON.FAAC28141191A6A3264BC1590DA95357,Chile,El Heraldo
Muere un doctor y una enfermera por coronavirus en Honduras,https://www.laprensa.hn/honduras/1399821-410/muere-doctor-enfermera-coronavirus-onduras-,"Un doctor y una enfermera fallecieron en las últimas horas por complicaciones del coronavirus en Honduras, confirmó Carlos Umaña, actual presidente de la Asociación de Médicos del Instituto Hondureño",08-08-2020 20:32,https://www.bing.com/th?id=ON.8FAFBC14746D5246A1DF081C8CE8612B,Chile,La Prensa Chicos
Enfermera muere por COVID-19 en Olanchito,https://www.latribuna.hn/2020/08/08/enfermera-muere-por-covid-19-en-olanchito/,"Una profesional de la enfermería murió en las últimas horas por COVID-19 cuando era trasladada en una ambulancia desde Olanchito a San Pedro Sula, Cortés, zona norte de Honduras. Se trata de Luz Idali",08-08-2020 21:26,https://www.bing.com/th?id=ON.69C67A24F7D364B9AA17F2CB2C2D967B,Chile,La Tribuna
Exclusiva: El plan de bioseguridad que utilizará la Liga Nacional en el Torneo Apertura 2020,https://www.diez.hn/liganacionaldehonduras/1400037-498/plan-de-bioseguridad-liga-nacional-honduras-torneo-apertura-2020,b. Entrevista rápida (formato que se adjunta en los anexos en el presente documento). En caso de encontrar un caso sospechoso de contagio por coronavirus se deberá de realizar lo siguiente: a. Llenado,09-08-2020 00:00,https://www.bing.com/th?id=ON.18EADEF695DEC6CAB41982747F295728,Chile,diez.hn
Dani Turcios está cerca de ser el nuevo técnico del Honduras Progreso,https://www.diez.hn/liganacionaldehonduras/1400096-498/dani-turcios-cerca-nuevo-tecnico-honduras-progreso-liga-nacional,"Elvis Danilo Turcios estaría muy cerca de convertirse en el nuevo técnico del Honduras Progreso, de acuerdo a lo conocido de manera exclusiva por DIEZ. El exmundialista con la Bicolor en Sudáfrica 201",09-08-2020 00:00,https://www.bing.com/th?id=ON.460C3348EF1A8E08D5FA858765D1A739,Chile,diez.hn
Honduras reporta 481 nuevos casos de covid-19 y suma 19 fallecidos,https://www.laprensa.hn/honduras/1400089-410/covid-19-honduras-singer-fallecidos-coronavirus-pandemia,"La tasa de letalidad por el virus llegó a 3.15%. Tegucigalpa, Honduras. El Sistema Nacional de Gestión de Riesgo (Sinager) anunció este domingo la cantidad de nuevos contagiados y fallecidos por coron",09-08-2020 00:00,https://www.bing.com/th?id=ON.6086E22E9D01542536AFD25FC0AC3870,Chile,La Prensa Chicos
Donde la justicia es ciega y muda el cemento carga con ¿Donde esta el dinero?,https://elpatriota.hn/2020/08/09/donde-la-justicia-es-ciega-y-muda-el-cemento-carga-con-donde-esta-el-dinero/,"TEGUCIGALPA, HONDURAS. Pese al toque de queda, se ls ingeniaron y delicadamente escribieron la pregunta:«¿DÓNDE ESTÁ DINERO? Honduras lo exige» que millones de hondureños exigen la respuesta. Adornada",09-08-2020 19:18,https://www.bing.com/th?id=ON.3524DC11A2CE7782CD44162C75677811,Chile,El Patriota
Celebran de forma virtual la Semana Mundial de la Lactancia Materna,http://www.eldiario.hn/celebran-de-forma-virtual-la-semana-mundial-de-la-lactancia-materna/,"Tegucigalpa.- Autoridades del Gobierno de Honduras, junto a representantes de la Organización Mundial de la Salud (OPS/OMS) y el Fondo de las Naciones Unidas para la Infancia (UNICEF), celebraron de f",09-08-2020 23:30,https://www.bing.com/th?id=ON.7D530252D33BE41812D2F05851494496,Chile,El Diario
Coronavirus en Honduras: Mapa y gráficos del crecimiento de casos,https://www.elheraldo.hn/interactivos/1377996-523/coronavirus-en-honduras-mapa-y-gr%C3%A1ficos-del-crecimiento-de-casos,"Desde el 11 de marzo, cuando se detectaron los dos primeros casos positivos, Honduras trata de contener la expansión de la enfermedad El coronavirus (Covid-19) entró oficialmente en Honduras en marzo",10-08-2020 00:41,https://www.bing.com/th?id=ON.A0AEAA5832C80481D879A67EDF1EABB9,Chile,El Heraldo
"COVID sin ceder en Honduras, dejando a “grandes y pequeños” en el camino",https://hondudiario.com/2020/08/09/covid-sin-ceder-en-honduras-dejando-a-grandes-y-pequenos-en-el-camino/,"La pandemia por coronavirus en Honduras continúa extendiéndose por el territorio nacional sin ceder, siempre bajo un escepticismo e incertidumbre entre la población y Gobierno. Acompañado de los escán",10-08-2020 01:09,https://www.bing.com/th?id=ON.2C1D2D91B1CF94BA1520D33D6596D0CA,Chile,Hondudiario
"Honduras supera los 47 mil contagios y roza las 1,500 muertes por coronavirus",https://hondudiario.com/2020/08/09/honduras-supera-los-47-mil-contagios-y-roza-las-1500-muertes-por-coronavirus/,"El Sistema Nacional de Gestión de Riesgos (Sinager), informó este domingo que de 1,245 pruebas para diagnosticar Covid-19 en el país, 481 dieron positivo, sumando así un total de 47,454 casos de coron",10-08-2020 02:04,https://www.bing.com/th?id=ON.D74C3352368601B559614A33DF1D598D,Chile,Hondudiario
Fuerza Honduras envía transferencias a 255 municipios para combatir COVID-19 (Galería),https://www.latribuna.hn/2020/08/09/fuerza-honduras-envia-transferencias-a-255-municipios-para-combatir-covid-19-galeria/,"El programa Fuerza Honduras, que el Gobierno de la República realiza para el combate a la pandemia de coronavirus, ya ha entregado fondos a 255 municipios y entre lunes y martes totalizará 282, de los",10-08-2020 03:57,https://www.bing.com/th?id=ON.06CBE75970A84F6616B86AAD39204E08,Chile,La Tribuna
