name,url,description,datePublished,imagen,pais,Fuente
Iota y COVID-19: Estos dígitos pueden circular hoy en Honduras,https://tiempo.hn/digitos-pueden-circular-hoy-en-honduras/,"Por la emergencia de COVID-19 e Iota, SINAGER indicó qué dígitos circulan hoy en Honduras y cómo atenderán los bancos en",18-11-2020 14:03,https://www.bing.com/th?id=OVFT.ker8-rLW6qVQRmBUl-HMKS,Chile,Tiempo
Soto inicia su tarea encomendándose a Dios,https://www.diariomas.hn/2020/11/18/soto-inicia-su-tarea-encomendandose-a-dios/,"Real España ha continuado sus entrenamientos con su entrenador interino, Edgardo Emilson Soto, quien mostró su lado espiritual y solidario al iniciar",18-11-2020 18:03,https://www.bing.com/th?id=OVFT._hNPpmiUveTkfTSrQxNLnC,Chile,Mas
"Falleció ex presidente del Deportes Savio, Sergio Reyes",https://www.diariomas.hn/2020/11/18/fallecio-ex-presidente-del-deportes-savio-sergio-reyes/,"Uno de los grandes quijotes del fútbol nacional, el abogado Sergio Antonio Reyes, perdió la batalla del Covid 19 la tarde del miércoles en Santa Rosa",18-11-2020 22:01,https://www.bing.com/th?id=OVFT._PP6Q8wC9Qhp-7VxtMVQiy,Chile,Mas
"Luto en el fútbol hondureño: Fallece Sergio Antonio Reyes, expresidente del Deporte Savio",https://www.diez.hn/liganacionaldehonduras/1423357-498/covid-19-muere-sergio-reyes-ex-presidente-deportes-savio-equipo-liga-nacional-honduras,"ya que se deberá seguir el protocolo que se maneja con las personas que fallecen por contagio de Covid-19. Tras esta triste noticia pone aún más de luto el fútbol nacional, que también se encuentra golpeada por los el duro momento que pasa Honduras.",18-11-2020 23:38,https://www.bing.com/th?id=OVFT.8YIPQnQQb-IVulXXFD5l5S,Chile,diez.hn
COVID-19 sigue cobrando la vida de médicos en Honduras,https://proceso.hn/covid-19-sigue-cobrando-la-vida-de-medicos-en-honduras/,"Tegucigalpa– Otro médico perdió la batalla contra el COVID-19 en las últimas horas en Santa Rosa de Copán, occidente de Honduras. -Suman 52 los profesionales de la medicina fallecidos por causa del nuevo coronavirus. Se trata del doctor Marco Antonio ...",18-11-2020 23:45,https://www.bing.com/th?id=OVFT.WrrQKo80AYgARKTdxqff6S,Chile,Proceso
"Pérdidas en Honduras por ciclones y COVID-19 sumarían hasta $ 10 mil millones, estima el Fosdeh",https://proceso.hn/perdidas-en-honduras-por-ciclones-y-covid-19-sumarian-hasta-10-mil-millones-estima-el-fosdeh/,"Tegucigalpa – Luego de dos eventos naturales de gran magnitud como las tormentas tropicales Eta e Iota junto con la pandemia de COVID-19, Honduras necesita de la ayuda de la cooperación internacional para tener una cuantificación de pérdidas y estimar ...",19-11-2020 02:09,https://www.bing.com/th?id=OVFT.SW-9Kvuodw8V9IQTPSrOxi,Chile,Proceso
"Suben a 2,839 muertos por covid-19 en Honduras y a 103,239 los contagios",https://www.laprensa.hn/honduras/1423056-410/suben-a-2839-muertos-por-covid-19-en-honduras-y-a-103239-los,"El país añadió hoy a sus cuadros de la pandemia 137 nuevos casos. Tegucigalpa, Honduras. La cifra de muertos en Honduras por la covid-19 se elevó este lunes a 2.839 y la de contagios a 103.239, desde marzo, informó el estatal Sistema Nacional de ...",19-11-2020 08:09,https://www.bing.com/th?id=OVFT.Q3fJqIaOL3czqi9-_kcneS,Chile,La Prensa Chicos
"A los ojos del mundo, ¿cuántos títulos tienen los equipos de fútbol en Honduras?",https://www.diez.hn/blogs/1423421-498/a-los-ojos-del-mundo-cu%C3%A1ntos-t%C3%ADtulos-tienen-los-equipos-de-f%C3%BAtbol,"Si una persona en cualquier parte del mundo desea obtener información sobre el fútbol en determinado país, lo primero que consulta son los archivos de la RSSSF.",19-11-2020 09:18,https://www.bing.com/th?id=OVFT.78-x5TOUEmnwTt84I3kH8i,Chile,diez.hn
Afectados por inundaciones pueden aprovechar servicios médicos enviados por Colombia instalado Wonderland Estadio Olímpico Metropolitano SPS,https://ultimahora.hn/afectados-por-inundaciones-pueden-aprovechar-servicios-medicos-enviados-por-colombia-instalado-wonderland-estadio-olimpico-metropolitano-sps/,"El ministro de Promoción de Inversiones de Honduras, Luis Mata, invitó este miércoles a los pobladores afectados por los fenómenos meteorológicos Eta e Iota a aprovechar los servicios y la",19-11-2020 13:58,https://www.bing.com/th?id=OVFT.pUF49UfTzdDKGF8uHN7S7C,Chile,Ultima Hora
OPS prevé alza de casos de covid-19 en Centroamérica tras Iota y Eta.,https://www.latribuna.hn/2020/11/19/ops-preve-alza-de-casos-de-covid-19-en-centroamerica-tras-iota-y-eta/,"La Organización Panamericana de la Salud (OPS) dijo el miércoles que la respuesta al covid-19 en Centroamérica está amenazada por la temporada de huracanes, y anticipó un alza de los contagios tras el",19-11-2020 16:54,https://www.bing.com/th?id=OVFT.P-1P9j3rStOy4gOAtEpySS,Chile,La Tribuna
"Hospital de San Lorenzo: por temor a inundaciones, evacúan sala COVID-19",https://tiempo.hn/hospital-san-lorenzo-inundaciones-sala-covid/,"A causa del peligro inminente de inundación, debido a Eta e Iota, las autoridades del Hospital de San Lorenzo tomaron medidas",19-11-2020 22:37,https://www.bing.com/th?id=OVFT.XHL11UJ6dTk0ABw-_ZtsEy,Chile,Tiempo
Médicos estadunidenses llegan a Honduras para atender la emergencia en la zona norte,https://hondudiario.com/2020/11/19/medicos-estadunidenses-llegan-a-honduras-para-atender-la-emergencia-en-la-zona-norte/,"Un grupo de médicos estadunidenses arribó este jueves al país para apoyar con atención sanitaria a los afectados por las Tormentas Tropicales Eta e Iota en la zona norte de Honduras. Por su parte, la",19-11-2020 22:55,https://www.bing.com/th?id=OVFT.FUxzEQLzVZc6lftABTk_Di,Chile,Hondudiario
Conadeh llama a la acción nacional y cooperación internacional para superar la emergencia compleja en Honduras,https://hondudiario.com/2020/11/19/conadeh-llama-a-la-accion-nacional-y-cooperacion-internacional-para-superar-la-emergencia-compleja-en-honduras/,"***Asimismo señala que la suma de desastres caracteriza una emergencia compleja en Honduras, que requiere ser atendida, con respuestas urgentes. El Comisionado Nacional de los Derechos Humanos en Hond",19-11-2020 23:47,https://www.bing.com/th?id=OVFT.s9LNkjKL_tcqSzSeyZYXTS,Chile,Hondudiario
"Muere Sergio Reyes, expresidente del Deportes Savio, por COVID-19",https://www.laprensa.hn/deportes/1423362-410/muere-sergio-reyes-expresidente-del-deportes-savio-covid-19-coronavirus-futbol-honduras,"Sergio Reyes, el conocido expresidente del club de fútbol Deportes Savio, falleció la tarde de este miércoles a causa del coronavirus COVID-19 en Santa Rosa de Copán. Reyes, que también fue vicepresid",20-11-2020 04:50,https://www.bing.com/th?id=OVFT.o15v2fNLNPUbsR8Wf2dtVi,Chile,La Prensa Chicos
Entre COVID-19 y huracanes,https://www.latribuna.hn/2020/11/20/entre-covid-19-y-huracanes/,"Por: Ángela Marieta Sosa Especialista en derechos humanos Entre COVID-19 y huracanes, “Honduras grita auxilio y llora sus pérdidas”. Los derechos humanos se han visto afectados y hasta extinguidos, lo",20-11-2020 06:42,https://www.bing.com/th?id=OVFT.JyA8Z4z8ir9bZcfSNnz3vC,Chile,La Tribuna
