name,url,description,datePublished,imagen,pais,Fuente
"Rent's due, again: Monthly anxieties deepen as aid falls off",https://www.fox5ny.com/news/rents-due-again-monthly-anxieties-deepen-aid-falls-off,"The coronavirus pandemic is entering a new month, meaning Americans struggling amid the economic fallout once again have to worry about paying their rent.",31-07-2020 19:06,https://www.bing.com/th?id=ON.1DB731F79CF1F1F183E27739BD4A2B04,Chile,Fox 5 NY
Honduras: Doce decesos por COVID-19 reportan hospitales,https://www.latribuna.hn/2020/08/14/honduras-doce-decesos-por-covid-19-reportan-hospitales/,"Doce pacientes fallecieron sospechosos de COVID-19, en el Hospital de Especialidades del Instituto Hondureño de Seguridad Social (IHSS) y el Hospital Escuela de la capital. La portavoz del Seguro Soci",14-08-2020 18:14,https://www.bing.com/th?id=ON.04A82DCB8BD7131731044D4704198AFA,Chile,La Tribuna
Embajador de México en Honduras se contagia de coronavirus,https://www.laprensa.hn/honduras/1401234-410/embajador-mexico-honduras-coronavirus-,"El embajador de México en Honduras, David Jiménez, fue trasladado ayer a su país para ser atendido por Covid-19. El representante diplomático de México en el país centroamericano dio positivo al nuevo",14-08-2020 18:33,https://www.bing.com/th?id=ON.2FAB84BBA1FE8844A5DEB1E0D8297558,Chile,La Prensa Chicos
Carlos Umaña: 37 médicos han muerto por COVID-19 en Honduras,https://www.latribuna.hn/2020/08/14/carlos-umana-37-medicos-han-muerto-por-covid-19-en-honduras/,"Con la muerte de Ismael Calix son 37 médicos que han perdido la vida a causa del COVID-19 en Honduras, aseguró el presidente de la Asociación de Médicos del Instituto Hondureño de Seguridad Social (IH",14-08-2020 20:49,https://www.bing.com/th?id=ON.DF2FA9ED12EF4C47846749B42C320171,Chile,La Tribuna
Aduanas Honduras reitera que no existe retrasos en el despacho de las mercancías,http://www.elsoldehonduras.com/nacionales/aduanas-honduras-reitera-que-no-existe-retrasos-en-el-despacho-de-las-mercancias/,"Con la finalidad de garantizar el ingreso de equipo médico, insumos y medicamentos para la atención de la pandemia por la COVID-19 al país y la región mediante la actividad de comercio exterior de imp",14-08-2020 23:27,https://www.bing.com/th?id=ON.71E4125F6BC7D8616CCC8637ACC92828,Chile,El Sol de Honduras
Recursos de Fuerza Honduras están en los 296 municipios del país,http://www.elsoldehonduras.com/nacionales/recursos-de-fuerza-honduras-estan-en-los-296-municipios-del-pais/,"El 70% de los fondos del Programa Fuerza Honduras están en 296 municipios del país, quedan por ser transferidos el 30% de los recursos, los que se entregarán en los próximos días, según las autoridade",14-08-2020 23:43,https://www.bing.com/th?id=ON.70BF1035F89CAB0C0E652618A4937BC8,Chile,El Sol de Honduras
Coronavirus en Honduras: Sinager confirma 512 nuevos contagios y 19 muertes más,https://www.diez.hn/coronavirus/1401558-441/coronavirus-honduras-actualizacion-covid19-singaer-muertos-pandemia,Las cifras de infectados por el virus chino (Covid-19) en Honduras no para. Los enfermos suman y las muertes se incrementan. Este sábado el Sistema Nacional de Gestión de Riesgos (Sinager) ha confirma,15-08-2020 00:00,https://www.bing.com/th?id=ON.82369A6971B9D8605C18E7A9319BBC2D,Chile,diez.hn
"A 350,000 subirá el número de los desempleados en Honduras este año",https://www.elheraldo.hn/economia/1401122-466/a-350000-subir%C3%A1-el-n%C3%BAmero-de-los-desempleados-en-honduras-este-a%C3%B1o,La Secretaría de Trabajo prevé que la crisis laboral golpeará más a los jóvenes de 19 a 24 años con una tasa de desempleo del 17.7% A raíz de la crisis económica derivada de la pandemia del covid-19 m,15-08-2020 00:15,https://www.bing.com/th?id=ON.5196447302850527E0450935A60C23BB,Chile,El Heraldo
Honduras registra 425 casos y 6 muertes nuevas por COVID-19,https://hondudiario.com/2020/08/14/honduras-registra-425-casos-y-6-muertes-nuevas-por-covid-19/,"El Sistema de Gestión de Riesgos (Sinager) comunicó este viernes 14 de agosto la ejecución de 987 nuevas pruebas de COVID-19, de las cuales 425 resultaron positivas y 562 negativas. En ese sentido cab",15-08-2020 18:52,https://www.bing.com/th?id=ON.5D3672896968D10733D2439CE4F1EA19,Chile,Hondudiario
Rusia produce el primer lote de la vacuna contra el coronavirus,https://hondudiario.com/2020/08/15/rusia-produce-el-primer-lote-de-la-vacuna-contra-el-coronavirus/,"*** Los primeros frascos con el medicamento preventivo contra el COVID-19 serán entregados el 1 de enero del 2021. Tegucigalpa, Honduras. El ministerio de salud ruso comunicó este sábado que se ha pro",16-08-2020 01:46,https://www.bing.com/th?id=ON.BC56FD210393AB1D23AB904F0FFCDDB0,Chile,Hondudiario
Honduras: La curva del covid-19 en cada municipio,https://www.elheraldo.hn/interactivos/1401535-529/covid-honduras-curva-municipios,Explora en nuestra herramienta la cantidad de casos diarios y acumulados en cada municipio. Los resultados se ven limitados por la cantidad de pruebas realizadas El covid-19 ya demostró que siempre no,16-08-2020 04:08,https://www.bing.com/th?id=ON.B21A4CE18A577062D682C8D190489868,Chile,El Heraldo
Hay 35 municipios de Honduras con cero casos de covid-19,https://www.laprensa.hn/premium/1401573-410/honduras-35-municipios-cero-casos-covid-19-pandemia,"Con fuertes restricciones para la población, socialización de medidas de bioseguridad, y algunos ayudados por su posición geográfica aislada, 35 municipios aún permanecen libres de covid-19 al quinto",16-08-2020 08:01,https://www.bing.com/th?id=ON.C9E77A8CF56657C6952329D357E9A38E,Chile,La Prensa Chicos
