name,url,description,datePublished,imagen,pais,Fuente
Científico hondureño recomienda aplicar prueba de antígeno ante posible rebrote de coronavirus,https://hondudiario.com/2020/09/17/cientifico-hondureno-recomienda-aplicar-prueba-de-antigeno-ante-posible-rebrote-de-coronavirus/,"El investigador y científico hondureño, Marco Tulio Medina, aseguró que la prueba de antígenos puede apoyar de manera significativa la evaluación de la pandemia del Covid-19 en el país. Lo anterior, d",17-09-2020 16:25,https://www.bing.com/th?id=OVFT.rKAc4xMRXpg_ku501MA5tC,Chile,Hondudiario
Buscan evitar transmisión comunitaria con entrega de mascarillas en Roatán (Video),https://www.latribuna.hn/2020/09/17/buscan-evitar-transmision-comunitaria-con-entrega-de-mascarillas-en-roatan-video/,"Autoridades de Honduras comenzaron este jueves a distribuir 10 mil mascarillas en Roatán, Islas de la Bahía, para evitar una transmisión comunitaria del coronavirus o COVID-19, debido a que se observa",17-09-2020 21:48,https://www.bing.com/th?id=OVFT.4kpht2gwkGZXG7cFY8iuLC,Chile,La Tribuna
Dos dígitos por día: la nueva modalidad de circulación en Honduras,https://www.elheraldo.hn/pais/1409131-466/dos-digitos-honduras-circulacion-septiembre-pandemia-covid,"Aunque a partir del lunes 21 de septiembre se flexibiliza la medida de circulación, hay restricciones que continúan tan vigentes como al principio de la pandemia Con la habilitación de más dígitos den",17-09-2020 21:50,https://www.bing.com/th?id=OVFT.gVxibMhla0Az7Faq7hBpQi,Chile,El Heraldo
Funerarias hondureñas podrían «morir» confinadas por la COVID-19,https://www.latribuna.hn/2020/09/17/funerarias-hondurenas-podrian-morir-confinadas-por-la-covid-19/,"La Asociación de Funerarias de Honduras sacó este jueves sus carrozas fúnebres a las calles en protesta porque el Gobierno no les permite abrir varios de sus servicios desde marzo, a causa de la pande",17-09-2020 22:21,https://www.bing.com/th?id=OVFT.rlwkgBCstqD5yDBxCUnzdi,Chile,La Tribuna
Armando Calidonio da positivo por coronavirus,https://www.laprensa.hn/sanpedro/1409130-410/armando-calidonio-positivo-coronavirus-san-pedro-sula,"El alcalde de San Pedro Sula tiene síntomas leves de Covid-19. San Pedro Sula. Este jueves se conoció que el alcalde de San Pedro Sula, Armando Calidonio, dio positivo por Covid-19, por lo que sus fun",17-09-2020 22:41,https://www.bing.com/th?id=OVFT.qW8gloBlVe6ScpJBlnl6Bi,Chile,La Prensa Chicos
"Honduras suma 2,122 muertes y supera lo 70 mil casos de Covid-19",https://hondudiario.com/2020/09/17/honduras-suma-2122-muertes-y-supera-lo-70-mil-casos-de-covid-19/,"Autoridades del Sistema Nacional de Gestión de Riesgos (Sinager), indicaron este jueves que el total de casos positivos de Covid-19 es de 460 de 1,199 pruebas procesadas por el Laboratorio de Virologí",18-09-2020 02:53,https://www.bing.com/th?id=OVFT.6kDsJnMlATMG79MViuJqCi,Chile,Hondudiario
Gobierno reactiva programas sociales y entrega beneficios a familias de Santa María y Chinacla,http://www.elsoldehonduras.com/nacionales/gobierno-reactiva-programas-sociales-y-entrega-beneficios-a-familias-de-santa-maria-y-chinacla/,"El Gobierno de la República, a través de la Secretaría de Desarrollo e Inclusión Social (Sedis), reactivó esta semana los programas sociales Vida Mejor y Honduras para Todos para beneficiar a familias",18-09-2020 03:54,https://www.bing.com/th?id=OVFT.tuXhcJVaQos85Hy3EcOGJy,Chile,El Sol de Honduras
De manera virtual entregan la “Orden Dionisio de Herrera” a 19 Maestro del Año 2020,http://www.eldiario.hn/de-manera-virtual-entregan-la-orden-dionisio-de-herrera-a-19-maestro-del-ano-2020/,"Tegucigalpa.-En la celebración del Día del Maestro y por séptimo año consecutivo, el presidente Juan Orlando Hernández y la primera dama, Ana García de Hernández, entregaron este jueves en una ceremon",18-09-2020 04:05,https://www.bing.com/th?id=OVFT.BhLSLxZ5Bo6f2UJD3Qc7kC,Chile,El Diario
Nostalgia: extrañar los buenos momentos es parte del proceso,https://www.elheraldo.hn/suplementos/salud/1409237-466/nostalgia-extra%C3%B1ar-los-buenos-momentos-es-parte-del-proceso,"El cerebro cumple una función adaptativa según las distintas etapas de la vida. La clave está en aprender a clarificar sus recuerdos TEGUCIGALPA, HONDURAS.-Unos echarán de menos la ruta diaria hacia e",18-09-2020 08:11,https://www.bing.com/th?id=OVFT.HTOxQte8BBaNbFQAXdTNaS,Chile,El Heraldo
Piden en Honduras combatir estigma y exclusión hacia afectados por COVID-19,https://proceso.hn/piden-en-honduras-combatir-estigma-y-exclusion-hacia-afectados-por-covid-19/,"Tegucigalpa – La pandemia de la COVID-19 ha profundizado las difíciles condiciones de vida de las personas, alertaron en Honduras funcionarios y expertos, que además llamaron a terminar con el estigma",18-09-2020 13:52,https://www.bing.com/th?id=OVFT.57UYkp1bUUMsYxNlSDCswC,Chile,Proceso
Fallece vicealcaldesa de Nacaome por COVID-19,https://proceso.hn/fallece-vicealcaldesa-de-nacaome-por-covid-19/,"Tegucigalpa – La vicealcaldesa del municipio de Nacaome, Valle, región sur de Honduras, María Brenda Mejía Domínguez falleció en las últimas horas producto del COVID-19. La vicealcaldesa fue confirmad",18-09-2020 13:53,https://www.bing.com/th?id=OVFT.FCtCpMmexCWD-FTrHfq3xC,Chile,Proceso
"Los siete hospitales móviles estarían funcionando en noviembre, según interventor de Invest-H",https://www.radiohrn.hn/los-siete-hospitales-moviles-estarian-funcionando-en-noviembre-segun-interventor-de-invest-h,"El interventor de Inversiones Estratégicas de Honduras (Invest-H), Gustavo Boquín, informó a HRN que los siete hospitales móviles comprados por la institución estarían funcionado en noviembre. ""Nosotr",18-09-2020 15:46,https://www.bing.com/th?id=OVFT.zXlrmN63zXldwpy5IL2r2C,Chile,Radio HRN
"Menú mostrado vía código QR y otras medidas de bioseguridad, así atenderán los restaurantes en Honduras",https://www.radiohrn.hn/reapertura-economica-covid-19-menu-mostrado-via-codigo-qr-y-otras-medidas-de-bioseguridad-asi-atenderan-los-restaurantes-en-honduras,"Los restaurantes de Tegucigalpa y San Pedro Sula podrán atender a las personas en sus instalaciones a partir del lunes 21 de septiembre, en el marco de la reapertura económica de manera gradual en Hon",18-09-2020 15:46,https://www.bing.com/th?id=OVFT.x5zTmyWGYs5jNefTiEZ6gC,Chile,Radio HRN
Presidente de Guatemala da positivo a prueba de coronavirus,https://www.laprensa.hn/mundo/1409297-410/presidente-de-guatemala-da-positivo-a-prueba-de-coronavirus,"Giammattei dio positivo al covid 19 el mismo día que reabre las fronteras del país más afectado por la pandemia en la región. Ciudad de Guatemala. El presidente de Guatemala, Alejandro Giammattei, inf",18-09-2020 16:21,https://www.bing.com/th?id=OVFT.OmGFuepJBSppV6YX72TYCi,Chile,La Prensa Chicos
