name,url,description,datePublished,imagen,pais,Fuente
"Honduras: contagios por la COVID-19 suben a 2,100 y 116 muertes",https://www.laprensa.hn/especiales/coronavirus/1379070-410/honduras-contagios-pandemia-covid-19-2100-116-muertes,"Sinager dijo que otras personas se han recuperado del coronavirus, el total se eleva a 206. Tegucigalpa, Honduras. La cifra de personas contagiadas por la COVID-19 en Honduras aumentó a 2,100 luego de",11-05-2020 00:00,https://www.bing.com/th?id=ON.A2D41A42AA9932323DD076A9C62A92D1,Chile,La Prensa Chicos
Las madres reciben el 38% de remesas en Honduras,https://www.elheraldo.hn/economia/1378675-466/las-madres-reciben-el-38-de-remesas-en-honduras,"Los hondureños que radican en el extranjero envían un 16% a los hermanos, 12.5% a hijos y 12.9% a cónyugues TEGUCIGALPA, HONDURAS.-Como una muestra de amor y apoyo, los hondureños que han migrado del",11-05-2020 00:11,https://www.bing.com/th?id=ON.EB663A7674545CFE47B85AA6C9E1B870,Chile,El Heraldo
"Nuevas medidas de circulación para Cortés, El Progreso, Yoro, y Las Vegas, Santa Bárbara",https://www.diez.hn/coronavirus/1378858-441/nuevas-medidas-circulacion-cortes-el-progreso-yoro-las-vegas-santa-barbara,"El departamento de Cortés, El Progreso, Yoro, y Las Vegas, Santa Bárbara, podrán salir esta semana según el último número de circulación de identidad. La Secretaría de Estado en el Despacho de Segurid",11-05-2020 01:21,https://www.bing.com/th?id=ON.267D2BC911B93D94CDBF609BBEFA442B,Chile,diez.hn
Desigualdades sociales y COVID-19 en Honduras,https://www.latribuna.hn/2020/05/11/desigualdades-sociales-y-covid-19-en-honduras/,"A nuestra pobreza de origen estructural ahora se le suma la COVID-19, una pandemia del siglo XXI, que ataca el aparato respiratorio de los hondureños y hondureñas. Tales aparatos respiratorios no func",11-05-2020 06:41,https://www.bing.com/th?id=ON.F0B5481E22A1A5AA73BA1D7266103FC6,Chile,La Tribuna
Honduras se acerca a los 2.000 casos de Covid-19 y la alerta sigue,https://hondudiario.com/2020/05/10/sinager-confirmo-142-casos-mas-positivos-de-coronavirus-rosando-los-dos-mil-el-total/,"El Gobierno de la República de Honduras, a través del Sistema Nacional de Gestión de Riesgos (Sinager), informó que realizaron 432 nuevas pruebas para diagnosticar coronavirus, de las cuales 142 diero",11-05-2020 07:04,https://www.bing.com/th?id=ON.17D10B868B71E1AED886F6B83D66BCF5,Chile,Hondudiario
La violencia da un respiro a Honduras ante asilamiento por el coronavirus,https://www.laprensa.hn/honduras/1378855-410/violencia-criminal-homicidios-honduras-pandillas-asesinatos-,"La violencia que azota a los países del Triángulo Norte de Centroamérica dio un respiro a sus empobrecidos pobladores, con una reducción en los índices de homicidios por las medidas de cuarentena impu",11-05-2020 17:08,https://www.bing.com/th?id=ON.F3B447E28E63288FF2196C047C3038AB,Chile,La Prensa Chicos
Honduras: Este lunes reinician trabajos de infraestructura en el Aeropuerto Palmerola,https://radiohrn.hn/honduras-este-lunes-reinician-trabajos-de-infraestructura-en-el-aeropuerto-palmerola/,"Proyecto de construcción del aeropuerto de Palmerola. Foto: Hondudiario. Las labores de construcción del aeropuerto de Palmerola, ubicado en Comayagua, zona centro de Honduras, se reanudan a partir de",11-05-2020 19:50,https://www.bing.com/th?id=ON.9DAADB8DD32363DB62F80F0C68BEFE92,Chile,Radio HRN
Cruz Roja invita a sumarse a campaña de donación de sangre,https://www.proceso.hn/aldia/15-al-d%C3%ADa/cruz-roja-invita-a-sumarse-a-campana-de-donacion-de-sangre.html,"Tegucigalpa - La Primera Dama, Ana García de Hernández, se sumó hoy a la campaña de la Cruz Roja Hondureña denominada ""La sangre nos conecta a todos"", que impulsa la institución para generar mayor cap",12-05-2020 02:31,https://www.bing.com/th?id=ON.838935E831D6597A7BE96CC8CE73AE1B,Chile,Proceso
Aduana El Amatillo continúa atendiendo con normalidad en el despacho de mercancías,https://www.proceso.hn/nacionales/9-nacionales/aduana-el-amatillo-continua-atendiendo-con-normalidad-en-el-despacho-de-mercancias.html,"Tegucigalpa - Con normalidad en la atención en el despacho de las mercancías y operaciones aduaneras correspondientes a importación, exportación y tránsitos de transportistas de carga terrestre funcio",12-05-2020 05:53,https://www.bing.com/th?id=ON.292D6F6F6F7B11F4FBC79CE9660495CE,Chile,Proceso
