name,url,description,datePublished,imagen,pais,Fuente
Honduras replantea a nivel internacional el tema migratorio,https://www.proceso.hn/honduras-replantea-a-nivel-internacional-el-tema-migratorio/,"Tegucigalpa.-A través de la II Conferencia Internacional de Migración «Nuevos Retos, Nuevas Esperanzas», Honduras presenta la nueva realidad, que vive el mundo a causa de la crisis sanitaria provocada",02-09-2020 17:48,https://www.bing.com/th?id=ON.3AD7BFCCA68407F33BAC54D5D2E37D82,Chile,Proceso
Elsa Palou: Honduras mantiene en 3.1 % la tasa de letalidad por COVID-19,https://www.latribuna.hn/2020/09/02/elsa-palou-honduras-mantiene-letalidad-de-3-1-de-tasa-de-letalidad-baja/,"La ex ministra de Salud, Elsa Palou, reconoció hoy que estamos en la meseta de la primera oleada del COVID-19 “gracias a los centros de triajes y las brigadas médicas que van de casa en casa en busca",02-09-2020 20:14,https://www.bing.com/th?id=ON.017DFEB6EFC4CB70002C164B8F15D705,Chile,La Tribuna
El otro partido de fútbol en Honduras: Covid-19 vs los equipos de la Liga Nacional,https://www.diez.hn/blogs/1405635-498/kike-lanza-honduras-liga-nacional-coronavirus-otro-partido,La sinceridad y deportividad serán fundamental para vencer en este partido extra que enfrentan día a día los equipos de la Liga. Ha sido de mucha alegría saber que tenemos fecha de arranque del torneo,02-09-2020 21:24,https://www.bing.com/th?id=ON.DFD34B016B01E7E9EB5BB77839D287A1,Chile,diez.hn
Estos tres síntomas sintió reinfectado por covid-19 en Honduras,https://www.radiohrn.hn/estos-tres-sintomas-sintio-reinfectado-por-covid-19-en-honduras,"Actualmente, Honduras podría estar entrando en la fase de la meseta en el comportamiento de contagio del covid-19, advirtió un galeno. El infectólogo del Instituto Hondureño de Seguridad Social (IHSS)",02-09-2020 22:57,https://www.bing.com/th?id=ON.8626CB941B5BFDE253AE4599E8C63B13,Chile,Radio HRN
Otro médico muere por COVID-19 en Honduras,https://www.latribuna.hn/2020/09/02/otro-medico-muere-por-covid-19-en-honduras/,"Otro profesional de la medicina murió ayer martes en la sala de COVID-19 del Hospital Mario Catarino Rivas de San Pedro Sula, Cortés, zona norte de Honduras. Se trata del doctor José Torres, quien ten",03-09-2020 00:47,https://www.bing.com/th?id=ON.295D527864C91F4075D6D89A92382A18,Chile,La Tribuna
Supermercados La Colonia entrega insumos de bioseguridad a 5 hospitales de la zona noroccidental del país,http://www.eldiario.hn/supermercados-la-colonia-entrega-insumos-de-bioseguridad-a-5-hospitales-de-la-zona-noroccidental-del-pais/,"“Porque solo unidos y solidarios saldremos adelante, en Supermercados La Colonia seguiremos de pie por nuestra amada Honduras, aportando con pequeñas acciones para mitigar el Covid-19. Como Empresa Socialmente Responsable hemos beneficiado a la fecha a ...",03-09-2020 04:19,https://www.bing.com/th?id=ON.83E69CBCAF31DD5BEBA09F96ADC4D8FC,Chile,El Diario
Marathón confirma que ha tenido ocho futbolistas con coronavirus; tres fueron recientes y ya lo superaron,https://www.diez.hn/liganacionaldehonduras/1405858-498/marathon-confirma-ocho-futbolistas-con-coronavirus-tres-fueron-recientes-rolin-pena,"El vicepresidente deportivo del club, Rolin Peña, confirmó que esos jugadores ya tienen anticuerpos y están trabajando con el plantel. Era un secreto a voces. La pandemia del Coronavirus ha afectado a",03-09-2020 18:49,https://www.bing.com/th?id=ON.302E0AE1EA4D3EF9BF0BB174120BB446,Chile,diez.hn
Honduras: Crean comedor comunitario para ayudar a afectados por la pandemia,https://www.laprensa.hn/buenasnoticias/1405838-410/comedor-comunitario-san-pedro-sula-honduras-cuarentena-aislamiento-covid,"Esta ejemplar iniciativa abrirá sus puertas el lunes, siete de septiembre, y pretenden regalar 1,000 platos de comida cada día. San Pedro Sula, Honduras. Hondureños de noble corazón darán inicio el lu",03-09-2020 19:32,https://www.bing.com/th?id=ON.85511EE75A4E76C1854103153E9DD78D,Chile,La Prensa Chicos
JOH pide a hondureños mantenerse disciplinados con medidas de bioseguridad,https://hondudiario.com/2020/09/03/joh-pide-a-hondurenos-mantenerse-disciplinados-con-medidas-de-bioseguridad/,"El presidente de Honduras, Juan Orlando Hernández, exhortó a todos los sectores de la sociedad hondureña a mantenerse disciplinados con el uso de las medidas de bioseguridad para evitar infección y pr",03-09-2020 20:40,https://www.bing.com/th?id=ON.D79CC8BE81846B3FA7E50B173FD24B0B,Chile,Hondudiario
Honduras con menor tasa de letalidad por Covid-19 en comparación a países desarrollados,https://hondudiario.com/2020/09/03/honduras-con-menor-tasa-de-letalidad-por-covid-19-en-comparacion-a-paises-desarrollados/,"La infectóloga y exministra de la Secretaria de Salud (Sesal), Elsa Palou, señaló que Honduras tiene la tasa de letalidad de COVID-19 es más baja en comparación a otros países debido a que se encuentr",03-09-2020 20:40,https://www.bing.com/th?id=ON.B2908900281B2BEB2601D9CBE006FF21,Chile,Hondudiario
"La reinfección, potencial amenaza",https://proceso.hn/la-reinfeccion-potencial-amenaza/,"Tegucigalpa – La reinfección en pacientes de COVID-19 es una alarma latente en Honduras. Volver a sufrir la enfermedad, con efectos que podrían llegar a desestabilizar a un convaleciente, es una situa",03-09-2020 21:49,https://www.bing.com/th?id=ON.D8DDF801D0C3318675F71111D0730E11,Chile,Proceso
"BCIE canalizará 15,000 millones de dólares para Centroamérica entre 2020-2024",https://www.laprensa.hn/economia/1405905-410/bcie-15000-millones-dolares-centroamerica-vacuna-covid19-honduras,El Banco Centroamericano aprobó también apoyar financieramente a la región para adquirir una vacuna contra la Covid-19. Tegucigalpa. El Banco Centroamericano de Integración Económica (BCIE) canalizará,03-09-2020 22:15,https://www.bing.com/th?id=ON.7E634396CED977FB17562AB558AA76A3,Chile,La Prensa Chicos
