name,url,description,datePublished,imagen,pais,Fuente
"Weston McKennie, el estadounidense que la rompe en Juventus y será rival de Honduras en eliminatorias",https://www.diez.hn/internacionales/1428088-498/weston-mckennie-estadounidense-rompe-juventus-italia-serie-a-champions-concacaf-honduras,"El jugador de 22 años que pertence al Schalke 04 de Alemania, pero que ha sido cedido por una temporada a la Juventus por petición de Andrea Pirlo, ha brillado en la 'Vecchia Signora' siempre que ha t",08-12-2020 23:49,https://www.bing.com/th?id=OVFT.tESVE5uFEcvmqU5NYKISqS,Chile,diez.hn
Chile y México donan a Honduras insumos y equipos para atención de migrantes retornados,http://www.elsoldehonduras.com/internacionales/noticia/chile-y-mexico-donan-a-honduras-insumos-y-equipos-para-atencion-de-migrantes-retornados/,"Con el propósito de apoyar la atención de los migrantes hondureños retornados a país, el Fondo Conjunto de Cooperación Chile – México oficializó hoy una donación a Honduras de insumos y equipos valora",09-12-2020 00:07,https://www.bing.com/th?id=OVFT.rcFhiIXHRp4GgKm9UFEfgC,Chile,El Sol de Honduras
Jefa de Sala COVID-19 del Tórax: No quiero volver a preparar 7 cadáveres al día,https://tiempo.hn/jefa-sala-covid-19-del-torax-preparar-cadaveres/,"Lesly López, enfermera y jefa de la Sala COVID-19 del Tórax, relató la experiencia que le ha tocado vivir durante los 9 meses de pandemia.",09-12-2020 00:09,https://www.bing.com/th?id=OVFT.tGhO3H_Ifw8EzfoOKfezYC,Chile,Tiempo
Honduras supera los 50 mil recuperados por COVID-19,https://proceso.hn/honduras-supera-los-50-mil-recuperados-por-covid-19/,"Tegucigalpa – Honduras acumuló este martes 50 mil 344 personas que superaron el COVID-19, tras reportarse en las últimas horas 563 pacientes que vencieron el virus. El último reporte brindado por el S",09-12-2020 03:32,https://www.bing.com/th?id=OVFT.42JxQQt6EcyKgM3vzX38Cy,Chile,Proceso
"Honduras supera los 112,000 casos de coronavirus",https://www.laprensa.hn/honduras/1428170-410/nuevos-casos-coronavirus-muertes-honduras-pandemia-,"Tegucigalpa, Honduras Las autoridades hondureñas confirmaron este martes 468 nuevos casos del coronavirus SARS-CoV-2, con lo que ya suman 112.175 las personas que han contraído el",09-12-2020 03:55,https://www.bing.com/th?id=OVFT.CZZRfZtSnnWUW29dn8uFCy,Chile,La Prensa Chicos
Covid-19 supera los 112 mil contagios en Honduras y se acerca a las tres mil muertes,https://hondudiario.com/2020/12/08/covid-19-supera-los-112-mil-contagios-en-honduras-y-se-acerca-a-las-tres-mil-muertes/,"***Además, se reportó la muerte de 2 personas por coronavirus, elevando a 2,952 las víctimas por la enfermedad. El Sistema Nacional de Gestión de Riesgos (Sinager), confirmó este martes 468 nuevos cas",09-12-2020 03:56,https://www.bing.com/th?id=OVFT.jzUdHbfjQMN3ixG2JNIkfS,Chile,Hondudiario
El BCIEanuncio que emitió bono por $ 50.1 millones para vacuna contra COVID-19,https://ultimahora.hn/el-bcieanuncio-que-emitio-bono-por-50-1-millones-para-vacuna-contra-covid-19/,"El Banco Centroamericano de Integración Económica (BCIE) anunció  que ha emitido un segundo bono por 50,1 millones de dólares, con la participación de inversionistas regionales japoneses, dinero",09-12-2020 14:12,https://www.bing.com/th?id=OVFT.itRHlsSXhbvb4Wqwt8dkvS,Chile,Ultima Hora
La reina Letizia de España llegará a Honduras la próxima semana constatará daños de Eta e Iota y entregará ayuda humanitaria,https://ultimahora.hn/la-reina-letizia-de-espana-llegara-a-honduras-la-proxima-semana-constatara-danos-de-eta-e-iota-y-entregara-ayuda-humanitaria/,La reina Letizia viajará el próximo lunes 14 y 15 de diciembre a Honduras para transmitir el apoyo de España a las autoridades y ONG del país centroamericano tras los graves daños causados por los,09-12-2020 15:15,https://www.bing.com/th?id=OVFT.gB88dGPU_PwZT9zMxRqlgi,Chile,Ultima Hora
La reina Reina Letizia de España visitará Honduras para entregar ayuda humanitaria a afectadas por Eta e Iota,http://www.eldiario.hn/la-reina-reina-letizia-de-espana-visitara-honduras-para-entregar-ayuda-humanitaria-a-afectadas-por-eta-e-iota/,Tegucigalpa. - La Reina Letizia de España visitará Honduras los próximos 14 y 15 de diciembre para entregar ayuda humanitaria del pueblo español a las zonas afectadas por las tormentas Eta e Iota. Cab,09-12-2020 17:46,https://www.bing.com/th?id=OVFT.isOr18eEiVt-7px-RqOz5i,Chile,El Diario
Una aplicación para dispositivos móviles ayudará a identificar brotes de covid-19 y otras enfermedades en Cortés,http://www.eldiario.hn/una-aplicacion-para-dispositivos-moviles-ayudara-a-identificar-brotes-de-covid-19-y-otras-enfermedades-en-cortes/,San Pedro Sula. - La Secretaría de Salud y la delegación de expertos de Israel que se encuentra en Honduras trabajan para implementar una aplicación para dispositivos móviles que permitirá identificar,09-12-2020 18:12,https://www.bing.com/th?id=OVFT.xRtJYiYFBDKwnS9iALJeRi,Chile,El Diario
La reina de España viajará a Honduras tras los daños por los huracanes,https://www.radiohrn.hn/la-reina-de-espana-viajara-a-honduras-tras-los-danos-por-los-huracanes,"La reina de España, doña Letizia, llegará a Honduras el 14 de diciembre de 2020, para transmitir el apoyo de España a las autoridades y ONG tras los graves daños causados por los huracanes Iota y Eta",09-12-2020 19:02,https://www.bing.com/th?id=OVFT.5Ry-WPwdG2_7OM7Aew0jry,Chile,Radio HRN
Reportan tres decesos por COVID-19 en Tegucigalpa,https://proceso.hn/reportan-un-fallecimiento-por-covid-19-en-tegucigalpa/,"Tegucigalpa – Tres personas fallecieron bajo sospecha de COVID-19 en el Hospital de Especialidades del Instituto Hondureño de Seguridad Social (IHSS), el Instituto Nacional Cardiopulmonar del Tórax y",09-12-2020 19:32,https://www.bing.com/th?id=OVFT.T1sS4mdeu38M8aAOB-mYSS,Chile,Proceso
OPS advierte del alza en los contagios de Covid-19 en Centroamérica y Brasil,https://hondudiario.com/2020/12/09/ops-advierte-del-alza-en-los-contagios-de-covid-19-en-centroamerica-y-brasil/,La Organización Panamericana de la Salud (OPS) advirtió este miércoles de que en las últimas semanas la región de las Américas registra los niveles más altos de nuevos casos de covid-19 desde el inici,09-12-2020 21:01,https://www.bing.com/th?id=OVFT.mhdn6iVNR9B89WMk5VR16i,Chile,Hondudiario
HONDURAS / ÉPOCA NAVIDEÑA DESENCADENARÁ MÁS CASOS COVID-19,http://www.web.ellibertador.hn/index.php/noticias/nacionales/2500-honduras-epoca-navidena-desencadenara-mas-casos-covid-19,"La problemática por la pandemia en Honduras se agudiza por indisciplinada de la población y negligencia con que las autoridades han manejado la crisis, la alerta crece porque en épocas festivas es cua",09-12-2020 22:25,https://www.bing.com/th?id=OVFT.2cXF_D4coGfz698kFczKjS,Chile,El Libertador
Motagua libre de covid-19; Real Estelí con un caso positivo,https://www.diariomas.hn/2020/12/09/motagua-libre-de-covid-19-real-esteli-con-un-caso-positivo/,"Luego de las pruebas de hisopado realizadas a los futbolistas del equipo Motagua y Real Estelí de Nicaragua, previo al juego de repechaje clasificatorio",09-12-2020 22:44,https://www.bing.com/th?id=OVFT.xYdc3o0pP4mUhhWOE9vdwy,Chile,Mas
Piden que el presupuesto de 2021 de Honduras se apruebe de forma transparente,https://www.laprensa.hn/honduras/1428344-410/-presupuesto-2021-honduras-apruebe-transparente-,"El Frente Parlamentario contra la Corrupción de Honduras pidió este miércoles al Parlamento aprobar de manera transparente el presupuesto nacional para 2021, con el fin de atender la reconstrucción de",09-12-2020 22:46,https://www.bing.com/th?id=OVFT.GG1PpyqvFZfJdOGRrhK3Py,Chile,La Prensa Chicos
Salud: cuatro de diez personas están saliendo positivos por COVID-19,https://tiempo.hn/salud-positivos-covid-19-honduras/,"TEGUCIGALPA, HONDURAS. Un promedio de cuatro de cada diez personas están resultando positivas en las pruebas para la detección de COVID-19 en Honduras, según dio a conocer la doctora Karla Pavón. Pavó",10-12-2020 00:25,https://www.bing.com/th?id=OVFT.n_2Zms4zfdDXCJ8m8HnYHy,Chile,Tiempo
Empresa Energía Honduras: Las pérdidas técnicas de ENEE se redujeron a 19%,https://www.latribuna.hn/2020/12/09/empresa-energia-honduras-las-perdidas-tecnicas-de-enee-se-redujeron-a-19/,"De noviembre del año pasado a la fecha, las pérdidas técnicas y por robo de energía se redujeron a 19 por ciento debido a la caída en la demanda a raíz de la pandemia por la COVID-19 y las tormentas t",10-12-2020 01:51,https://www.bing.com/th?id=OVFT.Dx9LOpdNMbFkVtV2AXtQAi,Chile,La Tribuna
“Fuerza Honduras” fortalece centro de triaje y estabilización,https://www.latribuna.hn/2020/12/09/fuerza-honduras-fortalece-centro-de-triaje-y-estabilizacion/,"SIGUATEPEQUE, Comayagua. El personal que labora en el centro triaje y estabilización de la “ciudad de los pinares» recibió, a través del programa «Fuerza Honduras», un lote de material de bioseguridad",10-12-2020 01:58,https://www.bing.com/th?id=OVFT.WPbT-0KlIIYuaBBO8d949y,Chile,La Tribuna
