name,url,description,datePublished,imagen,pais,Fuente
"Lobos – Motagua, reactivan la Liga Nacional",https://www.diariomas.hn/2020/09/26/lobos-motagua-reactivan-la-liga-nacional/,"El fútbol vuelve a casa, después de seis meses de incertidumbre y ansiedad por disfrutar de un partido de nuestra Liga Profesional que había tenido",26-09-2020 15:00,https://www.bing.com/th?id=OVFT.4MVqiExOYTDYRAWQdLk3bi,Chile,Mas
Primer clásico en plena pandemia,https://www.diariomas.hn/2020/09/27/primer-clasico-en-plena-pandemia/,La emoción del fútbol de la Liga Profesional de Honduras continúa esta noche con el primer clásico de la temporada en medio de la pandemia de la Covid,27-09-2020 15:01,https://www.bing.com/th?id=OVFT.owdRjxyRhmWBHmaOctHlxS,Chile,Mas
Honduras sobrepasa los 76 mil casos de covid,https://www.radiohrn.hn/honduras-sobrepasa-los-76-mil-casos-de-covid,"El Laboratorio de Virología realizó 943 pruebas para detectar el covid, de las cuales 561 resultaron positivas.",29-09-2020 00:00,https://www.bing.com/th?id=OVFT.cakvtEQcj3GOCob-JtuMyi,Chile,Radio HRN
Honduras reporta 22 muertes por coronavirus y 561 contagios,https://www.laprensa.hn/especiales/coronavirus/1411973-410/coronavirus-cifras-honduras-contagio-muertes-,"Las nuevas muertes por coronavirus corresponden a Islas de la Bahía con nueve, Cortés con seis, Comayagua dos, Lempira dos, Santa Bárbara uno, Intibucá y Copán uno.",29-09-2020 00:00,https://www.bing.com/th?id=OVFT.tewfOVq8jcJy7Yz0GS-tVy,Chile,La Prensa Chicos
"Honduras confirmó que ya suman 75,537 casos de coronavirus",https://ultimahora.hn/honduras-confirmo-que-ya-suman-75537-casos-de-coronavirus/,"En el último reporte Honduras confirmó el lunes 28 septiembre, 75,537 casos confirmados de coronavirus (covid-19) luego que en el último reporte del Sistema Nacional de Gestión de",29-09-2020 04:46,https://www.bing.com/th?id=OVFT.VqQXz2ig23dMm2NhzzXHMi,Chile,Ultima Hora
Nuevo tratado digital entre Corea y Honduras,https://www.latribuna.hn/2020/09/29/nuevo-tratado-digital-entre-corea-y-honduras/,"El embajador, Jae Hyun Shim, en representación de la embajada de la República de Corea en Honduras, presentó recientemente la política del Nuevo Trato Digital del gobierno de Corea y oportunidades par",29-09-2020 08:31,https://www.bing.com/th?id=OVFT.G9bgV_w3tw-ItG0L-B3cty,Chile,La Tribuna
"""Santuario Alimentario"" dará vigilancia contra COVID-19 a productores agrícolas",https://www.latribuna.hn/2020/09/29/santuario-alimentario-dara-vigilancia-contra-covid-19-a-productores-agricolas/,"DANLÍ, El Paraíso. Más de 20 mil productores del valle de Jamastrán recibirán vigilancia epidemiológica mediante el proyecto “Santuario Alimentario” que coordina Sir Salvador Moncada y otros cooperant",29-09-2020 09:08,https://www.bing.com/th?id=OVFT.bKTM4G_aWwPiq1qWKgF01y,Chile,La Tribuna
Generador retrasa hospital móvil de Tegucigalpa,https://www.elheraldo.hn/pais/1411738-466/generador-retrasa-hospital-m%C3%B3vil-de-tegucigalpa,"TEGUCIGALPA, HONDURAS.- Sin una fecha de entrega definida, con algunos contratiempos y el 80 por ciento de la instalación física terminada avanza el hospital móvil de Tegucigalpa. El de San Pedro Sula",29-09-2020 14:18,https://www.bing.com/th?id=OVFT.ZHlRt_cumFUaaA2T2ch-aC,Chile,El Heraldo
Cinco personas fallecen por COVID-19 en Tegucigalpa,https://proceso.hn/tres-personas-fallecen-por-covid-19-en-el-ihss-y-hospital-escuela/,"Tegucigalpa – Una persona falleció bajo sospecha de COVID-19 en el Hospital de Especialidades del Instituto Hondureño de Seguridad Social (IHSS), dos en el Hospital Escuela (HE) y dos en Instituto Nac",29-09-2020 14:30,https://www.bing.com/th?id=OVFT.sTlMANTzgGz1Gl8iOQTc2S,Chile,Proceso
Relajación de población puede causar rebrotes del coronavirus en Honduras,https://proceso.hn/relajacion-de-poblacion-puede-causar-rebrotes-del-coronavirus-en-honduras/,"Tegucigalpa – La relajación de la población de Honduras en lo que respecta a las medidas de bioseguridad puede propiciar rebrotes del coronavirus SARS-CoV-2 en el país centroamericano, alertó el cient",29-09-2020 15:21,https://www.bing.com/th?id=OVFT.p2kvhRoLRbgyhrNyFMpODi,Chile,Proceso
Confirmados cinco decesos por coronavirus en hospitales de la capital,https://hondudiario.com/2020/09/29/confirmados-cinco-decesos-por-coronavirus-en-hospitales-de-la-capital/,"Un total de cinco personas han perdido la vida en las últimas horas por sospechas de Covid-19, al interior de los principales centros de asistenciales de Tegucigalpa, capital de Honduras Según la info",29-09-2020 16:27,https://www.bing.com/th?id=OVFT._LTD6SZHIGaNkL_BJFpviS,Chile,Hondudiario
En FOROS HRN - TSi: Expertos plantean reorientar presupuesto para Educación y evaluar retorno a clases,https://www.radiohrn.hn/en-foros-hrn-tsi-expertos-plantean-reorientar-presupuesto-para-educacion-y-evaluar-retorno-a-clases,"Los grandes retos de la educación en la actual pandemia tienen que ver con la cobertura, la evaluación, la formación docente y el reintegro de los alumnos.",29-09-2020 17:02,https://www.bing.com/th?id=OVFT.4Z7X1BYwTCOPXMpvqC402y,Chile,Radio HRN
"El COVID-19 ha cegado la vida de 62 niños, adolescentes y jóvenes en Honduras",https://www.laprensa.hn/honduras/1411849-410/coronavirus-honduras-menores-ni%C3%B1os-ni%C3%B1as-jovenes-adolescentes-pandemia,"Del total de casos de COVID-19 registrados a la fecha en el país, 25,079 tienen que ver con niños, niñas, adolescentes y jóvenes.",29-09-2020 18:45,https://www.bing.com/th?id=OVFT.o2ixVoQmv7b5_qE8lfiRXS,Chile,La Prensa Chicos
Gildan y World Vision entregan 96.000 cuadernos de trabajo para alumnos sin acceso a internet,http://www.eldiario.hn/gildan-y-world-vision-entregan-96-000-cuadernos-de-trabajo-para-alumnos-sin-acceso-a-internet/,"San Pedro Sula.- La Dirección Departamental de Educación de Cortés recibió de Gildan y Word Vision Honduras, la donación de 96,000 cuadernos de trabajo para aquellos alumnos que no tienen acceso al se",29-09-2020 20:58,https://www.bing.com/th?id=OVFT.35NaIceT7g9XUuuoDc0BRC,Chile,El Diario
"Honduras acumula 76,098 casos de covid-19 y 2,323 decesos",https://www.elheraldo.hn/pais/1411971-466/honduras-acumula-nuevos-casos-covid-19-nuevos-decesos,"Desde el comienzo de la epidemia más de 33,162.930 personas contrajeron la enfermedad en todo el mundo, Honduras se acerca a los 80 mil casos en seis meses desde el registro del primer contagio",30-09-2020 02:40,https://www.bing.com/th?id=OVFT.fZYd4Nb3Pt2OSYK4ErlhKy,Chile,El Heraldo
Honduras supera los 76 mil contagios entre demandas de aplicar más pruebas,https://hondudiario.com/2020/09/29/honduras-supera-los-76-mil-contagios-entre-demandas-de-aplicar-mas-pruebas/,"El Sistema Nacional de Gestión de Riesgos (Sinager), informó este martes que de 943 pruebas para diagnosticar Covid-19 en el país, 561 dieron positivo, sumando así un total de 76,098 casos de coronavi",30-09-2020 02:54,https://www.bing.com/th?id=OVFT.OTe5SHisAfVbhRnJn1YyRS,Chile,Hondudiario
