name,url,description,datePublished,imagen,pais,Fuente
Israel donó vacunas contra el Covid-19 a Guatemala,https://www.vtv.com.hn/noticia/israel-dono-vacunas-contra-el-covid-19-a-guatemala/,El vice canciller de Guatemala agradeció al gobierno de Honduras por el apoyo en el traslado de las vacunas contra el Covid-19 donadas por el estado de Israel.,25-02-2021 21:20,https://www.bing.com/th?id=OVFT.7JrsEKJDfk2VNxZ8TrBQOi,Chile,VTV
Más de 1500 auxiliares de enfermería serán inmunizadas conta el Covid-19,https://www.vtv.com.hn/noticia/mas-de-1500-auxiliares-de-enfermeria-seran-inmunizadas-conta-el-covid-19/,"El presidente de la Asociación Nacional de Enfermeras y Enfermeros auxiliares de honduras afirma que en las próximas horas un estimado de mil 500 enfermeras serán inmunizadas contra el Covid-19, esta",26-02-2021 01:37,https://www.bing.com/th?id=OVFT.KVvP7nEXSZmOb03SB-99DC,Chile,VTV
Proceso de vacunación continuará con un flujo corrido en los próximos días y meses asegura el Gobierno,http://www.eldiario.hn/proceso-de-vacunacion-continuara-con-un-flujo-corrido-en-los-proximos-dias-y-meses-asegura-el-gobierno/,"Tegucigalpa. - Tras llegar a Honduras las 5.000 vacunas anticovid enviadas por Israel, el presidente Juan Orlando Hernández participó este jueves como testigo de honor en la supervisión del primer pro",26-02-2021 03:22,https://www.bing.com/th?id=OVFT.TSjUYrZj_Ivsi6JKDz_7My,Chile,El Diario
Honduras sobrepasa los 168 mil casos confirmados de COVID-19 con 749 nuevos contagios,https://proceso.hn/honduras-sobrepasa-los-168-mil-casos-confirmados-de-covid-19-con-749-nuevos-contagios/,"Tegucigalpa – Los casos de COVID-19 en Honduras se elevaron este jueves a 168 mil 243 desde que en el país se declarara emergencia sanitaria por la pandemia en marzo de 2020, con la confirmación de otros 749 contagios positivos, informó el Sistema ...",26-02-2021 05:16,https://www.bing.com/th?id=OVFT.Sxlc142OmovRMgL8MRft8C,Chile,Proceso
"Honduras se acerca a los 4,100 fallecidos por coronavirus",https://www.radiohrn.hn/honduras-se-acerca-a-los-4100-fallecidos-por-coronavirus,"Honduras acumula a casi un año desde que se comenzó a expandir la pandemia de covid-19 al menos 4 mil 009 muertos y 168 mil 243 contagios, informó este jueves el estatal Sistema Nacional de Gestión de",26-02-2021 05:51,https://www.bing.com/th?id=OVFT.RjMntXoC0m0gPFDpNfBh2i,Chile,Radio HRN
Reportan 12 fallecidos con sospecha de COVID-19 en hospitales de Honduras,https://proceso.hn/reportan-tres-fallecidos-con-sospecha-de-covid-19-en-hospitales-de-honduras/,"Este jueves las autoridades hospitalarias del país, reportaron el deceso de 12 personas con sospecha de la COVID-19.",26-02-2021 09:00,https://www.bing.com/th?id=OVFT.cKXCqW-9LmOEMPzuQKlH0i,Chile,Proceso
EMBAJADOR DE ISRAEL SATISFECHO PORQUE SU PAÍS ES EL PRIMERO QUE DONA VACUNAS CONTRA LA COVID-19 A HONDURAS,https://ultimahora.hn/embajador-de-israel-satisfecho-porque-su-pais-es-el-primero-que-dona-vacunas-contra-la-covid-19-a-honduras/,"Embajador Extraordinario y Plenipotenciario de Israel en Guatemala y concurrente para la República de Honduras, Mattanya Cohen expresó su alegría este viernes que su país este ayudando la nación",26-02-2021 14:48,https://www.bing.com/th?id=OVFT.9wanlqMIrIe9eKKHJT3HvC,Chile,Ultima Hora
Vacunación anticovid del personal sanitario se extendió a cuatro regiones del país,https://hondudiario.com/2021/02/26/vacunacion-anticovid-del-personal-sanitario-se-extendio-a-cuatro-regiones-del-pais/,"La jornada de vacunación contra la COVID-19, con las dosis donadas por el gobierno de Israel, arrancó de forma oficial este viernes a eso de las 7:30 de la mañana, en cuatro departamentos del país. Mé",26-02-2021 15:03,https://www.bing.com/th?id=OVFT.NtHR0nvOG7ptwMdRbt8fnC,Chile,Hondudiario
"Covax: Honduras recibirá 424,800 dosis de la vacuna de Astrazeneca",https://www.latribuna.hn/2021/02/26/covax-honduras-recibira-424800-dosis-de-la-vacuna-de-astrazeneca/,"La alianza Covax/Gavi confirmó este viernes que entregará a Honduras 428,000 dosis de vacunas contra la covid-19, las que llegarán",26-02-2021 18:39,https://www.bing.com/th?id=OVFT.Pf4rgFSXzp1MWB0Va45ddy,Chile,La Tribuna
Calendario de circulación por dígito para sábado y domingo 27 y 28 de febrero en Honduras,https://www.diez.hn/notodoesfutbol/1445743-498/circulacion-digito-honduras-fines-semana-sabado-27-febrero-domingo-28-febrero,Honduras mantiene restricción de circulación para ciudadanos en cuatro departamentos de donde se registran más casos de Covid-19.,26-02-2021 19:09,https://www.bing.com/th?id=OVFT.kgRlO7b73MhIujRwiQZ-Oi,Chile,diez.hn
Migrantes hondureños en EEUU gestionan vacunas de la covid-19 para su país,https://www.laprensa.hn/honduras/1445783-410/migrantes-hondure%C3%B1os-estados-unidos-gestionan-vacunas-covid-honduras,"Honduras inició hasta este jueves la vacunación de personal médico, tras recibir 5,000 vacunas donadas por Israel.",26-02-2021 20:46,https://www.bing.com/th?id=OVFT.FbdcfWga2XxHr1vgsB_j8y,Chile,La Prensa Chicos
En marzo o mayo llegarían a Honduras las primeras 428 mil vacunas de Covax,https://www.elheraldo.hn/pais/1445786-466/vacuna-coronavirus-honduras-covax,La notificación recibida por el Gobierno hondureño da seguimiento a la carta del mecanismo Covax fechada el 29 de enero con respecto a su asignación indicativa.,26-02-2021 20:52,https://www.bing.com/th?id=OVFT.UMAbMFt4nMB1Ut944VAKnC,Chile,El Heraldo
"Familia Baquedano, lucha por superar el COVID-19 que les arrebató a cuatro miembros en unas horas",https://tiempo.hn/familia-baquedano-lucha-covid-19-cuatro-muertes/,"La familia Baquedano, originaria del municipio de Soledad, El Paraíso, lucha tras la muerte de cuatro de sus miembros a causa del COVID-19",26-02-2021 20:57,https://www.bing.com/th?id=OVFT.YzLyqrgZgI_9EnG8thnTIC,Chile,Tiempo
"Covax anuncia que enviará más de 428,000 dosis de vacunas a Honduras entre marzo y mayo",https://www.laprensa.hn/honduras/1445785-410/covax-entrega-vacunas-dosis-covid-honduras-marzo-mayo-pandemia-oms,"La comunicación oficial indica que la primera entrega será de 48,000 dosis y llegará a mediados de marzo. La alianza Covax/Gavi confirmó este viernes que entregará a Honduras 428,000 dosis de vacunas",26-02-2021 21:18,https://www.bing.com/th?id=OVFT.zryicWUMfJAttsWrdbkgaS,Chile,La Prensa Chicos
Hoteleros ven llegada de la vacuna como la solución para recuperar el turismo,https://hondudiario.com/2021/02/26/hoteleros-ven-llegada-de-la-vacuna-como-la-solucion-para-recuperar-el-turismo/,"El presidente de la Asociación de Pequeños Hoteles de Honduras, Roberto Oseguera, manifestó que la llegada de la vacuna contra el Covid-19 trae buenas expectativas para el turismo. “Esperamos que las",26-02-2021 21:22,https://www.bing.com/th?id=OVFT.whQegdAaCMSGDbJ3Gre0MC,Chile,Hondudiario
Honduras: COVAX envía carta a Salud y define cuándo llegarán las 400 mil vacunas,https://tiempo.hn/honduras-covax-carta-cuando-llegaran-las-vacunas/,A través de una carta el mecanismo COVAX detalla y la cantidad de dosis de vacunas antiCOVID-19 que estarían llegando a Honduras,26-02-2021 22:02,https://www.bing.com/th?id=OVFT.tNdme2yvqPWZXY9_zOgxWi,Chile,Tiempo
MIGRANTES HONDUREÑOS EN EEUU REALIZAN GESTIONES PARA CONSEGUIR VACUNAS ANTI COVID-19 PARA SU PAÍS,https://ultimahora.hn/migrantes-hondurenos-en-eeuu-realizan-gestiones-para-conseguir-vacunas-anti-covid-19-para-su-pais/,La Fundación 15 de Septiembre de hondureños en Estados Unidos está gestionando con el Colegio Médico Hondureño (CMH) y la congresista estadounidense Ilhan Omar el envío de vacunas a su población,26-02-2021 22:02,https://www.bing.com/th?id=OVFT.x2MwSp3vL0YxHVnbXoFPky,Chile,Ultima Hora
Esta es la reacción de la primera enfermera auxiliar en vacunarse con 'Moderna' en Honduras,https://www.radiohrn.hn/esta-es-la-reaccion-de-la-primera-enfermera-auxiliar-en-vacunarse-con-moderna-en-honduras,"Soraya Ortega, fue la primera enfermera auxiliar en ser vacunada con la dosis anticovid ""Moderna"" donada por el gobierno de Israel como un acto de humanidad, hermandad y solidaridad con Honduras. A un",26-02-2021 22:21,https://www.bing.com/th?id=OVFT.wieioUmE3RB7uQvHH-gIVy,Chile,Radio HRN
