name,url,description,datePublished,imagen,pais,Fuente
"Carlos Aguilar: “Pese a todas las medidas, me contagié”",https://www.elheraldo.hn/pais/1382818-466/carlos-aguilar-pese-a-todas-las-medidas-me-contagie,"TEGUCIGALPA, HONDURAS.-En la guerra contra el enemigo invisible, los soldados de la primera línea siguen cayendo enfermos de Covid-19. Uno de esos guerreros es uno de los dos únicos neumólogos del Ins",28-05-2020 18:28,https://www.bing.com/th?id=ON.D0ED52064750EAE3EA3C19A6A5CA745E,Chile,El Heraldo
Honduras recibió 85 mil pruebas para Covid-19 ¿Dónde están?,https://notibomba.com/honduras-recibio-85-mil-pruebas-para-covid-19-donde-estan/,La negligencia y la corrupción del actual gobierno de Honduras quedó evidenciada nuevamente con una solicitud de pruebas o test para detectar el Covid-19. De acuerdo con la nota remitida a la Organiza,28-05-2020 20:11,https://www.bing.com/th?id=ON.3F18BE1ED8740DB362425C0A7FCF8D04,Chile,Noti Bomba
Selección de Honduras no volverá a jugar lo que resta del 2020 por pandemia,https://www.elheraldo.hn/deportes/1382930-466/selecci%C3%B3n-de-honduras-no-volver%C3%A1-a-jugar-lo-que-resta-del-2020,"TEGUCIGALPA, HONDURAS.-La Selección de Honduras en todas sus categorías no volverá a jugar en lo que queda del 2020 debido a la pandemia de Covid-19 que mantiene cerradas las fronteras. De acuerdo con",28-05-2020 20:59,https://www.bing.com/th?id=ON.D1231261662F1F7740A90CD5339BCAF3,Chile,El Heraldo
El 30% de casos diagnosticados de COVID-19 en Honduras son asintomáticos,https://www.latribuna.hn/2020/05/28/el-30-de-casos-diagnosticados-de-covid-19-en-honduras-son-asintomaticos/,"La jefa de Vigilancia Epidemiológica de la Secretaría de Salud, Karla Pavón, expresó hoy que el 30% de los casos positivos de COVID-19 han sido asintomáticos. Esto eleva el riesgo de contagio ya que a",28-05-2020 21:52,https://www.bing.com/th?id=ON.602DDBBE158884FCEAC32596478483A3,Chile,La Tribuna
La segunda quincena de junio será la asamblea de Liga Nacional con el tema Covid-19 de principal,https://www.diez.hn/liganacionaldehonduras/1382958-498/segunda-quincena-de-junio-asamblea-liga-nacional-fernando-osorio,"Los dirigentes de los equipos de la Liga Nacional de Honduras se están preparando para ir a debatir en la Asamblea de la profesional donde se definirán muchos temas, principalmente la reanudación del",28-05-2020 22:36,https://www.bing.com/th?id=ON.13D23147E2C778147227EF86FA4BC5B0,Chile,diez.hn
ONU donó a Honduras 85 mil pruebas PCR,https://elpatriota.hn/2020/05/28/onu-dono-a-honduras-85-mil-pruebas-pcr/,"TEGUCIGALPA, HONDURAS. Esta fue la respuesta contundente del secretario general, Antonio Gutiérres, a la embajadora de Hondura ante ese organismo internacional, Lizzy Flores. Desde febrero, la Organiz",28-05-2020 23:25,https://www.bing.com/th?id=ON.2DA52F05466C933F7B8725243D03DB3C,Chile,El Patriota
El resumen de las noticias de Honduras y el mundo del jueves 28 de mayo,https://www.laprensa.hn/podcasts/1382984-410/noticias-honduras-salud-coronavirus-covid_19-muertos-contagios-reactivacion-economia-liga_italia,"Este es el resumen de las principales noticias de Honduras y el mundo del jueves 28 de mayo de 2020. El viceministro de Salud, Roberto Cosenza, indicó que el Hospital Leonardo Martínez solo atenderá p",28-05-2020 23:51,https://www.bing.com/th?id=ON.89885D2E1FA4005CE298428D3A8727E8,Chile,La Prensa Chicos
"Honduras cerca de la fase 5 de Covid-19, “momento de alta incidencia y transmisión acelerada”",https://hondudiario.com/2020/05/28/honduras-cerca-de-la-fase-5-de-covid-19-momento-de-alta-incidencia-y-transmision-acelerada/,"El jefe de la unidad de epidemiología del Sistema Nacional de Gestión de Riesgos (Sinager), Mario Munguía, consideró que Honduras se encuentra a las puertas de entrar a la fase cinco de la pandemia po",29-05-2020 00:11,https://www.bing.com/th?id=ON.D57CC34DC5F4971CCFB9762F09B8141A,Chile,Hondudiario
Iker Casillas envía un mensaje de solidaridad a Honduras en tiempos de coronavirus,https://www.diez.hn/internacionales/1382982-498/iker-casillas-mensaje-honduras-coronavirus-covid-19-rifa-camiseta,"Iker Casillas donó una de sus camisetas para que se rife en Honduras y envió un mensaje de solidaridad al país. Iker Casillas, exportero del Real Madrid y del Porto de Portugal, envió un mensaje de so",29-05-2020 00:22,https://www.bing.com/th?id=ON.C325138B535A771042BD0F6702EA6FB7,Chile,diez.hn
Más de 300 empleados de salud en Honduras contagiados por Covid-19,https://notibomba.com/mas-de-300-empleados-de-salud-en-honduras-contagiados-por-covid-19/,"Las nuevas estadísticas de contagios de los empleados de salud en Honduras son desalentadores, se estima que más de 300 profesionales se han infectado mientras luchan contra el Covid-19. En total son",29-05-2020 15:11,https://www.bing.com/th?id=ON.1C6650BDFEE51B286C2F138E88CE4972,Chile,Noti Bomba
Honduras: Pacientes con esclerosis múltiple sin acceso a tratamiento por el alto costo,https://radiohrn.hn/honduras-pacientes-con-esclerosis-multiple-sin-acceso-a-tratamiento-por-el-alto-costo/,"En el marco del Día Mundial de la Esclerosis Múltiple, Honduras registra alrededor 500 personas que padecen la enfermedad, de las cuales 300 gozan de su tratamiento y 200 no, por falta de presupuesto.",29-05-2020 15:46,https://www.bing.com/th?id=ON.89D840564EF2B190D50D3DE6DF799BE0,Chile,Radio HRN
La apertura inteligente de la economía de Honduras y la reactivación de los empleos,https://radiohrn.hn/la-apertura-inteligente-de-la-economia-de-honduras-y-la-reactivacion-de-los-empleos/,"Economía mundial a la baja por covid-19. Es verdad que la pandemia del Covid-19 nos ha traído muchos infortunios. Ha puesto a prueba de fuego nuestro agónico sistema de salud, arrebatado la vida de ca",29-05-2020 15:46,https://www.bing.com/th?id=ON.9F6F94DA1A5C67A4445639A1E99215ED,Chile,Radio HRN
Honduras y sistema de la ONU presentan «Plan de Respuesta Humanitaria» COVID-19,https://www.latribuna.hn/2020/05/29/honduras-y-sistema-de-la-onu-presentan-plan-de-respuesta-humanitaria-covid-19/,"El Gobierno de Honduras y el Sistema de Naciones Unidas presentaron el «Plan de Respuesta Humanitaria COVID-19», que requiere de 99,2 millones de dólares y prevé beneficiar a 3 millones de personas po",29-05-2020 16:08,https://www.bing.com/th?id=ON.3C9619F5A234359ED935F9CCEF7134D1,Chile,La Tribuna
“NO ESPERE MÁS”: Embajada Americana insta a sus ciudadanos a salir de Honduras,https://hondudiario.com/2020/05/29/no-espere-mas-embajada-americana-insta-a-sus-ciudadanos-a-salir-de-honduras/,"La Embajada de Estados Unidos  en Tegucigalpa, emitió una Alerta de Salud ante el aumento de casos de Covid-19 en Honduras, e insta a los ciudadanos estadounidenses que deseen regresar a Estados Unido",29-05-2020 17:15,https://www.bing.com/th?id=ON.E921DE9FD9E32939973D34B323F1BFBF,Chile,Hondudiario
Honduras y el Sistema de la ONU presentan un Plan de Respuesta Humanitaria al COVID-19,https://www.laprensa.hn/honduras/1383107-410/noticias-pa%C3%ADs-pandemia-coronavirus-honduras-y-el-sistema-de-la-onu-presentan-plan-respuesta-covid19,"El objetivo del plan es apoyar el control de la epidemia a través de la desaceleración de la transmisión y el fortalecimiento de servicios de salud. Tegucigalpa, Honduras. El Gobierno de Honduras y el",29-05-2020 17:17,https://www.bing.com/th?id=ON.7BC469FD78275E96F59E2CDB17AFF438,Chile,La Prensa Chicos
