name,url,description,datePublished,imagen,pais,Fuente
Rigoberto Rivas entró de cambio en empate del Reggina en Italia que complica sus aspiraciones de ascenso,https://www.diez.hn/legionarios/1447584-498/rigoberto-rivas-suplente-empate-reggina-en-italia-serie-b-preolimpico-honduras,De momento se está a la espera de que el club lo puedo prestar a la Selección de Honduras Sub-23 para poder disputar el ... pues tienen temor de los contagios de Covid-19 y por eso está en duda para el Preolímpico. Por ahora el club se prepara para ...,06-03-2021 16:02,https://www.bing.com/th?id=OVFT.hR5sglY_-wrLt-ldTiZ05C,Chile,diez.hn
Satélites captan quemas en toda Honduras; pero no se reportan incendios en 10 departamentos,https://hondudiario.com/2021/03/06/satelites-captan-quemas-en-toda-honduras-pero-no-se-reportan-incendios-en-10-departamentos/,"Las condiciones secas comienzan a agudizarse, pero el mayor problema no es el verano sino la mano ardiente del hombre, porque de acuerdo al Instituto Nacional de Conservación Forestal (ICF) el 93 por",06-03-2021 19:55,https://www.bing.com/th?id=OVFT.jSoY82I3KSwMTfVc7yW_ZC,Chile,Hondudiario
FALLECE POR COVID EL EXMINISTRO DE SALUD ENRIQUE SAMAYOA EN SAN PEDRO SULA,https://ultimahora.hn/fallece-por-covid-el-exministro-de-salud-enrique-samayoa-en-san-pedro-sula/,"En las últimas horas  se confirmó el fallecimiento del exministro de Salud, doctor Enrique Octavio Samayoa Moncada en un centro asistencial en San Pedro Sula, zona norte de Honduras. En doctor",06-03-2021 21:04,https://www.bing.com/th?id=OVFT.j61VyVDe9zLlG0F8QfQyWS,Chile,Ultima Hora
"Contagios en Honduras suman 173,514 con 4,249 muertes confirmadas por coronavirus",https://hondudiario.com/2021/03/07/contagios-en-honduras-suman-173514-con-4249-muertes-confirmadas-por-coronavirus/,"El Sistema Nacional de Gestión de Riesgos (Sinager), confirmó en las últimas horas 494 nuevos casos de Covid-19, sumando así un total de 173,514 contagios a nivel nacional. De 1,940 pruebas PCR proces",07-03-2021 15:11,https://www.bing.com/th?id=OVFT.mjILb8S56dZzMy6ycOUkOy,Chile,Hondudiario
Honduras espera tener seis millones de vacunas contra el covid-19 entre marzo y mayo de 2021,https://www.radiohrn.hn/honduras-espera-tener-seis-millones-de-vacunas-contra-el-covid-19-entre-marzo-y-mayo-de-2021,Se espera que Honduras pueda contar con las vacunas necesarias para inmunizar a los más de 9 millones de hondureños,07-03-2021 18:25,https://www.bing.com/th?id=OVFT.AT8tyaLlFktrncRpxjGRWy,Chile,Radio HRN
El Distrito Central encabeza lista de ciudades con más contagios actuales de covid-19 en Honduras,https://www.radiohrn.hn/el-distrito-central-encabeza-lista-de-ciudades-con-mas-contagios-actuales-de-covid-19-en-honduras,"En el inicio de la semana 52 de la pandemia en Honduras, el 29.7 por ciento de los casos se concentran en el departamento de Cortés, seguido por Francisco Morazán con un 27.2 por ciento",07-03-2021 18:25,https://www.bing.com/th?id=OVFT.iuhlP-hKNUzwNhiL9l1f9y,Chile,Radio HRN
"Preolímpico de Concacaf: Formato, sedes, calendario y lo que debes saber del clasificatorio a Tokio 2021",https://www.diez.hn/laseleccion/1447880-498/preolimpico-concacaf-formato-sedes-calendario-grupos-juegos-olimpicos-tokio-2021,El torneo de la Concacaf para selecciones sub-23 arranca el 18 marzo y se realizará en México para conocer a los países que estarán en los Juegos Olímpicos.,08-03-2021 01:16,https://www.bing.com/th?id=OVFT.8gLDskAu19sKlm793bHV3y,Chile,diez.hn
Mapa de centros de triajes para atención por covid-19 en Honduras,https://www.laprensa.hn/premium/1447938-410/mapa-de-centros-de-triajes-para-atenci%C3%B3n-por-covid-19-en-honduras,"San Pedro Sula, Honduras. Desde el inicio de la pandemia, el gobierno, municipalidades y empresa privada aplicaron la estrategia de detección inmediata a través de los centros d",08-03-2021 08:23,https://www.bing.com/th?id=OVFT.QUekyDfILhJTQt0lpOQzVy,Chile,La Prensa Chicos
"Muere el doctor Enrique Samayoa, exministro de Salud de Honduras",https://www.laprensa.hn/honduras/1447995-410/muere-doctor-enrique-samayoa-covid-exministro-salud-honduras,"Este lunes falleció el doctor Enrique Octavio Samayoa Moncada, exministro de Salud y expresidente del Colegio Médico de Honduras. Se conoció que el doctor Samayoa murió en un hospital privado de San P",08-03-2021 09:33,https://www.bing.com/th?id=OVFT.HDjBwDRFXU1DI6Gz11hUAi,Chile,La Prensa Chicos
Canciller Rosales: Gobierno afina detalles del contrato para vacuna Sputnik V,https://www.latribuna.hn/2021/03/08/canciller-rosales-gobierno-afina-detalles-del-contrato-para-vacuna-sputnik-v/,"El canciller Lisandro Rosales, informó el domingo que el gobierno sigue ultimando detalles sobre el contrato para la adquisición de",08-03-2021 10:20,https://www.bing.com/th?id=OVFT.c-zLN6tuoLrODo43_r_-XC,Chile,La Tribuna
AUTORIDADES DE UNAH CONFIRMAN GESTIÓN PARA QUE HONDURAS TENGA ACCESO A VACUNA CHINA E INDIA CONTRA EL COVID-19,https://ultimahora.hn/autoridades-de-unah-confirman-gestion-para-que-honduras-tenga-acceso-a-vacuna-china-e-india-contra-el-covid-19/,"La Universidad Nacional Autónoma de Honduras, realiza gestiones para encaminar a Honduras en la adquisición de la vacuna china contra el coronavirus, informaron autoridades del alma mater. El",08-03-2021 14:06,https://www.bing.com/th?id=OVFT.iKNE25Pafb5QUGmDqEwATS,Chile,Ultima Hora
Alerta COVID-19: ¿Hay circulación por dígitos hoy lunes?,https://tiempo.hn/digitos-circulacion-lunes-marzo/,"Ante el aumento de casos de la COVID-19, el Gobierno definió nuevas medidas de circulación. Estos números circulan hoy, lunes TEGUCIGALPA, HONDURAS. Ante el aumento de casos de la COVID-19, el Gobiern",08-03-2021 14:52,https://www.bing.com/th?id=OVFT.QcDXe8dw_VGNdoKH2H4Ity,Chile,Tiempo
Reportan nueve decesos con sospecha de COVID-19 en hospitales de Honduras,https://proceso.hn/reportan-nueve-decesos-con-sospecha-de-covid-19-en-hospitales-de-honduras/,"Al menos nueve personas han perdido la vida por causa de la COVID-19 en las últimas horas, según informaron autoridades de los centros asistenciales de la capital y de la zona norte de Honduras.",08-03-2021 16:15,https://www.bing.com/th?id=OVFT.JZeChZ8tks8uf0evgOSRPy,Chile,Proceso
Comité COVID-19 de la UNAH recomienda a Arsa aprobar uso de la vacuna AstraZeneca,https://proceso.hn/comite-covid-19-de-la-unah-recomienda-a-arsa-aprobar-uso-de-la-vacuna-astrazeneca/,"El comité COVID-19 de la Universidad Nacional Autónoma de Honduras (UNAH), recomendó este lunes a la Agencia de Regulación Sanitaria (Arsa), aprobar la vacuna Covishield para la prevención de la",08-03-2021 17:27,https://www.bing.com/th?id=OVFT.RUkxmWj2RpdPSvnZmKaw2y,Chile,Proceso
"Pese al COVID, reportan masivas visitas a playas; cuatro personas casi se ahogan",https://tiempo.hn/playas-covid-19-honduras-cuatro-rescatados/,"HONDURAS. Cuatro bañistas rescatados y un quinto que fue atacado por pez que se le incrustó en la espalda, el Cuerpo de Bomberos reportó alta incidencia en las playas del país, principalmente en Puert",08-03-2021 17:47,https://www.bing.com/th?id=OVFT.DW99erve842A5IPjA60AIi,Chile,Tiempo
"Fallece destacado médico y exministro de Salud, Enrique Samayoa",https://www.latribuna.hn/2021/03/08/fallece-destacado-medico-y-exministro-de-salud-enrique-samayoa/,"El reconocido médico y exministro de Salud Pública, Enrique Samayoa, murió en las últimas horas por supuestas complicaciones relacionadas al",08-03-2021 17:57,https://www.bing.com/th?id=OVFT._8xjhnWoBaVtFto5v5lylC,Chile,La Tribuna
