name,url,description,datePublished,imagen,pais,Fuente
"Muere de covid la madre del fallecido diputado hondureño Francisco Paz, un mes después de despedir a su hijo",https://www.radiohrn.hn/muere-de-covid-la-madre-del-fallecido-diputado-hondureno-francisco-paz-un-mes-despues-de-despedir-a-su-hijo,"Se trata de Egla de Jesús Laínez, quien estuvo en condición crítica a causa del mortal virus, según se detalló. La madre del extinto diputado por el Partido Libertad y Refundación ( Libre), Francisco",31-08-2020 00:00,https://www.bing.com/th?id=ON.44F061D2A190643E709082B40B563CCD,Chile,Radio HRN
El podcast con las noticias de Honduras y el mundo del lunes 31 de agosto,https://www.laprensa.hn/podcasts/1405148-410/noticias-honduras-hospitales-investh-coronavirus-covid-19-trump-protestas-liga-espa%C3%B1a,"Podcast con el resumen de noticias que fueron tendencia en Honduras y el mundo el lunes 31 de agosto. San Pedro Sula, Honduras Este es el resumen de las principales noticias de Honduras y el mundo del",31-08-2020 00:00,https://www.bing.com/th?id=ON.C94B8C9F0CC1DFA6095A34D932EF31A9,Chile,La Prensa Chicos
Honduras registra 529 nuevos contagios de coronavirus,https://www.laprensa.hn/videos/?mId=i0tq2Yk5&c=US&c=US&c=US&c=US&c=U,"Este domingo Honduras el Laboratorio Nacional de Virología de Honduras practicó 1,169 pruebas PCR para detectar Covid-19, resultando 529 positivas y 640 negativas. Con los resultados de hoy el total d",31-08-2020 03:22,https://www.bing.com/th?id=ON.B29E4649C96BE4EA11E6A069FC33BA6D,Chile,La Prensa Chicos
Platense convoca a su plantilla para somerterse a las pruebas covid-19 de cara al inicio de pretemporada,https://www.diez.hn/liganacionaldehonduras/1405029-498/platense-convoca-a-su-plantilla-para-somerterse-a-las-pruebas-covid-19-de,Platense será el último equipo en iniciar su pretemporada de cara al torneo Apertura 2020. Real Sociedad y Real de Minas inician este lunes. Honduras Progreso el martes. La Liga Nacional confirmó este,31-08-2020 04:21,https://www.bing.com/th?id=ON.6ACD8269D63CBA49CD8B279231BE7FD9,Chile,diez.hn
Finanzas en orden y calidad del gasto es la fórmula para encarar crisis en Honduras,https://www.radiohrn.hn/finanzas-en-orden-y-calidad-del-gasto-es-la-formula-para-encarar-crisis-en-honduras,"Los analistas, principalmente los versados en economía y finanzas, concuerdan en que Honduras no tiene un plan de contingencias para reencauzar al país y reactivar su corazón productivo. Un balance fi",31-08-2020 14:00,https://www.bing.com/th?id=ON.CE0EB186A88CD5877EB9323A6B8868B8,Chile,Radio HRN
El torneo de fútbol hondureño vuelve el 26 de septiembre con un nuevo formato,https://www.proceso.hn/el-torneo-de-futbol-hondureno-vuelve-el-26-de-septiembre-con-un-nuevo-formato/,Tegucigalpa – El torneo Apertura del fútbol hondureño comenzará el 26 de septiembre con diez equipos y un nuevo formato tras casi cinco meses de inactividad debido a la pandemia de la COVID-19 que ha,31-08-2020 16:02,https://www.bing.com/th?id=ON.07978FAA775D8375E87DEEA331DF0778,Chile,Proceso
Un millón 900 mil personas prioritarias en plan de vacunación contra COVID-19,https://www.latribuna.hn/2020/08/31/un-millon-900-mil-personas-prioritarias-en-plan-de-vacunacion-contra-covid-19/,"A medida avanzan las investigaciones y experimentos a nivel mundial para el encuentro de una vacuna eficaz contra la COVID-19, Honduras se prepara por medio de un equipo de integración nacional para l",31-08-2020 16:18,https://www.bing.com/th?id=ON.B9E38B7E947BABD6F6B342E64A0E4FD3,Chile,La Tribuna
Aumentan muertes por COVID-19 en Tegucigalpa,https://hondudiario.com/2020/08/31/aumentan-muertes-por-covid-19-en-tegucigalpa/,"*** Días luego de que la ciudad capital reportó un día libre de muertes sospechosas por coronavirus, se reportan casos y muertes. Tegucigalpa, Honduras. Los hospitales de la ciudad capital de la nació",31-08-2020 19:38,https://www.bing.com/th?id=ON.B7ADC6F98E0083E722E9F9652156BC5B,Chile,Hondudiario
INM: Honduras trabaja en una nueva política migratoria,https://www.latribuna.hn/2020/08/31/inm-honduras-trabaja-en-una-nueva-politica-migratoria/,"La Directora del Instituto Nacional de Migración–INM, Carolina Menjivar, declaró este lunes que Honduras trabaja en la elaboración de una nueva política migratoria integral. La formulación de esta nue",31-08-2020 19:50,https://www.bing.com/th?id=ON.F40715664FE4859BF66B380EB1412E2C,Chile,La Tribuna
"Alianzas estratégicas entre actores locales, municipales y educativos",http://www.elsoldehonduras.com/educacion/alianzas-estrategicas-entre-actores-locales-municipales-y-educativos/,Las alianzas con actores de los municipios de Comayagua han fortalecido los procesos de enseñanza durante la pandemia de la COVID-19 informaron este día las autoridades de la Secretaría de Educación.,01-09-2020 00:32,https://www.bing.com/th?id=ON.B7A92A294DF1B658F95F65B7C63C07A2,Chile,El Sol de Honduras
Honduras trabaja en una nueva política migratoria integral,https://hondudiario.com/2020/08/31/honduras-trabaja-en-una-nueva-politica-migratoria-integral/,"La directora del Instituto Nacional de Migración (INM), Carolina Menjivar, declaró este lunes que Honduras trabaja en la elaboración de una nueva política migratoria integral. La formulación de esta n",01-09-2020 00:53,https://www.bing.com/th?id=ON.DF876D09ECA611B245FF7D3E43B72B31,Chile,Hondudiario
