name,url,description,datePublished,imagen,pais,Fuente
"Lobos – Motagua, reactivan la Liga Nacional",https://www.diariomas.hn/2020/09/26/lobos-motagua-reactivan-la-liga-nacional/,"El fútbol vuelve a casa, después de seis meses de incertidumbre y ansiedad por disfrutar de un partido de nuestra Liga Profesional que había tenido",26-09-2020 15:00,https://www.bing.com/th?id=OVFT.4MVqiExOYTDYRAWQdLk3bi,Chile,Mas
Primer clásico en plena pandemia,https://www.diariomas.hn/2020/09/27/primer-clasico-en-plena-pandemia/,La emoción del fútbol de la Liga Profesional de Honduras continúa esta noche con el primer clásico de la temporada en medio de la pandemia de la Covid,27-09-2020 15:01,https://www.bing.com/th?id=OVFT.owdRjxyRhmWBHmaOctHlxS,Chile,Mas
EN VIVO: Olimpia recibe en el Nacional de Tegucigalpa al Real de Minas,https://www.diez.hn/liganacionaldehonduras/1413926-498/olimpia-real-minas-en-vivo-liga-nacional-online-honduras,¡Bienvenidos al minuto a minuto del Olimpia - Real de Minas! Ver más: Calendario + Tablas de posiciones de la Liga Nacional de Honduras. EL JUEGO: Olimpia - Real de Minas. Real,07-10-2020 00:00,https://www.bing.com/th?id=OVFT.222BIZxrXqK2n7LS9znswy,Chile,diez.hn
"Honduras reporta 14 fallecidos por coronavirus y suma ya 2,466",https://www.laprensa.hn/especiales/coronavirus/1413915-410/coronavirus-contagios-muertes-honduras-pandemia-,"Los fallecidos por coronavirus son de Francisco Morazán con cinco, Copán con tres, Intibucá dos, El Paraíso dos, Comayagua, La Paz, Lempira y Valle uno.",07-10-2020 00:00,https://www.bing.com/th?id=OVFT.tewfOVq8jcJy7Yz0GS-tVy,Chile,La Prensa Chicos
"Coronavirus: Honduras reporta un total de 81,160 casos de covid-19",https://www.radiohrn.hn/coronavirus-honduras-reporta-un-total-de-81160-casos-de-covid-19,"Francis Contreras, vocero del Sistema Nacional de Gestión de Riesgos (Sinager), detalló el miércoles (7.10.2020) que Honduras reportó 498 nuevos pacientes de coronavirus (covid-19), que aumentan el to",07-10-2020 00:00,https://www.bing.com/th?id=OVFT.UXAbb2DvioGWYk-eylaXcS,Chile,Radio HRN
"Casi 2,800 presos liberados en Honduras por COVID-19, que deja 2,433 muertos",https://proceso.hn/casi-2800-presos-liberados-en-honduras-por-covid-19-que-deja-2433-muertos/,"Tegucigalpa – Un total de 2,773 presos han sido excarcelados en Honduras como parte de las medidas que el país está implementando en las prisiones para evitar la propagación del coronavirus, del que y",07-10-2020 00:14,https://www.bing.com/th?id=OVFT.9VbkKs5oDPKI3f0024jfny,Chile,Proceso
"Honduras llega a 80,662 contagiados y 2,447 decesos por COVID-19",https://proceso.hn/honduras-llega-a-80662-contagiados-y-2447-decesos-por-covid-19/,"Tegucigalpa – Honduras alcanzó este martes los 80 mil 662 contagiados y 2 mil 447 fallecimientos por COVID-19 en 211 días de pandemia, informó el Sistema Nacional de Gestión de Riesgos (Sinager). -La",07-10-2020 02:13,https://www.bing.com/th?id=OVFT.u9JkyLynAhoCKliIGs3f2S,Chile,Proceso
Los hondureños cambian sus patrones de consumo,https://www.latribuna.hn/2020/10/07/los-hondurenos-cambian-sus-patrones-de-consumo/,"La crisis económica por la pandemia de la COVID-19 modifica los patrones de consumo de los hondureños, en seis meses los cambios se observan en menores importaciones de bienes suntuarios, así lo expon",07-10-2020 08:33,https://www.bing.com/th?id=OVFT.-0UhZNVMW3dfCx7OoaA0oi,Chile,La Tribuna
China Meheco ya recibió 150 millones de lempiras,https://www.elheraldo.hn/pais/1413680-466/china-meheco-ya-recibi%C3%B3-150-millones-de-lempiras,"En el detalle del documento se especificó que el dinero corresponde a la “Factura proforma conforme al 40% entregada, pendiente factura por el 60% conforme a la solicitud de pago”",07-10-2020 12:42,https://www.bing.com/th?id=OVFT.YNG2Xik5ywMdWP3fXeXjWy,Chile,El Heraldo
En un 14% subirá la exportación de café en la nueva cosecha,https://www.elheraldo.hn/economia/1413686-466/en-un-14-subir%C3%A1-la-exportaci%C3%B3n-de-caf%C3%A9-en-la-nueva-cosecha,"El Instituto Hondureño del Café (Ihcafé) estima que se exportarán 8.2 millones de quintales, de una cosecha total de 8.9 millones, lo que generará unos 1,000 millones de dólares, que equivale a más de",07-10-2020 13:10,https://www.bing.com/th?id=OVFT.QTL36co7mNxAlZ9taOTRry,Chile,El Heraldo
Preocupación por aumento de casos covid-19 alerta roja en nueve colonias del Distrito Central Centro Penitenciario de Támara,https://ultimahora.hn/preocupacion-por-aumento-de-casos-covid-19-alerta-roja-en-nueve-colonias-del-distrito-central-centro-penitenciario-de-tamara/,"El jefe de la Región Metropolitana de Salud del Distrito Central, Harry Bock, informó que nueve colonias del Distrito Central (Comayaguela y Tegucigalpa, conjuntamente) han entrado en alerta roja",07-10-2020 14:03,https://www.bing.com/th?id=OVFT.jF4uvvtLpLzOoEiPM2ykVi,Chile,Ultima Hora
Primera Dama:“Debemos incrementar medidas de bioseguridad para evitar rebrotes de la COVID-19”,https://ultimahora.hn/primera-damadebemos-incrementar-medidas-de-bioseguridad-para-evitar-rebrotes-de-la-covid-19/,"Continuar con las medidas de distanciamiento social y respetar las medidas de bioseguridad, solicitó la primera dama, Ana García de Hernández, durante las actividades de entrega de beneficios de",07-10-2020 14:29,https://www.bing.com/th?id=OVFT.wcLkASOrabJCLPgOuqdBWS,Chile,Ultima Hora
OFICIAL: El Desportivo Chaves anuncia el fichaje del hondureño Jonathan Rubio,https://www.diez.hn/legionarios/1413805-498/jonathan-rubio-nuevo-jugador-desportivo-chaves-segunda-division-portugal-fichaje,"Tal como adelantó DIEZ en exclusiva, Jonathan Rubio es anunciado como el nuevo jugador del Desportivo Chaves de Portugal.",07-10-2020 18:26,https://www.bing.com/th?id=OVFT.lK8U1S1aBQ7_LYz8a7WjyS,Chile,diez.hn
"Subempleo crece más de un millón de personas en Honduras y suma 2,4 millones",https://www.latribuna.hn/2020/10/07/subempleo-crece-mas-de-un-millon-de-personas-en-honduras-y-suma-24-millones/,"La tasa de subempleo en Honduras aumentó entre 2009 y 2019 en más de un millón de personas, hasta alcanzar los 2,4 millones de subempleados, lo que supone el 63 % de la población económicamente activa",07-10-2020 18:41,https://www.bing.com/th?id=OVFT.F5rE21EHV9sUI_451v5B1C,Chile,La Tribuna
Cómo seguir la evolución de la COVID-19,http://www.eldiario.hn/como-seguir-la-evolucion-de-la-covid-19/,"Honduras. - Cuando alguien se infecta con el virus SARS-CoV-2 que causa la enfermedad del coronavirus COVID-19, puede sentirse de varias maneras distintas. Algunas personas están completamente asintom",07-10-2020 22:01,https://www.bing.com/th?id=OVFT.OJZHQL7EKwuWobsFcWTpSy,Chile,El Diario
Honduras continúa como el país de CA que menos pruebas COVID aplica,https://hondudiario.com/2020/10/07/honduras-continua-como-el-pais-en-ca-que-menos-pruebas-covid-aplica/,"***El panorama general del COVID-19 en Honduras al finalizar septiembre indicó que, solamente al 1.95% de la población se le han aplicado pruebas para detección del virus. Un grupo de investigadores a",07-10-2020 22:36,https://www.bing.com/th?id=OVFT.CjZ76OYohBFDsUM3m0stji,Chile,Hondudiario
Grupo Jaremar presente en el Congreso Industrial Virtual “El Futuro de la Industria en tiempos de Covid-19”,https://hondudiario.com/2020/10/07/grupo-jaremar-presente-en-el-congreso-industrial-virtual-el-futuro-de-la-industria-en-tiempos-de-covid-19/,"M ediante conferencia de prensa virtual, la Asociación Nacional de Industriales ANDI, realizó el lanzamiento de su primer congreso en modalidad digital, bajo el tema: “El Futuro de la Industria en Tie",07-10-2020 23:08,https://www.bing.com/th?id=OVFT.sVObxTzHaGYH7j3Tt8-LuS,Chile,Hondudiario
