name,url,description,datePublished,imagen,pais,Fuente
Presidente Bukele entrega viviendas a 252 familias afectadas por lluvias,https://notibomba.com/presidente-bukele-entrega-viviendas-a-252-familias/,"Se informó que los fondos son parte de los excedentes de un hospital dedicado exclusivamente al tratamiento de Covid-19. Mientras en El Salvador se entregan las muy bien acondicionadas casas, en Honduras los hospitales móviles aún no funcionan.",21-12-2020 23:59,https://www.bing.com/th?id=OVFT.O80CFHKi1QOF03eBnqyRCy,Chile,Noti Bomba
Carlos Madero: Honduras podría volver al confinamiento en enero,https://tiempo.hn/carlos-madero-honduras-podria-volver-al-confinamiento-en-enero/,"Carlos Madero dijo que Honduras podría volver al confinamiento en enero de 2021, debido al ascenso desproporcionado de casos de COVID-19. TEGUCIGALPA, HONDURAS. El ministro Coordinador General de Gobi",22-12-2020 02:23,https://www.bing.com/th?id=OVFT.HYmy7MqPKA8DxaHJRYYI7S,Chile,Tiempo
Informe CEPAL: Eta y Iota tuvieron un impacto de más de 45 mil millones de lempiras en Honduras,http://www.elsoldehonduras.com/nacionales/informe-cepal-eta-y-iota-tuvieron-un-impacto-de-mas-de-45-mil-millones-de-lempiras-en-honduras/,Tegucigalpa Un informe hecho por la Comisión Económica para América Latina y el Caribe (CEPAL) de las Naciones Unidas reveló que las tormentas Eta y Iota en Honduras tuvieron un impacto de 45.676 mill,22-12-2020 03:00,https://www.bing.com/th?id=OVFT.1Dw5CXcyL2zNsgOftRQEdC,Chile,El Sol de Honduras
Honduras acumula 3.034 muertos y 117.190 casos de coronavirus,https://www.latribuna.hn/2020/12/21/honduras-acumula-3-034-muertos-y-117-190-casos-de-coronavirus/,"Honduras sumó este lunes 168 nuevos casos del coronavirus SARS-CoV-2 y registró siete muertes más por la enfermedad de la covid-19, lo que eleva a 117.190 contagios confirmados y 3.034 los fallecidos,",22-12-2020 03:41,https://www.bing.com/th?id=OVFT.UiwNnLjraBmqBk2H0ZVqWS,Chile,La Tribuna
"Honduras reporta el fallecimiento de 3,034 personas a causa del covid",https://www.radiohrn.hn/honduras-reporta-el-fallecimiento-de-3034-personas-a-causa-del-covid,"Honduras registra más de 117,000 infectados por el coronavirus a nivel nacional El Sistema Nacional de Gestión de Riesgos (Sinager) confirmó el lunes (21.12.2020) el fallecimiento de 7 personas más, p",22-12-2020 03:58,https://www.bing.com/th?id=OVFT.SJwH3N5gQMDc6axIza5zXi,Chile,Radio HRN
"Bajo estas tres condiciones estaría Honduras durante todo el 2021 ante nueva cepa de covid, advierte exministra de Salud",https://www.radiohrn.hn/bajo-estas-tres-condiciones-estaria-honduras-durante-todo-el-2021-ante-mutaciones-de-covid-revela-exministra-de-salud,"La exministra de Salud e infectóloga, Elsa Palou, vaticinó el lunes (21.12.2020) que ""yo miro el futuro de Honduras con la vacuna, el uso ivermectina como profiláctico y las medidas de bioseguridad co",22-12-2020 04:02,https://www.bing.com/th?id=OVFT.S5q0vEcX2SzV7LyYOi1yiS,Chile,Radio HRN
Marathón recupera al portero Denovan Torres y John Paul Suazo quienes ya superaron el coronavirus,https://www.diez.hn/liganacionaldehonduras/1431012-498/marathon-recupera-denovan-torres-john-paul-suazo-coronavirus-final-olimpia,Ambos futbolistas serán de la partida el miércoles frente al Olimpia en la final de ida de grupos del Apertura.,22-12-2020 04:20,https://www.bing.com/th?id=OVFT.cMyjOCYdxS2V5hjM6HQ_Ni,Chile,diez.hn
Estrategia general contra el COVID-19 ha tenido aciertos,https://www.latribuna.hn/2020/12/22/estrategia-general-contra-el-covid-19-ha-tenido-aciertos/,"El exministro de Salud, Carlos Aguilar, reconoció que la estrategia general contra el COVID-19 ha tenido sus aciertos, los cuales se deben fortalecer, pero los errores hay que corregirlos. Se informó",22-12-2020 10:40,https://www.bing.com/th?id=OVFT.sdNqQiOlGTTq8-uvLgcuBS,Chile,La Tribuna
Honduras: El Paraíso tiene 30% de positividad de covid-19,https://www.elheraldo.hn/pais/1430990-466/honduras-el-para%C3%ADso-tiene-30-de-positividad-de-covid-19,"LEA TAMBIÉN: ¿Cuál es la cifra real de muertos por covid-19 en Honduras? Los municipios donde se han realizado más pruebas son Danlí, con 8,447; El Paraíso con 1,427; Trojes con 935 y Teupasenti con 770. En el caso de Danlí tiene la tasa de ...",22-12-2020 13:01,https://www.bing.com/th?id=OVFT.s-msBB_GIg8RM96CqWTqzS,Chile,El Heraldo
Honduras: Salud bajo alerta por nueva cepa de covid-19,https://www.elheraldo.hn/pais/1430980-466/honduras-salud-bajo-alerta-por-nueva-cepa-de-covid-19,"El gobierno de Honduras, desde el Laboratorio Nacional de Virología (LNV), se encuentra en una estricta vigilancia de los cambios que se puedan presentar en el país ante la presencia en el mundo de una nueva cepa del covid-19, considerada mucho más ...",22-12-2020 13:01,https://www.bing.com/th?id=OVFT.vihc6Skty1D7B5h3JvhLlS,Chile,El Heraldo
"Presidente Hernández:Eta, Iota y la pandemia constituyen el efecto más devastador de la historia del país",https://ultimahora.hn/presidente-hernandezeta-iota-y-la-pandemia-constituyen-el-efecto-mas-devastador-de-la-historia-del-pais/,"El presidente Juan Orlando Hernández declaró hoy que las tormentas Eta y Iota más la pandemia de covid-19 constituyen el efecto más devastador de la historia de Honduras, dejando un impacto",22-12-2020 14:01,https://www.bing.com/th?id=OVFT.kmDy5tsFiV7diw5-4m_Xfi,Chile,Ultima Hora
Semana navideña: ¿Quiénes pueden circular hoy martes en Honduras?,https://tiempo.hn/quienes-pueden-circular-hoy-martes-en-honduras/,"Hoy todos los hondureños pueden circular en Honduras. TEGUCIGALPA, HONDURAS. En víspera de una Navidad atípica por la pandemia del COVID-19, sumado a dos desastres naturales, las calles, mercados y ce",22-12-2020 14:02,https://www.bing.com/th?id=OVFT.TJkPCluauK5CNQ_gkb-5Si,Chile,Tiempo
"La COVID-19 cobra una vida más, según reporte diario de hospitales capitalinos",https://proceso.hn/la-covid-19-cobra-una-vida-mas-segun-reporte-diario-de-hospitales-capitalinos/,"En tanto, se registran los egresos hospitalarios de nueve pacientes de las diferentes Salas COVID-19 y 29 recuperados por otras enfermedades. El IHSS capitalino, desde que ingresó la pandemia a Honduras el pasado 11 de marzo, registra: un deceso en marzo ...",22-12-2020 15:02,https://www.bing.com/th?id=OVFT.bFxX5iQ9gFe79rzRHR9-ui,Chile,Proceso
Nueva cepa de COVID podría llegar a Honduras según la Jefa de Laboratorio de Virología,https://hondudiario.com/2020/12/22/nueva-cepa-de-covid-podria-llegar-a-honduras-segun-la-jefa-de-laboratorio-de-virologia/,"La jefa del Laboratorio Nacional de Virología, la doctora Mitzi Castro, indicó que  no descarta que la nueva cepa del coronavirus identificada en Reino Unido pueda llegar a Honduras en algún momento d",22-12-2020 15:30,https://www.bing.com/th?id=OVFT.mdaZH97plj8zAvvwKkcegy,Chile,Hondudiario
"Guatemala añade 32 muertes por covid-19 y acumula 4,688 decesos desde marzo",https://www.laprensa.hn/mundo/1431048-410/guatemala-anade-muertes-por-covid-acumule-decesos-marzo,"Guatemala contabilizó este lunes la muerte de 32 personas por la covid-19 y suma 4.688 decesos en total por el coronavirus ... seguido por Panamá y Honduras, cada uno rondando los 3,500 y 3,000 decesos, respectivamente. La cifra total de muertes por ...",22-12-2020 16:19,https://www.bing.com/th?id=OVFT.TxH9kTD7QuyS4yoKyyThqi,Chile,La Prensa Chicos
"Cifras sobre pérdidas se quedan “cortas” ante los daños que dejaron de Eta e Iota, según economista",https://hondudiario.com/2020/12/22/cifras-sobre-perdidas-se-quedan-cortas-ante-los-danos-que-dejaron-de-eta-e-iota-segun-economista/,"Según el informe de la Cepal, el impacto económico que dejaron los fenómenos naturales, son de más de 45 mil millones de lempiras, a esto se le suma los daños de la pandemia de COVID-19 que el Banco Central de Honduras (BCH), estima son más 55 mil ...",22-12-2020 16:31,https://www.bing.com/th?id=OVFT.pEhBjO79bOpvaZ485e9ECS,Chile,Hondudiario
La pandemia destruye 500.000 empleos en Honduras y obliga a cerrar MiPymes,https://proceso.hn/la-pandemia-destruye-500-000-empleos-en-honduras-y-obliga-a-cerrar-mipymes/,"Tegucigalpa – La pandemia de covid-19 y las medidas de confinamiento han destruido más de 500.000 empleos en Honduras, donde el sector turismo es el más golpeado y ocho de cada diez empresas han disminuido sus ventas, alertó este martes el Instituto ...",22-12-2020 17:39,https://www.bing.com/th?id=OVFT.G68-W88rOMp_jezlR_dnZi,Chile,Proceso
En 10% aumentan las atenciones en triajes en Francisco Morazán,https://ultimahora.hn/en-10-aumentan-las-atenciones-en-triajes-en-francisco-morazan/,"La coordinadora de la emergencia por la COVID-19 en Francisco Morazán, Yolani Batres, informó que en un 10 por ciento ha aumentado las atenciones en los triajes en los últimos días. Solo en los",22-12-2020 17:46,https://www.bing.com/th?id=OVFT.MH1sQp4ls8uvxXbEyJvz5i,Chile,Ultima Hora
Honduras recibe donación de Alemania para mejorar atención de migrantes retornados,https://www.laprensa.hn/honduras/1431076-410/honduras-alemania-donacion-cancilleria-atencion-migrantes-retornados,"Tegucigalpa, Honduras. El Gobierno de Alemania, a través de su embajador en el país, Jens Janik, entregó a Honduras por medio de la Cancillería, una donación que será destin",22-12-2020 18:02,https://www.bing.com/th?id=OVFT.lNX66nttmz3J0TXF1wtQ2S,Chile,La Prensa Chicos
