name,url,description,datePublished,imagen,pais,Fuente
"Cádiz derrotó al Huesca con gol de Negredo, Choco Lozano no jugó y solo suma 19 minutos en LaLiga",https://www.diez.hn/legionarios/1409642-498/cadiz-liga-espanola-en-vivo-online-transmision-visita-huesca-choco-lozano,"EN DIRECTO| Cádiz está visitando al Huesca por la jornada 2 de la liga española en el estadio El Alcoraz. 53' Tres cambios en el Huesca: Se marchan Rafa Mir, Juan Carlos y Eugeni, entran Sergio Gómez,",19-09-2020 00:00,https://www.bing.com/th?id=OVFT.22WQFeS62JTrcVx-s2qz3i,Chile,diez.hn
"Honduras reporta 71,143 casos de covid a nivel nacional, pero solo 47,797 permanecen activos",https://www.radiohrn.hn/honduras-reporta-71143-casos-de-covid-a-nivel-nacional-pero-solo-47797-permanecen-activos,"Las autoridades hondureñas reportan hasta el sábado 19 de septiembre 47 mil 797 casos activos de covid-19, según datos brindados por el Sistema Nacional de Gestión de Riesgos (Sinager), no obstante, e",19-09-2020 00:00,https://www.bing.com/th?id=OVFT.RB_2GAh7zgITXejJ4ktiGy,Chile,Radio HRN
"Honduras se acerca a los 2,200 fallecidos por covid-19",https://www.laprensa.hn/honduras/1409656-410/honduras-sinager-fallecidos-coronavirus-covid-19-salud,"Hoy se reportaron 532 nuevos contagiados por coronavirus. San Pedro Sula, Honduras. Las cifras de contagiados y fallecidos por coronavirus sigan aumentando en Honduras. Esta noche se reportó la muerte",19-09-2020 00:00,https://www.bing.com/th?id=OVFT.bwHJgoLc18aHVMk77ZD3HC,Chile,La Prensa Chicos
Continúan los contagios por Covid-19 en Honduras sumando 491nuevos casos y 24 muertes,https://hondudiario.com/2020/09/18/continuan-los-contagios-por-covid-19-en-honduras-sumando-491nuevos-casos-y-24-muertes/,"Autoridades del Sistema Nacional de Gestión de Riesgos (Sinager), reportaron este viernes que el total de casos positivos de Covid-19 es de 491 de 1,204 pruebas procesadas por el Laboratorio de Virolo",19-09-2020 02:48,https://www.bing.com/th?id=OVFT.alv346qb9_hwpUdAMTGw5C,Chile,Hondudiario
Inician construcción de laboratorio para procesar muestras PCR en La Ceiba,https://www.laprensa.hn/honduras/1409462-410/inician-construccion-laboratorio-pcr-la-ceiba-honduras,"El costo del proyecto es de L3.4 millones financiados por la Agencia de los Estados Unidos para el Desarrollo (USAID). La Ceiba, Honduras. Un laboratorio de virología para el procesamiento de muestras",19-09-2020 06:31,https://www.bing.com/th?id=OVFT.9cvZxu8xNyVOep-ajanabi,Chile,La Prensa Chicos
UNAH cancela graduaciones y PAA ante amenaza de COVID-19 en Honduras,https://proceso.hn/unah-cancela-graduaciones-y-paa-ante-amenaza-de-covid-19-en-honduras/,"Tegucigalpa – La Universidad Nacional Autónoma de Honduras (UNAH) anunció este miércoles, a través de un comunicado oficial, la suspensión de las graduaciones y la aplicación de la Prueba Aptitud Acad",19-09-2020 08:21,https://www.bing.com/th?id=OVFT.NARRdN0Z_jB8WnQ8IuAJtS,Chile,Proceso
Investigadores hondureños presentan radiografía del COVID-19 en Honduras.,https://www.latribuna.hn/2020/09/19/investigadores-hondurenos-presentan-radiografia-del-covid-19-en-honduras/,"Un grupo de Investigadores hondureños asociados al Observatorio de COVID-19 y dengue, presentó recientemente en Tegucigalpa, capital de Honduras, un nuevo informe de datos relevantes sobre la pandemia",19-09-2020 13:01,https://www.bing.com/th?id=OVFT.WEL3mf_rA3A33LlRL5GiHC,Chile,La Tribuna
"Honduras alcanza 71,143 casos y 2,166 decesos por COVID-19",https://proceso.hn/honduras-alcanza-71143-casos-y-2166-decesos-por-covid-19/,"Tegucigalpa –Honduras acumula este sábado 71 mil 143 contagios y dos mil 166 fallecimientos, confirmó el Sistema Nacional de Gestión de Riesgos (Sinager), tras cumplirse 193 días de pandemia. -La tasa",20-09-2020 02:32,https://www.bing.com/th?id=OVFT.r1tvsD2ZvnGwjNid8YwNZC,Chile,Proceso
Maestro le canta a la esperanza pese a crisis por covid-19,https://www.elheraldo.hn/pais/1409663-466/maestro-le-canta-a-la-esperanza-pese-a-crisis-por-covid-19,"COMAYAGUA, HONDURAS.-“Con la fe en mi Dios nos volveremos a encontrar para valorar la segunda oportunidad, vamos todos juntos como hermanos, a Honduras hay que levantar”. Así de esperanzador es el men",20-09-2020 06:53,https://www.bing.com/th?id=OVFT.jmrhyyC2GlRBbhwW0nVVlS,Chile,El Heraldo
Honduras: Solo el 2.5 por ciento de mujeres agredidas acude al Juzgado,https://www.elheraldo.hn/pais/1409665-466/violencia-domestica-mujer-pandemia-honduras-denuncias,"TEGUCIGALPA, HONDURAS.-La violencia doméstica contra la mujer se ha agudizado en tiempos de la pandemia provocada por el covid-19 en Tegucigalpa y San Pedro Sula. Un recuento del Sistema de Emergencia",20-09-2020 07:05,https://www.bing.com/th?id=OVFT.rxOcXp5yt4xWDv2CFg68jS,Chile,El Heraldo
Hondureño de 105 años vence al COVID-19 en Choluteca,https://www.latribuna.hn/2020/09/20/hondureno-de-105-anos-vence-al-covid-19-en-choluteca/,"Uno de los hombres más longevos de Honduras que había resultado contagiado de COVID-19, salió victorioso de la batalla contra la letal enfermedad. Se trata del maestro jubilado Fernando Rodríguez Joya",20-09-2020 15:21,https://www.bing.com/th?id=OVFT.ayucL-ar06GQhYVCHV7JRC,Chile,La Tribuna
