name,url,description,datePublished,imagen,pais,Fuente
COVID-19: SINAGER confirma 674 nuevos casos y ocho fallecimientos,https://tiempo.hn/sinager-nuevos-casos-covid-19-honduras-2/,"Las autoridades del Sistema Nacional de Gestión de Riesgo ( SINAGER ), informaron este domingo que el incremento de casos no cesa y es que de 1,588 nuevas pruebas para diagnosticar el virus, 674 resul",11-01-2021 03:19,https://www.bing.com/th?id=OVFT.OzMBAn5XI0HK9rDjcaUiTS,Chile,Tiempo
Honduras vuelve al toque de queda tras incrementarse los contagios por Covid-19,https://www.diez.hn/noticiasdelmundo/1434861-498/coronavirus-honduras-covid-contagios-toque-queda-policia-nacional,"Desde este domingo entra en vigor el toque de queda en todo el territorio hondureño, según comunicaco de la Policía Nacional.",11-01-2021 06:07,https://www.bing.com/th?id=OVFT.zd--Bnv01S3vEMK7CMXpiC,Chile,diez.hn
"Honduras acumula 3,273 fallecidos y 127,945 casos de covid-19",https://www.laprensa.hn/honduras/1434913-410/honduras-acumula-3273-fallecidos-127945-casos-coronavirus-inicio-pandemia,"Honduras el domingo 674 nuevos contagios de covid-19 y registró ocho muertes más por la enfermedad, lo que eleva a 127,945 contagios confirmados y 3,273 los fallecidos, informaron las autoridades hond",11-01-2021 14:37,https://www.bing.com/th?id=OVFT.0Ce3C9KaylqjlXHRYAjX1C,Chile,La Prensa Chicos
Fenafuth anuncia que Reynaldo Tilguath no sigue al frente de la Selección Sub-20 de Honduras,https://www.diez.hn/laseleccion/1434991-498/reynaldo-tilguath-no-sigue-sub-20-honduras-confirma-fenafuth-cancelacion-mundiales,La Federación de Honduras le comunicó a Reynaldo Tilguath que no seguirá al frente de la Sub-20 por la cancelación de los mundiales juveniles.,11-01-2021 19:05,https://www.bing.com/th?id=OVFT._CsAepsCRo50ipthRrFowy,Chile,diez.hn
Con resultado negativo de pruebas COVID-19 llegan a Honduras 135 deportados desde EEUU,https://proceso.hn/con-resultado-negativo-de-pruebas-covid-19-llegan-a-honduras-135-deportados-desde-eeuu/,"Tegucigalpa – Con pruebas que confirman resultados negativos a la COVID-19 llegaron esta mañana 135 hondureños deportados desde Estados Unidos, informó el Instituto Nacional de",11-01-2021 19:27,https://www.bing.com/th?id=OVFT.jLuh6RR44t5IyYcaIG1xDC,Chile,Proceso
Un total de 57 médicos fallecidos por Covid-19 en Honduras,https://hondudiario.com/2021/01/11/un-total-de-57-medicos-fallecidos-por-covid-19-en-honduras/,*** En las últimas horas se reportaron 17 muertos por sospecha de Covid-19 en 24 horas en San Pedro Sula. El presidente de la Asociación de Médicos del Instituto Hondureño de Seguridad Social (IHSS) d,11-01-2021 20:45,https://www.bing.com/th?id=OVFT.LG6sKEPS6UAxuJ1o4gUjCS,Chile,Hondudiario
674 nuevos casos de covid-19 ascendiendo a 127.945 con 59.130 recuperados y3.273 muertes,http://www.elsoldehonduras.com/nacionales/674-nuevos-casos-de-covid-19-ascendiendo-a-127-945-con-59-130-recuperados-y3-273-muertes/,"Tegucigalpa. Los casos de covid-19 en Honduras se elevaron a 127.945 desde el inicio de la pandemia con la confirmación de otros 674 contagios, mientras que los pacientes recuperados aumentaron a 59.1",11-01-2021 20:52,https://www.bing.com/th?id=OVFT.rcFhiIXHRp4GgKm9UFEfgC,Chile,El Sol de Honduras
Honduras y CA de rodillas: mueren más personas por Covid-19 que por crímenes,https://tiempo.hn/covid-19-centroamerica-muertes-violencia/,"Los índices de muertes por Covid-19 se han disparado. HONDURAS. El Covid-19 tomó más fuerza a inicios de 2021, y una prueba inequívoca para tal afirmación es que, en todos los países de Centroamérica,",11-01-2021 21:11,https://www.bing.com/th?id=OVFT.i1MUyVl-yiX828gcnzdYZC,Chile,Tiempo
Hospital San Felipe habilita moderna sala UCI para atender a pacientes con covid-19,http://www.elsoldehonduras.com/salud/hospital-san-felipe-habilita-moderna-sala-uci-para-atender-a-pacientes-con-covid-19/,Tegucigalpa. El Hospital General San Felipe habilitó una nueva y moderna sala de Unidad de Cuidados Intensivos (UCI) con capacidad para atender a seis pacientes que sufran complicaciones por covid-19,11-01-2021 21:36,https://www.bing.com/th?id=OVFT.rcFhiIXHRp4GgKm9UFEfgC,Chile,El Sol de Honduras
Vacuna comprada por el IHSS llegaría en marzo,https://ultimahora.hn/vacuna-comprada-por-el-ihss-llegaria-en-marzo/,"El Director Ejecutivo del Consejo Hondureño de la Empresa Privada (COHEP), Armando Urtecho, informó que para finales de marzo llegarían las vacunas compradas por la empresa privada contra la",11-01-2021 21:42,https://www.bing.com/th?id=OVFT.BCKFaLAj8hyp1HidTdgbJS,Chile,Ultima Hora
"Nueva medida contra el covid, impedirá que niños entren a comercios de Honduras",https://www.radiohrn.hn/nueva-medida-contra-el-covid-impedira-que-ninos-entren-a-comercios-de-honduras,"Las autoridades del Sistema Nacional de Gestión de Riesgo (Sinager), informaron el lunes (11.01.2021) mediante un comunicado de prensa que los niños no podrán ingresar a los comercios habilitados de H",11-01-2021 23:08,https://www.bing.com/th?id=OVFT.rnjVQnvo_eVpHBjCaLDi-S,Chile,Radio HRN
HONDURAS / FÓRMULA COMBUSTIBLES INFLAMA CRISIS ECONÓMICA,http://www.web.ellibertador.hn/index.php/noticias/nacionales/2579-honduras-formula-combustibles-inflama-crisis-economica,"El presidente de la Coalición Patriótica de Solidaridad, Juan Carlos Rodríguez, insta al Gobierno Hernández que replantee la desconocida fórmula que calcula el precio de los carburantes, ya que el paí",12-01-2021 00:31,https://www.bing.com/th?id=OVFT.4D-oadRv5alPvqre2zD4Fi,Chile,El Libertador
Por falta de responsabilidad de la población al incumplir medidas de bioseguridad casos de covid-19 siguen aumentando,http://www.eldiario.hn/por-falta-de-responsabilidad-de-la-poblacion-al-incumplir-medidas-de-bioseguridad-casos-de-covid-19-siguen-aumentando/,"San Pedro Sula. - La Secretaría de Salud advirtió este lunes que Honduras es uno de los países donde van en ascenso los casos de covid-19 a nivel mundial, que han aumentado debido a la falta de respon",12-01-2021 00:35,https://www.bing.com/th?id=OVFT.B-96PeCx1bMhEIGytO91iS,Chile,El Diario
Promedio de muertes diarias por COVID-19 en Honduras asciende a 20,https://hondudiario.com/2021/01/11/promedio-de-muertes-diarias-por-covid-19-en-honduras-asciende-a-20/,"El viceministro de Salud, Roberto Cosenza, confirmó este lunes a diario en los hospitales del país están falleciendo unas 20 personas a causa de la Covid-19, con un notable aumento en las últimas sema",12-01-2021 01:20,https://www.bing.com/th?id=OVFT.60EHe6vzRPUivZR3nM2aBC,Chile,Hondudiario
Expertos de la salud reportan reinfecciones de Covid-19,https://www.vtv.com.hn/noticia/expertos-de-la-salud-reportan-reinfecciones-de-covid-19/,Señalan expertos de la salud que las reinfecciones por Covid-19 son una realidad en Honduras y son muchas las personas que se ven afectadas.,12-01-2021 02:09,https://www.bing.com/th?id=OVFT.oJE518xqj32COd-yEAlxXC,Chile,VTV
"Los casos de COVID-19 ascienden a 128,701 con 721 nuevos contagios",https://proceso.hn/los-casos-de-covid-19-ascienden-a-128701-con-721-nuevos-contagios/,"Los casos de COVID-19 en Honduras se elevaron hoy a 128 mil 701 desde el inicio de la pandemia con la confirmación de otros 721 contagios, mientras que los pacientes recuperados aumentaron a 59",12-01-2021 03:15,https://www.bing.com/th?id=OVFT.TWG76TKFx-g7M-3wiALdXi,Chile,Proceso
En abril se presentaría en España Plan de Reconstrucción de Honduras afirma Madero,http://www.eldiario.hn/en-abril-se-presentaria-en-espana-plan-de-reconstruccion-de-honduras-afirma-madero/,"Tegucigalpa. - El Coordinador General de Gobierno, Carlos Madero, informó este lunes que en abril se presentará en España el Plan de Reconstrucción Nacional Sostenible, para gestionar recursos con el",12-01-2021 03:58,https://www.bing.com/th?id=OVFT.GInyTDq3WhFYTzRSvhamZi,Chile,El Diario
Faltan $39 millones para financiar plan de vacunación en Honduras,https://www.laprensa.hn/honduras/1435123-410/faltan-39-millones-para-financiar-plan-de-vacunacion-honduras,Honduras se prepara para la llegada de la vacuna contra el covid-19 con la que se espera inmunizar al 81.5% de la población apta para ser inoculada con las dosis. Debido a que la Secretaría de Salud r,12-01-2021 05:38,https://www.bing.com/th?id=OVFT.3jOOaP9ofyfuU1IQ6-G8mS,Chile,La Prensa Chicos
Con “Pavimento Municipal” se incrementa el turismo,https://www.latribuna.hn/2021/01/12/con-pavimento-municipal-se-incrementa-el-turismo/,"Varios proyectos de infraestructura vial se ejecutaron y se ejecutan en la Secretaría de Infraestructura y Servicios Públicos (INSEP), en el año 2020-2021, pese a la Pandemia por COVID-19 y el impacto",12-01-2021 08:05,https://www.bing.com/th?id=OVFT.opzgLrp5qSveu_x0OvstTi,Chile,La Tribuna
En abril se presentaría en España Plan de Reconstrucción de Honduras,https://www.latribuna.hn/2021/01/12/en-abril-se-presentaria-en-espana-plan-de-reconstruccion-de-honduras/,"El Coordinador General de Gobierno, Carlos Madero, informó que en abril se presentará en España el Plan de Reconstrucción Nacional Sostenible, para gestionar recursos con el fin de hacerle frente al d",12-01-2021 08:17,https://www.bing.com/th?id=OVFT.KEhRSPTeMBphdVaKIRXvci,Chile,La Tribuna
