name,url,description,datePublished,imagen,pais,Fuente
TRES MÉDICOS FALLECEN EN LAS ULTIMAS HORAS YA SUMAN 62 LOS DECESOS DE GALENOS POR COVID-19,https://ultimahora.hn/tres-medicos-fallecen-en-las-ultimas-horas-ya-suman-62-los-decesos-de-galenos-por-covid-19/,"El patólogo gástrico y docente de la Universidad Nacional Autónoma de Honduras (UNAH), Edgardo Murillo Castillo, es uno de los médicos que  falleció en las últimas horas en el Instituto Hondureño",25-01-2021 14:14,https://www.bing.com/th?id=OVFT.Shx2NB7HdlgNqrl_3IL6Dy,Chile,Ultima Hora
"Bajo sospechas de Covid-19, muere enfermera profesional del IHSS en SPS",https://tiempo.hn/muere-enfermera-ihss-covid-honduras/,"Foto en vida de la Enfermera Profesional Alma Umaña. CORTÉS, HONDURAS. Una guerrera más cayó este día en medio de la batalla contra el enemigo más peligroso que la humanidad ha enfrentado durante la ú",25-01-2021 15:06,https://www.bing.com/th?id=OVFT.eQVSrG74exeOVN1kPtZJ8y,Chile,Tiempo
Honduras reporta 21 fallecidos por COVID-19 en las últimas horas,https://proceso.hn/honduras-reporta-21-fallecidos-por-covid-19-en-las-ultimas-horas/,"Al menos 21 pacientes fallecieron con sospecha de COVID-19 durante el fin de semana en Honduras, de los cuales 17 murieron en las últimas 24 horas, informaron este lunes autoridades sanitarias del",25-01-2021 15:41,https://www.bing.com/th?id=OVFT.TJy-aXm_dqwViByUGSAosS,Chile,Proceso
EL PRESIDENTE DE MÉXICO ANDRÉS MANUEL LÓPEZ OBRADOR CON SÍNTOMAS LEVES Y EN TRATAMIENTO TRAS DAR POSITIVO A COVID-19,https://ultimahora.hn/el-presidente-de-mexico-andres-manuel-lopez-obrador-con-sintomas-leves-y-en-tratamiento-tras-dar-positivo-a-covid-19/,"El presidente de México, Andrés Manuel López Obrador, dio positivo a COVID-19. El mandatario confirmó este domingo su contagio. “Lamento informarles que estoy contagiado de COVID-19. Los síntomas",25-01-2021 16:24,https://www.bing.com/th?id=OVFT.Y8fgxb_LlYTt8_6bNDgGEy,Chile,Ultima Hora
"""En estos siete años nos enfocamos en recuperar a Honduras"": Presidente Hernández",https://www.elheraldo.hn/pais/1438123-466/cuarta-legislatura-congreso-nacional-discurso-joh-presidente-hernandez,"Hernández también habló de la crisis económica dejada por la emergencias, la cual catalogó como 'la peor de la historia'",25-01-2021 17:54,https://www.bing.com/th?id=OVFT.t2nDdhHvHoNDwhWc63o9Cy,Chile,El Heraldo
Cruceros volverían en mayo a Roatán de cumplirse programa de vacunación en EE.UU.,https://hondudiario.com/2021/01/25/cruceros-volverian-en-mayo-a-roatan-de-cumplirse-programa-de-vacunacion-en-ee-uu/,"porque al ser una persona vacunada no estará el riesgo de contagiarse por Covid-19’’, dijo Silvestri en declaraciones al periódico isleño. El gobernador comentó que Roatán siempre se mantendrá como el principal destino turístico en Honduras para ...",25-01-2021 19:07,https://www.bing.com/th?id=OVFT.QJHmJAaAPHnQcFc7tZcKdi,Chile,Hondudiario
HONDURAS / GOBIERNO AÚN NO CUMPLE CONTRATO PERMANENTE PROMETIDO A ENFERMERAS,http://www.web.ellibertador.hn/index.php/noticias/nacionales/2614-honduras-gobierno-aun-no-cumple-contrato-permanente-prometido-a-enfermeras,"Tegucigalpa. Un grupo de enfermeras afiliadas al Colegio de Profesionales de la Enfermería de Honduras, que han sido contratadas en el proyecto “Código Verde” que también ha hecho frente en primera lí",25-01-2021 19:10,https://www.bing.com/th?id=OVFT._uwgvCP3iez4FidaHMipcy,Chile,El Libertador
Más de 350 mil mujeres han quedado sin empleo o están suspendidas en Honduras,https://www.radiohrn.hn/mas-de-350-mil-mujeres-han-quedado-sin-empleo-o-estan-suspendidas-en-honduras,"A nivel nacional el índice de femineidad indica que existe una relación de 109 mujeres por cada 100 hombres El 25 de enero, como cada año, y se conmemora en Honduras el Día de la Mujer, en memoria de",25-01-2021 19:52,https://www.bing.com/th?id=OVFT.iy-EvVX3ulQSnPSMgGlAci,Chile,Radio HRN
"Fallece por COVID-19 la directora de Cultura y Artes, Lina Pina Mancuso",https://tiempo.hn/fallece-covid-19-directora-de-cultura-y-artes/,"La directora ejecutiva de Cultura y Artes, Lina Yexsuana Pina Mancuso, falleció hoy en la capital por complicaciones debido al COVID-19.",25-01-2021 20:58,https://www.bing.com/th?id=OVFT.xqN7awjJGsAMtvI1VXmcqS,Chile,Tiempo
Cerrarán triaje y centro de estabilización de Copán Ruinas por falta de fondos,https://www.elheraldo.hn/pais/1438190-466/cerraran-triaje-centro-estabilizacion-copan-ruinas-sin-fondos,La municipalidad dio a conocer que los últimos fondos que recibieron fueron los de agosto de 2020 y explicaron que se terminaron en noviembre,25-01-2021 22:47,https://www.bing.com/th?id=OVFT.EtS6jPNVYsFkDc9cWQN9ey,Chile,El Heraldo
Fallecen tres médicos y suman 62 los decesos por COVID-19 en Honduras,https://proceso.hn/fallecen-dos-medicos-y-suman-61-los-decesos-por-covid-19-en-honduras/,"El patólogo gástrico y docente de la Universidad Nacional Autónoma de Honduras (UNAH), Edgardo Murillo Castillo, falleció en las últimas horas en el Instituto Hondureño de Seguridad Social (IHSS),",26-01-2021 00:07,https://www.bing.com/th?id=OVFT.fA3rg7oLMe_nXEP5x0jPnC,Chile,Proceso
BID Invest refuerza la seguridad alimenticia en Centroamérica junto a CMI Alimentos,http://www.eldiario.hn/bid-invest-refuerza-la-seguridad-alimenticia-en-centroamerica-junto-a-cmi-alimentos/,"BID Invest, miembro del Grupo BID, otorgó un préstamo de US$75 millones a Corporación Multi Inversiones (CMI Alimentos) con el objetivo de asegurar su liquidez en el mediano plazo y apoyar la continui",26-01-2021 00:29,https://www.bing.com/th?id=OVFT.VpDeuYR-ZuzlDTnGiMjZzS,Chile,El Diario
Ante aumento de covid-19: Secretaría de Salud reforzará centros de triaje y ampliará capacidad hospitalaria en la zona norte,http://www.eldiario.hn/ante-aumento-de-covid-19-secretaria-de-salud-reforzara-centros-de-triaje-y-ampliara-capacidad-hospitalaria-en-la-zona-norte/,San Pedro Sula. - La Secretaría de Salud reforzará los centros de triaje y ampliará la capacidad hospitalaria mediante alianzas con organizaciones no gubernamentales y la empresa privada para contrarr,26-01-2021 03:26,https://www.bing.com/th?id=OVFT.-Yt8cqDiGjoiDREBuSnb1C,Chile,El Diario
Fallece primera funcionaria de coronavirus en Honduras,https://www.vtv.com.hn/noticia/fallece-primera-funcionaria-de-coronavirus-en-honduras/,La titular de Cultura y Arte Lina Mancuso ha perdido la batalla contra el coronavirus este 25 de enero precisamente día celebrado a la mujer hondureña. Lina Mancuso de profesión médica en el área de q,26-01-2021 03:45,https://www.bing.com/th?id=OVFT.y5DZj1aS0lZra938ktTtSS,Chile,VTV
"Muertos por covid en Honduras suman 3,462 y 141,984 contagiados",https://www.radiohrn.hn/muertos-por-covid-en-honduras-suman-3462-y-141984-contagiados,"El Laboratorio de Virología realizó un total de 3,838 pruebas para detectar el covid-19, de las cuales mil 055 salieron positivas",26-01-2021 04:20,https://www.bing.com/th?id=OVFT.IejhM-i2zkZ9frv7tgMumy,Chile,Radio HRN
Honduras tiene garantizada la vacuna contra Covid-19,https://www.vtv.com.hn/noticia/honduras-tiene-garantizada-la-vacuna-contra-covid-19/,Honduras tiene garantizada la vacuna contra el Covid-19 y en marzo estarían llegando las primeras dosis que serán suministradas a todo el personal que trabaja diariamente en primera línea en los hospi,26-01-2021 04:30,https://www.bing.com/th?id=OVFT.B7XTwmjacQgehMoEvKvleS,Chile,VTV
Reforzarán triajes y brigadas COVID-19,https://www.latribuna.hn/2021/01/26/reforzaran-triajes-y-brigadas-covid-19/,"El fortalecimiento de los centros de triaje y de las brigadas médicas casa por casa, son parte de las estrategias contempladas por las autoridades de la Comisión Permanente de Contingencias (Copeco),",26-01-2021 06:37,https://www.bing.com/th?id=OVFT.Ndjq8UvB_V9az6yxSyaMZC,Chile,La Tribuna
Suben a 3.462 los muertos por COVID-19 en Honduras y a 141.984 los contagios,https://www.latribuna.hn/2021/01/26/suben-a-3-462-los-muertos-por-covid-19-en-honduras-y-a-141-984-los-contagios/,"Tegucigalpa.– La cifra de muertos por COVID-19 en Honduras se elevó este lunes a 3.462, mientras que los contagios a 141.984, informó el estatal Sistema Nacional de Gestión de Riesgos (Sinager). En su",26-01-2021 06:39,https://www.bing.com/th?id=OVFT.r5MwBLld4tOezJKa4ej3li,Chile,La Tribuna
"Cuatro departamentos, los más abatidos por el covid-19 en Honduras",https://www.laprensa.hn/honduras/1438268-410/cuatro-departamentos-los-mas-abatidos-por-el-covid-19-honduras,"Tegucigalpa, Honduras. A casi un año del inicio de la pandemia en el país, el virus sigue sin dar tregua a los hondureños, que de acuerdo con los epidemiólogos, se siguen desc",26-01-2021 06:57,https://www.bing.com/th?id=OVFT.WuRAsjg_U5daGoGq4gdLNi,Chile,La Prensa Chicos
Presidentes de los tres poderes en Honduras destacan logros,https://www.laprensa.hn/honduras/1438269-410/presidentes-de-los-tres-poderes-en-honduras-destacan-logros,"Tegucigalpa, Honduras. En una ceremonia inusual que contó con una reducida presencia de diputados debido al elevado contagio del covid-19, el Congreso Nacional instaló ayer su c",26-01-2021 08:26,https://www.bing.com/th?id=OVFT.TL108Ha2y47ENlCM43KJHS,Chile,La Prensa Chicos
