name,url,description,datePublished,imagen,pais,Fuente
"Rent's due, again: Monthly anxieties deepen as aid falls off",https://www.fox5ny.com/news/rents-due-again-monthly-anxieties-deepen-aid-falls-off,"The coronavirus pandemic is entering a new month, meaning Americans struggling amid the economic fallout once again have to worry about paying their rent.",31-07-2020 19:06,https://www.bing.com/th?id=ON.1DB731F79CF1F1F183E27739BD4A2B04,Chile,Fox 5 NY
Cuatro decesos por COVID-19 reportan hospitales de la capital,https://www.latribuna.hn/2020/08/16/cuatro-decesos-por-covid-19-reportan-hospitales-de-la-capital/,"Cuatro personas muertas por COVID-19 reportan los hospitales Escuela e Instituto Hondureño de Seguridad Social (IHSS), de Tegucigalpa en las últimas 24 horas. Las autoridades del IHSS confirman este d",16-08-2020 21:51,https://www.bing.com/th?id=ON.B79BCB281EA5A09C99607AA2CB65E834,Chile,La Tribuna
El podcast con las noticias de Honduras y el mundo del lunes 17 de agosto,https://www.laprensa.hn/podcasts/1401942-410/honduras-salud-coronavirus-covid_19-pruebas-pcr-aeropuertos-vuelos-rey-juan-carlos-barcelona-tecnico,Este es el resumen de las principales noticias de Honduras y el mundo del lunes 17 de agosto de 2020. Luego de la renuncia de Marco Bográn como director ejecutivo de Inversión Estratégica de Honduras,17-08-2020 00:00,https://www.bing.com/th?id=ON.85510527AA66EEAEE69E939434F07E46,Chile,La Prensa Chicos
Proponen vacunar a niños contra covid-19 para que no lo propaguen,https://www.elheraldo.hn/pais/1401720-466/proponen-vacunar-a-ni%C3%B1os-contra-covid-19-para-que-no-lo-propaguen,"Un estudio internacional señala que los niños menores de cinco años pueden tener una carga viral en la garganta o nariz hasta 100 veces mayor que los adultos, por lo que pueden contagiar más Los niños",17-08-2020 13:16,https://www.bing.com/th?id=ON.C44251075295359CD678E0AD80B28039,Chile,El Heraldo
"Cardenal Rodríguez: ""Honduras está atormentada por el virus de corrupción""",https://www.elheraldo.hn/pais/1401728-466/honduras-atormentada-virus-corrupcion,"El cardenal Óscar Andrés Rodríguez criticó que hay quienes les importa más la política que la pandemia que se sufre TEGUCIGALPA, HONDURAS.- Para el cardenal Óscar Andrés Rodríguez, Honduras está siend",17-08-2020 13:52,https://www.bing.com/th?id=ON.5D72CAB37F40A4E4B729D4D69E70C22D,Chile,El Heraldo
Asume Luis Abinader como nuevo presidente de la República Dominicana,https://notibomba.com/asume-luis-abinader-como-nuevo-presidente-de-republica-dominicana/,"El economista Luis Abinader, de 53 años, juró este domingo como presidente de la República Dominicana para el periodo 2020-2024. Luis Abinader al momento de tomar juramento como nuevo presidente de Re",17-08-2020 14:32,https://www.bing.com/th?id=ON.1EBF05535729B3D7837300834EDA5E52,Chile,Noti Bomba
Honduras participará en conferencia sobre empoderamiento de mujeres en tiempos de COVID-19,https://www.laprensa.hn/honduras/1401798-410/honduras-participacion-conferencia-internacional-empoderamiento-mujeres-rurales,"Honduras estará presente mañana en la conferencia internacional que promueve el empoderamiento de mujeres rurales en tiempos de la COVID-19, impulsada por la Organización de las Naciones Unidas para l",17-08-2020 16:14,https://www.bing.com/th?id=ON.25FFBEB244A9F0EB29226CD69C380711,Chile,La Prensa Chicos
Honduras supera los 50 mil casos de COVID-19,https://hondudiario.com/2020/08/16/honduras-supera-los-50-mil-casos-de-covid-19/,"*** La nación experimentó sus primeros dos casos hace 159 días, hoy sábado 15 de agosto la nación virtualmente alcanzó las 50 mil infecciones confirmadas. Tegucigalpa, Honduras. El Sistema de Gestión",17-08-2020 16:45,https://www.bing.com/th?id=ON.549784A751557045396166AD1C9CB295,Chile,Hondudiario
Rebeldía continúa en cinco clubes de la Liga Nacional,https://www.diariomas.hn/2020/08/17/rebeldia-continua-en-cinco-clubes-de-la-liga-nacional/,"La Junta Directiva de la Liga Nacional se reunió virtualmente el domingo con la Comisión Médica, entrenadores y preparadores físicos de la Profesional para presentarles el plan de bioseguridad a ejecu",17-08-2020 18:11,https://www.bing.com/th?id=ON.7461707473FDB7002C01E446231F58D9,Chile,Mas
A “sol y agua” esperan noticias afuera de los hospitales,https://www.latribuna.hn/2020/08/17/a-sol-y-agua-esperan-noticias-afuera-de-los-hospitales/,"Escenas de tristeza, preocupación, impotencia y dolor viven los familiares de los pacientes COVID-19, en las afueras de diferentes hospitales capitalinos, tras cinco meses de la pandemia del coronavir",17-08-2020 18:57,https://www.bing.com/th?id=ON.79CE251D1735E1B9A8496B45B666747B,Chile,La Tribuna
Guatemaltecos se unen a campaña: ¿Dónde está el dinero?,https://notibomba.com/guatemaltecos-se-unen-a-campana-donde-esta-el-dinero/,"Miles de guatemaltecos desarrollaron el fin de semana una jornada de protesta para exigir la renuncia del presidente, Alejandro Giammattei, y exigirle cuentas de los fondos aprobados para el manejo de",17-08-2020 22:46,https://www.bing.com/th?id=ON.E36C1BC0149B8FC50101CB81FBBB114E,Chile,Noti Bomba
Hospital San Felipe “respira” luego de 9 días sin muertes por COVID-19,https://hondudiario.com/2020/08/17/hospital-san-felipe-respira-luego-de-9-dias-sin-muertes-por-covid-19/,"*** La institución salubre se encuentra con 25 pacientes en sus salas de coronavirus, sin embargo, la cantidad de muertes cayó a cero. Tegucigalpa, Honduras. La portavoz del Hospital San Felipe de Teg",17-08-2020 22:48,https://www.bing.com/th?id=ON.50D505DA7B5695468F6D07F96A9DEF97,Chile,Hondudiario
