name,url,description,datePublished,imagen,pais,Fuente
COVID-19 en Honduras: SINAGER confirma 219 casos y 8 muertos en 2021,https://tiempo.hn/covid-19-en-honduras-sinager-confirma-219-casos/,TEGUCIGALPA-HONDURAS. El incremento de casos de la COVID-19 en este 2021 no cesa en Honduras y esta es una emergencia sanitaria que mantiene en alerta roja a todo el país desde marzo del año pasado. P,08-01-2021 05:23,https://www.bing.com/th?id=OVFT.osV64uTPFwnQisu_8M3U1S,Chile,Tiempo
Esfuerzo científico histórico ha permitido vacuna contra la covid-19,https://www.latribuna.hn/2021/01/08/esfuerzo-cientifico-historico-ha-permitido-vacuna-contra-la-covid-19/,"Por: José Rolando Sarmiento Rosales La rapidez con la que se comenzó a hablar de una serie de laboratorios y universidades participantes en la elaboración de vacunas para la COVID-19, tanto en Europa,",08-01-2021 07:37,https://www.bing.com/th?id=OVFT.7Y5cXDnpRH03SDfOGfqXSS,Chile,La Tribuna
Sector amateur espera apoyo de Fenaftuh para reanudar actividades en 2021,https://www.diariomas.hn/2021/01/08/sector-amateur-espera-apoyo-de-fenaftuh-para-reanudar-actividades-2021/,"En último Congreso Deportivo de la Federación Hondureña de Fútbol (FENAFUTH), realizado a finales del 2020 se hizo una propuesta de Solicitud de Fondos",08-01-2021 17:32,https://www.bing.com/th?id=OVFT.9yADZEjlPApS0PG30bmccS,Chile,Mas
UNAH anuncia que dará cadena de frío para vacuna contra COVID-19,https://ultimahora.hn/unah-anuncia-que-dara-cadena-de-frio-para-vacuna-contra-covid-19/,Autoridades de la UNAH anuncian que pondrán a disposición la cadena de frío parta vacunas contra el COVID19 Las autoridades de la Universidad Nacional Autónoma de Honduras anuncian que pondrán a,08-01-2021 19:33,https://www.bing.com/th?id=OVFT.6XqiUwHFKZocPuGFxS9spi,Chile,Ultima Hora
UNAH anuncia que pondrán a disposición cadena de frío para vacuna contra Covid-19,https://hondudiario.com/2021/01/08/unah-anuncia-que-pondran-a-disposicion-cadena-de-frio-para-vacuna-contra-covid-19/,"El rector de la Universidad Nacional Autónoma de Honduras (UNAH), Francisco Herrera, informó que pondrán a disposición la cadena de frío para iniciar el proceso de vacunación contra el Covid-19. Agreg",08-01-2021 20:57,https://www.bing.com/th?id=OVFT.eTW4hgWysv3YeotuSCdjqy,Chile,Hondudiario
"Subjefa del PAI: Personal de Salud, tercera edad y enfermos crónicos serán los primeros en vacunarse contra el COVID-19",http://www.elsoldehonduras.com/salud/subjefa-del-pai-personal-de-salud-tercera-edad-y-enfermos-cronicos-seran-los-primeros-en-vacunarse-contra-el-covid-19/,"Tegucigalpa. La Subjefa del Programa Ampliado de Inmunizaciones (PAI), Lourdes Mendoza, manifestó que los primeros en ser vacunados contra el COVID-19 serán los trabajadores de la salud, tercera edad",08-01-2021 23:51,https://www.bing.com/th?id=OVFT.rcFhiIXHRp4GgKm9UFEfgC,Chile,El Sol de Honduras
En el tercer día de la gran movilización Todos contra el COVID-19#8221,http://www.elsoldehonduras.com/nacionales/en-el-tercer-dia-de-la-gran-movilizacion-todos-contra-el-covid-19/,"La ministra de Salud, Alba Consuelo Flores, dio a conocer que las brigadas integrales continuaron este día en intensa labor casa a casa y puntos fijos en la búsqueda activa de casos sintomáticos de CO",09-01-2021 00:09,https://www.bing.com/th?id=OVFT.yY2rSFxEaZKNVW4IH_6FWC,Chile,El Sol de Honduras
"HONDUREÑOS EN HOSPITAL DE LA MUERTE, NO HAY CUPOS EN UCI",http://www.web.ellibertador.hn/index.php/noticias/nacionales/2574-hondurenos-en-hospital-de-la-muerte-no-hay-cupos-en-uci,"Nueve de cada diez hondureños está muriendo esperando ingresar a la Unidad de Cuidados Intensivos (UCI), porque en promedio, la red hospitalaria pública sólo cuenta con 110 camas en salas especiales y",09-01-2021 01:15,https://www.bing.com/th?id=OVFT.YKr1ep322jaa98BP5jqAdC,Chile,El Libertador
"Honduras acumula 126,113 contagiados y 3,255 defunciones por COVID-19",https://proceso.hn/honduras-acumula-126113-contagiados-y-3255-defunciones-por-covid-19/,"Se registraron las muertes de 17 personas sospechosas, de las cuales se confirmaron 11: 7 en el municipio del Distrito Central, 2 en Talanga, 1 en San Lucas en El Paraíso y 1 en Santiago de",09-01-2021 03:59,https://www.bing.com/th?id=OVFT.ZdBBGW0JB5uzsMHSP7mBTi,Chile,Proceso
CNE llama hacer propaganda política en el margen del respeto,https://ultimahora.hn/cne-llama-hacer-propaganda-politica-en-el-margen-del-respeto/,"El consejero suplente del Consejo Nacional Electoral (CNE), Germán Lobo, llamó a los actores que participarán en las elecciones primarias que se comporten y respeten las decisiones para el",09-01-2021 14:30,https://www.bing.com/th?id=OVFT.eF2kOql-l01gRsWC9GLarC,Chile,Ultima Hora
COVID-19: el «crudo» recordatorio del doctor Fiallos a los «que no hacen caso»,https://tiempo.hn/doctor-hugo-fiallos-recordatorio-covid-19/,"El doctor Hugo Fiallos, con su peculiar forma de expresarse, escribió un recordatorio sobre el COVID-19 para ""los que no hacen caso"".",09-01-2021 14:33,https://www.bing.com/th?id=OVFT.MXXGIux5jN5c1R7q_8opvC,Chile,Tiempo
"Decesos por COVID siguen en aumento en Honduras, al menos 9 pacientes fallecen en las últimas horas",https://proceso.hn/decesos-por-covid-siguen-en-aumento-en-honduras-al-menos-9-pacientes-fallecen-en-las-ultimas-horas/,"En las últimas 12 horas se reporta la muerte de nueve pacientes por COVID-19, confirmó este sábado el viceministro de Salud, Roberto Cosenza.",09-01-2021 14:41,https://www.bing.com/th?id=OVFT.YKr1ep322jaa98BP5jqAdC,Chile,Proceso
Detectan en El Salvador a hondureño con covid-19 que viajaba en la aerolínea Spirit,https://www.laprensa.hn/honduras/1434574-410/aerolinea-spirit-airlines-pasajero-covid-hondureno,"Agentes de la Dirección General de Migración y Extranjería (DGME) de El Salvador detectaron la noche del jueves, 07 de enero, a un pasajero positivo de covid-19 de nacionalidad hondureña que viajaba e",09-01-2021 16:33,https://www.bing.com/th?id=OVFT.A4TYXfHxn890XBGWRi947S,Chile,La Prensa Chicos
Cancelan contrato de al menos 20 enfermeras del Instituto Cardiopulmonar,https://hondudiario.com/2021/01/09/cancelan-contrato-de-al-menos-20-enfermeras-del-instituto-cardiopulmonar/,"El presidente de la Asociación Nacional de Enfermeras y Enfermeros Auxiliares de Honduras (ANEEAH), Josué Orellana ... estaban asignadas a la sala dos de cuidados intermedios de Covid-19, como si el virus ya se fue del país y en un momento donde ...",09-01-2021 16:55,https://www.bing.com/th?id=OVFT.HXg7Zq2oCIXyE3-TKZcFQi,Chile,Hondudiario
Honduras confirma 283 nuevos casos de coronavirus y 11 decesos,https://www.laprensa.hn/honduras/1434587-410/honduras-coronavirus-contagios-coronavirus-,"Honduras superó este viernes los 126.000 contagios de la covid-19, mientras que los muertos ya suman 3.266, informó este viernes el estatal Sistema Nacional de Gestión de Riesgos (Sinager). El organis",09-01-2021 17:11,https://www.bing.com/th?id=OVFT.CZZRfZtSnnWUW29dn8uFCy,Chile,La Prensa Chicos
