name,url,description,datePublished,imagen,pais,Fuente
Pandemia amenaza recaudación tributaria de Honduras y le obliga a endeudarse,https://proceso.hn/mas-noticias/32-m%C3%A1s-noticias/pandemia-amenaza-recaudacion-tributaria-de-honduras-y-le-obliga-a-endeudarse.html,"Tegucigalpa - La crisis económica de Honduras, que se ha agudizado con la pandemia de COVID-19, podría provocar una caída de hasta el 50 % de la recaudación tributaria en 2020 y un mayor endeudamiento del país para financiar en parte el gasto público ...",20-06-2020 15:53,https://www.bing.com/th?id=ON.DC4D4F9C7761FE33B674D79617FADDD0,Chile,Proceso
"Tras siete fallecimientos, asilo Perpetuo Socorro será declarado libre de Covid-19",https://www.laprensa.hn/sanpedro/1390611-410/coronavirus-honduras-san-pedro-sula-perpetuo-socorro-asilo-de-ancianos,"En las primeras semanas de la llegada del coronavirus a Honduras, se reportó que lamentablemente en el asilo de ancianos Perpetuo Socorro de San Pedro Sula, habían varios de sus inquilinos con sospech",30-06-2020 20:56,https://www.bing.com/th?id=ON.D034B14EA80233C1A8A01792F09FA0D2,Chile,La Prensa Chicos
Ante confusión de la población: Hernández solicita a Sinager y Mesa Multisectorial revisar nuevas medidas de circulación,http://www.eldiario.hn/ante-confusion-de-la-poblacion-hernandez-solicita-a-sinager-y-mesa-multisectorial-revisar-nuevas-medidas-de-circulacion/,Tegucigalpa.-El presidente Juan Orlando Hernández solicitó hoy lunes al Sistema Nacional de Gestión de Riesgo (Sinager) y a la Mesa Multisectorial revisar las nuevas medidas de circulación aplicadas a,30-06-2020 21:33,https://www.bing.com/th?id=ON.C14CC9AEC7DB14E5B6FE3E08C03B243C,Chile,El Diario
EEUU anuncia apoyo de 4 millones de dólares en asistencia alimentaria para familias hondureñas afectadas por la COVID-19,http://www.eldiario.hn/eeuu-anuncia-apoyo-de-4-millones-de-dolares-en-asistencia-alimentaria-para-familias-hondurenas-afectadas-por-la-covid-19/,"Tegucigalpa.- La Agencia de los Estados Unidos para el Desarrollo Internacional (USAID), anuncia apoyo de 4 millones de dólares en asistencia alimentaria para familias hondureñas que han sido afectada",30-06-2020 21:33,https://www.bing.com/th?id=ON.7507E34504E74E1CA1AC8A6E4638886E,Chile,El Diario
Honduras entrega presidencia de la OCAM a Nicaragua,https://www.latribuna.hn/2020/06/30/honduras-entrega-presidencia-de-la-ocam-a-nicaragua/,"La Directora del Instituto Nacional de Migración de Honduras, Carolina Menjivar, entregó este martes la presidencia pro témpore de la Comisión Centroamericana de Directores de Migración-OCAM, que oste",30-06-2020 22:37,https://www.bing.com/th?id=ON.CF3EAAF2CC8179A13DC464D6EE829B70,Chile,La Tribuna
Gobierno elimina medida de circulación por terminación por número de placa vehicular,http://www.elsoldehonduras.com/nacionales/gobierno-elimina-medida-de-circulacion-por-terminacion-por-numero-de-placa-vehicular/,El Gobierno de la República a través del Sistema Nacional de Gestión de Riesgos (Sinager) informa lo siguiente: 1. Queda sin valor la medida de circulación del último dígito de placa vehícular. La pob,30-06-2020 22:47,https://www.bing.com/th?id=ON.A374A8476726ED6EF7A1FDE142678DDB,Chile,El Sol de Honduras
El Gobierno de los Estados Unidos apoyará,http://www.elsoldehonduras.com/nacionales/el-gobierno-de-los-estados-unidos-apoyaraa-familias-hondurenas-afectadas-por-la-emergencia/,"La Agencia de los Estados Unidos para el Desarrollo Internacional (USAID), anuncia $4 millones en asistencia alimentaria para familias que han sido afectadas por el COVID-19. Dicha asistencia será imp",30-06-2020 22:47,https://www.bing.com/th?id=ON.0F15C23AC9B27DD5194E4C905B9DDA95,Chile,El Sol de Honduras
OPS prevé pico de coronavirus en agosto en Centroamérica,https://www.laprensa.hn/especiales/coronavirus/1390676-410/honduras-ops-coronavirus-pico-pandemia-,"La Organización Panamericana de la Salud (OPS) prevé que el pico de la pandemia del Covid-19 para países en América Central y México, sea en agosto. ""En América Central países como por ejemplo El Salv",30-06-2020 23:09,https://www.bing.com/th?id=ON.7D63300DD92EB972C988B3AF2691DD24,Chile,La Prensa Chicos
"Motagua suspende el inicio de la pretemporada ,tenía todo listo en bioseguridad pero repunte del Covid-19 los frenó",https://www.diez.hn/liganacionaldehonduras/1390645-498/motagua-suspende-inicio-de-la-pretemporada-tenia-lista-bioseguridad,"El vicepresidente financiero del Motagua, Juan Carlos Suazo, reveló este martes que por ahora se ha suspendido la fecha del inicio de la pretemporada debido al confinamiento en Tegucigalpa por el aume",30-06-2020 23:55,https://www.bing.com/th?id=ON.1A5AF9AE5DF30B86357CBD8122BC2901,Chile,diez.hn
Honduras: Cierran varios centros de salud por contagios de coronavirus en personal de enfermería,https://radiohrn.hn/honduras-cierran-varios-centros-de-salud-por-contagios-de-coronavirus-en-personal-de-enfermeria/,"Más de 500 enfermas y enfermeros se han contagiado de coronavirus en Honduras. Foto / VTV. El presidente de la Asociación Nacional de Enfermeras y Enfermeros Auxiliares de Honduras (ANEEH), Josué Orel",01-07-2020 00:19,https://www.bing.com/th?id=ON.05EEB1B69B27B17A3A91C1E1D429B2B2,Chile,Radio HRN
"Doctora, ingeniero y empresario, víctimas del COVID-19 en Honduras",https://www.latribuna.hn/2020/06/30/doctora-ingeniero-y-empresario-victimas-del-covid-19-en-honduras/,"Tres destacados profesionales murieron en las últimas 24 horas, en las salas de COVID-19 de diferentes centros asistenciales de Honduras. La primera víctima que se reportó fue en horas de la noche de",01-07-2020 02:56,https://www.bing.com/th?id=ON.1C91A8150CED07EC98C2BA5C511CDE28,Chile,La Tribuna
Honduras supera los 19 mil casos de coronavirus y confirma 12 víctimas más,https://www.diez.hn/coronavirus/1390757-441/honduras-supera19-mil-casos-coronavirus-12-muertos-cortes-francisco-morazan,"Sinager confirmó este martes que de 1,697 pruebas realizadas un total de 740 resultaron positivas. Los casos en el país ya suman 19,558 casos. La cifra de contagios de coronavirus Covid-19 en Honduras",01-07-2020 04:03,https://www.bing.com/th?id=ON.8FB53B9BD1278CBF15C6E217C5E14032,Chile,diez.hn
ANEEAH anuncia cierre de establecimientos por contagios de Covid-19,https://hondudiario.com/2020/06/30/aneeah-anuncia-cierre-de-establecimientos-por-contagios-de-covid-19/,"El presidente de la Asociación Nacional de Enfermeras/os Auxiliares de Honduras (ANEEAH), Josué Orellana, anunció martes el cierre de diferentes centros de salud a nivel nacional, debido al contagio p",01-07-2020 04:41,https://www.bing.com/th?id=ON.8C359425CEAF066E4303E712ACFFDA56,Chile,Hondudiario
Al menos 15 fallecidos por sospecha de COVID en la capital,https://proceso.hn/actualidad/7-actualidad/al-menos-15-fallecidos-por-sospecha-de-covid-en-la-capital.html,Tegucigalpa - Los decesos por sospechas de COVID-19 suman 15 a la mañana de este martes en tres hospitales públicos del Distrito Central. Autoridades del Hospital Escuela informaron este martes que oc,01-07-2020 04:44,https://www.bing.com/th?id=ON.600831551477E5D8104F577E8D69C72F,Chile,Proceso
Más incongruencias: con 50 proveedores están armando hospitales móviles,https://www.elheraldo.hn/pais/1390746-466/hospitales-moviles-invest-axel-lopez-marco-bogran,"Para expertos en procesos de compras del Estado, el hecho de que la empresa contratada haya subcontratado a 50 compañías representa una alerta roja pues demuestra incapacidad de la firma TEGUCIGALPA,",01-07-2020 14:22,https://www.bing.com/th?id=ON.0EB1735D4275A70E45680A4F331A77AC,Chile,El Heraldo
El contrabando atenta contra la salud de la población en medio de la pandemia del Covid-19,https://hondudiario.com/2020/07/01/el-contrabando-atenta-contra-la-salud-de-la-poblacion-en-medio-de-la-pandemia-del-covid-19/,"El contrabando es un delito que constantemente afecta al país, no solo económicamente, sino que también atenta contra la salud de los hondureños que actualmente luchan contra la pandemia del COVID-19.",01-07-2020 14:55,https://www.bing.com/th?id=ON.5FA2732BABCE6AAB9FE996567D91672C,Chile,Hondudiario
"Con 740 nuevos casos de coronavirus, Honduras llega a 19,558 contagios",https://radiohrn.hn/con-740-nuevos-casos-de-coronavirus-honduras-llega-a-19558-contagios/,"Aumenta la cifra de muertos, recuperados y contagiados de coronavirus en Honduras. Este martes, la cifra de casos de coronavirus en Honduras llegó a 19,558. Así lo informaron las autoridades del Siste",01-07-2020 15:03,https://www.bing.com/th?id=ON.67D20DBDC6BE231B4AD33A0A7CFE2B91,Chile,Radio HRN
Al borde del colapso red hospitalaria de Honduras,https://www.elheraldo.hn/pais/1390745-466/red-hospitalaria-colapso-honduras-coronavirus-pandemia,"La mayoría de hospitales habilitados para atención de covid-19 reportan un nivel de ocupación máximo, mientras cientos de pacientes esperan un cupo en sillas o en el suelo TEGUCIGALPA, HONDURAS.-Postr",01-07-2020 15:14,https://www.bing.com/th?id=ON.C63E62251A75949FDCAFD2DAB5D705D0,Chile,El Heraldo
