name,url,description,datePublished,imagen,pais,Fuente
Muere por sospecha de COVID-19 otro médico en Siguatepeque.,https://www.latribuna.hn/2020/10/27/muere-por-sospecha-de-covid-19-otro-medico-en-siguatepeque/,"Hoy que se conmemora el día del médico hondureño se reportó la muerte por sospecha de COVID-19, de otro profesional de la medicina en la ciudad de Siguatepeque, zona central de Honduras. Se trata del",27-10-2020 19:40,https://www.bing.com/th?id=OVFT.aOMk8C3FlJ1BDLR6ANz4cC,Chile,La Tribuna
"Con más de dos mil pruebas procesadas, Honduras supera los 94 mil casos de COVID-19",https://proceso.hn/con-mas-de-dos-mil-pruebas-procesadas-honduras-supera-los-94-mil-casos-de-covid-19/,"Tegucigalpa – Honduras alcanzó este martes los 94 mil 623 contagiados y 2 mil 639 decesos por COVID-19, reportó el Sistema Nacional de Gestión de Riesgos (Sinager). – La tasa de letalidad del COVID-19 es del 2.8 por ciento. 2 mil 093 pruebas PCR ...",28-10-2020 02:15,https://www.bing.com/th?id=OVFT.7G6YeGAmhvd13VLTM5ZrmS,Chile,Proceso
"Honduras suma 2,639 muertes por Covid-19 y supera los 94 mil contagios",https://hondudiario.com/2020/10/27/honduras-suma-2639-muertes-por-covid-19-y-supera-los-94-mil-contagios/,"El Sistema Nacional de Gestión de Riesgos (Sinager), reportó este martes 657 nuevos casos de Covid-19 de 2,093 pruebas PCR procesadas, sumando así un total de 94,623 casos de coronavirus a nivel nacional. Además, se confirmó la muerte de 6 personas ...",28-10-2020 02:26,https://www.bing.com/th?id=OVFT.kkEYSbjj-wfcrX6Tq9RJ3S,Chile,Hondudiario
"94,623 casos positivos por covid, 2,639 fallecidos y 38,833 recuperados reporta Honduras",https://www.radiohrn.hn/94623-casos-positivos-por-covid-2639-fallecidos-y-38833-recuperados-reporta-honduras,"Honduras registra este martes (27.10.2020) un total de 94,623 casos positivos por covid-19 a nivel nacional. De los 94,623, permanecen activos (53,151), fallecidos 2,639 (6 nuevos), recuperados 38,833",28-10-2020 02:45,https://www.bing.com/th?id=OVFT.lUxpqL53I2Til75V_3y6py,Chile,Radio HRN
"Unas 50 irregularidades en gestión por pandemia en Honduras, expone Coalición Anticorrupción",https://www.radiohrn.hn/unas-50-irregularidades-en-gestion-por-pandemia-en-honduras-expone-coalicion-anticorrupcion,"El documento presenta de forma articulada, las denuncias, observaciones y recomendaciones de la ciudadanía organizada, sobre las compras y contrataciones",28-10-2020 03:00,https://www.bing.com/th?id=OVFT.SsXc3ZBm_rsfV6q_9tSUvC,Chile,Radio HRN
"Honduras llega a 94,623 casos de covid-19",https://ultimahora.hn/honduras-llega-a-94623-casos-de-covid-19/,"El Sistema Nacional de Gestión de Riesgos (Sinager) reportó este martes (27.10.2020) que se contabilizan 94,623 infecciones por covid-19 en Honduras. Los nuevos casos se han confirmado como",28-10-2020 04:19,https://www.bing.com/th?id=OVFT.UJ6xxOPApGBf7EYEd0e-li,Chile,Ultima Hora
A partir de hoy 100 funcionarios visitarán todos los municipios para supervisar manejo de fondos de Fuerza Honduras,https://ultimahora.hn/a-partir-de-hoy-100-funcionarios-visitaran-todos-los-municipios-para-supervisar-manejo-de-fondos-de-fuerza-honduras/,"El presidente Juan Orlando Hernández anunció  que a partir de hoy, y durante tres días, 100 funcionarios visitarán todos los municipios del país para supervisar el manejo de fondos de Fuerza Honduras.",28-10-2020 14:05,https://www.bing.com/th?id=OVFT.Z9boamSR3KdQU3lLqO-XdS,Chile,Ultima Hora
"La Juventus, sin Cristiano Ronaldo, pone a prueba la reacción de un Barcelona golpeado",https://www.diez.hn/championsleague/1418623-498/juventus-vs-barcelona-sin-cristiano-ronaldo-messi-champions-league-en-vivo-turin,"El Barcelona se mide hoy en Turín ante la Juventus en la segunda jornada de la Champions (2:00 pm de Honduras), en busca de una victoria ... pues el portugués volvió a dar positivo en el test del covid-19. El astro portugués de la Juventus, Cristiano ...",28-10-2020 14:46,https://www.bing.com/th?id=OVFT.XPKvtWxEzJhy_r2iopyjxS,Chile,diez.hn
Ante segunda ola del covid-19 ¿Cómo cuidar a los adultos mayores?,https://www.elheraldo.hn/otrassecciones/saludybelleza/1418638-466/ante-segunda-ola-covid-como-cuidar-adultos-mayores,"TEGUCIGALPA, HONDURAS.-Los adultos mayores son parte de la población considerada de alto riesgo durate la pandemia por covid-19, es por ello, que durante esta segunda oleada de contagios que se está p",28-10-2020 17:02,https://www.bing.com/th?id=OVFT.ijAiI1tmN_lKEV4RWbNK-C,Chile,El Heraldo
CPH: Brigada detecta a 15 periodistas positivos al COVID-19.,https://www.latribuna.hn/2020/10/28/cph-brigada-detecta-a-15-periodistas-positivos-al-covid-19/,"El Colegio de Periodistas de Honduras (CPH), informó este miércoles que un total de 15 periodistas han dado positivo al COVID-19. El miembro de la junta directiva del CPH, Wilfredo Oseguera, indicó qu",28-10-2020 17:09,https://www.bing.com/th?id=OVFT.qO4tI-hPF8GnojiVl4woky,Chile,La Tribuna
