name,url,description,datePublished,imagen,pais,Fuente
SINAGER confirma 398 nuevos casos de COVID-19 en Honduras,https://tiempo.hn/sinager-confirma-398-nuevos-casos-covid-19-honduras/,"TEGUCIGALPA, HONDURAS. El aumento de casos de COVID-19 en Honduras no cesa y es que a diario el Sistema Nacional de Gestión de Riesgo (SINAGER) informa sobre nuevas personas que contrajeron la mortal",23-12-2020 04:50,https://www.bing.com/th?id=OVFT.HfjDavWKcBWVqfVU5Meh0C,Chile,Tiempo
Autoridades de Salud advierten que nueva cepa de covid-19 puede llegar al país,https://www.elheraldo.hn/pais/1431216-466/salud-advierte-nueva-cepa-covid-19-llegar-honduras,"La nueva cepa del virus Sars-Cov-2 podría llegar a Honduras y extenderse por todo el territorio. El genoma del covid-19 mutó y se detectó en el ﻿Reino Unido y ya se ha extendido por otros países de Europa y de África. Sin embargo, la distancia no ...",23-12-2020 13:25,https://www.bing.com/th?id=OVFT.qGWRqU7C3JweZP-BXKrmJy,Chile,El Heraldo
Asistencia humanitaria será prioridad en reconstrucción de Honduras : Ministro Carlos Madero,https://ultimahora.hn/asistencia-humanitaria-sera-prioridad-en-reconstruccion-de-honduras-ministro-carlos-madero/,"El ministro Coordinador General de Gobierno, Carlos Madero, aseguró este martes que la asistencia humanitaria “inmediata” será una prioridad en el Plan de Reconstrucción Sostenible de",23-12-2020 14:15,https://www.bing.com/th?id=OVFT.u_ps_I8YoseM4e2roOC2VS,Chile,Ultima Hora
"Sobrevalorados en L 800 millones: Hospitales móviles, la historia gris en el abordaje de la pandemia del covid-19",https://www.radiohrn.hn/honduras-sobrevalorados-en-800-lempiras-millones-hospitales-moviles-la-historia-gris-en-el-abordaje-de-la-pandemia-del-covid-19,"La Unidad de Cuidados Intensivos de Juticalpa, Olancho, sufrió daños en un accidente vial cuando el módulo era trasladado al vasto departamento",23-12-2020 15:22,https://www.bing.com/th?id=OVFT.-fz3KRq0mfbIyTXE2tS1bS,Chile,Radio HRN
Los ingresos tributarios cerrarán 2020 con histórica caída en Honduras,https://ultimahora.hn/los-ingresos-tributarios-cerraran-2020-con-historica-caida-en-honduras/,"Los ingresos tributarios cerrarán 2020 con una histórica caída en Honduras. Para el presente ejercicio fiscal el Congreso Nacional aprobó a finales del 2019 la cantidad de 109,721.8 millones de",23-12-2020 16:02,https://www.bing.com/th?id=OVFT.x7h77-kpg0-3byuuE4Y8-S,Chile,Ultima Hora
"Crisis por covid, Eta y Iota repercute en el ambiente navideño en Honduras",https://www.laprensa.hn/honduras/1431292-410/crisis-covid-eta-iota-repercute-ambiente-navide%C3%B1o-honduras-,"Según un informe del Instituto de Investigaciones Económicas y Sociales de la Universidad Nacional Autónoma de Honduras (UNAH), la pandemia y el confinamiento han dejado a más de 500.000 personas sin",23-12-2020 17:33,https://www.bing.com/th?id=OVFT.3cBuyW5NI28mb3CZh_FcnS,Chile,La Prensa Chicos
"Pensar en la familia, el llamado “in extremis” de Sesal previo a Navidad",https://proceso.hn/pensar-en-la-familia-el-llamado-in-extremis-de-sesal-previo-a-navidad/,"Tegucigalpa – En un llamado “in extremis”, es decir el último previo a la Navidad, las autoridades de la Secretaría de Salud de Honduras exhortaron a pensar en la familia durante los festejos de Navid",23-12-2020 19:37,https://www.bing.com/th?id=OVFT.dCzFHdRwK4l_MXrFrcW-ki,Chile,Proceso
"La crisis por covid, Eta y Iota repercute en el ambiente navideño en Honduras",https://www.radiohrn.hn/la-crisis-por-covid-eta-y-iota-repercute-en-el-ambiente-navideno-en-honduras,"A raíz de la pandemia de la covid-19 y las tormentas tropicales, cuyas pérdidas superan los 4 mil millones de dólares",23-12-2020 20:17,https://www.bing.com/th?id=OVFT.NJbbtLruUseYucXNk0DsAy,Chile,Radio HRN
Tegucigalpa: ¿En qué colonias han repuntado los casos de coronavirus?,https://www.elheraldo.hn/tegucigalpa/1431315-466/coronavirus-covid-tegucigalpa-colonias,"TEGUCIGALPA, HONDURAS.- La segunda ola de contagios en Honduras se avecina ... la Unidad de Datos de EL HERALDO se dio a la tarea de monitorear cómo ha continuado la expansión del covid-19 en los barrios y colonias de Tegucigalpa. Los datos muestran ...",23-12-2020 21:31,https://www.bing.com/th?id=OVFT.dDvSrBfNQfXFmyIw4h9HmC,Chile,El Heraldo
Aumentan a 118 mil 036 los casos de coronavirus con 448 nuevos contagios,https://proceso.hn/aumentan-a-118-mil-036-los-casos-de-coronavirus-con-448-nuevos-contagios/,"Tegucigalpa – Los casos de COVID-19 en Honduras se elevaron hoy a 118 mil 036 desde el inicio de la pandemia con la confirmación de otros 448 contagios, mientras que los pacientes recuperados aumentar",24-12-2020 01:29,https://www.bing.com/th?id=OVFT.X-BKZkhLRxo7W7_wIlF_Bi,Chile,Proceso
HONDURAS DARÁ BIENVENIDA A 2021 CON COLAPSO DE HOSPITALES Y ENCIERRO TOTAL,http://www.web.ellibertador.hn/index.php/noticias/nacionales/2542-honduras-dara-bienvenida-a-2021-con-colapso-de-hospitales-y-encierro-total,"El doctor Carlos Umaña ha dicho a EL LIBERTADOR que para las primeras tres semanas de 2021, la red hospitalaria estará totalmente colapsada a causa de los contagios navideños, y que la decisión de dej",24-12-2020 01:30,https://www.bing.com/th?id=OVFT.TENiLcWbYGP8mf21qD-4Ly,Chile,El Libertador
"Honduras sobrepasa los 118 mil contagios y 3,054 muertes por COVID",https://hondudiario.com/2020/12/23/honduras-sobrepasa-los-118-mil-contagios-y-3054-muertes-por-covid/,"El Sistema Nacional de Gestión de Riesgos (Sinager), reportó 448 nuevos casos de COVID-19 para este miércoles de 2,532 pruebas procesada, por lo que los contagios ascienden a 118,036 a nivel nacional.",24-12-2020 02:05,https://www.bing.com/th?id=OVFT.WRznRDBC9t7P_yiqOyk-wi,Chile,Hondudiario
Gobierno entregó capital semilla en insumos a beneficiarios del Proyecto Liderazgo Empresarial,http://www.elsoldehonduras.com/nacionales/gobierno-entrego-capital-semilla-en-insumos-a-beneficiarios-del-proyecto-liderazgo-empresarial/,El presidente Juan Orlando Hernández entregó este día capital semilla en insumos a un grupo de beneficiarios del Programa Proyecto Liderazgo Empresarial del Servicio Nacional de Emprendimiento y Nuevo,24-12-2020 04:25,https://www.bing.com/th?id=OVFT.277U0TUYRx4m4Jb3RYt96S,Chile,El Sol de Honduras
“La operatividad policial estará trabajando al cien por ciento#8221 : Sub Inspectora Dania Cruz,http://www.elsoldehonduras.com/nacionales/la-operatividad-policial-estara-trabajando-al-cien-por-ciento-sub-inspectora-dania-cruz/,La Policía Nacional tiene listo el despliegue de su personal que ha estado y seguirá realizando acciones preventivas para evitar la comisión de delitos durante la época navideña. La operatividad polic,24-12-2020 04:46,https://www.bing.com/th?id=OVFT.nuzFZdEsUL6FxEd5d2ZZCC,Chile,El Sol de Honduras
Ministra de Salud: Honduras sabrá en enero cuando llega la vacuna contra el COVID-19,https://www.latribuna.hn/2020/12/24/ministra-de-salud-honduras-sabra-en-enero-cuando-llega-la-vacuna-contra-el-covid-19/,"La ministra de Salud, Alba Consuelo Flores, anunció que, a finales de enero del 2021, la Organización Panamericana de la Salud (OPS) notificará a Honduras cuándo recibirá el primer lote de vacunas contra el COVID-19. Honduras, por ser parte del grupo ...",24-12-2020 10:40,https://www.bing.com/th?id=OVFT.c08Wo9gL1qxQOyVqR0rZIS,Chile,La Tribuna
Nochebuena en Honduras: ¿quiénes y hasta qué hora pueden circular?,https://tiempo.hn/circulacion-hoy-24-de-diciembre-honduras/,"Las medidas de circulación para hoy, 24 de diciembre, permitirán que los hondureños visiten a sus familiares y disfrutar de la",24-12-2020 14:00,https://www.bing.com/th?id=OVFT.qIuRREoTUoIVz2Sc6C9Qui,Chile,Tiempo
