name,url,description,datePublished,imagen,pais,Fuente
Suyapa Figueroa continúa sin recibir apoyo popular en sus eventos político-gremialistas,https://ultimahora.hn/suyapa-figueroa-continua-sin-recibir-apoyo-popular-en-sus-eventos-politico-gremialistas/,La jornada de protesta organizada por Suyapa Figueroa el día de hoy en Tegucigalpa no fue apoyada por más de una docena de médicos y ciudadanos que la acompañaron frente al Hospital Móvil de,06-02-2021 22:22,https://www.bing.com/th?id=OVFT.RZK0mFy4-VvYKl9e8GIYvC,Chile,Ultima Hora
HONDURAS / 71 MÉDICOS Y 37 ENFERMERAS SUMAN LOS MÁRTIRES DEL COVID-19,http://www.web.ellibertador.hn/index.php/noticias/nacionales/2650-honduras-71-medicos-y-37-enfermeras-suman-los-martires-del-covid-19,"Desde el inicio de la pandemia han muerto 71 médicos y 37 enfermeras, en total son 108, y ante ese panorama desalentador, el gremio reitera hasta el cansancio que el país debe volver a una cuarentena",07-02-2021 00:06,https://www.bing.com/th?id=OVFT.lBn59sg-OcDMVhwZMN1WZC,Chile,El Libertador
"Honduras reporta un total de 153,905 casos de covid-19",https://www.radiohrn.hn/honduras-reporta-un-total-de-153905-casos-de-covid-19,"Por lo tanto, se registra un acumulado de 153,905 casos de covid-19 en el territorio nacional. Del total de los pacientes diagnosticados con covid-19 en este momento se encuentran 1,016 hospitalizados",07-02-2021 03:35,https://www.bing.com/th?id=OVFT.gIp4x32AqxDkl7V1X_S3QC,Chile,Radio HRN
"Coito: “No son de los más fuertes de Europa, pero serán buenos juegos”",https://www.diariomas.hn/2021/02/05/coito-no-solo-de-los-mas-fuertes-de-europa-pero-seran-buenos-juegos/,"La selección de Honduras jugará en marzo dos partidos amistosos, el día 24 contra Bielorrusia y el 28 ante Grecia, ambos duelos serán en Europa y según",07-02-2021 11:07,https://www.bing.com/th?id=OVFT.9JGy7uFIEugXtWn11cbS7C,Chile,Mas
Muertes por covid-19 en la capital han aumentado en 200% desde diciembre de 2020,https://www.radiohrn.hn/muertes-por-covid-19-en-la-capital-han-aumentado-en-200-desde-diciembre-de-2020,"El jefe de la Región Metropolitana de Salud del Distrito Central, Harry Bock, informó que los fallecimientos por covid-19 en la capital han aumentado en un 200 por ciento desde diciembre de 2020. El g",07-02-2021 14:09,https://www.bing.com/th?id=OVFT.mLnOWNlHxXrgaQy6bexlvC,Chile,Radio HRN
EE.UU promete enfocar apoyo en combatir corrupción e impunidad en Honduras,https://hondudiario.com/2021/02/07/ee-uu-promete-enfocar-apoyo-en-combatir-corrupcion-e-impunidad-en-honduras/,***En el comunicado establece que la cooperación del gobierno estadounidense estará enfocada a atacar las raíces que generan la migración irregular incluyendo la lucha contra la corrupción y la impuni,07-02-2021 14:15,https://www.bing.com/th?id=OVFT._ijBQMCt9CR3OEy9ZAoJdy,Chile,Hondudiario
"Deuda externa asciende a casi $ 16 mil millones, un 70% del PIB",https://hondudiario.com/2021/02/07/deuda-externa-asciende-a-casi-16-mil-millones-un-70-del-pib/,"El economista investigador del Foro Social de la Deuda Externa y Desarrollo de Honduras (Fosdeh), Alejandro Kafati, manifestó que la deuda externa de Honduras asciende a casi el 70 por ciento del Prod",07-02-2021 15:00,https://www.bing.com/th?id=OVFT.NrXW6idhUtQ1JKm6YIQ2pS,Chile,Hondudiario
IHSS reporta dos decesos por COVID-19 en la capital,https://www.latribuna.hn/2021/02/07/ihss-reporta-dos-decesos-por-covid-19-en-la-capital/,Dos personas fallecieron bajo sospecha de COVID-19 en las últimas horas así lo confirmó la directora de comunicaciones del Instituto,07-02-2021 18:57,https://www.bing.com/th?id=OVFT.OnZ0Ou1qbqZNWj_NGAj9by,Chile,La Tribuna
270 emprendedores de Comayagua y Siguatepeque reciben capital semilla para reactivar sus negocios,https://ultimahora.hn/270-emprendedores-de-comayagua-y-siguatepeque-reciben-capital-semilla-para-reactivar-sus-negocios/,"170 emprendedores de Siguatepeque y 100 de Comayagua reciben en total 1,1 millones de lempiras. En sus más de 60 años, es primera vez que un presidente llega con ayuda para el gremio cultural de",07-02-2021 19:49,https://www.bing.com/th?id=OVFT.bggwJFq63ZJz-i3Z0SknqC,Chile,Ultima Hora
Fallece la doctora Wendy Núñez por COVID-19 en San Pedro Sula,https://proceso.hn/fallece-la-doctora-wendy-nunez-por-covid-19-en-san-pedro-sula/,"Otra galena se suma a las estadísticas de las muertes por COVID-19, tras reportarse este domingo el fallecimiento de la doctora Wendy Núñez en un centro asistencial de San Pedro Sula, norte de",07-02-2021 20:34,https://www.bing.com/th?id=OVFT.p2R2LnGMdjkMR-PeNeuoqy,Chile,Proceso
Muere doctora en la zona norte de Honduras por sospecha de Covid-19,https://www.laprensa.hn/sanpedro/1441121-410/muere-doctora-wendy-nunez-honduras-covid-coronavirus-pandemia,Wendy Nuñez también se desempeñó como directora y catedrádica de la Facultad de Medicina y Cirugía en la Universidad Católica de Honduras en San Pedro Sula.,07-02-2021 22:06,https://www.bing.com/th?id=OVFT.vPUln0NifJBxDgtlnkJW3C,Chile,La Prensa Chicos
Muere periodista Nelson Flores a causa de la COVID-19,https://www.latribuna.hn/2021/02/07/muere-periodista-nelson-flores-a-causa-de-la-covid-19/,El periodista Nelson Flores (52) falleció este domingo a causa de la COVID-19 tras luchar por varios días en la,07-02-2021 22:23,https://www.bing.com/th?id=OVFT.XuZ0i3a6ixH9zIyeqPK9ti,Chile,La Tribuna
Fallece por COVID-19 el periodista Nelson Flores en Tegucigalpa,https://proceso.hn/fallece-por-covid-19-el-periodista-nelson-flores-en-tegucigalpa/,"El reconocido periodista de Televisión Educativa Nacional (TEN), Canal 10 y del telenoticiero Abriendo Brecha, Nelson Flores, falleció este domingo a causa del COVID-19 en un centro asistencial de",07-02-2021 23:03,https://www.bing.com/th?id=OVFT.iUp890HpRuyiLPzzHiJXJy,Chile,Proceso
"Covid-19 pone fin a la carrera del periodista Nelson Flores, pero su legado trasciende",https://tiempo.hn/fallece-nelson-flores-covid-19/,"TEGUCIGALPA, HONDURAS. El periodista Nelson Flores, de 52 años de edad, falleció producto del Covid-19 luego de 21 días interno en un centro hospitalario de la ciudad capital del país. Según sus famil",07-02-2021 23:34,https://www.bing.com/th?id=OVFT.M8n888rVoMT9s-wZE97RCy,Chile,Tiempo
Muere por covid-19 la propietaria de una farmacia en San Pedro Sula,https://www.laprensa.hn/honduras/1441163-410/muere-por-covid-19-la-propietaria-de-una-farmacia-en-san-pedro-sula,Por sospechas de covid-19 murió en la madrugada de este domingo la propietaria de la reconocida farmacia Leyla de la colonia Satélite de San Pedro Sula. La señora Leyla Antonia George estuvo hospitalizada en el Instituto Hondureño de Seguridad Social ...,07-02-2021 23:50,https://www.bing.com/th?id=OVFT.0h02ypetcOivv7Gc6CRrjC,Chile,La Prensa Chicos
Fallece por COVID-19 la doctora Wendy Núñez en el IHSS de SPS,https://tiempo.hn/fallece-doctora-wendy-nunez/,"La doctora Wendy Núñez, falleció por COVID-19 en San Pedro Sula. SAN PEDRO SULA. La doctora Wendy Argentina Núñez Flores se sumó a la lisa de víctimas del personal médico de primera línea que ha perdi",07-02-2021 23:55,https://www.bing.com/th?id=OVFT.NbersrHLCMYByBgDJ_T-Ri,Chile,Tiempo
