name,url,description,datePublished,imagen,pais,Fuente
Honduras registra 46 fallecidos por COVID-19 y 148 contagios en el exterior,https://www.latribuna.hn/2020/05/13/honduras-registra-46-fallecidos-por-covid-19-y-148-contagios-en-el-exterior/,"Honduras registra 46 de sus ciudadanos muertos por COVID-19 en el exterior, principalmente en Estados Unidos y España, mientras que el número de contagios se acerca a los 150, dijo a Efe la vicecancil",14-05-2020 05:37,https://www.bing.com/th?id=ON.0C1BE5D7F0559D273C6E6CCEB2C3C3A3,Chile,La Tribuna
"Honduras alcanza 2,255 casos y 123 muertes por Covid-19; Cortés sin síntomas de mejora",https://hondudiario.com/2020/05/13/honduras-alcanza-2255-casos-y-123-muertes-por-covid-19-cortes-sin-sintomas-de-mejora/,"El Sistema Nacional de Gestión de Riesgos (Sinager), informó este miércoles que de 451 pruebas para diagnosticar Covid-19 en la población hondureña, 175 dieron positivo sumando así un total de 2,255 c",14-05-2020 14:46,https://www.bing.com/th?id=ON.C515B27FE043122D642034CBE9DF56F6,Chile,Hondudiario
Subsidios se darán a través de transferencias bancarias o electrónicas durante emergencia,https://www.laprensa.hn/especiales/coronavirus/1379738-410/instituciones-estado-entrega-subsidios-transferencias-bancarias-emergencia,"El objetivo es que los subsidios sean más fáciles de auditar, verificar y controlar durante la emergencia por coronavirus en Honduras. Tegucigalpa, Honduras. Para realizar una labor efectiva para apoy",14-05-2020 17:50,https://www.bing.com/th?id=ON.25B5786968348F69B83DD8A11195A304,Chile,La Prensa Chicos
"Eliminatorias de Concacaf al Mundial de Qatar serán en grupos, pero arrancarían hasta 2021",https://www.diez.hn/laseleccion/1379729-498/eliminatorias-concacaf-mundial-de-qatar-sera-en-grupos-pero-arrancara-2021,"Es un hecho, las eliminatorias al Mundial de Qatar en Concacaf tendrán un cambio. Ya lo ha confirmado el presidente del organismo, Víctor Montagliani; quien dejó claro que la hexagonal no podrá disput",14-05-2020 18:32,https://www.bing.com/th?id=ON.53A45B92A9953971F954A858C4948240,Chile,diez.hn
El Distrito Central registra casos mixtos de dengue y coronavirus,https://www.elheraldo.hn/tegucigalpa/1379632-466/el-distrito-central-registra-casos-mixtos-de-dengue-y-coronavirus,"El aislamiento social ordenado por el gobierno, además de frenar la propagación del nuevo coronavirus, debe ser aprovechado por la ciudadanía para erradicar los criaderos de zancudos en sus casas TEGU",14-05-2020 18:51,https://www.bing.com/th?id=ON.3AC7D03EBD8EE68081D7DC1231BEB8C2,Chile,El Heraldo
Canadá proveerá $.2.5 millones para apoyar emergencia de COVID-19 en Honduras,https://hondudiario.com/2020/05/14/canada-proveera-2-5-millones-para-apoyar-emergencia-de-covid-19-en-honduras/,"*** Este apoyo resulta del compromiso de Canadá en apoyar a Honduras para cubrir sus necesidades urgentes en el marco de la emergencia del COVID-19. Tegucigalpa, Honduras. Canadá anunció que proveerá",14-05-2020 19:49,https://www.bing.com/th?id=ON.5C57377BE628BA71D789B43F8A295065,Chile,Hondudiario
Mapa: Regresa la contaminación después de cuarentena por coronavirus,https://www.laprensa.hn/premium/1379769-410/mapa-interactivo-regresa-la-contaminacion-despues-de-cuarentenas-por-coronavirus,"Luego de varios días en confinamiento por el Covid-19 en casi todo el mundo, varios países han reactivado su economía, el efecto en la naturaleza ya se puede notar. Según el sitio IQAir, que mide la c",14-05-2020 21:38,https://www.bing.com/th?id=ON.D6660F83A5B123CC39EA006662D294D2,Chile,La Prensa Chicos
Viceministro de la SAG: Gobierno garantiza que no habrá escasez de alimentos,http://www.elsoldehonduras.com/nacionales/viceministro-de-la-sag-gobierno-garantiza-que-no-habra-escasez-de-alimentos/,"Tegucigalpa. El viceministro de la Secretaría de Agricultura y Ganadería (SAG), José Benítez, anunció este jueves que el Gobierno del presidente Juan Orlando Hernández ha tomado las acciones correspon",14-05-2020 22:31,https://www.bing.com/th?id=ON.20F2D657B89E329F837118710F1A7E3E,Chile,El Sol de Honduras
175 nuevos casos de covid-19 reporta SINAGER y el total asciende a 2255,http://www.elsoldehonduras.com/salud/175-nuevos-casos-de-covid-19-reporta-sinager-y-el-total-asciende-a-2255/,Tegucigalpa. El Sistema Nacional de Gestión de Riesgos (Sinager) informó este miércoles que se registraron 175 nuevos casos positivos de covid-19 y que la cifra total en el país se elevó a 2255. Los n,14-05-2020 22:31,https://www.bing.com/th?id=ON.20F2D657B89E329F837118710F1A7E3E,Chile,El Sol de Honduras
10 de los 28 municipios de Francisco Morazán reportan casos positivos,https://www.elheraldo.hn/tegucigalpa/1379878-466/10-de-los-28-municipios-de-francisco-moraz%C3%A1n-reportan-casos-positivos,"Las autoridades de la Región Departamental de Salud, a cargo de 27 municipios, aseguran que ninguno de los 42 casos es autóctono sino de pacientes procedentes del Distrito Central El primer caso posit",15-05-2020 02:42,https://www.bing.com/th?id=ON.AFC51553D38C217F37BDBC258B931AD0,Chile,El Heraldo
A través de OPS Canadá dará apoyo a Honduras,https://www.latribuna.hn/2020/05/15/a-traves-de-ops-canada-dara-apoyo-a-honduras/,El gobierno de Canadá anunció ayer que apoyará la lucha de Honduras en contra del COVID-19 por medio de la Organización Panamericana de la Salud (OPS). “Canadá se complace en anunciar que proveerá 2.5,15-05-2020 08:03,https://www.bing.com/th?id=ON.14D47E0ECB879921ADE4A9C9C3C18FB0,Chile,La Tribuna
