name,url,description,datePublished,imagen,pais,Fuente
Pandemia amenaza recaudación tributaria de Honduras y le obliga a endeudarse,https://www.proceso.hn/mas-noticias/32-m%C3%A1s-noticias/pandemia-amenaza-recaudacion-tributaria-de-honduras-y-le-obliga-a-endeudarse.html,"Tegucigalpa - La crisis económica de Honduras, que se ha agudizado con la pandemia de COVID-19, podría provocar una caída de hasta el 50 % de la recaudación tributaria en 2020 y un mayor endeudamiento",20-06-2020 15:40,https://www.bing.com/th?id=ON.DC4D4F9C7761FE33B674D79617FADDD0,Chile,Proceso
Más de mil nuevos casos de Covid-19 en Honduras y las muertes ascienden a 639,https://hondudiario.com/2020/07/05/mas-de-mil-nuevos-casos-de-covid-19-en-honduras-y-las-muertes-ascienden-a-339/,"El Sistema Nacional de Gestión de Riesgo (Sinager), informó que el laboratorio realizo un total de 1,796 pruebas para detectar Covid-19 de las cuales resultaron positivas 1, 022 para hacer un total de",06-07-2020 15:37,https://www.bing.com/th?id=ON.17D10B868B71E1AED886F6B83D66BCF5,Chile,Hondudiario
Alcalde de Taulabé es hospitalizado con diagnóstico de coronavirus,https://www.laprensa.hn/honduras/1391949-410/honduras-coronavirus-alcalde-taulabe-cruz_roja,"El edil ingresó en estado crítico al hospital de Siguatepeque y es tratado con geo plasma por la Cruz Roja. Comayagua, Honduras Familiares del alcalde de Taulabé, Comayagua, Lectonio Maldonado, confir",06-07-2020 16:42,https://www.bing.com/th?id=ON.9154D2447BFDAF09D452C675A327927F,Chile,La Prensa Chicos
Honduras: Pandemia del covid-19 provoca estrepitosa caída del 44% en precio del aceite de palma africana,https://radiohrn.hn/honduras-pandemia-del-covid-19-provoca-estrepitosa-caida-del-44-en-precio-del-aceite-de-palma-africana/,"Baja precio de la palma africana por efecto pandemia. De un 44 por ciento es la caída en el precio de aceite de palma africana en 2020, a causa de la pandemia del coronavirus, confirmó el lunes el pre",06-07-2020 17:40,https://www.bing.com/th?id=ON.2B574745F8B1DDD3EA4DA655258744D8,Chile,Radio HRN
CNA denuncia mala calidad de mascarillas adquiridas por Copeco e Invest-H,https://www.elheraldo.hn/pais/1391950-466/honduras-cna-mascarillas-pandemia-copeco-investh,"En el séptimo informe de ""La corrupción en tiempos del covid-19"", el CNA alerta sobre la calidad de las mascarillas, ya que ""miles de ellas no están certificadas para proteger del contagio de la pande",06-07-2020 17:48,https://www.bing.com/th?id=ON.A31F5C261D8F5E34D36AD217D6151259,Chile,El Heraldo
Fuerzas vivas piden cierre de Olancho para frenar COVID-19,https://www.latribuna.hn/2020/07/06/fuerzas-vivas-piden-cierre-de-olancho-para-frenar-covid-19/,"Ante la cantidad de casos de COVID-19 en el departamento de Olancho, los alcaldes, fuerzas vivas e iglesias Evangélica y Católica, solicitaron a la Mesa Multisectorial de Apertura Inteligente el retor",06-07-2020 20:58,https://www.bing.com/th?id=ON.450ED4A2BE9BB878BF64C55555A252B4,Chile,La Tribuna
CMH da ultimátum: Médicos amenazan con abandonar hospitales sino cierran el país por 15 días,https://elpatriota.hn/2020/07/06/cmh-da-ultimatum-medicos-amenazan-con-abandonar-hospitales-sino-cierran-el-pais-por-15-dias/,"TEGUCIGALPA, HONDURAS. La advertencia obedece por el aumento de casos positivos, tanto en Tegucigalpa, como en San Pedro Sula. Al respecto, la titular del CMH, Suyapa Figueroa, denunció que estas empr",07-07-2020 00:58,https://www.bing.com/th?id=ON.57890BA15208A07167280604D00B2AB4,Chile,El Patriota
Muertes por Covid-19 se triplican luego de un mes de reapertura inteligente,https://hondudiario.com/2020/07/06/muertes-por-covid-19-se-triplican-luego-de-un-mes-de-reapertura-inteligente/,"Honduras reportó tres veces más muertes y más del doble en casos por coronavirus luego de la reapertura económica, según cifras del Sistema Nacional de gestión de Riesgo (Sinager). Esta información oc",07-07-2020 01:26,https://www.bing.com/th?id=ON.26B8F5EC0C8701BFBCE67A9F7CD5A934,Chile,Hondudiario
Agroindustria azucarera: orgullo nacional para el país,https://www.latribuna.hn/2020/07/07/agroindustria-azucarera-orgullo-nacional-para-el-pais/,"El coronavirus (COVID-19) afecta a Honduras, así como al resto del mundo; y la seguridad alimentaria es una de las prioridades. En estos tiempos duros, una de las industrias que se ha solidarizado más",07-07-2020 16:16,https://www.bing.com/th?id=ON.CACAE2257AA161B971BC637521A0588E,Chile,La Tribuna
