name,url,description,datePublished,imagen,pais,Fuente
Covax enviará 428 mil dosis de vacunas anticovid a Honduras,https://www.latribuna.hn/2021/02/27/covax-enviara-428-mil-dosis-de-vacunas-anticovid-a-honduras/,"La alianza Covax/Gavi ya confirmó que entregará a Honduras 428 mil dosis de vacunas contra el COVID-19, mismas que llegarán",27-02-2021 11:16,https://www.bing.com/th?id=OVFT.lsLxoXqtRo8Yvmwbm4xcRi,Chile,La Tribuna
"Francis Contreras: no se deje estafar, la vacuna no es algo que se puede ofrecer en redes sociales",https://www.radiohrn.hn/francis-contreras-no-se-deje-estafar-la-vacuna-no-es-algo-que-se-puede-ofrecer-en-redes-sociales,"El 25 de febrero, llegaron al país cinco mil de la vacuna contra el covid-19, de la farmacéutica Moderna, que fueron donadas por Israel",27-02-2021 16:24,https://www.bing.com/th?id=OVFT.CmgR1lu2ER02ncpUAuN3ui,Chile,Radio HRN
HONDUREÑOS INDIGNADOS CON POLÍTICOS POR DEGENERAR VACUNACIÓN,http://www.web.ellibertador.hn/index.php/noticias/nacionales/2725-hondurenos-indignados-con-politicos-por-degenerar-vacunacion,Bermúdez ha destacado más en medios de comunicación como furibunda activista del régimen Hernández que como abnegada médica de primera línea en una sala de Cuidados Intensivos enfrentando el mortal vi,27-02-2021 20:59,https://www.bing.com/th?id=OVFT.RrG5pe3658y52WL2DOU7Xy,Chile,El Libertador
"Testimonios: ""El covid-19 mató a un tío, a mi mamá y mi abuela en menos de un mes""",https://www.laprensa.hn/honduras/1443786-410/relatos-familiares-contagios-covid-primer-a%C3%B1o-pandemia-muertes-victimas-honduras,Miles de familias han atravesado por duros procesos de duelo y dolor tras perder a sus seres queridos a causa del covid-19.,27-02-2021 21:10,https://www.bing.com/th?id=OVFT.FFeAUU9ohbWWt1bXpcZ-5i,Chile,La Prensa Chicos
Personal de primera línea de los principales hospitales de San Pedro Sula ya está inmunizado contra la covid-19,http://www.eldiario.hn/personal-de-primera-linea-de-los-principales-hospitales-de-san-pedro-sula-ya-esta-inmunizado-contra-la-covid-19/,"San Pedro Sula. - La Secretaría de Salud dio por finalizado al 100 %, este sábado en la tarde, el proceso de inmunización contra la covid-19 del personal de primera línea de los principales hospitales",28-02-2021 02:27,https://www.bing.com/th?id=OVFT.NsSW3I9eBK-6qandzqHRoS,Chile,El Diario
"Covid-19 sigue en aumento en Honduras; hasta hoy deja 4,141 muertes",https://www.elheraldo.hn/pais/1446057-466/covid-19-aumento-honduras-4141-muertes-169-mil-casos,Sinager confirmó que Honduras esta cerca de los 170 mil casos de coronavirus; más de 66 mil compatriotas han logrado vencer el virus,28-02-2021 15:25,https://www.bing.com/th?id=OVFT.yLvqxFQrN3Kq1qqEbQASpS,Chile,El Heraldo
"Covid-19 sigue en aumento en Honduras; hasta este 28 de febrero deja 4,141 muertes",https://www.elheraldo.hn/pais/1446057-466/covid-honduras-4141-muertes-169-mil-casos,Sinager confirmó que Honduras está cerca de los 170 mil casos de coronavirus; más de 66 mil compatriotas han logrado vencer el virus,28-02-2021 16:26,https://www.bing.com/th?id=OVFT.yLvqxFQrN3Kq1qqEbQASpS,Chile,El Heraldo
"SESAL: Se superó la meta de 2,500 vacunados contra COVID-19",https://tiempo.hn/vacuna-covid-inmunizados-honduras/,"TEGUCIGALPA, HONDURAS. Un total de 2.684 trabajadores de la salud fueron inmunizados con la primera dosis de la vacuna contra la COVID-19 de la farmacéutica Moderna que donó el Gobierno de Israel. Así",01-03-2021 01:38,https://www.bing.com/th?id=OVFT.t97XsLKJKMeTqvrieF9C_i,Chile,Tiempo
Mesa Multisectorial presentará propuesta de suspender restricciones en elecciones internas,https://www.latribuna.hn/2021/03/01/mesa-multisectorial-presentara-propuesta-de-suspender-restricciones-para-las-elecciones-internas/,"El representante de la Asociación Nacional de Empleados Públicos de Honduras (Andeph) en la Mesa Multisectorial, César Chirinos, expresó que",01-03-2021 08:32,https://www.bing.com/th?id=OVFT.C5GmrzJcRYr-VSzozTq4BC,Chile,La Tribuna
"Honduras alcanza los 4,151 muertos por coronavirus",https://www.laprensa.hn/honduras/1446283-410/honduras-muertos-covid-coronavirus-pandemia-sinager,El Sistema Nacional de Gestión de Riesgos informó que en 2021 ha tenido una alta incidencia de contagios y decesos por Covid-19.,01-03-2021 14:36,https://www.bing.com/th?id=OVFT.zvh1wvPX3J8vGazwoZ-v0y,Chile,La Prensa Chicos
"AVIANCA ANUNCIA SUSPENSIÓN TEMPORAL DE VARIAS RUTAS A ESTADOS UNIDOS, EUROPA, CENTROAMÉRICA Y SURAMÉRICA POR LA PANDEMIA DE COVID-19",https://ultimahora.hn/avianca-anuncia-suspension-temporal-de-varias-rutas-a-estados-unidos-europa-centroamerica-y-suramerica-por-la-pandemia-de-covid-19/,"Avianca anunció este lunes la suspensión temporal de varias rutas a Estados Unidos, Europa, Centroamérica y Suramérica para ajustar sus operaciones a la demanda de pasajeros, mermada por la",01-03-2021 16:24,https://www.bing.com/th?id=OVFT.EiVlTNuR_Nnha9LKW93Wyi,Chile,Ultima Hora
