name,url,description,datePublished,imagen,pais,Fuente
Honduras llega a los 3.100 casos de coronavirus al confirmarse 145 contagios más,http://www.elsoldehonduras.com/nacionales/honduras-llega-a-los-3-100-casos-de-coronavirus-al-confirmarse-145-contagios-mas/,"Honduras sumó 3.100 casos de coronavirus al confirmarse 145 nuevos positivos tras la realización de 540 pruebas en todo el país, informó hoy el portavoz oficial del Sistema Nacional de Gestión de Ries",21-05-2020 18:52,https://www.bing.com/th?id=ON.305F8F0BF3595F077959B5EA37528923,Chile,El Sol de Honduras
SAG agiliza entrega del Bono Cafetalero en 15 departamentos,http://www.elsoldehonduras.com/agroindustria/sag-agiliza-entrega-del-bono-cafetalero-en-15-departamentos/,"Con una cobertura de entrega en 15 departamentos y 222 municipios, se podrán cubrir unas 248,131.37 manzanas con el Bono Cafetalero que otorga el Gobierno del Presidente Juan Orlando Hernández, a los",21-05-2020 18:52,https://www.bing.com/th?id=ON.9347DD43EDFF90C3BF04370B3D610E82,Chile,El Sol de Honduras
"FUNAZUCAR dona 1,500 mascarillas a las alcaldías de Cantarranas, Villa de San Francisco y Morocelí",https://hondudiario.com/2020/05/21/funazucar-dona-1500-mascarillas-a-las-alcaldias-de-cantarranas-villa-de-san-francisco-y-moroceli/,"La Fundación de la Agroindustria Azucarera de Honduras, FUNAZUCAR, entregó un donativo de 1,500 mascarillas a las alcaldías de Cantarranas, Villa de San Francisco en el departamento de Francisco Moraz",21-05-2020 20:18,https://www.bing.com/th?id=ON.AB3C0C8839A571D67D80673C00DB7982,Chile,Hondudiario
Congreso de Honduras aprueba ley para uso obligatorio de mascarillas en el país,https://www.diez.hn/coronavirus/1381364-441/congreso-nacional-honduras-ley-uso-obligatorio-mascarillas-coronavirus-covid-19,"El Congreso Nacional de Honduras aprobó este día mediante una sesión virtual, la Ley de uso obligatorio de mascarillas y aplicación de protocolos de bioseguridad, esto con el objetivo de aminorar los",21-05-2020 22:32,https://www.bing.com/th?id=ON.6AE80AE825A4753A25961A57F6E97D3E,Chile,diez.hn
SESAL y Comité Internacional de la Cruz Roja prioriza atención a privados de libertad y migrantes retornados,http://www.eldiario.hn/sesal-y-comite-internacional-de-la-cruz-roja-prioriza-atencion-a-privados-de-libertad-y-migrantes-retornados/,"San Pedro Sula.- En una reunión sostenida entre autoridades de la SESAL y la Comisión Internacional de la Cruz Roja (CRIC), se acordó diseñar una hoja de ruta para recibir y atender a migrantes irregu",22-05-2020 02:26,https://www.bing.com/th?id=ON.0229AEB5C2D2039344FF70E45652A7B5,Chile,El Diario
SINAGER confirma 104 casos nuevos de COVID-19,https://www.laprensa.hn/videos/?mId=hsDkVoaU&c=US&c=US&c=US&c=US&c=U,"Honduras llegó este jueves a 156 muertos a causa del COVID-19, mientras que los casos de contagios con la enfermedad ya suman 3,204 desde marzo que se",22-05-2020 02:38,https://www.bing.com/th?id=ON.F4B8623EC065C314571FFAD51F5EAC4B,Chile,La Prensa Chicos
Científico Marco Tulio Medina: OPS donará tratamiento que disminuye impacto del COVID-19,https://www.latribuna.hn/2020/05/22/cientifico-marco-tulio-medina-ops-donara-tratamiento-que-disminuye-impacto-del-covid-19/,El Estudio Solidaridad de un grupo de científicos hondureños ha permitido que la Organización Mundial de La Salud (OMS) tome en consideración la recomendación de cuatro medicamentos que disminuirán el,22-05-2020 10:04,https://www.bing.com/th?id=ON.98C8574FF1250945B5596FB01652EF67,Chile,La Tribuna
"Transportista hondureño de carga pesada denuncia retención de más de 600 rastras en Costa Rica, 100 son de Honduras",https://radiohrn.hn/transportista-hondureno-de-carga-pesada-denuncia-retencion-de-mas-de-600-rastras-en-costa-rica-100-son-de-honduras/,"El transportistas de carga pesada, Rufino Canaca, denunció el jueves por medio del programa La Tarde que se encuentran varados en frontera entre Costa Rica y Nicaragua más de 600 rastras de varios paí",22-05-2020 11:55,https://www.bing.com/th?id=ON.44331A7D8B62FD7A41C50F9FFADF74C8,Chile,Radio HRN
"Coronavirus: Con 104 casos más, Honduras eleva la cifra de contagiados a 3,204",https://radiohrn.hn/coronavirus-con-104-casos-mas-honduras-eleva-la-cifra-de-contagiados-a-3204/,"Honduras registra este 21 de mayo, 104 pruebas positiva por covid-19 y la cifra se eleva a un total de 3,204 contagiados. El Sistema Nacional de Riesgos (Sinager), realizó 505 pruebas, de la cuales 10",22-05-2020 13:13,https://www.bing.com/th?id=ON.29FD72B1D3E433C4C9F52A8024D691A9,Chile,Radio HRN
Salvador Moncada: No sabemos las consecuencias del Covid-19 en los niños,https://www.elheraldo.hn/pais/1381461-466/salvador-moncada-no-sabemos-las-consecuencias-del-covid-19-en-los-ni%C3%B1os,"TEGUCIGALPA, HONDURAS.-El reconocido científico hondureño, Sir Salvador Moncada, aseguró que los niños se han infectado por Covid-19 en todos los países del mundo, pero menos que los viejos. “En todas",22-05-2020 15:17,https://www.bing.com/th?id=ON.D95BD77DC7B2196E8A5BF566AA70B9AB,Chile,El Heraldo
El blog de Nerlyn Membreño: ¿Cómo realizar entrenamientos en tiempos de Covid-19?,https://www.diez.hn/blogs/1381494-500/nerlyn-membreno-entrenamientos-equipos-futbolistas-coronavirus-covid-19,"El exjugador y ahora director técnico, Nerlyn Membreño, analiza cómo se puede volver al fútbol en Honduras en tiempos del coronavirus Covid-19. Estamos en tiempos difíciles y lamento que muchas famili",22-05-2020 15:46,https://www.bing.com/th?id=ON.CCA77BF7476F47530245A0E33FE73395,Chile,diez.hn
Villanueva: inspeccionarán que maquilas cumplan medidas anticontagio,https://tiempo.hn/villanueva-inspeccionaran-que-maquilas-cumplan-medidas-anticontagio/,"CORTÉS, HONDURAS. Las maquilas que operan en Villanueva están descuidando que sus empleados sigan correctamente las medidas de bioseguridad para contener la propagación del Covid-19, así lo dijo el al",22-05-2020 18:07,https://www.bing.com/th?id=ON.E3DB13D2721C8AA82683F3100A997735,Chile,Tiempo
Ocho comerciantes del Zonal Belén dan positivo de COVID-19,https://www.latribuna.hn/2020/05/22/ocho-comerciantes-del-zonal-belen-dan-positivo-de-covid-19/,"Ocho comerciantes y empleados del mercado Zonal Belén dieron positivo en las pruebas de COVID-19, los mismos fueron puestos en cuarentena, así lo confirmó el presidente de la Federación de Mercados de",22-05-2020 19:15,https://www.bing.com/th?id=ON.9C3CDEC92C68A4AAA0CA6B80B1F92FDE,Chile,La Tribuna
UNAH desmiente que se haya planteado rebaja de salarios a su personal,https://www.elheraldo.hn/pais/1381555-466/unah-desmiente-que-se-haya-planteado-rebaja-de-salarios-a-su-personal,"TEGUCIGALPA, HONDURAS.-La Junta de Dirección de la Universidad Nacional Autónoma de Honduras (UNAH) desmintió este viernes haberse planteado una rebaja salarial para sus empleados, como medida socioec",22-05-2020 20:12,https://www.bing.com/th?id=ON.7596D87619FEFDD285F0CC11A29AF839,Chile,El Heraldo
Hospitales de San Pedro Sula reportan tres nuevos casos de una variante de kawasaki,https://www.laprensa.hn/honduras/1381559-410/hospitales-san-pedro-sula-tres-nuevos-casos-variante-kawasaki,"El kawasaki provoca fiebre elevada durante varios días y los niños con la enfermedadpueden tener síntomas como sarpullidos, hinchazón en el cuello, manos y los pies. San Pedro Sula, Cortés. Con la lle",22-05-2020 21:01,https://www.bing.com/th?id=ON.87D6B994C7510ED3A913A153FE536F79,Chile,La Prensa Chicos
