name,url,description,datePublished,imagen,pais,Fuente
Tegucigalpa reporta menos de 20 casos de covid-19 después de 71 días,https://www.elheraldo.hn/tegucigalpa/1400852-466/tegucigalpa-casos-coronavirus-agosto,"Después de ese tiempo los reportes en la ciudad eran elevados, ya que los casos iban de 250 a 350 incidencias diarias TEGUCIGALPA, HONDURAS.-Las altas cifras que reportaba a diario el Sistema Nacional",13-08-2020 17:10,https://www.bing.com/th?id=ON.B30E329E0CEB97B1A19984EC34B5F1FD,Chile,El Heraldo
Muere por coronavirus el doctor Juan Cálix Ardón en el IHSS de Tegucigalpa,https://www.laprensa.hn/honduras/1400976-410/muere-coronavirus-doctor-juan-calix-ardon-ihss-tegucigalpa,El médico que perdió la batalla contra la Covid-19 estuvo más de 15 días en cuidados intensivos. Tegucigalpa. Un héroe más que pierde el gremio médico hondureño. Este jueves falleció el doctor Juan Is,13-08-2020 21:07,https://www.bing.com/th?id=ON.E2E7A15CC562B097367C19DD4B0C9DB9,Chile,La Prensa Chicos
En ocho municipios de Copán habilitan centros de triajes y unidades estabilizadoras con fondos del Programa Fuerza Honduras,http://www.elsoldehonduras.com/nacionales/en-ocho-municipios-de-copan-habilitan-centros-de-triajes-y-unidades-estabilizadoras-con-fondos-del-programa-fuerza-honduras/,"Gracias a los recursos otorgados por el Gobierno del presidente Juan Orlando Hernández, a través del Programa Fuerza Honduras, ocho municipios del departamento de Copán habilitarán centros de triaje y",14-08-2020 00:32,https://www.bing.com/th?id=ON.F09E3014A41E4807C2F1B6D0FBF3F83D,Chile,El Sol de Honduras
II Feria Virtual ¨Honduras Consume Local¨ es una oportunidad para repotenciar a las empresas de los MIPYMES,http://www.elsoldehonduras.com/nacionales/ii-feria-virtual-%C2%A8honduras-consume-local%C2%A8-es-una-oportunidad-para-repotenciar-a-las-empresas-de-los-mipymes/,"A cuatro días del inicio de la II edición de la feria virtual ¨Honduras Consume Local¨, el Ministro Director del Servicio Nacional de Emprendimiento y Pequeños Negocios, Luis Colindres, dijo que ¨los",14-08-2020 00:32,https://www.bing.com/th?id=ON.F05399E78CDB2B54A78C8104632AC48F,Chile,El Sol de Honduras
Jefe de Región Metropolitana: Vacuna contra COVID-19 llegará a Honduras hasta el próximo año,https://www.latribuna.hn/2020/08/14/jefe-de-region-metropolitana-vacuna-contra-covid-19-llegara-a-honduras-hasta-el-proximo-ano/,"El jefe de la Región Sanitaria Metropolitana del Distrito Central, Harry Book, manifestó que la vacuna contra el COVID-19 llegará hasta el próximo año a Honduras. El funcionario se refirió al tema, lu",14-08-2020 15:07,https://www.bing.com/th?id=ON.CBBA2445418F50100C19A8BD61F9F565,Chile,La Tribuna
Médicos siguen perdiendo la batalla contra el Covid-19 hoy otro doctor es víctima del virus,https://ultimahora.hn/?q=content/m%C3%A9dicos-siguen-perdiendo-la-batalla-contra-el-covid-19-hoy-otro-doctor-es-v%C3%ADctima-del-virus,"Enviado por Editor 1 el Jue, 08/13/2020 - 09:58",14-08-2020 15:19,https://www.bing.com/th?id=ON.BCDA6F2D601657A12F1FAAC0ED0724A2,Chile,Ultima Hora
"Honduras registra 385 casos y 9 muertes nuevas, pruebas caen en 43%",https://hondudiario.com/2020/08/13/honduras-registra-385-casos-y-9-muertes-nuevas-pruebas-caen-en-43/,"*** Hasta el jueves de la semana anterior Honduras realizó 5,260 pruebas de COVID-19, en lo que va de esta semana solamente ha completado 3,877, una caída de casi la mitad. Tegucigalpa, Honduras. El S",14-08-2020 15:33,https://www.bing.com/th?id=ON.DDCC9B18BEC53B7F0146CF2CF503569F,Chile,Hondudiario
Honduras solo ha hecho pruebas PCR a 1.2 por ciento de la población,https://www.elheraldo.hn/pais/1401136-466/honduras-solo-ha-hecho-pruebas-pcr-a-12-por-ciento-de-la,"La jefa de la Unidad de Vigilancia de la Salud, Karla Pavón, informó a EL HERALDO que hoy adquirirán 10,000 pruebas PCR y la otra semana más para aumentar la capacidad diagnóstica TEGUCIGALPA, HONDURA",14-08-2020 16:07,https://www.bing.com/th?id=ON.5FA3A849BD0355EB1018563CB9545EDC,Chile,El Heraldo
México y Japón apoyan a Honduras ante la pandemia por Covid-19,https://hondudiario.com/2020/08/14/mexico-y-japon-apoyan-a-honduras-ante-la-pandemia-por-covid-19/,El Gobierno de México por medio de la Agencia Mexicana de Cooperación Internacional para el Desarrollo (AMEXCID) y el Gobierno de Japón a través de la Agencia de Cooperación Internacional del Japón (J,14-08-2020 17:56,https://www.bing.com/th?id=ON.015C61D3465C1013E840FBBE5205D014,Chile,Hondudiario
Honduras: Doce decesos por COVID-19 reportan hospitales,https://www.latribuna.hn/2020/08/14/honduras-doce-decesos-por-covid-19-reportan-hospitales/,"Doce pacientes fallecieron sospechosos de COVID-19, en el Hospital de Especialidades del Instituto Hondureño de Seguridad Social (IHSS) y el Hospital Escuela de la capital. La portavoz del Seguro Soci",14-08-2020 18:14,https://www.bing.com/th?id=ON.04A82DCB8BD7131731044D4704198AFA,Chile,La Tribuna
Embajador de México en Honduras se contagia de coronavirus,https://www.laprensa.hn/honduras/1401234-410/embajador-mexico-honduras-coronavirus-,"El embajador de México en Honduras, David Jiménez, fue trasladado ayer a su país para ser atendido por Covid-19. El representante diplomático de México en el país centroamericano dio positivo al nuevo",14-08-2020 18:33,https://www.bing.com/th?id=ON.2FAB84BBA1FE8844A5DEB1E0D8297558,Chile,La Prensa Chicos
