name,url,description,datePublished,imagen,pais,Fuente
Distribuyen tanques de oxígeno a cuatro centros penitenciarios,http://www.elsoldehonduras.com/nacionales/distribuyen-tanques-de-oxigeno-a-cuatro-centros-penitenciarios/,"Ocho cilindros de oxigeno de 8,500 libras cada uno fueron comprados por el Instituto Nacional Penitenciario (INP) para dotar los establecimientos que albergan la mayor cantidad de personas privadas de",01-09-2020 22:18,https://www.bing.com/th?id=OVFT.kUKHlDrPWMvMoJiainoYvC,Chile,El Sol de Honduras
Chicha y Limón martes 1 de septiembre de 2020,http://www.eldiario.hn/chicha-y-limon-martes-1-de-septiembre-de-2020/,"¡BIENVENIDO SEPTIEMBRE!!… Hoy arranca el noveno mes del año: mes de la patria, de cierre de ciclos y de lluvias por doquier… Ojalá y también llueva en el Valle del Calore… Seguimos rememorando ágapes",01-09-2020 23:24,https://www.bing.com/th?id=OVFT.Q5mqcza0bz2UCkxLLFuCAS,Chile,El Diario
"Honduras, entre los países beneficiados con presupuesto para vacunas covid por parte del BCIE",https://www.radiohrn.hn/honduras-entre-los-paises-beneficiados-con-presupuesto-para-vacunas-covid-por-parte-del-bcie,El Banco Centroamericano de Integración Económica (BCIE) aprobó un fondo de 400 millones de dólares para que los ocho países del Sistema de la Integración Centroamericana (SICA) puedan adquirir vacunas contra la Covid-19. De acuerdo con el presidente ...,02-09-2020 00:00,https://www.bing.com/th?id=OVFT.ITBWJtj43xi2LIrwYtSTAS,Chile,Radio HRN
Honduras registra 36 nuevos fallecimientos por coronavirus,https://www.laprensa.hn/honduras/1405719-410/honduras-36-muertes-fallecimientos-coronavirus-,"Según el Sinager, de 1,711 nuevas pruebas de laboratorio PCR procesadas, no todas de una misma fecha, 757 dieron positivo, con lo que la cifra de contagios superó los 62,526. Tegucigalpa, Honduras Los",02-09-2020 00:00,https://www.bing.com/th?id=OVFT.tewfOVq8jcJy7Yz0GS-tVy,Chile,La Prensa Chicos
"Coronavirus Honduras: Se reportan 755 nuevos casos positivos y se superan los 1,880 muertos",https://www.diez.hn/coronavirus/1405464-441/coronavirus-honduras-se-reportan-755-nuevos-casos-positivos-muertos-covid19,"Estamos comenzando el sexto mes de la pandemia y ya se llega a 61,769 compatriotas que han luchado con la enfermedad Las muertes por coronavirus en Honduras siguen creciendo día con día. Este martes s",02-09-2020 02:56,https://www.bing.com/th?id=OVFT.31i6zNIMQDmtNZaHPVZjuC,Chile,diez.hn
Otro médico muere por COVID-19 en Honduras,https://www.latribuna.hn/2020/09/02/otro-medico-muere-por-covid-19-en-honduras/,"Otro profesional de la medicina murió ayer martes en la sala de COVID-19 del Hospital Mario Catarino Rivas de San Pedro Sula, Cortés, zona norte de Honduras. Se trata del doctor José Torres, quien ten",02-09-2020 14:21,https://www.bing.com/th?id=OVFT.G5dCMLIqn1yuk7FyfcDYYy,Chile,La Tribuna
Avizoran un severo retroceso en el sistema educativo de Honduras,https://www.elheraldo.hn/pais/1405472-466/avizoran-un-severo-retroceso-en-el-sistema-educativo-de-honduras,"Las autoridades señalan que se ha logrado una cobertura de 86.3 por ciento pero estiman la deserción de unos 300 mil estudiantes del sistema TEGUCIGALPA, HONDURAS.-De las aulas de clases a plataformas",02-09-2020 14:38,https://www.bing.com/th?id=OVFT.Ew-cegMssEIbkC0vKL6t6S,Chile,El Heraldo
Apenas 93.1 millones de lempiras se han usado de los fondos de garantía,https://www.elheraldo.hn/economia/1405457-466/apenas-931-millones-de-lempiras-se-han-usado-de-los-fondos-de,"El BCH anunció ayer la reducción del encaje legal de 12% a 9% para liberar L 8,728 millones para mipymes TEGUCIGALPA, HONDURAS.-A principios de abril, el gobierno de Honduras anunció la creación de do",02-09-2020 14:41,https://www.bing.com/th?id=OVFT.yD-hwd3gYGANfwMp9qWr2C,Chile,El Heraldo
Honduras reduce en tres puntos el encaje en busca de dinamizar la economía,https://www.laprensa.hn/economia/1405559-410/honduras-reduce-puntos-encaje-econom%C3%ADa-pandemia-coronavirus,"El Banco Central de Honduras anunció este martes una reducción en tres puntos porcentuales del encaje legal en moneda nacional y estableció en 3 % las inversiones obligatorias, con el fin incentivar e",02-09-2020 16:40,https://www.bing.com/th?id=OVFT.6jfdKUtWCc4LwIQ-M2sV2i,Chile,La Prensa Chicos
Elsa Palou: Honduras mantiene en 3.1 % la tasa de letalidad por COVID-19,https://www.latribuna.hn/2020/09/02/elsa-palou-honduras-mantiene-letalidad-de-3-1-de-tasa-de-letalidad-baja/,"La ex ministra de Salud, Elsa Palou, reconoció hoy que estamos en la meseta de la primera oleada del COVID-19 “gracias a los centros de triajes y las brigadas médicas que van de casa en casa en busca",02-09-2020 17:19,https://www.bing.com/th?id=OVFT.dWBKIxpa1Ny9KKlgqCUhSS,Chile,La Tribuna
Suman 44 los galenos fallecidos por causa de COVID-19 en Honduras,https://www.proceso.hn/suman-44-los-galenos-fallecidos-por-causa-de-covid-19-en-honduras/,"Tegucigalpa – Otro galeno perdió la vida en su lucha contra el COVID-19, informó la portavoz del Hospital Escuela, Julieth Chavarría. – Con este nuevo deceso suman 44 los galenos que han perdido la vi",02-09-2020 17:33,https://www.bing.com/th?id=OVFT.tVC2lxmFfEMpPYfRFZHz1C,Chile,Proceso
Benigno Pineda: Lo ideal es tener nuestra propia terna para Qatar 2022,https://www.diariomas.hn/2020/09/02/benigno-pineda-lo-ideal-es-tener-nuestra-propia-terna-para-qatar-2022/,"El vicepresidente de la Comisión Nacional de Arbitraje (CNA), el ex árbitro internacional, José Benigno Pineda Fernández, en diálogo virtual con Deportes TNH, considera correcto buscar una terna y no",02-09-2020 17:45,https://www.bing.com/th?id=OVFT.FnHF6cbz_nr3c7v0u24GqS,Chile,Mas
Muere otro médico en primera línea contra el coronavirus en Honduras,https://hondudiario.com/2020/09/02/muere-otro-medico-en-primera-linea-contra-el-coronavirus-en-honduras/,"El presidente de la Asociación de Médicos del Instituto Hondureño de Seguridad Social (IHSS) de San Pedro Sula, Carlos Umaña, confirmó la muerte del doctor José Torres por coronavirus. “Otro héroe de",02-09-2020 18:02,https://www.bing.com/th?id=OVFT.wlvLWQPtKmgUxfr9BHvdrS,Chile,Hondudiario
El otro partido de fútbol en Honduras: Covid-19 vs los equipos de la Liga Nacional,https://www.diez.hn/blogs/1405635-498/kike-lanza-honduras-liga-nacional-coronavirus-otro-partido,La sinceridad y deportividad serán fundamental para vencer en este partido extra que enfrentan día a día los equipos de la Liga. Ha sido de mucha alegría saber que tenemos fecha de arranque del torneo,02-09-2020 21:18,https://www.bing.com/th?id=OVFT.a-eDgKTnibdSFNWgK-EIZi,Chile,diez.hn
Estos tres síntomas sintió reinfectado por covid-19 en Honduras,https://www.radiohrn.hn/estos-tres-sintomas-sintio-reinfectado-por-covid-19-en-honduras,"Actualmente, Honduras podría estar entrando en la fase de la meseta en el comportamiento de contagio del covid-19, advirtió un galeno. El infectólogo del Instituto Hondureño de Seguridad Social (IHSS)",02-09-2020 22:55,https://www.bing.com/th?id=OVFT.iqgSLYWfeiKwhwlVQPlw-y,Chile,Radio HRN
"Honduras con 62,526 contagios y 1,924 decesos por COVID-19",https://proceso.hn/honduras-con-62526-contagios-y-1924-decesos-por-covid-19/,"Tegucigalpa – El Sistema Nacional de Gestión de Riesgos (Sinager), reportó este miércoles que el COVID-19 ya cobra la vida de 1 mil 924 personas, así como 62 mil 526 contagios en 176 días de pandemia.",03-09-2020 02:06,https://www.bing.com/th?id=OVFT.XvHGEXQlziV0qRfNRo4kGy,Chile,Proceso
Supermercados La Colonia entrega insumos de bioseguridad a 5 hospitales de la zona noroccidental del país,http://www.eldiario.hn/supermercados-la-colonia-entrega-insumos-de-bioseguridad-a-5-hospitales-de-la-zona-noroccidental-del-pais/,"“Porque solo unidos y solidarios saldremos adelante, en Supermercados La Colonia seguiremos de pie por nuestra amada Honduras, aportando con pequeñas acciones para mitigar el Covid-19. Como Empresa Socialmente Responsable hemos beneficiado a la fecha a ...",03-09-2020 04:15,https://www.bing.com/th?id=OVFT.HsBmNI2cI088O0Z-bXzUYy,Chile,El Diario
