name,url,description,datePublished,imagen,pais,Fuente
"Honduras se acerca a los 26,000 casos de covid-19, la cifra de fallecidos es 694",https://radiohrn.hn/honduras-se-acerca-a-los-26000-casos-de-covid-19-la-cifra-de-fallecidos-es-694/,"Honduras registra este 8 de julio de 2020, 25 mil 978 casos de covid-19, según dato del Sistema Nacional de Gestión de Riesgo (Sinager). El Laboratorio Nacional de Virología realizó en las últimas horas 1,516 pruebas PCR para detectar el covid-19 ...",09-07-2020 12:56,https://www.bing.com/th?id=ON.B8754F6A58E84AF4BE30D82AF5FCC461,Chile,Radio HRN
"La Champions League y su ""Final 8"": Horario, cuándo y dónde ver el inédito sorteo de cuartos",https://www.diez.hn/championsleague/1392703-498/champions-league-final-8-sorteo-cuartos-cuando-hora-donde-ver-formato-equipos,"Este viernes se llevará a cabo el sorteo de los cuartos de final de la Champions League, que tendrá un nuevo formato. Todo está listo para que se lleve a cabo un inédito sorteo de la Champions League,",09-07-2020 13:38,https://www.bing.com/th?id=ON.C98300173542DA5A7F3065A532420991,Chile,diez.hn
Honduras recibe donación de medicamentos de La India,https://www.laprensa.hn/especiales/coronavirus/1392783-410/india-honduras-donacion-medicamentos-pacientes-coronavirus,"Entre los medicamentos donados están 750,000 unidades de hidroxicloroquina para bajar la carga viral en los pacientes con COVID-19. Tegucigalpa, Honduras. Autoridades de Salud recibieron una important",09-07-2020 18:24,https://www.bing.com/th?id=ON.58B4ABB178C46E416351B3B8C476F8CE,Chile,La Prensa Chicos
"El técnico Raúl Cáceres confirma que es positivo por coronavirus: ""Siento el pecho agitado""",https://www.diez.hn/liganacionaldehonduras/1392806-498/raul-caceres-tenico-confirma-positivo-coronavirus-honduras-real-minas-pecho-agitado,"El extécnico del Real de Minas, Raúl Cáceres, dio positivo por coronavirus y ya se encuentra en tratamiento. 'Ahí vamos haciéndole frente a esto', dijo a DIEZ. Las cifras del coronavirus en Honduras s",09-07-2020 19:47,https://www.bing.com/th?id=ON.842573A153DC68B32821ED8DDFC4C5B5,Chile,diez.hn
CN aprobó autorizar al HE para que pueda hacer contrataciones directas para combatir el COVID-19,https://elpatriota.hn/2020/07/09/cn-aprobo-autorizar-al-he-para-que-pueda-hacer-contrataciones-directas-para-combatir-el-covid-19/,HONDURAS. EL Congreso Nacional autoriza al Hospital Escuela (HE) para la contratación directa contemplada en el artículo 19 de la “Ley de Auxilio al Sector Productivo y a los Trabajadores ante los Efectos de la Pandemia Provocadas por el COVID-19”.,09-07-2020 20:47,https://www.bing.com/th?id=ON.2359FAD8438D0BC8AED7D66F04DCFC52,Chile,El Patriota
"Honduras: Esposo de funcionaria vendió gel al estado por más de $170,000",https://notibomba.com/honduras-esposo-de-funcionaria-vendio-gel-al-estado-por-mas-de-170000/,"Un nuevo escándalo de corrupción y abuso de autoridad ha sido revelado en Honduras en medio de una crisis sanitaria que se agudizó por el nuevo coronavirus, Covid-19. Se trata de la violación de la Le",09-07-2020 21:46,https://www.bing.com/th?id=ON.2CF2388A2E21D693A0734D0DD0386388,Chile,Noti Bomba
Extécnico de Real de Minas con coronavirus,https://www.diariomas.hn/2020/07/09/extecnico-de-real-de-minas-con-coronavirus/,"Raúl Cáceres, exdirector técnico de Real de Minas, dio positivo por coronavirus y se encuentra en tratamiento. La noticia la confirmó el mismo y dijo que se encuentra estable. Desde la semana anterior",09-07-2020 21:55,https://www.bing.com/th?id=ON.C71CB3D5BF67FD93699CCD9C213972D9,Chile,Mas
Más de 26 mil contagios y 705 fallecidos por Covid-19 en Honduras,https://hondudiario.com/2020/07/09/mas-de-26-mil-contagios-y-705-fallecidos-por-covid-19-en-honduras/,"El Sistema Nacional de Gestión de Riesgos (Sinager), confirmó 406 casos nuevos de COVID-19 para este jueves, sumando 26,384 contagios en todo el país. De igual forma, reportó 10 fallecidos más, para u",10-07-2020 03:00,https://www.bing.com/th?id=ON.5E3ECC00452BEB247962850A817A561C,Chile,Hondudiario
TGU: Recién nacida y un joven de 17 años mueren de COVID-19,https://tiempo.hn/tgu-recien-nacida-joven-17-anos-mueren-covid-19/,"Lourdes Barrientos, portavoz del IHSS, informó que, este jueves, 14 personas murieron a causa de la COVID-19 en dicho centro asistencial. TEGUCIGALPA, HONDURAS. En las últimas 24 horas se han reportad",10-07-2020 05:26,https://www.bing.com/th?id=ON.2BCFB6131174844F7315D7B0F976862E,Chile,Tiempo
JOH: “A Honduras solo la vamos a rescatar unidos”,https://www.latribuna.hn/2020/07/09/joh-a-honduras-solo-la-vamos-a-rescatar-unidos/,"El Presidente, Juan Orlando Hernández, manifestó que cada hondureño debe contribuir para rescatar el país de este duro golpe por el COVID-19. En ese sentido, llamó a los sectores con diversas ideologí",10-07-2020 06:25,https://www.bing.com/th?id=ON.ED032AE73072FBA1185BA48B6FAFC01E,Chile,La Tribuna
"Científico hondureño: ""Medicamento ruso contra el covid-19 se debe constatar""",https://www.elheraldo.hn/pais/1392938-466/medicamento-ruso-covid-19-pandemia-coronavirus,"Se trata del primer fármaco para tratar la enfermedad viral y es llamado Avifavir, para hacer negociaciones y distribuirlo en la región TEGUCIGALPA, HONDURAS.-Ante el anuncio de que el gobierno de Rus",10-07-2020 07:49,https://www.bing.com/th?id=ON.FD51C90A165991F4A91E7B3E5F6C9B57,Chile,El Heraldo
Tratamientos MAIZ y Catracho siguen aportando para salvar vidas de pacientes con covid-19,https://www.elheraldo.hn/pais/1392939-466/honduras-tratamientos-maiz-catracho-coronavirus,"Honduras registra más de 25,000 casos positivos de covid-19 y alrededor de 2,721 se han recuperado y han vencido al virus, pero más de 650 han perdido la vida batallando contra la enfermedad En Hondur",10-07-2020 07:49,https://www.bing.com/th?id=ON.5AAE427ED8D19BD27A1F2F3A6FFABAF5,Chile,El Heraldo
"Con 406 nuevos casos de coronavirus, Honduras llega a los 26,384 contagiados",https://radiohrn.hn/con-406-nuevos-casos-de-coronavirus-honduras-llega-a-los-26384-contagiados/,"En aumento los casos, muertes y recuperados de covid-19 en Honduras. Las autoridades del Sistema Nacional de Gestión de Riesgos (Sinager) informaron el jueves que aumentó a 26,384 las personas diagnos",10-07-2020 12:55,https://www.bing.com/th?id=ON.B9F1341C636A4D6530EC6D1D6CCFDB77,Chile,Radio HRN
