name,url,description,datePublished,imagen,pais,Fuente
"Crédito Solidario entrega más de 4,7 millones de lempiras a 246 emprendedores de 5 municipios",http://www.elsoldehonduras.com/nacionales/credito-solidario-entrega-mas-de-47-millones-de-lempiras-a-246-emprendedores-de-5-municipios/,"El presidente Juan Orlando Hernández entregó hoy 4,7 millones de lempiras en financiamientos del programa Crédito Solidario para 246 beneficiarios de cinco municipios en busca de mejorar las condicion",14-01-2021 01:14,https://www.bing.com/th?id=OVFT.-7Gt0V6OE_PH4c-QQox_cS,Chile,El Sol de Honduras
Sinager: Incumplimiento de medidas de bioseguridad ante covid-19 amenaza con colapsar sistema sanitario,http://www.elsoldehonduras.com/salud/sinager-incumplimiento-de-medidas-de-bioseguridad-ante-covid-19-amenaza-con-colapsar-sistema-sanitario/,"Tegucigalpa. El Gobierno de la Republica por medio del Sistema Nacional de Gestión Riesgo (Sinager), advirtió este martes que el incumplimiento de las medidas de bioseguridad contra la covid-19 por pa",14-01-2021 01:20,https://www.bing.com/th?id=OVFT.rcFhiIXHRp4GgKm9UFEfgC,Chile,El Sol de Honduras
Inaugura primera planta exportadora de vegetales única en Centroamérica,http://www.eldiario.hn/inaugura-primera-planta-exportadora-de-vegetales-unica-en-centroamerica/,"Comayagua. - ""Este es un esfuerzo tesonero que se materializa en resultados concretos"", resaltó este miércoles el presidente Juan Orlando Hernández al inaugurar en Comayagua la primera planta exportad",14-01-2021 04:31,https://www.bing.com/th?id=OVFT.U6pJ1E0KhFyeDBZGymPr4S,Chile,El Diario
Inauguran primera planta exportadora de vegetales orientales única en Centroamérica,http://www.eldiario.hn/inauguran-primera-planta-exportadora-de-vegetales-orientales-unica-en-centroamerica/,"Comayagua. - ""Este es un esfuerzo tesonero que se materializa en resultados concretos"", resaltó este miércoles el presidente Juan Orlando Hernández al inaugurar en Comayagua la primera planta exportad",14-01-2021 04:31,https://www.bing.com/th?id=OVFT.U6pJ1E0KhFyeDBZGymPr4S,Chile,El Diario
POR PANDEMIA CONFERENCIA EPISCOPAL DE HONDURAS ANUNCIÓ QUE ANIVERSARIO DE LA VIRGEN DE SUYAPA SE CELEBRARÁ SIN FIELES A PUERTA CERRADA,https://ultimahora.hn/por-pandemia-conferencia-episcopal-de-honduras-anuncio-que-aniversario-de-la-virgen-de-suyapa-se-celebrara-sin-fieles-a-puerta-cerrada/,A través de comunicación oficial la Conferencia Episcopal de Honduras informó que las actividades de la celebración de 274 aniversario del hallazgo de la virgen de Suyapa se realizarán sin la,14-01-2021 14:00,https://www.bing.com/th?id=OVFT.WKNdEhidtARSebjPd_jq-i,Chile,Ultima Hora
Empresarios prevén que llegada de la vacuna reactivará la actividad comercial,https://hondudiario.com/2021/01/14/empresarios-preven-que-llegada-de-la-vacuna-reactivara-la-actividad-comercial/,"El empresario sampedrano, Emín Abufele, consideró que con la llegada de las vacunas contra el Covid-19 a Honduras se reactivará la actividad comercial y economía del país. Sin embargo, Abufele expuso",14-01-2021 15:21,https://www.bing.com/th?id=OVFT.SUFmauI96bsxM187KWpori,Chile,Hondudiario
COVID-19: galeno retrata triste realidad y prevé «lo peor» para finales de enero,https://tiempo.hn/covid-19-medico-lo-peor-enero/,"DANLÍ, EL PARAÍSO. Las vivencias del «pico» de la pandemia en Honduras podrían revivirse en poco tiempo debido a la irresponsabilidad de una parte de la población, lamentó este día el galeno Miguel Za",14-01-2021 16:42,https://www.bing.com/th?id=OVFT.NGr0Rc8qWpEPdrKD9ru02C,Chile,Tiempo
Triaje del CCG reporta cifras “escalofriantes” de aumento en casos COVID-19,https://hondudiario.com/2021/01/14/triaje-del-ccg-reporta-cifras-escalofriantes-de-aumento-en-casos-covid-19/,"El director del centro de triaje del Centro Cívico Gubernamental (CCG), Rony Antúnez, calificó como “escalofriantes” las cifras de personas que se atienden a diario en dicho lugar con sospechas de COV",14-01-2021 17:35,https://www.bing.com/th?id=OVFT.k05Xfy-10-iPvASUzzN4-S,Chile,Hondudiario
Médicos piden no bajar la guardia ante el aumento de casos COVID-19,https://www.latribuna.hn/2021/01/14/medicos-piden-no-bajar-la-guardia-ante-el-aumento-de-casos-covid-19/,Médicos que están en la primera línea del combate contra la COVID-19 pidieron hoy a la población no bajar la guardia en los cuidados personales con las medidas de bioseguridad para que no se disparen,14-01-2021 21:21,https://www.bing.com/th?id=OVFT.hGeqMAq0QY-AxX_F3Uk4Ly,Chile,La Tribuna
Gobierno de Honduras tiene presupuestado 9.4 millones de vacunas contra el Covid-19,https://www.vtv.com.hn/noticia/gobierno-de-honduras-tiene-presupuestado-9-4-millones-de-vacunas-contra-el-covid-19/,"Derechos Reservados de Voz e Imagen Centroamericana - 26 Calle # 301, atras Toyota, Bo. La Granja, ELDI., Tegucigalpa, Honduras. Cerrar",15-01-2021 01:37,https://www.bing.com/th?id=OVFT.PMxjwPceb2pDRMlm5XM80C,Chile,VTV
DINAF BRINDA ATENCIÓN A 22 NIÑOS MIGRANTES RETORNADOS EN LO QUE VA DE ENERO,https://ultimahora.hn/dinaf-brinda-atencion-a-22-ninos-migrantes-retornados-en-lo-que-va-de-enero/,"La Dirección de Niñez, Adolescencia y Familia-DINAF, como el ente garante de las políticas públicas en materia de niñez migrante retornada, registra en lo que va de enero un total",15-01-2021 03:05,https://www.bing.com/th?id=OVFT.ebzVc3RRYhLVNsgfvqLI_y,Chile,Ultima Hora
Gobierno de Honduras tiene presupuestado 9.4 millones dosis de vacunas anti Covid-19,https://www.vtv.com.hn/noticia/gobierno-de-honduras-tiene-presupuestado-9-4-millones-dosis-de-vacunas-anti-covid-19/,"Honduras contará con un total de 9.4 millones de dosis de vacunas contra el Covid-19, las que serán destinadas a más del 81 por ciento de la población elegible para recibirla, destacando el grupo prio",15-01-2021 03:13,https://www.bing.com/th?id=OVFT.oQQSlyFiLN97Q-Vq6jeNji,Chile,VTV
"Secretaría de Salud: 51%, ocupación hospitalaria por COVID-19 en el país",https://www.latribuna.hn/2021/01/14/secretaria-de-salud-51-ocupacion-hospitalaria-por-covid-19-en-el-pais/,"La coordinadora de la Emergencia por el COVID-19, en Francisco Morazán, de la Secretaría de Salud, Yolani Batres, informó que la ocupación hospitalaria por coronavirus es del 51% a nivel nacional. Mie",15-01-2021 03:15,https://www.bing.com/th?id=OVFT.wU1KmmJPmEJVxQSZqBH3tS,Chile,La Tribuna
Reportan 17 decesos con sospecha de COVID-19 en hospitales del país,https://proceso.hn/reportan-cuatro-decesos-con-sospecha-de-covid-19-en-hospitales-del-pais/,"Tegucigalpa – Al menos 17 decesos se reportaron este jueves con sospecha de COVID-19 en los hospitales hondureños. En el Hospital de Especialidades del Instituto Hondureño de Seguridad Social (IHSS),",15-01-2021 03:36,https://www.bing.com/th?id=OVFT.jai6DWHY-Iw5aZZDMWr9OS,Chile,Proceso
COVID-19 en Honduras: SINAGER confirma 876 nuevos casos y 13 muertes,https://tiempo.hn/covid-19-casos-en-honduras-14-1-21/,"Honduras está rozando los 132,000 casos confirmados. TEGUCIGALPA, HONDURAS. De 3,135 nuevas pruebas para diagnosticar COVID-19 que procesó el Laboratorio Nacional de Virología (LNV), de la Secretaría",15-01-2021 03:50,https://www.bing.com/th?id=OVFT.FPQEDUSGeiFrPq31mJn9NS,Chile,Tiempo
Se triplican las atenciones por covid-19 en el triaje de Villanueva,https://www.laprensa.hn/honduras/1435790-410/honduras-triplican-atenciones-covid-19-triaje-villanueva,"A pesar de que los atenciones por covid-19 se han triplicado en el municipio, muchos pobladores no toman conciencia y no cumplen con las medidas de bioseguridad. Hace un mes, el centro de triaje, inst",15-01-2021 04:16,https://www.bing.com/th?id=OVFT.Lsr0qECGvxiKL0ZWoK_sai,Chile,La Prensa Chicos
Honduras registra 876 nuevos contagios y 15 muertes,https://www.laprensa.hn/honduras/1435867-410/honduras-contagios-muertes-coronavirus-,"Tegucigalpa, Honduras. Honduras rozó este jueves los 132.000 contagios de la covid-19, mientras que la cifra de muertos se elevó a 3.335 con quince nuevos casos, informó el est",15-01-2021 04:24,https://www.bing.com/th?id=OVFT.CZZRfZtSnnWUW29dn8uFCy,Chile,La Prensa Chicos
"Con 876 nuevos contagios se elevan a 131,963 los casos de COVID-19 en Honduras",https://proceso.hn/con-876-nuevos-contagios-se-elevan-a-131963-los-casos-de-covid-19-en-honduras/,"Para diagnosticar los nuevos casos, el Laboratorio Nacional de Virología procesó 3,135 pruebas PCR en tiempo real, de las que 876 resultaron positivas y 2,259 negativas.",15-01-2021 05:12,https://www.bing.com/th?id=OVFT.2zI2ooUufVHLQtGZtVwcJS,Chile,Proceso
