name,url,description,datePublished,imagen,pais,Fuente
Estos 8 efectos secundarios provoca la vacuna de AstraZeneca que aplicará Honduras,https://www.radiohrn.hn/estos-8-efectos-secundarios-provoca-la-vacuna-de-astrazeneca-que-aplicara-honduras,"Conoce los efectos secundarios que provoca la dosis AstraZeneca, por los que muchos países han retirado su uso",15-03-2021 06:40,https://www.bing.com/th?id=OVFT.gtB1J6Zbp8Di8-GUJzDcIi,Chile,Radio HRN
POR COVID-19 MUERE ENFERMERA AUXILIAR EN EL INSTITUTO NACIONAL CARDIOPULMONAR,https://ultimahora.hn/por-covid-19-muere-enfermera-auxiliar-en-el-instituto-nacional-cardiopulmonar/,"En las últimas horas se dio a conocer la muerte de la enfermera auxiliar Bertha Rodríguez quien falleció este lunes por causa de la COVID-19, en el Instituto Nacional Cardiopulmonar (INCP), más",15-03-2021 14:59,https://www.bing.com/th?id=OVFT.lXJzeJq5ojrP-70I0UXpCi,Chile,Ultima Hora
Muere enfermera auxiliar por covid-19 en Tegucigalpa,https://www.laprensa.hn/honduras/1449994-410/muere-enfermera-auxiliar-covid-19-tegucigalpa,"Una víctima del gremio sanitario a causa del covid se registró este lunes, tras el fallecimiento de Berta Rodríguez, enfermera auxiliar que se desempeñaba en el hospital cardiopulmonar ""El Tórax"" en T",15-03-2021 15:11,https://www.bing.com/th?id=OVFT.HZAndU-Vs7nnEgxW9Q7R-C,Chile,La Prensa Chicos
En San Pedro Sula inicia la jornada de vacunas contra el Covid-19,https://www.vtv.com.hn/noticia/en-san-pedro-sula-inicia-la-jornada-de-vacunas-contra-el-covid-19/,"El viernes pasado, con 830 dosis de vacunas,  en San Pedro Sula, se inició la primera jornada de vacunación, con personal del sector sanitario que está trabajando con casos del Covid-19. La aplicación",15-03-2021 15:27,https://www.bing.com/th?id=OVFT.aWzQVghTUYx74rnMfiuh9i,Chile,VTV
"En medio de elecciones, Honduras superó los 178 mil casos de COVID-19",https://tiempo.hn/elecciones-honduras-supero-178-mil-casos-covid19/,"Continúa el alza de casos de COVID-19 en Honduras, la noche del domingo SINAGER confirmó el contagio de más de 178 mil hondureños.",15-03-2021 15:41,https://www.bing.com/th?id=OVFT.-u6DOW-0HsDdpeOdEIjeUC,Chile,Tiempo
Arranca la segunda jornada de vacunación contra la COVID-19 en Honduras,https://www.latribuna.hn/2021/03/15/arranca-la-segunda-jornada-de-vacunacion-contra-la-covid-19-en-honduras/,Autoridades de Salud Pública iniciaron este lunes la segunda jornada de vacunación contra la COVID-19 en Honduras. La ministra de,15-03-2021 17:23,https://www.bing.com/th?id=OVFT.CFEQ9isePrzWLqMsbi3IcC,Chile,La Tribuna
"Honduras acumula 4,334 muertos y 178,277 contagios por covid-19 en un año de pandemia",https://www.laprensa.hn/honduras/1449907-410/honduras-coronavirus-contagios-muertes-a%C3%B1o-pandemia,En el último reporte de las autoridades sanitarias hondureñas se registraron 415 nuevos casos y tres fallecimientos por coronavirus.,15-03-2021 17:52,https://www.bing.com/th?id=OVFT._NBrI8t3CjdDoi0t9CbI_S,Chile,La Prensa Chicos
Enfermera pierde la batalla contra la COVID-19 en la capital,https://www.latribuna.hn/2021/03/15/enfermera-pierde-la-batalla-contra-la-covid-19-en-la-capital/,"Una enfermera auxiliar más ha muerto en las últimas horas tras perder la batalla contra la COVID-19 en Tegucigalpa, capital",15-03-2021 17:59,https://www.bing.com/th?id=OVFT.W-4w2Sa2J879GOXuxGMzty,Chile,La Tribuna
Los futbolistas del Real Sociedad que han sido más afectados por el Covid-19; uno presenta daños en el pulmón,https://www.diez.hn/liganacionaldehonduras/1450072-498/dos-futbolistas-real-sociedad-golpeado-covid-19-wilmer-fuentes-wilson-urbina,"El dirigente Javier Martínez confirmó que ambos jugadores ya se están recuperando, pero que uno de ellos ha tenido problemas en sus pulmones",15-03-2021 18:27,https://www.bing.com/th?id=OVFT.dVcXD3dY3F7Q6cBzsT8Cjy,Chile,diez.hn
"'Solo en Cortés esperamos vacunar a 10 mil personas del IHSS, Salud y sector privado': Roberto Cosenza, viceministro de Salud",https://www.radiohrn.hn/solo-en-cortes-esperamos-vacunar-a-10-mil-personas-del-ihss-salud-y-sector-privado-roberto-cosenza-viceministro-de-salud,"En Honduras comenzó este lunes (15.03.2021) la segunda jornada de vacunación contra el covid-19. El viceministro de la Secretaría de Salud (Sesal), Roberto Cosenza, brindó detalles acerca de la ejecuc",15-03-2021 19:16,https://www.bing.com/th?id=OVFT.K902HhUcRw2DFeoeqRL2hy,Chile,Radio HRN
Honduras inicia segunda jornada de vacunación contra el coronavirus con 48 mil dosis,https://hondudiario.com/2021/03/15/este-lunes-comienza-segunda-jornada-de-vacunacion-contra-el-covid-19-al-personal-medico/,Honduras dio por iniciada este lunes la segunda campaña del Plan de Vacunación contra el Covid-19 con el objetivo de proteger el personal sanitario del país. La actividad se desarrolla en el Centro de,15-03-2021 19:27,https://www.bing.com/th?id=OVFT.YF5JYcmPKYhqUsdprMrIgS,Chile,Hondudiario
Oficial: suspendido el juego Real Sociedad-Motagua por casos de Covid-19; así se jugará el resto de la jornada 8,https://www.diez.hn/liganacionaldehonduras/1450112-498/oficial-suspendido-juego-real-sociedad-motagua-casos-covid-19-honduras,La Liga Nacional se ha reunido esta noche para tomar estas decisiones. El resto de la jornada se completará entre martes y miércoles,15-03-2021 20:41,https://www.bing.com/th?id=OVFT.AUeubu3C1RPriYOzgzj7Mi,Chile,diez.hn
Hospital móvil de Tegucigalpa ya no será para atender pacientes COVID-19,https://tiempo.hn/hospital-movil-ya-no-atendera-pacientes-covid-19/,"El director del Hospital Escuela dijo que la compra de INVEST-H no funciona para enfermedades respiratorias. TEGUCIGALPA, HONDURAS. El hospital móvil de Tegucigalpa ya no será para atender a pacientes con COVID-19, confirmaron autoridades del Hospital ...",15-03-2021 21:06,https://www.bing.com/th?id=OVFT.OZrnNnSYHcomWRsPU5b15C,Chile,Tiempo
"1 de los 7 hospitales móviles en Honduras, ya no atenderá pacientes de Covid-19",https://www.vtv.com.hn/noticia/1-de-los-7-hospitales-moviles-en-honduras-ya-no-atendera-pacientes-de-covid-19/,"Según el director del primer centro asistencial del país Osmín Tovar, uno de los siete hospitales móviles de Honduras, para atender a pacientes que tienen Covid-19, ya no serán atendidos en el hospita",15-03-2021 22:04,https://www.bing.com/th?id=OVFT.OOY6OgryvCZUJtoNj9K6Ui,Chile,VTV
Personal del Centro de Salud Alonso Suazo trabajará con alivio y confianza tras recibir la vacuna anticovid,https://ultimahora.hn/personal-del-centro-de-salud-alonso-suazo-trabajara-con-alivio-y-confianza-tras-recibir-la-vacuna-anticovid/,"Médicos, enfermeras y otros miembros del personal agradecen al Gobierno del presidente Hernández por traer la vacuna. —- “Yo perdí a mi esposo hace 8 meses por el covid-19 y a mi pegó, pero",15-03-2021 23:49,https://www.bing.com/th?id=OVFT.wbHkzCaxPTvTDgRAru6Nui,Chile,Ultima Hora
"Tras las primarias, Honduras a las puertas de otro pico en la ola pandémica",https://proceso.hn/tras-las-primarias-honduras-a-las-puertas-de-otro-pico-en-la-ola-pandemica/,"Honduras llegó al primer año de la pandemia por el coronavirus, marcada por los “corona abusos”, en el manejo de la emergencia sanitaria y la angustia por una vacuna que empieza a llegar",16-03-2021 01:05,https://www.bing.com/th?id=OVFT.IeDIrYJV-PmsPUyjEG3bqS,Chile,Proceso
Gobierno inicia segunda campaña de vacunación contra la covid-19,http://www.eldiario.hn/gobierno-inicia-segunda-campana-de-vacunacion-contra-la-covid-19/,"Tegucigalpa. - Con el objetivo de proteger el personal sanitario del país, el presidente Juan Orlando Hernández dio por iniciada este lunes la segunda campaña del Plan de Vacunación contra el Covid-19",16-03-2021 02:45,https://www.bing.com/th?id=OVFT.NdNYhVYL88IE1FCZ5ofTUC,Chile,El Diario
Honduras añade 648 positivos de coronavirus y 26 muertes más,https://proceso.hn/honduras-anade-648-positivos-de-coronavirus-y-26-muertes-mas/,"Tegucigalpa – Honduras añadió este lunes 648 nuevos casos del coronavirus SARS-CoV-2, con lo que la cifra total de positivos se elevó a 178 mil 925, mientras que los decesos ascendieron a 4",16-03-2021 04:14,https://www.bing.com/th?id=OVFT.P8wJfx9upIqGcNHud-ZGrC,Chile,Proceso
