name,url,description,datePublished,imagen,pais,Fuente
El Hospital Mario Catarino Rivas recibe 40 ventiladores mecánico-pulmonares para la sala de Covid-19,http://www.eldiario.hn/el-hospital-mario-catarino-rivas-recibe-40-ventiladores-mecanico-pulmonares-para-la-sala-de-covid-19/,San Pedro Sula.-El Hospital Mario Catarino Rivas recibió este jueves 40 ventiladores mecánico-pulmonares para las unidades de cuidados intensivos de pacientes con Covid-19. El equipo fue recibido por,03-07-2020 16:39,https://www.bing.com/th?id=OVFT.jSvw_TffgGZ-dMGtSvZVmi,Chile,El Diario
Con 6 Distritos Turísticos Honduras busca ser imán de viajeros en escenario post Covid-19,https://hondudiario.com/2020/07/03/con-6-distritos-turisticos-honduras-busca-ser-iman-de-viajeros-en-escenario-post-covid-19/,"Honduras se prepara para reactivar el turismo mediante el fortalecimiento de sus seis distritos en los que está dividido el territorio nacional. De acuerdo al portal de Forbes Centroamérica, el país p",03-07-2020 18:02,https://www.bing.com/th?id=OVFT.vYPsr5PE0pHF8wrqgyXW_C,Chile,Hondudiario
Juan Carlos Suazo propone nueva estructura administrativa en Liga Nacional,https://www.diariomas.hn/2020/07/03/juan-carlos-suazo-propone-nueva-estructura-administrativa-en-liga-nacional/,"El presidente financiero el Motagua, Juan Carlos Suazo, mantiene su teoría de con la actual estructura de la Liga nacional, las cosas no van a caminar nunca y que por ello es urgente el cambio estruct",03-07-2020 21:04,https://www.bing.com/th?id=OVFT.yyE7nHij0moYXTSr0L016y,Chile,Mas
"Gonzalo Klusener, encantado con Motagua: “Desde el día que llegué me han tratado con cariño""",https://www.diez.hn/liganacionaldehonduras/1391451-498/gonzalo-klusener-encantado-con-motagua-criticas-edad-coronavirus-futuro,pues el Covid-19 cambió muchos planes. Además explica que los defensores hondureños son muy recios en la marca y le gustaría seguir más tiempo. Ver. LA LIGA NACIONAL DE HONDURAS AHORA INICIA EN SEPTIEMBRE “En Argentina están en una situación ...,03-07-2020 22:33,https://www.bing.com/th?id=OVFT.Xhqxuv5sI9D9fJVq43Gjgy,Chile,diez.hn
"Enfermo y en el olvido, el drama que vive el técnico Hermelindo Cantarero: ""No quiero morirme todavía""",https://www.diez.hn/liganacionaldehonduras/1391463-498/enfermo-olvido-drama-vive-tecnico-hermelindo-cantarero-coronavirus,"Dice que tiene temor de que esté contagiado del Covid-19. El “profe canta” como se le conoce, ha sacado más de 800 futbolistas que han jugado en Liga Nacional de Honduras desde 1974 hasta la actualidad. Está en cama en Tocoa, Colón, sufre de ...",03-07-2020 22:43,https://www.bing.com/th?id=OVFT.y8Tn-5NSDzBYS9OQZuN8BS,Chile,diez.hn
"En imágenes, el centro que habilitó la UNAH para determinar en tres segundos si una persona tiene neumonía por covid-19",https://radiohrn.hn/en-imagenes-el-centro-que-habilito-la-unah-para-determinar-en-tres-segundos-si-una-persona-tiene-neumonia-por-covid-19/,"La Universidad Nacional Autónoma de Honduras (UNAH) habilitó el Centro de Diagnóstico ... en apenas tres segundos si una persona tiene neumonía provocada por el coronavirus. De acuerdo con un comunicado por parte de la UNAH, el diagnóstico se ...",03-07-2020 23:01,https://www.bing.com/th?id=OVFT.ZiYF4Y0y51ngfWt7X3CK4C,Chile,Radio HRN
El Presidente es quien debe nombrar el nuevo director o directora de Invest-H,http://www.elsoldehonduras.com/nacionales/el-presidente-es-quien-debe-nombrar-el-nuevo-director-o-directora-de-invest-h/,"El dirigente de la Asociación Nacional de Empleados Público de Honduras (Andeph), César Chirinos, manifestó que el presidente Juan Orlando Hernández es quien debe nombrar el nuevo director o directora",03-07-2020 23:47,https://www.bing.com/th?id=OVFT.8zR2oCnFW6YkOXbNEGvyni,Chile,El Sol de Honduras
"Hay L92,800 millones disponibles para la crisis en Honduras",https://www.laprensa.hn/premium/1391533-410/hay-92800-millones-disponibles-para-la-crisis-honduras-coronavirus,"Honduras ha gastado un poco más de L4,500 millones, un 5% del presupuesto destinado para atender la emergencia. San Pedro Sula, Honduras. Los pronósticos de analistas internacionales son desalentadore",04-07-2020 10:33,https://www.bing.com/th?id=OVFT.O7Y04dO3PAeS0zUZe9-wBi,Chile,La Prensa Chicos
Unos 20 taxistas han fallecido y más mil están infectados por Covid-19,https://hondudiario.com/2020/07/04/unos-20-taxistas-han-fallecido-y-mas-mil-estan-infectados-por-covid-19/,"El presidente de la Asociación de Taxistas de Honduras (Ataxis), Víctor Aguilar, dijo que 20 compañeros han perdido su vida y más de mil se han contagiado por Covid-19. Manifestó que la mayoría de los",04-07-2020 14:37,https://www.bing.com/th?id=OVFT.cIBbtWB_BoAhMvl2nlnQeS,Chile,Hondudiario
"En Honduras hay al menos 100 mil casos de covid-19, según científico",https://radiohrn.hn/en-honduras-hay-al-menos-100-mil-casos-de-covid-19-segun-cientifico/,"Hasta la fecha en Honduras se contabilizan 22,116 casos de coronavirus. El científico hondureño Marco Tulio Medina informó que actualmente se estima que Honduras cuenta con cien mil casos de covid-19.",04-07-2020 14:42,https://www.bing.com/th?id=OVFT.yrvn8OvE4ootusIkKwx3Hy,Chile,Radio HRN
"Unas 1,500 pruebas de covid-19 se deben hacer al día en la capital, según epidemiólogo",https://www.elheraldo.hn/pais/1391494-466/coronavirus-honduras-covid-19-pruebas-tegucigalpa-casos,"Es urgente que se habiliten más centros de triaje en la ciudad pues la pandemia de covid-19 afecta a las urbes TEGUCIGALPA, HONDURAS.-El epidemiólogo e investigador de la Universidad Nacional Autónoma",04-07-2020 15:34,https://www.bing.com/th?id=OVFT.6xBhIsejLpsXX7NIpAztNC,Chile,El Heraldo
El COVID-19 deja 230 presos contagiados a la fecha en Honduras,https://www.laprensa.hn/honduras/1391598-410/coronavirus-privados-libertad-afectados-coronavirus-pandemia-honduras,"Al 1 de julio el Instituto Nacional Penitenciario reportó 587 afectados por coronavirus dentro de los penales, entre reos, personal de Salud y otros. Tegucigalpa, Honduras. Hasta el 3 de julio se regi",04-07-2020 18:39,https://www.bing.com/th?id=OVFT.6zyy6QzEcI23AUNEs5aI_C,Chile,La Prensa Chicos
