name,url,description,datePublished,imagen,pais,Fuente
"Francisco Morazán reporta 521 nuevos casos de covid; Honduras suma 87,594 contagios a nivel nacional",https://www.radiohrn.hn/francisco-morazan-reporta-521-nuevos-casos-de-covid-honduras-suma-87594-contagios-a-nivel-nacional,"Honduras registra 87 mil 594 casos de coronavirus, con repuntes en la zona central y noroccidente. El Laboratorio Nacional de Virología de la Secretaría de Salud procesó 1,950 nuevas pruebas PCR para",18-10-2020 04:28,https://www.bing.com/th?id=OVFT.DHyAfX3EJUeSPCp8ryx89y,Chile,Radio HRN
Teófimo López el mejor del mundo en peso ligero al destronar a Lomachenko,https://www.diariomas.hn/2020/10/17/teofimo-lopez-el-mejor-del-mundo-en-peso-ligero/,"El boxeador honduro – estadounidense Teófimo López, se convirtió en el mejor boxeador del mundo en 135 libras, al retener su título de la",18-10-2020 14:10,https://www.bing.com/th?id=OVFT.RhpuhMJ3X8tGGSDw1eVkNC,Chile,Mas
Vigilancia epidemiológica “en crisis” ante constantes alzas y bajas en numero de pruebas,https://hondudiario.com/2020/10/18/vigilancia-epidemiologica-en-crisis-ante-constantes-alzas-y-bajas-en-numero-de-pruebas/,"La Plataforma Todos Contra el COVID-19, informó que Honduras continúa con un porcentaje de positividad arriba del 40 por ciento en las últimas 10 semanas epidemiológicas, con una curva de crecimiento",18-10-2020 14:33,https://www.bing.com/th?id=OVFT.FW6HeaU4zKJyCkiyErJgcC,Chile,Hondudiario
"Un niño busca a Teófimo López tras vencer a Lomachenko, no lo dejan acercarse y el gesto del boxeador es de gigantes",https://www.diez.hn/notodoesfutbol/1416346-498/un-ni%C3%B1o-busca-a-te%C3%B3fimo-l%C3%B3pez-tras-vencer-a-lomachenko-no-lo,"Teófimo López, boxeador estadounidense de sangre hondureña, derrotó al ucraniano Vasyl Lomachenko, el sabadó por la noche en el MGM de Las Vegas y se convirtió en el nuevo rey de la división de peso l",18-10-2020 18:17,https://www.bing.com/th?id=OVFT.9SuGRz8Wn-LxIM3hcBmv4y,Chile,diez.hn
A partir de este lunes se reanudarán retornos terrestres de migrantes hondureños desde México,http://www.eldiario.hn/a-partir-de-este-lunes-se-reanudaran-retornos-terrestres-de-migrantes-hondurenos-desde-mexico/,"Tegucigalpa. - A partir de este lunes se reanudarán las conducciones terrestres de migrantes hondureños retornados desde México, informó la vicecanciller para Asuntos Consulares y Migratorios, Nelly J",19-10-2020 02:12,https://www.bing.com/th?id=OVFT.A0wG1GRG_qGs4pHOscfw1C,Chile,El Diario
"Coronavirus: Honduras casi llega a los 90,000 casos de covid-19",https://www.radiohrn.hn/coronavirus-honduras-casi-llega-a-los-90000-casos-de-covid-19,"El Sistema Nacional de Gestión de Riesgos (Sinager) detalló el domingo (18.10.2020) que Honduras reportó 831 nuevos pacientes de coronavirus (covid-19), que aumentan el total de contagios a nivel naci",19-10-2020 05:14,https://www.bing.com/th?id=OVFT.bdjLIVbjz5cbls9fJlM1ky,Chile,Radio HRN
Hay 34 personas con sospecha de covid-19 en cuatro asilos del Distrito Central,https://www.elheraldo.hn/tegucigalpa/1416058-466/hay-34-personas-con-sospecha-de-covid-19-en-cuatro-asilos-del-distrito,Los hogares para adultos mayores tienen prohibidas las visitas de familiares y particulares como una medida de prevención contra el virus. Las donaciones se reciben sempre que no haya contacto físico,19-10-2020 08:53,https://www.bing.com/th?id=OVFT.pECqAWX9jUmCLny6VQWKMy,Chile,El Heraldo
Manuel Zelaya participa en Venezuela en ensayo de vacuna rusa contra COVID-19,https://www.latribuna.hn/2020/10/19/manuel-zelaya-participa-en-venezuela-en-ensayo-de-vacuna-rusa-contra-covid-19/,"El expresidente de Honduras Manuel Zelaya está de visita en Venezuela para participar en la fase de ensayos clínicos de la vacuna rusa Sputnik 5, contra la COVID-19, informó este domingo el mandatario",19-10-2020 11:27,https://www.bing.com/th?id=OVFT.E83jJ6glfyqo1UFI6qAlxy,Chile,La Tribuna
Por pandemia Honduras continúa en alerta roja y toque de queda absoluto hasta el…,https://ultimahora.hn/por-pandemia-honduras-continua-en-alerta-roja-y-toque-de-queda-absoluto-hasta-el-25-de-octubre/,"El Sistema Nacional de Gestión de Riesgo (Sinager), a solicitud de la Secretaría de Salud, extendió hoy la alerta roja  para los 18 departamentos del país por la pandemia de covid-19 hasta el",19-10-2020 14:09,https://www.bing.com/th?id=OVFT.sqgwLKrjGqrCG-JBIuPtlS,Chile,Ultima Hora
"En 2020, sector tecnología de Honduras crecerá 5%",https://www.elheraldo.hn/economia/1416422-466/en-2020-sector-tecnolog%C3%ADa-de-honduras-crecer%C3%A1-5,"Se estima que la inversión en software, aplicaciones y otros desarrollos tecnológicos sumará 4,200 millones de lempiras, o sea 200 millones más",19-10-2020 14:52,https://www.bing.com/th?id=OVFT.rZBkTqPAcRuYXWo0Ga2IWC,Chile,El Heraldo
Infectólogo advierte de aumentos de casos de COVID-19 después de Semana Morazánica,https://proceso.hn/infectologo-advierte-de-aumentos-de-casos-de-covid-19-despues-de-semana-morazanica/,"Tegucigalpa – Honduras registrará mayores casos de COVID-19 después de la Semana Morazánica, la cual está prevista para la primera semana de noviembre, advirtió este lunes el infectólogo Tito Alvarado",19-10-2020 17:27,https://www.bing.com/th?id=OVFT.A34_aIWwe7kqoPcmYYhqji,Chile,Proceso
Marco Tulio Medina: UNAH puede realizar estudios sobre reinfección por COVID-19.,https://www.latribuna.hn/2020/10/19/marco-tulio-medina-unah-puede-realizar-estudios-sobre-reinfeccion-por-covid-19/,"El científico hondureño Marco Tulio Medina, explicó este lunes que en los casos de reinfección por COVID-19 detectados en países extranjeros, fue necesario evaluar el material genético del virus y que",19-10-2020 17:40,https://www.bing.com/th?id=OVFT.7jayaAXGBvFX1D0oCX1dsy,Chile,La Tribuna
Video viral: Sampedranos ya no creen en la pandemia y se van de fiesta a bar-discoteca,https://www.laprensa.hn/honduras/1416542-410/video-viral-sampedranos-pandemia-fiesta-bar-discoteca-covid19-coronavirus,San Pedro Sula. En las últimas horas se hizo viral un video que muestra a muchos hondureños disfrutar del ambiente nocturno en el interior de un bar-discoteca. Sin mascarillas y,19-10-2020 17:42,https://www.bing.com/th?id=OVFT.lAvuuJbnurSche8UFb1oey,Chile,La Prensa Chicos
Advierten que contagios por Covid-19 podrían aumentar después de la Semana Morazánica,https://hondudiario.com/2020/10/19/advierten-que-contagios-por-covid-19-podrian-aumentar-despues-de-la-semana-morazanica/,"El infectólogo, Tito Alvarado, advirtió este lunes que Honduras registrará mayores casos de COVID-19 después las vacaciones programadas a partir del 01 al 07 de noviembre en la denominada “Semana Mora",19-10-2020 18:12,https://www.bing.com/th?id=OVFT.oNZxrdQomseDxB_ssjy2yS,Chile,Hondudiario
"Niñez hondureña, principal víctima de consecuencias de pandemia de covid-19",https://proceso.hn/ninez-hondurena-principal-victima-de-consecuencias-de-pandemia-de-covid-19/,"Tegucigalpa – Miles de niños hondureños se han visto obligados a salir a la calle, abandonar el sistema educativo y se enfrentan al hambre, discriminación y al trabajo infantil por la crisis desatada",19-10-2020 19:45,https://www.bing.com/th?id=OVFT.obCM1CEVxBE7rWnM58FHRi,Chile,Proceso
A muerte súbita: Día y hora para el Motagua-Comunicaciones en Liga Concacaf,https://www.diez.hn/liganacionaldehonduras/1416596-498/motagua-comunicaciones-concacaf-league-guatemala-honduras-estadio-nacional-tegucigalpa,El equipo que comanda Diego Vázquez se enfrenta en la fase previa al Comunicaciones de Guatemala y este jueves se juegan el pase a los octavos de final a partido único en el Nacional.,19-10-2020 20:54,https://www.bing.com/th?id=OVFT.6YQ72bKKUWojeBiYlL83dy,Chile,diez.hn
"La niñez hondureña, la principal víctima de las consecuencias de la pandemia de Covid-19",https://www.laprensa.hn/honduras/1416597-410/ni%C3%B1ez-hondure%C3%B1a-v%C3%ADctima-consecuencias-pandemia-covid19,"Miles de niños hondureños se han visto obligados a salir a la calle, abandonar el sistema educativo y se enfrentan al hambre, discriminación y al trabajo infantil por la crisis desatada por la pandemi",19-10-2020 21:07,https://www.bing.com/th?id=OVFT.NyeSDMIGkOU51ern0W4HGy,Chile,La Prensa Chicos
El dirigente de LIBRE expresidente Manuel Zelaya participa en Venezuela en el ensayo de la vacuna rusa contra la covid-19,https://ultimahora.hn/el-dirigente-de-libre-expresidente-manuel-zelaya-participa-en-venezuela-en-el-ensayo-de-la-vacuna-rusa-contra-la-covid-19/,"El expresidente de Honduras y Coordinador del Libertad y Refundación, Manuel Zelaya llegó a Venezuela para participar de la vacuna Sputnik V como parte de los ensayos de la vacuna en ese país",19-10-2020 21:36,https://www.bing.com/th?id=OVFT.AefddCA1CqEpeiyiRmaNhy,Chile,Ultima Hora
