name,url,description,datePublished,imagen,pais,Fuente
Baja en ocupación hospitalaria alienta reapertura económica en Honduras,https://www.laprensa.hn/honduras/1396476-410/baja-en-ocupaci%C3%B3n-hospitalaria-alienta-reapertura-econ%C3%B3mica-en-honduras,"Titular de Copeco y Sinager indicó que los centros de triaje y las visitas de las brigadas de respuesta rápida han contribuido a disminuir la saturación en los hospitales de la capita. Tegucigalpa, Ho",25-07-2020 12:53,https://www.bing.com/th?id=ON.25044AB3DA85A11E1EB22C39511369BA,Chile,La Prensa Chicos
"Covid-19 hunde a más de 300,000 hondureños en la miseria",https://www.laprensa.hn/premium/1396477-410/covid-19-hunde-a-mas-de-300000-en-la-miseria-economia-coronavirus-pandemia,"San Pedro Sula, Honduras. Desde que el Gobierno de Honduras anunció el ... Hoy, a causa de las restricciones impuestas por el Gobierno para contener el covid-19, ellos integran el grupo de casi 2 millones que no tienen ni un pedazo de tortilla.",25-07-2020 13:23,https://www.bing.com/th?id=ON.3D80FF3D2043E0D259E821CD1C3F7DA7,Chile,La Prensa Chicos
Muere por covid-19 el periodista hondureño Edilberto Zelaya,https://www.elheraldo.hn/pais/1396559-466/muere-por-covid-19-el-periodista-hondure%C3%B1o-edilberto-zelaya,"TEGUCIGALPA, HONDURAS.-Otro periodista hondureño perdió la batalla contra el covid-19. José Edilberto Zelaya falleció este sábado en el Hospital Cardiopulmonar El Tórax. Hace una semana se informó que",25-07-2020 20:46,https://www.bing.com/th?id=ON.9362D1F0BD995B0FC19E9B5819B90C05,Chile,El Heraldo
Honduras registra 37.559 contagios y 1.061 muertos por COVID-19,https://www.latribuna.hn/2020/07/25/honduras-registra-37-559-contagios-y-1-061-muertos-por-covid-19/,"Los contagios con la COVID-19 en Honduras ascendieron este viernes a 37.559, mientras que los muertos a 1.061 desde que inició la pandemia, en marzo, informó el Sistema Nacional de Gestión de Riesgos",25-07-2020 22:44,https://www.bing.com/th?id=ON.EB6572C66E782C1A4680C1A21FAE1286,Chile,La Tribuna
Consternación por muerte del periodista Edilberto Zelaya,https://www.elheraldo.hn/pais/1396563-466/consternaci%C3%B3n-por-muerte-del-periodista-edilberto-zelaya,"TEGUCIGALPA, HONDURAS.-Consternación en el gremio periodístico por la muerte del comunicador Edilberto Zelaya, otra víctima más de la covid-19. Edilberto Zelaya siempre destacó como un periodista en d",25-07-2020 22:57,https://www.bing.com/th?id=ON.EDA87FAD7D4676475A9226C8177F3D89,Chile,El Heraldo
El coronavirus deja otras 37 muertes en Honduras y 879 nuevos casos positivos,https://www.diez.hn/coronavirus/1396620-441/coronavirus-honduras-covid-19-pandemia-muertes-sinager,"El número de fallecidos por COVID-19 está a punto de alcanzar los 1,100. En Gracias a Dios se disparó del número de casos. El Sistema Nacional de Gestión de Riesgos (SINAGER) anunció este sábado, 25 d",26-07-2020 02:12,https://www.bing.com/th?id=ON.FA1699A721D3B0A68262FE3FB7D0DA50,Chile,diez.hn
"Honduras reporta 38,430 contagiados por coronavirus y 1,098 fallecidos",https://hondudiario.com/2020/07/25/honduras-reporta-38430-contagiados-por-coronavirus-y-1098-fallecidos/,"El Sistema Nacional de Gestión de Riesgos (Sinager), confirmó 879 casos nuevos de Covid-19 este sábado de 2, 0048 pruebas realizadas, sumando un total de 38,438 contagios en todo el país. Los nuevos casos se distribuyen en Cortés 183, Francisco ...",26-07-2020 02:33,https://www.bing.com/th?id=ON.C5E2E6A288D2BA49AF53E8420A2A97D1,Chile,Hondudiario
Ministerio Público seguirá tomando declaración a funcionarios de alto perfil en caso hospitales móviles,https://www.radiohrn.hn/ministerio-publico-seguira-tomando-declaracion-a-funcionarios-de-alto-perfil-en-caso-hospitales-moviles,El Ministerio Público informó el sábado 25 de julio que se continuará tomando declaraciones y requiriendo información en el caso hospitales móviles comprados en medio de emergencia sanitaria por covid,26-07-2020 13:16,https://www.bing.com/th?id=ON.B909C8BE6AF808DF4B2A03F5F68482C6,Chile,Radio HRN
