name,url,description,datePublished,imagen,pais,Fuente
"Israel donará a Honduras alrededor de 5,000 vacunas contra el covid-19",https://www.elheraldo.hn/pais/1444864-466/israel-dona-vacunas-covid-19-honduras,"El coordinador general del gobierno, Carlos Madero, hizo un agradecimiento especial al primer ministro israelí, Benjamín Netanyahu",23-02-2021 15:19,https://www.bing.com/th?id=OVFT.P8NDu-va0eaPZ7shQN9hwi,Chile,El Heraldo
Enfermera pierde la batalla contra la COVID-19 en SPS,https://www.latribuna.hn/2021/02/23/enfermera-pierde-la-batalla-contra-la-covid-19-en-sps/,Una enfermera murió en las últimas horas tras perder la batalla contra la COVID-19 en el Instituto Hondureño de Seguridad,23-02-2021 17:06,https://www.bing.com/th?id=OVFT.zwUbZ4SCqc4FOTusbrss-y,Chile,La Tribuna
Hospitales reportan al menos 10 muertes por sospecha de coronavirus,https://hondudiario.com/2021/02/23/hospitales-reportan-al-menos-10-muertes-por-sospecha-de-coronavirus/,"El principal sanatorio del país tiene 59 pacientes ingresados en salas Covid-19, de los cuales 16 están en la Unidad ... la vida bajo sospecha de coronavirus en las últimas 12 horas. Honduras contabiliza 165,737 contagios y 4,024 muertes por coronavirus ...",23-02-2021 17:48,https://www.bing.com/th?id=OVFT.sXHcVGocjlznKshOlfa8HS,Chile,Hondudiario
Honduras agradece a Israel donación de vacunas,https://www.latribuna.hn/2021/02/23/honduras-agradece-a-israel-donacion-de-vacunas/,"El Coordinador General de Gobierno, Carlos Madero, llamó a la comunidad internacional y nacional a no politizar el manejo de",23-02-2021 19:46,https://www.bing.com/th?id=OVFT.ejWfaE_L9HvJTey-KXnT-i,Chile,La Tribuna
Gobierno de Honduras pide no politizar distribución de vacuna anticovid,https://www.laprensa.hn/honduras/1444981-410/gobierno-honduras-no-politizar-distribucion-vacuna-pandemia-coronavirus,El Congreso Nacional recién autorizó a la Secretaría de Finanzas para que realice compras de manera directa con las casas farmacéuticas ante fallaidos intentos con Covax.,23-02-2021 21:01,https://www.bing.com/th?id=OVFT.YiUo2vGHOQi-1n0W9ZUgAy,Chile,La Prensa Chicos
Gobierno respalda compra directa de vacunas contra la Covid-19,https://www.vtv.com.hn/noticia/gobierno-respalda-compra-directa-de-vacunas-contra-la-covid-19/,"Ante los constantes cambios de fecha de la entrega de la vacuna contra el Covid-19 a través del mecanismo COVAX, el presidente Juan Orlando Hernández decidió sancionar la reforma del decreto que permi",23-02-2021 21:41,https://www.bing.com/th?id=OVFT.aPxBH8Nwe0LtgYLk7D65ZS,Chile,VTV
"NO POLITIZAR DISTRIBUCIÓN DE VACUNA, PIDE MINISTRO MADERO",https://ultimahora.hn/no-politizar-distribucion-de-vacuna-pide-ministro-madero/,"El Coordinador General de Gobierno, Carlos Madero, llamó hoy a la comunidad internacional y nacional a no politizar el manejo de la vacuna y agradeció a Israel por la donación de un lote de",23-02-2021 21:54,https://www.bing.com/th?id=OVFT.yAzHHhe2JLFr0GfHtZ3KSi,Chile,Ultima Hora
ONU HACE LLAMADO URGENTE POR HAMBRUNA QUE AZOTA HONDURAS,http://www.web.ellibertador.hn/index.php/noticias/nacionales/2710-onu-hace-llamado-urgente-por-hambruna-que-azota-honduras,"Honduras y Nicaragua) azotados por graves hambrunas causadas por la crisis económica desata por el covid-19 y los desastres naturales. En un comunicado divulgado en Roma, la Organización de Naciones Unidas (ONU), premio Nobel de la Paz en 2020 ...",23-02-2021 21:55,https://www.bing.com/th?id=OVFT.WtMGyJ1uRQJW9riBDKZvIy,Chile,El Libertador
"El virus está más agresivo, son al menos 40 fallecidos diarios: Roberto Cosenza",https://hondudiario.com/2021/02/23/el-virus-esta-mas-agresivo-son-al-menos-40-fallecidos-diarios-roberto-cosenza/,"Es preocupante que aún Honduras no llega a la meseta por Covid-19, y se siguen contabilizando ciudadanos que fallecen por la enfermedad, señaló. Cosenza apuntó que, en el Hospital Leonardo Martínez de Cortés, donde se registran 80 pacientes ...",23-02-2021 22:17,https://www.bing.com/th?id=OVFT.xErtfq0Dla7z8yf5kDSwxi,Chile,Hondudiario
Salud acelerará envío de unidades de triaje móviles a barrios y colonias,http://www.elsoldehonduras.com/salud/salud-acelerara-envio-de-unidades-de-triaje-moviles-a-barrios-y-colonias/,"Ante el aumento de casos positivos de covid-19 en el país, la Secretaría de Salud (Sesal) ejecutará la estrategia nacional de llevar unidades de triaje móviles a barrios y colonias como forma de preve",23-02-2021 22:37,https://www.bing.com/th?id=OVFT._QGbWwAC35CJqLagLT7x1S,Chile,El Sol de Honduras
"Presidente Hernadez agradece a Israel por la respuesta de 5,000 dosis de vacunas contra el COVID-19",http://www.elsoldehonduras.com/nacionales/presidente-hernadez-agradece-a-israel-por-la-respuesta-de-5000-dosis-de-vacunas-contra-el-covid-19/,"Que el Gobierno de Israel, luego de una solicitud del Presidente Juan Orlando Hernández al Primer Ministro, Benjamin Netanyahu, anunció la donación de un lote de 5.000 dosis de vacunas contra el COVID",23-02-2021 22:50,https://www.bing.com/th?id=OVFT.cmz_8gQJFMSNKyoXz4ApZi,Chile,El Sol de Honduras
"La COVID-19, Eta e Iota dejan al descubierto violencia de género en Honduras",https://proceso.hn/la-covid-19-eta-e-iota-dejan-al-descubierto-violencia-de-genero-en-honduras/,El estudio titulado «Análisis Rápido de Género en Honduras: un panorama ante COVID-19 y Eta/Iota» destaca que la pandemia y las tormentas afectaron las condiciones estructurales relacionadas con,23-02-2021 22:50,https://www.bing.com/th?id=OVFT.pMN5frTZTThR6VgeCP0h0S,Chile,Proceso
HONDURAS QUEDARÁ A LA ZAGA DE AMÉRICA LATINA EN VACUNAS Y PAÍSES “TOP” DEL MUNDO,http://www.web.ellibertador.hn/index.php/noticias/nacionales/2711-honduras-quedara-a-la-zaga-de-america-latina-en-vacunas-y-paises-top-del-mundo,"En América Latina, Honduras está entre los cinco países que no han puesto una sola vacuna junto a Guatemala, Nicaragua, Uruguay y Cuba, que aunque esperan empezar en próximas semanas o meses, al final",23-02-2021 23:11,https://www.bing.com/th?id=OVFT.t4I2UDXg7solLFy2mbByli,Chile,El Libertador
"Honduras supera las 4,000 muertes por coronavirus en 11 meses",https://www.elheraldo.hn/pais/1445044-466/honduras-muertos-coronavirus,Los contagios y fallecimientos por el covid-19 en Honduras no presentan ningún descenso en el territorio hondureño,23-02-2021 23:41,https://www.bing.com/th?id=OVFT.JjxPsldpTCImtIRFJeiwNi,Chile,El Heraldo
Médico: Por esperar un 20 % de vacunas gratis Honduras no planificó compras,https://tiempo.hn/medico-vacunas-gratis-honduras-no-planificar-compras/,El médico Fidel Barahona lamentó que el gobierno se haya esperanzado a que la vacuna contra el COVID-19 se iba a obtener gratis con Covax.,23-02-2021 23:54,https://www.bing.com/th?id=OVFT.m3Kt6WbL9q6qgQqtWtlYvS,Chile,Tiempo
"La covid-19, Eta y Iota dejan al descubierto violencia de género en Honduras",https://www.laprensa.hn/honduras/1445052-410/-covid-19-eta-iota-violencia-genero-honduras-,"La representante de ONU Mujeres en Honduras, Margarita Bueso, dijo que la pandemia de coronavirus SARS-CoV-2 ha 'profundizado' los diferentes tipos de violencia contra la mujer en el país centroameric",24-02-2021 00:21,https://www.bing.com/th?id=OVFT.ln4TrIPS2AyE-tB1NvkBcC,Chile,La Prensa Chicos
Estos dos departamentos de Honduras presentan el mayor número de niños contagiados por covid-19,https://www.radiohrn.hn/estos-dos-departamentos-de-honduras-presentan-el-mayor-numero-de-ninos-contagiados-por-covid-19,¡Atención! Conoce los dos departamentos que registran el mayor número de niños contagiados por covid Francisco Morazán y Cortés son los departamentos que representan la mayor cantidad de niños diagnos,24-02-2021 00:24,https://www.bing.com/th?id=OVFT.H1dx4WKg1X3HY1z--GlMWy,Chile,Radio HRN
Expertos proponen crear plataforma para garantizar transparencia en la vacunación,https://tiempo.hn/expertos-plataforma-para-transparencia-en-vacunacion/,"Los expertos aseguraron que el proceso de vacunación debe ser transparente, por lo que proponen una plataforma que monitoree todo",24-02-2021 00:36,https://www.bing.com/th?id=OVFT.l8ZzOV6PISLy4sP_ucGI0y,Chile,Tiempo
Este jueves llegan a Honduras primeras vacunas contra el Covid-19: ¿Quienes serán los primeros inoculados?,https://www.diez.hn/coronavirus/1445083-441/jueves-llegan-primeras-vacunas-covid-19-honduras-donadas-israel,El Gobierno de Israel hizo la primera donación de vacunas contra el Coronavirus a Honduras y llegan la noche de este miércoles,24-02-2021 01:19,https://www.bing.com/th?id=OVFT.qe3_kVo1S0dGzkk99HpOtS,Chile,diez.hn
Honduras agradece a Israel por donación de vacunas,https://www.vtv.com.hn/noticia/honduras-agradece-a-israel-por-donacion-de-vacunas/,"En un mensaje publicado en su cuenta oficial de Twitter, el presidente Juan Orlando Hernández puntualizo: “Agradecemos a 𝗜𝘀𝗿𝗮𝗲𝗹 🇮🇱 por la respuesta de 5,000 dosis de vacunas 💉 contra el COVID",24-02-2021 02:09,https://www.bing.com/th?id=OVFT.NDjFgpnF6Tr0fZfQEkGwji,Chile,VTV
Honduras acumula 166 mil 547 contagios de COVID-19,https://proceso.hn/honduras-acumula-166-mil-547-contagios-de-covid-19/,"Los casos de COVID-19 en Honduras se elevaron este martes a 166 mil 547 desde que se declaró la emergencia sanitaria por la pandemia en marzo del año pasado, informó el Sistema Nacional de Gestión",24-02-2021 03:31,https://www.bing.com/th?id=OVFT.I7OXBhvdt5M2r7a9Lz3kSC,Chile,Proceso
Un hombre de 78 años y una mujer de 70 entre los nuevos fallecidos de este martes en Honduras,https://www.radiohrn.hn/un-hombre-de-78-anos-y-una-mujer-de-70-entre-los-nuevos-fallecidos-de-este-martes-en-honduras,"Honduras a través del Sistema Nacional de Gestión de Riesgos(Sinager), informó el martes (23.02.2021)  sobre la realizaron de 2 mil 485 nuevas pruebas para diagnosticar el virus, de las cuales 810 die",24-02-2021 04:16,https://www.bing.com/th?id=OVFT.Q5WrFaNIuxLjb9Q3PlP6WS,Chile,Radio HRN
Las 5.000 vacunas anticovid donadas por Israel serán para personal de primera línea asegura el Gobierno,http://www.eldiario.hn/las-5-000-vacunas-anticovid-donadas-por-israel-seran-para-personal-de-primera-linea-asegura-el-gobierno/,"Tegucigalpa. - Las 5.000 vacunas contra la covid-19 donadas por Israel a Honduras, que llegarán próximamente al país, serán en su totalidad para inmunizar a los trabajadores de la salud que trabajan e",24-02-2021 04:40,https://www.bing.com/th?id=OVFT.vr416BXkVUN3OJRv8cYBqy,Chile,El Diario
