name,url,description,datePublished,imagen,pais,Fuente
"Alice Shackelford, nueva coordinadora residente de ONU en Honduras",https://www.laprensa.hn/honduras/1393690-410/-alice-shackelford-coordinadora-onu-honduras-,"La nueva coordinadora residente del Sistema de Naciones Unidas en Honduras, Alice Shackelford, asumió este lunes el cargo con el compromiso de apoyar al país en la implementación de la Agenda 2030 par",13-07-2020 23:03,https://www.bing.com/th?id=ON.9F6338E5B85147CFEE11D18C9E9F84F8,Chile,La Prensa Chicos
El podcast con las noticias de Honduras y el mundo del lunes 13 de julio,https://www.laprensa.hn/podcasts/1393607-410/honduras-atic-investh-hospitales-salud-coronavirus-covid_19-trump-real-madrid-champions,"Escuche el resumen de las noticias más relevantes que fueron tendencia el día de hoy en Honduras y el mundo. San Pedro Sula, Honduras Este es el resumen de las principales noticias de Honduras y el mu",13-07-2020 23:33,https://www.bing.com/th?id=ON.E5B5A3A065EB30FCBA471C5A988A7BCE,Chile,La Prensa Chicos
Honduras participa en Cumbre ministerial de la OCDE sobre COVID-19,https://www.latribuna.hn/2020/07/13/honduras-participa-en-cumbre-ministerial-de-la-ocde/,"La viceministra Doris Mendoza en representación del pueblo y Gobierno de Honduras, participa en la cumbre ministerial virtual social de la Organización para la Cooperación y el Desarrollo Económico OC",14-07-2020 01:33,https://www.bing.com/th?id=ON.93BF931BF993AE63DDC257672372BAD4,Chile,La Tribuna
India dona medicamentos a Honduras para tratar a pacientes de COVID-19,https://www.latribuna.hn/2020/07/13/india-dona-medicamentos-a-honduras-para-tratar-a-pacientes-de-covid-19/,"El Gobierno de India entregó a Honduras una donación de medicamentos, entre ellos hidroxicloroquina, para tratar a infectados por el nuevo coronavirus SARS-Cov-2, informó este lunes una fuente oficial",14-07-2020 06:25,https://www.bing.com/th?id=ON.26BA568562F7315E92FF49075529D76C,Chile,La Tribuna
OPS: “Ahora más que nunca es importante vacunarse”,https://www.elheraldo.hn/pais/1393752-466/ops-ahora-mas-que-nunca-es-importante-vacunarse,"Piedad Huerta, representante de la OPS en Honduras, llamó a las grupos en riesgo a que acudan a los centros de salud a demandar la vacuna siguiendo las medidas de bioseguridad para protegerse contra e",14-07-2020 06:29,https://www.bing.com/th?id=ON.936F611AC2B53D02C35D72C5801F5619,Chile,El Heraldo
Aumentan en un 300% los contagios por covid-19 en Comayagua,https://www.elheraldo.hn/pais/1393749-466/aumentan-en-un-300-los-contagios-por-covid-19-en-comayagua,"Los departamentos de Comayagua, Choluteca, Olancho, Atlántida, Lempira, Colón y Santa Bárbara regresaron ayer a la fase cero de la apertura económica COMAYAGUA, HONDURAS.-El aumento de casos de covid-",14-07-2020 06:29,https://www.bing.com/th?id=ON.49D630DE82A5A2AA94455E3182B32EB5,Chile,El Heraldo
Honduras suma 489 positivos y 15 nuevas muertes por Covid-19,https://hondudiario.com/2020/07/13/honduras-suma-489-positivos-y-15-nuevas-muertes-por-covid-19/,"El Sistema Nacional de Gestión de Riesgos (Sinager), informó este lunes que de 1,343 pruebas para diagnosticar Covid-19 en el país, 489 dieron positivo sumando así un total de 28,579 casos de coronavi",14-07-2020 15:03,https://www.bing.com/th?id=ON.09A77A9A2D92798F9423D5B11FD1B51E,Chile,Hondudiario
"Carlos Mejía y su fichaje por Pumas: ""Voy a México para representar a Dios, mi familia y a Honduras""",https://www.diez.hn/legionarios/1393906-498/carlos-mejias-y-las-otras-ofertas-que-recibio-antes-de-fichar-por-pumas-mexico,"A partir de la próxima temporada, al joven futbolista hondureño Carlos Mejía ya no se le verá más en la Liga Nacional tras la confirmación de su fichaje por los Pumas de la Universidad de México. En e",14-07-2020 21:07,https://www.bing.com/th?id=ON.7579AAE6BA180C8B261049839BD76CA4,Chile,diez.hn
Fuerza Honduras es el mecanismo idóneo para coadyuvar en los problemas de la pandemia,http://www.elsoldehonduras.com/nacionales/fuerza-honduras-es-el-mecanismo-idoneo-para-coadyuvar-en-los-problemas-de-la-pandemia/,"Tegucigalpa. El secretario ejecutivo del Foro Nacional de Convergencia (Fonac), Omar Rivera, calificó hoy como acertada la iniciativa gubernamental Fuerza Honduras que busca contrarrestar a través de",14-07-2020 21:20,https://www.bing.com/th?id=ON.4D5DCA7353E87A56829B32233A86B731,Chile,El Sol de Honduras
28.579 casos de covid-19 se registran en Honduras al sumarse 489 nuevos positivos,http://www.elsoldehonduras.com/salud/28-579-casos-de-covid-19-se-registran-en-honduras-al-sumarse-489-nuevos-positivos/,Tegucigalpa. Un total de 28.579 casos de covid-19 se registran en Honduras al contabilizarse hoy 489 pacientes positivos con esa enfermedad causada por el coronavirus. Así lo informó hoy el vocero ofi,14-07-2020 21:20,https://www.bing.com/th?id=ON.C442E3F65CD08CF0ED9907F18D6485C5,Chile,El Sol de Honduras
Más de 100 agentes de tránsito se han contagiado de covid-19 en el Distrito Central,https://radiohrn.hn/honduras-coronavirus-mas-de-100-agentes-de-transito-se-han-contagiado-de-covid-19-en-el-distrito-central/,"Agentes de tránsito afectados por coronavirus. Un total de 110 agentes de la Dirección Nacional de Vialidad y Transporte (DNVT) resultaron positivos al covid-19 solo en Tegucigalpa y Comayagüela, conf",14-07-2020 21:27,https://www.bing.com/th?id=ON.313D1957F5ABE0601B096DFA153074AF,Chile,Radio HRN
"Finanzas detalla recursos ejecutados por Lps 4,589.2 millones en el marco del COVID-19",https://ultimahora.hn/?q=content/finanzas-detalla-recursos-ejecutados-por-lps-45892-millones-en-el-marco-del-covid-19,"Enviado por Editor 1 el Mar, 07/14/2020 - 15:34",14-07-2020 21:35,https://www.bing.com/th?id=ON.C7689AA88868A0D5AB3C17665DA5F0CC,Chile,Ultima Hora
Nuevo Centro de la UNAH ha realizado 36 tomografías a pacientes de covid-19,https://radiohrn.hn/nuevo-centro-de-la-unah-ha-realizado-36-tomografias-a-pacientes-de-covid-19/,"El nuevo Centro de Imágenes permite detectar neumonía por coronavirus en unos tres minutos. El nuevo Centro de Imágenes Biomédicas de la Universidad Nacional Autónoma de Honduras (UNAH), ha realizado",14-07-2020 22:16,https://www.bing.com/th?id=ON.71ECE7960A7164E22A698E91EC31AC5F,Chile,Radio HRN
