name,url,description,datePublished,imagen,pais,Fuente
"Abrir la economía de forma rápida podría llevar a un colapso de sistema, advierte científico hondureño",https://www.proceso.hn/actualidad/7-actualidad/abrir-la-economia-de-forma-rapida-podria-llevar-a-un-colapso-de-sistema-advierte-cientifico-hondureno.html,"Tegucigalpa - A criterio del científico hondureño, Marco Tulio Medina, tomar la decisión de abrir la economía muy rápido podría llevar a un pico de casos de contagio y esto al colapso del sistema de s",11-05-2020 19:26,https://www.bing.com/th?id=ON.66A4A66BD1C7F082FD558028A8CCDE35,Chile,Proceso
Honduras: Este lunes reinician trabajos de infraestructura en el Aeropuerto Palmerola,https://radiohrn.hn/honduras-este-lunes-reinician-trabajos-de-infraestructura-en-el-aeropuerto-palmerola/,"Proyecto de construcción del aeropuerto de Palmerola. Foto: Hondudiario. Las labores de construcción del aeropuerto de Palmerola, ubicado en Comayagua, zona centro de Honduras, se reanudan a partir de",11-05-2020 19:50,https://www.bing.com/th?id=ON.9DAADB8DD32363DB62F80F0C68BEFE92,Chile,Radio HRN
Minuto a minuto del coronavirus en Honduras y el mundo (12 de mayo de 2020),https://www.elheraldo.hn/especiales/coronavirus/1379173-528/minuto-a-minuto-del-coronavirus-en-honduras-y-el-mundo-12-de,"Los resultados de las pruebas que Honduras realiza para detectar los casos de Covid-19 tienen una mora de siete días, mientras no existe certeza de hacia dónde va la curva epidemiológica",12-05-2020 15:49,https://www.bing.com/th?id=ON.A733B7E543A67ABEDE1BF98158473B78,Chile,El Heraldo
Muere niña de ocho meses a causa del COVID-19 en Honduras,https://www.latribuna.hn/2020/05/12/muere-nina-de-ocho-meses-a-causa-del-covid-19-en-honduras/,El Sistema Nacional de Gestión de Riesgos (Sinager) confirmó ayer el fallecimiento de una niña de ocho meses de edad que se suma a las 116 muertes por el nuevo coronavirus. Desde el pasado 10 de marzo,12-05-2020 15:57,https://www.bing.com/th?id=ON.8C69DD5C3C6A1AE0A8E38BF79F474425,Chile,La Tribuna
A disparos ultiman a tres jóvenes en colonia capitalina La Rosa,https://www.proceso.hn/caliente/12-caliente/a-disparos-ultiman-a-dos-jovenes-en-colonia-capitalina-la-rosa.html,"Tegucigalpa - Tres jóvenes perdieron la vida en condiciones violentas la noche de este lunes en la colonia La Rosa de Comayagüela, ciudad gemela con Tegucigalpa, capital de Honduras. - La colonia La R",12-05-2020 16:15,https://www.bing.com/th?id=ON.CE2164E839F8647D3453AEA4B6D6D468,Chile,Proceso
"Cintia Zelaya, la hondureña que rompe el confinamiento para tener qué comer",https://www.diez.hn/coronavirus/1379208-441/historia-cinthia-zelaya-hondurena-rompe-confinamiento-cuarentena-buscando-comida,"La agencia de noticias AFP cuenta la historia de una hondureña sin empleo y sin comida en medio de la crisis por coronavirus. La hondureña Cintia Suyapa Zelaya, de 24 años, admite que incumple junto a",12-05-2020 17:06,https://www.bing.com/th?id=ON.E7441D429B850F8DCD9A51235C751F74,Chile,diez.hn
Muere subcomisionado de la Policía que fue hospitalizado por COVID-19,https://www.laprensa.hn/especiales/coronavirus/1379257-410/subcomisionado-fallecimiento-coronavirus-honduras-secretaria-seguridad,"El subcomisionado Jaime Manfredo Barahona fue ingresado a un centro médico el 5 de mayo tras dar positivo de coronavirus. Tegucigalpa, Honduras. La Secretaría de Seguridad informó este martes acerca d",12-05-2020 21:13,https://www.bing.com/th?id=ON.0878F05B3E2A2B91CA55211F066FBF86,Chile,La Prensa Chicos
