name,url,description,datePublished,imagen,pais,Fuente
Casi un millón de estudiantes siguen fuera de clases en Honduras,https://www.elheraldo.hn/pais/1446532-466/casi-un-mill%C3%B3n-de-estudiantes-siguen-fuera-de-clases-en-honduras,Un año va a cumplir la pandemia de covid-19 de haber llegado a Honduras y la Secretaría de Educación no ha logrado montar un sistema que permita llevar la educación a todos los niños y jóvenes de Honduras. LEA: Preocupa la baja calidad en clases ...,02-03-2021 14:15,https://www.bing.com/th?id=OVFT.V31PNRQEk3F9KOOypLNkay,Chile,El Heraldo
Vacunación anticovid en Honduras: buscan cerrar compra de cuatro millones de dosis,https://www.elheraldo.hn/pais/1446530-466/covid-honduras-cuatro-millones-vacunas,Salud está investigando al menos tres casos ocurridos en dos hospitales donde se aplicó vacunas a personal que no era de primera línea,02-03-2021 14:26,https://www.bing.com/th?id=OVFT.3gMfEV1h5O3pt6bm0ON_1S,Chile,El Heraldo
"Muere por covid-19 regidora de Villanueva, Cortés",https://www.laprensa.hn/honduras/1446596-410/muere-covid-19-regidora-villanueva,"Nusly Osiris Chavarría era reconocida, además, por su labor como docente en una institución educativa en el sector de Dos Caminos.",02-03-2021 16:59,https://www.bing.com/th?id=OVFT.r05ZNCHHV4LfFbD6HSOH5C,Chile,La Prensa Chicos
HONDURAS / COLECTIVO “100 MUJERES” SE SUMA A EXIGIR DIMISIÓN DE HERNÁNDEZ,http://www.web.ellibertador.hn/index.php/noticias/nacionales/2730-honduras-colectivo-100-mujeres-se-suma-a-exigir-dimision-de-hernandez,"Ayer, el colectivo “100 Mujeres por Honduras”, formado por distinguidas personalidades femeninas se suman a los diferentes bloques de la sociedad para exigir la renuncia irrevocable de Juan Hernández.",02-03-2021 18:07,https://www.bing.com/th?id=OVFT.1lz0tGCTXkyok1D_GYTeBC,Chile,El Libertador
Se apagó la voz narrativa del “Puma” Andino,https://www.diariomas.hn/2021/03/02/se-apago-la-voz-narrativa-del-puma-andino/,"Una triste noticia enluta nuevamente al periodismo deportivo nacional, una de los veces narrativas de los últimos 30 años, David ""Puma"" Andino ha",02-03-2021 19:34,https://www.bing.com/th?id=OVFT.SHFFpGqxCfwlbq9hHcXt4C,Chile,Mas
Nuevo lote de vacunas Covid-19 ingresarán a Honduras,https://www.vtv.com.hn/noticia/nuevo-lote-de-vacunas-contra-el-covid-19-llegaran-a-honduras/,Autoridades de salud confirman que serán 50 mil dosis de vacunas las que llegarán al país El Subsecretario de Salud informa que para la tercera semana de marzo estarán ingresando al país al rededor de,02-03-2021 20:35,https://www.bing.com/th?id=OVFT.YupJJwMbuCdr2C1ln6ae-y,Chile,VTV
Choco Lozano dice que el coronavirus lo hizo perder la forma física: “Es difícil volver a la dinámica”,https://www.diez.hn/legionarios/1446658-498/choco-lozano-coronavirus-lo-hizo-perder-la-forma-fisica-cadiz-barcelona-suplente,"El delantero hondureño, Choco Lozano, habla sobre lo complicado que ha sido recuperar su nivel tras ser contagiado de Coronavirus. Habla de su vida en España",02-03-2021 20:52,https://www.bing.com/th?id=OVFT.crcmQhH5U1Pw0MM9PIIIeC,Chile,diez.hn
SERÁ NECESARIA UNA VACUNACIÓN MASIVA DE LA POBLACIÓN HONDUREÑA PARA ALCANZAR UNA INMUNIZACIÓN DE REBAÑO,https://ultimahora.hn/sera-necesaria-una-vacunacion-masiva-de-la-poblacion-hondurena-para-alcanzar-una-inmunizacion-de-rebano/,"Con más de 170,000 casos registrados de COVID-19 en el país y más de 4,100 muertes según las cifras oficiales, es necesario que se realicen los procesos de vacunación masiva. Los datos",02-03-2021 20:52,https://www.bing.com/th?id=OVFT.0RgV_1sZMLKL1rTPv0IWES,Chile,Ultima Hora
"Coronavirus: Honduras reporta 171,758 casos de covid-19 tras sumar 773 nuevos contagios",https://www.radiohrn.hn/coronavirus-honduras-reporta-171758-casos-de-covid-19-tras-sumar-773-nuevos-contagios,"El Sistema Nacional de Gestión de Riesgos (Sinager), informó el martes (2.3.2021) que Honduras acumuló 171,758 casos positivos de coronavirus, tras reportarse 773 nuevos contagios a nivel nacional. Lo",03-03-2021 04:54,https://www.bing.com/th?id=OVFT.AU7Zm0OS2FLKsMRQ69NQyC,Chile,Radio HRN
131 municipalidades han recibido el segundo desembolso en atención al COVID-19,http://www.elsoldehonduras.com/nacionales/131-municipalidades-han-recibido-el-segundo-desembolso-en-atencion-al-covid-19/,"Un total de 131 municipalidades han recibido el segundo desembolso de emergencia en atención, prevención y combate al COVID-19, por un monto de 50 millones 399 mil 237 lempiras y cuatro alcaldías se e",03-03-2021 05:26,https://www.bing.com/th?id=OVFT.qi9iMKkMXi4tezdsmRKwEi,Chile,El Sol de Honduras
Honduras enviará 50 muestras a Brasil para detectar nuevas variantes del COVID-19,https://proceso.hn/honduras-enviara-50-muestras-a-brasil-para-detectar-nuevas-variantes-del-covid-19/,Honduras enviará alrededor de 50 muestras a un laboratorio de Brasil para determinar si en Honduras circulan otras variantes del virus SARS-Cov-2.,03-03-2021 07:04,https://www.bing.com/th?id=OVFT.LEmmI_iHo7XsrcKgcB-c4y,Chile,Proceso
Microbióloga Fallece por COVID-19 en Tegucigalpa,https://www.latribuna.hn/2021/03/03/microbiologa-fallece-por-covid-19-en-tegucigalpa/,Una profesional de la microbiología murió en las últimas horas tras perder la batalla contra la COVID-19 en el Hospital,03-03-2021 07:47,https://www.bing.com/th?id=OVFT.RgPfMoVRFx15zqlniA2y-y,Chile,La Tribuna
COVID-19 da tregua a presos de Honduras,https://proceso.hn/covid-19-da-tregua-a-presos-de-honduras/,"Tegucigalpa – Aunque la curva de contagios de nuevos casos de coronavirus en Honduras es hacia la alza, no ocurre lo mismo en el sistema carcelario del país que durante 2020 sumó 37",03-03-2021 09:40,https://www.bing.com/th?id=OVFT.TKXL4r33FxE6l2eRkyg9bC,Chile,Proceso
"Honduras acumula 181,758 contagios y 4,187 muertos por covid-19",https://www.laprensa.hn/honduras/1446828-410/honduras-coronavirus-covid-contagios-muertes,"Los contagios con covid-19 en Honduras subieron este martes a 171,758 y los muertos a 4,187, según el informe diario del Sistema Nacional de Gestión de Riesgos (Sinager). En un comunicado, el organism",03-03-2021 15:03,https://www.bing.com/th?id=OVFT.1rP8vT4U0OZ-zcDNQaiyHi,Chile,La Prensa Chicos
"COVID-19: Fallece David «El Puma» Andino, reconocido narrador deportivo",https://tiempo.hn/covid-19-muere-david-el-puma-andino-narrador-deportivo/,"David ""El Puma"" Andino, un narrador deportivo hondureño falleció en las últimas horas por complicaciones con el COVID-19. Las cifras",03-03-2021 15:38,https://www.bing.com/th?id=OVFT.H5AhuPga_wQk0lQFAG41RC,Chile,Tiempo
CIENTÍFICO MARCO TULIO MEDINA APLAUDE LLEGADA DE EMBAJADOR DE RUSIA PARA POSIBLE VACUNA ANTICOVID PARA HONDURAS,https://ultimahora.hn/cientifico-marco-tulio-medina-aplaude-llegada-de-embajador-de-rusia-para-posible-vacuna-anticovid-para-honduras/,"El medico Neurólogo Marco Tulio Medina, tras sostener una reunión con altos científicos organizados en Ginebra con la participación del Organización Mundial de la Salud informó que La reunión se",03-03-2021 20:01,https://www.bing.com/th?id=OVFT.ub-zcWZoGjDZ8ySNFJoveC,Chile,Ultima Hora
Dark web: Estafas vinculadas a la venta de la vacuna contra el COVID 19,https://hondudiario.com/2021/03/03/dark-web-estafas-vinculadas-a-la-venta-de-la-vacuna-contra-el-covid-19/,"La vacuna contra el COVID-19 es sin dudas uno de los que más atención acapara a nivel mundial. Es por lo que, lamentablemente, también representa una oportunidad para los cibercriminales de encubrir s",03-03-2021 20:34,https://www.bing.com/th?id=OVFT.OR9tWKKuMBJZMj6ha9Yc3i,Chile,Hondudiario
Honduras tendría un déficit de segundas dosis por exceder límite de vacunados,https://tiempo.hn/deficit-vacunacion-covid-honduras/,"CORTÉS, HONDURAS. Un total de 2,684 hondureños recibieron la primera dosis de la vacuna contra el COVID-19 de la farmacéutica Moderna donada por Israel, pero, según médicos que conversaron con TIEMPO",03-03-2021 20:59,https://www.bing.com/th?id=OVFT.sEwTvkUyCbmTX4q81F_cli,Chile,Tiempo
"La factura petrolera de Honduras bajó un 37,7 % en 2020 por el covid-19",https://www.radiohrn.hn/la-factura-petrolera-de-honduras-bajo-un-377-en-2020-por-la-covid-19,"La factura petrolera de Honduras sumó 938,7 millones de dólares en 2020, un 37,7 por ciento menos que en 2019, y el país compró 2,3 millones de barriles menos de hidrocarburos, debido a la caída de la",03-03-2021 21:05,https://www.bing.com/th?id=OVFT.coruWXY6byyvguxl3qXTkS,Chile,Radio HRN
