name,url,description,datePublished,imagen,pais,Fuente
HONDURAS/ ESTADO DE SITIO SIN CONFINAMIENTO ¿PARA QUÉ?,http://www.web.ellibertador.hn/index.php/noticias/nacionales/2477-honduras-estado-de-sitio-sin-confinamiento-para-que,"Los contagios por el Covid-19 superan los 108 mil 600 casos, más de 6 mil hondureños perdieron la vida y unos 600 mil puestos de trabajo se cerraron para siempre, pese a eso, el mandatario Juan Hernán",02-12-2020 22:51,https://www.bing.com/th?id=OVFT.2I37_Ix5qkpnmkIonQICqS,Chile,El Libertador
Sesal pide fortalecer medidas de bioseguridad para evitar el COVID-19 en Honduras,https://proceso.hn/sesal-pide-fortalecer-medidas-de-bioseguridad-para-evitar-el-covid-19-en-honduras/,"“Los hondureños debemos de continuar con las medidas de bioseguridad como una responsabilidad, debemos protegernos y proteger a nuestros compradores que visitan los establecimientos comerciales durant",02-12-2020 23:02,https://www.bing.com/th?id=OVFT.6wozbUhq-Tr37sXvOpnQfS,Chile,Proceso
Saprisista Frank Zamora se quedó de cuarentena en Honduras,https://www.diariomas.hn/2020/12/02/saprisista-frank-zamora-se-quedo-de-cuarentena-en-honduras/,"Debido a que salió positivo en las pruebas de la Covid-19 previo al juego ante el Marathon, donde su equipo el Deportivo Saprisas eliminó al",03-12-2020 01:02,https://www.bing.com/th?id=OVFT.nAb2wX16PAijktMQg0OYZC,Chile,Mas
Llega al país equipo israelí de socorro y rescate para ayudará en la rehabilitación de las zonas afectadas por las tormentas ETA e IOTA,http://www.eldiario.hn/llega-al-pais-equipo-israeli-de-socorro-y-rescate-para-ayudara-en-la-rehabilitacion-de-las-zonas-afectadas-por-las-tormentas-eta-e-iota/,La representación brindará asistencia profesional y ayudará en la rehabilitación de las zonas afectadas por los fenómenos ETA e IOTA Un equipo israelí de socorro y rescate llegó hoy al país para brind,03-12-2020 02:27,https://www.bing.com/th?id=OVFT.uyV-0numxHH9-4JCGcNOuy,Chile,El Diario
Honduras sobrepasa los 109 mil contagios de coronavirus,https://hondudiario.com/2020/12/02/honduras-sobrepasa-los-109-mil-contagios-de-coronavirus/,"*** En el plano internacional, la vacuna contra el nuevo coronavirus cada vez está más cerca. El Sistema Nacional de Gestión de Riesgos (Sinager), confirmó este miércoles 503 nuevos casos de Covid-19,",03-12-2020 02:55,https://www.bing.com/th?id=OVFT.0XMLNHZUQYGDfII-qyHY4i,Chile,Hondudiario
Honduras sigue sin bajar la curva del coronavirus en nueve meses de panademia,https://www.laprensa.hn/honduras/1426757-410/honduras-sigue-sin-bajar-curva-coronavirus-nueve-meses-panademia-,"El Sinager también registró 561 personas hospitalizadas, de las que 427 presentan un cuadro clínico estable, 121 están graves y 13 en unidades de cuidados intensivos.",03-12-2020 04:25,https://www.bing.com/th?id=OVFT.tewfOVq8jcJy7Yz0GS-tVy,Chile,La Prensa Chicos
COVID-19 Honduras: SINAGER confirma 503 nuevos casos y 3 muertos,https://tiempo.hn/covid-19-en-honduras-sinager-503-casos-3-muertos/,"TEGUCIGALPA, HONDURAS. De 1,512 nuevas pruebas para diagnosticar COVID-19 que procesó el Laboratorio Nacional de Virología (LNV), de la Secretaría de Salud (SESAL), 503 resulta",03-12-2020 05:29,https://www.bing.com/th?id=OVFT.Yczh90CphL780xQOqPe8di,Chile,Tiempo
La COVID-19 ha causado 2.930 muertos en Honduras,https://www.latribuna.hn/2020/12/02/la-covid-19-ha-causado-2-930-muertos-en-honduras/,"La pandemia de COVID-19, que desde marzo se comenzó a expandir en Honduras, le ha causado la muerte a 2.930 personas, informó este miércoles el estatal Sistema Nacional de Gestión de Riesgos (Sinager)",03-12-2020 05:51,https://www.bing.com/th?id=OVFT.gODl8F94927luU_HEjF1yS,Chile,La Tribuna
"Troglio cuenta cómo motivó al plantel para vencer a Motagua ""Les dije que son partidos de gloria""",https://www.diez.hn/liganacionaldehonduras/1426780-498/pedro-troglio-cuenta-como-motivo-olimpia-para-vencer-a-motagua-boca-river,"El entrenador del Olimpia, además, confesó que ha recibido otro golpe en su familia: su madre sufre con el coronavirus en Argentina. Habla de que se siente feliz de estar en Olimpia",03-12-2020 06:43,https://www.bing.com/th?id=OVFT.Yg5iV085nOZhKheL08aJlS,Chile,diez.hn
Casos de covid aumentan 2 por ciento en las últimas dos semanas; la pandemia no se ha controlado: Karla Pavón,https://www.radiohrn.hn/casos-de-covid-aumentan-2-por-ciento-en-las-ultimas-dos-semanas-la-pandemia-no-se-ha-controlado-karla-pavon,"""En las últimas dos semanas hemos tenido un aumento en el número de casos covid. Se ha incrementado en 2 por ciento. Esto se debe a que ya está en circulación toda la poblacin",03-12-2020 15:56,https://www.bing.com/th?id=OVFT.o_cUaCMhwc0hLSuYg8oHmy,Chile,Radio HRN
Destacan a Honduras entre los 30 países que participaron en desarrollo de medicinas contra el Covid,https://ultimahora.hn/destacan-a-honduras-entre-los-30-paises-que-participaron-en-desarrollo-de-medicinas-contra-el-covid/,"El destacado científico hondureño, el doctor Marco Tulio Medina, da cuenta de la publicación del New Orleans of Medicine, del estudio solidaridad para la evolución de cuatro medicamentos contra el",03-12-2020 17:38,https://www.bing.com/th?id=OVFT.gtNgZy9gp7ThuWRp-o5z1C,Chile,Ultima Hora
Honduras hace un llamamiento ante la ONU para garantizar acceso a vacunas,https://www.latribuna.hn/2020/12/03/honduras-hace-un-llamamiento-ante-la-onu-para-garantizar-acceso-a-vacunas/,"El presidente de Honduras, Juan Orlando Hernández, hizo este jueves un llamamiento a la comunidad internacional para que continúe fortaleciendo el fondo financiero de la alianza que impulsa la ONU «pa",03-12-2020 18:16,https://www.bing.com/th?id=OVFT.b1jKfI0SiVp_8zopSyV-IS,Chile,La Tribuna
"Darixon Vuelto sobre el clásico ante Olimpia: ""Vamos con el cuchillo entre los dientes""",https://www.diez.hn/liganacionaldehonduras/1426887-498/darixon-vuelto-olimpia-real-espana-domingo-liguilla-liga-concacaf,"El delantero del Real España, Darixon Vuelto, dijo que han trabajado en la semana en definición y esperan llegar finos al choque contra Olimpia. Además, envió un mensaje de solidad a periodista.",03-12-2020 20:10,https://www.bing.com/th?id=OVFT.sN46ezCHDLABOt8-KmUavi,Chile,diez.hn
"Vacuna contra el covid será gratuita en Honduras, tras aprobación de nueva ley",https://www.radiohrn.hn/vacuna-contra-el-covid-sera-gratuita-en-honduras,Las personas que se encuentran en la primera línea serán algunas de las primeras personas que serán vacunadas contra el covid en Honduras,03-12-2020 20:24,https://www.bing.com/th?id=OVFT.ZQHPq4HKQH-_AOvAWXtYUi,Chile,Radio HRN
Salud mantiene plan de fortalecimiento del sistema sanitario del país para contrarrestar la COVID-19,https://ultimahora.hn/salud-mantiene-plan-de-fortalecimiento-del-sistema-sanitario-del-pais-para-contrarrestar-la-covid-19/,La Secretaría de Salud ha logrado con éxito implementar el plan de respuesta para contrarrestar un posible brote de la COVID-19 consecuencia de los daños ocasionados por las tormentas tropicales,03-12-2020 22:03,https://www.bing.com/th?id=OVFT.29DRQiKZnoXY4lWx8Ivusi,Chile,Ultima Hora
BID ayudará a Honduras en la reasignación de fondos para reconstrucción y habilitación de infraestructura,https://proceso.hn/bid-ayudara-a-honduras-en-la-reasignacion-de-fondos-para-reconstruccion-y-habilitacion-de-infraestructura/,"Washington – El Banco Interamericano de Desarrollo (BID) ayudará a Honduras en la reasignación de fondos para la reconstrucción y habilitación de infraestructura del país, informó hoy el ministro de F",03-12-2020 22:37,https://www.bing.com/th?id=OVFT.d3NuI3V5qEsmwyZyXJMVNi,Chile,Proceso
HONDURAS / ¡ABSURDO! SÓLO 30 MIL LEMPIRAS PAGARÁN VIOLADORES DE LEY TRANSPARENCIA,http://www.web.ellibertador.hn/index.php/noticias/nacionales/2481-honduras-absurdo-solo-30-mil-lempiras-pagaran-violadores-de-ley-transparencia,"Si se considera que el salario mínimo vigente para 2020 en Honduras, oscila entre 9 mil 400 y 12 mil 100 lempiras, significa que los “sancionados” pagarán a lo sumo unos 36 mil lempiras, algo que raya",03-12-2020 23:45,https://www.bing.com/th?id=OVFT.Lb-I249TmNfLtWNryfr0JS,Chile,El Libertador
"Honduras suma 616 contagios y muertes por Covid-19 ya son 2,938",https://hondudiario.com/2020/12/03/honduras-suma-616-contagios-y-muertes-por-covid-19-ya-son-2938/,"El Sistema Nacional de Gestión de Riesgos (Sinager), confirmó este jueves 616 nuevos casos de Covid-19, sumando así un total de 109,760 contagios a nivel nacional. Además, se reportó la muerte de 8 pe",04-12-2020 01:34,https://www.bing.com/th?id=OVFT.Q-6-XmlAgbZ-fTPmrKyENS,Chile,Hondudiario
FUNDAHRSE realiza su primera ceremonia virtual para resaltar la labor de 67 empresas y un gremio socialmente responsable,http://www.eldiario.hn/fundahrse-realiza-su-primera-ceremonia-virtual-para-resaltar-la-labor-de-67-empresas-y-un-gremio-socialmente-responsable/,San Pedro Sula. -  La Responsabilidad Social Empresarial (RSE) se ha convertido en uno de los temas de mayor importancia en la gestión empresarial impactando positivamente en la sostenibilidad del neg,04-12-2020 02:21,https://www.bing.com/th?id=OVFT.X5udYNiITizGYf79117viS,Chile,El Diario
El periodista «Chico» Ferrera recibe alta médica y está ¡fuera de peligro!,https://tiempo.hn/chico-ferrera-alta-medica-covid-19-fuera-de-peligro/,"En una charla exclusiva, Diario Tiempo Digital confirmó que Francisco ""Chico"" Ferrera, recibió el alta médica tras ser internado por complicaciones causadas por COVID-19. SAN PEDRO SULA, HONDURAS. El",04-12-2020 02:36,https://www.bing.com/th?id=OVFT.DSee4DN4VPBnb778lqfqMS,Chile,Tiempo
