name,url,description,datePublished,imagen,pais,Fuente
Mario Mejía: “Esperaríamos que la población se cuide más y a su familia”,https://www.elheraldo.hn/pais/1402522-466/mario-mej%C3%ADa-esperar%C3%ADamos-que-la-poblaci%C3%B3n-se-cuide-m%C3%A1s-y-a-su,"TEGUCIGALPA, HONDURAS.- Un incremento en los casos positivos de covid-19 puede parar toda la reapertura económica o sus avances a otras fases, por lo que la expectativa es que la población evite los r",20-08-2020 21:05,https://www.bing.com/th?id=ON.E2E31E2864065687D6BCBD43DB9AECB2,Chile,El Heraldo
"Pablo Pírez: ""El objetivo que tenemos en Real España es uno solo y es ser campeón""",https://www.diez.hn/liganacionaldehonduras/1402690-498/pablo-pirez-deli-vargas-real-espana-ojetivo-ser-campeon-apertura-2020-emilson-soto,"El charrúa dice que tomó la decisión, junto a sus compatriotas, de no marcharse a su país durante la pandemia para adaptarse más al país y estar disponible al momento de iniciar los trabajos. ""No sé s",20-08-2020 21:24,https://www.bing.com/th?id=ON.9190E800B35B283513C80947411D8621,Chile,diez.hn
Educación no está de acuerdo con la promoción automática del año lectivo,http://www.elsoldehonduras.com/educacion/educacion-no-esta-de-acuerdo-con-la-promocion-automatica-del-ano-lectivo/,"El ministro de Educación, Arnaldo Bueso, expuso hoy que no están de acuerdo con la promoción automática del año lectivo ya que desde esta entidad se han establecido las estrategias para la evaluación",20-08-2020 21:39,https://www.bing.com/th?id=ON.02EE612CAC8405E7AB0EB5B6DBD8060B,Chile,El Sol de Honduras
CAPTAC-DR del Fondo Monetario Internacional brinda asistencia técnica a Aduanas Honduras en Auditoria Previa posterior al Despacho Aduanero,http://www.elsoldehonduras.com/nacionales/captac-dr-del-fondo-monetario-internacional-brinda-asistencia-tecnica-a-aduanas-honduras-en-auditoria-previa-posterior-al-despacho-aduanero/,"Expertos del Centro de Asistencia Técnica del Fondo Monetario Internacional para Centroamérica, Panamá y República Dominicana (CAPTAC-DR/FMI), brindan asistencia técnica a las áreas de Fiscalización,",20-08-2020 23:02,https://www.bing.com/th?id=ON.619AC8639F60C8680DE6542611D99F76,Chile,El Sol de Honduras
Honduras: Ocho decesos por COVID-19 reportan hospitales,https://www.latribuna.hn/2020/08/20/honduras-ocho-decesos-por-covid-19-reportan-hospitales/,"Cinco personas perdieron la batalla al COVID-19, de acuerdo a reporte de los centros asistenciales de Tegucigalpa, como Instituto Hondureño de Seguridad Social (IHSS), Hospital Escuela e Instituto Nac",21-08-2020 00:44,https://www.bing.com/th?id=ON.A5B62EFB79B4C546F6AAFE4BE266808C,Chile,La Tribuna
Honduras: Secretaría de Seguridad autoriza la circulación de personas los fines de semana,https://www.diez.hn/coronavirus/1402813-441/honduras-coronavirus-secretaria-seguridad-policia-nacional-covid-19,"La Secretaría de Seguridad ha confirmado que los días de circulación ahora irán corridos, tomando en cuenta sábados y domingos. Honduras ahora podrá circular los fines de semana luego que la Secretarí",21-08-2020 04:33,https://www.bing.com/th?id=ON.2B9C022B774E49FCCF7332F90C52B956,Chile,diez.hn
Israel inaugura oficina de cooperación en Honduras,https://www.proceso.hn/component/k2/38-politica-nacional/israel-inaugura-hoy-oficina-de-cooperacion-en-honduras.html,"Tegucigalpa - Con un acto virtual, Israel inauguró este jueves una Oficina de Cooperación en Honduras, en reciprocidad a la oficina con las mismas características que el gobierno hondureño instaló en",21-08-2020 04:37,https://www.bing.com/th?id=ON.3F3AC265FEDD9E0E825366AA4B294ECE,Chile,Proceso
El PMA abre corredor humanitario en Honduras para asistencia en Centroamérica,https://www.laprensa.hn/honduras/1402839-410/programa-mundial-alimentos-honduras-centroamerica-pandemia-crisis-sanitaria-covid-19,"El objetivo del corredor es facilitar el transbordo y el preposicionamiento por el PMA de productos alimenticios y no alimenticios. Tegucigalpa, Honduras. Honduras y el Programa Mundial de Alimentos (",21-08-2020 14:32,https://www.bing.com/th?id=ON.BF856A3566B5BECB1ED3D4E4FA1E836E,Chile,La Prensa Chicos
Sigue el bajo reporte de casos positivos de covid-19 en la capital,https://www.elheraldo.hn/tegucigalpa/1402775-466/sigue-el-bajo-reporte-de-casos-positivos-de-covid-19-en-la-capital,"TEGUCIGALPA, HONDURAS.-La baja de casos, catalogada por especialistas de la salud como “un aplanamiento artificial”, se mantiene desde el 8 de agosto en el Distrito Central. Y es que desde esa fecha,",21-08-2020 14:47,https://www.bing.com/th?id=ON.F62947FC6E529CEBAF8F6E16994782A4,Chile,El Heraldo
"Honduras crea estrategia para revertir cifras negativas en inversión, turismo y exportaciones",https://hondudiario.com/2020/08/20/honduras-crea-estrategia-para-revertir-cifras-negativas-en-inversion-turismo-y-exportaciones/,"El Consejo Nacional de Inversiones (CNI), Marca País Honduras, con el apoyo del Instituto Hondureño de Turismo (IHT), la Secretaría de Desarrollo Económico (SDE) y la Secretaría de Relaciones Exterior",21-08-2020 16:28,https://www.bing.com/th?id=ON.CDFB7C34DB22B785122B1A8668DA7C7F,Chile,Hondudiario
"Presidente de la ANEEAH en Tela, muere por COVID-19",https://www.latribuna.hn/2020/08/21/presidente-de-la-aneeah-en-tela-muere-por-covid-19/,"El presidente de la Asociación Nacional de Enfermeras y Enfermeros Auxiliares de Honduras (ANEEAH), en el Hospital Tela Integrado, murió en las últimas horas por COVID-19. Se trata de Juan Ángel Gueva",21-08-2020 17:40,https://www.bing.com/th?id=ON.EC370AB2129401CF2BEDC1101732F14B,Chile,La Tribuna
