name,url,description,datePublished,imagen,pais,Fuente
Ministerio Público tiene 11 líneas de investigación relacionadas con las compras de emergencia por covid-19,https://radiohrn.hn/honduras-invest-h-ministerio-publico-tiene-11-lineas-de-investigacion-relacionadas-con-las-compras-de-emergencia-por-covid-19/,Instalaciones del Ministerio Público en Tegucigalpa. Foto / El Tiempo (Honduras). La Fiscalía tiene abiertas 11 líneas de investigación que están relacionadas con todas las compras realizadas durante,15-07-2020 20:56,https://www.bing.com/th?id=ON.6BE9C1BF8DC68ED267698AF39612A8FF,Chile,Radio HRN
Coronavirus: 4 recomendaciones para superar la crisis económica expuestas por el sector empresarial,https://radiohrn.hn/coronavirus-4-recomendaciones-para-superar-la-crisis-economica-expuestas-por-el-sector-empresarial/,"Reactivación de la economía en medio de la pandemia. En el tema “El equilibro entre la salud, la economía y el empleo”, el presidente de la Federación de Cámaras de Comercio e Industrias de Honduras (",15-07-2020 23:54,https://www.bing.com/th?id=ON.78B120E6027792284DF5119C087342CE,Chile,Radio HRN
Muere por coronavirus otro reconocido doctor en San Pedro Sula,https://www.laprensa.hn/honduras/1394522-410/muere-coronavirus-doctor-adalberto-mej%C3%ADa-san-pedro-sula-,El gremio médico sigue siendo golpeado por la pandemia del coronavirus en Honduras con la muerte del doctor José Adalberto Mejía en el Instituto Hondureño del Seguro Social (IHSS) de San Pedro Sula. E,16-07-2020 00:00,https://www.bing.com/th?id=ON.AD5156C188A26EFF9C4435207519632A,Chile,La Prensa Chicos
La Covid-19 se expande en Honduras entre denuncias de corrupción con hospitales,https://www.laprensa.hn/honduras/1394488-410/covid19-expande-honduras-corrupcion-hospitales-pandemia,"El pico de la pandemia de Covid-19 en Honduras sigue creciendo, con decenas de muertos diarios y centenares de contagios, mientras que dos hospitales móviles cumplen una semana sin poder ser sacados d",16-07-2020 00:00,https://www.bing.com/th?id=ON.E1AA37AB6D69F0753BD55FE1F55E8937,Chile,La Prensa Chicos
Más de 8.800 pacientes con sospecha de covid-19 han sido atendidos en centros de triaje en menos de un mes,http://www.elsoldehonduras.com/salud/mas-de-8-800-pacientes-con-sospecha-de-covid-19-han-sido-atendidos-en-centros-de-triaje-en-menos-de-un-mes/,"En menos de un mes de operar, los centros de triaje de Tegucigalpa han atendido a más de 8.800 pacientes con sospecha de covid-19, entre ellos 240 en el Centro Cívico Gubernamental (CCG), que entró en",16-07-2020 00:44,https://www.bing.com/th?id=ON.20F2D657B89E329F837118710F1A7E3E,Chile,El Sol de Honduras
BID pone a Honduras como ejemplo por tener Observatorio de Precios,https://www.latribuna.hn/2020/07/15/bid-pone-a-honduras-como-ejemplo-por-tener-observatorio-de-precios/,"El Banco Interamericano de Desarrollo (BID) puso a Honduras como ejemplo de cómo garantizar la transparencia y la integridad de los procesos de adquisición de insumos durante la pandemia de COVID-19,",16-07-2020 07:01,https://www.bing.com/th?id=ON.C8187FDB49E31115455CCD230C29E130,Chile,La Tribuna
Aeropuertos de Honduras refuerza campaña contra el coronavirus,https://www.latribuna.hn/2020/07/16/aeropuertos-de-honduras-refuerza-campana-contra-el-coronavirus/,"Aeropuertos de Honduras informó que aumenta los esfuerzos para brindar mayor protección a los pasajeros y colaboradores del coronavirus (COVID-19), en los cuatro establecimientos en el país. “Una de l",16-07-2020 16:23,https://www.bing.com/th?id=ON.621EFD7748AD56768BBF3D20623244F3,Chile,La Tribuna
Honduras supera los 30 mil casos de Covid-19 en repunte de pruebas diarias,https://hondudiario.com/2020/07/15/honduras-supera-los-30-mil-casos-de-covid-19-en-repunte-de-pruebas-diarias/,"El Sistema Nacional de Gestión de Riesgos (Sinager), informó este miércoles que de 1,960 pruebas para diagnosticar Covid-19 en el país, 930 dieron positivo, sumando así un total de 30,036 casos de cor",16-07-2020 17:55,https://www.bing.com/th?id=ON.25764051C52A8FE147B97BD617912B16,Chile,Hondudiario
Facturas de hospitales móviles entregadas a Aduanas también tienen registros falsos,https://www.elheraldo.hn/especiales/coronavirus/1394401-528/facturas-hospitales-moviles-registros-falsos-invest,"Dos de las facturas, entregadas por la empresa de Axel López, fueron emitidas con el código comercial SDI-I0-20031606001, que en realidad pertenece a SDI Global En las facturas originales de los hospi",16-07-2020 19:31,https://www.bing.com/th?id=ON.9715C2DE23B0EE3F279A97F5A68AE61F,Chile,El Heraldo
930 nuevos contagios y los casos por covid-19 se elevan a 30.036 en Honduras,http://www.elsoldehonduras.com/nacionales/930-nuevos-contagios-y-los-casos-por-covid-19-se-elevan-a-30-036-en-honduras/,Tegucigalpa. El Sistema Nacional de Gestión de Riesgo (Sinager) reportó hoy 930 nuevos casos positivos de covid-19 para hacer un total de 30.036 contagiados en el país. En cadena nacional de radio y t,16-07-2020 19:57,https://www.bing.com/th?id=ON.20F2D657B89E329F837118710F1A7E3E,Chile,El Sol de Honduras
Tres futbolistas de la Sub-20 de Honduras dieron positivo de coronavirus durante los entrenos pilotos,https://www.diez.hn/laseleccion/1394473-498/tres-futbolistas-seleccion-sub-20-honduras-dieron-positivo-coronavirus,"Se veía venir. En medio de la pandemia del coronavirus, la Fenafut determinó hacer entrenamientos pilotos con la Sub-20 para buscar la reactivación del fútbol durante el mes de junio, pero durante esa",16-07-2020 21:15,https://www.bing.com/th?id=ON.54C7A2C8BD6BE4DA1B460FA9622F599C,Chile,diez.hn
“Palomo” Rodríguez no pudo salir del país,https://www.diariomas.hn/2020/07/16/palomo-rodriguez-no-pudo-salir-del-pais/,"El entrenador uruguayo del Honduras Progreso, Julio César “Palomo” Rodríguez, no pudo viajar a Houston, Estados Unidos, debido a que el vuelo humanitario aprobado fue cancelado a última hora por las a",16-07-2020 21:40,https://www.bing.com/th?id=ON.0CAEA2407BB2CE5BD97B8F527D7B9BE0,Chile,Mas
"Sin velorios, ni acompañamiento: el doloroso adiós a víctimas de covid-19 en Honduras",https://www.elheraldo.hn/inicio/1394493-465/honduras-coronavirus-cementerio-victima-adios-solitario-pandemia,"Llanto, dolor y consternación se vive a diario en el 'cementerio covid-19' en el Distrito Central, donde descansan los restos de los hondureños que no lograron vencer al mortal virus. Fotos: Alex Pére",16-07-2020 23:27,https://www.bing.com/th?id=ON.B083C056E7387DE28595B91F427E6E60,Chile,El Heraldo
"Tras más de 2 mil pruebas, Honduras suma 831 contagios para 30,867 casos en total",https://hondudiario.com/2020/07/16/tras-mas-de-2-mil-pruebas-honduras-suma-831-contagios-para-30867-casos-en-total/,"El Sistema Nacional de Gestión de Riesgos (Sinager), informó este jueves que de 2,044 pruebas para diagnosticar Covid-19 en el país, 831 dieron positivo, sumando así un total de 30,867 casos de corona",17-07-2020 03:11,https://www.bing.com/th?id=ON.BBB107D82ED7E906DEA12A937D5ED701,Chile,Hondudiario
