name,url,description,datePublished,imagen,pais,Fuente
Honduras reporta seis muertes más coronavirus y 657 nuevos casos,https://www.laprensa.hn/especiales/coronavirus/1418555-410/pandemia-coronavirus-contagios-muertes-covi-,"Gracias a Dios, Atlántida, Colón, Islas de la Bahía y Lempira no reportaron nuevos casos. Honduras reportó este martes 94,623 contagios por la covid-19 con 657 nuevos casos, mientras que los muertos y",27-10-2020 00:00,https://www.bing.com/th?id=OVFT.CZZRfZtSnnWUW29dn8uFCy,Chile,La Prensa Chicos
"Honduras registra 93,966 contagios y 2,633 muertes por covid-19",https://www.elheraldo.hn/pais/1418291-466/honduras-infectados-muertos-covid-19-sinager,"Honduras ya superó a China en contagios (85,800), país que logró contener el virus nueve meses después del inicio de la crisis",27-10-2020 02:22,https://www.bing.com/th?id=OVFT.aVuikKQaX6inJQm912IGDi,Chile,El Heraldo
"Ramón Carranza: ""Alcaldías deben rendir cuentas de la pandemia""",https://www.elheraldo.hn/pais/1418329-466/ram%C3%B3n-carranza-alcald%C3%ADas-deben-rendir-cuentas-de-la-pandemia,"TEGUCIGALPA, HONDURAS.-Las alcaldías deben rendir cuentas con informes detallados de los recursos que se les han dado durante la pandemia de covid-19 para continuar con las transferencias. Así lo declaró el viceministro de la Secretaría de Gobernación ...",27-10-2020 14:37,https://www.bing.com/th?id=OVFT.fFXU043yoBpw3j69cC7mxS,Chile,El Heraldo
Corteros de café deberán presentar pruebas COVID 19 y seguir estrictas medidas de bioseguridad,https://ultimahora.hn/corteros-de-cafe-deberan-presentar-pruebas-covid-19-y-seguir-estrictas-medidas-de-bioseguridad/,"Solo en Copán se necesitan  unos  25,000 corteros. Sin embargo las autoridades de Migración y de la aduana del Florido, han advertido que   persona que no presenten su pruebas de COVID 19  con",27-10-2020 16:19,https://www.bing.com/th?id=OVFT.MoVZ0doWJcAQgdBtUmLqZC,Chile,Ultima Hora
Muere por sospecha de COVID-19 otro médico en Siguatepeque.,https://www.latribuna.hn/2020/10/27/muere-por-sospecha-de-covid-19-otro-medico-en-siguatepeque/,"Hoy que se conmemora el día del médico hondureño se reportó la muerte por sospecha de COVID-19, de otro profesional de la medicina en la ciudad de Siguatepeque, zona central de Honduras. Se trata del",27-10-2020 19:40,https://www.bing.com/th?id=OVFT.aOMk8C3FlJ1BDLR6ANz4cC,Chile,La Tribuna
"Con más de dos mil pruebas procesadas, Honduras supera los 94 mil casos de COVID-19",https://proceso.hn/con-mas-de-dos-mil-pruebas-procesadas-honduras-supera-los-94-mil-casos-de-covid-19/,"Tegucigalpa – Honduras alcanzó este martes los 94 mil 623 contagiados y 2 mil 639 decesos por COVID-19, reportó el Sistema Nacional de Gestión de Riesgos (Sinager). – La tasa de letalidad del COVID-19 es del 2.8 por ciento. 2 mil 093 pruebas PCR ...",28-10-2020 02:15,https://www.bing.com/th?id=OVFT.7G6YeGAmhvd13VLTM5ZrmS,Chile,Proceso
"Honduras suma 2,639 muertes por Covid-19 y supera los 94 mil contagios",https://hondudiario.com/2020/10/27/honduras-suma-2639-muertes-por-covid-19-y-supera-los-94-mil-contagios/,"El Sistema Nacional de Gestión de Riesgos (Sinager), reportó este martes 657 nuevos casos de Covid-19 de 2,093 pruebas PCR procesadas, sumando así un total de 94,623 casos de coronavirus a nivel nacional. Además, se confirmó la muerte de 6 personas ...",28-10-2020 02:26,https://www.bing.com/th?id=OVFT.kkEYSbjj-wfcrX6Tq9RJ3S,Chile,Hondudiario
"94,623 casos positivos por covid, 2,639 fallecidos y 38,833 recuperados reporta Honduras",https://www.radiohrn.hn/94623-casos-positivos-por-covid-2639-fallecidos-y-38833-recuperados-reporta-honduras,"Honduras registra este martes (27.10.2020) un total de 94,623 casos positivos por covid-19 a nivel nacional. De los 94,623, permanecen activos (53,151), fallecidos 2,639 (6 nuevos), recuperados 38,833",28-10-2020 02:45,https://www.bing.com/th?id=OVFT.lUxpqL53I2Til75V_3y6py,Chile,Radio HRN
"Unas 50 irregularidades en gestión por pandemia en Honduras, expone Coalición Anticorrupción",https://www.radiohrn.hn/unas-50-irregularidades-en-gestion-por-pandemia-en-honduras-expone-coalicion-anticorrupcion,"El documento presenta de forma articulada, las denuncias, observaciones y recomendaciones de la ciudadanía organizada, sobre las compras y contrataciones",28-10-2020 03:00,https://www.bing.com/th?id=OVFT.SsXc3ZBm_rsfV6q_9tSUvC,Chile,Radio HRN
Sinager registra 657 nuevos casos de COVID-19,https://www.latribuna.hn/2020/10/27/sinager-registra-657-nuevos-casos-de-covid-19/,"con estos nuevos casos la cifra total es de 94,623 casos confirmados de COVID-19 en Honduras. Asimismo, el Laboratorio Nacional de Virología de la Secretaría de Salud, confirma el deceso de 6 personas a causa del mortal virus, sumando un total de 2,639 ...",28-10-2020 03:11,https://www.bing.com/th?id=OVFT.Y8C3ti3G2e8uUwbfcJFG7y,Chile,La Tribuna
"Honduras llega a 94,623 casos de covid-19",https://ultimahora.hn/honduras-llega-a-94623-casos-de-covid-19/,"El Sistema Nacional de Gestión de Riesgos (Sinager) reportó este martes (27.10.2020) que se contabilizan 94,623 infecciones por covid-19 en Honduras. Los nuevos casos se han confirmado como",28-10-2020 04:19,https://www.bing.com/th?id=OVFT.UJ6xxOPApGBf7EYEd0e-li,Chile,Ultima Hora
