name,url,description,datePublished,imagen,pais,Fuente
"Vacunas contra Covid-19: Honduras solo recibirá gratis el 20 %, dice Batres",https://tiempo.hn/vacunas-contra-covid-19-gratis-20/,Honduras es parte de Covax-alianza Gavi. TEGUCIGALPA. “Honduras recibirá gratis solo el 20 por ciento de vacunas contra COVID-19 y el Gobierno y el Instituto Hondureño de Seguridad Social (IHSS) deber,07-12-2020 13:09,https://www.bing.com/th?id=OVFT.aB8URuI7Suc5UfA14KGTgC,Chile,Tiempo
"La población perdió por completo el miedo al covid, dice neumóloga del Hospital El Tórax",https://www.radiohrn.hn/la-poblacion-perdio-por-completo-el-miedo-al-covid-dice-neumologa-del-hospital-el-torax,"La neumóloga del Instituto Nacional Cardiopulmonar, conocido como El Tórax, Suyapa Sosa, afirmó el lunes (7.12.2020) que la población perdió por completo el miedo al covid, ya que entró en franca inco",07-12-2020 16:12,https://www.bing.com/th?id=OVFT.0pIDrFiC028fl-XAP9a7Ai,Chile,Radio HRN
Colapsado el ingreso de pacientes por COVID-19 en el Hospital El Tórax,https://www.latribuna.hn/2020/12/07/colapsado-el-ingreso-de-pacientes-por-covid-19-en-el-hospital-el-torax/,"La titular del Servicio de Neumología del Instituto Nacional Cardiopulmonar de Honduras, Suyapa Sosa, informó que este centro hospitalario se encuentra colapsado por el ingreso de varios pacientes por",07-12-2020 17:12,https://www.bing.com/th?id=OVFT.Sma64IIUgy6DaVVpE2Q-Fi,Chile,La Tribuna
Misión israelí recomienda crear plataforma para detección temprana de enfermedades por secuelas de pandemia y tormentas,http://www.eldiario.hn/mision-israeli-recomienda-crear-plataforma-para-deteccion-temprana-de-enfermedades-por-secuelas-de-pandemia-y-tormentas/,San Pedro Sula. - La misión de expertos israelíes que está en Honduras resaltó este lunes las acciones que el Gobierno ha realizado para tender la triple crisis que vive el país y sugirió a la Secreta,07-12-2020 23:23,https://www.bing.com/th?id=OVFT.xMPqVRuPJQNOAuASwG0SwS,Chile,El Diario
"Gobierno de Honduras no descarta restringir actividad económica, ante ascenso de contagios por covid-19",https://www.laprensa.hn/honduras/1427823-410/gobierno-honduras-no-descarta-volver-restringuir-actividad-economica-aumento-casos-coronavirus,"Tegucigalpa, Honduras. Ebal Díaz, ministro de la presidencia dijo este lunes que el Gobierno no descarta la posibilidad de volver a restriguir la actividad economica en todo el t",07-12-2020 23:41,https://www.bing.com/th?id=OVFT.4qRPeAKqq9dxLtfmiBdHqS,Chile,La Prensa Chicos
HONDURAS / UN MES SIN CONFINAMIENTO: HOSPITALES COLAPSAN Y CADA 3 HORAS UN MUERTO,http://www.web.ellibertador.hn/index.php/noticias/nacionales/2495-honduras-un-mes-sin-confinamiento-hospitales-colapsan-y-cada-3-horas-un-muerto,"Anoche, se confirmó que en Honduras hay 111,023 casos positivos de Covid-19, de ellos 2,946 no lograron recuperarse y han perdido la vida, unos 49,456 se curaron pero siguen en riesgo de volver a infe",08-12-2020 01:12,https://www.bing.com/th?id=OVFT.fZ9JVXX72nUhlMD78PR3Ji,Chile,El Libertador
"Hasta en octubre de 2021, Estados Unidos extendió el TPS para los hondureños",https://www.radiohrn.hn/hasta-en-octubre-de-2021-estados-unidos-extendio-el-tps-para-los-hondurenos,"Cabe mencionar, que el 4 de enero del 2021 vencía los permisos de trabajo de los beneficiarios del TPS. Más de 40 mil hondureños se acogen al actual TPS, quienes están protegi",08-12-2020 01:58,https://www.bing.com/th?id=OVFT.v6Sz6IYTs5axrHXjscgGgC,Chile,Radio HRN
La COVID-19 deja 684 nuevos casos y 4 muertes más en Honduras,https://proceso.hn/la-covid-19-deja-684-nuevos-casos-y-4-muertes-mas-en-honduras/,"Tegucigalpa – Honduras reportó este lunes 684 nuevos casos por el coronavirus SARS-CoV-2, por lo que los positivos totalizan 111 mil 707, mientras que las 4 muertes en las últimas 24 horas eleva las v",08-12-2020 04:49,https://www.bing.com/th?id=OVFT.XtPhiLgBDpxkh7SVGC1rwi,Chile,Proceso
Covid-19 y emergencia climática duro golpe a la Educación,https://proceso.hn/covid-19-y-emergencia-climatica-duro-golpe-a-la-educacion/,"– Colón, Yoro y Atlántida, los tres departamentos más golpeados. La deserción escolar, según los expertos, alcanzó un récord histórico en el país, y al analizar las perspectivas futuras no dudan en af",08-12-2020 05:33,https://www.bing.com/th?id=OVFT.HTSR8Un5zee_pMRU0ubBvS,Chile,Proceso
Visión Mundial: Queremos sumarnos a la reconstrucción educativa del país,https://www.latribuna.hn/2020/12/08/vision-mundial-queremos-sumarnos-a-la-reconstruccion-educativa-del-pais/,"La gerente de Programas Técnicos y Habilidades de Visión Mundial Honduras, Inés Martínez, dijo que queremos sumarnos a la reconstrucción educativa del país y al proceso de respuesta impulsado por el g",08-12-2020 12:33,https://www.bing.com/th?id=OVFT.I9STDeDomMjFBt7ie61bgi,Chile,La Tribuna
COVID-19 Honduras: SINAGER confirma 684 nuevos casos y cuatro fallecidos,https://tiempo.hn/covid-19-684-nuevos-casos-honduras/,"De 1,889 pruebas para diagnosticar COVID-19 que procesó el LNV, 684 resultaron positivas, el total de casos en Honduras incrementó a 111,707. TEGUCIGALPA, HONDURAS. De 1,889 nuevas pruebas para diagno",08-12-2020 13:11,https://www.bing.com/th?id=OVFT.HCrIl3DcAiV9sB2YqIpWJS,Chile,Tiempo
Gobierno recibe donativo del Fondo Conjunto de Cooperación Chile- México,https://ultimahora.hn/gobierno-recibe-donativo-del-fondo-conjunto-de-cooperacion-chile-mexico/,"En apoyo a la emergencia sanitaria nacional por la pandemia de la covid-19 en Honduras, los gobiernos de Chile y México, a través de sus embajadas, entregaron una donación de insumos de",08-12-2020 13:32,https://www.bing.com/th?id=OVFT.JtfxoeacR4mTkSwQalFzfS,Chile,Ultima Hora
Honduras suma 684 nuevos casos y 4 muertes más por Covid-19,https://hondudiario.com/2020/12/08/honduras-suma-684-nuevos-casos-y-4-muertes-mas-por-covid-19/,"***Además, se reportó la muerte de 4 personas por coronavirus, elevando a 2,950 las víctimas por la enfermedad. El Sistema Nacional de Gestión de Riesgos (Sinager), confirmó el lunes 684 nuevos casos",08-12-2020 14:55,https://www.bing.com/th?id=OVFT.WTDo3LP62JnOIHxM8UChQy,Chile,Hondudiario
Ebal Díaz; “al menos 30 diputados de la oposición votaron en contra de que hondureños reciban gratis vacuna Covid-19”,https://ultimahora.hn/ebal-diaz-al-menos-30-diputados-de-la-oposicion-votaron-en-contra-de-que-hondurenos-reciban-gratis-vacuna-covid-19/,"El ministro de la Presidencia, Ebal Díaz, lamentó que un grupo de diputados haya votado en contra de la Ley de Vacuna Gratis para Todos contra el Covid-19, que beneficiará con el suministro de ese",08-12-2020 15:15,https://www.bing.com/th?id=OVFT.E_XM13JRlnnJiux-q5t8xC,Chile,Ultima Hora
En un 40% se mantiene la ocupación hospitalaria por Covid-19 en Honduras,https://hondudiario.com/2020/12/08/en-un-40-se-mantiene-la-ocupacion-hospitalaria-por-covid-19-en-honduras/,"***De ese modo, la funcionaria apuntó que ese nosocomio capitalino cuenta con 30 camas adicionales para pacientes que pueden ser atendidos en el área de cuidados intermedios. La ministra de la Secreta",08-12-2020 15:24,https://www.bing.com/th?id=OVFT.K9RtkmiRxZwWvdrQhl_Vjy,Chile,Hondudiario
"Honduras llega a 2,950 muertos por Covid-19 y 111,707 contagios",https://www.laprensa.hn/honduras/1427931-410/honduras-muertos-covid-contagios-recuperados,"El número de muertos en Honduras por covid-19 se elevó ayer a 2.950 y los contagios a 111.707, según el informe diario del estatal Sistema Nacional de Gestión de Riesgos (Sinager). El organismo sanita",08-12-2020 15:28,https://www.bing.com/th?id=OVFT.h5E_rkgin-9ZHBOlU0G6Si,Chile,La Prensa Chicos
