name,url,description,datePublished,imagen,pais,Fuente
Contagios de Covid-19 aumentan por no respetar medidas de bioseguridad: viceministro de Salud,https://hondudiario.com/2020/12/10/contagios-de-covid-19-aumentan-por-no-respetar-medidas-de-bioseguridad-viceministro-de-salud/,"Este miércoles el viceministro de Salud, Roberto Cosenza, señaló que el aumento en los contagios por la Covid-19 han aumentado debido a la actitud indiferente de los ciudadanos que no respetan las med",10-12-2020 14:06,https://www.bing.com/th?id=OVFT._fB4n03vTgWfdz-mGQ-kEi,Chile,Hondudiario
"Honduras suma 112,792 casos de coronavirus y 2,961 muertos en casi nueve meses",https://www.laprensa.hn/honduras/1428472-410/honduras-casos-coronavirus-muertos-recuperados-pruebas-covid-19,"De 1,811 nuevas pruebas PCR de laboratorio procesadas, 617 dieron positivo, con las que los casos se elevaron a 112,792, indicó el Sistema Nacional de Gestión de Riesgos (Sinager)",10-12-2020 15:08,https://www.bing.com/th?id=OVFT.HO8Vw2WOE7ZGAF4IoBiVSi,Chile,La Prensa Chicos
"Choco Lozano tras superar el covid-19: ""En este momento no se deberían hacer esos amistosos""",https://www.diez.hn/legionarios/1428584-498/choco-lozano-covid-amistosos-seleccion-honduras-cadiz-barcelona-cervera-negredo,"El delantero hondureño del Cádiz, Antony 'Choco' Lozano, contó la pesadilla que vivió tras dar positivo por covid-19 en la Selección de Honduras.",10-12-2020 21:12,https://www.bing.com/th?id=OVFT.58HSeDtbiyeIfWjAWv8sRi,Chile,diez.hn
"Honduras contabiliza 113,207 contagios y 2,968 por coronavirus",https://hondudiario.com/2020/12/10/honduras-contabiliza-113207-contagios-y-2968-por-coronavirus/,"El Sistema Nacional de Gestión de Riesgos (Sinager), confirmó este jueves 415 nuevos casos de Covid-19 de 1,703 pruebas procesadas por el Laboratorio Nacional de Virología, sumando así un total de 113",11-12-2020 03:03,https://www.bing.com/th?id=OVFT.NPOPuEZeEsMaF9q4yrOuJC,Chile,Hondudiario
"Honduras supera la cifra de 113,000 infectados por covid",https://www.radiohrn.hn/honduras-supera-la-cifra-de-113000-infectados-por-covid,"Honduras reporta una tasa de letalidad de 2.62% El Sistema Nacional de Gestión de Riesgos ( Sinager), registró este jueves (10.12.2020) un total de de 113,207 casos de covid-19 a nivel nacional. Según",11-12-2020 03:05,https://www.bing.com/th?id=OVFT.e22SQZs4CQShf-BR92TrfS,Chile,Radio HRN
COVID-19 en Honduras: SINAGER confirma 415 nuevos casos y siete muertes,https://tiempo.hn/covid-19-honduras-415-nuevos-casos-siete-muertes/,"TEGUCIGALPA, HONDURAS. De 1,703 nuevas pruebas para diagnosticar COVID-19 que procesó el Laboratorio Nacional de Virología (LNV), de la Secretaría de Salud (SESAL), 415 resulta",11-12-2020 03:45,https://www.bing.com/th?id=OVFT.H7_rV4wJfXyBKEynQobZJy,Chile,Tiempo
Presidente Hernández destaca apoyo del BCIE para atención de pandemia y desastres por huracanes Eta y Iota,https://ultimahora.hn/presidente-hernandez-destaca-apoyo-del-bcie-para-atencion-de-pandemia-y-desastres-por-huracanes-eta-y-iota/,"En la celebración del 60 aniversario del Banco Centroamericano de Integración Económica (BCIE), el presidente Juan Orlando Hernández destacó este jueves el aporte valioso de esta institución",11-12-2020 14:15,https://www.bing.com/th?id=OVFT.hST8teL0URjUHukXhzqTdC,Chile,Ultima Hora
"Médicos que luchan contra COVID en Honduras urgen vacaciones, según Colegio de Microbiólogos",https://proceso.hn/medicos-que-luchan-contra-covid-en-honduras-urgen-vacaciones-segun-colegio-de-microbiologos/,"Tegucigalpa – El personal médico que durante varios meses se ha mantenido en primera línea en la lucha contra la COVID-19 en Honduras urge de vacaciones, demandó este viernes el presidente del Colegio",11-12-2020 14:41,https://www.bing.com/th?id=OVFT.dwT2RA8z0v-N4Db3gPtdzC,Chile,Proceso
Honduras cumple 9 meses de pandemia sin llegar a meseta y con rebrote a la vista,https://proceso.hn/honduras-cumple-11-meses-de-pandemia-sin-llegar-a-meseta-y-con-rebrote-a-la-vista/,"– Durante los 9 meses de pandemia, Honduras no ha logrado aplicar el número óptimo de 3 mil pruebas diarias para diagnosticar la nueva enfermedad del coronavirus. “Desgraciadamente las cosas que inici",11-12-2020 19:16,https://www.bing.com/th?id=OVFT.5BEfmlr685IwjmIZLjoLlS,Chile,Proceso
Club Ecuestre La Herradura anuncia “Copa Navideña BAC”,https://www.diariomas.hn/2020/12/10/federacion-de-ecuestre-anuncia-copa-navidena-bac/,"La federación de Ecuestre de Honduras tiene su última prueba del 2020 de salto en el establo La Herradura, carretera a Valle de Ángeles, donde se",11-12-2020 19:38,https://www.bing.com/th?id=OVFT.6NV3yXOo63s-55aBoSNiQy,Chile,Mas
Honduras cumple nueve meses de pandemia sin un horizonte claro,https://www.laprensa.hn/honduras/1428772-410/honduras-cumple-nueve-meses-pandemia-horizonte-claro-,"El 11 de marzo, Honduras anunció los primeros dos casos de covid-19 en el país, en dos mujeres hondureñas que ingresaron por Tegucigalpa y San Pedro Sula, procedentes de España y Suiza.",11-12-2020 20:27,https://www.bing.com/th?id=OVFT.Km0DTfFn9wmRT1MPYk7OVS,Chile,La Prensa Chicos
Rey Felipe VI reitera apoyo a Honduras en llamada al presidente Hernández,https://www.latribuna.hn/2020/12/11/rey-felipe-vi-reitera-apoyo-a-honduras-en-llamada-al-presidente-hernandez/,"El presidente de Honduras, Juan Orlando Hernández, informó este viernes que sostuvo una llamada con el rey de España Felipe VI, quien le demostró su deseo de apoyar a Honduras, tras los desastres caus",11-12-2020 20:28,https://www.bing.com/th?id=OVFT.8JyDlwjVhcriUNbqcs2I4S,Chile,La Tribuna
HONDURAS / ¡CAMBIOS YA! MÁS INDIGENCIA Y CRIMEN MUEVEN NUEVA CARAVANA,http://www.web.ellibertador.hn/index.php/noticias/nacionales/2505-honduras-cambios-ya-mas-indigencia-y-crimen-mueven-nueva-caravana,"Sólo quieren empleo para subsistir y ayudar a sus seres queridos que dejan en terrible pobreza en Honduras, otras familias se fueron completas en la nutrida caravana que salió anteayer de San Pedro Su",11-12-2020 20:35,https://www.bing.com/th?id=OVFT.TehZYr1Ei9mgpDrxzM7vli,Chile,El Libertador
HONDURAS / “DIPUTADO LORA” CREA SOSPECHA CON VOTACIÓN DOBLE,http://www.web.ellibertador.hn/index.php/noticias/nacionales/2507-honduras-diputado-lora-crea-sospecha-con-votacion-doble,"El diputado nacionalista, Mario Pérez (foto), presentó una moción para que los hondureños puedan votar en dos lugares distintos en la próxima contienda electoral, dando cabida al fraude de votos, aleg",11-12-2020 22:54,https://www.bing.com/th?id=OVFT.qSVNvoUwamXuEqokTsgVaC,Chile,El Libertador
Jorge Hernández brilla en campeonato virtuales de halterofilia,https://www.diariomas.hn/2020/12/11/jorge-hernandez-brilla-en-campeonato-virtuales-de-halterofilia/,"El deporte hondureño está de fiesta con el gane del atleta de levantamiento de pesas Jorge Hernández, quien se agenció los primeros lugares en",11-12-2020 23:04,https://www.bing.com/th?id=OVFT.nPDsYpSnhEAtAilwV5o2vS,Chile,Mas
Cecilia Rossell es Miss Honduras Universo 2020,http://www.eldiario.hn/cecilia-rossell-es-miss-honduras-universo-2020/,San Pedro Sula. - Aunque la noticia corrió como pólvora desde el miércoles pasado la organización Carimax oficializó anoche que Cecilia Rossell es la nueva representante de Honduras ante el Miss Unive,12-12-2020 01:16,https://www.bing.com/th?id=OVFT.nUDbF_G6Lu9hF_zUnvPAvi,Chile,El Diario
El mundo está pagando un alto precio tras alivio de medidas contra covid-19,https://www.elheraldo.hn/fotogalerias/1428814-468/el-mundo-est%C3%A1-pagando-un-alto-precio-tras-alivio-de-medidas-contra,"Conoce a Cecilia Rossell, la nueva Miss Honduras Universo 2020",12-12-2020 01:23,https://www.bing.com/th?id=OVFT.e8aRhr0dAMy9-7VREhMbzy,Chile,El Heraldo
"Nueve meses con COVID en Honduras: cifras en alza, déficit de pruebas y posible rebrote",https://tiempo.hn/nueve-meses-covid-19-en-honduras-cifras-deficit-posible-rebrote/,"Hoy se cumplen nueve meses, desde que las autoridades confirmaron los dos primeros casos positivos a la COVID-19 en Honduras.",12-12-2020 02:05,https://www.bing.com/th?id=OVFT.mQYLjChvQohACBQ3dQ44QC,Chile,Tiempo
Unión Europea y PNUD lanzan proyecto de apoyo electoral,https://www.latribuna.hn/2020/12/11/union-europea-y-pnud-lanzan-proyecto-de-apoyo-electoral/,La Unión Europea y el Programa de las Naciones Unidas para el Desarrollo (PNUD) lanzan el proyecto de “Apoyo al Ciclo Electoral en Honduras para Elecciones Transparentes y Pacíficas 2020-2022”. Durant,12-12-2020 02:32,https://www.bing.com/th?id=OVFT.sOBbahZS_EPDNcqZwXLA8y,Chile,La Tribuna
