name,url,description,datePublished,imagen,pais,Fuente
Decenas de familiares reciben con alegría a hondureños que estaban varados en España,https://www.laprensa.hn/honduras/1381438-410/hondurenos-coronavirus-covid-aeropuerto-ramon-villeda-morales-espana-honduras-crisis-sanitaria,"Esta tarde retornaron 334 hondureños en un vuelo chárter al aeropuerto Ramón Villeda Morales de San Pedro Sula durante la emergencia por COVID-19. San Pedro Sula, Honduras. Este día llegaron 334 hondu",21-05-2020 00:00,https://www.bing.com/th?id=ON.C8D35A913293B37B59073AFF5722BDD7,Chile,La Prensa Chicos
"En 22 días, Honduras duplicó municipios con casos de Covid-19",https://www.elheraldo.hn/pais/1382019-466/en-22-dias-honduras-duplico-municipios-con-casos-de-covid-19,"TEGUCIGALPA, HONDURAS.- La aceleración de la pandemia de ﻿Covid-19 en Honduras eleva cada día más la curva de personas infectadas. Este comportamiento exponencial del virus hizo que en 22 días el país",25-05-2020 19:00,https://www.bing.com/th?id=ON.C9C0DE2B0086455EF4C5537999A36EAF,Chile,El Heraldo
"Cámara del Libro hondureña pide reabrir en un país ""alérgico"" a la lectura",https://www.laprensa.hn/honduras/1382125-410/covid-19-lectura-libro-en-honduras-camara-del-libro-hondureno,"Hay universitarios que leen más por la exigencia de un maestro. Tegucigalpa, Honduras. La emergencia que vive Honduras a causa del COVID-19 tiene literalmente prisioneros a los libros, por lo que el s",25-05-2020 21:11,https://www.bing.com/th?id=ON.D1EAC7E320954406B78729B88B6AED44,Chile,La Prensa Chicos
Seis reclusas son asesinadas por otras internas en cárcel femenina de Támara,http://www.eldiario.hn/seis-reclusas-son-asesinadas-por-otras-internas-en-carcel-femenina-de-tamara/,"TEGUCIGALPA.- Seis mujeres murieron a manos de otras internas en una cárcel femenina en Honduras, informó este domingo el Instituto Nacional Penitenciario (INP). En un comunicado, el INP relató que en",25-05-2020 22:48,https://www.bing.com/th?id=ON.2EE066D950825FBF309A0A79A97A8C6F,Chile,El Diario
La Selección de Honduras no volverá a competir en lo que resta del 2020 debido al coronavirus,https://www.diez.hn/laseleccion/1382190-498/seleccion-de-honduras-no-volvera-a-competir-2020-coronavirus-concacaf-asamblea,"La Selección de fútbol de Honduras en todas sus categorías no volverá a competir en lo que resta del 2020, pues el cierre de fronteras para los viajes debido al coronavirus, conjunto con la inactivida",25-05-2020 23:59,https://www.bing.com/th?id=ON.E7D2438646DCB93CF314CCF58B55F0E6,Chile,diez.hn
Honduras reportó este lunes 239 casos de COVID-19 y supera los cuatro mil contagiados,https://www.diez.hn/coronavirus/1382215-441/honduras-reporto-este-lunes-239-casos-de-covid-19-superan-cuatro-mil-infectados,"Las autoridades de Sinager informaron que la mayoría de casos han sido del departamento de Cortés que sólo este lunes reportó 137 infectados Honduras supera la barrera de los 4,000 infectados de coron",26-05-2020 01:15,https://www.bing.com/th?id=ON.E82EB6C2ADC920CCE7A01E6FFA7D96DE,Chile,diez.hn
Todas las religiones se unen para orar por Honduras,https://www.latribuna.hn/2020/05/26/todas-las-religiones-se-unen-para-orar-por-honduras/,"Representantes de todas las religiones se unieron en la jornada de oración “Todos a Orar por Honduras”, en la que pidieron a Dios que el país salga adelante y supere la pandemia de COVID-19, y elevaro",26-05-2020 06:20,https://www.bing.com/th?id=ON.D2843D1106633CF3733C2E6D0328925F,Chile,La Tribuna
Maquiladores entregan ocho millones de mascarillas al gobierno,https://www.latribuna.hn/2020/05/26/maquiladores-entrengan-ocho-millones-de-mascarillas-al-gobierno/,"Considerando el uso de la mascarilla como una medida de prevención ante el COVID-19, el gobierno de la República en Honduras solicitó al sector textil maquilador la elaboración de nueve millones de ma",26-05-2020 09:29,https://www.bing.com/th?id=ON.7023A58CA77E1D9D1333492D7424072D,Chile,La Tribuna
Los medios deben acelerar los cambios y adaptarse a la realidad de “bajo contacto”: Jorge Canahuati,https://proceso.hn/portadas/10-portada/los-medios-deben-acelerar-los-cambios-y-adaptarse-a-la-realidad-de-bajo-contacto-jorge-canahuati.html,"San Pedro Sula/Tegucigalpa - El impacto del COVID-19 en el futuro de los medios de comunicación convencionales ya es notable, los medios de comunicación serán de los más afectados en esta crisis, dijo",26-05-2020 09:47,https://www.bing.com/th?id=ON.F3B72923018DA7F1C3653E4BE50F6CBA,Chile,Proceso
Covid-19 los arrastró a ser nuevos mendigos en Honduras,https://www.elheraldo.hn/pais/1382259-466/covid-19-los-arrastr%C3%B3-a-ser-nuevos-mendigos-en-honduras,"TEGUCIGALPA, HONDURAS.-“Solo huevo, huevo y huevo. Quiero arroz y frijoles”, clama la pequeña Abigaíl (8). La exigencia de la niña cala profundamente en su mamá, Sara Amador, una vendedora de tortilla",26-05-2020 14:49,https://www.bing.com/th?id=ON.88F6625B13555202B9363E5162F9622C,Chile,El Heraldo
"Covid-19 no da tregua en Honduras; los contagios suman 4,189 y 182 decesos",https://hondudiario.com/2020/05/25/covid-19-no-da-tregua-en-honduras-los-contagios-suman-4189-y-182-decesos/,"El Sistema Nacional de Gestión de Riesgos (Sinager), confirmó 239 nuevos casos de Covid-19 en Honduras para un total de 4,189 contagios; así como 2 decesos más, ascendiendo a 182 los decesos en el paí",26-05-2020 14:55,https://www.bing.com/th?id=ON.E07B2685D124200990755F273CABA046,Chile,Hondudiario
OMS suspende ensayos clínicos de hidroxicloroquina,https://notibomba.com/oms-suspende-ensayos-clinicos-de-hidroxicloroquina/,"La Organización Mundial para la Salud (OMS) anunció la suspensión temporal de los ensayos clínicos con hidroxicloroquina, medicamento que era impulsado por el presidente de Estados Unidos (EEUU), Dona",26-05-2020 15:14,https://www.bing.com/th?id=ON.E26B36B83AD3979828A4B4A75880EDA7,Chile,Noti Bomba
Al menos 54 enfermeras y enfermeros han dado positivo para Covid-19: ANEAH,https://hondudiario.com/2020/05/26/al-menos-54-enfermeras-y-enfermeros-han-dado-positivo-para-covid-19-aneah/,"El presidente de la Asociación Nacional de Enfermeras y Enfermeros Auxiliares de Honduras (ANEAH), Josué Orellana, dijo que 54 de sus agremiados han dado positivos de Covid-19. “Continuamos con un núm",26-05-2020 15:28,https://www.bing.com/th?id=ON.8C359425CEAF066E4303E712ACFFDA56,Chile,Hondudiario
