name,url,description,datePublished,imagen,pais,Fuente
Honduras suma 602 nuevos contagios y 11 muertes más por COVID-19,https://hondudiario.com/2020/08/22/honduras-suma-602-nuevos-contagios-y-11-nuevas-muertes-de-covid-19/,"El Sistema Nacional de Gestión de Riesgos (Sinager), confirmó 602 casos nuevos de COVID-19 este sábado, de 1,378 pruebas procesadas, para un total de contagios en todo el país. De igual forma, reportó",23-08-2020 03:05,https://www.bing.com/th?id=OVFT.CMvQYJZp9ie421QAu7l6US,Chile,Hondudiario
Cardenal Rodríguez: Jesús está en Honduras aun en medio del COVID-19,https://www.latribuna.hn/2020/08/23/cardenal-rodriguez-jesus-esta-en-honduras-aun-en-medio-del-covid-19/,"Bajo medidas de bioseguridad, el Cardenal Óscar Andrés Rodríguez, durante la homilía dominical correspondiente al XXI del tiempo ordinario, celebrada en la Basílica Menor de Suyapa, expresó hoy que el",23-08-2020 19:48,https://www.bing.com/th?id=OVFT.gu2OAqkuczXEpPbr88VQlS,Chile,La Tribuna
"Inauguran policlínico y centro de triaje en Talanga, Francisco Morazán",https://www.laprensa.hn/especiales/coronavirus/1403289-410/inauguran-policlinico-centro-triaje-talanga-francisco-morazan-coronavirus,"De manera virtual se inauguró el policlínico de Talanga, el cual se acondicionó como centro de triaje y también dará servicio a otros municipios del norte del departamento de Francisco Morazán ante la",23-08-2020 19:57,https://www.bing.com/th?id=OVFT.uQJODNiCIEkrk2EGaNlcei,Chile,La Prensa Chicos
Honduras reportó 528 nuevos casos y 11 fallecidos por Coronavirus en las últimas 24 horas,https://www.diez.hn/coronavirus/1403405-441/honduras-reporto-528-nuevos-casos-11-fallecidos-por-coronavirus,"El coronavirus sigue cobrando la vida de muchos hondureños. Este domingo las autoridades de Sinager reportaron 11 nuevos fallecidos y 528 contagiados en las últimas 24 horas tras realizar 1,308 prueba",24-08-2020 02:32,https://www.bing.com/th?id=OVFT.K1coy5_vB6rnVhTvJhZPHy,Chile,diez.hn
El doctor Pablo Ulloa luchó contra el covid-19 y se fue amando su profesión,https://www.elheraldo.hn/pais/1403412-466/honduras-muertes-salud-doctor-covid,"TEGUCIGALPA, HONDURAS.-Eligió la profesión de la medicina con el anhelo de servir a los demás, desde pequeño lo imaginó y al cumplir 25 años lo hizo realidad. Pablo Enrrique Ulloa Cáceres falleció la",24-08-2020 14:24,https://www.bing.com/th?id=OVFT.ugwTHi31MsQ8paLZSoxC6i,Chile,El Heraldo
Extienden alerta roja por la pandemia hasta el 6 de septiembre en toda Honduras,https://www.laprensa.hn/honduras/1403467-410/ampliacion-alerta-roja-pandemia-coronavirus-seis-septiembre-honduras,"El Sistema Nacional de Gestión de Riesgo (Sinager) extendió la alerta roja por la pandemia de COVID-19 hasta el domingo 6 de septiembre próximo a nivel nacional. Carlos Flores, de Copeco El viceminist",24-08-2020 14:59,https://www.bing.com/th?id=OVFT.y3tiXlYWzGWL5OiOFZ-vkC,Chile,La Prensa Chicos
Gremio médico de luto en Honduras; estos son los nombres de los más de 40 héroes que han muerto por covid,https://www.radiohrn.hn/gremio-medico-de-luto-en-honduras-estos-son-los-nombres-de-los-mas-de-40-heroes-que-han-muerto-por-covid,"La mayoría de los fallecidos a causa del mortal virus se registra en los departamentos de Francisco Morazán y Cortés. Desde el inicio de la pandemia por covid-19, Honduras registra la muerte de unos 4",24-08-2020 15:16,https://www.bing.com/th?id=OVFT.qVt0pTKnqiCM5tfmVa6qdy,Chile,Radio HRN
Severos daños a viviendas y derrumbes dejan lluvias en la capital,https://www.elheraldo.hn/tegucigalpa/1403454-466/lluvias-tegucigalpa-derrumbes,"TEGUCIGALPA, HONDURAS.-Varias colonias y barrios capitalinos sufrieron los estragos de las fuertes lluvias que azotaron el Distrito Central durante el fin de semana. El pasado sábado el Cuerpo de Bomb",24-08-2020 15:27,https://www.bing.com/th?id=OVFT.KC_PgOpaRMjwHS4UgPLP6i,Chile,El Heraldo
"El Presidente Hernández recorrió el triaje de Gracias, Lempira",http://www.elsoldehonduras.com/nacionales/el-presidente-hernandez-recorrio-el-triaje-de-gracias-lempira/,"El presidente Juan Orlando Hernández recorrió hoy el triaje de Gracias, Lempira,, ubicado en la Casa de la Cultura, y con el que se pretende evitar la propagación del coronavirus, y por ende la satura",24-08-2020 15:42,https://www.bing.com/th?id=OVFT.0djsTLPFIpFSbWN4rmx3Bi,Chile,El Sol de Honduras
"Fusina ha capturado más de 5,000 personas durante la pandemia",https://hondudiario.com/2020/08/24/fusina-ha-capturado-mas-de-5000-personas-durante-la-pandemia/,"El vocero de las Fuerzas Armadas de Honduras (FFAA), teniente José Coello, informó que la Fuerza de Seguridad Interinstitucional Nacional (Fusina) ha capturado unas 5,084 personas durante el tiempo qu",24-08-2020 16:56,https://www.bing.com/th?id=OVFT.xABaErYjo3BRI_M68EE9Mi,Chile,Hondudiario
Talangueños ya cuenta con su centro de triaje,http://www.elsoldehonduras.com/salud/talanguenos-ya-cuenta-con-su-centro-de-triaje/,"Gracias a los recursos otorgados por el gobierno del presidente Juan Orlando Hernández, a través del Programa Fuerza Honduras, este sábado fue inaugurado el centro de triaje y unidad estabilizadora pa",24-08-2020 18:21,https://www.bing.com/th?id=OVFT.w1arFt4vlGt4_DVRQLXVdC,Chile,El Sol de Honduras
Carlos Umaña: 41 médicos y 20 enfermeras han muerto por COVID-19 en Honduras,https://www.latribuna.hn/2020/08/24/carlos-umana-41-medicos-y-20-enfermeras-han-muerto-por-covid-19-en-honduras/,"El presidente de la Asociación de Médicos del Instituto Hondureño de Seguridad Social (IHSS), Carlos Umaña, confirmó este lunes la muerte de 41 colegas suyos por COVID-19 en Honduras. ‘Efectivamente,",24-08-2020 20:25,https://www.bing.com/th?id=OVFT.gLL88c8EtlZJs6c3-3UXmS,Chile,La Tribuna
