name,url,description,datePublished,imagen,pais,Fuente
Cohep estima pérdidas que perdidas en Honduras ocasionadas por covid-19 y ahora ETA se cuantifican en unos Lps. 120 mil millones,https://ultimahora.hn/cohep-estima-perdidas-que-perdidas-en-honduras-ocasionadas-por-covid-19-y-ahora-eta-se-cuantifican-en-unos-lps-120-mil-millones/,"El Consejo Hondureño de la Empresa Privada (Cohep), estima que las pérdidas de Honduras ocasionadas por las medidas de contención a la pandemia del covid-19 se cuantifican en 100 mil y 120 mil",04-11-2020 17:57,https://www.bing.com/th?id=OVFT.8NTVUwyX56WIym5l4FEu8i,Chile,Ultima Hora
Honduras informa al Cuerpo Diplomático de primeros daños provocados por el huracán ETA,http://www.elsoldehonduras.com/nacionales/honduras-informa-al-cuerpo-diplomatico-de-primeros-danos-provocados-por-el-huracan-eta/,"El gobierno hondureño, a través del canciller Lisandro Rosales y del titular de la Secretaría de Coordinación General de Gobierno, Carlos Madero, informaron hoy al cuerpo diplomático sobre los primero",04-11-2020 18:55,https://www.bing.com/th?id=OVFT.pUbn99TbGs5pXpKaiPBYoC,Chile,El Sol de Honduras
COVID-19 DE EEUU SE HIZO MÁS CONTAGIOSO Y HONDURAS SIN ¡ALERTA!,http://www.web.ellibertador.hn/index.php/noticias/nacionales/2385-covid-19-de-eeuu-se-hizo-mas-contagioso-y-honduras-sin-alerta,"Tegucigalpa. La comunidad científica ha alertado sobre el comportamiento del nuevo coronavirus durante la segunda ola de casos en Estados Unidos, y los más que probables siguientes brotes en un horizo",04-11-2020 21:37,https://www.bing.com/th?id=OVFT.yLDjOvJfGue9zBaFbGnUPy,Chile,El Libertador
Alerta Roja a nivel nacional Población que vive en zonas de riesgo o históricamente inundables debe realizar evacuaciones obligatorias,http://www.elsoldehonduras.com/nacionales/alerta-roja-a-nivel-nacional-poblacion-que-vive-en-zonas-de-riesgo-o-historicamente-inundables-debe-realizar-evacuaciones-obligatorias/,El Comité de Alertas de la Secretaría de Estado en los Despachos de Gestión de Riesgo y Contingencias Nacionales (Copeco) determinó declarar por tiempo indefinido ALERTA ROJA en todo el territorio nac,05-11-2020 00:06,https://www.bing.com/th?id=OVFT.AZRgvsHNFOdkGL-YjSHOuy,Chile,El Sol de Honduras
HONDURAS / JOH Y “KILLA” MONTAN ALBERGUES SIN MÉDICOS ¡FÁBRICA COVID!,http://www.web.ellibertador.hn/index.php/noticias/nacionales/2386-honduras-joh-y-killa-montan-albergues-sin-medicos-fabrica-covid,"La presidente de los médicos de Honduras, Suyapa Figueroa, ha mostrado preocupación porque el gabinete de Juan Hernández instala albergues para personas afectadas por el fenómeno climático “Eta”, obvi",05-11-2020 03:34,https://www.bing.com/th?id=OVFT.C1AZ_4btmelH_oqRwIgJyy,Chile,El Libertador
Congreso Nacional aprueba ley que permite la realización de juicios virtuales,https://www.elheraldo.hn/pais/1420353-466/congreso-nacional-aprueba-ley-que-permite-la-realizaci%C3%B3n-de-juicios-virtuales,"En la sesión virtual también se aprobó la modificación de los días de asueto por la Semana Morazánica, ahora la decisión de la fecha en que se otorguen está en manos del Poder Ejecutivo",05-11-2020 16:12,https://www.bing.com/th?id=OVFT.-FHQzLhSR6kGqexcxX3pri,Chile,El Heraldo
Déficit fiscal de Honduras será de 10 por ciento del Producto Interno Bruto en 2020,https://www.radiohrn.hn/deficit-fiscal-de-honduras-sera-de-10-por-ciento-del-producto-interno-bruto-en-2020,Honduras tendrá que buscar otras fuentes de financiamiento a través de nuevos endeudamientos. El déficit entre los ingresos y los gastos de la Administración Central al término del presente año será d,05-11-2020 17:36,https://www.bing.com/th?id=OVFT.rkln_lAoC-i8pzd81dhFwS,Chile,Radio HRN
Olimpia-Managua: Concacaf nombra árbitros hondureños por emergencia que provocó tormenta ETA,https://www.diez.hn/liganacionaldehonduras/1420486-498/eta-concacaf-league-nombra-arbitros-olimpia-managua-honduras-nicaragua-oscar-moncada,"El encargado de impartir justicia será Óscar Moncada, quien suplirá la baja del jamaicano Oshane Nation, luego que este y sus asistentes no pudieran tener acceso de llegar al país por el cierre de los",05-11-2020 21:18,https://www.bing.com/th?id=OVFT._4jB4RBv8alTGUEdp1DhxC,Chile,diez.hn
Honduras es presentada como atractivo turístico para los estadounidenses,https://hondudiario.com/2020/11/05/honduras-es-presentada-como-atractivo-turistico-para-los-estadounidenses/,"*** El país cuenta con la oferta turística más variada de la región centroamericana. El reconocido periodista estadounidense, Peter Greenberg, destacó en su sitio web a Honduras como un destino que lo",05-11-2020 21:31,https://www.bing.com/th?id=OVFT.IuRp5WJGNFQHqckf1yEqNy,Chile,Hondudiario
"Honduras llega a un total de 99,347 casos de COVID-19 a nivel nacional",https://ultimahora.hn/honduras-llega-a-un-total-de-99347-casos-de-covid-19-a-nivel-nacional/,"El Gobierno de la República de Honduras, a través del Sistema Nacional de Gestión de Riesgos (SINAGER), informa a la población lo siguiente: En cumplimiento con el compromiso de comunicar",06-11-2020 03:15,https://www.bing.com/th?id=OVFT.GKTU0_DYRVs8U_UZWVsG-i,Chile,Ultima Hora
"Honduras alcanza los 99,347 contagiados y 2,736 muertes por COVID-19",https://proceso.hn/honduras-alcanza-los-99347-contagiados-y-2736-muertes-por-covid-19/,"Tegucigalpa – A 99 mil 347 casos acumulados y 2 mil 736 decesos por COVID-19 en Honduras, informó este miércoles el Sistema Nacional de Gestión de Riesgos (Sinager). Por segundo día seguido, los datos",06-11-2020 03:22,https://www.bing.com/th?id=OVFT.xb64U3kN5a5YsSmDvCPN4C,Chile,Proceso
COVID-19 Honduras: SINAGER confirma 223 nuevos casos y 6 muertos,https://tiempo.hn/covid-19-honduras-223-nuevos-casos-y-6-muertos/,"SINAGER también reportó 421 nuevo recuperados de esa enfermedad en el país. TEGUCIGALPA, HONDURAS. Debido a los estragos que ocasionó la tormenta tropical Eta en Honduras, específicamente en la zona n",06-11-2020 04:09,https://www.bing.com/th?id=OVFT.JgO8di9PBQjrJ0-OccRmOy,Chile,Tiempo
Muertos por la COVID-19 en Honduras suman 2.736 y los contagios 99.347,https://www.latribuna.hn/2020/11/05/muertos-por-la-covid-19-en-honduras-suman-2-736-y-los-contagios-99-347/,"Tegucigalpa.- La cifra de muertos en Honduras por la COVID-19 se elevó este jueves a 2.736 con seis nuevos casos registrados por el estatal Sistema Nacional de Gestión de Riesgos (Sinager), mientras q",06-11-2020 06:03,https://www.bing.com/th?id=OVFT.4uVtNVx-G2PLwCoZjoX1TC,Chile,La Tribuna
Conferencia episcopal llama a estar alertas y con medidas,https://www.latribuna.hn/2020/11/06/conferencia-episcopal-llama-a-estar-alertas-y-con-medidas/,"Los obispos de la Conferencia Episcopal de Honduras (C.E.H.), mediando un comunicado, se dirigieron a la comunidad católica y la ciudadanía en general para mantenerse alertas ante el fenómeno de la de",06-11-2020 10:36,https://www.bing.com/th?id=OVFT.3x33LGi3KrN2HDhYxVUipC,Chile,La Tribuna
Ingreso de las remesas supera el nivel de 2019 pese a la crisis,https://www.elheraldo.hn/economia/1420553-466/ingreso-de-las-remesas-supera-el-nivel-de-2019-pese-a-la,"Los migrantes hondureños siguen aportando con sus remesas el 18% del PIB y el 47% de las divisas TEGUCIGALPA, HONDURAS.-Los hondureños recibieron 4,456.4 millones de dólares (unos 109,000 millones de",06-11-2020 13:31,https://www.bing.com/th?id=OVFT.P7C33cdR1mmnoEN5BgXYrS,Chile,El Heraldo
Con pocos recursos continúan rescates de damnificados de Eta en Honduras,https://www.laprensa.hn/honduras/1420582-410/con-pocos-recursos-contin%C3%BAan-rescates-de-damnificados-de-eta-en-honduras,"Con más ganas que recursos, los organismos de socorro de Honduras aceleraron el esfuerzo por realizar evacuaciones en diversos puntos de Honduras, en donde miles de personas siguen afectadas por las i",06-11-2020 14:27,https://www.bing.com/th?id=OVFT.IQsqPg1C5jQkt4_cIT27sy,Chile,La Prensa Chicos
Taiwán solidario con militares rescatistas,https://elpatriota.hn/2020/11/06/taiwan-solidario-con-militares-rescatistas/,Con el propósito de salvaguardar la salud de los miembros de las Fuerza Armadas de Honduras que laboran en las operaciones de rescate y socorro en las diferentes zonas del país donde la presencia del,06-11-2020 16:01,https://www.bing.com/th?id=OVFT.lwJ_7TbxFpRAQsXKg6ndQC,Chile,El Patriota
Futbolistas de Marathón unieron fuerzas para regalar comida a habitantes en tiempos de Eta,https://www.diez.hn/liganacionaldehonduras/1420618-498/futbolistas-de-marathon-solidarizan-en-tiempos-de-lluvia-eta,"Allan Banegas, Denovan Torres, Otoniel Osorio y Carlos Perdomo contribuyeron para llevar un bocado a los más necesitados.",06-11-2020 16:50,https://www.bing.com/th?id=OVFT.zjC3F16rghZMSqe-Y38cly,Chile,diez.hn
Intensifican labores de rescate de damnificados de Eta en Honduras,https://www.laprensa.hn/honduras/1420582-410/honduras-eta-lluvias-damnificados-evacuados-rescates,"Los organismos de socorro de Honduras reforzaron el viernes las acciones de rescate y evacuación en diversos puntos de Honduras, en donde miles de personas siguen afectadas por las inundaciones dejada",06-11-2020 17:27,https://www.bing.com/th?id=OVFT.ApleYb8k5TOqF1pOqUUa2i,Chile,La Prensa Chicos
Salud: Eta dejará repunte de COVID-19 y alza en otras enfermedades,https://tiempo.hn/salud-eta-dejara-repunte-de-covid-19-enfermedades/,"Ante el paso de Eta por Honduras, habrá un repunte de COVID-19 y un alza en otras enfermedades, señaló el jefe de la Región",06-11-2020 18:52,https://www.bing.com/th?id=OVFT.9TJhYabz-O7bzdfP4PIRZS,Chile,Tiempo
