name,url,description,datePublished,imagen,pais,Fuente
"PROYECCIONES DEL BM: ECONOMÍA HONDUREÑA, ENTRE LAS QUE MÁS CRECERÁ EN 2021",https://ultimahora.hn/proyecciones-del-bm-economia-hondurena-entre-las-que-mas-crecera-en-2021/,"En medio de un panorama donde la pandemia de covid-19 sigue golpeando a todo el mundo, Honduras se destaca como el tercer país que liderará el crecimiento en la región centroamericana, reveló el",18-01-2021 15:51,https://www.bing.com/th?id=OVFT.dCHUNi9dTNVJLWwPmmkX-C,Chile,Ultima Hora
Advertencia de cierre de ciudades en Honduras y suspenden salvoconductos por aumento de casos de Covid-19,https://www.diez.hn/coronavirus/1437753-441/anuncian-toque-de-queda-drastico-suspenden-salvoconductos-aumento-coronavirus,"En un comunicado, la Policía Nacional, explicó que harán operativos y tendrán medidas duras y solo se podrá circular de 5.00 am a 9.00 de la noche",24-01-2021 05:39,https://www.bing.com/th?id=OVFT.bWXyYEKb6zOnfIxH2MLYMi,Chile,diez.hn
Médico patólogo muere por COVID-19.,https://www.latribuna.hn/2021/01/24/medico-patologo-muere-por-covid-19-en-tegucigalpa/,"Otro héroe de primera línea muere por COVID-19 en Honduras. Se trata del doctor especialista en patología, Edgardo Murillo, quien según sus colegas se encontraba entubado en la Unidad de Cuidados Inte",24-01-2021 18:18,https://www.bing.com/th?id=OVFT.hymUeCUQ_uTxzT2C-odH4S,Chile,La Tribuna
"Honduras: Por Covid-19, muere el patólogo Edgardo Murillo",https://tiempo.hn/por-covid-19-muere-el-patologo-edgardo-murillo/,"TEGUCIGALPA, HONDURAS. Otro médico hondureño se suma a la lista de fallecidos a causa de la COVID-19 en el país, se trata del patólogo Edgardo Murillo , así lo confirmó este domingo Carlos Umaña, pres",24-01-2021 20:02,https://www.bing.com/th?id=OVFT.l9ctMfC_ySZMV1z0IZOXUy,Chile,Tiempo
Honduras supera los 140 mil casos de coronavirus,https://hondudiario.com/2021/01/24/honduras-supera-los-140-mil-casos-de-coronavirus/,"El Sistema Nacional de Gestión de Riesgos (Sinager), confirmó la noche del sábado 1,056 nuevos casos de Covid-19, sumando así un total de 140,238 contagios a nivel nacional. De 2,753 pruebas PCR proce",24-01-2021 21:01,https://www.bing.com/th?id=OVFT.YwDOQFmK-JCM7i5msrxBKC,Chile,Hondudiario
El covid-19 cega la vida del patólogo Edgardo Murillo Castillo,https://www.laprensa.hn/especiales/coronavirus/1437949-410/doctor-edgardo-murillo-castillo-muerte-covid-seguro-social-tegucigalpa,"El gremio médico de Honduras volvió a ser golpeado por la pandemia del covid-19, luego de conocerse este domingo el lamentable fallecimiento del patólogo Edgardo Murillo Castillo, quien estaba interna",24-01-2021 21:25,https://www.bing.com/th?id=OVFT.GIiQD4Ni5oJ9qvqBjnKCWi,Chile,La Prensa Chicos
Muere otro médico por COVID-19.,https://www.latribuna.hn/2021/01/24/muere-otro-medico-por-covid-19/,"Otro médico murió este domingo por COVID-19 en un centro asistencial de Tegucigalpa, capital de Honduras. Se trata del joven doctor Raúl Pérez, originario de Comayagua, zona central de Honduras. Infor",24-01-2021 21:38,https://www.bing.com/th?id=OVFT.UxYacuKNVYF87kHXrl3pVy,Chile,La Tribuna
Fallecen dos médicos y suman 61 los decesos por COVID-19 en Honduras,https://proceso.hn/fallecen-dos-medicos-y-suman-61-los-decesos-por-covid-19-en-honduras/,"Tegucigalpa- El patólogo gástrico y docente de la Universidad NacionalAutónoma de Honduras (UNAH), Edgardo Murillo Castillo, falleció en las últimashoras en el Instituto Hondureño de Seguridad",24-01-2021 23:59,https://www.bing.com/th?id=OVFT.fA3rg7oLMe_nXEP5x0jPnC,Chile,Proceso
Muere por covid-19 el patólogo hondureño Edgardo Murillo,https://www.elheraldo.hn/pais/1437959-466/muere-covid-19-patologo-edgardo-murillo-honduras,Murillo perdió la batalla contra el coronavirus tras permanecer interno varias semanas en la Unidad de Cuidados Intensivos del IHSS en la capital,25-01-2021 02:08,https://www.bing.com/th?id=OVFT.SE-c1dxV76c5DutAp9UEfS,Chile,El Heraldo
Tres médicos hondureños murieron de covid-19 este domingo,https://www.elheraldo.hn/pais/1437991-466/medicos-muertos-covid-19-honduras,La ola de contagios está creciendo actualmente en el país y ha vuelto a colapsar el sistema sanitario. En total ya son 62 médicos muertos por covid-19,25-01-2021 02:36,https://www.bing.com/th?id=OVFT.ryuY32XKMjoohC5owSBk_S,Chile,El Heraldo
"Honduras cerca de los 141 mil contagios y muertes por coronavirus ya son 3,447",https://hondudiario.com/2021/01/24/honduras-cerca-de-los-141-mil-contagios-y-muertes-por-coronavirus-ya-son-3447/,"El Sistema Nacional de Gestión de Riesgos (Sinager), confirmó este domingo 691 nuevos casos de Covid-19, sumando así un total de 140,929 contagios a nivel nacional. Además, se reportó la muerte de 6 p",25-01-2021 04:25,https://www.bing.com/th?id=OVFT.Aue9-wkq0AY4Owfe90CCwC,Chile,Hondudiario
"Honduras contabiliza 140,929 infectados y 3,447 muertos por covid-19",https://www.radiohrn.hn/honduras-contabiliza-140929-infectados-y-3447-muertos-por-covid-19,"El Sistema Nacional de Gestión de Riesgos (Sinager) contabilizó este domingo (42.01.2021) la cifra de 140,929 casos de contagiados por covid-19 a nivel nacional. El reporte del Sinager, detalló que ho",25-01-2021 04:48,https://www.bing.com/th?id=OVFT.mMA-RfnlbP8_WwzjGbXBai,Chile,Radio HRN
Honduras registra 140 mil 929 casos y tres mil 447 decesos por COVID-19,https://proceso.hn/honduras-registra-140-mil-929-casos-y-tres-mil-447-decesos-por-covid-19/,"El Sistema Nacional de Gestión de Riesgos (Sinager), confirmó este domingo que Honduras alcanzó los 140 mil 929 contagios confirmados y tres mil 447 fallecimientos a causa del COVID-19.",25-01-2021 05:00,https://www.bing.com/th?id=OVFT.wLZk7NRlF0OelOpAWQldYS,Chile,Proceso
Recomiendan ampliar toque de queda en cuatro departamentos,https://www.laprensa.hn/honduras/1438042-410/recomiendan-ampliar-toque-de-queda-en-cinco-departamentos-coronavirus-covid-policia-nacional,"Ante aumento de casos de covid-19, Mesa solicita a Sinager restringir más la circulación, fortalecer hospitales y centros de triaje.",25-01-2021 12:52,https://www.bing.com/th?id=OVFT.IZD8UUoXo3w12f7L8ZK0Ai,Chile,La Prensa Chicos
Radio HRN presenta el gran foro 'El desafío de la educación 2021 en Honduras',https://www.radiohrn.hn/radio-hrn-presenta-el-gran-foro-el-desafio-de-la-educacion-2021-en-honduras,"Honduras enfrenta un gran desafío este 2021 en materia educativa a causa del covid-19 Radio HRN y TSi de Televicentro presentan el lunes (25.01.2021) el gran foro ""El desafío de la Educación 2021 en H",25-01-2021 12:59,https://www.bing.com/th?id=OVFT.sUtnmr9DEmqmrU3mD01Coy,Chile,Radio HRN
Covid-19: Entre 10 y 15 casos detectados en triajes son reinfecciones,https://tiempo.hn/reinfecciones-triajes-covid-19-honduras/,"A través de medios locales, Rony Antúnez, director del triaje del Centro Cívico Gubernamental (CCG), afirmó que él se infectó dos veces. El galeno relató que la primera vez fue asintomático y en la se",25-01-2021 13:24,https://www.bing.com/th?id=OVFT.BQDmVOJplqgRoAxns2OOky,Chile,Tiempo
TRES MÉDICOS FALLECEN EN LAS ULTIMAS HORAS YA SUMAN 62 LOS DECESOS DE GALENOS POR COVID-19,https://ultimahora.hn/tres-medicos-fallecen-en-las-ultimas-horas-ya-suman-62-los-decesos-de-galenos-por-covid-19/,"El patólogo gástrico y docente de la Universidad Nacional Autónoma de Honduras (UNAH), Edgardo Murillo Castillo, es uno de los médicos que  falleció en las últimas horas en el Instituto Hondureño",25-01-2021 14:14,https://www.bing.com/th?id=OVFT.Shx2NB7HdlgNqrl_3IL6Dy,Chile,Ultima Hora
