name,url,description,datePublished,imagen,pais,Fuente
Hondureña dio a luz en centro de triaje al momento que buscada atención médica en Yoro,https://www.radiohrn.hn/hondurena-dio-a-luz-en-centro-de-triaje-al-momento-que-buscada-atencion-medica-en-yoro,"Una hondureña dio a luz a un hermoso bebé al momento que buscaba el domingo (25.10.2020) asistencia médica en el Centro de Triaje La Fragua, donde se practican exámenes de covid-19, en El Progreso en",26-10-2020 03:27,https://www.bing.com/th?id=OVFT.vLUmSxbF602VTcpFbDcDEC,Chile,Radio HRN
"Honduras reporta 93,214 casos de covid-19 y suma 2,623 muertes",https://www.elheraldo.hn/pais/1418048-466/honduras-reporta-casos-covid-suma-mas-muertos,"TEGUCIGALPA; HONDURAS.-El coronavirus sigue sin dar tregua a los hondureños. El Sistema Nacional de Gestión de Riesgos (Sinager) reportó este domingo que de 1,197 pruebas que se procesaron, 490 result",26-10-2020 04:00,https://www.bing.com/th?id=OVFT.Gd4ErNDWWKlRnjKJQ5Jv9C,Chile,El Heraldo
Honduras alcanza los 93 mil 214 casos de COVID-19 en día 230 de pandemia,https://proceso.hn/honduras-alcanza-los-93-mil-214-casos-de-covid-19-en-dia-230-de-pandemia/,"Tegucigalpa – Honduras alcanzó este domingo la cifra de 93 mil 214 casos confirmados del coronavirus SARS-CoV-2 y la de 2 mil 623 fallecidos por la enfermedad de la COVID-19, de acuerdo con el informe",26-10-2020 04:14,https://www.bing.com/th?id=OVFT.9LfZFA0cg79OsKCiG5YObi,Chile,Proceso
Ramón Maradiaga y Ricardo Canales vuelven a dar positivo de Covid-19,https://www.diariomas.hn/2020/10/24/ramon-maradiaga-y-ricardo-canales-vuelven-a-dar-positivos-de-covid-19/,"El plantel del equipo Vida de la ciudad de La Ceiba fue sometido este sábado a pruebas de Covid-19, luego que a inicios de la semana dieran positivos",26-10-2020 16:18,https://www.bing.com/th?id=OVFT.mehBAJkKSK77QDJv7Tt-bi,Chile,Mas
Trabajadores de la salud los más expuestos al Covid-19 ante irresponsabilidad de la población,https://hondudiario.com/2020/10/26/trabajadores-de-la-salud-los-mas-expuestos-al-covid-19-ante-irresponsabilidad-de-la-poblacion/,***Orellana aseguró que la irresponsabilidad de la población expone a los trabajadores de la salud y a todos los que están en la primera línea de contención contra el virus. El presidente de la Asocia,26-10-2020 18:03,https://www.bing.com/th?id=OVFT.qgTzEkaljlTTUX5X9bvD3i,Chile,Hondudiario
Gobierno congela precios de alimentos balanceados para consumo animal,http://www.elsoldehonduras.com/economia/gobierno-congela-precios-de-alimentos-balanceados-para-consumo-animal/,"Entre otras razones del congelamiento, la SDE señala que en medio de la emergencia nacional por la pandemia de covid-19 se ha encontrado que los precios de esos alimentos balanceados, que son de consumo de animales como cerdos, gallinas ponedoras ...",26-10-2020 19:33,https://www.bing.com/th?id=OVFT.406Yuz9EIdTNvg--mGJvuy,Chile,El Sol de Honduras
En primeros siete meses de cuarentena Honduras registra 138 muertes violentas de mujeres,https://ultimahora.hn/en-primeros-siete-meses-de-cuarentena-honduras-registra-138-muertes-violentas-de-mujeres/,"La directora del Observatorio de la Violencia de la Universidad Nacional Autónoma de Honduras, manifestó que la cifra de mujeres asesinadas desde el confinamiento ha incrementado de forma alarmante.",26-10-2020 19:55,https://www.bing.com/th?id=OVFT.ZngtEnY5rHxlSNxMimDDmS,Chile,Ultima Hora
En marcha instalación de módulos del hospital móvil de aislamiento de Choluteca,https://ultimahora.hn/en-marcha-instalacion-de-modulos-del-hospital-movil-de-aislamiento-de-choluteca/,"A partir de hoy se inicia el proceso de emplazamiento de los módulos del Hospital Móvil de Aislamiento de Choluteca de atención a pacientes COVID-19 en un tiempo que durará cuatro días, si las condici",26-10-2020 22:01,https://www.bing.com/th?id=OVFT.5uu1aKnD2dSOREAV-9VFLC,Chile,Ultima Hora
Comerciantes y arroceros de La Ceiba reciben apoyo de Crédito Solidario en impulso a reactivación económica,http://www.elsoldehonduras.com/agroindustria/comerciantes-y-arroceros-de-la-ceiba-reciben-apoyo-de-credito-solidario-en-impulso-a-reactivacion-economica/,La Ceiba. Cinco miembros de la Asociación de Arroceros y 10 comerciantes de La Ceiba recibieron de parte del Gobierno de la República financiamiento de Crédito Solidario por 1.686.000 lempiras como pa,26-10-2020 22:24,https://www.bing.com/th?id=OVFT.jZfGU885XNMjNB1odbrWeS,Chile,El Sol de Honduras
"Con reapertura de aduanas, contagios por Covid-19 podrían aumentar en el país",https://hondudiario.com/2020/10/26/con-reapertura-de-aduanas-contagios-por-covid-19-podrian-aumentar-en-el-pais/,"La exministra la Secretaria de Salud (Sesal), Roxana Araujo, advirtió que debido a la reapertura de las aduanas terrestres del país, los contagios por Covid-19 podrían aumentar si la población no toma",27-10-2020 01:50,https://www.bing.com/th?id=OVFT.9sHSlwaZtkLMjGdBKDQmbi,Chile,Hondudiario
"Honduras registra 93,966 contagios y 2,633 muertes por covid-19",https://www.elheraldo.hn/pais/1418291-466/honduras-infectados-muertos-covid-19-sinager,"Honduras ya superó a China en contagios (85,800), país que logró contener el virus nueve meses después del inicio de la crisis",27-10-2020 02:22,https://www.bing.com/th?id=OVFT.aVuikKQaX6inJQm912IGDi,Chile,El Heraldo
Honduras se acerca a los 94 mil casos positivos por coronavirus,https://www.radiohrn.hn/honduras-se-acerca-a-los-94-mil-casos-positivos-por-coronavirus,"Un total de 1,727 pruebas PCR para covid-19 realizó este lunes (26.10.2020) el Laboratorio Nacional de Virología de la Secretaría de Salud de Honduras, de las que 935 dieron resultado positivo. Para u",27-10-2020 02:42,https://www.bing.com/th?id=OVFT.P4B1cGe_gaNcgP1bMlDyti,Chile,Radio HRN
"Honduras acumula 93,966 contagiados y 2,633 defunciones por COVID-19",https://proceso.hn/honduras-acumula-93966-contagiados-y-2633-defunciones-por-covid-19/,"Tegucigalpa – Honduras llegó este lunes a 93 mil 966 contagiados y 2 mil 633 fallecimientos por COVID-19, informó el Sistema Nacional de Gestión de Riesgos (Sinager). – La tasa de letalidad en Hondura",27-10-2020 03:16,https://www.bing.com/th?id=OVFT.P4Dl4wkC7yZBPmkxtSZ84C,Chile,Proceso
Sin casos de COVID-19 el mercado San Pablo,https://www.latribuna.hn/2020/10/26/sin-casos-de-covid-19-el-mercado-san-pablo/,"A más de seis meses de la pandemia del coronavirus en Honduras, el mercado San Pablo, en Tegucigalpa, mantiene extremas medidas de bioseguridad para promover la reapertura inteligente de los distintos",27-10-2020 03:45,https://www.bing.com/th?id=OVFT.VsfEXDNSNV0UBnL8x8H0WS,Chile,La Tribuna
SINAGER registra 752 nuevos casos de COVID-19,https://www.latribuna.hn/2020/10/26/sinager-registra-752-nuevos-casos-de-covid-19/,"El Sistema Nacional de Gestión de Riesgos (SINAGER), informó que se procesaron 1,727 pruebas para diagnosticar coronavirus de las cuales 752 han dado positivo del virus, con estos nuevos casos la cifr",27-10-2020 04:00,https://www.bing.com/th?id=OVFT.HI4iDCQgxtxLE-_6mbmLNC,Chile,La Tribuna
Baja afluencia en centros de triaje de San Pedro Sula,https://www.laprensa.hn/sanpedro/1418341-410/baja-afluencia-en-centro-de-triaje-san-pedro-sula-honduras,"Referente a la cantidad de casos de covid-19 en San Pedro Sula, la doctora informó que hasta la semana epidemiológica número 43 suman 12,451 contagios, lo que representa el 48% del total de infectados a nivel de Cortés. Resaltó que esta es la ciudad ...",27-10-2020 08:12,https://www.bing.com/th?id=OVFT.SQiFvSD7cdOUao-Fs-0GbS,Chile,La Prensa Chicos
L150 millones invertirán para fortalecer la red de hospitales de Cortés,https://www.laprensa.hn/sanpedro/1418339-410/fortalecer-red-de-hospitales-cortes-coronavirus-honduras-sinager-salud,"Una inversión de 150 millones de lempiras realizará el Gobierno de Honduras a través de la Secretaría de Salud ... e irán destinados a mejorar la capacidad de la salas de covid-19 de los hospitales Mario Catarino Rivas, Leonardo Martínez y el ...",27-10-2020 08:12,https://www.bing.com/th?id=OVFT.PrcFyUpad7pCiWmcIp87QS,Chile,La Prensa Chicos
