name,url,description,datePublished,imagen,pais,Fuente
Vida reclama a Sinager y Copeco pago de diez meses de energía eléctrica en su sede,https://www.diez.hn/liganacionaldehonduras/1441520-498/sede-del-vida-diez-meses-energia-electrica-incumplimiento-de-pago-copeco-sinager,"Inmueble del Vida fue prestado a las autoridades de salud a principios de la pandemia de manera gratuita, sufriendo daños en su interior y exterior debido al descuido de los mismos.",09-02-2021 15:41,https://www.bing.com/th?id=OVFT.2iS3GB46WdLrDtGYtVxOKC,Chile,diez.hn
LA ONU EN HONDURAS INSTA A COMBATIR LA DESINFORMACIÓN SOBRE LA VACUNA CONTRA LA COVID-19,https://ultimahora.hn/la-onu-en-honduras-insta-a-combatir-la-desinformacion-sobre-la-vacuna-contra-la-covid-19/,"En diversas ocasiones, el Secretario General de las Naciones Unidas ha reiterado el llamado a cada persona a detenerse a pensar un momento antes de compartir cualquier información en línea, para",09-02-2021 16:07,https://www.bing.com/th?id=OVFT.WyAycMlrxTawVdBQeBy6Uy,Chile,Ultima Hora
"Honduras recibirá en calidad de donación COVAX, para inmunizar al 20% de la población",https://www.vtv.com.hn/noticia/honduras-recibira-en-calidad-de-donacion-covax-para-inmunizar-al-20-de-la-poblacion/,"Juan Orlando Hernández y su gabinete cedieron su cupo para personas de la tercera edad La Secretaría de Salud y el Gobierno, dieron a conocer que en los últimos días de febrero, podría darse la vacuna",09-02-2021 16:11,https://www.bing.com/th?id=OVFT.dhoRGa3wx8Edvkl25s1HmS,Chile,VTV
"OMS reafirma compromiso de donación de vacunas bajo mecanismo Covax, pero desconoce fechas de entrega",https://proceso.hn/oms-reafirma-compromiso-de-donacion-de-vacunas-bajo-mecanismo-covax-pero-desconoce-fechas-de-entrega/,"La Organización Mundial de la Salud (OMS), reafirmó este martes el compromiso de donación de vacunas contra la COVID-19 bajo el mecanismo Covax, aunque no precisó fechas de entrega porque está",09-02-2021 16:50,https://www.bing.com/th?id=OVFT.MiXMB1_uC2ci4XGKu7TM4C,Chile,Proceso
Salud Pública: tasa de letalidad por COVID-19 en Honduras es de 2.42 %.,https://www.latribuna.hn/2021/02/09/salud-publica-tasa-de-letalidad-por-covid-19-en-honduras-es-de-2-42/,"La tasa de letalidad causada por la enfermedad COVID-19 en Honduras, entre la semana epidemiológica número 11 (2020) y la",09-02-2021 17:11,https://www.bing.com/th?id=OVFT.ZHOvnUURW9jQOG-i5S3M_i,Chile,La Tribuna
ONU en Honduras insta a combatir la desinformación sobre la vacuna contra la Covid-19,https://hondudiario.com/2021/02/09/onu-en-honduras-insta-a-combatir-la-desinformacion-sobre-la-vacuna-contra-la-covid-19/,"El Sistema de las Naciones Unidas en Honduras insta a la población a combatir la desinformación sobre la vacuna contra la Covid-19 como una acción clave para frenar la pandemia, en respuesta a la prol",09-02-2021 17:52,https://www.bing.com/th?id=OVFT.SWnUIV_p39UyeYwB4lCOLC,Chile,Hondudiario
Mueren dos pastores por sospechas de COVID-19.,https://www.latribuna.hn/2021/02/09/mueren-dos-pastores-por-sospechas-de-covid-19/,"Dos pastores evangélicos murieron por sospechas de COVID-19, en las últimas horas en diferentes sectores de Honduras. Se trata de",09-02-2021 18:58,https://www.bing.com/th?id=OVFT.7MFe_901Y1tO1r1eUCH8mC,Chile,La Tribuna
FALLECE POR COVID-19 PASTOR EN SAN PEDRO SULA COMUNIDAD EVANGÉLICA NUEVAMENTE DE LUTO,https://ultimahora.hn/fallece-por-covid-19-pastor-en-san-pedro-sula-comunidad-evangelica-nuevamente-de-luto/,"La covid-19 sigue cobrando vidas de hondureños a diario en esta ocasión se dio a conocer que el pastor del Ministerio Internacional La Cosecha, Ramón Pérez, falleció esta mañana tras padecer",09-02-2021 19:19,https://www.bing.com/th?id=OVFT.58po_BhBcUAeZdqS9HdIhy,Chile,Ultima Hora
"Honduras: tasa de letalidad por COVID-19 se sitúa en 2.42 %, según Salud",https://tiempo.hn/honduras-tasa-letalidad-covid/,"TEGUCIGALPA, HONDURAS. En un 2.42% se sitúa la tasa de letalidad causada por el Covid-19 en Honduras, según los datos brindados por la Secretaría de Salud (Sesal). Los datos proporcionados por la Sesa",09-02-2021 20:13,https://www.bing.com/th?id=OVFT.wfmkrfnuP1f4gfIoA8_aGC,Chile,Tiempo
"Por COVID-19 muere la pastora Norma Zúñiga, en La Entrada, Copán",https://tiempo.hn/por-covid-19-muere-pastora-norma-zuniga-la-entrada-copan/,"Debido a complicaciones derivadas del COVID-19, falleció este martes una reconocida pastora evangélica en la ciudad de La Entrada",09-02-2021 23:08,https://www.bing.com/th?id=OVFT.0D6gAL5l6NftUSWVdMA6Ni,Chile,Tiempo
La covid-19 arrebata la vida a dos pastores evangélicos más en Honduras,https://www.radiohrn.hn/la-covid-19-arrebata-la-vida-a-dos-pastores-evangelicos-mas-en-honduras,"Dos pastores hondureños fallecieron el martes (09.02.2021) a causa de complicaciones causadas por el coronavirus. Unos de ellos, es el pastor de la Iglesia internacional La Cosecha, Ramón Pérez, quien",10-02-2021 00:47,https://www.bing.com/th?id=OVFT.gNhvW7iC-nkbu8m0P0tjwC,Chile,Radio HRN
Torneo Clausura se jugará sin público,https://www.diariomas.hn/2021/02/09/torneo-clausura-se-jugara-sin-publico/,"El torneo Clausura de la Liga Nacional que iniciará el martes de 16 de febrero con el partido entre Lobos de la UPN y Motagua, se jugará al igual que",10-02-2021 01:02,https://www.bing.com/th?id=OVFT.W_Ceps8P-AcbjqFChvjokS,Chile,Mas
"Tasa de letalidad por covid-19 en Honduras es de 2,42 %",http://www.elsoldehonduras.com/nacionales/tasa-de-letalidad-por-covid-19-en-honduras-es-de-242/,"La tasa de letalidad causada por la enfermedad covid-19 en Honduras, entre la semana epidemiológica número 11 (2020) y la número 5 (2021) es de 2,42 %, informó este lunes el coordinador de la Unidad d",10-02-2021 02:49,https://www.bing.com/th?id=OVFT.GvawH33JcGb1ZoRzgAhYTC,Chile,El Sol de Honduras
Secretaría de Salud hace llamado enérgico de alerta a la población ante aumento de casos de covid-19 en Cortés,http://www.elsoldehonduras.com/nacionales/secretaria-de-salud-hace-llamado-energico-de-alerta-a-la-poblacion-ante-aumento-de-casos-de-covid-19-en-cortes/,"La Secretaría de Salud hizo este lunes un llamado enérgico a la población a presentarse a los centros de triaje al aparecer los primeros síntomas de covid-19, ya que han aumentado los casos positivos",10-02-2021 02:53,https://www.bing.com/th?id=OVFT.Risn3jSdh1gxFHtFVMdS1C,Chile,El Sol de Honduras
La ONU en Honduras insta a combatir la desinformación sobre la vacuna contra la COVID-19,http://www.eldiario.hn/la-onu-en-honduras-insta-a-combatir-la-desinformacion-sobre-la-vacuna-contra-la-covid-19/,"Tegucigalpa. - El Sistema de las Naciones Unidas en Honduras insta a la población a combatir la desinformación sobre la vacuna contra la COVID-19 como una acción clave para frenar la pandemia, en resp",10-02-2021 03:10,https://www.bing.com/th?id=OVFT.VWyioil9yjXZ8o1oSjdWyS,Chile,El Diario
Médicos Sin Fronteras y Sesal trabajarán por salud mental de afectados por tormentas Eta e Iota en el Valle de Sula,http://www.eldiario.hn/medicos-sin-fronteras-y-sesal-trabajaran-por-salud-mental-de-afectados-por-tormentas-eta-e-iota-en-el-valle-de-sula/,"San Pedro Sula. - En el marco de la campaña Todos Contra la Covid-19 que impulsa el Gobierno, la organización internacional Médicos Sin Fronteras se sumará a la Secretaría de Salud (Sesal) en este esf",10-02-2021 03:41,https://www.bing.com/th?id=OVFT.LGOJCkUtnqdhCLHV46f7mi,Chile,El Diario
"Honduras reporta 1,077 hospitalizados por covid-19, de los cuales 377 están grave y 56 en UCI",https://www.radiohrn.hn/honduras-reporta-1077-hospitalizados-por-covid-19-de-los-cuales-377-estan-grave-y-56-en-uci,"Honduras, a través del Sistema Nacional de Gestión de Riesgos (Sinager) confirmó este martes (09.02.2021) la cifra de 156,606 infectados y 3,789 fallecidos por covid-19 desde el inicio de la pandemia",10-02-2021 03:51,https://www.bing.com/th?id=OVFT.RtSWyHJ4RohTtJCpBIfcnC,Chile,Radio HRN
"Honduras llega a 156,606 contagios mientras suma 47 nuevas muertes por coronavirus",https://hondudiario.com/2021/02/09/honduras-llega-a-156606-contagios-mientras-suma-47-nuevas-muertes-por-coronavirus/,"*** Hay 371 muertes que aún están bajo sospecha. El Sistema Nacional de Gestión de Riesgos (Sinager), confirmó este martes 871 nuevos casos de Covid-19, sumando así un total de 156,606 contagios a niv",10-02-2021 04:27,https://www.bing.com/th?id=OVFT.Bm6pkA4_zlHafhukXGbwRi,Chile,Hondudiario
Honduras reporta 871 nuevos contagios y acumula 156 mil 606 casos confirmados de COVID-19,https://proceso.hn/honduras-reporta-871-nuevos-contagios-y-acumula-156-mil-606-casos-confirmados-de-covid-19/,"Los casos de COVID-19 en Honduras se elevaron este martes a 156 mil 606 desde que en marzo del año pasado se declaró la emergencia por la pandemia, con la confirmación de 871 contagios, informó el",10-02-2021 04:37,https://www.bing.com/th?id=OVFT.265VmWcgI_Ls_lML6SFx9C,Chile,Proceso
Gobierno pone al alcance de la población la ivermectina,https://www.laprensa.hn/honduras/1441770-410/honduras-gobierno-pone-alcance-poblacion-ivermectina,La Secretaría de Salud informó que decidieron protocolizar el uso del medicamento como un tratamiento preventivo contra el covid-19. La OMS aún no aprueba su uso.,10-02-2021 05:07,https://www.bing.com/th?id=OVFT.wrO5XqbJxV1bQ7UC_7VPQy,Chile,La Prensa Chicos
Laboratorios privados de Honduras han hecho más de un millón de pruebas,https://www.laprensa.hn/premium/1441772-410/laboratorios-privados-honduras-han-hecho-un-millon-pruebas,"Sinager reporta solamente más de 154,000 casos acumulados. Unos 15 laboratorios privados reportan tres veces más esa cifra y el doble de muertos.",10-02-2021 05:36,https://www.bing.com/th?id=OVFT.jgdsRjTPQnq1TVT8RvGnBi,Chile,La Prensa Chicos
