name,url,description,datePublished,imagen,pais,Fuente
Reinicio: Comisión Fiscalizadora vigila cumplimiento de medidas,https://proceso.hn/actualidad/7-actualidad/comision-fiscalizadora-vigilara-cumplimiento-de-medidas-en-reinicio.html,"Tegucigalpa - La Mesa Multisectorial para la Apertura Ordenada, Gradual y Progresiva de Sectores Económicos y Sociales informó este lunes que una Comisión Fiscalizadora vigilará el cumplimiento de las",09-06-2020 01:23,https://www.bing.com/th?id=ON.EBD002D80211606194090091410DA3C4,Chile,Proceso
Brasil retira candidatura para el Mundial femenino de 2023,https://www.diez.hn/internacionales/1385660-498/brasill-retira-candidatura-para-mundial-femenino-de-2023-internacionales,"La Confederación Brasileña de Fútbol (CBF) anunció que se retira de la contienda para albergar el Mundial femenino de fútbol en 2023 debido al ""escenario de austeridad económica"" que prevalecerá en lo",09-06-2020 20:33,https://www.bing.com/th?id=ON.725CF4979D7B7DA23BE565619961F046,Chile,diez.hn
"El blog de Astor: ""El trabajo de Fenafuth ha sido silencioso, pareciera despreocupada por la situación actual del futbol""",https://www.diez.hn/blogs/1388149-500/el-blog-de-astor-el-trabajo-de-fenafuth-ha-sido-silencioso-pareciera,"Astor Henríquez, experto en derecho deportivo, analiza 4 escenarios que forman parte del nuevo documento emitido por FIFA relacionado a conflictos producto del COVID-19. No podemos negar que la actual",19-06-2020 21:59,https://www.bing.com/th?id=ON.FFF07759B530096814555FF75FADC2E6,Chile,diez.hn
Médico muere por COVID-19 en San Pedro Sula,https://www.latribuna.hn/2020/06/19/medico-muere-por-covid-19-en-san-pedro-sula/,"La jefa de la Región Metropolitana de Salud en San Pedro Sula, Lesbia Villatoro, confirmó este viernes la muerte de otro médico por COVID-19, en el Instituto Hondureño de Seguridad Social (IHSS) de es",19-06-2020 23:45,https://www.bing.com/th?id=ON.8B6730EA52A9376001EF80EAF5F3A759,Chile,La Tribuna
"El coronavirus, los pastores y la unidad familiar en Honduras",https://radiohrn.hn/el-coronavirus-los-pastores-y-la-unidad-familiar-en-honduras/,"el 8 de junio que el gobierno volvió a reaperturar la economía en el territorio hondureño. El 13 de marzo, el gobierno de Honduras decidió suspender todas las actividades al aire libre, centros educat",20-06-2020 02:31,https://www.bing.com/th?id=ON.818800D6AE59D44B3436E395200519D5,Chile,Radio HRN
Chicha y Limón viernes 19 de junio de 2020,http://www.eldiario.hn/chicha-y-limon-viernes-19-de-junio-de-2020/,¡VIERNES JUNIANO!!… La tierra sigue enferma y la humanidad de luto… Los planetas se revuelcan por estas fechas: viene Grimorio a contarnos todo…Hoy cumplen años el eterno galán Rubén Alemán y la espec,20-06-2020 04:01,https://www.bing.com/th?id=ON.84EB0143478527FBD8F8895796B1BB84,Chile,El Diario
Muere por COVID-19 el doctor Mario Benítez en la zona norte de Honduras,https://www.laprensa.hn/especiales/coronavirus/1388265-410/muere-doctor-mario-benitez-honduras-covid-coronavirus,"Este sábado trascendió la muerte de otro médico hondureño a causa del COVID-19, se trata del conocido radiólogo Mario Benítez. El doctor Benítez trabajó por muchos años en el hospital Mario Catarino R",20-06-2020 15:46,https://www.bing.com/th?id=ON.B88850B75F02B0D39F486A256167635A,Chile,La Prensa Chicos
Pandemia amenaza recaudación tributaria de Honduras y le obliga a endeudarse,https://www.laprensa.hn/honduras/1388299-410/pandemia-amenaza-recaudacion-tributaria-honduras-endeudarse-,"La crisis económica de Honduras, que se ha agudizado con la pandemia de COVID-19, podría provocar una caída de hasta el 50 % de la recaudación tributaria en 2020 y un mayor endeudamiento del país para",20-06-2020 17:03,https://www.bing.com/th?id=ON.CBFE8B91AF7CF5E07944FD87A6339B4F,Chile,La Prensa Chicos
"Imparable Covid-19 en Honduras, más de 11 mil casos y 349 muertes",https://hondudiario.com/2020/06/19/imparable-covid-19-en-honduras-mas-de-11-mil-casos-y-349-muertes/,"El Sistema Nacional de Gestión de Riesgos (Sinager), confirmó este viernes, que Honduras sobrepasó los 11 mil casos de Covid-19, tras registrarse 519 contagios nuevos. En ese sentido, detalló que ya s",20-06-2020 18:03,https://www.bing.com/th?id=ON.3C019CD8151EF78FD1D18022122DED52,Chile,Hondudiario
Reynaldo Ekónomo: Siete miembros de mi familia tienen covid-19,https://www.elheraldo.hn/pais/1388340-466/reynaldo-ek%C3%B3nomo-siete-miembros-de-mi-familia-tienen-covid-19,"TEGUCIGALPA, HONDURAS.-El diputado nacionalista Reynaldo Ekónomo aseguró en redes sociales que siete miembros de su familia se han dado positivo a covid-19. ""Siete miembros de mi familia han sido cont",20-06-2020 20:39,https://www.bing.com/th?id=ON.67FDF88C634E3E1DD28823A02B25623C,Chile,El Heraldo
Establecen horarios para sepultar a víctimas de covid-19 en el Distrito Central,https://www.elheraldo.hn/tegucigalpa/1388345-466/honduras-coronavirus-muertos-entierros-tegucigalpa-horarios-cementerio-angeles,"TEGUCIGALPA, HONDURAS.-Después del calvario de una familia hondureña que permaneció durante varias horas afuera de un cementerio para sepultar a su pariente, víctima del covid-19, la Alcaldía Municipa",20-06-2020 21:44,https://www.bing.com/th?id=ON.961D7C13B3C5206C7EA41AA191E234A0,Chile,El Heraldo
"Unos 247 mil hondureños desplazados, en la mira por el coronavirus",https://hondudiario.com/2020/06/20/unos-247-mil-hondurenos-desplazados-en-la-mira-por-el-coronavirus/,"Este 20 de junio se conmemora el Día Mundial del Refugiado, una fecha que para más de 247 mil hondureños no solamente ocurre una vez al año, sino que es parte de su realidad. Datos de la Agencia de la",20-06-2020 22:01,https://www.bing.com/th?id=ON.AC1F50990EF5E52FD0981C828AAEF305,Chile,Hondudiario
Pandemia afecta terriblemente plan de selecciones menores: Daniel Uberti,https://www.diariomas.hn/2020/06/20/pandemia-afecta-terriblemente-plan-de-selecciones-menores-daniel-uberti/,"El uruguayo Daniel Uberti, director de selecciones menores de Honduras en plática con Deportes TNH lamentó que el trabajo de las distintas selecciones se ha venido abajo por el Covid-19, aunque recono",20-06-2020 22:08,https://www.bing.com/th?id=ON.9F328C4DB44FF3AEA5DB079D65F85C0D,Chile,Mas
Pastor coreano dona tres respiradores a embajador hondureño,https://www.latribuna.hn/2020/06/20/pastor-coreano-dona-tres-respiradores-a-embajador-hondureno/,"El Embajador de Honduras en Corea del Sur, Virgilio Paredes Trapero, recibió un importante donativo de tres respiradores del Pastor Ock Soo Park, para hondureños que se encuentran gravemente afectados",20-06-2020 22:09,https://www.bing.com/th?id=ON.2E8308FB1012618FABE9FD92821A233E,Chile,La Tribuna
