name,url,description,datePublished,imagen,pais,Fuente
Honduras no sabe si hay un rebrote del coronavirus,https://www.laprensa.hn/honduras/1406534-410/honduras-rebrote-coronavirus-pruebas-pcr-pandemia-,"La pandemia de COVID-19 en Honduras ha dejado en seis meses 2,000 muertos y más de 63,000 contagiados, según fuentes oficiales, sin que se vislumbre un claro descenso de la enfermedad, mientras que la",06-09-2020 22:23,https://www.bing.com/th?id=ON.E69BE43FDD09A852BD7FE2AD4CDDFD96,Chile,La Prensa Chicos
COVID-19 en Honduras: se reportan 50 nuevos casos positivos y 16 fallecimientos,https://www.diez.hn/coronavirus/1406860-441/covid-19-honduras-muertes-fallecimientos-casos-coronavirus-pandemia,"El Sistema Nacional de Gestión de Riesgos (SINAGER) anunció este lunes, 7 de septiembre, que de solo 281 pruebas realizadas para detectar el nuevo coronavirus, 50 dieron un resultado positivo y 231 di",07-09-2020 00:00,https://www.bing.com/th?id=ON.7BDD81D81D620946B7F7A1E02B0D897C,Chile,diez.hn
Positividad en pruebas de COVID-19 en Honduras es de más de 50 por ciento,https://proceso.hn/positividad-en-pruebas-de-covid-19-en-honduras-es-de-mas-de-50-por-ciento/,"Tegucigalpa – La positividad en las pruebas para detectar el COVID-19, en Honduras es de más del 50 por ciento, señaló el médico internista Elvin Omar Videa. Detalló que hasta la semana epidemiológica",07-09-2020 05:37,https://www.bing.com/th?id=ON.CE4740A05D97F5632FFA89084E50A2CD,Chile,Proceso
"Editorial HRN: Burocracia, injusticia salarial y finanzas en bancarrota en Honduras",https://www.radiohrn.hn/editorial-hrn-burocracia-injusticia-salarial-y-finanzas-en-bancarrota-en-honduras,"Tenemos una burocracia con un enorme y preocupante exceso de peso, una estructura salarial muy injusta y un déficit insostenible entre los ingresos y los gastos. “A pobre viene, quien gasta más de lo",07-09-2020 13:47,https://www.bing.com/th?id=ON.243FB928B75455756BB75DD3E6868E8F,Chile,Radio HRN
Según advierten especialistas: Depresión y delirios entre secuelas que causaría el COVID-19,https://www.latribuna.hn/2020/09/07/segun-advierten-especialistas-depresion-y-delirios-entre-secuelas-que-causaria-el-covid-19/,"En Honduras se registran más de 13,115 casos de personas que le han ganado la batalla al COVID-19, sin embargo, ¿qué secuelas deja esta enfermedad en quienes la padecen? La ansiedad, depresión, deliri",07-09-2020 14:01,https://www.bing.com/th?id=ON.BD5AF80C430920A7D46727F2AD1468AE,Chile,La Tribuna
Corea del Sur entrega equipo médico a Honduras,https://www.latribuna.hn/2020/09/07/corea-del-sur-entrega-equipo-medico-a-honduras/,"El Embajador Jae Hyun Shim, en representación de la Embajada de la República de Corea en Honduras, entregó este lunes una donación de 3 equipos médicos y 121 kits de extracción para realizar 46,464 pr",07-09-2020 17:56,https://www.bing.com/th?id=ON.E6A9524177FA4CAE9375C81D2AC0E415,Chile,La Tribuna
Cuatro decesos con sospecha de COVID-19 se reportan en dos hospitales de la capital,https://proceso.hn/solo-un-deceso-con-sospecha-de-covid-19-se-reporta-en-hospitales-de-la-capital/,"Tegucigalpa – Cuatro personas fallecieron bajo sospecha de COVID-19 este lunes en el Instituto Nacional Cardiopulmonar del Tórax y Hospital Escuela, mientras que el Hospital de Especialidades del Inst",07-09-2020 20:12,https://www.bing.com/th?id=ON.F6B0FFDE6B208C2B0B55DC750EA521EA,Chile,Proceso
Comisión Médica sugiere pruebas COVID un día antes a cada partido de Liga Nacional,https://hondudiario.com/2020/09/07/comision-medica-sugiere-pruebas-covid-un-dia-antes-a-cada-partido-de-liga-nacional/,"La Comisión Médica de la Liga Nacional, integrada por doctores de los 10 clubes, sugieren que se haga pruebas COVID-19 a los jugadores, un día antes de cada partido del torneo Apertura que arranca el",07-09-2020 20:32,https://www.bing.com/th?id=ON.26EF031ECF5B96F1F8325DAF525A98E0,Chile,Hondudiario
COVID-19 en Honduras: se reportarn 50 nuevos casos positivos y 16 fallecimientos,https://www.diez.hn/videos/mid-pBNLtzRS,Nuestras Secciones La Selección Liga Nacional Centroamérica Legionarios Fútbol Internacional No todo es fútbol Videos Sobre nosotros Servicio al Usuario Políticas de Privacidad Newsletter Mapa del sit,08-09-2020 03:44,https://www.bing.com/th?id=ON.A05551194CD3B2CBA15EF3E7E3F8E231,Chile,diez.hn
Hay que reconocer que el COVID-19 ha bajado: Carlos Umaña,http://www.elsoldehonduras.com/salud/hay-que-reconocer-que-el-covid-19-ha-bajado-carlos-umana/,"El presidente de la Asociación Médica del Instituto Hondureño de Seguridad Social (IHSS) de San Pedro Sula, Carlos Umaña, sostuvo que hay que reconocer que el COVID-19 ha bajado en el país, “pero el p",08-09-2020 06:00,https://www.bing.com/th?id=ON.B2A856728558458A2D86EB81237095E0,Chile,El Sol de Honduras
