name,url,description,datePublished,imagen,pais,Fuente
Honduras reporta más recuperados que infectados de coronavirus,https://www.laprensa.hn/honduras/1430220-410/honduras-recuperados-infectados-coronavirus-covid-19,El número total de personas que se han salvado de morir a causa del coronavirus en Honduras se elevó a 53.499.,18-12-2020 04:30,https://www.bing.com/th?id=OVFT.CZZRfZtSnnWUW29dn8uFCy,Chile,La Prensa Chicos
SINAGER anuncia recomendaciones y prohibiciones en fiestas navideñas ante aumento de casos de covid-19,http://www.elsoldehonduras.com/nacionales/sinager-anuncia-recomendaciones-y-prohibiciones-en-fiestas-navidenas-ante-aumento-de-casos-de-covid-19/,"El Sistema Nacional de Gestión de Riesgos (SINAGER) anunció este miércoles nuevas recomendaciones y prohibiciones con motivo de las fiestas navideñas, ante el aumento de los casos de covid-19 en el pa",18-12-2020 04:43,https://www.bing.com/th?id=OVFT.P3FH792Ix4cUXNONifBkly,Chile,El Sol de Honduras
Honduras reporta más recuperados que infectados de COVID-19 en últimas horas,https://proceso.hn/honduras-reporta-mas-recuperados-que-infectados-de-covid-19-en-ultimas-horas/,"Tegucigalpa – El número de pacientes recuperados de la pandemia de la COVID-19 en las últimas horas en Honduras ascendió a 554, frente a los 157 nuevos infectados con el coronavirus, informó este juev",18-12-2020 05:13,https://www.bing.com/th?id=OVFT.jOKUpXkM0o-pYK21w0-etC,Chile,Proceso
ASJ será veedor en compra de vacuna contra la covid-19 para garantizar transparencia,https://ultimahora.hn/asj-sera-veedor-en-compra-de-vacuna-contra-la-covid-19-para-garantizar-transparencia/,"El director ejecutivo de la Asociación para una Sociedad más Justa (ASJ), Carlos Hernández informó que estarán vigilante en la compra de la vacuna contra el covid-19 para Honduras. “Uno de los",18-12-2020 16:02,https://www.bing.com/th?id=OVFT.cR7dnjP6jUsgKo8WEYQIZi,Chile,Ultima Hora
"Honduras: en 10 meses, 54 médicos han muerto por Covid-19, confirma Salud",https://tiempo.hn/medicos-muertos-por-covid-19-honduras/,"TEGUCIGALPA, HONDURAS. Desde marzo de este año, mes en que inició la pandemia generada por la COVID-19 en en país, a la fecha, se han reportado la muerte de al menos 54 médicos a causa del mortal viru",18-12-2020 16:55,https://www.bing.com/th?id=OVFT.cVzLl64b1hHYxD9L3fuw0y,Chile,Tiempo
Empresa Privada reitera garantía de compra de 1.4 millones de vacunas contra el covid-19 para derechohabientes del IHSS,https://ultimahora.hn/empresa-privada-reitera-garantia-de-compra-de-1-4-millones-de-vacunas-contra-el-covid-19-para-derechohabientes-del-ihss/,Empresa Privada garantiza la compra de 1.4 millones de vacunas contra el covid-19 para los derechohabientes del Instituto ... casi 200 países y ya hay un precio convenido”. Detalló que Honduras fue el último en firmar el contrato con la farmacéutica ...,18-12-2020 19:32,https://www.bing.com/th?id=OVFT.-PBW0_LcSA34BpgP_ELzEC,Chile,Ultima Hora
"Crear vacuna contra el coronavirus ha sido un éxito a nivel mundial, según científico hondureño",https://hondudiario.com/2020/12/18/crear-vacuna-contra-el-coronavirus-ha-sido-un-exito-a-nivel-mundial-segun-cientifico-hondureno/,"El científico hondureño, Marco Tulio Medina, consideró que el proceso para encontrar una vacuna contra el Covid-19 ha sido exitoso a nivel mundial. “Desde el punto de vista científico el trabajo por c",18-12-2020 22:42,https://www.bing.com/th?id=OVFT.rKAc4xMRXpg_ku501MA5tC,Chile,Hondudiario
"El PMA entrega comida a 345.000 hondureños afectados por COVID-19, Eta e Iota",https://www.latribuna.hn/2020/12/18/el-pma-entrega-comida-a-345-000-hondurenos-afectados-por-covid-19-eta-e-iota/,Tegucigalpa.- El Programa Mundial de Alimentos (PMA) informó este viernes que continúa entregando comida a 345.000 personas en Honduras afectadas por la pandemia de COVID-19 y los severos daños que de,19-12-2020 02:09,https://www.bing.com/th?id=OVFT.1m3mKJ1Add-zU9KCHcwo8C,Chile,La Tribuna
Honduras añade 738 nuevos casos y 503 recuperados por COVID-19,https://proceso.hn/honduras-anade-738-nuevos-casos-y-503-recuperados-por-covid-19/,"Tegucigalpa – Honduras agregó este viernes 738 nuevos casos, llegando a un acumulado de 116 mil 212 infectados por COVID-19 en más de nueve meses de pandemia. El informe diario que proporciona el Sist",19-12-2020 02:25,https://www.bing.com/th?id=OVFT.Uul1NbYaCaFuyoxyVtPAHy,Chile,Proceso
Honduras supera las tres mil muertes por coronavirus,https://hondudiario.com/2020/12/18/honduras-supera-las-tres-mil-muertes-por-coronavirus/,"El Sistema Nacional de Gestión de Riesgos (Sinager), confirmó 738 nuevos casos de Covid-19 de 1,550 nuevas pruebas procesadas por el Laboratorio Nacional de Virología, para diagnosticar coronavirus haciendo un total de 116,212 casos confirmados ...",19-12-2020 03:07,https://www.bing.com/th?id=OVFT.Gj5GKgqbhKBTK2HlN7holy,Chile,Hondudiario
"Honduras llega a 3,023 muertes y supera los 116,000 contagios por covid-19",https://www.laprensa.hn/honduras/1430397-410/honduras-llega-muertes-supera-116000-contagios-covid-19,"La situación continúa siendo alarmante en Honduras, el tercer país de Centroamérica más afectado por la pandemia.",19-12-2020 03:28,https://www.bing.com/th?id=OVFT.w1h1vpv870rJePQPEiLXHi,Chile,La Prensa Chicos
ONU solicita a gobiernos que incluyan a migrantes en vacunación contra la COVID-19,https://tiempo.hn/onu-gobiernos-vacunacion-migrantes-covid-19/,"La OMS y la OIM, aglutinadas en la ONU, solicitaron a los gobiernos de todos los países que se incluya a los migrantes en la vacunación contra el COVID-19. TEGUCIGALPA, HONDURAS. Las agencias del sist",19-12-2020 03:57,https://www.bing.com/th?id=OVFT.gUniySBfQpkmfHyjzFxJgC,Chile,Tiempo
Gobierno activa proyecto Comedores Solidarios y Comida Caliente,http://www.elsoldehonduras.com/nacionales/gobierno-activa-proyecto-comedores-solidarios-y-comida-caliente/,"Tegucigalpa. El Gobierno del presidente Juan Orlando Hernández, a través de la Subsecretaría de Políticas Públicas, lanzó el proyecto Comedores Solidarios y Comida Caliente, que beneficiará a personas",19-12-2020 04:08,https://www.bing.com/th?id=OVFT.rcFhiIXHRp4GgKm9UFEfgC,Chile,El Sol de Honduras
"Los casos de coronavirus aumentan a 116,212 con 738 nuevos contagios",https://www.latribuna.hn/2020/12/18/los-casos-de-coronavirus-aumentan-a-116212-con-738-nuevos-contagios/,"Con 738 nuevos contagios confirmados, los casos de coronavirus en Honduras sumaron 116,212 desde el inicio de la pandemia, mientras que los pacientes recuperados aumentaron a 54,002, informó el Sistem",19-12-2020 04:28,https://www.bing.com/th?id=OVFT.rVD6FmN35nfVp6zjNae7MS,Chile,La Tribuna
