name,url,description,datePublished,imagen,pais,Fuente
Pandemia amenaza recaudación tributaria de Honduras y le obliga a endeudarse,https://proceso.hn/mas-noticias/32-m%C3%A1s-noticias/pandemia-amenaza-recaudacion-tributaria-de-honduras-y-le-obliga-a-endeudarse.html,"Tegucigalpa - La crisis económica de Honduras, que se ha agudizado con la pandemia de COVID-19, podría provocar una caída de hasta el 50 % de la recaudación tributaria en 2020 y un mayor endeudamiento del país para financiar en parte el gasto público ...",20-06-2020 15:53,https://www.bing.com/th?id=ON.DC4D4F9C7761FE33B674D79617FADDD0,Chile,Proceso
Ministerio Público inicia secuestro de documentación por compras en la pandemia,https://www.elheraldo.hn/pais/1391321-466/ministerio-p%C3%BAblico-inicia-secuestro-de-documentaci%C3%B3n-por-compras-en-la-pandemia,"Redacción 03.07.2020 TEGUCIGALPA, HONDURAS.-Para esclarecer 11 líneas de investigación ... de moradas de funcionarios vinculados a las compras de la emergencia de covid-19. LEA: Marco Bográn: 'Esa compañía proveedora no tiene nada que ver con ...",03-07-2020 13:16,https://www.bing.com/th?id=ON.0BD208AAFE20C0698FC26669B121C780,Chile,El Heraldo
Honduras cerca de las 600 muertes y del pico de la curva por coronavirus,https://www.laprensa.hn/honduras/1391354-410/honduras-salud-coronavirus-covid_19-hospitales-muertos-contagios,"Al borde de las 600 muertes confirmadas por coronavirus y 21,120 casos de contagio confirmados por coronavirus, Honduras se acerca al punto más alto de la pandemia según los médicos. ""Eso lo estamos v",03-07-2020 15:33,https://www.bing.com/th?id=ON.1F09568F9A7E1049D12CC5164E6A2B80,Chile,La Prensa Chicos
Sugiere científico: Honduras tiene que buscar el Remdesivir a través de la OMS,https://www.latribuna.hn/2020/07/03/sugiere-cientifico-honduras-tiene-que-buscar-el-remdesivir-a-traves-de-la-oms/,"El científico hondureño, Marco Tulio Medina, manifestó que por los buenos resultados del Remdesivir en pacientes con COVID-19, se debe tratar por medio de la Organización Mundial de la Salud (OMS), te",03-07-2020 16:01,https://www.bing.com/th?id=ON.169E249BF5FF7CF52ADB333B5FE5A309,Chile,La Tribuna
El Hospital Mario Catarino Rivas recibe 40 ventiladores mecánico-pulmonares para la sala de Covid-19,http://www.eldiario.hn/el-hospital-mario-catarino-rivas-recibe-40-ventiladores-mecanico-pulmonares-para-la-sala-de-covid-19/,San Pedro Sula.-El Hospital Mario Catarino Rivas recibió este jueves 40 ventiladores mecánico-pulmonares para las unidades de cuidados intensivos de pacientes con Covid-19. El equipo fue recibido por,03-07-2020 16:40,https://www.bing.com/th?id=ON.0F67824DBDC29D439705724482EFF18A,Chile,El Diario
Fallece periodista y abogado Pablo Gerardo Matamoros,https://www.latribuna.hn/2020/07/03/fallece-periodista-y-abogado-pablo-gerardo-matamoros/,"El abogado y jefe de prensa del canal de televisión “Hable Como Habla” (HCH), Pablo Gerardo Matamoros, murió ayer, en Tegucigalpa, tras haber sido diagnosticado positivo de COVID-19, desde hace dos se",03-07-2020 16:48,https://www.bing.com/th?id=ON.8A8AA76DD6175068D5787DE8E6143139,Chile,La Tribuna
Suspenden actividades en instituciones del Estado por COVID-19,https://www.laprensa.hn/honduras/1391374-410/actividades-suspendidas-instituciones-estado-corronavirus-honduras,"Las autoridades de Cancillería dijeron se mantendrán suspendidas hasta nuevo aviso. sobre todo en Francisco Morazán, donde funcionan la mayoría de las oficinas. Tegucigalpa, Honduras. La Secretaría de",03-07-2020 17:20,https://www.bing.com/th?id=ON.A050E5489041AFB24A9AB6792F2F1054,Chile,La Prensa Chicos
Con 6 Distritos Turísticos Honduras busca ser imán de viajeros en escenario post Covid-19,https://hondudiario.com/2020/07/03/con-6-distritos-turisticos-honduras-busca-ser-iman-de-viajeros-en-escenario-post-covid-19/,"Honduras se prepara para reactivar el turismo mediante el fortalecimiento de sus seis distritos en los que está dividido el territorio nacional. De acuerdo al portal de Forbes Centroamérica, el país p",03-07-2020 18:16,https://www.bing.com/th?id=ON.52E6630526907FB3262B18DC6B7EE241,Chile,Hondudiario
El COVID y la violencia enlutan al periodismo hondureño,https://www.proceso.hn/portadas/10-portada/el-covid-y-la-violencia-enlutan-al-periodismo-hondureno.html,"Tegucigalpa - El periodismo hondureño escribió otra página triste en su historia, luego que este jueves se confirmaron los decesos a causa del COVID-19, de los comunicadores Pablo Gerardo Matamoros y",03-07-2020 19:41,https://www.bing.com/th?id=ON.A1B065870BCAFADD78827D2B08F8CC87,Chile,Proceso
"Honduras debe buscar el Remdesivir para pacientes de Covid-19, según científico",https://hondudiario.com/2020/07/03/honduras-debe-buscar-el-remdesivir-para-pacientes-de-covid-19-segun-cientifico/,"El científico hondureño, Marco Tulio Medina, dio a conocer que Honduras debe buscar por medio de la Organización Mundial de la Salud (OMS) tener disponibilidad del Remdesivir por los buenos resultados",03-07-2020 20:26,https://www.bing.com/th?id=ON.C48F78AD34C7E2DF690D1FE8129A056E,Chile,Hondudiario
"Gonzalo Klusener, encantado con Motagua: “Desde el día que llegué me han tratado con cariño""",https://www.diez.hn/liganacionaldehonduras/1391451-498/gonzalo-klusener-encantado-con-motagua-criticas-edad-coronavirus-futuro,"El delantero argentino del Motagua, Gonzalo Klusener, revela cómo la ha pasado en tiempos de pandemia en Honduras y lo que le ha cambiado la vida de cara al futuro ya que las cosas será distinto despu",03-07-2020 22:36,https://www.bing.com/th?id=ON.8D572369B99DF50D17121972725A31D4,Chile,diez.hn
"Enfermo y en el olvido, el drama que vive el técnico Hermelindo Cantarero: ""No quiero morirme todavía""",https://www.diez.hn/liganacionaldehonduras/1391463-498/enfermo-olvido-drama-vive-tecnico-hermelindo-cantarero-coronavirus,"Llorando y con su voz bastante triste, estornuda y da gracias a Dios por estar vivo. Es el drama del entrenador hondureño y uno de los mejores busca-talentos que hay en el fútbol nacional. Hablamos de",03-07-2020 22:49,https://www.bing.com/th?id=ON.6FC4EBEB7613B4378E051607377BBE8C,Chile,diez.hn
El Presidente es quien debe nombrar el nuevo director o directora de Invest-H,http://www.elsoldehonduras.com/nacionales/el-presidente-es-quien-debe-nombrar-el-nuevo-director-o-directora-de-invest-h/,"El dirigente de la Asociación Nacional de Empleados Público de Honduras (Andeph), César Chirinos, manifestó que el presidente Juan Orlando Hernández es quien debe nombrar el nuevo director o directora",03-07-2020 23:50,https://www.bing.com/th?id=ON.7CCF83E0B6AFF220EE375414E4F025F5,Chile,El Sol de Honduras
Gobierno entregó Mascarillas a Asociaciones de Salones y Academias de Belleza,http://www.elsoldehonduras.com/nacionales/gobierno-entrego-mascarillas-a-asociaciones-de-salones-y-academias-de-belleza/,"Como parte de la operación ¨Todos Con Mascarilla¨, el Servicio Nacional de Emprendimiento y Pequeños Negocios (SENPRENDE) entregó 1,200 cubre bocas a dueñas de asociación de salones y academias de bel",03-07-2020 23:50,https://www.bing.com/th?id=ON.7A2C5BB556C95E9F19C1992C5452F35C,Chile,El Sol de Honduras
Honduras registra 996 nuevos casos y 14 muertes por coronavirus,https://radiohrn.hn/honduras-registra-996-nuevos-casos-y-14-muertes-por-coronavirus/,"Aumentan los casos, muertes y recuperados de coronavirus. La cifra de casos de coronavirus en Honduras llegó este viernes a 22,116 según datos de las autoridades del Sistema Nacional de Gestión de Rie",04-07-2020 02:47,https://www.bing.com/th?id=ON.DAF6F8B6E03874DE3808E16795CFAC6E,Chile,Radio HRN
Cuatro sacerdotes han dado positivo al coronavirus en Honduras,https://radiohrn.hn/cuatro-sacerdotes-han-dado-positivo-al-coronavirus-en-honduras/,Cuatro sacerdotes con covid-19 en el territorio hondureño. Cuatro sacerdotes han dado positivo a la prueba para detectar el coronavirus en Honduras. Así lo confirmó el portavoz de la Conferencia Episc,04-07-2020 02:47,https://www.bing.com/th?id=ON.E822B96E14F0CB9B7418EF7D52F98740,Chile,Radio HRN
