name,url,description,datePublished,imagen,pais,Fuente
UNAH da su aprobación para que el Estado compre la vacuna Sputnik V cuanto antes,https://hondudiario.com/2021/02/19/unah-da-su-aprobacion-para-que-el-estado-compre-la-vacuna-sputnik-v-cuanto-antes/,"El Comité Covid-19 de la Universidad Nacional Autónoma de Honduras (UNAH), informó mediante un comunicado, que da su aprobación para que el Gobierno compre la vacuna Sputnik V, tras analizar estudios",19-02-2021 17:00,https://www.bing.com/th?id=OVFT.yJnqBLZAkqn8HDKrcqGvsC,Chile,Hondudiario
Gobierno de Honduras también está negociando la vacuna Sputnik V para tener acceso pronto contra el Covid-19,https://www.vtv.com.hn/noticia/gobierno-de-honduras-tambien-esta-negociando-la-vacuna-sputnik-v-para-tener-acceso-pronto-contra-el-covid-19/,"El Gobierno de la República se encuentra negociando con las casas farmacéuticas Pfizer, Moderna y Sputnik V de Rusia para tener acceso inmediato a las vacunas contra el Covid-19. Con el fin de evitar",19-02-2021 21:20,https://www.bing.com/th?id=OVFT.aPxBH8Nwe0LtgYLk7D65ZS,Chile,VTV
"El personal de salud es prioridad en proceso de vacunación, reitera Gobierno",http://www.elsoldehonduras.com/salud/el-personal-de-salud-es-prioridad-en-proceso-de-vacunacion-reitera-gobierno/,"El Coordinador General de Gobierno, Carlos Madero, reiteró este jueves que el primer lote de vacunas que arribe al país será para inmunizar exclusivamente al personal de salud que está en primera líne",20-02-2021 03:10,https://www.bing.com/th?id=OVFT.BGintoBj6RiSm4diCd8q_S,Chile,El Sol de Honduras
Secretaría de Salud instalará nuevo centro de triaje en SPS,http://www.elsoldehonduras.com/salud/secretaria-de-salud-instalara-nuevo-centro-de-triaje-en-sps/,"Para seguir dando respuesta rápida a la población ante la emergencia por covid-19, autoridades de la Secretaría de Salud inspeccionaron este jueves el Parque Acuático Wonderland, en San Pedro Sula, do",20-02-2021 03:16,https://www.bing.com/th?id=OVFT.oheG4FqoBRjFkjhz7zd0Qy,Chile,El Sol de Honduras
Honduras supera los 164 mil contagiados por COVID-19,https://proceso.hn/honduras-supera-los-164-mil-contagiados-por-covid-19/,"Tegucigalpa – Honduras alcanzó este viernes los 164 mil 077 contagiados y tres mil 975 defunciones por COVID-19, según el reporte del Sistema Nacional de Gestión de Riesgos (Sinager). Se confirmó los",20-02-2021 03:56,https://www.bing.com/th?id=OVFT._Oq97II4At1X2v67Cf--pi,Chile,Proceso
6.000 Mipymes serán capacitadas con nuevo programa de formación en Economía Social de Mercado,http://www.eldiario.hn/6-000-mipymes-seran-capacitadas-con-nuevo-programa-de-formacion-en-economia-social-de-mercado/,"Tegucigalpa. - ""Este es el momento de salir adelante y de apoyar el comercio de país con artesanías, gastronomías, agricultura, turismo"", destacó hoy viernes el presidente Juan Orlando Hernández en el",20-02-2021 04:34,https://www.bing.com/th?id=OVFT.W7ZFoKayFguLLHIFxILkQC,Chile,El Diario
RICARDO ÁLVAREZ: «MAURICIO OLIVA ES EL MÉDICO QUE NECESITA HONDURAS PARA QUE TRAIGA MÁS RÁPIDO LAS VACUNAS AL PAÍS»,https://ultimahora.hn/ricardo-alvarez-mauricio-oliva-es-el-medico-que-necesita-honduras-para-que-traiga-mas-rapido-las-vacunas-al-pais/,"Ricardo Álvarez, invitó a que el día de las elecciones internas, los nacionalistas acudan a las urnas desde temprano a votar por Mauricio Oliva «él devolverá La Paz y tranquilidad». Precandidatos",20-02-2021 14:08,https://www.bing.com/th?id=OVFT.mUmihuWkZrsRsFG9zH2TgS,Chile,Ultima Hora
CN CONVOCA A PLENO PARA SESIONAR Y TRATAR TEMA DE REFORMA A LEY DE VACUNAS GRATUITAS CONTRA LA COVID-19,https://ultimahora.hn/cn-convoca-a-pleno-para-sesionar-y-tratar-tema-de-reforma-a-ley-de-vacunas-gratuitas-contra-la-covid-19/,"Este sábado el Congreso Nacional a convocado sesiones al pleno a la 1:00 de la tarde y el tema en la agenda es el decreto relacionado a la compra, adquisición de la vacuna contra el coronavirus.",20-02-2021 14:31,https://www.bing.com/th?id=OVFT.SBPGoOIV5_jlnWnsXC1sCC,Chile,Ultima Hora
Honduras: El BCIE anuncia rebaja a las tasas para préstamos,https://www.elheraldo.hn/economia/1444180-466/honduras-bcie-tasas-prestamos,La rebaja es de 0.10% y representa un ahorro de 10 millones de dólares al año en intereses para los países. También garantiza fondos para vacuna y mipymes,20-02-2021 15:13,https://www.bing.com/th?id=OVFT.c3RAQLEEjCPUCMasXzB7Py,Chile,El Heraldo
La vacunación contra la covid-19 avanza con desigualdad en América Latina,https://www.latribuna.hn/2021/02/20/la-vacunacion-contra-la-covid-19-avanza-con-desigualdad-en-america-latina/,"La vacunación contra la covid-19 en América Latina avanza de forma desigual, y si bien la caída en los contagios",20-02-2021 15:26,https://www.bing.com/th?id=OVFT.csZFcpVknaKNL0zkmuLVci,Chile,La Tribuna
En un 10% aumentó el ingreso de hondureñas a la prostitución a raíz de la crisis por covid-19,https://www.radiohrn.hn/en-un-10-aumento-el-ingreso-de-hondurenas-a-la-prostitucion-a-raiz-de-la-crisis-por-covid-19,"El trabajo sexual ha bajado debido a que los clientes no están buscando a las muchachas por el factor pandemia, según la Red",20-02-2021 15:40,https://www.bing.com/th?id=OVFT.HQXBWLti8l5O3pwM7ug3ci,Chile,Radio HRN
Mueren dos trabajadoras de la salud víctimas del coronavirus,https://www.elheraldo.hn/pais/1444186-466/honduras-personal-salud-victimas-covid,"Honduras no dispone de vacunas contra el covid-19 y mientras no se proteja a los trabajadores sanitarios en primera línea están expuestos a enfermarse TEGUCIGALPA, HONDURAS.- Las muertes de los profesionales de la salud a causa de las complicaciones por ...",20-02-2021 15:42,https://www.bing.com/th?id=OVFT.W7GZqZZTqn8TWR0oQBTCdi,Chile,El Heraldo
"Honduras registra 164,077 casos positivos de covid-19",https://www.laprensa.hn/honduras/1444252-410/honduras-registra-164077-casos-positivos-covid-19,"Sinager, a la vez, detalló que procesó 3,072 pruebas para detectar los 772 casos, en distintos departamentos del país. Honduras registra, con esto, 164,077 casos confirmados desde el inicio de la pand",20-02-2021 15:55,https://www.bing.com/th?id=OVFT.0Ce3C9KaylqjlXHRYAjX1C,Chile,La Prensa Chicos
COVID-19: Gustavo Boquín viaja a ser atendido en México; con este equipo lo tratarán,https://tiempo.hn/gustavo-boquin-invest-h-viajara-mexico-covid-19/,"Gustavo Boquín, interventor de INVEST-H, presenta complicaciones por COVID-19 y se estará tratando en México con equipo",20-02-2021 18:40,https://www.bing.com/th?id=OVFT.9Id1heYgWUBv26BWaw9icy,Chile,Tiempo
Cada hora se diagnostican 34 casos nuevos de COVID-19 en Honduras,https://proceso.hn/cada-hora-se-diagnostican-34-casos-nuevos-de-covid-19-en-honduras/,"Tegucigalpa – Durante los 50 días que han transcurrido de 2021, según los reportes oficiales del Sistema Nacional de Gestión de Riesgos (Sinager), uno de cada cuatro hondureños ha sido",20-02-2021 19:22,https://www.bing.com/th?id=OVFT.6FFyyMHaXU6NorcdELJuYi,Chile,Proceso
A MÉXICO POR COVID INTERVENTOR DE INVEST ¿POR QUÉ NO A HOSPITAL MÓVIL?,http://www.web.ellibertador.hn/index.php/noticias/nacionales/2702-a-mexico-por-covid-interventor-de-invest-por-que-no-a-hospital-movil,"En la misma semana que dejaron morir al estudiante hondureño de Medicina, Yasser Cuéllar, por falta de cupos en hospitales, el interventor de Invest-H, Gustavo Boquín, tendrá un tratamiento exclusivo",20-02-2021 20:02,https://www.bing.com/th?id=OVFT.anL04iswogajHRuv1FVKsS,Chile,El Libertador
Gustavo Boquín sería llevado a México por complicaciones de covid-19,https://www.laprensa.hn/honduras/1444297-410/interventor-gustavo-boquin-traslado-mexico-atencion-medica-complicaciones-covid,"Este sábado se conoció que Boquín sería trasladado en las próximas horas a México para recibir una mejor asistencia médica, pues ya tiene más de una semana de estar luchando contra el virus en su cuer",20-02-2021 20:07,https://www.bing.com/th?id=OVFT.gtnyzzY7kv7vbpl_cdOtMy,Chile,La Prensa Chicos
El capitán Ever Alvarado ha renovado su contrato con Olimpia y se queda por dos años más,https://www.diez.hn/liganacionaldehonduras/1444299-498/capitan-ever-alvarado-renovado-contrato-olimpia-pedro-troglio-honduras,Alvarado había venido de una lesión en el torneo pasado y reapareció en la final. Recientemente se recuperó del COVID-19 que lo contrajo cuando disputó la Liga Concacaf en Costa Rica,20-02-2021 20:12,https://www.bing.com/th?id=OVFT.sItBIBoGlhhLcvdMCfKvqi,Chile,diez.hn
El capitán Ever Alvarado ha renovado su contrato con Olimpia y se queda año y medio más de blanco,https://www.diez.hn/liganacionaldehonduras/1444299-498/capitan-ever-alvarado-renovado-contrato-olimpia-pedro-troglio-tres-torneos,Alvarado había venido de una lesión en el torneo pasado y reapareció en la final. Recientemente se recuperó del COVID-19 que lo contrajo cuando disputó la Liga Concacaf en Costa Rica,20-02-2021 20:20,https://www.bing.com/th?id=OVFT.sItBIBoGlhhLcvdMCfKvqi,Chile,diez.hn
Crecimiento económico depende de la vacuna contra Covid-19: CHE,https://hondudiario.com/2021/02/20/crecimiento-economico-depende-de-la-vacuna-contra-covid-19-che/,"El presidente del Colegio Hondureño de Economistas (CHE), Helmis Cárdenas, manifestó que contar con una vacuna contra el Covid-19 es vital para la recuperación económica en el país. Inidicó que el Ban",20-02-2021 20:53,https://www.bing.com/th?id=OVFT.g-JbvJJj_S2yg4Wd8Wn9RC,Chile,Hondudiario
HONDURAS / ¡URGENTE! CONGRESO APRUEBA “CHEQUE EN BLANCO” PARA VACUNAS,http://www.web.ellibertador.hn/index.php/noticias/nacionales/2703-honduras-urgente-congreso-aprueba-cheque-en-blanco-para-vacunas,"El Congreso Nacional ha aprobado este sábado una serie de reformas a la “Ley de Vacunas” que, según denuncias de diputados de oposición, es un “cheque en blanco” para la Agencia de Regulación Sanitari",20-02-2021 22:00,https://www.bing.com/th?id=OVFT.p0tjCJIC_eJ_ykwn8WPJiC,Chile,El Libertador
Más de 100 abogados han muerto en Honduras durante la pandemia,https://www.radiohrn.hn/mas-de-100-abogados-han-muerto-en-honduras-durante-la-pandemia,Honduras ya contabiliza un total de 164 mil 077 personas infectadas de coronavirus a nivel nacional El covid-19 también enluta a los abogados hondureños. Un total de 141 togados han fallecido desde ma,20-02-2021 22:36,https://www.bing.com/th?id=OVFT.7vVPnkP3xkJtgIlcf4mbai,Chile,Radio HRN
BCH: Economía de Honduras se contrajo 8.5 % en 2020: ¿cuál es el impacto en cada sector?,https://tiempo.hn/bch-economia-honduras-contrajo-8-5-2020/,"TEGUCIGALPA, HONDURAS. En 8.5 % se contrajo la economía de Honduras en 2020 debido al impacto de la pandemia de COVID-19 y los efectos de las tormentas tropicales Eta y Iota. Así lo informó el jueves",21-02-2021 01:01,https://www.bing.com/th?id=OVFT.MND2EgBeAS5PzNFMdxUoxy,Chile,Tiempo
BCIE anuncia $100 millones para Honduras para compra de vacuna,https://www.latribuna.hn/2021/02/20/bcie-anuncia-100-millones-para-honduras-para-compra-de-vacuna/,"El presidente del Banco Centroamericano de Integración Económica (BCIE), Dante Mossi, anunció este sábado 100 millones de dólares disponibles para",21-02-2021 01:40,https://www.bing.com/th?id=OVFT.dPdch2o1fBsY9ks955Cr8y,Chile,La Tribuna
