name,url,description,datePublished,imagen,pais,Fuente
"Honduras acumula 199 muertes por Covid-19 y 4,886 casos",https://www.laprensa.hn/videos/?mId=I894Q1jz&c=US&c=US&c=US&c=US&c=U,"El Laboratorio Nacional de Virología de Honduras informó este viernes que el país registra 3 nuevas muertes por Covid-19 y 134 casos nuevos de la enfermedad, catalogada como pandemia por la Organizaci",30-05-2020 02:34,https://www.bing.com/th?id=ON.F36DAF7731A74835BA4FA6EFB5822F21,Chile,La Prensa Chicos
Honduras y BID crean el Observatorio de Precios para Bienes Esenciales ante emergencia,https://www.laprensa.hn/especiales/coronavirus/1383273-410/honduras-bid-obervatorio-precios-bienes-esenciales-emergencia,"La autoridades de Gobierno informaron que con esa herramienta se busca una mayor transparencia en el uso de los recursos públicos. Tegucigalpa, Honduras. Con colaboración del Banco Interamericano de D",30-05-2020 13:52,https://www.bing.com/th?id=ON.EEF2BE1AB3ED938B448ABF022E76E914,Chile,La Prensa Chicos
Solitario entierro de paciente de Covid-19 estrangulado en el San Felipe,https://www.elheraldo.hn/sucesos/1383287-466/entierro-estrangulado-hospital-san-felipe-covid19-honduras,"TEGUCIGALPA, HONDURAS.-Bajo el protocolo de seguridad y en compañía de pocos parientes, la mañana de este sábado fue enterrado José Francisco Ferrufino Turcios, el hombre que falleció estrangulado en",30-05-2020 15:41,https://www.bing.com/th?id=ON.7D5D82EA1AA8A2E41340465D55FC9D3E,Chile,El Heraldo
Alto nivel de contagio por coronavirus en Cortés: hay más pruebas positivas que negativas,https://www.elheraldo.hn/especiales/coronavirus/1383314-528/coronavirus-cortes-pruebas-positivas,"TEGUCIGALPA, HONDURAS.-El Covid-19 es una enfermedad silenciosa. Sus síntomas pueden confundirse con una simple gripe que ataca poco a poco el organismo y, en muchos casos, puede llegar a ser mortal.",30-05-2020 17:43,https://www.bing.com/th?id=ON.5364158CC4644B24A93DE34039B4929F,Chile,El Heraldo
Análisis | Los discursos de la corrupción y de la falta…,https://elpatriota.hn/2020/05/30/analisis-los-discursos-de-la-corrupcion-y-de-la-falta-de-transparencia-en-el-contexto-covid19/,"Se te ha enviado una contraseña por correo electrónico. Uno de los voceros de la MACCIH, Luis Guimaraez Marey, acuñó la frase que la corrupción en Honduras “es a cielo abierto”, porque se hace dejando",30-05-2020 19:57,https://www.bing.com/th?id=ON.9305D47BBAFEFCE8B224086173FBD291,Chile,El Patriota
"Covid-19 en el Triángulo Norte: Honduras lidera en muertes y casos, rezagado en recuperaciones y pruebas",https://hondudiario.com/2020/05/29/covid-19-en-el-triangulo-norte-honduras-lidera-en-muertes-y-casos-rezagado-en-recuperaciones-y-pruebas/,"Honduras tiene la mayor cantidad de muertes y casos confirmados de COVID-19 de los países del triángulo norte, esto según datos recopilados de la Universidad John Hopkins de Estados Unidos. Los casos",30-05-2020 20:00,https://www.bing.com/th?id=ON.E3E462FA21003473FA7956B173FB3BDF,Chile,Hondudiario
Honduras suma 199 muertos y 4.886 contagiados con COVID-19,https://www.latribuna.hn/2020/05/30/honduras-suma-199-muertos-y-4-886-contagiados-con-covid-19/,"Los muertos a causa de la pandemia del COVID-19 en Honduras ya suman 199, mientras que los casos de contagiados ascendieron a 4.886, informó este viernes el estatal Sistema Nacional de Gestión de Ries",30-05-2020 21:13,https://www.bing.com/th?id=ON.72B55789A29367309DC55804FDD0D69B,Chile,La Tribuna
"Hondureño recuperado de coronavirus con Maíz: “Ese tratamiento es milagroso, Dios me regaló otra vida”",https://radiohrn.hn/hondureno-recuperado-de-coronavirus-con-maiz-ese-tratamiento-es-milagroso-dios-me-regalo-otra-vida/,"Cerrato dijo que el 10 de mayo comenzó a sentir los primeros síntomas del coronavirus, una fiebre de 38 grados y de ese momento fue aislado. Manuel Cerrato, es el primer hondureño que se ha recuperado",30-05-2020 21:40,https://www.bing.com/th?id=ON.A01ABFBD877D4B85565B0097DB8E80CB,Chile,Radio HRN
"Roxana Araujo: “Se volvió caro el examen del coronavirus en las clínicas privadas, así como es el sapo es la pedrada”",https://radiohrn.hn/roxana-araujo-se-volvio-caro-el-examen-del-coronavirus-en-las-clinicas-privadas-asi-como-es-el-sapo-es-la-pedrada/,"Roxana Araujo, epidemióloga y exministra de Salud. La epidemióloga y exministra de Salud, Roxana Araujo, comentó en Diario Matutino de HRN que el examen para detectar el coronavirus se ha vuelto caro",30-05-2020 21:40,https://www.bing.com/th?id=ON.A10737EDD81F61C5C6F3B24F294FA6F0,Chile,Radio HRN
Honduras da inicio al ensayo clínico “Solidaridad”,http://www.elsoldehonduras.com/salud/honduras-da-inicio-al-ensayo-clinico-solidaridad/,"Autoridades de la Secretaría de Salud comprometidas con la población este día presentaron formalmente el inicio del ensayo clínico para tratar a los pacientes con COVID-19, el cual está coordinado por",30-05-2020 22:27,https://www.bing.com/th?id=ON.B8F7CCC552093CBBCB30B6F9E393AB60,Chile,El Sol de Honduras
Presidente Hernández felicita a Sinager de Comayagua por acciones de contención del coronavirus,http://www.elsoldehonduras.com/nacionales/presidente-hernandez-felicita-a-sinager-de-comayagua-por-acciones-de-contencion-del-coronavirus/,Comayagua. El presidente Juan Orlando Hernández felicitó al equipo que conforma el Sistema Nacional de Gestión de Riesgo (Sinager) de la seccional de Comayagua por las acciones implementadas para la c,30-05-2020 22:43,https://www.bing.com/th?id=ON.20F2D657B89E329F837118710F1A7E3E,Chile,El Sol de Honduras
"Honduras con 4,886 casos positivos y 199 muertes por Covid-19",https://hondudiario.com/2020/05/29/honduras-con-4886-casos-positivos-y-199-muertes-por-covid-19/,"El Sistema Nacional de Gestión de Riesgos (Sinager), informó este viernes de 134 casos nuevos de Covid-19 para un total de 4886 contagiados, así como 3 muertes más, sumando ya 199. Para este día se re",30-05-2020 23:01,https://www.bing.com/th?id=ON.DAD6D766ED2974D7B7DC13C708583A1B,Chile,Hondudiario
