name,url,description,datePublished,imagen,pais,Fuente
"Honduras registra 4,401 infectados por covid-19 y 188 fallecidos",https://radiohrn.hn/honduras-registra-4401-infectados-por-covid-19-y-188-fallecidos/,"El Sistema Nacional de Gestión de Riesgos (Sinager), confirmó el martes 26 de mayo 212 nuevos casos positivos de covid-19, elevándose la cifra de infectados a 4,401 los infectados. En ese sentido, se",27-05-2020 16:28,https://www.bing.com/th?id=ON.0B279466C67BDBF306DB1519809A4A2F,Chile,Radio HRN
"Crisis por Covid-19: Sin dinero para alquiler, hondureños viven en medianas o puentes",https://www.elheraldo.hn/pais/1382539-466/crisis-por-covid-19-sin-dinero-para-alquiler-hondure%C3%B1os-viven-en-medianas-o,"TEGUCIGALPA, HONDURAS.-Un pedazo de sofá amarrado con una cabuya a un árbol, un par de cobijas empapadas por la lluvia, dos bolsas negras con ropa vieja y un fogón improvisado con ladrillos a la par d",27-05-2020 19:12,https://www.bing.com/th?id=ON.77D293B214ABF60A65FCAB3E96484654,Chile,El Heraldo
Embajada de Estados Unidos en Honduras habilita nuevos vuelos comerciales,https://www.laprensa.hn/honduras/1382675-410/embajada-estados-unidos-honduras-coronavirus-pandemia-crisis,"Tome nota de las fechas y de quiénes pueden acceder a estos vuelos, que se realizarán a través de United Airlines y Spirit Airlines. Tegucigalpa, Honduras. La Embajada de Estados Unidos (EEUU) en Hond",27-05-2020 22:01,https://www.bing.com/th?id=ON.5979D16CCC51347FDAED2A446A551CD5,Chile,La Prensa Chicos
Suspenden uso de hidroxicloroquina en Honduras por advertencia de OMS,https://www.elheraldo.hn/pais/1382540-466/suspenden-uso-de-hidroxicloroquina-en-honduras-por-advertencia-de-oms,"TEGUCIGALPA, HONDURAS.-La Secretaría de Salud no aplicará la hidroxicloroquina en pacientes con Covid-19, tal y como lo contemplaba la implementación en el país del ensayo clínico internacional llamad",27-05-2020 22:40,https://www.bing.com/th?id=ON.2946D6931924FB23E31213F8DB4859FE,Chile,El Heraldo
Según científico: «Clínica del Polideportivo debe abrirse en los siguientes días»,https://www.latribuna.hn/2020/05/27/segun-cientifico-clinica-del-polideportivo-debe-abrirse-en-los-siguientes-dias/,"El científico hondureño, Marco Tulio Medina, manifestó hoy que la clínica de COVID-19 del Polideportivo de la Universidad Nacional Autónoma de Honduras (UNAH), debe abrirse en los próximos días. Y es",27-05-2020 23:13,https://www.bing.com/th?id=ON.0E40CF60D91FE163ED6ED83877B78ABE,Chile,La Tribuna
Honduras: Salud asegura que la ocupación hospitalaria de pacientes con covid-19 está en un 40 por ciento,https://radiohrn.hn/honduras-salud-asegura-que-la-ocupacion-hospitalaria-de-pacientes-con-covid-19-esta-en-un-40-por-ciento/,"El viceministro de Salud, Roberto Cosenza, confirmó que hasta el momento los hospitales del país no han colapsado. En un 42.75 por ciento se encuentra la ocupación hospitalaria de pacientes con covid-",27-05-2020 23:55,https://www.bing.com/th?id=ON.7DBF452698348AFC0977CEAAA7836774,Chile,Radio HRN
Siguen aumentando el coronavirus en Honduras; se reportan 239 nuevos contagiados,https://www.diez.hn/coronavirus/1382744-441/siguen-aumentando-el-coronavirus-en-honduras-se-reportan-239-nuevos-contagiados,"Con este número se llegan a 4,640 casos; además de seis fallecidos y estamos a punto de llegar a los 200 decesos El coronavirus sigue cobrando la vida de muchos hondureños. Este miércoles se ha confir",28-05-2020 01:08,https://www.bing.com/th?id=ON.B66E13A39FAB901F4D5213BEB805424A,Chile,diez.hn
Siguen aumentando los contagiados de Covid-19 en Honduras; se reportan 239 nuevos casos,https://www.diez.hn/coronavirus/1382744-441/siguen-aumentando-los-contagiados-de-covid-19-en-honduras-se-reportan-239-nuevos,"Con este número se llegan a 4,640 casos; además de seis fallecidos y estamos a punto de llegar a los 200 decesos El coronavirus sigue cobrando la vida de muchos hondureños. Este miércoles se ha confir",28-05-2020 01:12,https://www.bing.com/th?id=ON.B66E13A39FAB901F4D5213BEB805424A,Chile,diez.hn
"Por cumplimiento de la información en el portal “Emergencia COVID-19”, BANASUPRO recibe reconocimiento",https://hondudiario.com/2020/05/27/por-cumplimiento-de-la-informacion-en-el-portal-emergencia-covid-19-banasupro-recibe-reconocimiento/,"El Instituto de Acceso a la Información Pública (IAIP), otorgó un reconocimiento a la Suplidora Nacional de Productos Básicos (BANASUPRO). El diploma se otorga por el cumplimiento de la información de",28-05-2020 01:23,https://www.bing.com/th?id=ON.AAA115D6CD0553C3EE9E38A94D07FFB1,Chile,Hondudiario
"ONU recuerda a Honduras que ya le otorgó 85,000 pruebas para Covid-19",https://hondudiario.com/2020/05/27/onu-recuerda-a-honduras-que-ya-le-otorgo-85000-pruebas-para-covid-19/,"El secretario general de la Organización de las Naciones Unidas (ONU) António Guterres, le respondió a la embajadora hondureña Mary Elizabeth Flores, sobre sus peticiones de ayuda para atender el Covi",28-05-2020 01:34,https://www.bing.com/th?id=ON.FC9B06FD231F9C36A28CCA3B2714090C,Chile,Hondudiario
Muertes por COVID-19 en Honduras aumentan a 194,https://www.laprensa.hn/videos/?mId=8dUIB4r2&seccion=ultimosvideos&c,"Honduras registró este miércoles 27 de mayo 239 nuevos casos de coronavirus COVID-19, lo que aumenta a 4,640 la cifra de personas contagiadas con el virus.",28-05-2020 01:52,https://www.bing.com/th?id=ON.645FC079575131490502BEF0A6E70B13,Chile,La Prensa Chicos
"Gobierno gestionado repatriación de más de 6,600 hondureños",https://www.latribuna.hn/2020/05/27/gobierno-gestionado-repatriacion-de-mas-de-6600-hondurenos/,"Ante la crisis mundial provocada por la pandemia del coronavirus (COVID – 19), el gobierno de Honduras gestionó, hasta la fecha, la repatriación de 6,630 hondureños desde 23 naciones o cruceros, según",28-05-2020 04:06,https://www.bing.com/th?id=ON.40CB9CCAA2B72D4056C195B968FD276F,Chile,La Tribuna
