name,url,description,datePublished,imagen,pais,Fuente
"Lobos – Motagua, reactivan la Liga Nacional",https://www.diariomas.hn/2020/09/26/lobos-motagua-reactivan-la-liga-nacional/,"El fútbol vuelve a casa, después de seis meses de incertidumbre y ansiedad por disfrutar de un partido de nuestra Liga Profesional que había tenido",26-09-2020 15:00,https://www.bing.com/th?id=OVFT.4MVqiExOYTDYRAWQdLk3bi,Chile,Mas
Primer clásico en plena pandemia,https://www.diariomas.hn/2020/09/27/primer-clasico-en-plena-pandemia/,La emoción del fútbol de la Liga Profesional de Honduras continúa esta noche con el primer clásico de la temporada en medio de la pandemia de la Covid,27-09-2020 15:01,https://www.bing.com/th?id=OVFT.owdRjxyRhmWBHmaOctHlxS,Chile,Mas
"""Santuario Alimentario"" dará vigilancia contra COVID-19 a productores agrícolas",https://www.latribuna.hn/2020/09/29/santuario-alimentario-dara-vigilancia-contra-covid-19-a-productores-agricolas/,"DANLÍ, El Paraíso. Más de 20 mil productores del valle de Jamastrán recibirán vigilancia epidemiológica mediante el proyecto “Santuario Alimentario” que coordina Sir Salvador Moncada y otros cooperant",29-09-2020 09:08,https://www.bing.com/th?id=OVFT.bKTM4G_aWwPiq1qWKgF01y,Chile,La Tribuna
Generador retrasa hospital móvil de Tegucigalpa,https://www.elheraldo.hn/pais/1411738-466/generador-retrasa-hospital-m%C3%B3vil-de-tegucigalpa,"TEGUCIGALPA, HONDURAS.- Sin una fecha de entrega definida, con algunos contratiempos y el 80 por ciento de la instalación física terminada avanza el hospital móvil de Tegucigalpa. El de San Pedro Sula",29-09-2020 14:18,https://www.bing.com/th?id=OVFT.ZHlRt_cumFUaaA2T2ch-aC,Chile,El Heraldo
Cinco personas fallecen por COVID-19 en Tegucigalpa,https://proceso.hn/tres-personas-fallecen-por-covid-19-en-el-ihss-y-hospital-escuela/,"Tegucigalpa – Una persona falleció bajo sospecha de COVID-19 en el Hospital de Especialidades del Instituto Hondureño de Seguridad Social (IHSS), dos en el Hospital Escuela (HE) y dos en Instituto Nac",29-09-2020 14:30,https://www.bing.com/th?id=OVFT.sTlMANTzgGz1Gl8iOQTc2S,Chile,Proceso
Embajada de Estados Unidos respalda labor del fiscal general en su trabajo contra la corrupción y fortalecimiento institucional,https://ultimahora.hn/embajada-de-estados-unidos-respalda-labor-del-fiscal-general-en-su-trabajo-contra-la-corrupcion-y-fortalecimiento-institucional/,"La embajada de Estados Unidos en Tegucigalpa manifestó su apoyo al fiscal general Oscar Fernando Chinchilla por su trabajo para fortalecer las instituciones y el estado de derecho en Honduras, así",29-09-2020 15:17,https://www.bing.com/th?id=OVFT.Q1SUCnOQwID6V8XAMgtzOi,Chile,Ultima Hora
Relajación de población puede causar rebrotes del coronavirus en Honduras,https://proceso.hn/relajacion-de-poblacion-puede-causar-rebrotes-del-coronavirus-en-honduras/,"Tegucigalpa – La relajación de la población de Honduras en lo que respecta a las medidas de bioseguridad puede propiciar rebrotes del coronavirus SARS-CoV-2 en el país centroamericano, alertó el cient",29-09-2020 15:21,https://www.bing.com/th?id=OVFT.p2kvhRoLRbgyhrNyFMpODi,Chile,Proceso
Confirmados cinco decesos por coronavirus en hospitales de la capital,https://hondudiario.com/2020/09/29/confirmados-cinco-decesos-por-coronavirus-en-hospitales-de-la-capital/,"Un total de cinco personas han perdido la vida en las últimas horas por sospechas de Covid-19, al interior de los principales centros de asistenciales de Tegucigalpa, capital de Honduras Según la info",29-09-2020 16:27,https://www.bing.com/th?id=OVFT._LTD6SZHIGaNkL_BJFpviS,Chile,Hondudiario
En FOROS HRN - TSi: Expertos plantean reorientar presupuesto para Educación y evaluar retorno a clases,https://www.radiohrn.hn/en-foros-hrn-tsi-expertos-plantean-reorientar-presupuesto-para-educacion-y-evaluar-retorno-a-clases,"Los grandes retos de la educación en la actual pandemia tienen que ver con la cobertura, la evaluación, la formación docente y el reintegro de los alumnos.",29-09-2020 17:02,https://www.bing.com/th?id=OVFT.4Z7X1BYwTCOPXMpvqC402y,Chile,Radio HRN
"El COVID-19 ha cegado la vida de 62 niños, adolescentes y jóvenes en Honduras",https://www.laprensa.hn/honduras/1411849-410/coronavirus-honduras-menores-ni%C3%B1os-ni%C3%B1as-jovenes-adolescentes-pandemia,"Del total de casos de COVID-19 registrados a la fecha en el país, 25,079 tienen que ver con niños, niñas, adolescentes y jóvenes.",29-09-2020 18:45,https://www.bing.com/th?id=OVFT.o2ixVoQmv7b5_qE8lfiRXS,Chile,La Prensa Chicos
Gildan y World Vision entregan 96.000 cuadernos de trabajo para alumnos sin acceso a internet,http://www.eldiario.hn/gildan-y-world-vision-entregan-96-000-cuadernos-de-trabajo-para-alumnos-sin-acceso-a-internet/,"San Pedro Sula.- La Dirección Departamental de Educación de Cortés recibió de Gildan y Word Vision Honduras, la donación de 96,000 cuadernos de trabajo para aquellos alumnos que no tienen acceso al se",29-09-2020 20:58,https://www.bing.com/th?id=OVFT.35NaIceT7g9XUuuoDc0BRC,Chile,El Diario
El podcast con las noticias de Honduras y el mundo del martes 29 de septiembre,https://www.laprensa.hn/podcasts/1411945-410/noticias-honduras-coronavirus-hospitales-covid-19-vacuna-estados-unidos-onu-suarez,"Podcast con el resumen de noticias que fueron tendencia en Honduras y el mundo el martes 29 de septiembre. San Pedro Sula, Honduras Este es el resumen de las principales noticias de Honduras y el mund",29-09-2020 23:35,https://www.bing.com/th?id=OVFT.wYE8M4XWn7wN0aDk6nsQ5C,Chile,La Prensa Chicos
Honduras supera los 76 mil contagios entre demandas de aplicar más pruebas,https://hondudiario.com/2020/09/29/honduras-supera-los-76-mil-contagios-entre-demandas-de-aplicar-mas-pruebas/,"El Sistema Nacional de Gestión de Riesgos (Sinager), informó este martes que de 943 pruebas para diagnosticar Covid-19 en el país, 561 dieron positivo, sumando así un total de 76,098 casos de coronavi",30-09-2020 02:54,https://www.bing.com/th?id=OVFT.OTe5SHisAfVbhRnJn1YyRS,Chile,Hondudiario
"Honduras acumula 76,098 casos de covid-19 y 2,323 decesos",https://www.elheraldo.hn/pais/1411971-466/honduras-acumula-nuevos-casos-covid-19-nuevos-decesos,"Desde el comienzo de la epidemia más de 33,162.930 personas contrajeron la enfermedad en todo el mundo, Honduras se acerca a los 80 mil casos en seis meses desde el registro del primer contagio",30-09-2020 03:58,https://www.bing.com/th?id=OVFT.fZYd4Nb3Pt2OSYK4ErlhKy,Chile,El Heraldo
Melodía coreana que resuena en Honduras,https://www.latribuna.hn/2020/09/30/melodia-coreana-que-resuena-en-honduras/,"El embajador, Jae Hyun Shim, en representación de la embajada de la República de Corea en Honduras, firmó un Memorando de Entendimiento (MoU) con la Dirección Ejecutiva de Cultura y Artes (DECA). Por",30-09-2020 07:21,https://www.bing.com/th?id=OVFT.ekDfdg9MKz2IvR8B2f87-i,Chile,La Tribuna
Editorial HRN: El sistema educativo hondureño en tiempos de pandemia,https://www.radiohrn.hn/editorial-hrn-el-sistema-educativo-hondureno-en-tiempos-de-pandemia/,"Los grandes retos de la educación en la actual pandemia tienen que ver con la cobertura, la evaluación, la formación docente y el reintegro de los alumnos que están desconectados de las plataformas te",30-09-2020 14:02,https://www.bing.com/th?id=OVFT.nuNhVNUno51cwyNGV653Ry,Chile,Radio HRN
