name,url,description,datePublished,imagen,pais,Fuente
"Honduras registra 29,011 infectados y 487 fallecidos por covid en lo que va de 2021",https://www.radiohrn.hn/honduras-registra-29011-infectados-y-487-fallecidos-por-covid-en-lo-que-va-de-2021,Honduras se acerca rápidamente a los 155 mil infectados por covid-19 desde el inicio de la pandemia en 2020 Honduras registró el domingo (07.02.2021) a través del Sistema Nacional de Gestión de Riesgo,08-02-2021 04:06,https://www.bing.com/th?id=OVFT.N9emmjBtJA_EpDNHDsjUuC,Chile,Radio HRN
FINANZAS: HONDURAS YA TIENE FIRMADOS 5 ACUERDOS DE CONFIDENCIALIDAD CON LABORATORIOS PARA ADQUIRIR DIRECTAMENTE VACUNAS CONTRA COVID-19,https://ultimahora.hn/finanzas-honduras-ya-tiene-firmados-5-acuerdos-de-confidencialidad-con-laboratorios-para-adquirir-directamente-vacunas-contra-covid-19/,"El Gobierno tiene firmados cinco acuerdos de confidencialidad con casas farmacéuticas para asegurar vacunas contra la covid-19 para el restante 81 % de la población hondureña, reiteró el ministro",08-02-2021 14:54,https://www.bing.com/th?id=OVFT.54b_vw7L6v6rAjYjffbqTi,Chile,Ultima Hora
Así será la circulación por dígito en 4 departamentos de Honduras,https://www.radiohrn.hn/coronavirus-asi-sera-la-circulacion-en-4-departamentos-de-honduras-y-medidas-de-restriccion-por-alza-de-casos-de-covid,Conoce el calendario de circulación para el sábado 13 y domingo 14 de febrero; y para el sábado 20 y domingo 21 de febrero de 2021 en estas zonas del país,08-02-2021 15:20,https://www.bing.com/th?id=OVFT.NBGGGIS7IjVrfFOhi1qSYC,Chile,Radio HRN
"Con 663 nuevos contagios, aumentan a 154.568 los casos de covid-19",http://www.elsoldehonduras.com/salud/con-663-nuevos-contagios-aumentan-a-154-568-los-casos-de-covid-19/,"Los casos de covid-19 en Honduras se elevaron hoy a 154.568 desde el inicio de la pandemia con la confirmación de otros 663 contagios, mientras que los pacientes recuperados aumentaron a 61.817, infor",08-02-2021 18:01,https://www.bing.com/th?id=OVFT.QrmV-9hH7ODZvg-_kcwaJy,Chile,El Sol de Honduras
Honduras aboga ante la OMS para asegurar obtención del mayor número de vacunas,https://hondudiario.com/2021/02/08/honduras-aboga-ante-la-oms-para-asegurar-obtencion-del-mayor-numero-de-vacunas/,*** El mandatario hondureño aboga ante la OMS para que se asegure la obtención del mayor número de vacunas para el país. El presidente Juan Orlando Hernández abogó este lunes ante el director general,08-02-2021 18:56,https://www.bing.com/th?id=OVFT.EvJwtk0r_WEhtlAO_hsUQi,Chile,Hondudiario
Muere otro médico por COVID-19 en SPS.,https://www.latribuna.hn/2021/02/08/muere-otro-medico-por-covid-19-en-sps/,"El presidente de la Asociación de Médicos del Instituto Hondureño de Seguridad Social (IHSS) en San Pedro Sula, Carlos Umaña,",08-02-2021 19:03,https://www.bing.com/th?id=OVFT._4hKVfAwsrsVuKIDZ3Kl1S,Chile,La Tribuna
CPH pide que comunicadores también sean prioridad para vacuna contra el COVID-19,https://hondudiario.com/2021/02/08/cph-pide-que-comunicadores-tambien-sean-prioridad-para-vacuna-contra-el-covid-19/,"El nuevo presidente del Colegio de Periodista de Hondura (CPH), Osman Reyes, peticionó este lunes que todas las personas que están ligadas al periodismo, sean tomadas en cuenta, para ser inmunizadas c",08-02-2021 20:02,https://www.bing.com/th?id=OVFT.bHAwWovpiX1BwQ3dqQwoqC,Chile,Hondudiario
CIENTÍFICA HONDUREÑA RECHAZA REPRESENTAR A “GOBIERNO ENEMIGO” DE CIENCIA Y PUEBLO,http://www.web.ellibertador.hn/index.php/noticias/nacionales/2655-cientifica-hondurena-rechaza-representar-a-gobierno-enemigo-de-ciencia-y-pueblo,"“Por razones éticas, resulta incompatible con mis principios ser imagen de un gobierno que se comporta como enemigo de la ciencia, lo que hasta ahora ha costado muchísimas vidas de mis compatriotas”,",08-02-2021 20:46,https://www.bing.com/th?id=OVFT.9NsFw4zJwjWrbK0seDjQLi,Chile,El Libertador
Estudio: El 35 % de los hondureños planea no vacunarse contra el COVID-19,https://tiempo.hn/35-hondurenos-no-se-vacunaran-covid-19/,"Un 35% de los hondureños han planteado que no se vacunarán contra el COVID-19, según un estudio realizado por el Observatorio de UNITEC.",08-02-2021 20:53,https://www.bing.com/th?id=OVFT.4KJ1h5UDbfOWxzGJErLcGi,Chile,Tiempo
La pandemia de la COVID-19 en Honduras siguen siendo alarmante y de angustia,https://proceso.hn/la-pandemia-de-la-covid-19-en-honduras-siguen-siendo-alarmante-y-de-angustia/,"Hasta ahora no hay una fecha sobre la llegada de las primeras vacunas, pero podría ser en el primer trimestre de este año, según la OMS, aunque en enero el Gobierno hondureño anunció que estarían",08-02-2021 21:16,https://www.bing.com/th?id=OVFT.xxlwjG02uVfpRokHnGrVjS,Chile,Proceso
Con dos ausencias: Pedro Troglio aún no lograr completar su plantilla en la pretemporada de Olimpia,https://www.diez.hn/liganacionaldehonduras/1441319-498/olimpia-pedro-troglio-ausencias-preptemporada-javier-portillo-harold-fonseca-covid-19,Los merengues suman dos semanas de trabajo y el técnico no ha podido contar con todos sus futbolistas. Esta próxima semana se viene el debut en el Clausura ante el Real España.,08-02-2021 21:23,https://www.bing.com/th?id=OVFT.FEEqL2BmLJo6N-e8niGV0C,Chile,diez.hn
Médicos en el Valle de Sula anunciaron paro de labores,https://www.vtv.com.hn/noticia/medicos-en-el-valle-de-sula-anunciaron-paro-de-labores/,"Los médicos de los hospitales privados decidieron cancelar las consultas médicas privadas para el día 9 de de febrero, sin abandonar las emergencia",08-02-2021 22:36,https://www.bing.com/th?id=OVFT.r4EblBxORvFIF0oEXOEDdC,Chile,VTV
Primer lote de vacunas contra el coronavirus llega a Honduras este fin de semana,https://www.laprensa.hn/honduras/1441394-410/primer-lote-vacunas-contra-coronarivus-honduras-,"El presidente de Honduras, Juan Orlando Hernández, confirmó que se está trabajando para permitir que la Ivermectina se pueda ofrecer como un tratamiento preventivo.",08-02-2021 22:56,https://www.bing.com/th?id=OVFT.PSBPRgDUh2QUappbeyEEgC,Chile,La Prensa Chicos
"COORDINADOR DE UNIDAD DE VIGILANCIA DE SALUD: TASA DE LETALIDAD POR COVID-19 EN HONDURAS ES DE 2,42 %",https://ultimahora.hn/coordinador-de-unidad-de-vigilancia-de-salud-tasa-de-letalidad-por-covid-19-en-honduras-es-de-242/,"La tasa de letalidad causada por la enfermedad covid-19 en Honduras, entre la semana epidemiológica número 11 (2020) y la número 5 (2021) es de 2,42 %, informó este lunes el coordinador de la",08-02-2021 23:02,https://www.bing.com/th?id=OVFT.DMRuS--svvvNMregOXjQVi,Chile,Ultima Hora
Presidente Hernández se reúne con director general de la OMS,http://www.elsoldehonduras.com/nacionales/presidente-hernandez-se-reune-con-director-general-de-la-oms/,"El presidente Juan Orlando Hernández abogó hoy ante el director general de la Organización Mundial de la Salud (OMS), Tedros Adhanom Ghebreyesus, para que se asegure que Honduras tenga acceso al mayor",08-02-2021 23:36,https://www.bing.com/th?id=OVFT.PkG-jrkmMRpd012JHWsW5i,Chile,El Sol de Honduras
Salud pide restringir medidas de circulación y alerta sobre nueva mutación del COVID en Honduras,https://proceso.hn/salud-pide-restringir-la-circulacion-y-alerta-sobre-nueva-mutacion-del-covid-en-honduras/,"La titular de la Secretaría de Salud (Sesal) Alba Consuelo Flores, arguyó este lunes que es necesario que se restrinjan las medidas de circulación para tratar de contener la propagación del",09-02-2021 01:02,https://www.bing.com/th?id=OVFT.S4AzWrFYtH9meMJ5cOuaWi,Chile,Proceso
Copán: El padre Rudy Mejía está delicado por COVID-19; solicitan ayuda,https://tiempo.hn/padre-rudy-mejia-delicado-covid19-ayuda-copan/,"COPÁN, HONDURAS. El querido padre Rudy Mejía de Santa Rosa de Copán está atravesando un fuerte proceso, luego de ser internado por contagiarse de COVID-19, ahora su salud está delicada, y sus familiar",09-02-2021 02:20,https://www.bing.com/th?id=OVFT._Z7z4yHgNBrSSqMGmW0hpy,Chile,Tiempo
