name,url,description,datePublished,imagen,pais,Fuente
"Honduras ya supera las 48 mil personas contagiados de coronavirus y llega a 1,515 muertes",https://www.diez.hn/coronavirus/1400597-441/honduras-supera-48-mil-contagiados-coronavirus-covid19-muertos,Este día se realizaron más de 1200 pruebas y resultaron positivas 531 y la mayoría fueron del departamento de Yoro El COVID-19 sigue cobrando la vida de compatriotas en Honduras. La pandemia ya supera,12-08-2020 03:33,https://www.bing.com/th?id=ON.A12D77B9A3D9615D051CC76B46087256,Chile,diez.hn
Extranjeros deberán presentar prueba negativa de COVID-19 para ingresar a Honduras,https://www.latribuna.hn/2020/08/12/extranjeros-deberan-presentar-prueba-negativa-de-covid-19-para-ingresar-a-honduras/,". Ante la emergencia de COVID-19, uno de los requisitos para ingresar al país es la presentación de una prueba PCR o rápida negativa, confirmó ayer el gerente del Aeropuerto Internacional “Ramón Ville",12-08-2020 04:45,https://www.bing.com/th?id=ON.D391B7CD5FCCA6C076957E94DDE382A7,Chile,La Tribuna
"Hospitales de Tegucigalpa y SPS respiran un poco, pero los regionales comienzan a colapsar",https://www.elheraldo.hn/especiales/coronavirus/1400541-528/hospitales-covid-honduras,"Aunque San Pedro Sula y la capital se mantienen como las dos ciudades con más casos de covid-19, los hospitales todavía tienen camas para ingresar a pacientes en condición estable, grave e incluso en",12-08-2020 06:57,https://www.bing.com/th?id=ON.5AE44A213450FAA9D06D1A237ACA61C1,Chile,El Heraldo
Inician brigadas médicas en Comayagua,https://www.latribuna.hn/2020/08/12/inician-brigadas-medicas-en-comayagua/,"La directora de las brigadas médicas en Comayagua, Dolores Ortega, informó que iniciaron casa por casa para detectar y tratar a pacientes con COVID-19. Esta misma acción se está desarrollando en mucho",12-08-2020 07:14,https://www.bing.com/th?id=ON.83E76F87DBD7322187B6EF5843BD5202,Chile,La Tribuna
Fenafuth respalda gestión de Infantino tras investigaciones por supuesta corrupción,https://hondudiario.com/2020/08/11/fenafuth-respalda-gestion-de-infantino-tras-investigaciones-por-supuesta-corrupcion/,"El presidente de la Federación Nacional Autónoma de Fútbol de Honduras (Fenafuth), Jorge Salomón, firmó junto a todos los presidentes de la región, una carta corporativa de Uncaf, en la que reiteran s",12-08-2020 15:04,https://www.bing.com/th?id=ON.A516132B8BD18320968526DB4663E102,Chile,Hondudiario
Japón designa nueve millones de dólares a Honduras para la lucha contra el Covid-19,http://www.elsoldehonduras.com/nacionales/japon-designa-nueve-millones-de-dolares-a-honduras-para-la-lucha-contra-el-covid-19/,"Con el objetivo de mejorar la atención a los pacientes mediante el fortalecimiento del Departamento de Radiología e Imagen del Hospital Escuela Universitario (HUE), Honduras, con la cooperación financ",12-08-2020 16:13,https://www.bing.com/th?id=ON.66EBBB8008C4BA6E8A2622F822EA82EF,Chile,El Sol de Honduras
Productores siguen cosechando alimentos en medio de la pandemia gracias a Agrocrédito 8.7,http://www.elsoldehonduras.com/agricultura/productores-siguen-cosechando-alimentos-en-medio-de-la-pandemia-gracias-a-agrocredito-8-7/,"Productores agrícolas aglutinados en cooperativas e industrias han seguido cosechando alimentos en medio de la pandemia de covid-19, gracias al brazo solidario del programa Agrocrédito 8.7 que impulsa",12-08-2020 16:30,https://www.bing.com/th?id=ON.09D9A4F67B936C87F24E797EB74FB924,Chile,El Sol de Honduras
"Atic llega a empresa de envíos por caso de 250,000 pruebas dañadas",https://www.laprensa.hn/honduras/1400678-410/atic-empresa-env%C3%ADos-dhl-250000-pruebas-da%C3%B1adas-covid19-honduras,"Las investigaciones en el caso de las 250,000 pruebas dañadas para detectar Covid-19 continúa y este miércoles la Agencia Técnica de Investigación Criminal (Atic) inspecciona la empresa que se encargó",12-08-2020 17:32,https://www.bing.com/th?id=ON.B4F1D0BDAD5E4EE76B8F416EFA546476,Chile,La Prensa Chicos
El fútbol tiene que reactivarse: Javier Atala,https://www.diariomas.hn/2020/08/12/el-futbol-tiene-que-reactivarse-javier-atala/,"El presidente de la Comisión Nacional de Selecciones Mayor de Fútbol y a la vez directivo de Motagua y FENAFUTH, Javier Eduardo Atala es de la idea que es primordial reanudarse la Liga Nacional lo más",12-08-2020 18:24,https://www.bing.com/th?id=ON.BF4827E35B868584B7376BB528170B93,Chile,Mas
"Honduras requiere nuevo modelo de salud, dice exrectora de universidad autónoma",https://www.laprensa.hn/honduras/1400744-410/julieta-castellanos-secretaria-de-salud-honduras-coronavirus-pandemia-invest-h,"Honduras necesita de un nuevo modelo de salud que permita invertir en toda su red hospitalaria y que los recursos económicos no aparezcan solo cuando hay emergencias, como la pandemia de COVID-19, dij",12-08-2020 22:16,https://www.bing.com/th?id=ON.C70EBA67FF0090B5A65C7667878EEDE3,Chile,La Prensa Chicos
Grupo Jaremar dona 150 canastas de sus productos líderes al personal de enfermería del Hospital Catarino Rivas,http://www.eldiario.hn/grupo-jaremar-dona-150-canastas-de-sus-productos-lideres-al-personal-de-enfermeria-del-hospital-catarino-rivas/,"San Pedro Sula.-Grupo Jaremar continúa evidenciando su compromiso con Honduras al apoyar a las enfermeras, enfermeros y auxilares de la sala Covid del Hospital Mario Catarino Rivas de San Pedro Sula a",12-08-2020 22:50,https://www.bing.com/th?id=ON.14212AE9B4F85E671B1F40379FD2F672,Chile,El Diario
Exigen a cafetaleros tomar medidas para evitar contagios en las fincas,https://www.elheraldo.hn/pais/1400581-466/exigen-a-cafetaleros-tomar-medidas-para-evitar-contagios-en-las-fincas,Sinager teme que la movilización de corteros aumente los contagios de covid-19. Afirma que gremiales no se han acercado para coordinar protocolos de bioseguridad durante corte y transporte de empleado,13-08-2020 00:35,https://www.bing.com/th?id=ON.58AFE61B00D687EC3A4782DB0415DF95,Chile,El Heraldo
"Honduras confirma 18 muertos más por coronavirus y los contagios ya ascienden a 48,657",https://www.diez.hn/coronavirus/1400862-441/honduras-muertos-coronavirus-casos-contagios-recuperados-cortes-francisco-morazan,Sinager confirmó que procesó 854 pruebas de las cuales un total de 245 resultaron positivas. Además se reportan 150 pacientes más recuperados de coronavirus. Sinager confirmó este miércoles 18 nuevos,13-08-2020 02:22,https://www.bing.com/th?id=ON.E58536B0F9974D0841DC28D4BFB39AA8,Chile,diez.hn
Tegucigalpa registra 12 muertos más bajo sospecha de COVID-19 este miércoles,https://hondudiario.com/2020/08/12/tegucigalpa-registra-12-fallecimientos-bajo-sospecha-de-covid-19/,La capital de Honduras reportó este miércoles un total de 12 muertes bajo sospecha de coronavirus en sus cuatro principales hospitales. Autoridades del Hospital Escuela (HE) especificaron que 4 pacien,13-08-2020 03:22,https://www.bing.com/th?id=ON.9EE2A863A8F0F7B4F8C11A419F2A3ACB,Chile,Hondudiario
