name,url,description,datePublished,imagen,pais,Fuente
"Con 544 nuevos contagios de covid-19, casos se elevan a 106,116, recuperados a 47,006 y 2,888 fallecidos",http://www.elsoldehonduras.com/nacionales/con-544-nuevos-contagios-de-covid-19-casos-se-elevan-a-106116-recuperados-a-47006-y-2888-fallecidos/,"Tegucigalpa. El Sistema Nacional de Gestión de Riesgo (Sinager) registró 544 nuevos contagios de coronavirus, que elevaron a 106,116 los casos de la enfermedad covid-19 confirmados en el país, mientra",26-11-2020 16:36,https://www.bing.com/th?id=OVFT.Ye6erEz4Xx2v15ykgRYEpS,Chile,El Sol de Honduras
Honduras recibirá otras 300 mil pruebas de antígeno para diagnóstico temprano de COVID-19,https://proceso.hn/honduras-recibira-otras-300-mil-pruebas-de-antigeno-para-diagnostico-temprano-de-covid-19/,"Tegucigalpa – Al menos 300 mil pruebas de antígeno para detectar COVID-19, recibirá la Secretaría de Salud, informó este jueves el Coordinador de Enfermedades Transmisibles, Doctor Homer Mejía. “La Se",26-11-2020 17:34,https://www.bing.com/th?id=OVFT.Y3pL_03GEvBNDcKwUNXh3i,Chile,Proceso
Gobierno desembolsa 800 millones de lempiras para el combate de la covid-19 en centros asistenciales del país,http://www.elsoldehonduras.com/nacionales/gobierno-desembolsa-800-millones-de-lempiras-para-el-combate-de-la-covid-19-en-centros-asistenciales-del-pais/,"San Pedro Sula. El Gobierno de la Republica, a través de la Secretaría de Salud, informó que destinará 800 millones de lempiras para reforzar las atenciones en los hospitales y establecimientos de pri",26-11-2020 18:01,https://www.bing.com/th?id=OVFT.rcFhiIXHRp4GgKm9UFEfgC,Chile,El Sol de Honduras
"Honduras llega a los 106,116 contagios con covid-19 y 2,888 muertos",https://www.laprensa.hn/honduras/1425182-410/honduras-llega-a-los-contagios-sinager-coronavirus-covid-muertos-salud,"Honduras enfrenta la pandemia con muchas deficiencias desde que el coronavirus se comenzó a expandir, en marzo.",26-11-2020 19:12,https://www.bing.com/th?id=OVFT.OOoPHuiA7fSiAzZAVKjaky,Chile,La Prensa Chicos
Lozano regresa a Cádiz tras estar confinado por COVID-19 en Guatemala,https://www.diariomas.hn/2020/11/26/lozano-regresa-a-cadiz-tras-estar-confinado-por-covid-19-en-guatemala/,El delantero hondureño del Cádiz Anthony 'Choco' Lozano regresó este jueves a Cádiz tras haber estado confinado unos diez días en la habitación de,26-11-2020 20:24,https://www.bing.com/th?id=OVFT.OTUxiZMVDu-OCXlkkGUhKy,Chile,Mas
Presidente Hernández envía proyecto de ley al Congreso para que vacuna contra covid-19 sea gratuita para el pueblo hondureño,https://ultimahora.hn/presidente-hernandez-envia-proyecto-de-ley-al-congreso-para-que-vacuna-contra-covid-19-sea-gratuita-para-el-pueblo-hondureno/,El presidente Juan Orlando Hernández envió hoy al Congreso Nacional una propuesta de ley para que se garantice que la vacuna contra la covid-19 sea gratuita para el pueblo hondureño. El gobernante,26-11-2020 20:39,https://www.bing.com/th?id=OVFT.T3Grxik8KSBuxIoIzj-wci,Chile,Ultima Hora
“Tenemos vacuna contra el covid-19 para todos los hondureños que médicamente se la puedan administrar” presidente Hernández,https://ultimahora.hn/tenemos-vacuna-contra-el-covid-19-para-todos-los-hondurenos-que-medicamente-se-la-puedan-administrar-presidente-hernandez/,"“Tenemos vacuna contra el covid-19 para todos los hondureños” que médicamente se la puedan administrar, afirmó este jueves el presidente Juan Orlando Hernández en declaraciones al noticiero Diario",26-11-2020 21:15,https://www.bing.com/th?id=OVFT.PxNIKtmyJtH_18vtw80bji,Chile,Ultima Hora
"OPS/OMS: Honduras recibirá una vacuna contra el COVID-19 certificada, segura y eficaz",https://www.latribuna.hn/2020/11/26/ops-oms-honduras-recibira-una-vacuna-contra-el-covid-19-certificada-segura-y-eficaz/,"La representante en Honduras de la Organización Panamericana de la Salud y de la Organización Mundial de la Salud (OPS/OMS) Piedad Huerta, dijo que el país debe tener la certeza que recibirá una vacun",27-11-2020 01:25,https://www.bing.com/th?id=OVFT.WmrovYI8wGnL7L6pUhDgvy,Chile,La Tribuna
"Los casos de COVID-19 van en aumento, advierte epidemiólogo",https://www.laprensa.hn/honduras/1425321-410/covid-19-aumento-honduras-epidemiologo-coronavirus-pandemia-,"Recordó que “el COVID-19 no se va a ir con las tormentas, no se va a ir con las vacunas, no sabemos por cuánto tiempo va a estar en el país”. Actualmente hay más de 90,000",27-11-2020 02:54,https://www.bing.com/th?id=OVFT.RQEoGoBwuAXbwy0O0xOOAS,Chile,La Prensa Chicos
COVID-19 Honduras: SINAGER confirma 565 nuevos casos y 4 muertos,https://tiempo.hn/covid-19-honduras-sinager-565-casos-4-muertos/,"TEGUCIGALPA, HONDURAS. Las autoridades de Honduras continúan cuantificando los daños que ocasionaron los fenómenos naturales Eta e Iota, sin embargo, el aumento de casos de la COVID-19 en el país no c",27-11-2020 04:37,https://www.bing.com/th?id=OVFT.39n749OXqpK8eHVUNI_Zly,Chile,Tiempo
JOH envía al CN Ley de “vacuna contra COVID-19 gratuita para todos”,https://tiempo.hn/joh-envia-cn-ley-vacuna-contra-covid-19-gratuita-todos/,"El gobernante hondureño manifestó que logró asegurar la vacuna conta la COVID-19 para todos los hondureños que medicamente lo necesiten. TEGUCIGALPA, HONDURAS. El presidente, Juan Orlando Hernández, e",27-11-2020 04:59,https://www.bing.com/th?id=OVFT.J7MY1IVP-M3G_D9CnqcMJC,Chile,Tiempo
JOH presenta en el CN la vacuna gratuita para todos contra COVID-19,https://www.latribuna.hn/2020/11/27/joh-presenta-en-el-cn-la-vacuna-gratuita-para-todos-contra-covid-19/,"El Presidente Juan Orlando Hernández, en la “sesión virtual” del Congreso Nacional, ayer jueves, se conectó con los diputados de la Cámara Legislativa para darles pormenores de las acciones de su gobi",27-11-2020 08:27,https://www.bing.com/th?id=OVFT.gg1z_NcR0W_fcYPBdnN1iC,Chile,La Tribuna
Editorial HRN: ¿Seguimos a la deriva ante la pandemia covid?,https://www.radiohrn.hn/editorial-hrn-seguimos-a-la-deriva-ante-la-pandemia-covid,Honduras continúa sin una estrategia clara en lo que respecta al manejo de la urgencia sanitaria Hay destrucción por todas partes. Honduras ha sido golpeado sin piedad por los fenómenos naturales Eta,27-11-2020 13:26,https://www.bing.com/th?id=OVFT.5OzUM-RrFaL4TdeAeMothy,Chile,Radio HRN
Mauricio Dubón con Honduras siempre presente,https://www.diariomas.hn/2020/11/27/mauricio-dubon-con-honduras-siempre-presente/,"El hondureño Mauricio Dubón lleva el Nro. 1 en la espalda de su camisa de los Gigantes, un tributo a su improbable camino hasta las Grandes Ligas.",27-11-2020 14:02,https://www.bing.com/th?id=OVFT.w7eCQkO9VXyBdhlyLdb88S,Chile,Mas
Condecoran al embajador de Israel como reconocimiento a su apoyo y amistad hacia Honduras,https://hondudiario.com/2020/11/27/condecoran-al-embajador-de-israel-como-reconocimiento-a-su-apoyo-y-amistad-hacia-honduras/,***“En los últimos 72 años Honduras e Israel disfrutan de unas excelentes relaciones de cooperación y amistad y puedo afirmar que en estos tres últimos años las relaciones se han incrementado en los á,27-11-2020 15:14,https://www.bing.com/th?id=OVFT.Kbnx_goQeaw7reNN-7CbPi,Chile,Hondudiario
Al menos 13 fallecimientos por COVID-19 esta semana en hospital Leonardo Martínez,https://proceso.hn/al-menos-13-fallecimientos-por-covid-19-esta-semana-en-hospital-leonardo-martinez/,"Tegucigalpa – En lo que va de la presente semana al menos 13 fallecimientos a causa del COVID-19 se registran en el Hospital Leonardo Martínez de San Pedro Sula, norte de Honduras. – Las autoridades s",27-11-2020 19:43,https://www.bing.com/th?id=OVFT.kA-MGfIgK1qictxx5pwJuC,Chile,Proceso
Alberth Elis da negativo a prueba de coronavirus y este sábado saldrá rumbo a Portugal,https://www.diez.hn/legionarios/1425516-498/alberth-elis-negativo-prueba-coronavirus-este-sabado-viaja-boavista-portugal,"El hondureño llegó contagiado al país el pasado 12 de noviembre antes del juego contra Guatemala. Cuando ya se estaba consolidando en el Boavista, fue frenado por el Covid-19",28-11-2020 01:21,https://www.bing.com/th?id=OVFT.VKZfkHJIR7mEuTT57638uy,Chile,diez.hn
Alberth Elis viajará a Portugal este sábado luego de dar negativo a COVID-19,https://hondudiario.com/2020/11/28/alberth-elis-viajara-a-portugal-este-sabado-luego-de-dar-negativo-a-covid-19/,"El delantero hondureño Alberth Elis, superó el COVID-19 tras dar negativo en la última prueba PCR practicada en Honduras, por lo que este sábado viajará a Portugal para incorporarse a su club Boavista",28-11-2020 15:20,https://www.bing.com/th?id=OVFT.iuAd42f8gaFQpMksoHoM2S,Chile,Hondudiario
