name,url,description,datePublished,imagen,pais,Fuente
HONDURAS / CICLONES DISPARAN LEPTOSPIROSIS EN ZONA NORTE; JOH NO ESCUCHA EXPERTOS,http://www.web.ellibertador.hn/index.php/noticias/nacionales/2486-honduras-ciclones-disparan-leptospirosis-en-zona-norte-joh-no-escucha-expertos,"Tegucigalpa. Pese a las reiteradas advertencias, el gabinete de Juan Hernández sigue sin escuchar a los expertos. Y el anuncio de al menos 26 casos de leptospirosis en la zona norte del país tras las",05-12-2020 02:58,https://www.bing.com/th?id=OVFT.MP3oC2U7TbQkrRBmO754_i,Chile,El Libertador
"Tras huracanes Eta e Iota, Honduras pide ayuda urgente en Washington y solicita un nuevo TPS",http://www.eldiario.hn/tras-huracanes-eta-e-iota-honduras-pide-ayuda-urgente-en-washington-y-solicita-un-nuevo-tps/,NUEVA YORK. - Honduras lanzó un llamado de ayuda internacional para enfrentar los efectos devastadores del paso de dos huracanes por Centroamérica y advirtió que podrían provocar una nueva oleada migr,05-12-2020 03:52,https://www.bing.com/th?id=OVFT.mAD7ZNT14tCudt35otVvGi,Chile,El Diario
Gobierno garantiza la aplicación de la vacuna contra covid-19 al 100 % de la población médicamente apta,http://www.eldiario.hn/gobierno-garantiza-la-aplicacion-de-la-vacuna-contra-covid-19-al-100-de-la-poblacion-medicamente-apta/,"Tegucigalpa. - El Gobierno del presidente Juan Orlando Hernández garantizó este viernes que la aplicación de la vacuna contra la covid-19 será para el 100 % de la población médicamente apta, tras apro",05-12-2020 04:08,https://www.bing.com/th?id=OVFT.ow7dwq5tpOMYXx_ycs0GAy,Chile,El Diario
"HONDURAS / GOBIERNO PIDE 3,200 MILLONES DE DÓLARES MIENTRAS CORRE DAMNIFICADOS",http://www.web.ellibertador.hn/index.php/noticias/nacionales/2487-honduras-gobierno-pide-3-200-millones-de-dolares-mientras-corre-damnificados,"Hasta este sábado, Hernández ha recibido fondos de auxilio “en nombre del pueblo hondureño” unos 1,300 millones de dólares del BM (250 millones), Corporación Financiera Internacional para el Desarroll",05-12-2020 22:09,https://www.bing.com/th?id=OVFT.zSjnokRKAHOfEwDCualivy,Chile,El Libertador
Honduras registró cuatro fallecidos más y 763 nuevos casos de covid-19,https://www.radiohrn.hn/honduras-registro-cuatro-fallecidos-mas-y-763-nuevos-casos-de-covid-19,"Honduras aumentó a 110 mil 723 el número de personas que han contraído covid-19, de las que 2 mil 945 han fallecido, según informe oficial",06-12-2020 05:16,https://www.bing.com/th?id=OVFT.BhGpUAJUI4_Crz4ced65Bi,Chile,Radio HRN
"Honduras agrega 763 casos y acumula un total de 110,723 contagiados por COVID-19",https://proceso.hn/honduras-agrega-763-casos-y-acumula-un-total-de-110723-contagiados-por-covid-19/,"Tegucigalpa – Honduras añadió en las últimas horas 763 nuevos de COVID-19, tras que el Laboratorio de Virología procesara 2 mil 567 pruebas PCR, informó el Sistema Nacional de Gestión de Riesgos (Sina",06-12-2020 14:14,https://www.bing.com/th?id=OVFT.kg8r4Xk7Ly0TyuOgLJR_lC,Chile,Proceso
"Honduras contabiliza 110,723 contagios y 2,945 muertes por Covid-19",https://hondudiario.com/2020/12/06/honduras-contabiliza-110723-contagios-y-2945-muertes-por-covid-19/,"*** El numeró se muertos por la enfermedad corresponde a varios días. El Sistema Nacional de Gestión de Riesgos (Sinager), confirmó la madrugada de este domingo 763 nuevos casos de Covid-19, sumando a",06-12-2020 15:33,https://www.bing.com/th?id=OVFT.Gj5GKgqbhKBTK2HlN7holy,Chile,Hondudiario
Vamos con todo al Excélsior: Alexander “La Ficha” Aguilar,https://www.diariomas.hn/2020/12/06/vamos-con-todo-al-excelsior-alexander-la-ficha-aguilar/,"A pesar del triunfo e Marathon sobre Honduras Progreso, el Vida no se rinde, sus jugadores van conto al estadio Excélsior aunque tenga algunas bajas",06-12-2020 16:33,https://www.bing.com/th?id=OVFT.7Yasnbx6nDl9L4fl2PUpJC,Chile,Mas
"Unas 70 mil denuncias de violencia contra la niñez registra Honduras en 2020, según Unicef",https://www.radiohrn.hn/unas-70-mil-denuncias-de-violencia-contra-la-ninez-registra-honduras-en-2020-segun-unicef,"Los datos estadísticos revelan que diariamente mueren dos niños a causa de la violencia criminal, situación que ha puesto en alarma a las autoridades hondureñas",06-12-2020 20:24,https://www.bing.com/th?id=OVFT.VI1j3qXZI5X_8PF40_65Vi,Chile,Radio HRN
Aclaran ante campaña de desinformación: Honduras sólo recibirá gratis 20% de vacunas contra Covid-19,https://ultimahora.hn/aclaran-ante-campana-de-desinformacion-honduras-solo-recibira-gratis-20-de-vacunas-contra-covid-19/,Dra Yolani Batres asegura que el Gobierno y el IHSS comprarán las demas vacunas para proteger al resto de la población. Todas las vacunas será aplicadas gratuitamente a toda la población. La,06-12-2020 22:42,https://www.bing.com/th?id=OVFT.Gnhu9KsaBDOric-TWWA9DC,Chile,Ultima Hora
Honduras solo recibirá gratis el 20 % de las vacunas contra covid-19,https://www.latribuna.hn/2020/12/06/honduras-solo-recibira-gratis-el-20-de-las-vacunas-contra-covid-19/,"Los fondos gestionados por el presidente Juan Orlando Hernández a través de las secretarías de Salud y Finanzas son para que toda la población sea vacunada contra la covid-19, aclaró hoy la exministra",06-12-2020 23:12,https://www.bing.com/th?id=OVFT.q1SqdcH72-3csoAzL0ClkC,Chile,La Tribuna
Honduras solo recibirá gratis el 20 % de las vacunas contra covid-19 y Gobierno e IHSS comprarán las demás,https://www.laprensa.hn/honduras/1427602-410/honduras-solo-recibir%C3%A1-gratis-el-20-de-las-vacunas-contra-covid-19,"Ante los gastos, el Ministerio de Salud asegura que serán gratis para toda la población. La exministra de Salud y representante de Honduras de la Alianza Global para Vacunas e Inmunización (Gavi), Yol",07-12-2020 00:43,https://www.bing.com/th?id=OVFT.4C5LGaxvXzvjrHLMyAYLVi,Chile,La Prensa Chicos
Honduras recibirá gratis el 20 % de vacunas contra covid-19,https://www.laprensa.hn/honduras/1427602-410/el-20-de-vacunas-contra-covid-19-seran-gratis-gobierno-e-ihss,El Gobierno e IHSS comprarán el 80% de las vacunas. Aseguran que serán gratis para toda la población. La exministra de Salud y representante de Honduras de la Alianza Global para Vacunas e Inmunizació,07-12-2020 01:09,https://www.bing.com/th?id=OVFT.4C5LGaxvXzvjrHLMyAYLVi,Chile,La Prensa Chicos
En L27 mil millones se sitúan las recaudaciones aduaneras,https://www.latribuna.hn/2020/12/06/en-l27-mil-millones-se-situan-las-recaudaciones-aduaneras/,"Las recaudaciones aduaneras a octubre de este año cerraron en 27,000 millones de lempiras, severamente afectadas por la pandemia de la COVID-19 que obligó la implementación de restricciones a la movil",07-12-2020 02:29,https://www.bing.com/th?id=OVFT.CFtfx3CU6ctAx1XdAmYLFi,Chile,La Tribuna
"Honduras acumula 111,023 contagiados y 2,946 muertes por COVID-19",https://proceso.hn/honduras-acumula-111023-contagiados-y-2946-muertes-por-covid-19/,"Tegucigalpa – El Sistema Nacional de Gestión de Riesgos (Sinager), reportó que Honduras ha acumulado durante la pandemia 111 mil contagiados y 2 mil 946 decesos por COVID-19. Se confirmó la muerte de",07-12-2020 03:32,https://www.bing.com/th?id=OVFT.s7_QHdGYnnEXR9GZ8kVChS,Chile,Proceso
COVID-19 Honduras: SINAGER confirma 300 nuevos casos y un fallecido,https://tiempo.hn/covid-19-casos-en-honduras/,"De 1,167 pruebas para diagnosticar COVID-19 que procesó el LNV, 300 resultaron positivas, el total de casos en Honduras incrementó a 111,023. TEGUCIGALPA, HONDURAS. De 1,252 nuevas pruebas para diagno",07-12-2020 04:01,https://www.bing.com/th?id=OVFT.XnhkCavCUWqeDpENReg_RS,Chile,Tiempo
Honduras supera los 111 mil contagios de coronavirus,https://hondudiario.com/2020/12/06/honduras-supera-los-111-mil-contagios-de-coronavirus/,"El Sistema Nacional de Gestión de Riesgos (Sinager), confirmó este domingo 300 nuevos casos de Covid-19, sumando así un total de 111,023 contagios a nivel nacional. Los nuevos contagios contabilizados",07-12-2020 04:27,https://www.bing.com/th?id=OVFT.6FSQ7oYKhq8eBHZbTVyEjS,Chile,Hondudiario
"Vacunas contra Covid-19: Honduras solo recibirá gratis el 20 %, dice Batres",https://tiempo.hn/vacunas-contra-covid-19-gratis-20/,Honduras es parte de Covax-alianza Gavi. TEGUCIGALPA. “Honduras recibirá gratis solo el 20 por ciento de vacunas contra COVID-19 y Gobierno y el Instituto Hondureño de Seguridad Social (IHSS) deberán,07-12-2020 13:09,https://www.bing.com/th?id=OVFT.aB8URuI7Suc5UfA14KGTgC,Chile,Tiempo
"Gobierno, Cepredenac y expertos de Israel:Identifican prioridades de salud en el marco de emergencias por covid-19 y tormentas",https://ultimahora.hn/gobierno-cepredenac-y-expertos-de-israelidentifican-prioridades-de-salud-en-el-marco-de-emergencias-por-covid-19-y-tormentas/,"Autoridades del Gobierno, Cepredenac y la delegación de expertos de Israel sostuvieron una reunión este domingo con el objetivo de elaborar un plan que logre fortalecer la reconstrucción de la",07-12-2020 14:08,https://www.bing.com/th?id=OVFT.1mcCEA1AkptVD3fZpIvIli,Chile,Ultima Hora
