name,url,description,datePublished,imagen,pais,Fuente
Vigilan la formación de disturbio tropical,https://www.laprensa.hn/honduras/1405236-410/vigilan-la-formaci%C3%B3n-de-disturbio-tropical,"TEGUCIGALPA. Honduras inicia hoy su mes patrio, y el covid-19 no detendrá las actividades cívicas para celebrar los 199 años de independencia patria, aunque sí serán atípicas. Antes del inicio de sept",01-09-2020 06:46,https://www.bing.com/th?id=ON.E4F2484E6BEB1E350B59298B3E77F156,Chile,La Prensa Chicos
El IHSS ha pagado 32.5 millones de lempiras en incapacidades,https://www.elheraldo.hn/pais/1405214-466/el-ihss-ha-pagado-325-millones-de-lempiras-en-incapacidades,Los médicos están dando entre 21 y 28 días de incapacidad a los pacientes para que se recuperen de la enfermedad y luego puedan volver a laborar Los trabajadores hacen enormes filas en las instalacion,01-09-2020 14:59,https://www.bing.com/th?id=ON.EB6AC94B4B3DAE1C315CF80437565DE0,Chile,El Heraldo
Medidas anticipadas fueron vitales para evitar males mayores con la pandemia de covid-19:Presidente Hernández,https://ultimahora.hn/?q=content/medidas-anticipadas-fueron-vitales-para-evitar-males-mayores-con-la-pandemia-de-covid,"Enviado por Editor 1 el Mar, 09/01/2020 - 08:53",01-09-2020 15:12,https://www.bing.com/th?id=ON.95B4527A56BFD26DC784E1416DE9364E,Chile,Ultima Hora
"Honduras sumó 18,160 casos y 521 muertes sólo en agosto",https://hondudiario.com/2020/08/31/honduras-sumo-18160-casos-y-521-muertes-solo-en-agosto/,"*** El octavo mes del año fue el segundo más mortal desde el comienzo de la pandemia a mediados de marzo. Tegucigalpa, Honduras. El Sistema Nacional de Gestión de Riesgos (Sinager), informó este lunes",01-09-2020 15:13,https://www.bing.com/th?id=ON.B82B5C68A7BCE23EA9935E3E49F1EA5B,Chile,Hondudiario
Ministra de Salud: Ocupación hospitalaria en Honduras bajó a 48%,https://www.latribuna.hn/2020/09/01/ministra-de-salud-ocupacion-hospitalaria-en-honduras-bajo-a-48/,"La ministra de Salud, Alba Consuelo Flores, destacó en las últimas horas que durante la fase de atención a la pandemia la ocupación hospitalaria bajó en las últimas semanas de 150 a 48 por ciento. Asi",01-09-2020 16:01,https://www.bing.com/th?id=ON.04575D8C32078C827D6EC67FBB8EFDB4,Chile,La Tribuna
Gobierno conmemora Día de la Bandera Nacional en memoria de víctimas por Covid-19,https://hondudiario.com/2020/09/01/gobierno-conmemora-dia-de-la-bandera-nacional-en-memoria-de-victimas-por-covid-19/,"El presidente de Honduras, Juan Orlando Hernández, inició las fiestas patrias este 1 de septiembre izando la Bandera Nacional hasta media asta como un símbolo de luto y dolor, pero también como repres",01-09-2020 17:50,https://www.bing.com/th?id=ON.628B8D0ADE01BE74F03ECF627BA6FAA7,Chile,Hondudiario
Real de Minas confirma que varios jugadores dieron positivo en la primera prueba de Covid-19,https://www.diez.hn/liganacionaldehonduras/1405332-498/real-minas-jugadors-positivos-covid-19-apertura-2020-juan-ramon-mejia-olimpia,Seis jugadores y dos miembros del cuerpo técnico del Real de Minas resultaron positivos en la prueba ELISA. Con hisopado se descartó a seis. Los otros dos hoy se harán el PCR. Real de Minas confirmó q,01-09-2020 18:38,https://www.bing.com/th?id=ON.EDC14B8A5F4DC6B6718E3A65F0480A3B,Chile,diez.hn
"Expertos sobre reactivación económica: Honduras necesita plan integral, giro en política fiscal y atención a grupos vulnerables",https://www.radiohrn.hn/expertos-sobre-reactivacion-economica-honduras-necesita-plan-integral-giro-en-politica-fiscal-y-atencion-a-grupos-vulnerables,"Un balance fiscal es una condición sin la cual no es posible tener orden en la hacienda hondureña, muy presionada por el alto endeudamiento y el gasto improductivo, además de la distribución inequitat",01-09-2020 18:48,https://www.bing.com/th?id=ON.76892A68CA144EB88E00F9693DAD2CAD,Chile,Radio HRN
Conozca la interpretación de las pruebas rápidas para detectar covid,https://www.radiohrn.hn/honduras-conozca-la-interpretacion-de-las-pruebas-rapidas-para-detectar-covid,"Los test de anticuerpos ofrecen claridad sobre si alguien se está recuperando del virus o es potencialmente infeccioso, si necesita tratamiento o aislamiento. El test de anticuerpos IgM e IgG es una d",01-09-2020 19:24,https://www.bing.com/th?id=ON.40A9479AB3C578EA795EF933D36F2EA2,Chile,Radio HRN
"Próximo viernes salen de Turquía dos hospitales móviles con destino a Honduras, informa Invest-H",https://www.proceso.hn/proximo-viernes-salen-de-turquia-dos-hospitales-moviles-con-destino-a-honduras-informa-invest-h/,"Tegucigalpa – La Comisión Interventora de Inversión Estratégica de Honduras (Invest-H), informó este martes que el próximo viernes 4 de septiembre, saldrán de Turquía otros dos hospitales móviles, de",01-09-2020 19:31,https://www.bing.com/th?id=ON.2836AC424AB83C6066F381CD76606714,Chile,Proceso
"Ocupación hospitalaria en Honduras bajó a 48 % y la contratación de recurso humano es mayor a los 4,000 profesionales",http://www.elsoldehonduras.com/salud/ocupacion-hospitalaria-en-honduras-bajo-a-48-y-la-contratacion-de-recurso-humano-es-mayor-a-los-4000-profesionales/,"La ministra de Salud, Alba Consuelo Flores, remarcó hoy que durante la fase de atención a la pandemia la ocupación hospitalaria bajó en las últimas semanas de 150 a 48 %, y la contratación de recurso",01-09-2020 22:28,https://www.bing.com/th?id=ON.8862D36E223FB8344806134765BD114A,Chile,El Sol de Honduras
Aduanas Honduras da inicio a festividades del 199 aniversario de Independencia Patria,http://www.elsoldehonduras.com/nacionales/aduanas-honduras-da-inicio-a-festividades-del-199-aniversario-de-independencia-patria/,"En un acto solemne de manera virtual la Administración Aduanera de Honduras dio inicio a las festividades que conmemoran el 199 aniversario de la patria, “Camino al Bicentenario, 200 años de Historia",01-09-2020 22:28,https://www.bing.com/th?id=ON.AD37EC2BBA086AF34D6186F57496B1D7,Chile,El Sol de Honduras
Honduras replantea a nivel internacional el tema migratorio,https://www.latribuna.hn/2020/09/01/honduras-replantea-a-nivel-internacional-el-tema-migratorio/,"Hoy y mañana se realiza en el país la II Conferencia Internacional de Migración acompañada por la OIM, ACNUR y UNICEF. Honduras nuevamente se ubica en el contexto internacional, a través de la II Conf",01-09-2020 23:38,https://www.bing.com/th?id=ON.CC0C1A406AB3D3DB8FD4DD20A5A7EA23,Chile,La Tribuna
Chicha y Limón martes 1 de septiembre de 2020,http://www.eldiario.hn/chicha-y-limon-martes-1-de-septiembre-de-2020/,"¡BIENVENIDO SEPTIEMBRE!!… Hoy arranca el noveno mes del año: mes de la patria, de cierre de ciclos y de lluvias por doquier… Ojalá y también llueva en el Valle del Calore… Seguimos rememorando ágapes",01-09-2020 23:41,https://www.bing.com/th?id=ON.EBAA3B54F97174B4ED479970AB44E020,Chile,El Diario
"Empresario Camilo Atala, nuevo presidente del CEAL-capítulo de Honduras",https://www.proceso.hn/empresario-camilo-atala-nuevo-presidente-del-ceal-capitulo-de-honduras/,"Tegucigalpa – Al momento de aceptar su nominación, el empresario Camilo Atala fue claro y conciso en su mensaje ante sus pares, al decir que, en las circunstancias actuales, Honduras demanda una unida",01-09-2020 23:57,https://www.bing.com/th?id=ON.953F6BACA5B66947C17FA22ACAA6DE07,Chile,Proceso
