name,url,description,datePublished,imagen,pais,Fuente
Lo que hemos vivido con estos dos huracanes no nos puede dejar indiferentes,http://www.elsoldehonduras.com/nacionales/lo-que-hemos-vivido-con-estos-dos-huracanes-no-nos-puede-dejar-indiferentes/,"El Arzobispo de Tegucigalpa, cardenal Oscar Rodríguez, expresó hoy en la homilía dominical, que lo que hemos vivido con estos dos huracanes Iota y Eta, no nos puede dejar indiferentes a todos los hond",01-12-2020 02:28,https://www.bing.com/th?id=OVFT.rcFhiIXHRp4GgKm9UFEfgC,Chile,El Sol de Honduras
COVID-19 Honduras: Solo 928 pruebas procesadas; más de 300 positivas,https://tiempo.hn/covid-19-honduras-solo-928-pruebas-procesada/,"TEGUCIGALPA, HONDURAS. De 928 nuevas pruebas para diagnosticar COVID-19 que procesó el Laboratorio Nacional de Virología ( LNV) de la Secretaría de Salud ( SESAL ), 365 resultaron positivas, por lo qu",01-12-2020 12:51,https://www.bing.com/th?id=OVFT.Rdeoexr_1xDQoyNLB5p93S,Chile,Tiempo
La vacuna contra el COVID-19 “la gran esperanza” para Honduras,https://hondudiario.com/2020/12/01/la-vacuna-contra-el-covid-19-la-gran-esperanza-para-honduras/,"La exministra de Salud, Yolani Batres, manifestó que todas las esperanzas de Honduras están puestas en la vacuna contra el COVID-19 para eliminar este virus. El país ya firmó el acuerdo en donde se es",01-12-2020 14:38,https://www.bing.com/th?id=OVFT.ATqWgoagovjn2Z9jVKI6Cy,Chile,Hondudiario
Cohep garantiza adquisición de vacuna contra el Covid-19 para derechohabientes del IHSS,https://ultimahora.hn/cohep-garantiza-adquisicion-de-vacuna-contra-el-covid-19-para-derechohabientes-del-ihss/,"El presidente del Consejo Hondureño de la Empresa Privada (COHEP) Juan Carlos Syikaff, lo que le estamos garantizando la adquisición de vacunas para todos los derechohabientes del IHSS. Lo",01-12-2020 15:40,https://www.bing.com/th?id=OVFT.bVBcv4UGMnyXlY1DA-zIjC,Chile,Ultima Hora
Yolani Batres: «Honduras es campeón en vacunas»,https://www.latribuna.hn/2020/12/01/yolani-batres-honduras-es-campeon-en-vacunas/,"La coordinadora de la emergencia por el COVID-19 en Francisco Morazán, Yolani Batres, destacó este martes que Honduras es un «país campeón en vacunación», pues hay 20 tipos de vacunas que se ofertan e",01-12-2020 17:35,https://www.bing.com/th?id=OVFT.LlVkso7MfquAIhrSmfolyi,Chile,La Tribuna
Taiwán dona mascarillas a la Cámara de Comercio e Industrias de Santa Bárbara,https://elpatriota.hn/2020/12/01/taiwan-dona-mascarillas-a-la-camara-de-comercio-e-industrias-de-santa-barbara/,"Continuando con el apoyo, solidaridad y compromiso de ayudar a Honduras el Gobierno de la República de China (Taiwán), por medio de su embajador Diego Wen, entregó una donación de tres mil mascarillas",01-12-2020 19:31,https://www.bing.com/th?id=OVFT.zktG3ylDqSuYD8whsbEnTi,Chile,El Patriota
"Alberth Elis regresó a los entrenamientos con el Boavista, luego de superar el Covid-19",https://www.diez.hn/legionarios/1426338-498/alberth-elis-boavista-coronavirus-covid-19-portugal-honduras-guatemala,El delantero hondureño viajó desde el pasado sábado a Portugal y someterse a una nueva prueba en ese país y de esa manera incorporarse a las actividades del Boavista.,01-12-2020 20:18,https://www.bing.com/th?id=OVFT.ML_yG4jspz2G7rMLuswtgC,Chile,diez.hn
Autoridades penitenciarias socializan plan para reapertura de visita en centro penitenciarios,http://www.elsoldehonduras.com/nacionales/autoridades-penitenciarias-socializan-plan-para-reapertura-de-visita-en-centro-penitenciarios/,"Las autoridades del Instituto Nacional Penitenciario (INP) socializaron con organismos de derechos humanos, Poder Judicial, entre otras instituciones el protocolo de bioseguridad para la reapertura de",01-12-2020 22:00,https://www.bing.com/th?id=OVFT.Xn21z6WQvCi6ZAPziP5Idi,Chile,El Sol de Honduras
CPH pide que se incluya a periodistas en inmunización contra el COVID-19,https://www.laprensa.hn/honduras/1426398-410/colegio-periodistas-inmunizacion-covid-coronavirus-honduras-hondurenos,"El presidente del CPH, Dagoberto Rodríguez, hizo un llamado a las autoridades para no dejar de lado a los comunicadores de la lista de grupos vulnerables ante la pandemia.",01-12-2020 23:13,https://www.bing.com/th?id=OVFT.cwAddJxlGy26P41XznIF7i,Chile,La Prensa Chicos
Presidente del Cohep: Vacuna contra el COVID-19 vendrá en marzo,https://www.latribuna.hn/2020/12/01/presidente-del-cohep-vacuna-contra-el-covid-19-vendra-en-marzo/,"El presidente del Consejo Hondureño de la Empresa Privada (Cohep) Juan Carlos Sikaffy, anunció que la vacuna contra el COVID-19 estará en el país en marzo del próximo año. Recientemente, Honduras firm",01-12-2020 23:55,https://www.bing.com/th?id=OVFT.WmrovYI8wGnL7L6pUhDgvy,Chile,La Tribuna
COVID-19 en Honduras: SINAGER confirma 388 nuevos casos y 9 muertos,https://tiempo.hn/covid-19-en-honduras-sinager-388-nuevos-casos-9-muertos/,"TEGUCIGALPA, HONDURAS. De 1,167 nuevas pruebas para diagnosticar COVID-19 que procesó el Laboratorio Nacional de Virología (LNV), de la Secretaría de Salud (SESAL), 388 resulta",02-12-2020 03:57,https://www.bing.com/th?id=OVFT.sqJqX2w-1csaBfXAiONEFC,Chile,Tiempo
Otros 388 casos positivos de COVID-19 y Honduras contabiliza 107 mil 888 contagios,https://proceso.hn/otros-388-casos-positivos-de-covid-19-y-honduras-contabiliza-107-mil-888-contagios/,"Tegucigalpa– El Sistema Nacional de Gestión de Riesgos (Sinager), dio a conocer este martes, que se reportaron 388 nuevos casos positivos de COVID-19, por lo que Honduras acumula 108 mil 641 contagios",02-12-2020 04:17,https://www.bing.com/th?id=OVFT.6qzR9psD189Mrsn8TI9K8C,Chile,Proceso
Editorial HRN: La otra pandemia de la especulación y acaparamiento en Honduras,https://www.radiohrn.hn/editorial-hrn-la-otra-pandemia-de-la-especulacion-y-acaparamiento-en-honduras,Exigimos que el gobierno a través de la instancia que debe velar por los derechos del consumidor le ponga atención a esta vorágine especulativa,02-12-2020 13:26,https://www.bing.com/th?id=OVFT.At9Ny-047p22C5CMCAY5gC,Chile,Radio HRN
Semipresencial se impartirá clases en el año escolar de 2021,https://www.elheraldo.hn/pais/1426460-466/semipresencial-se-impartir%C3%A1-clases-en-el-a%C3%B1o-escolar-de-2021,"Se iniciará con proyectos pilotos para retornar a las clases presenciales en zonas rurales donde la incidencia de contagios de covid-19 no es muy elevada o está controlada, estiman las autoridades",02-12-2020 14:23,https://www.bing.com/th?id=OVFT.1REbJVrYj-aRoEhtozG5kC,Chile,El Heraldo
Histórico super clásico catracho en Liga Concacaf,https://www.diariomas.hn/2020/12/02/historico-super-clasico-catracho-en-liga-concacaf/,"Es un partido especial, pero a la vez insólito porque se jugará sin público. Quizás siempre los aficionados de Olimpia y Motagua esperaban un",02-12-2020 15:02,https://www.bing.com/th?id=OVFT.HIhtHogEuBJJZZn8KR-aQS,Chile,Mas
"Honduras registra 2,927 muertos por covid-19 y 108,641 contagiados",https://www.laprensa.hn/honduras/1426531-410/honduras-coronavirus-muertos-cifras-recuperados,"De 1.167 nuevas pruebas PCR de laboratorio, 388 dieron positivo, con las que el número de contagios ascendió a 108.641",02-12-2020 15:39,https://www.bing.com/th?id=OVFT.i0cgxtWAfJBEb72i7Cu63C,Chile,La Prensa Chicos
Año escolar se extiende hasta febrero de 2021 para atender estudiantes que se desvincularon de las clases,https://ultimahora.hn/ano-escolar-se-extiende-hasta-febrero-de-2021-para-atender-estudiantes-que-se-desvincularon-de-las-clases/,"El secretario de Educación, Arnaldo Bueso, expresó este día que el año escolar 2020 se extenderá hasta febrero de 2021, con el propósito de atender a los estudiantes que se han desvinculado del",02-12-2020 16:40,https://www.bing.com/th?id=OVFT.iExyxG8_1byS1OwBKXaZ2i,Chile,Ultima Hora
Fenafuth sentencia que Fabián Coito dirigirá el Preolímpico y aclara por qué Honduras no jugó contra Catar y Arabia Saudita,https://www.diez.hn/laseleccion/1426556-498/fenafuth-sentencia-que-fabi%C3%A1n-coito-dirigir%C3%A1-el-preol%C3%ADmpico-y-aclara-por-qu%C3%A9,"El presidente de la Federación de Fútbol de Honduras reveló que para el mes de marzo, el técnico uruguayo estará a cargo de la Sub-23 en este evento a desarrollarse en Guadalajara, México.",02-12-2020 17:04,https://www.bing.com/th?id=OVFT.KVIcaUkHKtaHfHjZVldVGi,Chile,diez.hn
"BCH transfiere L.5,600 millones al gobierno para atender emergencia de COVID y tormentas",https://proceso.hn/bch-transfiere-l-5600-millones-al-gobierno-para-atender-emergencia-de-covid-y-tormentas/,"-La institución aprobó una facilidad crediticia de 5,600 millones de lempiras para hacer frente al COVID y la emergencia por tormentas. Explicó que la Ley Orgánica del BCH, está facultada para otorgar",02-12-2020 17:05,https://www.bing.com/th?id=OVFT.L0IOg_DettUD7lVNxhoJti,Chile,Proceso
Liga Nacional anuncia la jornada seis para el fin de semana,https://www.diariomas.hn/2020/12/02/liga-nacional-anuncia-la-jornada-seis-para-el-fin-de-semana/,La junta directiva de la Liga Nacional confirmó que este fin de semana se disputarán los partidos correspondientes a la jornada seis de la primera,02-12-2020 18:02,https://www.bing.com/th?id=OVFT.x2NoXIfHHc0sOJiLvgbaEy,Chile,Mas
