name,url,description,datePublished,imagen,pais,Fuente
Honduras cae ante Guatemala en amistoso de pobre nivel dejando dudas en su funcionamiento,https://www.diez.hn/laseleccion/1422476-498/en-vivo-transmision-honduras-guatemala-amistoso-choco-lozano-covid-doroteo-guamuch,Los chapines marcaron las dos que les quedaron. Darwin Lom hizo doblete; por Honduras descontó Alex López de penal,15-11-2020 21:33,https://www.bing.com/th?id=OVFT.oec4huTAkFluCTEFTnQlgy,Chile,diez.hn
Honduras suma 547 nuevos casos de COVID-19 y acumula 103 mil 102 contagios,https://proceso.hn/honduras-suma-547-nuevos-casos-de-covid-19-y-acumula-103-mil-102-contagios/,"Tegucigalpa– El Sistema Nacional de Gestión de Riesgos (Sinager), dio a conocer este domingo a través de un comunicado que se reportaron 547 nuevos casos positivos de COVID-19, por lo que Honduras acu",16-11-2020 03:21,https://www.bing.com/th?id=OVFT._Xy81wwHYA-jvFJLfxXuRy,Chile,Proceso
Honduras supera los 103.000 contagios por covid-19 y muertos suman 2.823,https://www.latribuna.hn/2020/11/15/honduras-supera-los-103-000-contagios-por-covid-19-y-muertos-suman-2-823/,"Honduras superó este domingo los 103.000 contagios por covid-19, con 547 nuevos casos positivos, en tanto que los muertos ya suman 2.823, informó el Sistema Nacional de Gestión de Riesgos (Sinager). E",16-11-2020 03:36,https://www.bing.com/th?id=OVFT.MOwEDqO3F_5EWZwLSfXlHy,Chile,La Tribuna
"Honduras supera los 103,000 contagios y 2,823 muertes por coronavirus",https://www.laprensa.hn/honduras/1422695-410/honduras-supera-103000-contagios-2823-muertes-coronavirus,"De 1,562 nuevas pruebas PCR de laboratorio, el Sinager indicó que 547 dieron positivo, elevando los contagios a 103,102.",16-11-2020 03:50,https://www.bing.com/th?id=OVFT.YiPnYS1Pw6mDn2PvxWhgNS,Chile,La Prensa Chicos
"Honduras eleva la cifra de afectados por covid a 103,102 con una tasa de letalidad de 2.75 %",https://www.radiohrn.hn/honduras-eleva-la-cifra-de-afectados-por-covid-a-103102-con-una-tasa-de-letalidad-de-2-75,"De los 103,102, se registran 44,778 recuperados con (227 nuevos). Mientras que la cifra de fallecidos es de 2,823 con un nuevo deceso. La letalidad llega a 2.75%. Los departamentos de Cortés y Francis",16-11-2020 05:17,https://www.bing.com/th?id=OVFT.BuSVb7Uq9Q6VRaR1ZlLEri,Chile,Radio HRN
Advierten sobre un repunte en los casos de coronavirus en albergues del país,https://hondudiario.com/2020/11/16/advierten-sobre-un-repunte-en-los-casos-de-coronavirus-en-albergues-del-pais/,"La epidemióloga hondureña, Miriam Aguilera, advirtió sobre un repunte en los casos de Covid-19 que podría ocurrir en las próximas dos semanas de noviembre en los albergues instalados en diferentes sec",16-11-2020 15:53,https://www.bing.com/th?id=OVFT.ysryRdKy1h7_Tvuirk6cny,Chile,Hondudiario
Llega a Honduras el presidente de Guatemala con el objetivo de seguir impulsando un frente común para reconstrucción,https://ultimahora.hn/llega-a-honduras-el-presidente-de-guatemala-con-el-objetivo-de-seguir-impulsando-un-frente-comun-para-reconstruccion/,"El presidente de Guatemala, Alejandro Giammattei, llegó este lunes a Tegucigalpa para reunirse con su homólogo, Juan Orlando Hernández, con el fin de continuar impulsando un frente común regional para",16-11-2020 15:59,https://www.bing.com/th?id=OVFT.Btmh5sxw91OVJbmukIV6vC,Chile,Ultima Hora
Honduras país destacado por la Organización Mundial de Aduanas (OMA),https://ultimahora.hn/honduras-pais-destacado-por-la-organizacion-mundial-de-aduanas-oma/,"Tegucigalpa, 16 noviembre 2020-La Organización Mundial de Aduanas (OMA), otorgó en su edición País Destacado del Mes a Honduras a través de la Administración Aduanera de Honduras por los esfuerzos",16-11-2020 20:53,https://www.bing.com/th?id=OVFT.uYQCuRZIK24Y8Kx5zdzTRS,Chile,Ultima Hora
"Honduras registra 137 nuevos casos de covid, 16 muertes y 137 recuperados",https://www.radiohrn.hn/honduras-registra-137-nuevos-casos-de-covid-16-muertes-y-137-recuperados,"El departamento de Cortés, es el lugar más afectado de Honduras por el covid-19, donde se registran 28 mil 068",17-11-2020 05:31,https://www.bing.com/th?id=OVFT.MwTExRTrwrkeCXDt0xJK-y,Chile,Radio HRN
COVID-19 sigue cobrando la vida de médicos en Honduras,https://proceso.hn/covid-19-sigue-cobrando-la-vida-de-medicos-en-honduras/,"Tegucigalpa– Otro médico perdió la batalla contra el COVID-19 en las últimas horas en Santa Rosa de Copán, occidente de Honduras.-Suman 52 los profesionales de la medicina f",17-11-2020 16:37,https://www.bing.com/th?id=OVFT.WrrQKo80AYgARKTdxqff6S,Chile,Proceso
Muere médico por COVID-19 en Santa Rosa de Copán,https://www.latribuna.hn/2020/11/17/muere-medico-por-covid-19-en-santa-rosa-de-copan/,"Un médico perdió la batalla en las últimas horas por COVID-19 en un centro asistencial en Santa Rosa de Copán, occidente de Honduras. Se trata del doctor Marco Antonio Bones Tábora, maestro de generac",17-11-2020 19:45,https://www.bing.com/th?id=OVFT.gcCD8e7dRN5FPdzhrnVs1i,Chile,La Tribuna
"Suben a 2,839 muertos por covid-19 en Honduras y a 103,239 los contagios Suben a 2.839 muertos por covid-19 en Honduras y a 103.239 los contagios",https://www.laprensa.hn/honduras/1423056-410/suben-a-2839-muertos-por-covid-19-en-honduras-y-a-103239-los,"La cifra de muertos en Honduras por la covid-19 se elevó este lunes a 2.839 y la de contagios a 103.239, desde marzo, informó el estatal Sistema Nacional de Gestión de Riesgos (Sinager). De 555 nuevas",17-11-2020 19:49,https://www.bing.com/th?id=OVFT.Q3fJqIaOL3czqi9-_kcneS,Chile,La Prensa Chicos
Orlando Ponce: Coito vuelve a colocar el proceso patas arriba y el caballo es muy grande para el jinete,https://www.diez.hn/blogs/1423131-498/seleccion-nacional-honduras-critica-orlando-ponce-fabian-coito-jugadores-crisis,Orlando Ponce lanza una crítica a Fabián Coito y a los jugadores tras la derrota de Honduras ante Guatemala en juego amistoso.,17-11-2020 23:09,https://www.bing.com/th?id=OVFT.90wSLPzjPz-AYcphWgrIjy,Chile,diez.hn
COVID-19: SINAGER confirma 249 casos y 0 fallecidos a nivel nacional,https://tiempo.hn/covid-19-sinager-confirma-249-casos-honduras/,"No obstante, la COVID-19 también sigue afectando y se reportan nuevos casos. Este martes, el Sistema Nacional de Gestión de Riesgo ( SINAGER) informó que de 996 nuevas pruebas para diagnosticar COVID-",18-11-2020 03:19,https://www.bing.com/th?id=OVFT.R1Sze9Rgw98gABY3hC6H_C,Chile,Tiempo
Iota y COVID-19: Estos dígitos pueden circular hoy en Honduras,https://tiempo.hn/digitos-pueden-circular-hoy-en-honduras/,"Por la emergencia de COVID-19 e Iota, SINAGER indicó qué dígitos circulan hoy en Honduras y cómo atenderán los bancos en",18-11-2020 14:03,https://www.bing.com/th?id=OVFT.ker8-rLW6qVQRmBUl-HMKS,Chile,Tiempo
