name,url,description,datePublished,imagen,pais,Fuente
CN aprueba ley: Vacuna contra el COVID-19 será gratuita para los hondureños,https://tiempo.hn/cn-aprueba-vacuna-contra-el-covid-19-gratuita-honduras/,"El Congreso Nacional (CN), durante la sesión virtual de hoy, jueves, aprobó la la Ley de Vacuna Gratuita contra el COVID-19 que aplicaría",03-12-2020 21:04,https://www.bing.com/th?id=OVFT.k4aBumCYwe0wYIlaLUEM6C,Chile,Tiempo
HONDURAS / ¡ABSURDO! SÓLO 30 MIL LEMPIRAS PAGARÁN VIOLADORES DE LEY TRANSPARENCIA,http://www.web.ellibertador.hn/index.php/noticias/nacionales/2481-honduras-absurdo-solo-30-mil-lempiras-pagaran-violadores-de-ley-transparencia,"Si se considera que el salario mínimo vigente para 2020 en Honduras, oscila entre 9 mil 400 y 12 mil 100 lempiras, significa que los “sancionados” pagarán a lo sumo unos 36 mil lempiras, algo que raya",03-12-2020 23:45,https://www.bing.com/th?id=OVFT.Lb-I249TmNfLtWNryfr0JS,Chile,El Libertador
Hernández expone a bancos multilaterales los daños que dejaron las tormentas tropicales Eta y Iota,http://www.eldiario.hn/hernandez-expone-a-bancos-multilaterales-los-danos-que-dejaron-las-tormentas-tropicales-eta-y-iota/,Washington. - El presidente Juan Orlando Hernández realizó este jueves en Washington una serie de reuniones con representantes de bancos multilaterales a fin de concretar la asistencia que le brindará,04-12-2020 03:11,https://www.bing.com/th?id=OVFT.DGS92dbjqqW-w1rlp27lky,Chile,El Diario
Hernández expone a bancos multilaterales los daños que dejaron las tormentas tropicales Eta e Iota,http://www.eldiario.hn/hernandez-expone-a-bancos-multilaterales-los-danos-que-dejaron-las-tormentas-tropicales-eta-e-iota/,Washington. - El presidente Juan Orlando Hernández realizó este jueves en Washington una serie de reuniones con representantes de bancos multilaterales a fin de concretar la asistencia que le brindará,04-12-2020 03:11,https://www.bing.com/th?id=OVFT.DGS92dbjqqW-w1rlp27lky,Chile,El Diario
Presidente Hernández expone a bancos multilaterales los daños que dejaron las tormentas tropicales Eta y Iota,http://www.elsoldehonduras.com/nacionales/presidente-hernandez-expone-a-bancos-multilaterales-los-danos-que-dejaron-las-tormentas-tropicales-eta-y-iota/,El presidente Juan Orlando Hernández realiza hoy en Washington una serie de reuniones con representantes de bancos multilaterales a fin de concretar la asistencia que le brindarn,04-12-2020 04:08,https://www.bing.com/th?id=OVFT.RVvX4L4i0hKdjT79nYzuYy,Chile,El Sol de Honduras
Aumentan en 4% casos de COVID-19 en últimas 2 semanas,https://www.latribuna.hn/2020/12/04/aumentan-en-4-casos-de-covid-19-en-ultimas-2-semanas/,"En las últimas dos semanas se ha registrado un aumento del dos por ciento en los casos de COVID-19 en Honduras, informó la jefa de la Unidad de Vigilancia de la Secretaría de Salud (Sesal), Karla Pavó",04-12-2020 11:46,https://www.bing.com/th?id=OVFT.tzZbcA2lFVvZJs0t0q2eey,Chile,La Tribuna
Sistema 911 ha atendido 344 mil emergencias en lo que va del año,https://www.elheraldo.hn/tegucigalpa/1427012-466/sistema-911-ha-atendido-344-mil-emergencias-en-lo-que-va-del,"Las tormentas tropicales Eta y Iota dispararon las llamadas para recibir apoyo durante noviembre, producto de inundaciones, derrumbes y vientos racheados registrados en el Distrito Central",04-12-2020 14:18,https://www.bing.com/th?id=OVFT.0D6jhzeXf4DkIpo3SFEnsi,Chile,El Heraldo
Revelan supuesta lista de diputados de Libre y del Partido Liberal que dijeron 'no' a la vacuna gratuita contra el covid,https://www.radiohrn.hn/revelan-lista-diputados-de-libre-y-del-partido-liberal-que-dijeron-no-a-la-vacuna-gratuita-contra-el-covid,"La normativa aprobada es para garantizar la adquisición de vacunas contra el coronavirus, según el Congreso Nacional",04-12-2020 14:55,https://www.bing.com/th?id=OVFT.cA2ieNxtJgWx-Tma8TTuTC,Chile,Radio HRN
Honduras perdió 65 % de los cultivos: el agro avizora crisis alimentaria en 2021,https://tiempo.hn/honduras-agro-avizora-crisis-alimentaria-2021/,El agro de Honduras está preocupado por la pérdida del 65 % de los cultivos tras el paso de Eta e Iota que dejará una crisis alimentaria.,04-12-2020 17:35,https://www.bing.com/th?id=OVFT.5EDZHu831d-2hOGqVRbnsy,Chile,Tiempo
"HONDURAS / PARQUES “CONVIVE MEJOR”, ¡REABREN SUS PUERTAS!",http://www.web.ellibertador.hn/index.php/noticias/nacionales/2483-honduras-parques-convive-mejor-reabren-sus-puertas,Un espacio para las familias se ha reabierto para los hondureños. El 2 de diciembre por disposiciones de la Secretaría de Trabajo y Seguridad Social y apegados al “Protocolo de Bioseguridad para Parqu,04-12-2020 18:00,https://www.bing.com/th?id=OVFT.oUMa9nkE-sFqqg4D1fl6VS,Chile,El Libertador
Aduanas Honduras participa en el 5to Foro Mundial de Ciudades y Plataformas Logísticas “Un cambio del rumbo para el Proceso Logístico Global”,http://www.elsoldehonduras.com/nacionales/aduanas-honduras-participa-en-el-5to-foro-mundial-de-ciudades-y-plataformas-logisticas-un-cambio-del-rumbo-para-el-proceso-logistico-global/,"Para presentar su experiencia de gestión en tiempos post pandemia, el Ministro Director de la Administración Aduanera de Honduras Juan José Vides participó y compartió su experiencia en el 5to Foro Mu",04-12-2020 18:07,https://www.bing.com/th?id=OVFT.VkXTrViP6T1VaxqES_oEpS,Chile,El Sol de Honduras
En Washington:Presidente Hernández agradece a senadores y congresistas de EEUU por su apoyo a Honduras,https://ultimahora.hn/en-washingtonpresidente-hernandez-agradece-a-senadores-y-congresistas-de-eeuu-por-su-apoyo-a-honduras/,– El mandatario expone al senador Ben Cardin y a los congresistas Ted Yoho y Rick Crawford los daños que dejaron en el país las tormentas Eta y Iota – “Tienen nuestro apoyo para,04-12-2020 18:16,https://www.bing.com/th?id=OVFT.ovf9qpRrNOKStRpRTt3ZAS,Chile,Ultima Hora
Departamento de Francisco Morazán nuevo epicentro de la COVID-19,https://proceso.hn/departamento-de-francisco-morazan-nuevo-epicentro-de-la-covid-19/,Tegucigalpa – Territorialmente hablando el departamento de Francisco Morazán desplazó en las últimas horas al departamento de Cortés como nuevo epicentro de la pandemia a causa del nuevo coronavirus e,04-12-2020 18:45,https://www.bing.com/th?id=OVFT.yghujOsNUcUcA9j138HtGS,Chile,Proceso
Honduras presenta solicitud formal ante Estados Unidos para un nuevo TPS,https://www.radiohrn.hn/honduras-presenta-solicitud-formal-ante-estados-unidos-para-extension-del-tps,"Honduras también reiteró su agradecimiento al gobierno estadounidense por la relación bilateral existente, la que calificó de ""robusta y sostenida""",04-12-2020 20:04,https://www.bing.com/th?id=OVFT.89FVKTMNsI1V5xc1IYf2zS,Chile,Radio HRN
Ebal Díaz aplaude aprobación de la compra de vacuna contra la covid-19 en CN y anuncia que solo se espera que sea sancionada,https://ultimahora.hn/ebal-diaz-aplaude-aprobacion-de-la-compra-de-vacuna-contra-la-covid-19-en-cn-y-anuncia-que-solo-se-espera-que-sea-sancionada/,El Ministro de la Presidencia Ebal Díaz aplaude este viernes la aprobación en el Congreso Nacional para la compra de vacunas contra la covid-19 gratuita para el pueblo hondureño. “Esta aprobación,04-12-2020 20:31,https://www.bing.com/th?id=OVFT.5mlAC6oYHIJGEsm45hSd-y,Chile,Ultima Hora
Francisco Morazán se convierte en el nuevo epicentro del Covid-19 en Honduras,https://hondudiario.com/2020/12/04/francisco-morazan-se-convierte-en-el-nuevo-epicentro-del-covid-19-en-honduras/,"El Jefe de la Región Metropolitana de Salud del Distrito Central, Harry Book, reveló este viernes que el departamento de Francisco Morazán desplazó al departamento de Cortés como el nuevo epicentro de",04-12-2020 21:17,https://www.bing.com/th?id=OVFT.oBgnxo4xWGkdFWI-hb6KXC,Chile,Hondudiario
Presidente Hernández agradece a senadores y congresistas de EEUU por su apoyo a Honduras,https://www.latribuna.hn/2020/12/04/presidente-hernandez-agradece-a-senadores-y-congresistas-de-eeuu-por-su-apoyo-a-honduras/,"El presidente Juan Orlando Hernández Alvarado conversó este viernes, como parte de su agenda de trabajo en Washington, con miembros del Congreso y del Senado de los Estados Unidos para agradecer el ap",04-12-2020 21:43,https://www.bing.com/th?id=OVFT.sn24DWKGDZkTGakY6dYPUS,Chile,La Tribuna
"Ley de adquisición de la vacuna contra el Covid-19 contempla asesoría, asegura Congreso Nacional",https://www.laprensa.hn/honduras/1427133-410/congreso-nacional-honduras-ley-acceso-vacuna-covid-asesoria-medicos,"Tomas Zambrano, secretario del CN, dijo que en el debate de la ley se aprobó el asesoramiento de médicos y la academia.",04-12-2020 22:10,https://www.bing.com/th?id=OVFT.2ATf2dV5Dtbp3TbURL2uai,Chile,La Prensa Chicos
"Vida en alerta: Más de 10 de contagiados por coronavirus, entre jugadores y cuerpo técnico",https://www.diez.hn/liganacionaldehonduras/1427142-498/vida-alerta-mas-10-contagiados-coronavirus-entre-jugadores-platense-covid19,"Hay futbolistas, cinco de ellos titulares, utileros y miembros del cuerpo técnico que salieron positivos en la prueba. Siempre se presentarán al partido del domingo",04-12-2020 22:14,https://www.bing.com/th?id=OVFT.g0o-40pHjDM5mDkTZNhzzi,Chile,diez.hn
Vacuna anticovid evitará más muertes y controlará la pandemia en Honduras,https://hondudiario.com/2020/12/04/vacuna-anticovid-evitara-mas-muertes-y-controlara-la-pandemia-en-honduras/,***Asimismo detalló que la vacuna Covax aporta a la investigación y esa es la carta de garantía que tendrá Honduras y se evitará las muertes y se controlará la pandemia. La representante de Honduras a,04-12-2020 22:44,https://www.bing.com/th?id=OVFT.lxKGljHp8sa5nNhu4HGZjy,Chile,Hondudiario
"Anthony Lozano, falso positivo de Covid-19 y estará contra el Barcelona",https://www.diariomas.hn/2020/12/04/anthony-lozano-falso-positivo-de-covid-19-y-estara-contra-el-barcelona/,El delantero hondureño Anthony Lozano podrá estará este sábado con su equipo el Cádiz que recibe en su estadio al FC Barcelona. El catracho,04-12-2020 23:11,https://www.bing.com/th?id=OVFT.MP1Mw25bqqhcEeFR2wLjCC,Chile,Mas
Honduras ya conoce su camino en la octagonal de Concacaf rumbo al Mundial de Qatar 2022: así se jugará la fase final,https://www.laprensa.hn/deportes/1427215-410/honduras-conoce-su-camino-octagonal-eliminatoria-concacaf-mundial-qatar-2022-fase-final-fechas,"La Concacaf ha anunciado este viernes las fechas de reprogramación, tras la suspensión por la pandemia del coronavirus, para el comienzo de las eliminatorias para el Mundial de Qatar 2022 y la Selecci",05-12-2020 00:28,https://www.bing.com/th?id=OVFT.aohGuduXoy2Vky5jOksRXi,Chile,La Prensa Chicos
