name,url,description,datePublished,imagen,pais,Fuente
Foro DIEZ: LOS EXPERTOS coinciden que varios clubes de Centroamérica desaparecerán,https://www.diez.hn/liganacionaldehonduras/1378167-498/foro-diez-jose-del-valle-espn-mauricio-kawas-everardo-herrera-futbol-centroamerica-coronavirus,"En el mismo se analizó el panorama de los torneos en los países del área y todos coinciden en que después de la pandemia, varios clubes desaparecerán por la carga económica. En Honduras la Liga SalvaV",07-05-2020 19:02,https://www.bing.com/th?id=ON.C8264C4C60B16B5EA717D24525892698,Chile,diez.hn
FMI llega a acuerdo con Honduras para ampliar crédito a $530 millones,https://www.laprensa.hn/honduras/1378173-410/fmi-acuerdo-honduras-credito-530-millones,"El Fondo Monetario Internacional (FMI) llegó este jueves a un acuerdo con Honduras para ampliar en 222 millones de dólares a un total de 530 millones un crédito para el país, ante la crisis global del",07-05-2020 19:26,https://www.bing.com/th?id=ON.BD7F7F84AF2616BF4060C3D6B8308316,Chile,La Prensa Chicos
Valle de Ángeles registra el primer caso de coronavirus,https://radiohrn.hn/valle-de-angeles-registra-el-primer-caso-de-coronavirus/,"El municipio de Valle de Ángeles, Francisco Morazán, reportó el primer caso de coronavirus. La noticia fue confirmada por la jefa regional departamental, Ana Velásquez, en el noticiero Prensa del Aire",07-05-2020 21:08,https://www.bing.com/th?id=ON.02D1D6152E445E9E5DDB51C850EE3109,Chile,Radio HRN
"Con globos y pastel reciben a enfermera que ha sufrido discriminación en su lucha contra el covid-19 en Cofradía, Cortés",https://radiohrn.hn/con-globos-y-pastel-reciben-a-enfermera-que-ha-sufrido-discriminacion-en-su-lucha-contra-el-covid-19-en-cofradia-cortes/,Como heroína fue recibida por sus vecinos la enfermera María Leyla Perdomo Martínez quien combate al covid-19 en los hospitales Mario Catarino Rivas y Leonardo Martínez en la zona norte de Honduras. L,07-05-2020 21:38,https://www.bing.com/th?id=ON.6D222038B86B7D00DB8EC569204AD9FF,Chile,Radio HRN
Hasta 300 llamadas al día recibe el 911 de sospechosos de Covid-19,https://www.elheraldo.hn/pais/1378065-466/hasta-300-llamadas-al-d%C3%ADa-recibe-el-911-de-sospechosos-de-covid-19,"Cientos de hondureños angustiados se comunican a diario por presentar síntomas parecidos a la enfermedad, pero la mayoría son resfriados, dicen las autoridades de este ente de atención TEGUCIGALPA, HONDURAS.- La crisis sanitaria generada por la pandemia derivada del Covid-19 tomó por sorpresa a cientos de países en el mundo y el nuestro ...",08-05-2020 00:03,https://www.bing.com/th?id=ON.890643DFCC821C51FE108375A331FA3E,Chile,El Heraldo
Las pandemias en Honduras,https://www.elheraldo.hn/opinion/columnas/1378078-469/las-pandemias-en-honduras,"Honduras está sufriendo los efectos simultáneos de varias pandemias, que desafortunadamente vendrán a profundizar los problemas seculares que han caracterizado al país. El Covid-19 es un virus que se ha extendido por la mayoría de los países del mundo y obviamente que Honduras no podía ser la excepción. De acuerdo con el último informe ...",08-05-2020 00:03,https://www.bing.com/th?id=ON.D15D3C30DCB6828AF530E121C14D4587,Chile,El Heraldo
Presidente: FMI reconoce que Honduras focaliza bien medidas para atender la COVID-19,https://www.latribuna.hn/2020/05/08/presidente-fmi-reconoce-que-honduras-focaliza-bien-medidas-para-atender-la-covid-19/,"El Presidente Juan Orlando Hernández dijo que en la presentación de resultados del trabajo del Gabinete Económico durante la emergencia sanitaria, que el Fondo Monetario Internacional (FMI), avala las",08-05-2020 10:27,https://www.bing.com/th?id=ON.F1663835AB7078A32080F259F26B0A25,Chile,La Tribuna
Ángel Garachana recriminó la estigmatización hacia los enfermos por coronavirus,https://www.latribuna.hn/2020/05/08/angel-garachana-recrimino-la-estigmatizacion-hacia-los-enfermos-por-coronavirus/,"“Surgen brotes de estigmatización hacia los enfermos por coronavirus, hacia el personal sanitario y hacia fallecidos por la misma enfermedad. Cierto que el COVID-19 es muy contagioso. Pero una cosa es",08-05-2020 15:32,https://www.bing.com/th?id=ON.FA2B73BCB6D60E5BF280E0722D09E978,Chile,La Tribuna
El regreso a clases presenciales en Honduras sigue sin estar definido,https://www.laprensa.hn/honduras/1378338-410/honduras-coronavirus-crisis-sanitaria-covid-gobierno,"El funcionario Arnaldo Bueso explicó este día, en cadena nacional, que aún no se define el retorno a las aulas de clases, pero sostuvo que el año lectivo no se perderá. Tegucigalpa, Honduras. La Secre",08-05-2020 16:20,https://www.bing.com/th?id=ON.F176F34F04821EF54A9ACA70107E4636,Chile,La Prensa Chicos
