name,url,description,datePublished,imagen,pais,Fuente
"Honduras requiere nuevo modelo de salud, dice exrectora de la UNAH",https://www.latribuna.hn/2020/08/12/honduras-requiere-nuevo-modelo-de-salud-dice-exrectora-de-la-unah/,"Tegucigalpa, 12 ago (EFE).- Honduras necesita de un nuevo modelo de salud que permita invertir en toda su red hospitalaria y que los recursos económicos no aparezcan solo cuando hay emergencias, como",13-08-2020 00:16,https://www.bing.com/th?id=ON.EE1683F758154DF4CCE5917DFAA8146D,Chile,La Tribuna
Grupo Jaremar dona 150 canastas de sus productos líderes al personal de enfermería del Hospital Catarino Rivas,http://www.eldiario.hn/grupo-jaremar-dona-150-canastas-de-sus-productos-lideres-al-personal-de-enfermeria-del-hospital-catarino-rivas/,"San Pedro Sula.-Grupo Jaremar continúa evidenciando su compromiso con Honduras al apoyar a las enfermeras, enfermeros y auxilares de la sala Covid del Hospital Mario Catarino Rivas de San Pedro Sula a",13-08-2020 00:37,https://www.bing.com/th?id=ON.14212AE9B4F85E671B1F40379FD2F672,Chile,El Diario
"Honduras confirma 18 muertos más por coronavirus y los contagios ya ascienden a 48,657",https://www.diez.hn/coronavirus/1400862-441/honduras-muertos-coronavirus-casos-contagios-recuperados-cortes-francisco-morazan,Sinager confirmó que procesó 854 pruebas de las cuales un total de 245 resultaron positivas. Además se reportan 150 pacientes más recuperados de coronavirus. Sinager confirmó este miércoles 18 nuevos,13-08-2020 02:22,https://www.bing.com/th?id=ON.E58536B0F9974D0841DC28D4BFB39AA8,Chile,diez.hn
"A 1.533 suman los fallecidos y 48,657 contagiados a nivel nacional",https://elpatriota.hn/2020/08/13/a-1-533-suman-los-fallecidos-y-48657-contagiados-a-nivel-nacional/,"TWGUCIGALPA,HONDURAS. El Sistema Nacional de Gestión de Riesgo (Sinager) confirmó hoy 254 positivos de covid-19 en Honduras, para totalizar 48.657 casos, e indicó que 140 hondureños más superaron esa",13-08-2020 12:15,https://www.bing.com/th?id=ON.A3C5347D968BB82BED054D6E67A39DE5,Chile,El Patriota
Ex titular de Salud:¿Pico de la pandemia? Imposible saberlo con tan pocas pruebas,https://elpatriota.hn/2020/08/13/ex-titular-de-saludpico-de-la-pandemia-imposible-saberlo-con-tan-pocas-pruebas/,"TEGUCIGALPA, HONDURAS. Es la epidemióloga, Roxana Araujo, considera imposible determinar cuándo llegará el país al pico de la curva epidemiológica debido a las pocas pruebas que se realizan en tiempo",13-08-2020 12:32,https://www.bing.com/th?id=ON.7B105167DB0967C2B906DB102BBF63DD,Chile,El Patriota
Ven ineficiencia y corrupción que el Estado asuma los aeropuertos,https://www.elheraldo.hn/pais/1400848-466/ven-ineficiencia-y-corrupci%C3%B3n-que-el-estado-asuma-los-aeropuertos,"De forma silenciosa, el gobierno creó una sociedad de propósito especial que contratará a una empresa internacional a la que le pagará para que le ayude a operar tres aeropuertos internacionales TEGUC",13-08-2020 13:05,https://www.bing.com/th?id=ON.851279AD913ED2F2300EB609578AE536,Chile,El Heraldo
Tegucigalpa reporta menos de 20 casos de covid-19 después de 71 días,https://www.elheraldo.hn/tegucigalpa/1400852-466/tegucigalpa-casos-coronavirus-agosto,"Después de ese tiempo los reportes en la ciudad eran elevados, ya que los casos iban de 250 a 350 incidencias diarias TEGUCIGALPA, HONDURAS.-Las altas cifras que reportaba a diario el Sistema Nacional",13-08-2020 17:10,https://www.bing.com/th?id=ON.B30E329E0CEB97B1A19984EC34B5F1FD,Chile,El Heraldo
Congreso Nacional de Honduras condecorará brigada de médicos cubanos,https://www.laprensa.hn/honduras/1400967-410/congreso-nacional-condecora-brigada-medicos-cubanos-pandemia-honduras,"Las autoridades otorgarán el grado honorífico ""Cruz de Comendador"" a los profesionales cubanos, por su labor en el país combatiendo el COVID-19. Tegucigalpa, Honduras. Con el grado honorífico Cruz de",13-08-2020 18:57,https://www.bing.com/th?id=ON.3112D03AE9529F69FFE5A7F0FB3B3D74,Chile,La Prensa Chicos
Muere por coronavirus el doctor Juan Cálix Ardón en el IHSS de Tegucigalpa,https://www.laprensa.hn/honduras/1400976-410/muere-coronavirus-doctor-juan-calix-ardon-ihss-tegucigalpa,El médico que perdió la batalla contra la Covid-19 estuvo más de 15 días en cuidados intensivos. Tegucigalpa. Un héroe más que pierde el gremio médico hondureño. Este jueves falleció el doctor Juan Is,13-08-2020 21:07,https://www.bing.com/th?id=ON.E2E7A15CC562B097367C19DD4B0C9DB9,Chile,La Prensa Chicos
En ocho municipios de Copán habilitan centros de triajes y unidades estabilizadoras con fondos del Programa Fuerza Honduras,http://www.elsoldehonduras.com/nacionales/en-ocho-municipios-de-copan-habilitan-centros-de-triajes-y-unidades-estabilizadoras-con-fondos-del-programa-fuerza-honduras/,"Gracias a los recursos otorgados por el Gobierno del presidente Juan Orlando Hernández, a través del Programa Fuerza Honduras, ocho municipios del departamento de Copán habilitarán centros de triaje y",14-08-2020 00:32,https://www.bing.com/th?id=ON.F09E3014A41E4807C2F1B6D0FBF3F83D,Chile,El Sol de Honduras
II Feria Virtual ¨Honduras Consume Local¨ es una oportunidad para repotenciar a las empresas de los MIPYMES,http://www.elsoldehonduras.com/nacionales/ii-feria-virtual-%C2%A8honduras-consume-local%C2%A8-es-una-oportunidad-para-repotenciar-a-las-empresas-de-los-mipymes/,"A cuatro días del inicio de la II edición de la feria virtual ¨Honduras Consume Local¨, el Ministro Director del Servicio Nacional de Emprendimiento y Pequeños Negocios, Luis Colindres, dijo que ¨los",14-08-2020 00:32,https://www.bing.com/th?id=ON.F05399E78CDB2B54A78C8104632AC48F,Chile,El Sol de Honduras
Honduras: Policía lanza bomba lacrimógena al interior de un bus con pasajeros,https://notibomba.com/honduras-policia-lanza-bomba-lacrimogena-al-interior-de-un-bus-con-pasajeros/,"Un elemento de la Policía Nacional de Honduras lanzó al interior de un bus con pasajeros una bomba lacrimógena, en un claro abuso de autoridad y violentando los derechos humanos de los ciudadanos. El",14-08-2020 01:31,https://www.bing.com/th?id=ON.95F0E1F5F2DF954422061651F310C027,Chile,Noti Bomba
Vacuna contra el COVID llegará a Honduras hasta el próximo año,https://hondudiario.com/2020/08/13/vacuna-contra-el-covid-llegara-a-honduras-hasta-el-proximo-ano/,"El jefe de la Región Metropolitana de Salud de Francisco Morazán, Harry Bock, estimó que la vacuna contra el coronavirus llegará a Honduras hasta el próximo año. Sus palabras vienen luego del anunció",14-08-2020 14:53,https://www.bing.com/th?id=ON.C6381CFF72C243D894BC7065850198A3,Chile,Hondudiario
Jefe de Región Metropolitana: Vacuna contra COVID-19 llegará a Honduras hasta el próximo año,https://www.latribuna.hn/2020/08/14/jefe-de-region-metropolitana-vacuna-contra-covid-19-llegara-a-honduras-hasta-el-proximo-ano/,"El jefe de la Región Sanitaria Metropolitana del Distrito Central, Harry Book, manifestó que la vacuna contra el COVID-19 llegará hasta el próximo año a Honduras. El funcionario se refirió al tema, lu",14-08-2020 15:07,https://www.bing.com/th?id=ON.CBBA2445418F50100C19A8BD61F9F565,Chile,La Tribuna
Médicos siguen perdiendo la batalla contra el Covid-19 hoy otro doctor es víctima del virus,https://ultimahora.hn/?q=content/m%C3%A9dicos-siguen-perdiendo-la-batalla-contra-el-covid-19-hoy-otro-doctor-es-v%C3%ADctima-del-virus,"Enviado por Editor 1 el Jue, 08/13/2020 - 09:58",14-08-2020 15:19,https://www.bing.com/th?id=ON.BCDA6F2D601657A12F1FAAC0ED0724A2,Chile,Ultima Hora
"Honduras registra 385 casos y 9 muertes nuevas, pruebas caen en 43%",https://hondudiario.com/2020/08/13/honduras-registra-385-casos-y-9-muertes-nuevas-pruebas-caen-en-43/,"*** Hasta el jueves de la semana anterior Honduras realizó 5,260 pruebas de COVID-19, en lo que va de esta semana solamente ha completado 3,877, una caída de casi la mitad. Tegucigalpa, Honduras. El S",14-08-2020 15:33,https://www.bing.com/th?id=ON.DDCC9B18BEC53B7F0146CF2CF503569F,Chile,Hondudiario
