name,url,description,datePublished,imagen,pais,Fuente
Siete casos de reinfección por covid-19 investigan médicos en el país y temen más,https://ultimahora.hn/siete-casos-de-reinfeccion-por-covid-19-investigan-medicos-en-el-pais-y-temen-mas/,"La pregunta de cuanto tiempo dura la inmunidad aun es un misterio para la ciencia en el virus Covid-19, lo cierto es que en Honduras ya se han reportado al menos siete casos de reinfección",08-10-2020 20:58,https://www.bing.com/th?id=OVFT.UJ6xxOPApGBf7EYEd0e-li,Chile,Ultima Hora
Conapid prepara instalaciones para reactivación en complejo deportivo,https://www.diariomas.hn/2020/10/08/conapid-prepara-instalaciones-para-reactivacion-en-complejo-deportivo/,"Poco a poco se va reactivando el deporte en Honduras y sobre todo en el complejo Deportivo Azcona Hoyo que mantiene la Conapid, ente que ha",08-10-2020 21:01,https://www.bing.com/th?id=OVFT.7A2d8DCDeWd8Jg0EgpLHoy,Chile,Mas
Honduras abre mañana las fronteras para que ingresen cortadores de café,https://www.laprensa.hn/honduras/1414137-410/honduras-abre-fronteras-cortadores-cafe-,"El representante de la Asociación Nacional de Empleados Públicos de Honduras (Andeph) en la mesa multisectorial, César Chirinos, informó que a partir de mañana se abren las fronteras para que ingresen",08-10-2020 22:35,https://www.bing.com/th?id=OVFT.nN8FyRbXdOcbMK0AxtTsWC,Chile,La Prensa Chicos
Motagua juega como en la copa Covid 19: Diego Vázquez,https://www.diariomas.hn/2020/10/09/motagua-juega-como-en-la-copa-covid-19-diego-vazquez/,"El técnico argentino Diego Martín Vázquez del Motagua, no pierde la oportunidad para de una manera jocosa reclamar algunas cosas que no le han",08-10-2020 23:00,https://www.bing.com/th?id=OVFT.n2STrYPzBZOdwie5L0C6mi,Chile,Mas
Autoridades de Aduanas de Honduras supervisa Terminales Especializadas en Puerto Cortés,http://www.eldiario.hn/autoridades-de-aduanas-de-honduras-supervisa-terminales-especializadas-en-puerto-cortes/,San Pedro Sula. -  Con la finalidad de garantizar la prestación de servicios de calidad a los usuarios que realizan operaciones de comercio exterior a través de las Terminales de Importación entre ell,08-10-2020 23:35,https://www.bing.com/th?id=OVFT.gGuynTMkVG5KFu019HUg3y,Chile,El Diario
EN VIVO: ¡Brasil le está pegando a Bolivia con gol de Marquinhos de cabeza!,https://www.diez.hn/internacionales/1414109-498/brasil-bolivia-transmision-en-vivo-online-eliminatorias-conmebol-neymar,"ALINEACIONES CONFIRMADAS. BRASIL. BOLIVIA. Sin la magia de Neymar garantizada, Brasil empieza este viernes el largo camino para poder alzar su sexta Copa del Mundo ante una Bolivi",09-10-2020 00:00,https://www.bing.com/th?id=OVFT.lwPUeZN2FjLw_tnYPKF-mi,Chile,diez.hn
Honduras observa mayor caída en primer semestre,https://www.latribuna.hn/2020/10/08/honduras-observa-mayor-caida-en-primer-semestre/,"Honduras registró la contracción más fuerte (-9.9%) en su actividad económica durante el primer semestre del año, en comparación al resto de Centroamérica, según la Secretaría Ejecutiva del Consejo Mo",09-10-2020 00:09,https://www.bing.com/th?id=OVFT.TEuvl5j0hvdmPU1014IxJy,Chile,La Tribuna
"HONDURAS / TRAS EMPARENTARLO CON “EL PORKY”, OFICIAL ACUSA “CAMPAÑA DE DESPRESTIGIO”",http://www.web.ellibertador.hn/index.php/noticias/nacionales/2315-honduras-tras-emparentarlo-con-el-porky-oficial-acusa-campana-de-desprestigio,"también el actual comisionado especial para la atención de la pandemia Covid-19, Lisandro Rosales Banegas; y el jefe de la Dirección Nacional de Investigación e Inteligencia (DNII), el teniente coronel Carlos Roberto Aldana Zelaya.",09-10-2020 00:11,https://www.bing.com/th?id=OVFT.kLEUxQYfTg7rsr8oXMWfXi,Chile,El Libertador
Registran 512 nuevos contagios y 11 fallecimientos por COVID-19 en Honduras,https://proceso.hn/registran-512-nuevos-contagios-y-11-fallecimientos-por-covid-19-en-honduras/,"Tegucigalpa – Los casos de COVID-19 en Honduras suman 81 mil 672 y los decesos 2 mil 477, informó la noche de este jueves el Sistema Nacional de Gestión de Riesgos (Sinager). El vocero de Sinager, Fra",09-10-2020 02:42,https://www.bing.com/th?id=OVFT.0oaqoNexT1ogRKRDZXMr1S,Chile,Proceso
CORTE EMPIEZA A “LAVAR” MILLONARIO DESFALCO A HONDURAS,http://www.web.ellibertador.hn/index.php/noticias/nacionales/2316-corte-empieza-a-lavar-millonario-desfalco-a-honduras,"Este día, la Corte Suprema de Justicia ha favorecido a los rostros visibles del saqueo al pueblo hondureño a través de Invest-H, Marco Bográn Corrales y Alex Moraes, al permitirles defenderse en liber",09-10-2020 02:47,https://www.bing.com/th?id=OVFT.UyvM2YJpYsSMVzOZRZgwKy,Chile,El Libertador
Dirigentes Magisteriales y expertos en educación analizan propuestas de evaluación en centros educativos ante crisis de COVID-19,http://www.elsoldehonduras.com/educacion/dirigentes-magisteriales-y-expertos-en-educacion-analizan-propuestas-de-evaluacion-en-centros-educativos-ante-crisis-de-covid-19/,"El foro denominado “Exámenes y evaluaciones en centros educativos gubernamentales ante crisis de COVID-19”, contó con la participación ... del Colegio Profesional Unión Magisterial de Honduras (COPRUMH) Edwin Hernández, presidente del Colegio ...",09-10-2020 04:20,https://www.bing.com/th?id=OVFT.raJfMCAAJ6ILcCYcd7vmCi,Chile,El Sol de Honduras
El 98.6 por ciento de privados de libertad contagiados de covid-19 se han recuperado,http://www.elsoldehonduras.com/nacionales/el-98-6-por-ciento-de-privados-de-libertad-contagiados-de-covid-19-se-han-recuperado/,"Un total de 2,295 personas privadas de libertad contagiadas del virus covid-19 han logrado vencerlo, esto representa una tasa de recuperación del 98.6 por ciento. A la fecha, en los centros penitencia",09-10-2020 04:30,https://www.bing.com/th?id=OVFT.H8xmdcgRpUetUWXz1ZjjlC,Chile,El Sol de Honduras
El 59% de deuda externa de Honduras es con las multilaterales,https://www.laprensa.hn/honduras/1414258-410/el-59-de-deuda-externa-es-con-las-multilaterales-honduras-economia-crisis,"San Pedro Sula, Honduras. La pandemia del covid-19 supone para América Latina el afrontar los gastos derivados de la emergencia sanitaria y económica y también enfrentar la fug",09-10-2020 06:12,https://www.bing.com/th?id=OVFT.uF8s2rFR_cTk98mQF9D1vy,Chile,La Prensa Chicos
Avance de la Pandemia – Infografía 8 de octubre 2020,https://proceso.hn/avance-de-la-pandemia-infografia-8-de-octubre-2020/,"Los casos de COVID-19 en Honduras suman 81 mil 672 y los decesos 2 mil 477, informó la noche de este jueves el Sistema Nacional de Gestión de Riesgos (Sinager). Los expertos señalaron que es importante mantener la salud del sistema bancario y financiero ...",09-10-2020 06:45,https://www.bing.com/th?id=OVFT._hP7KtOQMmIKCHdtMj-iiS,Chile,Proceso
Honduras destaca iniciativa “Honduras Start-Up” que promueve la innovación tecnológica,https://www.latribuna.hn/2020/10/09/honduras-destaca-iniciativa-honduras-start-up-que-promueve-la-innovacion-tecnologica/,"Añadió que Honduras, al igual que el resto de países del mundo, tuvo que reinventarse con la pandemia y enfocarse en la educación virtual. “Al inicio de la COVID-19, el Gobierno de Honduras a través de la Secretaría de Educación implementó una ...",09-10-2020 08:25,https://www.bing.com/th?id=OVFT.ZbasEcFOy-5Sr2Ua0fUkkC,Chile,La Tribuna
Primera Dama destaca iniciativa “Honduras Start-Up” que promueve la innovación tecnológica,https://ultimahora.hn/primera-dama-destaca-iniciativa-honduras-start-up-que-promueve-la-innovacion-tecnologica/,"La primera dama, Ana García de Hernández, participó este jueves junto a sus homólogas de Panamá, Argentina, Brasil y Paraguay en el foro virtual internacional de Educación “Steam Américas:",09-10-2020 14:10,https://www.bing.com/th?id=OVFT.AGIR3ZN9dWJ0RO7r807C-i,Chile,Ultima Hora
En 807 millones de lempiras inflaron hospitales móviles,https://www.elheraldo.hn/pais/1414207-466/en-807-millones-de-lempiras-inflaron-hospitales-m%C3%B3viles,Un análisis del Consejo Hondureño de la Empresa Privada (Cohep) muestra que cada unidad hospitalaria se adquirió tres veces más cara que el valor real,09-10-2020 14:57,https://www.bing.com/th?id=OVFT.Als2sStZAAYBHu8gbFiWli,Chile,El Heraldo
"Taiwán, un aliado estratégico de Honduras en tiempos difíciles",https://www.elheraldo.hn/pais/1414249-466/taiw%C3%A1n-un-aliado-estrat%C3%A9gico-de-honduras-en-tiempos-dif%C3%ADciles,"En el marco de la celebración del 109 aniversario de fundación, Taiwán reafirma su apoyo a Honduras a través de proyectos de cooperación en materia de salud, educación, agricultura y seguridad aliment",09-10-2020 14:57,https://www.bing.com/th?id=OVFT.8FN9tqn_IecK0ElNb-jdXC,Chile,El Heraldo
Equipos de Respuesta Rápida irán “casa por casa” en municipios más afectados por coronavirus,https://hondudiario.com/2020/10/09/equipos-de-respuesta-rapida-iran-casa-por-casa-en-municipios-mas-afectados-por-coronavirus/,"*** Se busca el fortalecimiento de los hospitales del país ante un eventual rebrote de coronavirus. La ministra de Salud, Alba Consuelo Flores, manifestó que los 400 nuevos Equipos de Respuesta Rápida",09-10-2020 15:49,https://www.bing.com/th?id=OVFT.8ZPHiS7IVusJhYCWD9VfkC,Chile,Hondudiario
Honduras reportará caída del 21% en las exportaciones a finales del 2020,https://hondudiario.com/2020/10/09/honduras-reportara-caida-del-21-en-las-exportaciones-a-finales-del-2020/,"El economista del Foro Social de la Deuda Externa y Desarrollo de Honduras (Fosdeh), Alejando Kafati, manifestó que a finales del 2020 el país reportará una caída de un 21 por ciento en las exportacio",09-10-2020 15:58,https://www.bing.com/th?id=OVFT.NrXW6idhUtQ1JKm6YIQ2pS,Chile,Hondudiario
7 departamentos de Honduras en nivel 5 de riesgo por rebrote de casos de coronavirus,https://www.radiohrn.hn/7-departamentos-de-honduras-en-nivel-5-de-riesgo-por-rebrote-de-casos-de-coronavirus,"De seguir con el mismo comportamiento entre dos a tres semanas se observará un incremento en episodios covid en otras regiones del país, advirtió, el doctor.",09-10-2020 15:59,https://www.bing.com/th?id=OVFT.Wnf9eCS4UxXZDEtntd2YkC,Chile,Radio HRN
Fabián Coito encantado de trabajar aislado: “Tener un lugar exclusivo es lo mejor y lo ideal para el jugador”,https://www.diez.hn/laseleccion/1414390-498/fabian-coito-encantado-trabajar-aislado-amistoso-honduras-nicaragua-comayagua,El entrenador de la Selección Nacional dice que no puede hablar mucho de Nicaragua porque la conoce poco; pero considera que se trabajó en la semana pensando a futuro,09-10-2020 20:58,https://www.bing.com/th?id=OVFT.jGXre3iGPXFFFcGyyfZoCy,Chile,diez.hn
Hasta el 2021 estarán ensamblados los hospitales móviles en Honduras,https://notibomba.com/hasta-el-2021-estaran-ensamblados-los-hospitales-moviles-en-honduras/,"El ministro de la presidencia del régimen orlandista, Ebal Díaz, consideró este viernes que los siete hospitales móviles adquiridos por 48 millones de dólares serán ensamblados hasta el 2021. Las decl",09-10-2020 21:12,https://www.bing.com/th?id=OVFT.i_oFmbNBrdQw8qMpiLuvoS,Chile,Noti Bomba
Chicha y Limón viernes 9 de octubre de 2020,http://www.eldiario.hn/chicha-y-limon-viernes-9-de-octubre-de-2020/,¡MES SOLIDARIO!!... Todos a unirnos a las actividades del mes donde se conmemora la lucha contra el cáncer de seno…La gente sigue “descosida” en la calle y esas cifras friolentas…Nuestros dilectos cum,10-10-2020 00:30,https://www.bing.com/th?id=OVFT.ozktti6Xy_itrk5h7TfVxy,Chile,El Diario
