name,url,description,datePublished,imagen,pais,Fuente
Muere enfermero hondureño por sospecha de COVID-19 en Tegucigalpa,https://www.laprensa.hn/honduras/1404505-410/muere-enfermero-hondureno-sospecha-covid-honduras-hondureno-coronavirus,"La Asociación Nacional de Enfermeras y Enfermeros Auxiliares de Honduras denuncia que el profesional de la salud tenía una enfermedad de base y aún así le exigió trabajar. Tegucigalpa, Honduras. Un en",28-08-2020 17:48,https://www.bing.com/th?id=ON.892E188498A7DF9FCA6F8E2B478E2C1D,Chile,La Prensa Chicos
BCIE dará a Centroamérica $350 millones para vacuna de COVID,https://www.proceso.hn/portadas/10-portada/bcie-dara-350-millones-de-dolares-a-centroamerica-para-vacuna-de-covid-19.html,San José - El Banco Centroamericano de Integración Económica (BCIE) anunció este viernes que apoyará a la región con 350 millones de dólares para adquirir de manera oportuna una vacuna contra la COVID,28-08-2020 18:11,https://www.bing.com/th?id=ON.CD417D21BB99FA637D0A3122CDD8FB8C,Chile,Proceso
A paro 150 empleados por contrato de hospital Gabriela Alvarado por falta de pago,https://proceso.hn/actualidad/7-actualidad/a-paro-150-empleados-por-contrato-de-hospital-gabriela-alvarado-por-falta-de-pago.html,"Danlí-El personal por contrato del hospital Gabriela Alvarado, localizado en Danlí, El Paraíso, oriente de Honduras, se declaró en huelga a partir de este viernes por falta de pago atrasados y la adju",28-08-2020 20:41,https://www.bing.com/th?id=ON.404BE8DD6CC18274E56BC20798D035CA,Chile,Proceso
"Honduras suma 59,645 casos de covid-19 y 1,842 muertos",https://www.elheraldo.hn/pais/1404806-466/casos-muertes-sinager-honduras-coronavirus,"TEGUCIGALPA, HONDURAS.-El Sistema Nacional de Gestión de Riesgos (Sinager) reportó este sábado que realizaron 1,524 pruebas en el territorio nacional y que 835 resultaron positivas. El número de infec",29-08-2020 00:00,https://www.bing.com/th?id=ON.1F0A982E0E19DF2A4F0428CA743CEF6C,Chile,El Heraldo
"Honduras registra 1,842 fallecimientos y 59,645 casos de coronavirus",https://www.laprensa.hn/honduras/1404615-410/honduras-registra-1842-fallecimientos-59645-casos-coronavirus,"Honduras registra hasta este sábado 1,842 muertes y 59,645 contagios de coronavirus, desde que a mediados de marzo fueron confirmados los primeros dos enfermos, informó el Sistema Nacional de Gestión",29-08-2020 00:00,https://www.bing.com/th?id=ON.8BFA0B961434A98DACFC63C17AF3A1DE,Chile,La Prensa Chicos
"Coronavirus en Honduras: Los contagios llegan a 59,645 y la cifra de muertos aumenta",https://www.diez.hn/coronavirus/1404826-441/oronavirus-honduras-actualizado-sinager-contagiados-muertos-covid-19,"Honduras sigue siendo uno de los países más golpeados por la pandemia del coronavirus, este día se reportaron 835 casos positivos luego de 1,524 pruebas realizadas en todo el país. Los departamentos q",29-08-2020 00:00,https://www.bing.com/th?id=ON.ADF96E6DD86B2671EADC2FB1DDC7E67B,Chile,diez.hn
Tres muertes bajo sospecha de COVID-19 reportan el IHSS y HE en la capital,https://www.latribuna.hn/2020/08/29/tres-muertes-bajo-sospecha-de-covid-19-reportan-el-ihss-y-he-en-la-capital/,Tres muertes bajo sospecha de COVID-19 fueron reportadas este sábado por el Hospital de Especialidades del Instituto Hondureño de Seguridad Social (IHSS) y el Hospital Escuela (HE) en la capital. Auto,29-08-2020 02:20,https://www.bing.com/th?id=ON.D4656AFECB34D104C7C537A165F96F9C,Chile,La Tribuna
"Coronavirus Honduras: Más de mil 100 contagiados en las últimas 24 horas y se superan los 1,800 fallecidos",https://www.diez.hn/coronavirus/1404652-441/coronavirus-honduras-mil-100-contagiados-en-las-ultimas-24-horas,"Las autoridades de Sinager reportaron 1750 pruebas realizadas de las cuales 1,141 dieron positivas en Honduras. La pandemia está en alza La curva del coronavirus en Honduras no se aplana, sigue en sub",29-08-2020 03:44,https://www.bing.com/th?id=ON.CF7567EEC0C17246B3C0828F42A21B63,Chile,diez.hn
Hospital móvil de San Pedro Sula ya está instalado en un 98 %,http://www.eldiario.hn/hospital-movil-de-san-pedro-sula-ya-esta-instalado-en-un-98/,"San Pedro Sula.- El hospital móvil de San Pedro Sula está instalado en un 98 % y apenas restan algunos detalles antes de entregarlo a la Secretaría de Salud, manifestó hoy viernes la representante de",29-08-2020 21:21,https://www.bing.com/th?id=ON.1D79D6F22629B27C5B5EC9DF54FFDFB2,Chile,El Diario
En 22 municipios de Honduras no se registra casos de covid,https://www.radiohrn.hn/en-22-municipios-de-honduras-no-se-registra-casos-de-covid,"Han pasado más de cinco meses que se reportó la primera persona con covid-19 en Honduras, pero un total de 22 municipios del país no registran casos. La jefa de Vigilancia Epidemiológica de la Secreta",29-08-2020 21:23,https://www.bing.com/th?id=ON.67E12072EE790328861D142C80EF3D6A,Chile,Radio HRN
"Honduras registra nuevo récord de contagios diarios con 1,141 positivos",https://hondudiario.com/2020/08/28/honduras-registra-nuevo-record-de-contagios-diarios-con-1141-positivos/,"El Sistema Nacional de Gestión de Riesgos (Sinager), informó este viernes que de 1,750 pruebas para diagnosticar Covid-19 en el país, 1,141 dieron positivo, sumando así un total de 58,810 casos de cor",30-08-2020 02:08,https://www.bing.com/th?id=ON.C1C1EACC1059E25893AF537B751A3666,Chile,Hondudiario
Honduras acogerá II Conferencia Internacional de Migración,https://www.latribuna.hn/2020/08/30/honduras-acogera-ii-conferencia-internacional-de-migracion/,"Honduras será el país anfitrión de la II Conferencia Internacional de Migración que el 1 y 2 de septiembre reunirá de forma virtual a las delegaciones oficiales de Norte, Centro y Suramérica, con el o",30-08-2020 10:36,https://www.bing.com/th?id=ON.434DE3B1262BE798204DDBCE02A22F00,Chile,La Tribuna
