name,url,description,datePublished,imagen,pais,Fuente
Honduras alcanza los 178 mil 277 contagios y 4 mil 334 fallecidos por COVID-19,https://proceso.hn/honduras-alcanza-los-178-mil-277-contagios-y-4-mil-334-fallecidos-por-covid-19/,"Respecto al estado de salud de mil 044 pacientes hospitalizados: 593 siguen estables, 389 en estado de gravedad y 62 continúan en las unidades de cuidados intensivos (UCI).",15-03-2021 02:48,https://www.bing.com/th?id=OVFT.lmqotRFR2h-nNmvSMyoq-i,Chile,Proceso
Estos 8 efectos secundarios provoca la vacuna de AstraZeneca que aplicará Honduras,https://www.radiohrn.hn/estos-8-efectos-secundarios-provoca-la-vacuna-de-astrazeneca-que-aplicara-honduras,"Conoce los efectos secundarios que provoca la dosis AstraZeneca, por los que muchos países han retirado su uso",15-03-2021 06:40,https://www.bing.com/th?id=OVFT.gtB1J6Zbp8Di8-GUJzDcIi,Chile,Radio HRN
Muere enfermera auxiliar por COVID-19 en el Instituto Nacional Cardiopulmonar,https://proceso.hn/muere-enfermera-auxiliar-por-covid-19-en-el-instituto-nacional-cardiopulmonar/,"La enfermera auxiliar Bertha Rodríguez falleció este lunes por causa de la COVID-19, en el Instituto Nacional Cardiopulmonar (INCP), más conocido como Hospital El Tórax, en esta capital.",15-03-2021 14:54,https://www.bing.com/th?id=OVFT.udQItlOO2TeLij1q-nZcUS,Chile,Proceso
POR COVID-19 MUERE ENFERMERA AUXILIAR EN EL INSTITUTO NACIONAL CARDIOPULMONAR,https://ultimahora.hn/por-covid-19-muere-enfermera-auxiliar-en-el-instituto-nacional-cardiopulmonar/,"En las últimas horas se dio a conocer la muerte de la enfermera auxiliar Bertha Rodríguez quien falleció este lunes por causa de la COVID-19, en el Instituto Nacional Cardiopulmonar (INCP), más",15-03-2021 14:59,https://www.bing.com/th?id=OVFT.lXJzeJq5ojrP-70I0UXpCi,Chile,Ultima Hora
Muere enfermera auxiliar por covid-19 en Tegucigalpa,https://www.laprensa.hn/honduras/1449994-410/muere-enfermera-auxiliar-covid-19-tegucigalpa,"Una víctima del gremio sanitario a causa del covid se registró este lunes, tras el fallecimiento de Berta Rodríguez, enfermera auxiliar que se desempeñaba en el hospital cardiopulmonar ""El Tórax"" en T",15-03-2021 15:11,https://www.bing.com/th?id=OVFT.HZAndU-Vs7nnEgxW9Q7R-C,Chile,La Prensa Chicos
En San Pedro Sula inicia la jornada de vacunas contra el Covid-19,https://www.vtv.com.hn/noticia/en-san-pedro-sula-inicia-la-jornada-de-vacunas-contra-el-covid-19/,"El viernes pasado, con 830 dosis de vacunas,  en San Pedro Sula, se inició la primera jornada de vacunación, con personal del sector sanitario que está trabajando con casos del Covid-19. La aplicación",15-03-2021 15:27,https://www.bing.com/th?id=OVFT.aWzQVghTUYx74rnMfiuh9i,Chile,VTV
Bryan Moya vuelve a la convocatoria de la Selección de Honduras para los juegos ante Bielorrusia y Grecia,https://www.diez.hn/laseleccion/1450002-498/bryan-moya-vuelve-seleccion-honduras-amistosos-bielorrusia-grecia-angola,El volante que milita en el fútbol de Angola es titular en el cuadro 1 de Agosto. Honduras jugará el 25 y 28 de marzo en Europa,15-03-2021 16:15,https://www.bing.com/th?id=OVFT.R3bbBrOPdi_FZ1TpOK88sy,Chile,diez.hn
Arranca la segunda jornada de vacunación contra la COVID-19 en Honduras,https://www.latribuna.hn/2021/03/15/arranca-la-segunda-jornada-de-vacunacion-contra-la-covid-19-en-honduras/,Autoridades de Salud Pública iniciaron este lunes la segunda jornada de vacunación contra la COVID-19 en Honduras. La ministra de,15-03-2021 17:23,https://www.bing.com/th?id=OVFT.CFEQ9isePrzWLqMsbi3IcC,Chile,La Tribuna
"Honduras acumula 4,334 muertos y 178,277 contagios por covid-19 en un año de pandemia",https://www.laprensa.hn/honduras/1449907-410/honduras-coronavirus-contagios-muertes-a%C3%B1o-pandemia,En el último reporte de las autoridades sanitarias hondureñas se registraron 415 nuevos casos y tres fallecimientos por coronavirus.,15-03-2021 17:52,https://www.bing.com/th?id=OVFT._NBrI8t3CjdDoi0t9CbI_S,Chile,La Prensa Chicos
Enfermera pierde la batalla contra la COVID-19 en la capital,https://www.latribuna.hn/2021/03/15/enfermera-pierde-la-batalla-contra-la-covid-19-en-la-capital/,"Una enfermera auxiliar más ha muerto en las últimas horas tras perder la batalla contra la COVID-19 en Tegucigalpa, capital",15-03-2021 17:59,https://www.bing.com/th?id=OVFT.W-4w2Sa2J879GOXuxGMzty,Chile,La Tribuna
Los futbolistas del Real Sociedad que han sido más afectados por el Covid-19; uno presenta daños en el pulmón,https://www.diez.hn/liganacionaldehonduras/1450072-498/dos-futbolistas-real-sociedad-golpeado-covid-19-wilmer-fuentes-wilson-urbina,"El dirigente Javier Martínez confirmó que ambos jugadores ya se están recuperando, pero que uno de ellos ha tenido problemas en sus pulmones",15-03-2021 18:16,https://www.bing.com/th?id=OVFT.dVcXD3dY3F7Q6cBzsT8Cjy,Chile,diez.hn
Honduras inicia segunda jornada de vacunación contra el coronavirus con 48 mil dosis,https://hondudiario.com/2021/03/15/este-lunes-comienza-segunda-jornada-de-vacunacion-contra-el-covid-19-al-personal-medico/,Honduras dio por iniciada este lunes la segunda campaña del Plan de Vacunación contra el Covid-19 con el objetivo de proteger el personal sanitario del país. La actividad se desarrolla en el Centro de,15-03-2021 19:27,https://www.bing.com/th?id=OVFT.YF5JYcmPKYhqUsdprMrIgS,Chile,Hondudiario
Hospital móvil de Tegucigalpa ya no será para atender pacientes COVID-19,https://tiempo.hn/hospital-movil-ya-no-atendera-pacientes-covid-19/,"El director del Hospital Escuela dijo que la compra de INVEST-H no funciona para enfermedades respiratorias. TEGUCIGALPA, HONDURAS. El hospital móvil de Tegucigalpa ya no será para atender a pacientes con COVID-19, confirmaron autoridades del Hospital ...",15-03-2021 21:06,https://www.bing.com/th?id=OVFT.OZrnNnSYHcomWRsPU5b15C,Chile,Tiempo
"1 de los 7 hospitales móviles en Honduras, ya no atenderá pacientes de Covid-19",https://www.vtv.com.hn/noticia/1-de-los-7-hospitales-moviles-en-honduras-ya-no-atendera-pacientes-de-covid-19/,"Según el director del primer centro asistencial del país Osmín Tovar, uno de los siete hospitales móviles de Honduras, para atender a pacientes que tienen Covid-19, ya no serán atendidos en el hospita",15-03-2021 22:04,https://www.bing.com/th?id=OVFT.OOY6OgryvCZUJtoNj9K6Ui,Chile,VTV
Sitramedhys: Más de 140 agremiados han muerto por COVID-19,https://tiempo.hn/sitramedhys-mas-140-agremiados-muerto-covid-19/,"Este 2021, las muertes en personal médico a causa de la COVID-19 se ha agudizado, según Sitramedhys. TEGUCIGALPA, HONDURAS.  La COVID-19 ha cobrado la vida de más de 140 agremiados del Sindicato de Tr",15-03-2021 22:34,https://www.bing.com/th?id=OVFT.RHGVV2V7mgqdHKaVqVIuKi,Chile,Tiempo
Microbiólogos serán incluidos en la segunda jornada de vacunación a partir de este jueves,https://hondudiario.com/2021/03/15/microbiologos-seran-incluidos-en-la-segunda-jornada-de-vacunacion-a-partir-de-este-jueves/,"El presidente de la Asociación de Microbiólogos de Honduras, Marco Moncada, manifestó que en esta segunda jornada de vacunación contra el Covid-19, los especialistas se tomaran en cuenta ya que son de primera línea en el combate contra la pandemia.",15-03-2021 23:36,https://www.bing.com/th?id=OVFT.UaMS1e6nsGf0nQ14uxexQy,Chile,Hondudiario
Personal del Centro de Salud Alonso Suazo trabajará con alivio y confianza tras recibir la vacuna anticovid,https://ultimahora.hn/personal-del-centro-de-salud-alonso-suazo-trabajara-con-alivio-y-confianza-tras-recibir-la-vacuna-anticovid/,"Médicos, enfermeras y otros miembros del personal agradecen al Gobierno del presidente Hernández por traer la vacuna. —- “Yo perdí a mi esposo hace 8 meses por el covid-19 y a mi pegó, pero",15-03-2021 23:49,https://www.bing.com/th?id=OVFT.wbHkzCaxPTvTDgRAru6Nui,Chile,Ultima Hora
