name,url,description,datePublished,imagen,pais,Fuente
Honduras cierra punto fronterizo con Guatemala después de un caso de COVID-19,https://www.laprensa.hn/honduras/1378648-410/honduras-cierra-punto-fronterizo-guatemala-despues-caso-covid19,"El Gobierno de Honduras informó este sábado del cierre temporal del punto El Florido, fronterizo con Guatemala, después de que un delegado de salud hondureño dio positivo a la prueba de coronavirus. """,09-05-2020 00:00,https://www.bing.com/th?id=ON.6E635533715B7AEFD31C3D391A5DF4CD,Chile,La Prensa Chicos
OPC en Puerto Cortés no reporta casos de COVID-19,https://www.laprensa.hn/honduras/1378634-410/opc-puerto-cortes-no-reporta-casos-covid19,La Operadora Portuaria Centroamericana (OPC) en Puerto Cortés informó este sábado que hasta el momento no se reportan casos positivos de coronavirus COVID-19 entre sus empleados. Mediante un comunicad,09-05-2020 00:00,https://www.bing.com/th?id=ON.BC21B37DCA7AF114CBFCE8012ECB1F8C,Chile,La Prensa Chicos
Pedro Atala: “No podemos seguir pagando salarios completos y el que no entienda no está en sus cinco sentidos”,https://www.diez.hn/liganacionaldehonduras/1378466-498/pedro-atala-no-podemos-seguir-pagando-salarios-completos-motagua-crisis,"El presidente vitalicio del Motagua, Pedro Atala, declaró que el Motagua lleva una pérdida de 6 a 7 millones de lempiras debido al coronavirus y anuncian medidas Es la primera vez que un directivo de",09-05-2020 00:43,https://www.bing.com/th?id=ON.E30F943A63156E0DAE58CC94F865F99D,Chile,diez.hn
BCIE aprueba $ 300 millones para apoyar la Mipyme hondureña afectada por COVID,https://proceso.hn/aldia/15-al-d%C3%ADa/bcie-aprueba-300-millones-para-apoyar-la-mipyme-hondurena-afectada-por-covid.html,"Tegucigalpa - El Banco Centroamericano de Integración Económica (BCIE), aprobó hoy un financiamiento por 300 millones dólares para el “Programa para la Reactivación Económica a través de la Micro, Peq",09-05-2020 04:48,https://www.bing.com/th?id=ON.BBE18E7D7AE649D2899A6AA1A12414C2,Chile,Proceso
Estas son las personas infectadas por COVID-19 en Honduras,https://www.latribuna.hn/2020/05/09/estas-son-las-personas-infectadas-por-covid-19-en-honduras-2/,"El Sistema de Nacional de Gestión de Riesgos (Sinager), en Cadena Nacional de Radio y Televisión confirmó el viernes 8 de mayo, 86 nuevos casos de COVID-19), y ya se contabilizan mil 771 (1,771) conta",09-05-2020 16:14,https://www.bing.com/th?id=ON.B4EDE6B887BEBBFF54347F2E876269E7,Chile,La Tribuna
Tres empleados de Aduanas dan positivo a la prueba de COVID-19,https://www.latribuna.hn/2020/05/09/tres-empleados-de-aduanas-dan-positivo-a-la-prueba-de-covid-19/,"Las autoridades de la Administración Aduanera de Honduras, confirmaron este sábado que tres de sus empleados dieron positivo a la prueba de COVID-19. En el comunicado explicaron que han procedido a lo",09-05-2020 17:21,https://www.bing.com/th?id=ON.AAF49C8C94A832450401D407A4D2A52E,Chile,La Tribuna
Mapas y gráficos: Así crecen los casos de coronavirus en Tegucigalpa,https://www.elheraldo.hn/interactivos/1378193-529/mapa-coronavirus-casos-tegucigalpa-honduras,"El primer infectado por coronavirus (Covid-19) en la capital y toda Honduras se confirmó el 11 de marzo de 2020 TEGUCIGAPA, HONDURAS.-El primer caso de coronavirus (Covid-19) en Honduras se oficializó",09-05-2020 19:22,https://www.bing.com/th?id=ON.BF980BE1D7B23FEFD371D42E802DC35E,Chile,El Heraldo
Se reporta el primer alcalde con coronavirus en Honduras,https://radiohrn.hn/se-reporta-el-primer-alcalde-con-coronavirus-en-honduras/,"Luis Guerra, es el primer alcalde con coronavirus en Honduras. En Honduras se contabilizan mil 771 (1,771) casos de coronavirus, de los cuales uno es el alcalde de Langue en el departamento de Valle,",09-05-2020 21:27,https://www.bing.com/th?id=ON.C81D6C7B1726547E93F5AEB9DB632E4A,Chile,Radio HRN
A revisión últimas estadísticas de COVID-19 en Honduras por repetición en casos de pacientes,https://www.proceso.hn/actualidad/7-actualidad/a-revision-ultimas-estadisticas-de-covid-19-en-honduras-por-similitud-en-casos-de-pacientes.html,"Tegucigalpa - Luego que se reportaran una serie de similitudes en los casos de pacientes positivos de COVID-19, las autoridades hondureñas informaron que las estadísticas sobre este tema están en revi",09-05-2020 22:50,https://www.bing.com/th?id=ON.3BD3C2592297C1506FEAEB9067D36E66,Chile,Proceso
Árbitro hondureño se dedica a la agricultura en tiempo de pandemia de coronavirus,https://www.diez.hn/liganacionaldehonduras/1378646-498/carlos-darinel-martinez-arbitro-hondureno-agricultura-pandemia-coronavirus,"Carlos Darinel Martínez ha dejado el pito y las tarjetas, ahora se está dedicando a la cosecha de piñas, frijoles, maíz y también a la pesca. Lo que bien se aprende nunca se olvida. Es lo que está pon",09-05-2020 23:19,https://www.bing.com/th?id=ON.BB8A1F74472FB32AD173C3447FF452EF,Chile,diez.hn
"Aplicar más pruebas, clave en lucha contra coronavirus en Honduras",https://www.elheraldo.hn/pais/1378689-466/aplicar-m%C3%A1s-pruebas-clave-en-lucha-contra-coronavirus-en-honduras,La falta de control del Covid-19 también se ha debido por la poca conciencia ciudadana y el incumplimiento de las medidas de bioseguridad a 56 días de haberse decretado la cuarentena en el país TEGUCI,10-05-2020 04:30,https://www.bing.com/th?id=ON.8256C07F6FBAF332A0121B6A1599E9C5,Chile,El Heraldo
Más de 120 mil episodios de agresiones en perjuicio de las mujeres se registran en Honduras,https://radiohrn.hn/mas-de-120-mil-episodios-de-agresiones-en-perjuicio-de-las-mujeres-se-registran-en-honduras/,"Las agresiones contra las mujeres en confinamiento. Foto Mans Unides. En los últimos seis años, se han reportado más de 120 mil episodios de agresiones en perjuicio de las mujeres, informó el domingo",10-05-2020 18:36,https://www.bing.com/th?id=ON.137DD5AAE6F1AEAC005060E6809B3DA1,Chile,Radio HRN
