name,url,description,datePublished,imagen,pais,Fuente
Primer clásico en plena pandemia,https://www.diariomas.hn/2020/09/27/primer-clasico-en-plena-pandemia/,La emoción del fútbol de la Liga Profesional de Honduras continúa esta noche con el primer clásico de la temporada en medio de la pandemia de la Covid,27-09-2020 15:01,https://www.bing.com/th?id=OVFT.owdRjxyRhmWBHmaOctHlxS,Chile,Mas
Cómo seguir la evolución de la COVID-19,http://www.eldiario.hn/como-seguir-la-evolucion-de-la-covid-19/,"Honduras. - Cuando alguien se infecta con el virus SARS-CoV-2 que causa la enfermedad del coronavirus COVID-19, puede sentirse de varias maneras distintas. Algunas personas están completamente asintom",07-10-2020 22:01,https://www.bing.com/th?id=OVFT.OJZHQL7EKwuWobsFcWTpSy,Chile,El Diario
Honduras continúa como el país de CA que menos pruebas COVID aplica,https://hondudiario.com/2020/10/07/honduras-continua-como-el-pais-en-ca-que-menos-pruebas-covid-aplica/,"***El panorama general del COVID-19 en Honduras al finalizar septiembre indicó que, solamente al 1.95% de la población se le han aplicado pruebas para detección del virus. Un grupo de investigadores a",07-10-2020 22:36,https://www.bing.com/th?id=OVFT.CjZ76OYohBFDsUM3m0stji,Chile,Hondudiario
Portería de Real Sociedad sufre revés tras tapadón de Willian Robledo ante Upnfm,https://www.diez.hn/liganacionaldehonduras/1413935-498/porteria-de-real-sociedad-sufre-reves-accidente-vs-upnfm-video,El tubo de soporte de la portería se terminó zafando. El árbitro se vio obligado a detener el encuentro durante al menos tres minutos hasta que lo restauraron.,08-10-2020 01:10,https://www.bing.com/th?id=OVFT.nzPT3vR7ZqTcc9Tt9rB1iS,Chile,diez.hn
Apoyan lucha contra COVID-19 en cinco municipios de Cortés,https://www.latribuna.hn/2020/10/07/apoyan-lucha-contra-covid-19-en-cinco-municipios-de-cortes/,"La Fundación de la Industria Azucarera (Funazúcar), el ingenio CAHSA y The Project CURE refuerzan la lucha contra el coronavirus en varios municipios de Cortés con insumos, equipo médico, camas especi",08-10-2020 02:07,https://www.bing.com/th?id=OVFT.uLlUxv4CjMyl0N0CX85-0S,Chile,La Tribuna
Partidos el fin de semana: Así se va a jugar la fecha 3 del torneo Apertura de la Liga Nacional,https://www.diez.hn/liganacionaldehonduras/1413971-498/jornada-tres-torneo-apertura-liga-nacional-partidos-olimpia-motagua-marathon,Tres partidos han sido programados para el sábado y dos se van a disputar el domingo en la tercera jornada de la Liga Nacional.,08-10-2020 03:13,https://www.bing.com/th?id=OVFT.iigYZ65yG5sJ45wkAYxe3C,Chile,diez.hn
HONDURAS / GOBIERNO APRUEBA 600 MILLONES TRAS REBROTE DE CASOS COVID,http://www.web.ellibertador.hn/index.php/noticias/nacionales/2314-honduras-gobierno-aprueba-600-millones-tras-rebrote-de-casos-covid,"Tegucigalpa. Continúan las medidas paliativas y no preventivas en el gobierno nombrado por Juan Hernández. Este 7 de octubre, la secretaria de Salud, la pedagoga Alba Consuelo Flores, ha informado que",08-10-2020 09:25,https://www.bing.com/th?id=OVFT.w6Kz6hv46z4wMavIC5Slpi,Chile,El Libertador
Exministra de Salud: Reinfección es más fuerte que el primer contagio,https://www.latribuna.hn/2020/10/08/exministra-de-salud-reinfeccion-es-mas-fuerte-que-el-primer-contagio/,"La exministra de Salud, Roxana Araujo, manifestó que la única manera de evitar una reinfección del COVID-19 es seguir con todas las medidas de bioseguridad. Está comprobado por PCR que varias personas",08-10-2020 10:16,https://www.bing.com/th?id=OVFT.hlyoyLsJhHCPY8ndM6hz4i,Chile,La Tribuna
Debaten polémica reforma para el sistema financiero hondureño,https://www.elheraldo.hn/economia/1413942-466/debaten-pol%C3%A9mica-reforma-para-el-sistema-financiero-hondure%C3%B1o,"Cohep pide al Congreso que la revisen TEGUCIGALPA, HONDURAS.- El gobierno de la República envió ... para pagar sus deudas al haber sido afectadas por la pandemia del covid-19. Sin embargo, la iniciativa dispara las alarmas, puesto que aunque genera ...",08-10-2020 13:47,https://www.bing.com/th?id=OVFT.EQbCcPAFD4zy4y5MB_hSvi,Chile,El Heraldo
Aumentan en 10 por ciento contagios de COVID-19 entre enfermeras auxiliares,https://proceso.hn/aumentan-en-10-por-ciento-contagios-de-covid-19-entre-enfermeras-auxiliares/,"Tegucigalpa – Luego que se había reportado un descenso en un 80 por ciento en el contagio de COVID-19 en el gremio de enfermeras y enfermeros en el país, en los últimos nueve días se registra un aumen",08-10-2020 15:00,https://www.bing.com/th?id=OVFT.2A8u2I1--As_8-X5-Q2FRC,Chile,Proceso
Salud estudia casos de posible reinfección de COVID-19 en Honduras,https://proceso.hn/salud-estudia-casos-de-posible-reinfeccion-de-covid-19-en-honduras/,"Tegucigalpa – Hasta el momento y después de siete meses de pandemia, no existe ningún caso de reinfección comprobado científicamente por COVID-19 en Honduras, pero se estudian varios, afirmaron este j",08-10-2020 15:58,https://www.bing.com/th?id=OVFT._ZDBTq7LwRUcerixXXMTgy,Chile,Proceso
Contagios de Covid-19 aumentan un 10% en enfermeras auxiliares,https://hondudiario.com/2020/10/08/contagios-de-covid-19-aumentan-un-10-en-enfermeras-auxiliares/,"El presidente de la Asociación Nacional de Enfermeras y Enfermeros Auxiliares de Honduras (ANEEAH), Josué Orellana, informó este martes que en los últimos nueve días se registra un aumento del 10 por",08-10-2020 16:11,https://www.bing.com/th?id=OVFT.qgTzEkaljlTTUX5X9bvD3i,Chile,Hondudiario
Casi 30 enfermeras y enfermeros resultan contagiados de covid-19 cada semana en Honduras,https://www.radiohrn.hn/casi-30-enfermeras-y-enfermeros-resultan-contagiados-de-covid-19-cada-semana-en-honduras,"Un total de 29 enfermeras y enfermeros se contagian de covid-19 cada semana en Honduras, mientras atienden a pacientes con el nuevo virus, según Josué Orellana, presidente de la Asociación de Enfermer",08-10-2020 17:15,https://www.bing.com/th?id=OVFT.6KmCg1uErWX-oBzmMUM69y,Chile,Radio HRN
Suman dos mil 411 contagios de Covid-19 en gremio de enfermeras: ANEEAH,https://ultimahora.hn/suman-dos-mil-411-contagios-de-covid-19-en-gremio-de-enfermeras-aneeah/,"En la última semana  se registra un aumento del 10 por ciento en los casos positivos, en el gremio de las enfermeras, así lo indicó a los periodistas el presidente de la Asociación Nacional de",08-10-2020 18:10,https://www.bing.com/th?id=OVFT.Jk18uDSR6LIgvp0GBS4s3y,Chile,Ultima Hora
Lanzan programa para hondureños en rehabilitación tras el COVID-19,https://www.laprensa.hn/honduras/1414107-410/atencion-gratis-post-covid-telemedicina-honduras-reactivate-especialistas-medicos,Especialistas en diferentes ramas ofrecen herramientas de manera gratuita a través del programa Honduras Reactívate. Lanzan programa para hondureños en rehabilitación tras el COVID-19 </,08-10-2020 20:40,https://www.bing.com/th?id=OVFT.4ZUC0oa2AjzJ4lOhrxl5KC,Chile,La Prensa Chicos
Siete casos de reinfección por covid-19 investigan médicos en el país y temen más,https://ultimahora.hn/siete-casos-de-reinfeccion-por-covid-19-investigan-medicos-en-el-pais-y-temen-mas/,"La pregunta de cuanto tiempo dura la inmunidad aun es un misterio para la ciencia en el virus Covid-19, lo cierto es que en Honduras ya se han reportado al menos siete casos de reinfección",08-10-2020 20:58,https://www.bing.com/th?id=OVFT.UJ6xxOPApGBf7EYEd0e-li,Chile,Ultima Hora
Conapid prepara instalaciones para reactivación en complejo deportivo,https://www.diariomas.hn/2020/10/08/conapid-prepara-instalaciones-para-reactivacion-en-complejo-deportivo/,"Poco a poco se va reactivando el deporte en Honduras y sobre todo en el complejo Deportivo Azcona Hoyo que mantiene la Conapid, ente que ha",08-10-2020 21:01,https://www.bing.com/th?id=OVFT.7A2d8DCDeWd8Jg0EgpLHoy,Chile,Mas
Honduras abre mañana las fronteras para que ingresen cortadores de café,https://www.laprensa.hn/honduras/1414137-410/honduras-abre-fronteras-cortadores-cafe-,"El representante de la Asociación Nacional de Empleados Públicos de Honduras (Andeph) en la mesa multisectorial, César Chirinos, informó que a partir de mañana se abren las fronteras para que ingresen",08-10-2020 22:35,https://www.bing.com/th?id=OVFT.nN8FyRbXdOcbMK0AxtTsWC,Chile,La Prensa Chicos
